,Description,Published,Meta_Url,Languages,Provider,Asset URL,Repository,Terms Of Service
0, Sammy is a framework on Javascript. It is 16K compressed and 5.2 compressed and gzipped. This framework is built on plugins and adapters. It aims to extract developers' code into reusable plugins.,11.13.2014,https://www.programmableweb.com/framework/sammy-framework,JavaScript,,http://sammyjs.org/docs,https://github.com/quirkey/sammy,
1," Can is a framework on Javascript. It aims to build applications that are flexible, powerful, and fast. It's flexible because developers can reuse templates. It's powerful because the framework contains 2 RESTful models. And it's fast because the responsive widgets can be learned in a day.",11.13.2014,https://www.programmableweb.com/framework/can-javascript-framework,JavaScript,,http://canjs.com/,https://github.com/bitovi/canjs/,
2," Backbone is a framework on Javascript. It connects events, collections, and functions to existent APIs over a RESTful JSON interface.",11.13.2014,https://www.programmableweb.com/framework/backbone-framework,JavaScript,,http://backbonejs.org/,https://github.com/jashkenas/backbone,
3," Written in Java and Android compatible, Licas allows you to build service-based networks. All of the main SOA features are included for distributed communications or architecture and additional packages allow for AI programming. Build lightweight networks of service-based components (SOA or Cloud). Programmable framework with many features - add/run services, add/search metadata, autonomous, agent-based, self-organizing and distributed communication. Java J2SE (1.5+) compatible. Communication includes XML-RPC, REST, HTTP and dynamic Web Services (SOAP). An 'All-in-One' GUI is a free tool, available from the DCS site and can be used to run all of the packages and separate modules. Alternatively, write programs using the stand-alone server, or by extending the open source classes. A p2p network can be setup requiring only the HTTP address and optional passwords. Example Apps are messenger, file sharing, web services, query. The code can also be used for more scientific programs. Sub-packages include text or query processing, or heuristic evaluation. A problem solver provides genetic algorithms and other AI algorithms, integrated into the whole system.",11.13.2014,https://www.programmableweb.com/framework/licas-framework,Java,,http://distributedcomputingsystems.co.uk/licas.html,https://sourceforge.net/projects/licas/,
4, PyGtalkRobot is a Google Talk bot framework written in Python. This framework requires the user to have either Python 2.4+ or ActivePython. Its dependencies are xmpppy and pydns.,11.13.2014,https://www.programmableweb.com/framework/pygtalkrobot-google-talk-python-framework,Python,Google,https://code.google.com/p/pygtalkrobot/,,
5, Derby.js is a framework designed for developers to create collaborative real time web applications. The MVC framework facilitates the creation of applications that serve in Node.js and the browser.,11.05.2014,https://www.programmableweb.com/framework/derby.js-framework,JavaScript,,http://derbyjs.org/,https://github.com/derbyjs/derby,
6," The Zendesk framework can be utilized to construct robust Zendesk-themed apps with the help of JavaScript APIs. Zendesk apps can enhance functionality such as ticket information, customer details, and time tracking.",10.17.2014,https://www.programmableweb.com/framework/zendesk-framework,JavaScript,Zendesk,https://developer.zendesk.com/apps/docs/agent/introduction,https://github.com/zendesk/demo_apps/tree/master/hello_world_sample_app,
7," Connect IQ a platform for third-party developers to create apps for Garmin products, and the Connect IQ SDK gives developers the tools to build these apps. With Connect IQ developers can customize the user experience with new faces, use the sensors to accumulate data and metrics, create widgets for instant information tidbits, and create fitness-reflated lifestyle web apps. A preview of the SDK is now available to start building apps for Garmin wearable devices. Devices that are compatible with Connect IQ will be available early 2015, but until then, the simulator included in the SDK will provide a testing platform for what is being built.",10.17.2014,https://www.programmableweb.com/framework/garmin-connect-iq-sdk,Unspecified,Garmin,http://developer.garmin.com/connect-iq/overview/,,
8," This Ruby on Rails gem allows developers to easily integrate Algolia into object relational mapping systems. The Algolia Search API can be implemented into web applications to reference a database to display a drop down of real time search results. The API supports quick faceted, full-text, and numerical search results.",10.13.2014,https://www.programmableweb.com/framework/algolia-rails-client,Ruby,,https://github.com/algolia/algoliasearch-rails#readme,,
9," Feed.Fm offers Unity SDK, a kit that wraps the REST API for the Unity environment. Developers can find a sample scene in the website to become aware of the functionality. In this case, the quickest way to understand how the kit works is to install the package and open the sample in Assets/FeedFm Demos/PlayerScene.unity. Additional to a sample scene, users can find guides related to the Player GUI that includes initialization, rendering, and caveats.",09.17.2014,https://www.programmableweb.com/framework/feed.fm-unity-sdk,C#,,http://developer.feed.fm/documentation,https://github.com/fuzz-radio/Unity-Native-SDK,
10," The Splunk developer platform consists of three primary components: Splunkd, the engine; Splunk Web, the app framework that sits on top of the engine; and the Splunk SDKs that interface with the REST API and extension points.The Splunk SDK for PHP lets developers target Splunkd by making calls against the engine's REST API and accessing the various Splunkd end points such as custom search commands, lookup functions, scripted inputs, and custom REST handlers.",09.17.2014,https://www.programmableweb.com/framework/splunk-php-sdk,PHP,Splunk,http://dev.splunk.com/view/php-sdk/SP-CAAAEJM,,
11," GuildWars2::API is a PERL library that provides a set of standard interfaces for interacting with the Guild Wars 2 API. This library was written in PERL 5.16.3, and users will need to have at least PERL 5.14.0.",09.07.2014,https://www.programmableweb.com/framework/guildwars2api,PERL,,https://github.com/dr-ishmael/GuildWars2-API,,
12," GW2API by Frugghi is an Objective-C framework for accessing the Guild Wars 2 API, especially for integration with iOS and OS X applications. The framework's prerequisites are OS X, iOS: 6.0+, and ARC.",09.06.2014,https://www.programmableweb.com/framework/gw2api-frugghi,Objective-C,,https://github.com/Frugghi/GW2API,,
13," Durmand Priory is a framework written in Objective-C for accessing the Guild Wars 2 API. All of the API's endpoints are included in the framework, but it's still a work in progress.",09.06.2014,https://www.programmableweb.com/framework/durmand-priory,Objective-C,,https://github.com/dannywartnaby/DurmandPriory,,
14," React is a JavaScript framework that helps developers build user interfaces. It can easily serve as the ""view"" element in a model-view-controller (MVC) stack since it makes no assumptions about the rest of the stack. The library is declarative, lightweight, efficient, and flexible.",09.05.2014,https://www.programmableweb.com/framework/react-javascript-framework,JavaScript,Facebook,http://facebook.github.io/react/index.html,https://github.com/facebook/react,
15," Ember-Runtime is a framework that provides core functions for Ember including cross-platform functions, and support for property observing and objects. It's focus is on small size and performance. It is intended to be used in place of or along-side other cross-platform libraries such as jQuery. The core Runtime framework is based on the jQuery API with a number of performance optimizations.",09.05.2014,https://www.programmableweb.com/framework/ember-javascript,JavaScript,Tilde,http://emberjs.com/,https://github.com/emberjs/ember.js,
16," Google provides AngularJS, a framework that can help developers to extend an application in HTML using Javascript objects. The site displays code with examples named basic html code, add some control, wire up backend, and create components. Such samples add js and css to the html to include style and functionality. In the main sites, users can view code on Githib and access the download file. To build an application using Angular, developers can practice in a browser at no cost.",09.05.2014,https://www.programmableweb.com/framework/angularjs,JavaScript,Google,https://angularjs.org/,,
17," Meteor is a service that allows users to build web applications. Some features of Meteor include application interoperability, data synchronization, and live page updates. The Meteor JavaScript Framework is an open source tool for developers to construct web apps purely using JavaScript.",09.05.2014,https://www.programmableweb.com/framework/meteor-javascript-framework,JavaScript,,https://www.meteor.com/,https://github.com/meteor/meteor,
18," Bottle is a Python Web Framework. With Bottle users can request calls, receive support for mako, jinja2 and cheetah templates. They can also access services to create data, upload files, cookies and headers. Bottle is built in HTTP and is supported with Google App Engine and WSGI servers.",08.27.2014,https://www.programmableweb.com/framework/bottle,Python,Independent Developer,http://bottlepy.org/docs/dev/index.html,https://pypi.python.org/pypi/bottle,
19," Tornado is a framework developed at FriendFeed, a feed created with friends' news, articles, photos and videos and shared in multiple collaborative sites. With Tornado, users can access applications, websockets, and long polling code. This service is optimum for consumers who require lasting connections. The framework serves also as an asynchronous networking library.",08.27.2014,https://www.programmableweb.com/framework/tornado,Python,FriendFeed,http://www.tornadoweb.org/en/stable/,https://github.com/tornadoweb/tornado,
20," Giotto is a framework based on the model, view and controllers (MVC) concept. Some of the characteristics of Giotto include a free RESTful interface, automatic URL routing, and Jinja2 for HTML templates with an API. This framework promotes functionality while the code for model, view, and controller is separated from an existing association.",08.27.2014,https://www.programmableweb.com/framework/giotto,Python,Independent Developer,http://giotto.readthedocs.org/en/latest/index.html,https://github.com/priestc/giotto,
21," The Nav SDK by Cloudmade is designed for developers to implement customizable tools into mobile devices for use in automobile navigation. Developed from the ground up, the Nav SDK supports multiple software platforms, compatible with Linux, QNX, Android, iOS, WinCE, and Windows Phone. The SDK is flexible enough to be implemented into various hardware platforms such as wearables, smartphone, and a car's dashboard control panel. Integrating 3rd party APIs for data sources is possible, and the SDK comes compatible with all major map providers. Some main features this hybrid offline/online SDK specializes in is route calculating, re-routing, voice control, and displaying traffic data.",08.21.2014,https://www.programmableweb.com/framework/cloudmade-nav-sdk,"Java, Objective-C",CloudMade,http://cloudmade.com/solutions/navigation-guidance,,
22," easyXDM is a JavaScript framework that enables easy cross-domain messaging and JavaScript API exposure. It is a nearly independent framework written with light and flexible code. The framework allows the ability to transfer strings between two windows, termed a 'provider' and a 'consumer.' easyXDM works well with low latency on the following browsers: IE, Opera, Firefox, Safari, and Chrome.",08.20.2014,https://www.programmableweb.com/framework/easyxdm-framework,JavaScript,Independent Developer,http://easyxdm.net/wp/,https://github.com/oyvindkinsey/easyXDM,
23," Grape is a RESTful micro-framework that allows developers to build simple APIs in Ruby. With built in support for conventions and versioning, it's simplicity makes it an alternative to using a large framework such as Rails. Grape is designed with DSL to compliment existing web applications with an easy to implement API.",08.18.2014,https://www.programmableweb.com/framework/grape,Ruby,,http://intridea.github.io/grape/,,
24, Zillow API in Cake allows developers to access the Zillow API using the CakePHP development framework. This framework is designed to help PHP users of all skill levels quickly develop applications.,08.11.2014,https://www.programmableweb.com/framework/zillow-api-cake,PHP,Zillow,https://github.com/brij420/Zillow-API-in-Cake,,
25," restify is a small framework that borrows from express, used to build RESTful web services in Node.js. It provides out of the box support for features used to build such services such as versioning, error handling, content negotiation and CORS.",07.31.2014,https://www.programmableweb.com/framework/restify,Node.js,,http://mcavage.me/node-restify/,https://github.com/mcavage/node-restify,
26," Express is a minimal node.js web application framework. It offers developers a full set of features for building single, multi-page, and hybrid web applications. Express is styled after Sinatra.",07.30.2014,https://www.programmableweb.com/framework/express,Node.js,,http://expressjs.com/,https://github.com/strongloop/express,
