,Url,Description,Topics,Stars
0,https://github.com/minimaxir/big-list-of-naughty-strings.git,The Big List of Naughty Strings is a list of strings which have a high probability of causing issues when used as user-input data.,,40376
1,https://github.com/donnemartin/data-science-ipython-notebooks.git,"Data science Python notebooks: Deep learning (TensorFlow, Theano, Caffe, Keras), scikit-learn, Kaggle, big data (Spark, Hadoop MapReduce, HDFS), matplotlib, pandas, NumPy, SciPy, Python essentials, AWS, and various command lines.","python,machine-learning,deep-learning,data-science,big-data,aws,tensorflow,theano,caffe,scikit-learn,kaggle,spark,mapreduce,hadoop,matplotlib,pandas,numpy,scipy,keras",21058
2,https://github.com/ClickHouse/ClickHouse.git,ClickHouse® is a free analytics DBMS for big data,"dbms,olap,analytics,sql,distributed-database,big-data,mpp,clickhouse,hacktoberfest",15839
3,https://github.com/taosdata/TDengine.git,An open-source big data platform designed and optimized for the Internet of Things (IoT).,"iot,bigdata,time-series,database,industrial-iot,connected-vehicles,full-stack,monitoring",14845
4,https://github.com/prestodb/presto.git,The official home of the Presto distributed SQL query engine for big data,"java,presto,hive,hadoop,big-data,sql",11988
5,https://github.com/0xnr/awesome-bigdata.git,"A curated list of awesome big data frameworks, ressources and other awesomeness.","awesome,bigdata,data-warehouse,data-analytics,data-visualization,data-stream,database,data-science,data,awesome-list,distributed-database,series-database,stream-processing,streaming-data,visualize-data",9913
6,https://github.com/vaexio/vaex.git,"Out-of-Core hybrid Apache Arrow/NumPy DataFrame for Python, ML, visualize and explore big tabular data at a billion rows per second 🚀","dataframe,python,bigdata,tabular-data,visualization,memory-mapped-file,hdf5,machine-learning,machinelearning",6096
7,https://github.com/allegro/bigcache.git,Efficient cache for gigabytes of data written in Go.,"cache,performance,caching,golang-library,hacktoberfest",4816
8,https://github.com/vespa-engine/vespa.git,The open big data serving engine. https://vespa.ai,"vespa,search-engine,big-data,ai,serving,serving-recommendation,machine-learning,server,tensorflow,java,cpp",3536
9,https://github.com/trinodb/trino.git,"Official repository of Trino, the distributed SQL query engine for big data, formerly known as PrestoSQL (https://trino.io)","java,presto,hive,hadoop,big-data,sql,prestodb,database,databases,distributed-systems,distributed-database,distributed-databases,data-science,datalake,jdbc,query-engine,trino,analytics",3272
10,https://github.com/delta-io/delta.git,"An open-source storage layer that brings scalable, ACID transactions to Apache Spark™ and big data workloads.","spark,acid,big-data,analytics",3272
11,https://github.com/yyhsong/iDataV.git,大屏数据可视化 Big screen data visualization demo,"data-visualization,large-screen-data-visualization,datav,sugar,echarts,antv",3021
12,https://github.com/blaze/blaze.git,NumPy and Pandas interface to Big Data,,2950
13,https://github.com/tangbc/vue-virtual-scroll-list.git,⚡️A vue component support big amount data list with high render performance  and efficient.,"virtual-list,big-data,infinite-scroll",2779
14,https://github.com/facebookresearch/PyTorch-BigGraph.git,Generate embeddings from large-scale graph-structured data.,,2760
15,https://github.com/opendatav/datav.git,"📊 Beautiful and interactive data visualization platform, visualize metrics,logs,traces and big-screens","metrics,logging,data-visualization,typescript,big-screen,go,observability,opentelemetry,datav,dataviz,echarts,react,data-analysis",2589
16,https://github.com/Tencent/TubeMQ.git,TubeMQ focuses on high-performance storage and transmission of massive data in big data scenarios,,2025
17,https://github.com/apache/hudi.git,"Upserts, Deletes And Incremental Processing on Big Data.","hudi,apachehudi,datalake,bigdata,apachespark,incremental-processing,stream-processing,data-integration,apacheflink",1912
18,https://github.com/apache/gobblin.git,"A distributed data integration framework that simplifies common aspects of big data integration such as data ingestion, replication, organization and lifecycle management for both streaming and batch data ecosystems.","data,ingestion,replication,management,apache",1908
19,https://github.com/Netflix/genie.git,Distributed Big Data Orchestration Service,"big-data,bigdata,orchestration,configuration,configuration-management,java,spring-boot,distributed-systems,netflixoss,cloud,netflix-oss,microservice,microservices",1487
20,https://github.com/griddb/griddb.git,"GridDB is a next-generation open source database that makes time series IoT and big data fast,and easy.","database,griddb,nosql,iot,fast,time-series,newsql,sql,bigdata,timeseries",1450
21,https://github.com/root-project/root.git,"The official repository for ROOT: analyzing, storing and visualizing big data, scientifically","data-analysis,root-cern,root,c-plus-plus,python,physics,statistics,mathematics,machine-learning,interpreter,cling,graphics,visualization,geometry,parallel",1426
22,https://github.com/jadianes/spark-py-notebooks.git,Apache Spark & Python (pySpark) tutorials for Big Data Analysis and Machine Learning as IPython / Jupyter notebooks,"spark,python,pyspark,data-analysis,mllib,ipython-notebook,notebook,ipython,data-science,machine-learning,big-data,bigdata",1360
23,https://github.com/allwefantasy/mlsql.git,The Programming Language Designed For Big Data and AI,"machine-learning,mlsql,bigdata,sql-like-dsl",1278
24,https://github.com/Intel-bigdata/HiBench.git,HiBench is a big data benchmark suite.,,1150
25,https://github.com/TheEconomist/big-mac-data.git,Data and methodology for the Big Mac index,,1120
26,https://github.com/baidu/bigflow.git,"Baidu Bigflow is an interface that allows for writing distributed computing programs and provides lots of simple, flexible, powerful APIs. Using Bigflow, you can easily handle data of any scale. Bigflow processes 4P+ data inside Baidu and runs about 10k jobs every day.",,1093
27,https://github.com/locationtech/geomesa.git,GeoMesa is a suite of tools for working with big geo-spatial data in a distributed fashion.,,1078
28,https://github.com/googledatalab/datalab.git,Interactive tools and developer experiences for Big Data on Google Cloud Platform.,,955
29,https://github.com/Teradata/kylo.git,"Kylo is a data lake management software platform and framework for enabling scalable enterprise-class data lakes on big data technologies such as Teradata, Apache Spark and/or  Hadoop. Kylo is licensed under Apache 2.0. Contributed by Teradata Inc.","spark,nifi,kylo,data-lake,teradata,hadoop",931
30,https://github.com/pinterest/querybook.git,"Querybook is a Big Data Querying UI, combining collocated table metadata and a simple notebook interface.",,836
31,https://github.com/sitewhere/sitewhere.git,"SiteWhere is an industrial strength open-source application enablement platform for the Internet of Things (IoT). It provides a multi-tenant microservice-based infrastructure that includes device/asset management, data ingestion, big-data storage, and integration through a modern, scalable architecture.  SiteWhere provides REST APIs for all system functionality.  SiteWhere provides SDKs for many common device platforms including Android, iOS, Arduino, and any Java-capable platform such as Raspberry Pi rapidly accelerating the speed of innovation.","sitewhere,internet-of-things,integration,device-management,iot,iot-platform,platform,mqtt,iot-framework,java,arduino,raspberry-pi,android,open-source,aws,kafka,zookeeper,microservices,kubernetes,helm",809
32,https://github.com/pcbje/ggraph.git,Graph visualization of big messy data,"graph-visualization,messy-data",774
33,https://github.com/GraphChi/graphchi-cpp.git,"{""GraphChi's C++ version.  Big Data - small machine.""}",,750
34,https://github.com/gearpump/gearpump.git,Lightweight real-time big data streaming engine over Akka,"akka,stream-processing,bigdata,scala",748
35,https://github.com/hadoopecosystemtable/hadoopecosystemtable.github.io.git,"This page is a summary to keep the track of Hadoop related projects, and relevant projects around Big Data scene focused on the open source, free software environment.",,666
36,https://github.com/uwdata/falcon.git,Brushing and linking for big data,,656
37,https://github.com/firmai/data-science-career.git,"Career Resources for Data Science, Machine Learning, Big Data and Business Analytics Career Repository","data-science,analytics,career,machine-learning,resources,big-data,business-analytics,business-intelligence",641
38,https://github.com/Palleas/NaughtyKeyboard.git,The Big List of Naughty Strings is a list of strings which have a high probability of causing issues when used as user-input data. This is a keyboard to help you test your app from your iOS device.,,590
39,https://github.com/bignerdranch/CoreDataStack.git,The Big Nerd Ranch Core Data Stack,,561
40,https://github.com/tensorbase/tensorbase.git,TensorBase is a new big data warehousing with modern efforts.,"rust,bigdata,database,analytics,modern,infrastructure,data,data-infrastructure,high-performance,engineering,rust-lang,warehouse,data-warehouse",547
41,https://github.com/thrill/thrill.git,Thrill - An EXPERIMENTAL Algorithmic Distributed Big Data Batch Processing Framework in C++,"thrill,big-data,c-plus-plus,distributed-computing",530
