,Url,Description,Topics,Stars
0,https://github.com/OmneyaOsman/Movie-Zone.git,movies application using MVVM Architecture,"mvvm-architecture,kotlin-android,retrofit2,retrofit2-rxjava2,livedata,viewmodel,clean-architecture,repository-pattern",25
0,https://github.com/bapspatil/FlickOff.git,"A lite movie guide app, with MVVM architecture, that lets you discover movies from TMDb. ","tmdb,android,udacity,nanodegree,android-architecture-components,dagger2,rxjava,anko,karamba,firebase,retrofit,glide,gson,recyclerview-animators,floatingsearchview,databinding",25
0,https://github.com/GerardPaligot/discovering-movies.git,Kotlin Multiplatform Project about movies.,"multiplatform,kotlin,kmp,movie,android,desktop",25
0,https://github.com/danieladov/jellyfin-plugin-mergeversions.git,This plugin scans all your movies and groups every repeated movie in one version,"jellyfin,plugin",25
0,https://github.com/yehiahd/Movies.git,"An Android application that retrieved informations about movies using movie db API. The app is created just for testing, applying new Android Technologies",,25
0,https://github.com/debajyotibasak/UdacityPopularMovies.git,"An Android app, that helps you browse most popular and most rated movies. This project is created for Udacity Android Developer Nanodegree.","udacity,udacity-android-nanodegree,popular-movies,android-architecture-components,room,dagger2,retrofit2",25
0,https://github.com/ivan-magda/UpcomingMovies.git,"tvOS example app, shows upcoming movies","tvos,tmdb-api",24
0,https://github.com/Thomas-George-T/Movies-Analytics-in-Spark-and-Scala.git,"Data cleaning, pre-processing, and Analytics on a million movies using Spark and Scala.","spark,spark-sql,rdd,shell-script,big-data,dataframes,movielens-data-analysis,big-data-analytics,big-data-projects,spark-programs,scala,movielens-dataset,analytics,case-study,spark-dataframes,spark-rdd,hadoop,spark-scala,movies",24
0,https://github.com/wahyouwebid/MovieQ.git,"Android Movies build with Component Architechtures, Jetpack Pagination, Room, RxJava, Coroutines, Hilt",,24
0,https://github.com/iOSDevTraining/books-and-movies.git,"A simple app that pulls books (and movies) from a JSON feed, lists them in a table view, and shows detail about them.",,24
0,https://github.com/divijbindlish/movienamer.git,Command-line utility to properly name movies,,23
0,https://github.com/Trekky12/kburns-slideshow.git,generate slideshow movies with Ken Burns effect on images,"ken-burns,ffmpeg,video,image,slideshow,zoom-pan,kburns-slideshow",23
0,https://github.com/lbroudoux/chuck-norris-streams.git,"Kafka, Debezium and Fuse demonstration based on Chuck Norris movies!","debezium,kafka,kafka-streams,openshift,syndesis,quarkus",23
0,https://github.com/fvdm/nodejs-searchitunes.git,"{""Lightweight node.js module to quickly search Apple's iTunes Store for music, movies, apps, etc.""}","music,apple-itunes-store,appstore,api-client,nodejs,movies,apps,unlicense",23
0,https://github.com/bapspatil/SilverScreener.git,"A feature-rich movie guide app, that lets you discover movies from TMDb.","tmdb,firebase,retrofit,glide,cookiebar,gson,butterknife,recyclerview-animators,android-expandabletextview,floatingsearchview,realm,android,udacity,nanodegree",23
0,https://github.com/koutilya-pnvr/BiConvLSTM_Violence_Detection.git,"This Pytorch repo uses BiConvLSTM in a Spatiotemporal Encoder to detect violence in Videos. Three benchmark datasets namely Hockey, Movies and Violent Flows were used in this work. ",,23
0,https://github.com/IRFAN-GujjAR/tmdb.git,"TMDb is a cross-platform mobile application developed using flutter framework that uses https://www.themoviedb.org API to fetch Movies, Tv Shows, Celebrities etc information.",,23
0,https://github.com/aramk/IMDb-Scraper.git,"Scrapes information about movies and TV shows from IMDb (imdb.com). Built in PHP, one line to use, can write to CSV.",,23
0,https://github.com/entdark/q3mme.git,"{""Quake 3 Movie Maker's Edition is a special version of Quake 3 engine that aids the creation of game movies, making it possible to simplify required tasks and adds new features to the engine that are related to the movie making.""}",,23
0,https://github.com/avraham/hass_radarr_sonarr_search_by_voice.git,Add movies to radarr by voice,,22
0,https://github.com/kiahamedi/zirnevis.git,download subtitle only with movies name,,22
0,https://github.com/5-star/plugin.video.last_played.git,"List of the last movies, episodes and music played, including streaming sources from any addon",,22
0,https://github.com/damienlangg/SimpleMovieCatalog.git,"Simple Movie Catalog will scan a given directory for movies, query imdb for info and generate a catalog as a html page which offers sorting, filtering and grouping of found movies by different criteria.",,22
0,https://github.com/michaelx/media-tracker.git,"Self-hosted open source media-tracker for tv shows and movies. (React, Redux)","react,redux,tv-shows,tv-series,movies,tracking",22
0,https://github.com/StepfenShawn/cf-lang.git,The CF programming language. A programming language inspired by some war movies! 💣💣,"python,python3,cf-lang,programming-language,compiler,interpreter,new-language",22
0,https://github.com/leodeleon22/PopularMovies.git,Discover the most popular movies playing with this Android App,"mvvm,mvvm-architecture,mvvm-pattern,mvvm-sample,mvvm-android,room,livedata,android-architecture-components,dagger2,dagger2-android,rxjava2,rxjava2-retrofit2,rxbinding,gradle,kotlin,kotlin-android,kotlin-android-extensions",22
0,https://github.com/mainframed/hacker_scenes.git,Scenes from movies re-imagined as though there were in the terminal,,22
0,https://github.com/kerolloz/MoviezApp.git,Simple iOS application that provides you with the latest movies in cinema.,"ios-app,ios,ios11,objective-c,movies,movie,movies-api,moviedb-api,movie-database",22
0,https://github.com/skepticli/tutorial-screencast-to-gif.git,Convert screencasts (or other digital movies) into portable animated GIFs using nothing but the command-line,,22
0,https://github.com/ziacik/lumus.git,"Search for movies, shows and music and add them automatically to Transmission when they appear on torrents. Lightweight all-in-one alternative to SickBeard, CouchPotato and Headphones. Integration with Kodi.",,22
0,https://github.com/melihbodr/Bitcoin_Analysis-.git,"Python  Bitcoin is widely used cryptocurrency for digital market. It is decentralised that means it is not own by government or any other company.Transactions are simple and easy as it doesn’t belong to any country.Records data are stored in Blockchain.Bitcoin price is variable and it is widely used so it is important to predict the price of it for making any investment.This project focuses on the accurate prediction of cryptocurrencies price using neural networks. We’re implementing a Long Short Term Memory (LSTM) model using keras; it’s a particular type of deep learning model that is well suited to time series data (or any data with temporal/spatial/structural order e.g. movies, sentences, etc.).We have used different activation function for analysing the efficiency of the system.Instead of historical data we are using live streaming data for better accuracy.","blockchain,analysis,bitcoin,financial-analysis,python,data-analysis,data-science,tachnical-analysis,trading,bitcoin-price,bitcoin-price-prediction",22
