,Url,Description,Topics,Stars
0,https://github.com/brillout/awesome-angular-components.git,Catalog of Angular 2+ Components & Libraries,"devarchy,angular2-component,angular-library,angular2-directive,angular2-modal,angular2-toaster,angular2-components,angular-components,angular-component,angular2-library,ng2",3176
1,https://github.com/ckan/ckan.git,"CKAN is an open-source DMS (data management system) for powering data hubs and data portals. CKAN makes it easy to publish, share and use data. It powers catalog.data.gov, open.canada.ca/data, data.humdata.org among many other sites.","python,open-data,data,catalog,api,ckan,ckanext",2966
2,https://github.com/lewis617/react-redux-tutorial.git,"react-redux-tutorial in Chinese, catalog && code examples",,2270
3,https://github.com/datopian/portal.js.git,🌀 The Javacript framework for creating a portal to your data. Perfect for a single dataset or a full catalog.,"data-portal,data-portals,ckan,data-portal-frontends,data-presentation",1977
4,https://github.com/jondot/blade.git,"Better asset workflow for iOS developers. Generate Xcode image catalogs for iOS / OSX app icons, universal images, and more.",,829
5,https://github.com/chec/commercejs-nextjs-demo-store.git,"Commerce demo store built for the Jamstack. Built with Commerce.js, Next.js, and can be one-click deployed to Netlify. Includes product catalog, categories, variants, cart, checkout, payments (Stripe) order confirmation, and printable receipts.","headless,nextjs,netlify,commercejs,chec,ecommerce,open-source,one-click-deploy,serverless,jamstack,hacktoberfest,commerce",768
6,https://github.com/raphaelhanneken/iconizer.git,"Create Xcode asset catalogs swift and painless. Generate images for macOS and iOS app icons, launch images and image sets.","generator,icns,icons,xcode,assets,swift,generate,xcassets,appicon,ios,launchimage,icon",767
7,https://github.com/Eli-Fox/LEGO-Catalog.git,A LEGO® Catalog app illustrating current Android Architecture state using Android development best practices.,,735
8,https://github.com/awslabs/aws-api-gateway-developer-portal.git,A Serverless Developer Portal for easily publishing and cataloging APIs,,694
9,https://github.com/radiantearth/stac-spec.git,SpatioTemporal Asset Catalog specification - making geospatial assets openly searchable and crawlable,"satellites,satellite-imagery,earth-observation,earth-observation-catalogue",434
10,https://github.com/yogthos/clojure-error-message-catalog.git,a catalog of common Clojure errors and their meaning,,415
11,https://github.com/JustOff/ca-archive.git,Catalog of classic Firefox add-ons created before WebExtensions apocalypse,"extensions,firefox,amo,mozilla,xul,xpcom,addons,pale-moon,palemoon,waterfox,seamonkey",390
12,https://github.com/rancher/community-catalog.git,Catalog entries contributed by the community,,388
13,https://github.com/monitoringsucks/metrics-catalog.git,Catalog of valuable metrics you might want to collect,,340
14,https://github.com/brillout/awesome-redux.git,Catalog of Redux Libraries & Learning Material,"devarchy,redux",339
15,https://github.com/eleybourn/Book-Catalogue.git,A book cataloging tool for Android phones. ,,336
16,https://github.com/tektoncd/catalog.git,Catalog of shared Tasks and Pipelines.,"tekton,pipeline,task,catalog,re-useable",333
17,https://github.com/IFTTT/IFTTTLaunchImage.git,Put your asset catalog launch images to work for you.,,309
18,https://github.com/szastupov/musicbot.git,Telegram Music Catalog Bot,"telegram-bot,python,mongo,bot,music",281
19,https://github.com/aws-samples/aws-service-catalog-reference-architectures.git,Sample CloudFormation templates and architecture for AWS Service Catalog,"cloudformation,servicecatalog,devops,management-tools",264
20,https://github.com/AI4Bharat/indicnlp_catalog.git,A collaborative catalog of resources for Indian language NLP,"indian-languages,corpora,libraries,models,awesome-list",247
21,https://github.com/foliojs/font-manager.git,A C++ module for Node.js providing access to the system font catalog.,,245
22,https://github.com/andreyvit/ScrollingMadness.git,A catalog of UIScrollView samples (iPhone),,244
23,https://github.com/OpusCapita/react-showroom-client.git,Catalog of React based components with versioning and realtime props editing support,"react,showroom,javascript,sandbox-playground",237
24,https://github.com/GeertWille/sketch-to-xcode-assets-catalog.git,Export assets for iOS directly from Sketch into Xcodes assets catalog,,224
25,https://github.com/foodcoops/foodsoft.git,"Web-based software to manage a non-profit food coop (product catalog, ordering, accounting, job scheduling).","food-cooperative,foodcoop,food,cooperative,product-catalog,membership,foodsoft",223
26,https://github.com/azavea/Open-Data-Catalog.git,"Open Data Catalog is an open data catalog based on Django, Python and PostgreSQL.  It was originally developed for OpenDataPhilly.org, a portal that provides access to open data sets, applications, and APIs related to the Philadelphia region. The Open Data Catalog is a generalized version of the original source code with a simple skin.  It is intended to display information and links to publicly available data in an easily searchable format. The code also includes options for data owners to submit data for consideration and for registered public users to nominate a type of data they would like to see openly available to the public.",,221
27,https://github.com/github/octocatalog-diff.git,"Compile Puppet catalogs from 2 branches, versions, etc., and compare them",puppet,219
28,https://github.com/nasa/code-nasa-gov.git,"code.nasa.gov site leveraging the Open Source Catalog on github.com, powered by Polymer",,214
29,https://github.com/nasa/Open-Source-Catalog.git,Contains the NASA open source software catalog for automatic deployment to code.nasa.gov,"open-source,website,nasa,catalog,meta-record,ai-tags",212
30,https://github.com/magda-io/magda.git,"A federated, open-source data catalog for all your big data and small data","open-data,scala,nodejs,kubernetes,elasticsearch,postgresql",212
31,https://github.com/4m4n5/fifa18-all-player-statistics.git,A complete catalog of all the players in Fifa 18 and their complete statistics.,"video-game,fifa,fifa18,dataset",186
32,https://github.com/koreader/kpvbooklet.git,KPVBooklet is a Kindle booklet for starting koreader/kindlepdfviewer and updating last access and percentage finished information in Kindle content catalog entry of the opened document.,"kindle,java,koreader",183
33,https://github.com/swri-robotics/bag-database.git,A server that catalogs bag files and provides a web-based UI for accessing them.,"bag-files,bag-database,metadata,ros,docker",180
34,https://github.com/AppImage/appimage.github.io.git,"Given an URL to an AppImage, AppImageHub inspects the AppImage and puts it into a community-maintained catalog","appimage,catalog,hacktoberfest",173
35,https://github.com/fnplus/community-project-ideas.git,Catalog of all the ideas/tutorials for project based learning!,"community,project-ideas,catalog",172
36,https://github.com/face/activity_streams.git,ActivityStreams is a Rails Plug-in providing a customizable framework for cataloging and publishing user activity and social objects.,,172
37,https://github.com/yep/app-downloader.git,Easily search for macOS apps from the `homebrew cask` app catalog.,"macos,osx,homebrew,homebrew-cask,macos-apps",169
38,https://github.com/david-legend/login_catalog.git,A catalog of beautiful login UI,,166
39,https://github.com/googlearchive/polymer-element-catalog.git,A catalog of Polymer-based web components built by the Polymer team,,166
40,https://github.com/elm/error-message-catalog.git,A catalog of broken Elm programs / data to improve error messages,elm,163
41,https://github.com/mitshel/sopds.git,Simple opds catalog,,154
42,https://github.com/robotsu/Flying-Swift.git,"{""A Free Swift simple project for fun, with Apple's UIKit Dynamic Catalogs Migration and blog reader etc. interesting functions.""}",,154
43,https://github.com/TerriaJS/TerriaMap.git,Catalog-based web geospatial visualisation platform.,,151
44,https://github.com/mattmurray/juno_crawler.git,Scrapy crawler to collect data on the back catalog of songs listed for sale.,"scrapy,python,web-scraping",150
45,https://github.com/Vinai/groupscatalog2.git,Magento extension to enable you to hide categories and products from customers depending on their customer group. This is a Magento 1.6 and newer compatible version of the Netzarbeiter Customer Groups Catalog extension.,,143
46,https://github.com/anirudhjayaraman/Machine-Learning.git,"{""Repo cataloging my coursework for Andrew Ng's ML MOOC""}",,139
47,https://github.com/ortelius/ortelius.git,"Ortelius simplifies the implementation of microservices.  By providing a central catalog of services with their deployment specs, application teams can easily consume and deploy services across cluster. Ortelius tracks application versions based on service updates and maps their service dependencies eliminating confusion and guess work. ","hacktoberfest,hacktoberfest2020",138
48,https://github.com/rancher/catalog-dockerfiles.git,Dockerfiles for Rancher Catalog containers,,130
49,https://github.com/rubytoolbox/catalog.git,"{""The Ruby Toolbox library catalog. If you'd like to contribute to the categorizations of Ruby open source projects on the Ruby Toolbox this is the place you can do so 📬🎉""}",,128
50,https://github.com/madebyform/react-parts.git,An unofficial catalog of React components,,126
51,https://github.com/calibre2opds/calibre2opds.git,Calibre2opds:  Generate a web catalog for a Calibre library,,126
52,https://github.com/tasanobu/Misen.git,Script to support easily using Xcode Asset Catalog in Swift.,,123
53,https://github.com/FINRAOS/herd.git,Herd is a managed data lake for the cloud. The Herd unified data catalog helps separate storage from compute in the cloud. Manage petabytes of data and make it accessible for data processing and analytical purposes by any cloud compute platform. ,,123
54,https://github.com/alexisakers/alternate-icons.git,iOS alternate app icons from Asset Catalogs,"swift,ios,app-icons,xcode,automation",120
55,https://github.com/edx/ecommerce.git,"{""Service for managing edX's product catalog and handling orders for those products""}",,118
56,https://github.com/infinityworks/Guide_Rancher_Monitoring.git,Easy to follow guide on how to deploy and make the best use of the Rancher community catalog template for Prometheus.,"rancher,prometheus,rancher-api,guide-rancher-monitoring,catalog",115
57,https://github.com/operator-framework/operator-registry.git, Operator Registry runs in a Kubernetes or OpenShift cluster to provide operator catalog data to Operator Lifecycle Manager.,"kubernetes,kubernetes-operator,grpc",113
58,https://github.com/lukaszlach/clip.git,":whale: Docker Client Plugins Manager - build new plugins, publish them on Docker Hub or just try some plugins from the catalog and install them locally","docker,docker-client,docker-cli-plugin,plugins",113
59,https://github.com/johnuberbacher/flutter_medical.git,Functioning Doctor/Healthcare Catalog App created using Dart with Flutter. Stores and loads data from Firebase Firestore DB.,"flutter,dart,app,android,ios,ios-app,androidstudio,firebase,medical,medical-application,screenshot,firestore,firestore-database,flutter-ui",112
60,https://github.com/adrianco/Actors-for-Netflix-on-iPad.git,"{""iPad app that navigates the Netflix catalog by Actor using the OData API and calls the Netflix Player to watch a movie.  Winner of best use of Web API's prize at the iPadDevCamp. Code is stable and functional, but unfinished""}",,111
61,https://github.com/Agence-DnD/PIMGento.git,PimGento is a Magento extension that allows you to import your catalog from Akeneo CSV files into Magento.,,110
62,https://github.com/stac-utils/pystac.git,Python library for working with any SpatioTemporal Asset Catalog (STAC),,107
63,https://github.com/openstack/murano.git,Application Catalog for OpenStack. Mirror of code maintained at opendev.org.,service,106
64,https://github.com/RolandR/place-atlas.git,"{""The /r/place Atlas is a project aiming to catalog all the artworks created during Reddit's /r/place event.""}","reddit,internet-culture,maps,agpl,agplv3",106
65,https://github.com/petems/cucumber-puppet.git,Specifying Puppet catalog behavior with Cucumber,,105
66,https://github.com/10961020/GB28181.git,GB28181使用python实现源码  作为上级域对接海康蓝盾平台。包括catalog设备信息，预览设备视频流保存成本地文件以及球机PTZ控制,,104
67,https://github.com/awslabs/aws-glue-data-catalog-client-for-apache-hive-metastore.git,"The AWS Glue Data Catalog is a fully managed, Apache Hive Metastore compatible, metadata repository. Customers can use the Data Catalog as a central repository to store structural and operational metadata for their data.  AWS Glue provides out-of-box integration with Amazon EMR that enables customers to use the AWS Glue Data Catalog as an external Hive Metastore.  This is an open-source implementation of the Apache Hive Metastore client on Amazon EMR clusters that uses the AWS Glue Data Catalog as an external Hive Metastore. It serves as a reference implementation for building a Hive Metastore-compatible client that connects to the AWS Glue Data Catalog. It may be ported to other Hive Metastore-compatible platforms such as other Hadoop and Apache Spark distributions",,102
68,https://github.com/opendata/lmgtdfy.git,“Let Me Get That Data For You” catalogs the machine-readable data on a given domain name. [RETIRED],,100
69,https://github.com/creativecommons/cccatalog-api.git,Note: Project is discontinued. The Creative Commons Catalog API allows programmatic access to search for CC-licensed and public domain digital media.,"python,elasticsearch,discontinued",96
70,https://github.com/SHERlocked93/progress-catalog.git,"Generate a progress catalog by html tag (h1, h2, h3, h4, h5, h6) 😜",catalog,95
71,https://github.com/construct-catalog/catalog.git,Catalog for aggregating CDK Constructs,,93
72,https://github.com/material-components/material-components-web-catalog.git,Catalog of Material Components for the web (MDC Web),,93
73,https://github.com/puppetlabs/puppet-specifications.git,"Specification of the Puppet Language, Catalog, Extension points",,92
74,https://github.com/deadc0de6/catcli.git,The command line catalog tool for your offline data,"catalog,commandline,indexer,python3",92
75,https://github.com/awslabs/aws-service-catalog-products.git,"This repository contains a number of CloudFormation templates which can be used independently or as Products with AWS Service Catalog including the Open Source Tools AWS Service Catalog Factory and AWS Service Catalog Puppet. The templates include a number of the foundational AWS Services you may choose to manage Account Compliance including AWS Config, AWS CloudTrail and GuardDuty","aws,servicecatalog,selfservice,cloudformation,iaas",87
76,https://github.com/facebookarchive/facebook-for-magento.git,"A first-party extension plugin built for Magento. This plugin will install a pixel on your site, upload your products into a catalog for use in FB ads, and (optionally) auto-create an FB shop with your products.",,86
77,https://github.com/w3c/dxwg.git,Data Catalog Vocabulary (DCAT),,83
78,https://github.com/usnationalarchives/Catalog-API.git,National Archives Catalog API,,83
79,https://github.com/puffinrocks/puffin.git,"lightweight webapp catalog based on containers, with user interface à la mobile app store","puffin,docker,decentralized,app-store",83
80,https://github.com/metaperl/python-oop.git,Catalog of Python object-oriented programming articles and links,,83
81,https://github.com/johnpolacek/styled-starter.git,"Starter Kit with React, Next.js, Styled System and Catalog to get projects going with a design theme, built-in styleguide and browser testing",,81
82,https://github.com/Vinai/nicer-image-names.git,Magento extension to build catalog image file names from product attributes so they have neat descriptive names.,,79
83,https://github.com/awslabs/aws-service-catalog-factory.git,"This is a framework where you define a Service Catalog portfolio, products and versions using YAML. For versions of your products you specify where the source code for them can be found and the framework publishes the portfolio, products and versions in every* AWS Region after validating, linting and testing them.",,79
84,https://github.com/darius/code-canon.git,A catalog of code worth reading,,78
85,https://github.com/Wikidata/soweego.git,Link Wikidata items to large catalogs,"wikimedia,wikidata,knowledge-graph,record-linkage,data-matching,entity-resolution,identifiers,entity-linking",77
86,https://github.com/EhsanKia/CatalogScanner.git,Scans Animal Crossing: New Horizon catalog from video of user scrolling through.,"animal-crossing,animal-crossing-new-horizons,computer-vision,hacktoberfest",77
87,https://github.com/textbrowser/biblioteq.git,"BiblioteQ strives to be a professional archiving, cataloging, and library management suite, utilizing a Qt interface and providing connectivity to PostgreSQL and SQLite. The Open Library, SRU, and Z39.50 protocols are used for retrieving data for books, journals, and magazines. AMD, ARM, Alpha, PowerPC, Sparc64, etc. Completed.",,77
88,https://github.com/wilmerkrisp/patterns.git,Complete catalog of all classical patterns in the Archimate language,"patterns,domain-driven-design,ddd,ddd-architecture,ddd-patterns,architecture,archimate-language,diagram,book",76
89,https://github.com/astromatic/sextractor.git,Extract catalogs of sources from astronomical images,,75
90,https://github.com/ttzt/catalog_of_requirements_for_ai_products.git,The purpose of the catalog is to help data science teams to collect all the requirements to consider while building a ML model and productionizing it.,,75
91,https://github.com/HowToFind-bot/osint-tools.git,OSINT tools catalog,"osint,catalog,repository,fullname,creditcard,platenumber,bssid,cryptocurrency,username-checker,leaks,email,analysis,osint-tool,osint-resources,osint-framework",74
92,https://github.com/cazzer/gulp-selectors.git,Catalog all of your selectors and do fun stuff with them.,,73
93,https://github.com/AOEpeople/Aoe_LazyCatalogImages.git,Magento module to lazy render catalog images,,72
94,https://github.com/googlearchive/k8s-service-catalog.git,[DEPRECATED] Commandline tool to manage Service Catalog lifecycle and GCP Service Broker atop Kubernetes Cluster,,72
95,https://github.com/LinkedInAttic/rest.li-api-hub.git,API Hub is a web UI for browsing and searching a catalog of Rest.li APIs.,,72
96,https://github.com/invadersmustdie/puppet-catalog-test.git,Tests all your puppet catalogs for compiler errors,,68
97,https://github.com/mottalrd/learning-to-rank.git,Experiments on how to use machine learning to rank a product catalog,,68
98,https://github.com/aaronparker/LatestUpdate.git,A module to retrieve and download Windows 10 current updates from the Microsoft Update Catalog,"windows-10,updates,cumulative-update,monthly-rollups,powershell,net-framework,adobe-flash,powershell-gallery,microsoft-update-catalog",68
99,https://github.com/EnterpriseDB/pg_catcheck.git,Postgres Catalog Checker,,66
100,https://github.com/Agence-DnD/PIMGento-2.git,PimGento2 is a Magento 2 extension that allows you to import your catalog from Akeneo CSV files into Magento 2.,,65
101,https://github.com/softprops/awesome-mdbook.git,🕶️🗃️ a card catalog of mdbooks for your reading curiosity,"mdbook,markdown,book",64
102,https://github.com/iPeng6/docsify-sidebar-collapse.git,"a docsify plugin, support sidebar catalog expand and collapse","docsify,docsify-sidebar-collapse,sidebar",63
103,https://github.com/OpenSourceMolecularModeling/OpenSourceMolecularModeling.github.io.git,Catalog of Open Source Molecular Modeling Projects,,62
104,https://github.com/aws-samples/accelerated-data-lake.git,"A packaged Data Lake solution, that builds a highly functional Data Lake, with a data catalog queryable via Elasticsearch",,61
105,https://github.com/prathyvsh/Visual-Math-Tools.git,Catalog of Visual Math Tools,,61
106,https://github.com/inamiy/ReactiveCocoaCatalog.git,UI Catalog for ReactiveCocoa.,"reactivecocoa,reactiveswift,swift",60
107,https://github.com/vube/vagrant-catalog.git,Simple web app to host a catalog of vagrant boxes. A simplified Vagrant Cloud to be run on your private network.,,60
108,https://github.com/mapbox/diversify.git,Script for quickly creating varying sizes of app icons for iOS project asset catalogs.,banished,59
109,https://github.com/sveinbjornt/searchfs.git,Command line tool to quickly search by filename on entire APFS and HFS+ volumes using the file system catalog.,"volume,catalog-search,macos,macosx,apfs-volumes,apfs,hfs-filesystem,search,searchfs,command-line-tool,hfs",59
110,https://github.com/alexk984/yii-catalog.git,yii-catalog,,58
111,https://github.com/Slashgear/generator-rancher-catalog.git,Yeoman generator for creating catalog template for Rancher,,58
112,https://github.com/mnrkbys/vss_carver.git,Carves and recreates VSS catalog and store from Windows disk image.,"python,forensics,windows,vss-carver",58
113,https://github.com/zyegfryed/django-statici18n.git,A Django app that provides helper for generating Javascript catalog to static files.,"django,i18n,python,catalog",58
114,https://github.com/abritopach/angular-ionic-ngxs-movies.git,"Sample project that shows how to build a Movies Catalog APP with Angular, Ionic 4, Capacitor and NGXS (State Management).","ionic4,ionic,angular,ngxs,typescript,capacitor,ionic5,angular9,angular10,angular10-sample",58
115,https://github.com/baldwin-agency/magento2-module-url-data-integrity-checker.git,Magento 2 module which can find potential url related problems in your catalog data,,58
116,https://github.com/ckenst/testing-guides.git,A set of guides and catalogs to help test software,"software-testing,testing,catalog,boundary-conditions",57
117,https://github.com/tokern/piicatcher.git,A data catalog for database tables and columns to track PII and PHI.,"aws-athena,aws-glue,pii,database,data-catalog,phi,data,catalog,aws-redshift,snowflake",57
118,https://github.com/lfzawacki/musical-artifacts.git," Helping to catalog, preserve and free the artifacts you need to produce music. ","music,music-production,free,libre,free-software,ruby",57
119,https://github.com/Azure/helm-charts.git,Helm charts for use with Kubernetes service-catalog,,56
120,https://github.com/ripienaar/puppet-catalog-diff.git,Tool to diff Puppet catalogs,,55
121,https://github.com/intake/intake-stac.git,Intake interface to STAC data catalogs ,,55
122,https://github.com/zonination/galaxies.git,"Catalog of Galaxies, Plotted by Redshift",,55
123,https://github.com/softprops/ls.git,[discontinued] a scala card catalog,,55
124,https://github.com/Esri/geoportal-server-catalog.git,"Geoportal Server next generation search application and metadata catalog, based on elasticsearch.","publishing-sharing,geoportal-server,geoportal,esri-geoportal-server,metadata,elasticsearch,catalog,metadata-editing,csw,iso,fgdc,dcat,gemini,data-management",55
125,https://github.com/sat-utils/sat-stac.git,Python library for creating and working with STAC catalogs,,54
126,https://github.com/strongself/generamba-catalog.git,The shared catalog for Generamba templates,,54
127,https://github.com/LaravelDaily/Laravel-Vue-Sidebar-Filters.git,Demo-project with Laravel API and Vue.js - Sidebar Filters for Catalog/E-Shop,,54
128,https://github.com/brunojs02/react-native-movies-app.git,Movies catalog app written in react native and use of themoviedb api,"react-native,movies,mobile-app,themoviedb-api",54
129,https://github.com/gjoseph92/stackstac.git,Turn a STAC catalog into a dask-based xarray,"stac,geospatial,rasterio,dask,xarray,cog",54
130,https://github.com/truecharts/apps.git,Community App Catalog for TrueNAS SCALE,"truenas,truenas-scale,helm,k8s,k3s,charts,apps",53
131,https://github.com/ZeeZide/SwiftPMCatalog.git,Metadata driving the SwiftPM Catalog application,"swift,swift-package-manager",53
132,https://github.com/jreklund/php4dvd.git,php4dvd is an open source php/mysql powered movie database. Catalog your video collection with ease. Automatic update of information and images.,"movie-collection,php,mysql,imdb",53
133,https://github.com/mozilla/simulated-devices.git,A catalog of common web-enabled devices.,,52
134,https://github.com/open-chaos/experiment-catalog.git,A public and open source chaos engineering experiment catalog.,"chaos-engineering,chaostoolkit,openchaos",50
135,https://github.com/toco/TOCAssetCatalogBackground.git,Xcode plugin to switch between white and dark background color in the asset catalog viewer.,,50
136,https://github.com/ericwhyne/darpa_open_catalog.git,Meta information for the DARPA open catalog project.,,49
137,https://github.com/jbangdev/jbang-catalog.git,Catalog of jbang scripts,,49
138,https://github.com/prathyvsh/pl-catalog.git,A catalog of programming languages,,49
139,https://github.com/rtumaykin/ssis-build.git,"A set of utilities that allow to autonomously build a Visual Studio SSIS project (dtproj) into a deployment package (ispac), and deploy the package to an SSIS catalog",,48
140,https://github.com/awslabs/aws-service-catalog-puppet.git,"This is a framework where you list your AWS accounts with tags and your AWS Service Catalog products with tags or target accounts. The framework works through your lists, dedupes and spots collisions and then provisions the products into your AWS accounts for you. It handles the Portfolio sharing, its acceptance and can provision products cross account and cross region.",,48
141,https://github.com/vokal/Cat2Cat.git,Creates a category on UIImage from Asset Catalogs in order to reduce typos and enable auto-complete with image names.,,47
