,Url,Description,Topics,Stars
883,https://github.com/liufengting/FTChatMessageDemoProject.git,"FTChatMessageDemoProject, a chat message UI framework written in swift. Not quite finished.",,64
884,https://github.com/FinndropStudios/GifRocket.git,Giphy Integration for Rocket.Chat,,63
885,https://github.com/dytlabs/Messenger-Android-XML-Template.git,Free android xml template for chat/messenger app.,"messenger,android-xml-layout,android-xml-template,android-xml,chat-ui,chat",63
886,https://github.com/duytq94/reactjs-chat-demo.git,The web chat made by ReactJS and Firebase,"reactjs,demo,chat,electron,firebase",63
887,https://github.com/pusher-community/pusher-webrtc-chat-demo.git,WebRTC chat application using the DataChannel API and Pusher,,63
888,https://github.com/dericeira/Simple-Chat-Socket.io.git,A simple chat system with NodeJS and Socket.io,,63
889,https://github.com/addyosmani/socketchat.git,SocketChat - a beginners chat app using SocketStream,,63
890,https://github.com/IBM-Cloud/bluechatter.git,"Deploy & Scale a chat app using Cloud Foundry, Docker Container and Kubernetes","docker-container,ibm-bluemix,nodejs,auto-scaling,cloud-foundry,docker-image,docker-application",63
891,https://github.com/vapor-community/chat-example.git,Realtime chat example built with Vapor.,,63
892,https://github.com/MegaMark16/django-live-support.git,A simple live support chat app for django,,63
893,https://github.com/theindianappguy/flutterdevconnect.git,"Be together, whenever. A simple way to text chat and plan things all in one place for flutter developers.",,63
894,https://github.com/GlitchCog/ChatGameFontificator.git,A Twitch chat display that uses the fonts of various video games,"twitch,chat,video-games,fonts,dialogue-box",63
895,https://github.com/mmukhin/psitsmike_example_1.git,node.js and socket.io chat tutorial,,62
896,https://github.com/meganz/MEGAchat.git,MEGA C++ SDK for chat-enabled apps,"mega,calls,chat,webrtc,privacy,end-to-end-encryption",62
897,https://github.com/RocketChat/Rocket.Chat.Kotlin.SDK.git,"{""Rocket.Chat's Kotlin SDK (REST & WebSocket abstractions)""}",rocketchat-sdk,62
898,https://github.com/TakeoffAndroid/VideoChatHeads.git,A custom chat head implementation for videos,,62
899,https://github.com/ephigabay/GIC.git,A chat client based on git,,62
900,https://github.com/martindevans/MumbleSharp.git,An implementation of the mumble voice chat protocol in C#,,62
901,https://github.com/luvuong-le/node-vue-chat.git,:rocket: :stars: Real Time Chat Application created with MEVN Stack ,"chat-application,vuejs,mevn,express,chatroom,chatapp,chat,mevn-stack,vue-chat,socket-io,socket-io-chat-app",62
902,https://github.com/robotty/dank-twitch-irc.git,Connect to Twitch chat from Node.js,"twitch,irc,tmi,nodejs,npm-package",62
903,https://github.com/amrkhaledccd/One-to-One-WebSockets-Chat.git,Building Persistable One-to-One Chat Using Spring Boot and WebSockets,"java,spring-boot,one-to-one-chat,websockets,persistable-chat,programming,software-development,reactjs,mongodb,spring-data-mongodb",62
904,https://github.com/justinsacbibit/chat.git,Barebones iOS client for chat. Written in Swift.,,62
905,https://github.com/liufengting/FTChatMessage.git,"FTChatMessage, a chat message UI framework written in swift. Not quite finished.",,62
906,https://github.com/clarkio/ttv-chat-bot.git,Twitch TV chat reader to control colors for overlays from Stream Elements and/or internet connected light bulbs,"twitch,chatbot,nodejs,javascript,typescript",62
907,https://github.com/RocketChat/Rocket.Chat.Apps-engine.git,The Rocket.Chat Apps engine and definitions.,"rocketchat-apps,apps,hacktoberfest",61
908,https://github.com/dilicode/LetsChat.git,Android chat application based on Openfire and Smack,,61
909,https://github.com/oriceon/laravel-5-redis-and-socket.io.git,Laravel 5 WebSocket Chat with Redis and Socket.io,,61
910,https://github.com/chat21/chat21-web-widget.git,Live Chat Widget built with Firebase and Angular4 for customer support .,"livechat,widget,firebase,angular,messaging,customer-support,bot",61
911,https://github.com/jacklul/inlinegamesbot.git,A Telegram bot providing games that can be played in any chat via inline keyboards.,"bot,telegram-bot",61
912,https://github.com/exul/matrix-rocketchat.git,Application service to bridge Matrix <-> Rocket.Chat.,,61
913,https://github.com/TomPrograms/Python-Voice-Chat.git,Instant multi-person voice chat over the internet in Python 3,"python3,python,sockets,networking,voice-chat,server-client",61
914,https://github.com/haridas/RabbitChat.git,A simple Chat system based on the RabbitMQ + Tornado + Websocket + Pika,,61
915,https://github.com/miroslavpejic85/mirotalk.git,"🚀 Powered by WebRTC, Real-time video call, chat room and screen sharing entirely browser based 🚀","webrtc,peer-to-peer,video-call,video-chat,nodejs,javascript,video-conferencing,webrtc-call,webrtc-demo,webrtc-video,webrtc-signaling,chatroom,screensharing,meeting,zoom-clone,realtime-messaging,google-meet-clone,google-meet,zoom",61
916,https://github.com/romainpiel/meatspace-android.git,Chat for Android with gif generation and more...,,61
917,https://github.com/youtube/youtubechatbot.git,"{""This is a sample YouTube chat bot that's designed to run on Google App Engine. It leverages Task Queues to simulate a long-running background process which polls the YouTube LiveChatMessages API for the specified video.""}",,61
918,https://github.com/kevinpschaaf/chat-view-paper.git,Polymer demo chat app,,60
919,https://github.com/zulip/zulip.git,Zulip server and webapp - powerful open source team chat,"zulip,python,python3,chat,javascript,collaboration,slack,foss,free,apache,react-native,electron",13483
920,https://github.com/jupyter/jupyter.git,"Jupyter metapackage for installation, docs and chat",,12196
921,https://github.com/gunthercox/ChatterBot.git,"ChatterBot is a machine learning, conversational dialog engine for creating chat bots","chatterbot,machine-learning,chatbot,python,conversation,language,bot",11114
922,https://github.com/FaridSafi/react-native-gifted-chat.git,💬 The most complete chat UI for React Native,"react-native,chat,component",10541
923,https://github.com/howdyai/botkit.git,"Botkit is an open source developer tool for building chat bots, apps and custom integrations for major messaging platforms.","botkit,botkit-studio,microsoft-bot-framework,bot-application,slack,facebook,twilio,cisco-spark,bots,sms,conversational-ui,workplacebyfacebook,microsoft-teams,bot,facebook-bot,facebook-messenger,glitch,making-bots,web-bot,chatbot",10328
924,https://github.com/sdelements/lets-chat.git,Self-hosted chat app for small teams,,9475
925,https://github.com/kkuchta/css-only-chat.git,A truly monstrous async web chat using no JS whatsoever on the frontend,,5690
926,https://github.com/botman/botman.git,A framework agnostic PHP library to build chat bots,"chatbot,botman,bot-framework,chatbot-framework,php,bot",5422
927,https://github.com/owncast/owncast.git,Take control over your live stream video by running it yourself.  Streaming + chat out of the box.,"video,streaming-video,livestream,hls,chat,rtmp,broadcasting",4536
928,https://github.com/micahflee/onionshare.git,"Securely and anonymously share files, host websites, and chat with friends using the Tor network","tor,file-sharing,onionshare,onion-service,tor-onion-service,security,python,cross-platform,open-source",4515
929,https://github.com/yinxin630/fiora.git,"An interesting open source chat application. Developed with node.js, mongoDB, socket.io and react","react,fiora,mongodb,socket,chat,chatroom",4507
930,https://github.com/shazow/ssh-chat.git,Chat over SSH.,"ssh-chat,ssh,chat,server",4289
931,https://github.com/badoo/Chatto.git,"A lightweight framework to build chat applications, made in Swift",,4232
932,https://github.com/papercups-io/papercups.git,Open-source live customer chat,"elixir,phoenix-framework,phoenix,react,intercom,livechat,docker,heroku,frontend,typescript,drift,javascript,slack,elixir-phoenix,zendesk,help-desk,customer-support,chat-widget,gdpr-compliant,mattermost",4167
933,https://github.com/relatedcode/Messenger.git,"Open source, native iOS Messenger, with realtime chat conversations (full offline support).","messenger,chat,ios,swift,ios-app,telegram,chat-application,instant-messaging,messaging,graphql,graphql-client,graphql-server,swift5,apollographql,apollo-ios",4146
934,https://github.com/42wim/matterbridge.git,"bridge between mattermost, IRC, gitter, xmpp, slack, discord, telegram, rocketchat, twitch, ssh-chat, zulip, whatsapp, keybase, matrix, microsoft teams, nextcloud, mumble, vk and more with REST API (mattermost not required!)","mattermost,xmpp,telegram,gitter,rocketchat,discord,irc,bridge,slack,matrix,twitch,zulip,whatsapp,facebook-messenger,minecraft-chat,microsoft-teams,counter-strike,nextcloud,mumble,vk",3889
935,https://github.com/mumble-voip/mumble.git,"Mumble is an open-source, low-latency, high quality voice chat software.","voicechat,voip,audio,client,server,gaming,open-source,linux,macos,quality-voice-chat,windows,cross-platform,cmake,hacktoberfest",3864
936,https://github.com/yakyak/yakyak.git,Desktop chat client for Google Hangouts,"google-hangouts,yakyak,notifications,chat,client,cross-platform",3854
937,https://github.com/qTox/qTox.git,"qTox is a chat, voice, video, and file transfer IM client using the encrypted peer-to-peer Tox protocol.","qtox,tox,c-plus-plus,qt,p2p,encryption,distributed,voip,audio,video,messaging,privacy,communication",3560
938,https://github.com/webrtc/apprtc.git,The video chat demo app based on WebRTC. This project is currently on HOLD with minimal maintenance.,,3488
939,https://github.com/sindresorhus/promise-fun.git,"Promise packages, patterns, chat, and tutorials","async-functions,promise-modules,promises,javascript,ponyfill,unicorns,promise-library,promise-queue,promise,promise-patterns,async-await,polyfill,concurrency,async,iteration,list,resources,awesome,awesome-list,nodejs",3402
940,https://github.com/stfalcon-studio/ChatKit.git,"Android library. Flexible components for chat UI implementation with flexible possibilities for styling, customizing and data management.  Made by Stfalcon","chat,uikit,android,android-library,messaging,jsqmessagesviewcontroller,messages,chatview",3367
941,https://github.com/jitsi/jitsi.git,"Jitsi is an audio/video and chat communicator that supports protocols such as SIP, XMPP/Jabber, IRC and many other useful features.","jitsi,icq,jabber,java,xmpp,instant-messaging,xmpp-client,audio,video,irc,sip,chat",3349
942,https://github.com/ottomated/CrewLink.git,"Free, open, Among Us Proximity Chat","among-us,amongus",3131
943,https://github.com/moose-team/friends.git,:tv: P2P chat powered by the web.,,3122
944,https://github.com/ChatSecure/ChatSecure-iOS.git,ChatSecure is a free and open source encrypted chat client for iOS that supports OTR and OMEMO encryption over XMPP.,"omemo,xmpp,otr,ios,swift,objective-c,messaging,chat,iphone,ipad,encryption,sqlcipher,yapdatabase,decentralized",3007
945,https://github.com/Katee/quietnet.git,Simple chat program that communicates using inaudible sounds,"python,toy,demo",2921
946,https://github.com/mofarrell/p2pvc.git,A point to point color terminal video chat.,,2878
947,https://github.com/conversejs/converse.js.git,Web-based XMPP/Jabber chat client written in JavaScript,"xmpp,xmpp-client,jabber,chat",2658
948,https://github.com/ehForwarderBot/ehForwarderBot.git,An extensible message tunneling chat bot framework. Delivers messages to and from multiple platforms and remotely control your accounts.,"chat-bot,chatbot,tunnel-bot,chat-tunneling,framework,eh-forwarder-bot,python-3",2523
949,https://github.com/adrianhajdin/project_chat_application.git,"This is a code repository for the corresponding YouTube video. In this tutorial we are going to build and deploy a real time chat application. Covered topics: React.js, Node.js, Express.js, and Socket.io.","react,reactjs,react-project,react-hooks",2483
950,https://github.com/errbotio/errbot.git,"Errbot is a chatbot, a daemon that connects to your favorite chat service and bring your tools and some fun into the conversation.","python,chatbot,chatops,chat,chatbots,devops,python3,automation,hacktoberfest,hacktoberfest2020",2481
951,https://github.com/webgems/webgems.git,A curated list of resources for devs and designers. Join me on devcord.com if you are up for a chit chat :),"nuxt,resources,learn,learn-to-code,bookmark",2459
952,https://github.com/rickyrauch/Balloons.IO.git,"Balloons.IO is a web multi-room chat server and client ready to use. It’s built with the help of node.JS, Express, Socket.IO and Redis. Balloons uses PassportJS for authentication with Twitter and Facebook",,2389
953,https://github.com/FirebaseExtended/firechat.git,Real-time Chat powered by Firebase,,2342
954,https://github.com/Tyrrrz/DiscordChatExporter.git,Exports Discord chat logs to a file,"discord,chat,log,export,hacktoberfest",2341
955,https://github.com/area17/twill.git,"Twill is an open source CMS toolkit for Laravel that helps developers rapidly create a custom admin console that is intuitive, powerful and flexible. /// Chat with us and others on Spectrum: https://spectrum.chat/twill","laravel,vue,cms,content-management-system,cms-framework",2287
956,https://github.com/AndrewBelt/hack.chat.git,"a minimal, distraction-free chat application",,2270
957,https://github.com/leancloud/ChatKit-OC.git,此项目已经废弃，以后不再维护。我们推出了基于 Swift SDK 的 Chat Demo。,,2174
958,https://github.com/weechat/weechat.git,The extensible chat client.,"chat,irc,c,extensible,scripting,python,perl,ruby,lua,tcl,javascript,scheme,php,client",2160
959,https://github.com/DV8FromTheWorld/JDA.git,Java wrapper for the popular chat & VOIP service: Discord https://discord.com,"discord,rest-api,websocket,java,rest,javadoc,bot,bot-api,jda,promoted-downloads,api-wrapper,api",2043
960,https://github.com/ZhipingYang/UUChatTableView.git,"Cocoa UI component for group or private chat bubbles with text, images and audio support",,1914
961,https://github.com/nkzawa/socket.io-android-chat.git,A simple chat demo for socket.io and Android,,1842
962,https://github.com/AnySoftKeyboard/AnySoftKeyboard.git,Android (f/w 2.1+) on screen keyboard for multiple languages (chat https://gitter.im/AnySoftKeyboard),"screen-keyboard,java,multiple-languages,android,anysoftkeyboard,language",1749
963,https://github.com/aslanyanhaik/Quick-Chat.git,Real time chat app written in Swift 5 using Firebase,"firebase,chat,ios,swift,animation",1747
964,https://github.com/ahmadawais/corona-cli.git,"🦠 Track the Coronavirus disease (COVID-19) in the command line. Worldwide for all countries, for one country, and the US States. Fast response time (< 100ms). To chat: https://twitter.com/MrAhmadAwais/","coronavirus,corona,coronavirus-tracking,coronavirus-real-time,coronavirus-analysis,coronavirus-info,covid-19,visualization",1741
965,https://github.com/Schmavery/facebook-chat-api.git,Unofficial Facebook Chat API for Nodejs,,1731
966,https://github.com/claudiajs/claudia-bot-builder.git,"Create chat bots for Facebook Messenger, Slack, Amazon Alexa, Skype, Telegram, Viber, Line, GroupMe, Kik and Twilio and deploy to AWS Lambda in minutes","aws-lambda,chatbot,facebook-messenger,slack,skype,viber,telegram,twilio,alexa,line,claudiajs",1692
967,https://github.com/ng-book/angular2-rxjs-chat.git,Example Chat Application using RxJS and Angular 2,,1660
968,https://github.com/superscriptjs/superscript.git,A dialogue engine for creating chat bots,,1645
969,https://github.com/Coffcer/vue-chat.git,chat example by vue.js + vuex + webpack,,1603
970,https://github.com/testshallpass/react-native-dropdownalert.git,"A simple alert to notify users about new chat messages, something went wrong or everything is ok.","react-native,dropdown,alert,notification",1567
971,https://github.com/orbitdb/orbit.git,"A distributed, serverless, peer-to-peer chat application on IPFS","orbit,ipfs,p2p,chat,distributed",1553
972,https://github.com/JabbR/JabbR.git,Collaborative chat done right,,1506
973,https://github.com/dino/dino.git,"Modern XMPP (""Jabber"") Chat Client using GTK+/Vala","xmpp-client,vala,xmpp,linux-desktop,gtk3,gtk,omemo,dino,chat,messenger,jingle,p2p,xml,jabber,jabber-client",1502
974,https://github.com/firebase/codelab-friendlychat-web.git,The source for the Firebase codelab for building a cross-platform chat app,"firebase,codelab",1498
975,https://github.com/LiveHelperChat/livehelperchat.git,"Live Helper Chat - live support for your website. Featuring web and mobile apps, Voice & Video & ScreenShare. Supports Telegram, Twilio (whatsapp), Facebook messenger including building a bot.","live-support,chat-application,chat,livehelp,live-help,screenshare,audio-call,video-call",1493
976,https://github.com/microsoft/BotFramework-Emulator.git,A desktop application that allows users to locally test and debug chat bots built with the Bot Framework SDK.,"microsoft-bot-framework,bot-framework-emulator,electron,typescript,react,redux,bot-builder,bot,sdk",1473
977,https://github.com/txusballesteros/bubbles-for-android.git,Bubbles for Android is an Android library to provide chat heads capabilities on your apps. With a fast way to integrate with your development.,,1462
978,https://github.com/chat-sdk/chat-sdk-android.git,Chat SDK Android - Open Source Mobile Messenger,"chat-sdk,firebase,messaging,instant-messaging,messenger,messenger-client,sdk,android,android-sdk,xmpp,xmpp-client",1427
979,https://github.com/nahid/talk.git,Talk is a real-time users messaging and chatting system Laravel.,"realtime-message,message-threads,conversation,talk,laravel-message,laravel-chat,inbox,laravel-talk,laravel-package",1393
980,https://github.com/chaskiq/chaskiq.git,"A full featured Live Chat, Support & Marketing platform, alternative to Intercom, Drift, Crisp, etc ...","rails,react,graphql,messenger,messenger-platform,messenger-chatbots,newsletter-management,chat,support-ticket,tour-guide-app,helpdesk,knowledge-base,livechat,widget,webchat,livechat-bot,livechat-integration,chatbot",1369
981,https://github.com/OmarElGabry/chat.io.git,"A Real Time Chat Application built using Node.js, Express, Mongoose, Socket.io, Passport, & Redis.","real-time,chat,nodejs,express,mongoose,socket,passport,redis",1336
982,https://github.com/LucasBassetti/react-simple-chatbot.git,:speech_balloon: Easy way to create conversation chats,"react,chat,chatbot,conversational-ui",1328
983,https://github.com/candy-chat/candy.git,JavaScript-based multi-user chat client for XMPP.,"xmpp,javascript,chat",1318
984,https://github.com/lukejacksonn/react-slack-clone.git,"Complete chat application, built with Chatkit | by @lukejacksonn","pusher,chatkit,chat,react",1314
985,https://github.com/ISBX/apprtc-ios.git,A native iOS video chat app based on WebRTC,,1278
986,https://github.com/onetimesecret/onetimesecret.git,Keep sensitive info out of your email & chat logs.,,1241
987,https://github.com/matiasinsaurralde/facebook-tunnel.git,Tunneling Internet traffic over Facebook chat.,"facebook,tunnel,tuntap",1236
988,https://github.com/Figma-Linux/figma-linux.git,"Figma is the first interface design tool based in the browser, making it easier for teams to create software. Join us in https://t.me/figma_linux and https://spectrum.chat/figma-linux","figma,linux,figma-app,electron",1232
989,https://github.com/scrapinghub/slackbot.git,A chat bot for Slack (https://slack.com).,,1153
990,https://github.com/RocketChat/Rocket.Chat.Electron.git,"Official  OSX, Windows, and Linux Desktop Clients for Rocket.Chat ","electron,chat,slack,desktop,collaboration,foss,mit,opensource,windows,linux,macos,hacktoberfest",1144
991,https://github.com/idoco/intergram.git,Free live chat widget linked to your Telegram messenger,"chat-widget,telegram,telegram-bot",1124
992,https://github.com/RocketChat/Rocket.Chat.ReactNative.git,Rocket.Chat mobile clients,"hacktoberfest,react-native,chat,ios,android",1123
993,https://github.com/Clivern/Beaver.git,"💨 A real time messaging system to build a scalable in-app notifications, multiplayer games, chat apps in web and mobile apps.","pusher,beaver,websocket,pubsub,socket-io,realtime,messaging,messaging-service,socketjs",1082
994,https://github.com/mtdvio/ru-tech-chats.git,"This repo contains a list of various russian-speaking tech chats. Русскоязычные IT-чаты. Их есть у нас. Налетай, торопись!",,1063
995,https://github.com/duytq94/flutter-chat-demo.git,The chat app made by Flutter and Firebase,"flutter,chat,demo,firebase",1048
996,https://github.com/nextcloud/spreed.git,"📞😀 Nextcloud Talk – chat, video & audio calls for Nextcloud","nextcloud,video,spreed,call,screensharing,open-source,webrtc,hacktoberfest",1033
997,https://github.com/RocketChat/Rocket.Chat.iOS.git,Legacy mobile Rocket.Chat client in Swift for iOS,"chat,rocket,foss,free,swift,rocketchat,ios",1030
998,https://github.com/cloudfuji/kandan.git,A Cloudfuji chat application,,1022
999,https://github.com/cryptocat/cryptocat.git,Secure chat software for your computer.,"cryptocat,secure,messaging,cryptography,security,chat",1016
1000,https://github.com/fbchat-dev/fbchat.git,Facebook Chat (Messenger) for Python,"facebook-messenger,facebook-messenger-bot,python,hacktoberfest",1013
1001,https://github.com/mattmezza/vue-beautiful-chat.git,"A simple and beautiful Vue chat component backend agnostic, fully customisable and extendable.","vue,chat,vuejs,frontend,message,support,colors,marketing,customer-support",1012
1002,https://github.com/walkor/workerman-chat.git,Websocket chat room written in PHP based on workerman.,"websocket,chat,chatroom",1001
1003,https://github.com/rohan20/flutter-chat-app.git,A chat app built on Flutter with firebase authentication and image sharing capability.,"dart,google-flutter,firebase,flutter",975
1004,https://github.com/Wolox/react-chat-widget.git,Awesome chat widget for your React App,"react,widget,chat",913
1005,https://github.com/operable/cog.git,Bringing the power of the command line to chat,"chatops,unix-pipes,slack,hipchat,devops,cog,elixir-phoenix,chatbot-framework,chatbot,chat-bot,bot-framework",910
1006,https://github.com/Kwoth/NadekoBot.git,"Open source, general-purpose Discord chat bot written in C#","discord,nadekobot,bot,chatbot,csharp,dotnet,dotnet-core",897
1007,https://github.com/braidchat/braid.git, Braid is a team-chat app with a novel UI that leads to better conversations.,,885
1008,https://github.com/RocketChat/Rocket.Chat.Android.git,Legacy mobile Rocket.Chat client in Kotlin for Android,"chat,rocket,foss,free,kotlin,rocketchat,android",876
1009,https://github.com/lensh/vue-qq.git,"🎨  Vue family bucket with socket.io and express/koa2 , create a web version of mobile QQ, supporting real-time group chat, real-time private chat, special care, shielding chat,  smart IP geographic location, real-time display  temperature  and other QQ core functions","vue2,vuex,vue-router,axios,koa2,socket-io,es6,es7,webpack2,node,async-await,mysql,express,html5,css3,es8",870
1010,https://github.com/AlexBarinov/UIBubbleTableView.git,Cocoa UI component for chat bubbles with avatars and images support,,857
1011,https://github.com/raineroviir/react-redux-socketio-chat.git,Full Stack Chat Application,,856
1012,https://github.com/chat-sdk/chat-sdk-ios.git,Chat SDK iOS - Open Source Mobile Messenger,"chat-sdk,firebase,messaging,instant-messaging,messenger,sdk,iphone,xmpp,xmpp-client,messenger-client,ipad,ios,objective-c,swift",821
1013,https://github.com/MasterScrat/Chatistics.git,"💬 Python scripts to parse Messenger, Hangouts, WhatsApp and Telegram chat logs into DataFrames.","google-hangouts,facebook-messenger,wordcloud,hangouts-logs,takeout,histogram,parse,extract,plot,cloud,telegram,telegram-api,whatsapp,parsers,whatsapp-parser",821
1014,https://github.com/matterhorn-chat/matterhorn.git,A feature-rich Unix terminal client for the Mattermost chat system,"mattermost-chat,tui,client,haskell,mattermost,brick",819
1015,https://github.com/knadh/niltalk.git,"Instant, disposable, single-binary web based live chat server. Go + VueJS.","chat,chat-server,chat-room,communication,private-chat,private-messaging,disposable",815
1016,https://github.com/Chatterino/chatterino2.git,Chat client for https://twitch.tv,"twitch,chatclient,linux,windows,macos",807
1017,https://github.com/aermin/ghChat.git,:octocat: 📱A chat application for GitHub. React + PWA + Node(koa2) + Typescripts  + Mysql  + Socket.io,"chat,im,react,redux,koa2,mysql,pwa,nodejs,socket-io,axios,scss,react-router,webpack,typescript,jwt",806
1018,https://github.com/maqp/tfc.git,"Tinfoil Chat - Onion-routed, endpoint secure messaging system","open-source,end-to-end-encryption,secure-messenger,tor,onion-service,data-diode,endpoint-security,python3,tails,qubes-os,privacy-by-design,secure-by-default,tor-onion-service,onion-services,hidden-services",795
1019,https://github.com/luixaviles/socket-io-typescript-chat.git,"A chat application implemented using Socket.io, TypeScript, Angular and Angular Material components","typescript,socket,angular,nodejs,angular-material2,chat",782
1020,https://github.com/holtwick/briefing.git,Secure direct video group chat,"chat,video,webrtc,webrtc-video,webrtc-signaling,webrtc-call,vue,end-to-end-encryption,webapp,website,websocket,communication,group,conferencing,audio,call,sfu,peer,e2ee,p2p-chat",746
1021,https://github.com/HashNuke/mogo-chat.git,Beautiful team chat app written in Elixir & Ember.js,,746
1022,https://github.com/callicoder/spring-boot-websocket-chat-demo.git,Spring Boot WebSocket Chat Demo with SockJS fallback and STOMP protocol,"spring-boot,websocket,sockjs,stomp,chat,spring,tutorial",738
1023,https://github.com/andreas-mausch/whatsapp-viewer.git,Small tool to display chats from the Android msgstore.db database (crypt12),,736
