,Url,Description,Topics,Stars
0,https://github.com/zulip/zulip.git,Zulip server and webapp - powerful open source team chat,"zulip,python,python3,chat,javascript,collaboration,slack,foss,free,apache,react-native,electron",13483
1,https://github.com/jupyter/jupyter.git,"Jupyter metapackage for installation, docs and chat",,12196
2,https://github.com/gunthercox/ChatterBot.git,"ChatterBot is a machine learning, conversational dialog engine for creating chat bots","chatterbot,machine-learning,chatbot,python,conversation,language,bot",11114
3,https://github.com/FaridSafi/react-native-gifted-chat.git,💬 The most complete chat UI for React Native,"react-native,chat,component",10541
4,https://github.com/howdyai/botkit.git,"Botkit is an open source developer tool for building chat bots, apps and custom integrations for major messaging platforms.","botkit,botkit-studio,microsoft-bot-framework,bot-application,slack,facebook,twilio,cisco-spark,bots,sms,conversational-ui,workplacebyfacebook,microsoft-teams,bot,facebook-bot,facebook-messenger,glitch,making-bots,web-bot,chatbot",10328
5,https://github.com/sdelements/lets-chat.git,Self-hosted chat app for small teams,,9475
6,https://github.com/kkuchta/css-only-chat.git,A truly monstrous async web chat using no JS whatsoever on the frontend,,5690
7,https://github.com/botman/botman.git,A framework agnostic PHP library to build chat bots,"chatbot,botman,bot-framework,chatbot-framework,php,bot",5422
8,https://github.com/owncast/owncast.git,Take control over your live stream video by running it yourself.  Streaming + chat out of the box.,"video,streaming-video,livestream,hls,chat,rtmp,broadcasting",4536
9,https://github.com/micahflee/onionshare.git,"Securely and anonymously share files, host websites, and chat with friends using the Tor network","tor,file-sharing,onionshare,onion-service,tor-onion-service,security,python,cross-platform,open-source",4515
10,https://github.com/yinxin630/fiora.git,"An interesting open source chat application. Developed with node.js, mongoDB, socket.io and react","react,fiora,mongodb,socket,chat,chatroom",4507
11,https://github.com/shazow/ssh-chat.git,Chat over SSH.,"ssh-chat,ssh,chat,server",4289
12,https://github.com/badoo/Chatto.git,"A lightweight framework to build chat applications, made in Swift",,4232
13,https://github.com/papercups-io/papercups.git,Open-source live customer chat,"elixir,phoenix-framework,phoenix,react,intercom,livechat,docker,heroku,frontend,typescript,drift,javascript,slack,elixir-phoenix,zendesk,help-desk,customer-support,chat-widget,gdpr-compliant,mattermost",4167
14,https://github.com/relatedcode/Messenger.git,"Open source, native iOS Messenger, with realtime chat conversations (full offline support).","messenger,chat,ios,swift,ios-app,telegram,chat-application,instant-messaging,messaging,graphql,graphql-client,graphql-server,swift5,apollographql,apollo-ios",4146
15,https://github.com/42wim/matterbridge.git,"bridge between mattermost, IRC, gitter, xmpp, slack, discord, telegram, rocketchat, twitch, ssh-chat, zulip, whatsapp, keybase, matrix, microsoft teams, nextcloud, mumble, vk and more with REST API (mattermost not required!)","mattermost,xmpp,telegram,gitter,rocketchat,discord,irc,bridge,slack,matrix,twitch,zulip,whatsapp,facebook-messenger,minecraft-chat,microsoft-teams,counter-strike,nextcloud,mumble,vk",3889
16,https://github.com/mumble-voip/mumble.git,"Mumble is an open-source, low-latency, high quality voice chat software.","voicechat,voip,audio,client,server,gaming,open-source,linux,macos,quality-voice-chat,windows,cross-platform,cmake,hacktoberfest",3864
17,https://github.com/yakyak/yakyak.git,Desktop chat client for Google Hangouts,"google-hangouts,yakyak,notifications,chat,client,cross-platform",3854
18,https://github.com/qTox/qTox.git,"qTox is a chat, voice, video, and file transfer IM client using the encrypted peer-to-peer Tox protocol.","qtox,tox,c-plus-plus,qt,p2p,encryption,distributed,voip,audio,video,messaging,privacy,communication",3560
19,https://github.com/webrtc/apprtc.git,The video chat demo app based on WebRTC. This project is currently on HOLD with minimal maintenance.,,3488
20,https://github.com/sindresorhus/promise-fun.git,"Promise packages, patterns, chat, and tutorials","async-functions,promise-modules,promises,javascript,ponyfill,unicorns,promise-library,promise-queue,promise,promise-patterns,async-await,polyfill,concurrency,async,iteration,list,resources,awesome,awesome-list,nodejs",3402
21,https://github.com/stfalcon-studio/ChatKit.git,"Android library. Flexible components for chat UI implementation with flexible possibilities for styling, customizing and data management.  Made by Stfalcon","chat,uikit,android,android-library,messaging,jsqmessagesviewcontroller,messages,chatview",3367
22,https://github.com/jitsi/jitsi.git,"Jitsi is an audio/video and chat communicator that supports protocols such as SIP, XMPP/Jabber, IRC and many other useful features.","jitsi,icq,jabber,java,xmpp,instant-messaging,xmpp-client,audio,video,irc,sip,chat",3349
23,https://github.com/ottomated/CrewLink.git,"Free, open, Among Us Proximity Chat","among-us,amongus",3131
24,https://github.com/moose-team/friends.git,:tv: P2P chat powered by the web.,,3122
25,https://github.com/ChatSecure/ChatSecure-iOS.git,ChatSecure is a free and open source encrypted chat client for iOS that supports OTR and OMEMO encryption over XMPP.,"omemo,xmpp,otr,ios,swift,objective-c,messaging,chat,iphone,ipad,encryption,sqlcipher,yapdatabase,decentralized",3007
26,https://github.com/Katee/quietnet.git,Simple chat program that communicates using inaudible sounds,"python,toy,demo",2921
27,https://github.com/mofarrell/p2pvc.git,A point to point color terminal video chat.,,2878
28,https://github.com/conversejs/converse.js.git,Web-based XMPP/Jabber chat client written in JavaScript,"xmpp,xmpp-client,jabber,chat",2658
29,https://github.com/ehForwarderBot/ehForwarderBot.git,An extensible message tunneling chat bot framework. Delivers messages to and from multiple platforms and remotely control your accounts.,"chat-bot,chatbot,tunnel-bot,chat-tunneling,framework,eh-forwarder-bot,python-3",2523
30,https://github.com/adrianhajdin/project_chat_application.git,"This is a code repository for the corresponding YouTube video. In this tutorial we are going to build and deploy a real time chat application. Covered topics: React.js, Node.js, Express.js, and Socket.io.","react,reactjs,react-project,react-hooks",2483
31,https://github.com/errbotio/errbot.git,"Errbot is a chatbot, a daemon that connects to your favorite chat service and bring your tools and some fun into the conversation.","python,chatbot,chatops,chat,chatbots,devops,python3,automation,hacktoberfest,hacktoberfest2020",2481
32,https://github.com/webgems/webgems.git,A curated list of resources for devs and designers. Join me on devcord.com if you are up for a chit chat :),"nuxt,resources,learn,learn-to-code,bookmark",2459
33,https://github.com/rickyrauch/Balloons.IO.git,"Balloons.IO is a web multi-room chat server and client ready to use. It’s built with the help of node.JS, Express, Socket.IO and Redis. Balloons uses PassportJS for authentication with Twitter and Facebook",,2389
34,https://github.com/FirebaseExtended/firechat.git,Real-time Chat powered by Firebase,,2342
35,https://github.com/Tyrrrz/DiscordChatExporter.git,Exports Discord chat logs to a file,"discord,chat,log,export,hacktoberfest",2341
36,https://github.com/area17/twill.git,"Twill is an open source CMS toolkit for Laravel that helps developers rapidly create a custom admin console that is intuitive, powerful and flexible. /// Chat with us and others on Spectrum: https://spectrum.chat/twill","laravel,vue,cms,content-management-system,cms-framework",2287
37,https://github.com/AndrewBelt/hack.chat.git,"a minimal, distraction-free chat application",,2270
38,https://github.com/leancloud/ChatKit-OC.git,此项目已经废弃，以后不再维护。我们推出了基于 Swift SDK 的 Chat Demo。,,2174
39,https://github.com/weechat/weechat.git,The extensible chat client.,"chat,irc,c,extensible,scripting,python,perl,ruby,lua,tcl,javascript,scheme,php,client",2160
40,https://github.com/DV8FromTheWorld/JDA.git,Java wrapper for the popular chat & VOIP service: Discord https://discord.com,"discord,rest-api,websocket,java,rest,javadoc,bot,bot-api,jda,promoted-downloads,api-wrapper,api",2043
41,https://github.com/ZhipingYang/UUChatTableView.git,"Cocoa UI component for group or private chat bubbles with text, images and audio support",,1914
42,https://github.com/nkzawa/socket.io-android-chat.git,A simple chat demo for socket.io and Android,,1842
43,https://github.com/AnySoftKeyboard/AnySoftKeyboard.git,Android (f/w 2.1+) on screen keyboard for multiple languages (chat https://gitter.im/AnySoftKeyboard),"screen-keyboard,java,multiple-languages,android,anysoftkeyboard,language",1749
44,https://github.com/aslanyanhaik/Quick-Chat.git,Real time chat app written in Swift 5 using Firebase,"firebase,chat,ios,swift,animation",1747
45,https://github.com/ahmadawais/corona-cli.git,"🦠 Track the Coronavirus disease (COVID-19) in the command line. Worldwide for all countries, for one country, and the US States. Fast response time (< 100ms). To chat: https://twitter.com/MrAhmadAwais/","coronavirus,corona,coronavirus-tracking,coronavirus-real-time,coronavirus-analysis,coronavirus-info,covid-19,visualization",1741
46,https://github.com/Schmavery/facebook-chat-api.git,Unofficial Facebook Chat API for Nodejs,,1731
47,https://github.com/claudiajs/claudia-bot-builder.git,"Create chat bots for Facebook Messenger, Slack, Amazon Alexa, Skype, Telegram, Viber, Line, GroupMe, Kik and Twilio and deploy to AWS Lambda in minutes","aws-lambda,chatbot,facebook-messenger,slack,skype,viber,telegram,twilio,alexa,line,claudiajs",1692
48,https://github.com/ng-book/angular2-rxjs-chat.git,Example Chat Application using RxJS and Angular 2,,1660
49,https://github.com/superscriptjs/superscript.git,A dialogue engine for creating chat bots,,1645
50,https://github.com/Coffcer/vue-chat.git,chat example by vue.js + vuex + webpack,,1603
51,https://github.com/testshallpass/react-native-dropdownalert.git,"A simple alert to notify users about new chat messages, something went wrong or everything is ok.","react-native,dropdown,alert,notification",1567
52,https://github.com/orbitdb/orbit.git,"A distributed, serverless, peer-to-peer chat application on IPFS","orbit,ipfs,p2p,chat,distributed",1553
53,https://github.com/JabbR/JabbR.git,Collaborative chat done right,,1506
54,https://github.com/dino/dino.git,"Modern XMPP (""Jabber"") Chat Client using GTK+/Vala","xmpp-client,vala,xmpp,linux-desktop,gtk3,gtk,omemo,dino,chat,messenger,jingle,p2p,xml,jabber,jabber-client",1502
55,https://github.com/firebase/codelab-friendlychat-web.git,The source for the Firebase codelab for building a cross-platform chat app,"firebase,codelab",1498
56,https://github.com/LiveHelperChat/livehelperchat.git,"Live Helper Chat - live support for your website. Featuring web and mobile apps, Voice & Video & ScreenShare. Supports Telegram, Twilio (whatsapp), Facebook messenger including building a bot.","live-support,chat-application,chat,livehelp,live-help,screenshare,audio-call,video-call",1493
57,https://github.com/microsoft/BotFramework-Emulator.git,A desktop application that allows users to locally test and debug chat bots built with the Bot Framework SDK.,"microsoft-bot-framework,bot-framework-emulator,electron,typescript,react,redux,bot-builder,bot,sdk",1473
58,https://github.com/txusballesteros/bubbles-for-android.git,Bubbles for Android is an Android library to provide chat heads capabilities on your apps. With a fast way to integrate with your development.,,1462
59,https://github.com/chat-sdk/chat-sdk-android.git,Chat SDK Android - Open Source Mobile Messenger,"chat-sdk,firebase,messaging,instant-messaging,messenger,messenger-client,sdk,android,android-sdk,xmpp,xmpp-client",1427
60,https://github.com/nahid/talk.git,Talk is a real-time users messaging and chatting system Laravel.,"realtime-message,message-threads,conversation,talk,laravel-message,laravel-chat,inbox,laravel-talk,laravel-package",1393
61,https://github.com/chaskiq/chaskiq.git,"A full featured Live Chat, Support & Marketing platform, alternative to Intercom, Drift, Crisp, etc ...","rails,react,graphql,messenger,messenger-platform,messenger-chatbots,newsletter-management,chat,support-ticket,tour-guide-app,helpdesk,knowledge-base,livechat,widget,webchat,livechat-bot,livechat-integration,chatbot",1369
62,https://github.com/OmarElGabry/chat.io.git,"A Real Time Chat Application built using Node.js, Express, Mongoose, Socket.io, Passport, & Redis.","real-time,chat,nodejs,express,mongoose,socket,passport,redis",1336
63,https://github.com/LucasBassetti/react-simple-chatbot.git,:speech_balloon: Easy way to create conversation chats,"react,chat,chatbot,conversational-ui",1328
64,https://github.com/candy-chat/candy.git,JavaScript-based multi-user chat client for XMPP.,"xmpp,javascript,chat",1318
65,https://github.com/lukejacksonn/react-slack-clone.git,"Complete chat application, built with Chatkit | by @lukejacksonn","pusher,chatkit,chat,react",1314
66,https://github.com/ISBX/apprtc-ios.git,A native iOS video chat app based on WebRTC,,1278
67,https://github.com/onetimesecret/onetimesecret.git,Keep sensitive info out of your email & chat logs.,,1241
68,https://github.com/matiasinsaurralde/facebook-tunnel.git,Tunneling Internet traffic over Facebook chat.,"facebook,tunnel,tuntap",1236
69,https://github.com/Figma-Linux/figma-linux.git,"Figma is the first interface design tool based in the browser, making it easier for teams to create software. Join us in https://t.me/figma_linux and https://spectrum.chat/figma-linux","figma,linux,figma-app,electron",1232
70,https://github.com/scrapinghub/slackbot.git,A chat bot for Slack (https://slack.com).,,1153
71,https://github.com/RocketChat/Rocket.Chat.Electron.git,"Official  OSX, Windows, and Linux Desktop Clients for Rocket.Chat ","electron,chat,slack,desktop,collaboration,foss,mit,opensource,windows,linux,macos,hacktoberfest",1144
72,https://github.com/idoco/intergram.git,Free live chat widget linked to your Telegram messenger,"chat-widget,telegram,telegram-bot",1124
73,https://github.com/RocketChat/Rocket.Chat.ReactNative.git,Rocket.Chat mobile clients,"hacktoberfest,react-native,chat,ios,android",1123
74,https://github.com/Clivern/Beaver.git,"💨 A real time messaging system to build a scalable in-app notifications, multiplayer games, chat apps in web and mobile apps.","pusher,beaver,websocket,pubsub,socket-io,realtime,messaging,messaging-service,socketjs",1082
75,https://github.com/mtdvio/ru-tech-chats.git,"This repo contains a list of various russian-speaking tech chats. Русскоязычные IT-чаты. Их есть у нас. Налетай, торопись!",,1063
76,https://github.com/duytq94/flutter-chat-demo.git,The chat app made by Flutter and Firebase,"flutter,chat,demo,firebase",1048
77,https://github.com/nextcloud/spreed.git,"📞😀 Nextcloud Talk – chat, video & audio calls for Nextcloud","nextcloud,video,spreed,call,screensharing,open-source,webrtc,hacktoberfest",1033
78,https://github.com/RocketChat/Rocket.Chat.iOS.git,Legacy mobile Rocket.Chat client in Swift for iOS,"chat,rocket,foss,free,swift,rocketchat,ios",1030
79,https://github.com/cloudfuji/kandan.git,A Cloudfuji chat application,,1022
80,https://github.com/cryptocat/cryptocat.git,Secure chat software for your computer.,"cryptocat,secure,messaging,cryptography,security,chat",1016
81,https://github.com/fbchat-dev/fbchat.git,Facebook Chat (Messenger) for Python,"facebook-messenger,facebook-messenger-bot,python,hacktoberfest",1013
82,https://github.com/mattmezza/vue-beautiful-chat.git,"A simple and beautiful Vue chat component backend agnostic, fully customisable and extendable.","vue,chat,vuejs,frontend,message,support,colors,marketing,customer-support",1012
83,https://github.com/walkor/workerman-chat.git,Websocket chat room written in PHP based on workerman.,"websocket,chat,chatroom",1001
84,https://github.com/rohan20/flutter-chat-app.git,A chat app built on Flutter with firebase authentication and image sharing capability.,"dart,google-flutter,firebase,flutter",975
85,https://github.com/Wolox/react-chat-widget.git,Awesome chat widget for your React App,"react,widget,chat",913
86,https://github.com/operable/cog.git,Bringing the power of the command line to chat,"chatops,unix-pipes,slack,hipchat,devops,cog,elixir-phoenix,chatbot-framework,chatbot,chat-bot,bot-framework",910
87,https://github.com/Kwoth/NadekoBot.git,"Open source, general-purpose Discord chat bot written in C#","discord,nadekobot,bot,chatbot,csharp,dotnet,dotnet-core",897
88,https://github.com/braidchat/braid.git, Braid is a team-chat app with a novel UI that leads to better conversations.,,885
89,https://github.com/RocketChat/Rocket.Chat.Android.git,Legacy mobile Rocket.Chat client in Kotlin for Android,"chat,rocket,foss,free,kotlin,rocketchat,android",876
90,https://github.com/lensh/vue-qq.git,"🎨  Vue family bucket with socket.io and express/koa2 , create a web version of mobile QQ, supporting real-time group chat, real-time private chat, special care, shielding chat,  smart IP geographic location, real-time display  temperature  and other QQ core functions","vue2,vuex,vue-router,axios,koa2,socket-io,es6,es7,webpack2,node,async-await,mysql,express,html5,css3,es8",870
91,https://github.com/AlexBarinov/UIBubbleTableView.git,Cocoa UI component for chat bubbles with avatars and images support,,857
92,https://github.com/raineroviir/react-redux-socketio-chat.git,Full Stack Chat Application,,856
93,https://github.com/chat-sdk/chat-sdk-ios.git,Chat SDK iOS - Open Source Mobile Messenger,"chat-sdk,firebase,messaging,instant-messaging,messenger,sdk,iphone,xmpp,xmpp-client,messenger-client,ipad,ios,objective-c,swift",821
94,https://github.com/MasterScrat/Chatistics.git,"💬 Python scripts to parse Messenger, Hangouts, WhatsApp and Telegram chat logs into DataFrames.","google-hangouts,facebook-messenger,wordcloud,hangouts-logs,takeout,histogram,parse,extract,plot,cloud,telegram,telegram-api,whatsapp,parsers,whatsapp-parser",821
95,https://github.com/matterhorn-chat/matterhorn.git,A feature-rich Unix terminal client for the Mattermost chat system,"mattermost-chat,tui,client,haskell,mattermost,brick",819
96,https://github.com/knadh/niltalk.git,"Instant, disposable, single-binary web based live chat server. Go + VueJS.","chat,chat-server,chat-room,communication,private-chat,private-messaging,disposable",815
97,https://github.com/Chatterino/chatterino2.git,Chat client for https://twitch.tv,"twitch,chatclient,linux,windows,macos",807
98,https://github.com/aermin/ghChat.git,:octocat: 📱A chat application for GitHub. React + PWA + Node(koa2) + Typescripts  + Mysql  + Socket.io,"chat,im,react,redux,koa2,mysql,pwa,nodejs,socket-io,axios,scss,react-router,webpack,typescript,jwt",806
99,https://github.com/maqp/tfc.git,"Tinfoil Chat - Onion-routed, endpoint secure messaging system","open-source,end-to-end-encryption,secure-messenger,tor,onion-service,data-diode,endpoint-security,python3,tails,qubes-os,privacy-by-design,secure-by-default,tor-onion-service,onion-services,hidden-services",795
100,https://github.com/luixaviles/socket-io-typescript-chat.git,"A chat application implemented using Socket.io, TypeScript, Angular and Angular Material components","typescript,socket,angular,nodejs,angular-material2,chat",782
101,https://github.com/holtwick/briefing.git,Secure direct video group chat,"chat,video,webrtc,webrtc-video,webrtc-signaling,webrtc-call,vue,end-to-end-encryption,webapp,website,websocket,communication,group,conferencing,audio,call,sfu,peer,e2ee,p2p-chat",746
102,https://github.com/HashNuke/mogo-chat.git,Beautiful team chat app written in Elixir & Ember.js,,746
103,https://github.com/callicoder/spring-boot-websocket-chat-demo.git,Spring Boot WebSocket Chat Demo with SockJS fallback and STOMP protocol,"spring-boot,websocket,sockjs,stomp,chat,spring,tutorial",738
104,https://github.com/andreas-mausch/whatsapp-viewer.git,Small tool to display chats from the Android msgstore.db database (crypt12),,736
105,https://github.com/musonza/chat.git,A Laravel chat package. You can use this package to create a chat/messaging Laravel application.,"laravel-package,laravel-chat,laravel-messaging,conversation,laravel-messaging-package,chat,chatapp,php-chat,laravel,laravel6-package,participant-conversations",728
106,https://github.com/wayou/HiChat.git,A chat application built with Node.js and Websocket,,713
107,https://github.com/justadudewhohacks/websocket-chat.git,Websocket based group chat app built with socket.io and react.,"websocket,socket-io,chat,react,reactjs,styled-components,javascript,nodejs,material-ui",699
108,https://github.com/chrisfsampaio/imsg.git,Chat using iMessage from your terminal!,,696
109,https://github.com/guidone/node-red-contrib-chatbot.git,"Visually build a full featured chat bot for Telegram, Facebook Messenger and Slack with Node-RED. Almost no coding skills required.",,685
110,https://github.com/badoo/Chateau.git,Chateau is a framework for adding (or improving) chat functionality in any Android app,,684
111,https://github.com/minimalchat/client.git,Client library for Minimal Chat,,681
112,https://github.com/seeden/react-facebook.git,"Facebook components like a Login button, Like, Share, Chat, Comments, Page or Embedded Post","react-components,facebook-components,facebook,react,javascript,facebook-api",678
113,https://github.com/hack-chat/main.git,"a minimal, distraction-free chat application","anonymous,chat,javascript,nodejs,websockets",671
114,https://github.com/brannondorsey/chattervox.git,📡 An AX.25 packet radio chat protocol with support for digital signatures and binary compression. Like IRC over radio waves.,"ax25,packet-radio,digital-signatures,ecdsa,public-key-cryptography,ham-radio,amateur-radio,radio,direwolf",669
115,https://github.com/cabal-club/cabal-desktop.git,"Desktop client for Cabal, the p2p/decentralized/local-first chat platform.","p2p,chat,slack,distributed,desktop,instant-messaging",667
116,https://github.com/PHPJunior/laravel-video-chat.git,Laravel Video Chat using Socket.IO and WebRTC,"socket-io,video-chat,laravel-5-package,laravel,chat,realtime",661
117,https://github.com/igorantun/node-chat.git,:speech_balloon: Chat application built with NodeJS and Material Design,"nodejs,websocket,chat",660
118,https://github.com/exAspArk/awesome-chatops.git,:robot: A collection of awesome things about ChatOps – managing operations through a chat,"awesome,chatops,bots,chatbot",659
119,https://github.com/bradtraversy/chatcord.git,Realtime chat app with rooms,,658
120,https://github.com/ORelio/Minecraft-Console-Client.git,Lightweight console for Minecraft chat and automated scripts,,658
121,https://github.com/himanshu-soni/ChatMessageView.git,Android library to create chat message view easily,,644
122,https://github.com/premnirmal/Magnet.git,"{""A library for creating a window icon, similar to Facebook's chat heads.""}",,642
123,https://github.com/idoco/map-chat.git,A super simple location based chat,,641
124,https://github.com/chandu0101/sri.git,"Build truly native cross platform (web,ios,android) apps using scalajs and react, react-native ,This project moved to new organization : https://github.com/scalajs-react-interface/sri#sri, new chat room :  https://gitter.im/scalajs-react-interface/sri","scalajs,react,android,react-native,ios,web,reactjs,cross-platform,scala",638
125,https://github.com/aermin/vue-chat.git,:calling: A web chat application.   Vue + node(koa2) + Mysql + socket.io,"vue,vuex,vue-router,koa2,msyql,jwt-token,socket-io,vue-cli,gulp,robot,websocket,scss,pm2",627
126,https://github.com/AppLozic/Applozic-Android-SDK.git,Android Real Time Chat & Messaging SDK,"android,android-chat-sdk,firebase-cloud-messaging,gcm,gradle,notifications,fcm,real-time,realtime,realtime-messaging,chat,chatbot-application,chatapp,messenger,messenger-platform,in-app-communication,communication,communication-library,applozic,chat-sdk",625
127,https://github.com/rajaraodv/redispubsub.git,"A Node.js chat app using Express, Redis Pub/Sub + Redis SessionStore + Socket.io + Socket.Sessions that shows scaling on Cloud foundry",,625
128,https://github.com/aws-samples/aws-lambda-zombie-workshop.git,Code and walkthrough labs to set up a serverless chat application for the Zombie Apocalypse Workshop,"serverless,aws-lambda,amazon-web-services",622
129,https://github.com/ErickWendel/semana-js-expert30.git,Aulas da Semana JS Expert 3.0 - Construindo um chat multiplataforma usando linha de comando e JavaScript Avançado,"node,javascript,websocket,js,builder,design,patterns,heroku,npm,cli",619
130,https://github.com/jsxc/jsxc.git,":speech_balloon: Real-time xmpp chat application with video calls, file transfer and encrypted communication.","xmpp-client,javascript,xmpp,webrtc,file-transfer,video-calls,otr",616
131,https://github.com/darkwire/darkwire.io.git,End-to-end encrypted instant web chat,"encryption,chat,anonymous-users,socket-io,privacy,chatroom,chat-room,end-to-end-encryption,chat-application,cryptography",612
132,https://github.com/chatty/chatty.git,Twitch Chat Client written in Java,"java,standalone,twitch,chat",606
133,https://github.com/cloverstudio/Spika.git,"Spika is universal chat module with backend, web, ios and Android client.",,603
134,https://github.com/Detaysoft/react-chat-elements.git,"Reactjs chat elements chat UI, react chat components","react,react-components,chat,react-ui,chat-ui,ui-components",599
135,https://github.com/quassel/quassel.git,Quassel IRC: Chat comfortably.  Everywhere.,"quassel,irc,irc-client,bouncer",598
136,https://github.com/little2s/NoChat.git,A lightweight chat UI framework for iOS.,,597
