,Url,Description,Topics,Stars
0,https://github.com/rishabhathiya/Bank-Marketing.git,"{""# Bank Marketing Dataset  ## Marketing Introduction: The process by which companies create value for customers and build strong customer relationships in order to capture value from customers in return. - Kotler and Armstrong (2010).  Marketing campaigns are characterized by focusing on the customer needs and their overall satisfaction. Nevertheless, there are different variables that determine whether a marketing campaign will be successful or not. There are certain variables that we need to take into consideration when making a marketing campaign.  ## The 4 Ps:  1) Segment of the Population: To which segment of the population is the marketing campaign going to address and why? This aspect of the marketing campaign is extremely important since it will tell to which part of the population should most likely receive the message of the marketing campaign.  2) Distribution channel to reach the customer's place: Implementing the most effective strategy in order to get the most out of this marketing campaign. What segment of the population should we address? Which instrument should we use to get our message out? (Ex: Telephones, Radio, TV, Social Media Etc.)  3) Price: What is the best price to offer to potential clients? (In the case of the bank's marketing campaign this is not necessary since the main interest for the bank is for potential clients to open depost accounts in order to make the operative activities of the bank to keep on running.)  4) Promotional Strategy: This is the way the strategy is going to be implemented and how are potential clients going to be address. This should be the last part of the marketing campaign analysis since there has to be an indepth analysis of previous campaigns (If possible) in order to learn from previous mistakes and to determine how to make the marketing campaign much more effective.  ## What is a Term Deposit?  A Term deposit is a deposit that a bank or a financial institurion offers with a fixed rate (often better than just opening deposit account) in which your money will be returned back at a specific maturity time. For more information with regards to Term Deposits please click on this link from Investopedia: https://www.investopedia.com/terms/t/termdeposit.asp  ## Outline:  1. Import data from dataset and perform initial high-level analysis: look at the number of rows, look at the missing values, look at dataset columns and their values respective to the campaign outcome. 2. Clean the data: remove irrelevant columns, deal with missing and incorrect values, turn categorical columns into dummy variables. 3. Use machine learning techniques to predict the marketing campaign outcome and to find out factors, which affect the success of the campaign.   ## Dataset Link    https://archive.ics.uci.edu/ml/datasets/Bank+Marketing  ## Dataset Information    The data is related with direct marketing campaigns of a Portuguese banking institution. The marketing campaigns were based on phone calls. Often, more than one contact to the same client was required, in order to access if the product (bank term deposit) would be ('yes') or not ('no') subscribed.  There are four datasets: 1) bank-additional-full.csv with all examples (41188) and 20 inputs, ordered by date (from May 2008 to November 2010), very close to the data analyzed in [Moro et al., 2014] 2) bank-additional.csv with 10% of the examples (4119), randomly selected from 1), and 20 inputs. 3) bank-full.csv with all examples and 17 inputs, ordered by date (older version of this dataset with less inputs). 4) bank.csv with 10% of the examples and 17 inputs, randomly selected from 3 (older version of this dataset with less inputs). The smallest datasets are provided to test more computationally demanding machine learning algorithms (e.g., SVM).  The classification goal is to predict if the client will subscribe (yes/no) a term deposit (variable y).    ## Attribute Information    Input variables: #### bank client data: 1-age (numeric)   2-job : type of job (categorical: 'admin.','blue-collar','entrepreneur','housemaid','management','retired','self-employed','services','student','technician','unemployed','unknown')   3-marital : marital status (categorical: 'divorced','married','single','unknown'; note: 'divorced' means divorced or widowed) 4-education(categorical:'basic.4y','basic.6y','basic.9y','high.school','illiterate','professional.course','university.degree','unknown') 5-default: has credit in default? (categorical: 'no','yes','unknown')   6-housing: has housing loan? (categorical: 'no','yes','unknown')   7-loan: has personal loan? (categorical: 'no','yes','unknown')   #### related with the last contact of the current campaign: 8-contact: contact communication type (categorical: 'cellular','telephone')   9-month: last contact month of year (categorical: 'jan', 'feb', 'mar', ..., 'nov', 'dec')   10-day_of_week: last contact day of the week (categorical: 'mon','tue','wed','thu','fri')   11-duration: last contact duration, in seconds (numeric). Important note: this attribute highly affects the output target (e.g., if duration=0 then y='no'). Yet, the duration is not known before a call is performed. Also, after the end of the call y is obviously known. Thus, this input should only be included for benchmark purposes and should be discarded if the intention is to have a realistic predictive model.   #### other attributes: 12-campaign: number of contacts performed during this campaign and for this client (numeric, includes last contact)   13-pdays: number of days that passed by after the client was last contacted from a previous campaign (numeric; 999 means client was not previously contacted)   14-previous: number of contacts performed before this campaign and for this client (numeric)   15-poutcome: outcome of the previous marketing campaign (categorical: 'failure','nonexistent','success')   #### social and economic context attributes 16-emp.var.rate: employment variation rate - quarterly indicator (numeric)   17-cons.price.idx: consumer price index - monthly indicator (numeric)   18-cons.conf.idx: consumer confidence index - monthly indicator (numeric)   19-euribor3m: euribor 3 month rate - daily indicator (numeric)   20-nr.employed: number of employees - quarterly indicator (numeric)    Output variable (desired target):   21-y - has the client subscribed a term deposit? (binary: 'yes','no')     ## License  This dataset is public available for research.   Citations -   1.Moro et al., 2014] S. Moro, P. Cortez and P. Rita. A Data-Driven Approach to Predict the Success of Bank Telemarketing. Decision Support Systems, Elsevier, 62:22-31, June 2014   2.Dua, D. and Graff, C. (2019). UCI Machine Learning Repository [http://archive.ics.uci.edu/ml]. Irvine, CA: University of California, School of Information and Computer Science. ""}",,1
0,https://github.com/garethdown44/payment-initiation-api-spec.git,Swagger files for the Open Banking Payment Initiation API,,0
0,https://github.com/ProjectRogueOne/tpp-reference-server.git,Reference server app demonstrating the Open Banking Read/Write API,,0
0,https://github.com/akafred/openbanking.git,DNB Open Banking,,0
0,https://github.com/wso2/kubernetes-open-banking.git,Kubernetes and Helm Resources for WSO2 Open Banking,,0
0,https://github.com/judahmu/cyclos.git,Open source banking software (Eclipse project),,0
0,https://github.com/shashi073/OpenBanking.git,Open Banking & PSD2,,0
0,https://github.com/kaveenr/ob-quicktests.git,Quick OIDC testing platform for Open Banking,,0
0,https://github.com/sebastianhaas/cloudbanking.git,Beautiful open source cloud-based banking software,,0
0,https://github.com/biazzotto/OpenBanking.git,"Projeto exemplo para utilização do Original Connect, nosso OAuth 2.0, em conjunto com as APIs do Open Banking",,0
0,https://github.com/ProjectRogueOne/tpp-reference-client.git,Reference web client demonstrating the Open Banking Read/Write API,,0
0,https://github.com/looorent/ponto-client.git,Java Client for Ponto (Open Banking API).,"open,bank",0
0,https://github.com/alessandramarinho/tf-rendimentus.git,Desafio Safra Rendimentus - Dashboard de Open Banking consumindo uma API. Desenvolvido durante o Talent Fest da Laboratória.,desafio-safra,0
0,https://github.com/mashsubs/OpenBanking.git,Open Banking sandbox,,0
0,https://github.com/wingyi903/OpenBanking.git,Open banking API,,0
0,https://github.com/iam-aki/open-banking.git,Open Banking ,,0
0,https://github.com/rodrigoarias12/OpenBankingArgentinaApi.git,Open Banking Argentina Api,,0
0,https://github.com/thiagodiogo/openopenbanking.git,Open source open banking,,0
0,https://github.com/vanceheredia/OB_Accounts.git,Open Banking ,,0
0,https://github.com/apoorvkvirtusa/programs-transformation-psd2.git,Open Banking,,0
0,https://github.com/millertron/manning-open-banking.git,Banking Application,,0
0,https://github.com/volvofinans/openbanking.git,Volvofinans Open Banking Specifications,,0
0,https://github.com/tatiocloud/openbanking.git,Open Banking API,,0
0,https://github.com/pooja-more-ey/openbank.git,try open banking postman ,,0
0,https://github.com/darshanlsagar/open-banking.git,Open Banking Demo,,0
0,https://github.com/bams/open-ib.git,rural banking core systems,,0
0,https://github.com/patadejaguar/safeosms-openbanking.git,SAFE-OSMS Open Banking,,0
0,https://github.com/axway-apim/open-banking.git,Open Banking APIs,,0
0,https://github.com/OpenBankingToolkit/openbanking-auth.git,Open Banking authentication library,"openbanking,psd2",0
0,https://github.com/dingall99/open-banking.git,Open Banking Fun,,0
0,https://github.com/zonkyio/openbanking-api.git,Zonky Open Banking API,,0
0,https://github.com/gidyon/api-open-banking.git,Open Banking project,,0
0,https://github.com/paganwinter/open-banking-au.git,AU Open Banking Experiments,,0
0,https://github.com/saulwiggin/Inf-Coin.git,Fintech Open Banking Open Portal ,,0
0,https://github.com/archalke/Open_Bank_API_Specs.git,Open Banking API ,,0
0,https://github.com/MJMGP/open-banking-sandbok.git,Open Banking sandbox.,,0
0,https://github.com/pancalex/AU-Open-Banking.git,AU Open Banking,,0
0,https://github.com/klm9/open-banking-platform.git,open-banking-platform,,0
0,https://github.com/muellners/Finscale-Open-Bank.git,Finscale Open Banking,,0
0,https://github.com/MJMGP/open-banking-client.git,Open Banking client.,,0
0,https://github.com/Chris0296/OpenBanking.git,Testing potential of Open Banking APIs,,0
0,https://github.com/kamaudan/OpenBankingApis.git,This is an open banking API program,,0
0,https://github.com/italoag/OpenBankingLiquidExample.git,Open Banking Brasil Liquid Framework Example,,0
0,https://github.com/nelson1987/Open-Banking.git,Projeto Inicial do Open Banking,,0
0,https://github.com/chuk-chuk/wallet.git,🏧open banking stuff,,0
0,https://github.com/Megahack-LINGER/ob-back.git,Open Banking Backend,,0
0,https://github.com/GluuFederation/access-consent-ob.git,Open Banking module,,0
0,https://github.com/leandrou-technology-forward/restapi_server.git,open banking apis,,0
0,https://github.com/openbanking-simulator/ob_api_gateway.git,Open Banking API Gateway,,0
0,https://github.com/BabuGumpu/OpenBankingMicroServices.git,Open Banking Micro Services with Spring Boot,,0
0,https://github.com/alkanen/open-banking.git,An Open Banking API implementation,,0
0,https://github.com/openbanking-simulator/ob_api_transactions.git,Open Banking Transactions API,,0
0,https://github.com/openbanking-simulator/ob_api_accounts.git,Open Banking Accounts API,,0
0,https://github.com/OpenBankingHackathon-Rotmen/votee-backend.git,Votee - Open Banking Hackathon,,0
0,https://github.com/soumyarout/spendictor.git,"Open banking hackathon project, ",,0
0,https://github.com/Prachi481992/transactions.git,open banking api getTransactions,,0
0,https://github.com/Sujay-kumar/ob_assignment.git,open banking assignment,,0
0,https://github.com/MelloCaique/Link_Bank.git,Flutter Open_Banking Project,,0
0,https://github.com/siddharthSharma102/tp_bank.git,Open Banking Platform,,0
0,https://github.com/sbidolach/neon-www.git,Hackathon Open Banking RailsBank,,0
0,https://github.com/sandya-muchharla/p10-bdd.git,Open banking - PISP,,0
0,https://github.com/cristiancoman-iss/ObieAccelerators.git,Open Banking acc,,0
0,https://github.com/Megahack-LINGER/ob-front.git,Open Banking Front,,0
0,https://github.com/mlackman/psd2.git,open banking psd2 hacking,,0
0,https://github.com/openbanking-simulator/ob_api_customer.git,Open Banking Customer API,,0
0,https://github.com/Mukz95/obp-front-end.git,Angular Open Banking Project,,0
0,https://github.com/xxdannilinxx/warbank.git,Aplicação open-banking;,,0
0,https://github.com/MoniqueWarrington/Keep-Accountable.git,Open Banking Hackathon,,0
0,https://github.com/not-a-bank/open-banking-tracker-blog.git,The Open Banking Tracker blog,,0
0,https://github.com/OpenBankingToolkit/openbanking-ui-customization.git,Open Banking UI customization app,,0
0,https://github.com/scottdevereux/openbanking.git,trial of open banking api application,,0
0,https://github.com/fintechblocks/open-banking-auth-sdk-php.git, Open Banking Authorization PHP SDK,,0
0,https://github.com/SecureBankingAccessToolkit/securebanking-openbanking-spring-config.git,The Spring configuration for Open Banking applications within the Secure Banking Toolkit,,0
0,https://github.com/rockettc/cdr_openbanking.git,Consumer Data Right for Open Banking,,0
0,https://github.com/kudabank/openapi-php.git,Kuda open banking API php implementation,,0
0,https://github.com/nigamthebest/openbanking-moneymatters.git,Client App for Nordea Open Banking APIs,,0
0,https://github.com/chatelao/openbanking_apis.git,A list of Open Banking API,,0
0,https://github.com/nelson1987/OpenBanking.git,Geração de Produto para validação de Open Banking,,0
0,https://github.com/kudabank/openapi-csharp.git,Kuda open banking API c# implementation ,,0
0,https://github.com/kaanaktas/openbanking-paymentinitiation.git,Open Banking UK Payment Initiation Module,"go,golang,docker,docker-compose,openbanking,openbanking-api,payment-initiation",0
0,https://github.com/kaanaktas/openbanking-registration.git,Open Banking UK Dynamic Client Registration Module,"golang,go,openbanking,docker,openbanking-api,open,registration,dynamic-registration",0
0,https://github.com/kaanaktas/openbanking-accountinformation.git,Open Banking UK Account Information Module,"openbanking,golang,go,account-information,openbanking-api,docker,docker-compose",0
0,https://github.com/mvrozanti/inob.git,Interface Ncurses para Open Banking,,0
0,https://github.com/Paridhi-Mohindra/oba-docs.git,Documentation for Open Banking Accelerator,,0
0,https://github.com/platformable/platformableobvtool.git,Platformable Open Banking Value Tool,,0
0,https://github.com/garbanv/platformableobvtool.git,Platformable Open Banking Value Tool,,0
0,https://github.com/decodeMe001/alex.git,Alex - the open-banking chatbot,,0
0,https://github.com/msaliusa/edward-professional-planner.git,Capagemini open banking Hackathon challenge ,,0
0,https://github.com/Paridhi-Mohindra/oba-documetation.git,Documentation for Open Banking Accelerator,,0
0,https://github.com/pitzer42/opbk-br-quickstart.git,Open Banking Brazil python client,,0
0,https://github.com/rai-prashanna/better-banking.git,open banking using spring boot ,,0
0,https://github.com/Ezak91/BootBankJS.git,Open Source banking Dashboard - Frontend,,0
0,https://github.com/dannyeuu/original-credit-analysis.git,Banco Original Open Banking Hackathon,"artificial-intelligence,banking,open-banking,python,hackathon",0
0,https://github.com/Paridhi-Mohindra/oba-svc.git,Open Banking Accelerator Specification service,,0
0,https://github.com/ayeola/OpenBankingSystem.git,Mobile banking solution repository is created on 20/08/2015,,0
0,https://github.com/siddharthSharma102/OpenBanking_v1.git,"Open Banking Platform development using Flask, Python, MongoDB.",,0
0,https://github.com/JoeEcob/Blazor-OpenBanking.git,Blazor web app to pull Open Banking data,,0
0,https://github.com/lachlanclulow/OpenBankingSpring.git,Open Banking Spring API using OpenAPITools API Generator ,,0
0,https://github.com/tryflux/open-banking-verification.git,open banking JWKS and JWS verfication,,0
0,https://github.com/dpitkevics/SwedbankOpenBanking.git,WIP: Swedbank Open Banking API wrapper,,0
0,https://github.com/OpenBankingToolkit/openbanking-java-docker.git,Java docker image for open banking,,0
0,https://github.com/windhooked/yapily-sdk-dart.git,Dart SDK generated against the Yapily API. This SDK can be used to connect to Open Banking entities.,,0
0,https://github.com/thlaegler/openbanking.git,Open Banking API stub generator project using Open API specification,,0
0,https://github.com/SergeyProtos/Online-Banking-Spring-MVC-OpenShift.git,Online Banking Spring MVC for OpenShift3 hosting 21.01.2018,,0
0,https://github.com/SecureBankingAccessToolkit/securebanking-openbanking-uk.git,"A repository containing ""common"" Open Banking modules that are used by more than one Secure Banking repository",,0
0,https://github.com/mfidzrin/Create-an-Open-Banking-App-Using-OpenAPIs-and-Spring-Boot.git,Create an Open Banking App Using OpenAPIs and Spring Boot,,0
0,https://github.com/arxidamos/banks_opener.git,Fast opens 4 e-banking websites with pyautogui,,0
0,https://github.com/fgyara/openbanking.rs.git,Open Banking client written in Rust Programming Language.,,0
0,https://github.com/evleite/opencbs-online.git,Online Core Banking Solution for microfinance based upon OpenCBS,,0
0,https://github.com/owen151128/openplatform-sample.git,Republic of Korea Open Banking System sample app,,0
0,https://github.com/Mondido/omniauth-nordea.git,Omniauth strategy for Nordea Open Banking ,"openbanking,nordea,mondido,payments,psd2",0
0,https://github.com/quabenaa/base-one-app.git,Open Source Universal Core Banking application ,,0
0,https://github.com/Malenea/ThisIsBudTest.git,Test for This is Bud open banking,,0
0,https://github.com/DomhnallBoyle/plaid-app.git,"{""Working with Plaid's Open Banking SDK""}",,0
0,https://github.com/antoine-aumjaud/hackathon-sg2017-chatbot.git,Hackathon SG 2017 - Open banking chatbot,,0
0,https://github.com/epogrebnyak/banking.git,Open source guide to banking data,,0
0,https://github.com/vishaldhoke/OBDATAT.git,Open Banking OBTAT to acquire access token,,0
0,https://github.com/bpraviprasad/Wipro--OBP.git,Sample Project for Testing Open Banking API,,0
0,https://github.com/audrincp/dominandooreal.git,Hackathon Open Banking Hacka Lina & Banfico,,0
0,https://github.com/openbanking-simulator/ob_simulator.git,Open Banking Simulator orchestrating all API Services,,0
0,https://github.com/openbanking-simulator/ob_lib_commons.git,Open Banking Library for common utilities,,0
0,https://github.com/kaveenr/docker-ob.git,Docker For WSO2 Open Banking Solution,,0
0,https://github.com/telestoio/oba-testing.git,Open Banking API Integration Automated Testing,,0
0,https://github.com/esehovic89/open-banking-app.git,Create an Open Banking App Using OpenAPIs and Spring Boot,,0
0,https://github.com/isabela-dominguez/API_Project.git,Integrating Open Banking APIs into an application,,0
0,https://github.com/DomhnallBoyle/yapily-app.git,"{""Working with Yapily's Open Banking SDK""}",,0
0,https://github.com/igloooooo/openbanking-broker-portal.git,This is the broker portal for open banking ADR,,0
0,https://github.com/apache/fineract-open-banking-app.git,Repository for reference mobile app for Fineract Open Banking APIs,,0
0,https://github.com/mjbambang/dft_web_openbanking.git,practice for building open banking website as name of MJL,,0
0,https://github.com/realyarilabs/open_banking_workshop.git,Open Banking Workshop and the amazing possibilities for fintech,,0
0,https://github.com/stephencdaly/stephens-openbanking-test.git,Playing around with creating an open banking demo in Go,,0
0,https://github.com/amit-boi/Open-Banking-Israel.git,open banking project by the bank of israel,,0
0,https://github.com/DMeechan/NBS-Open-Banking-Example.git,Getting started with the Open Banking API with Nationwide,,0
0,https://github.com/webmaxru/openbanking-nodejs-sdk.git,A NodeJS SDK to help implementing the Open Banking standard,"openbanking,open-banking,sdk,nodejs-sdk",0
0,https://github.com/ramdasmv/onebank.git,One Bank is an open Banking API ,,0
0,https://github.com/roksela/openbanking-payment-client.git,Python Client for Open Banking Payment Initiation API,"openbanking,swagger,payments,python",0
0,https://github.com/tim-m-robinson/open_banking_api_stubs.git,Test stubs for Open Banking Api v1.0.0 ,,0
0,https://github.com/souzamarcos/open-banking-brazil-participants.git,Página para exibição simplificada dos participantes do Open Banking Brasil,,0
0,https://github.com/DMeechan/NBS-Open-Banking-Hackathon.git,Nationwide Open Banking API Hackathon Team - OB1-NEM-OB,,0
0,https://github.com/qcastel/forgerock-openbanking-demo-config.git,The configuration of the Open Banking ForgeRock Demo,,0
0,https://github.com/SecureBankingAccessToolkit/securebanking-openbanking-aspsp.git,A mock bank for the Open Banking Accelerator Toolkit,,0
0,https://github.com/texashedgeem/openbanking_java_sandpit.git,"{""A 'playground' for anything Open Banking and Java related""}",,0
0,https://github.com/baelans/open-banking-api-php-client.git,A PHP client library for accessing Open Banking APIs,,0
0,https://github.com/luankevinferreira/openapi-mock-open-banking.git,A mock serving the open API specification of the open banking of Brazil,,0
0,https://github.com/OpenBankProject/OBP-Hydra-OAuth2.git,"The OBP ""Hola"" App is a Spring Boot application to showcase Berlin Group / UK Open Banking style OAuth2 consent creation and use flows with OBP API and Ory Hydra.",,0
0,https://github.com/SolidCharity/OpenPetraPlugin_BankimportCSV.git,Import bank statements in CSV format (eg. downloaded from online banking website),,0
0,https://github.com/SecureBankingAccessToolkit/securebanking-openbanking-uk-rcs.git,A multi-module maven project providing a Remote Consent Service for the UK Open Banking facility within the Secure Banking Toolkit,,0
0,https://github.com/eumagnun/openbanking-aggregator.git,Simple Demo based on Open Banking Brasil API´s. For demonstration purposes only.,,0
0,https://github.com/BrownKnight/OpenWallet-api.git,Backend services for OpenWallet - a simple money management app utilising Open Banking to help you take control of your finances,,0
0,https://github.com/ScraperDev/open-banking-protocol-backend.git,Building a Django API that loosely conforms to the Open Banking Protocol,,0
0,https://github.com/robmckinnon/open_banking_ex.git,Elixir helper functions for using the UK Open Banking API standard,,0
0,https://github.com/philratcliffe/openbanking_atm_project.git,Using the Open Banking API to grab and display ATM data,,0
0,https://github.com/sebzy/Open-banking-app.git,Login and checking transactions on banks on the Open banking API,,0
0,https://github.com/akash75gupta/open-banking-account-aggregation.git,Open Banking Ecosystem - India Chapter - RBI Directive | Account Aggregation APIs using Spring Boot,,0
0,https://github.com/SecureBankingAccessToolkit/securebanking-openbanking-uk-rs.git,"A multi-module maven project providing a UK Open Banking Resource Server, including a bank simulator",,0
0,https://github.com/Crazy-Horse/open-banking-app.git,This project will create a backend banking API using Spring Boot and Open API,,0
0,https://github.com/sebzy/Open-banking-app.git,Login and checking transactions on banks on the Open banking API,,0
0,https://github.com/gilbertotcc/intesasanpaolo-openbanking-client.git,[Draft of] Java client to use Intesa Sanpaolo Open Banking API.,openbanking,0
0,https://github.com/RajKumarUpadhyay/BankingService.git,"Banking Service for open account, transfer money etc",,0
0,https://github.com/christian-brindley/node-tpp.git,Demonstration web app for Open Banking TPP implementation,,0
0,https://github.com/marclweimer/PlaidCaseStudy.git,An overview of Plaid and its impact on open banking.,,0
0,https://github.com/trustmub/obs_django.git,Django Version of the Open Banking System OBS,,0
0,https://github.com/migli/pyOBP.git,A python wrapper for the Open Banking Project API,,0
0,https://github.com/dancochran/moolahweb.git,Angular 5 / Bootstrap 4 frontend for open banking services,,0
0,https://github.com/bad-gal/banking_app_java.git,LiveProject - Create an open banking app using OpenAPIs and SpringBoot,,0
0,https://github.com/open-banking/offers.git,Open Banking Offers API built on top of light-4j,"openapi3,light-4j,open-banking,offers",0
0,https://github.com/danieljoris/SicoobWrapperApi-v1.git,Biblioteca em C# que encapsula a API Sicoob | Open Banking.,,0
0,https://github.com/WilliamMayor/ob.git,A Python client for the Open Banking UK API,,0
0,https://github.com/GewoonMaarten/StashDash.git,Proof Of Concept for an open banking dashboard 💶 ,"openbanking,springboot,angular",0
0,https://github.com/open-banking/statements.git,Open Banking Statements API built on top of light-4j,"openapi3,open-banking,light-4j,statements",0
0,https://github.com/jminthorne/api_mgmt.git,Use Fuse and 3scale with Open Banking APIs,,0
0,https://github.com/KBPsystem777/banking_app.git,tryna build an open source fullstack banking app,,0
0,https://github.com/botx/101.git,"Open-source handbook on economics, finance, central banking, and more.","economics,finance,central-banking",0
0,https://github.com/ricardoschullerSL/atm-branch-finder.git,Home made client side implementation of Open Banking API,,0
0,https://github.com/scttech/pibank.git,An open source real-time core banking platform in python,,0
0,https://github.com/cyberphone/swedbank-psd2-saturn.git,Enhanced Open Banking/PSD2 APIs for Mobile Payments,,0
0,https://github.com/randomk/obk-application.git,Simple banking application to Open Bank account and process payments,,0
0,https://github.com/tleed5/up-hack-api.git,Mess around api using Up Banks open banking api,,0
