,Url,Description,Topics,Stars
256,https://github.com/nstack/nstack.git,"Type-safe, composable microservices for data analytics","microservices,serverless,type-safe,composition,dsl,haskell,containers,data-analysis,python",219
257,https://github.com/kubernetes-retired/kubedash.git,[EOL] Analytics dashboard for Kubernetes,,218
258,https://github.com/microsoft/clarity.git,A behavioral analytics library that uses dom mutations and user interactions to generate aggregated insights.,"clarity,session-replay,heatmap",218
259,https://github.com/leandromineti/ml-feynman-experience.git,A collection of analytics methods implemented with Python on Google Colab,"notebook,python,machine-learning,statistics,numpy,scipy",217
260,https://github.com/ScreamZ/vue-analytics.git,Google Universal Analytics support in Vue.js,"vue,google-analytics,vue-analytics,vuejs,vuejs2",215
261,https://github.com/open-source-labs/SeeQR.git,A database analytic tool that allows a developer to compare the efficiency of different schemas and queries on a granular level to make better informed architectural decisions regarding SQL databases at various scales.,,215
262,https://github.com/GeostatsGuy/GeostatsPy.git,"GeostatsPy Python package for spatial data analytics and geostatistics. Mostly a reimplementation of GSLIB, Geostatistical Library (Deutsch and Journel, 1992) in Python. Geostatistics in a Python package. I hope this resources is helpful, Prof. Michael Pyrcz ","geostatistics,statistics,spatial,dataanalytics,modeling",214
263,https://github.com/okgrow/analytics.git,"UNMAINTAINED! - Complete Google Analytics, Mixpanel, KISSmetrics (and more) integration for Meteor","javascript,meteor,analytics,google-analytics,segment,kissmetrics,mixpanel",212
264,https://github.com/qminer/qminer.git,Analytic platform for real-time large-scale streams containing structured and unstructured data.,"machine-learning,data-mining,text-mining,signal-processing,javascript,cpp",209
265,https://github.com/Tatvic/RGoogleAnalytics.git,R Library to easily extract data from the Google Analytics API into R,,208
266,https://github.com/evollu/react-native-firebase-analytics.git,React native bridge for firebase analytics,,207
267,https://github.com/segmentio/analytics-react-native.git,The hassle-free way to add analytics to your React-Native app.,,207
268,https://github.com/harshalbenake/hbworkspace2-100.git,"(1) Name :- ActionBarSearchView Description :- Action bar search view.  (2) Name :- Adsfree Description :- Admob integration.  (3) Name :- AndroidDayDreamDemo Description :- Day dream demo.  (4) Name :- android query demo live Description :- Google play live app details parsing.  (5) Name :- Arc GIS map Description :- Arc gis map integration without hash key.  (6) Name :- aviarySdk Description :- Aviary integration for image operations.  (7) Name :- BetterGestureDetector Description :- Gesture accrate detection.  (8) Name :- BlinkText Description :- Blinking text.  (9) Name :- BuzzBoxSDKHelloWorld Description :- Buzz box integration cron scheduler.  (10) Name :- CircularProgressBar Description :- Circular progress bar.  (11) Name :- ContactNumbersDemo Description :- Get contact details from device.  (12) Name :- ControlViewheight Description :- Manage height of specific view.  (13) Name :- ControlViewHeightSeekbar Description :- Two listview manage appropriate hieght.  (14) Name :- DownloadManagerAndroid Description :- Download specific file online.  (15) Name :- Facebook Integration Description :- Facebook integration.  (16) Name :- Graphview Description :- Graphview demo.  (17) Name :- HB 1337 Description :- Virus and antivirus.  (18) Name :- HomeButtonEvent Description :- Block home button press.  (19) Name :- HomeLauncher Description :- Home launcher demo.  (20) Name :- InAppPurchaseTut Description :- InAppPurchase demo.  (21) Name :- KeyboardCustom Description :- Creating Custom keyboard demo.  (22) Name :- MapDemoGeofencing Description :- Location map for geo fencing.  (23) Name :- MapDemoV2Final Description :- Map demo for google version 2.  (24) Name :- OpenGLESSquare Description :- Opengl moving square.  (25) Name :- pagination numbering 2 Description :- Pagination type 2.  (26) Name :- Pagination numbering Description :- Pagination type 1.  (27) Name :- PhoneGapCordova Description :- Phone gap simple cordova demo.  (28) Name :- PhoneGapCordovaCamera Description :- Phone gap for camera.  (29) Name :- PhoneGapCordovaParsing Description :- Phone gap for parsing.  (30) Name :- PhoneGapCordovaSMS Description :- Phone gap for sending sms.  (31) Name :- RotatingWheel Description :- Rotating wheel by user interaction.  (32) Name :- RotatingWheelSocialsites Description :- Rotating wheel by user interaction for socialsites.  (33) Name :- RunningBackgroundServices Description :- Get Running services in background for package name/class name.  (34) Name :- SearchList Description :- Searching from a specific list.  (35) Name :- SearchViewContacts Description :- Search from contacts details.  (36) Name :- SlidingDrawer Description :- Sliding drawer from bottom over another activity.  (37) Name :- SpeechToTextDemo Description :- Convert speech to text.  (38) Name :- TextToSpeak Description :- Convert text to speech.  (39) Name :- TouchCordinates Description :- Get coordinate of user touch intergration.  (40) Name :- TreeViewListDemo Description :- Tree view integration demo.  (41) Name :- UninstallDeleteapp Description :- Uninstall another app from my app after removing admin permission.  (42) Name :- ViewPagerCustomWidthFragment Description :- Fragment in viewpager.  (43) Name :- WearableNotification Description :- Wearable notification.  (44) Name :- WearablePages Description :- Wearable pages.  (45) Name :- WidgetDemo Description :- Widget demo.  (46) Name :- CameraIntentAll Description :- Camera demo for picture as well as video demo.  (47) Name :- CameraOverlay Description :- Camera overlay image as aim shooting game.  (48) Name :- DrmIntegration Description :- Drm Integration library for authorize users apk file.  (49) Name :- SwipeRefreshLayout Description :- SwipeRefreshLayout Pulltorefresh like google.  (50) Name :- TwitterIntegration Description :- Twitter Integration.  (51) Name :- CameraADev Description :- Custom Camera for picture as well as video capture from android developer.  (52) Name :- DataBaseSQLiteCRUD Description :- Simple SQLite CRUD funtions for contact database.  (53) Name :- DataBaseSQLiteDBUtility Description :- Simple SQLite DBUtility all files and basic operations.  (54) Name :- CustomDropdownMenu Description :- Custom Dropdown/Poup Menu.  (55) Name :- CalenderSimpleView Description :- Simple calender view as well as timestamp using calender class.  (56) Name :- CalendarProviderADevIntent Description :- Calender provider Intent from android developer.  (57) Name :- AnimationTextViewAnimateLayoutChanges Description :- Animation of adding view inside another view using animatelayoutchanges.  (58) Name :- DragnDropLowVersion Description :- Drag n drop funtionality for low version.  (59) Name :- GoogleWalletAdev Description :- Google Wallet Integration from android developer.  (60) Name :- AndroidShootingGame Description :- Android Shooting Game without opengl.  (61) Name :- ViewPagerAnimation Description :- ViewPager page transformation for pages like alpha,scaling,rotation.  (62) Name :- GoogleCloudWirelessPrintingIntent Description :- Google cloud wireless printing integration from google developer.  (63) Name :- Barcode_or_QRCode_Scanner_openurl Description :- Barcord/QR code scanner from google play and open result url in browser.  (64) Name :- MSServerListSyncSample Description :- List Sync Sample using MS Server.  (65) Name :- SlidingMenuAPI Description :- Sliding Menu jeremyfeinstein library like facebook,gmail,etc.  (66) Name :- GCMIntegration Description :- Google cloud messageing integration for notification.  (67) Name :- NoiseAlert Description :- Detect noise or blow sound.  (68) Name :- GregorianCalendar Description :- Basic Gregorian Calendar information.  (69) Name :- getVariableName Description :- Get name of the variable not its value.  (70) Name :- GoogleAnalyticsV4Adev Description :- Google analytics integration V4.  (71) Name :- FlipboardAnimationAdev Description :- Animation like Flipboard.  (72) Name :- Html5Camera Description :- Camera in Html5 without phonegap.  (73) Name :- CopyPasteClipboard Description :- Copy & Paste Clipboard textual data.  (74) Name :- AndroidPhpMysql Description :- Php and Mysql data parsing in android.  (75) Name :- SpellChecker Description :- Check spelling and give appropriate suggestion for enter text.  (76) Name :- PdfReader Description :- Read pdf file.Barcode/QR code scanner.  (77) Name :- BarcodeQRcodeIntegration Description :- Barcode/QR code scanner using ZbarScanner lib and also Zxing lib without intent.  (78) Name :- InstagramIntegrationApi Description :- Instagram Integration using sample demo.  (79) Name :- Logger Description :- Read logger/logcat using api.  (80) Name :- SmsControl Description :- Control device via sms codes.  (81) Name :- EncryptDecryptString Description :- Encrypt string and Decrypt the same string.  (82) Name :- FloatingActionButton Description :- Floating Action Button.  (83) Name :- DownloadAndUnzipFile Description :- Download And Unzip File.  (84) Name :- MoPubAd Description :- MoPub Ad Banner integration .  (85) Name :- ListViewParsingDB_AndroidStudio Description :- ListView Parsing in android studio.  (86) Name :- CustomCamera_AS Description :- Custom Camera using surfaceview.  (87) Name :- ResizeableBox_AS Description :- Resizeable Box like crop.  (88) Name :- AudioRecorder_AS Description :- Audio Recorder.  (89) Name :- DateAndTimePicker_AS Description :- Date And Time Picker.  (90) Name :- CustomActionBar_AS Description :- Simple Custom ActionBar.  (91) Name :- CustomSpinner_AS Description :- Custom Spinner with default text item.  (92) Name :- SendEmail_AS Description :- Send email in background after authentication.  (93) Name :- GoogleAnalytics_AS Description :- GoogleAnalytics integration demo for crash and screen.  (94) Name :- BroadcastReciever_AS Description :- Broadcast Reciever for sms ,call and boot receiver.  (95) Name :- Azure Description :- Azure storage gsi credentials zip dowload.  (96) Name :- InAppPurchase_AS Description :- In App Purchase simple demo.  (97) Name :- iOS_Listview Description :- Simple Listview in ios.  (98) Name :- iOS_Database Description :- Sqlite Database in ios.  (99) Name :- MessangerList_AS Description :- Messanger Listview UI send and recieve.  (100) Name :- FindingFriend_AS Geofencing for enter and exit another pin.",,207
269,https://github.com/rahuljoshi44/GraphVega.git,Open Source Options Analytics Platform.,"options,options-trading,options-pricing,volatility,stocks,stock-market,data-visualization",205
270,https://github.com/qonversion/qonversion-ios-sdk.git,"iOS SDK for cross-platform in-app purchase and subscription infrastructure, revenue analytics, engagement automation, and integrations","purchases,trials,ios-subscription,storekit,in-app-purchase,in-app-receipt,in-app-purchases,receipt-validation,subscriptions,purchase",203
271,https://github.com/googleanalytics/google-analytics-super-proxy.git,Publicly share your Google Analytics reporting data.,,201
272,https://github.com/dbs-leipzig/gradoop.git,Distributed Graph Analytics with Apache Flink,"graph,property-graph,distributed-graph-analytics,apache-flink,graph-mining,pattern-matching",200
273,https://github.com/julianYaman/discord-bot-dashboard.git,ðŸ“Š A tool for Discord.js Bot Developers to get detailed analytics of their bots and to manage them.,"discord,discord-js,discord-bot-dashboard,nodejs,bot,hacktoberfest",200
274,https://github.com/StephenOTT/GitHub-Analytics.git,GitHub Issues Tracker reporting and analytics (Project Management Reporting and Analytics),,199
275,https://github.com/EvanBacon/expo-native-firebase.git,"ðŸ”¥ Native Firebase Expo App (iOS, Android) Demo for Firestore, Notifications, Analytics, Storage, Messaging, Database  ðŸš¨","firebase,react-native,expo,android,ios,objective-c,java,es6,javascript,template,boilerplate,social-network,quickstart,tutorial,reactjs,example-app,cross-platform,app,react-navigation,firebase-database",197
276,https://github.com/GoogleChromeLabs/web-vitals-report.git,Measure and report on your Web Vitals data in Google Analytics,,195
277,https://github.com/Azure/azure-stream-analytics.git,Azure Stream Analytics,,192
278,https://github.com/DUanalytics/pyAnalytics.git,This repository for Teaching Analytics using Python Programming,,191
279,https://github.com/yahoo/Oak.git,A Scalable Concurrent Key-Value Map for Big Data Analytics,,188
280,https://github.com/oslabs-beta/PostQL.git,Web app to visualize your GraphQL metrics and provide historical analytics,,188
281,https://github.com/ncb000gt/node-googleanalytics.git,Google Analytics data exporting library for NodeJS,,187
282,https://github.com/joola/joola.git,Data middleware for building custom analytics applications.,,186
283,https://github.com/almarklein/mypaas.git,"Run your own PaaS using Docker, Traefik, and great analytics","docker,traefik,analytics,paas",185
284,https://github.com/tirthajyoti/Web-Database-Analytics.git,Web scrapping and related analytics using Python tools,"analytics,python,sqlite3,xml-parser,json,json-parser,sql,web-scraping,beautifulsoup4,database,regular-expression,nlp,natural-language-processing,data-science,data-wrangling",182
285,https://github.com/googlearchive/chrome-platform-analytics.git,Chrome Platform Analytics is a JavaScript library that supports the use of Google Analytics (GA) in Chrome Platform Applications and Extensions.,,182
286,https://github.com/hyj1991/v8-analytics.git,"{""v8 engine's cpu & heap-memory analytics""}","v8-profiler,bailout,bailout-reason,heap-memory,heap-memory-analytics,cpu,cpu-profiler,analytics",181
287,https://github.com/GoogleWebComponents/google-analytics.git,Google Analytics web components,,180
288,https://github.com/Qihoo360/XSQL.git,Unified SQL Analytics Engine Based on SparkSQL,"sql,spark,hive,datasource,elasticsearch,federation",180
289,https://github.com/skardhamar/rga.git,R Google Analytics,,179
290,https://github.com/segmentio/analytics-python.git,The hassle-free way to integrate analytics into any python application. ,,179
291,https://github.com/keenlabs/keen-gem.git,Official Ruby client for the Keen IO API. Build analytics features directly into your Ruby apps.,,179
292,https://github.com/tomdyson/wagalytics.git,A Google Analytics dashboard in your Wagtail admin,"wagtail,google-analytics",178
293,https://github.com/bruth/django-tracking2.git,"django-tracking2 tracks the length of time visitors and registered users spend on your site. Although this will work for websites, this is more applicable to web _applications_ with registered users. This does not replace (nor intend) to replace client-side analytics which is great for understanding aggregate flow of page views.","django,tracking,visitor",178
294,https://github.com/AmazingDreams/vue-matomo.git,Vue plugin for Piwik / Matomo Analytics,"vue,piwik,analytics,matomo",177
295,https://github.com/Uniswap/uniswap-info.git,â„¹ï¸ Uniswap analytics.,,176
296,https://github.com/robcowart/synesis_lite_suricata.git,Suricata IDS/IPS log analytics using the Elastic Stack.,"suricata,elasticsearch,logstash,kibana,filebeat,log-analytics,elk",175
297,https://github.com/invisibleroads/analytical-tutorials.git,Tutorials for writing analytical scripts,,175
298,https://github.com/mujx/hakatime.git,Wakatime server implementation & analytics dashboard,"wakatime-dashboard,wakatime-server,servant,mithriljs,self-hosted,wakatime",174
299,https://github.com/byukan/Marketing-Data-Science.git,"Analytics and data science business case studies to identify opportunities and inform decisions about products and features.  Topics include Markov chains, A/B testing, customer segmentation, and machine learning models (logistic regression, support vector machines, and quadratic discriminant analysis).",,174
300,https://github.com/DUanalytics/rAnalytics.git,Analytics in R ,,173
301,https://github.com/hendrikschneider/jekyll-analytics.git,"Plugin to easily add webanalytics to your jekyll site. Currently Google Analytics, Piwik and mPulse are supported.","jekyll-plugin,analytics,jekyll",173
302,https://github.com/waterlink/Challenge-Build-Your-Own-Array-In-Js.git,"This is a challenge that will allow you to practice your logical, analytical and problem-solving skills. Additionally, by the end of it youâ€™ll have much better command of arrays in javascript.","javascript,vanilla-js,challenge",173
303,https://github.com/awslabs/aws-centralized-logging.git,"The Centralized Logging solution enables organizations to collect, analyze, and display logs on AWS across multiple accounts and AWS Regions. The solution uses Amazon Elasticsearch Service (Amazon ES), a managed service that simplifies the deployment, operation, and scaling of Elasticsearch clusters in the AWS Cloud, as well as Kibana, an analytics and visualization platform that is integrated with Amazon ES. In combination with other AWS managed services, this solution offers customers a customizable, multi-account environment to begin logging and analyzing their AWS environment and applications.",,173
304,https://github.com/Azure/ibex-dashboard.git,Custom Analytics Dashboard for Microsoft Bot Framework and other applications as well,"application-insights,dashboard,insights-service,azure,ibex-dashboard,bot-framework",171
305,https://github.com/d0z0/redis_analytics.git,Web analytics for your rails apps using Redis,,171
306,https://github.com/srom/easyAB.git,âš ï¸ Unmaintained âš ï¸ | A jQuery plugin for easily setting up A/B tests using Google Analytics.,,171
307,https://github.com/vectorengine/vectorsql.git,"VectorSQL is a free analytics DBMS for IoT & Big Data, compatible with ClickHouse.","olap,clickhouse,pipeline,reactive,stream-processing,distributed-database,column-store,iot",171
308,https://github.com/clintecker/django-google-analytics.git,A simple django application to using Google Analytics in your project and tying different GA tags to different sites,,170
309,https://github.com/laresbernardo/lares.git,R Library for Analytics and Machine Learning,"r,machine-learning,automation,analytics,visualization",168
310,https://github.com/infochimps-labs/big_data_for_chimps.git,A Seriously Fun guide to Big Data Analytics in Practice,,168
311,https://github.com/rogchap/Titanium-Google-Analytics.git,Example Titanium project that uses Google Analytics to track page views,,168
312,https://github.com/MSRCCS/Prajna.git,Prajna: A Distributed Functional Programming Platform for Interactive Big Data Analytics and Cloud Service Building,,168
313,https://github.com/erebusnz/gapi-google-analytics-php-interface.git,GA:PI() - Google Analytics PHP Interface,,167
314,https://github.com/Countly/countly-sdk-web.git,Countly Product Analytics SDK for websites and web applications,"javascript,countly-server,sdk,analytics,web,analytics-server,web-analytics,data-analytics,data-analysis,data-visualization",167
315,https://github.com/seanmiller802/BrowserTime.git,open source browser history page with analytics,"chrome-extensions,react,javascript,open-source,material-ui,browser",166
316,https://github.com/dart-code-checker/dart-code-metrics.git,Software analytics tool that helps developers analyse and improve software quality.,"dart,dartlang,codeclimate,analysis,analyzer,cli,tool,flutter,antipatterns,analyzer-plugin,metrics,quality,code-metrics,anti-patterns",166
317,https://github.com/sassoftware/sas_kernel.git,A Jupyter kernel for SAS. This opens up all the data manipulation and analytics capabilities of your SAS system within a notebook interface.  Use the Jupyter Notebook interface to execute SAS code and view results inline.,,166
318,https://github.com/projectwallace/css-analyzer.git,Analytics for CSS,"css,analyzer,statistics,stats,wallace,css-analyzer,projectwallace,audit,cssstats,complexity",164
319,https://github.com/microsoft/Microsoft-Rocket-Video-Analytics-Platform.git,A highly extensible software stack to empower everyone to build practical real-world live video analytics applications for object detection and counting with cutting edge machine learning algorithms.,"video-analytics,edge-computing,dotnet-core,docker,object-detection,tensorflow,azure,yolov3,counting,gpu",164
320,https://github.com/matomo-org/matomo-log-analytics.git,Import any kind of server logs in Matomo for powerful log analytics. Universal log file parsing and reporting.,,162
321,https://github.com/ArcadeData/arcadeanalytics.git,"Arcade Analytics is the first Open Source Graph Analytics platform. Connect your Graph Database (Neo4j, OrientDB, Amazon Neptune, Microsoft CosmosDB, etc) and RDBMS (Oracle, MySQL, Postgres, Microsoft SQLServer, MariaDB) to create powerful dashboards.","graphdb,analytics,graph-analytics,dashboards,widgets,charts",162
322,https://github.com/dataunlocker/save-analytics-from-content-blockers.git,A proxy back end for Google Tag Manager & Google Analytics,"analytics,analytics-tracking,google-analytics,google-analytics-javascript,medium-article,content-blockers,ad-blocker,ad-block,proxied-analytics",161
323,https://github.com/simagix/keyhole.git,Survey Your Mongo Land - MongoDB Performance Analytics,"mongodb,golang,grafana,performance-analysis,docker,ftdc,atlas",158
324,https://github.com/goshakkk/sleek.git,Doing Analytics in Ruby.,,158
325,https://github.com/debrouwere/google-analytics.git,A command-line interface and Python API wrapper for Google Analytics.,,157
326,https://github.com/Datamart/Komito.git,"ðŸ”– Komito Analytics is a free, open-source enhancement for the most popular web analytics software.","javascript,analytics,google-analytics,event-tracking,adobe-analytics,clicktale,baidu-analytics,media-tracking,komito-analytics",156
327,https://github.com/mvelazc0/Oriana.git,"Oriana is a threat hunting tool that leverages a subset of Windows events to build relationships, calculate totals and run analytics. The results are presented in a Web layer to help defenders identify outliers and suspicious behavior on corporate environments.","threat-hunting,incident-response,dfir",155
328,https://github.com/thepacketgeek/cloud-pcap.git,Web PCAP storage and analytics,,154
329,https://github.com/repo-analytics/repo-analytics.github.io.git,Thorough analytics for your GitHub repos,,154
330,https://github.com/hortonworks/streamline.git,StreamLine - Streaming Analytics ,"streaming,real-time,storm,spark-streaming,kafka,kafka-streams,flink",153
331,https://github.com/yahoo/fili.git,Easily make RESTful web services for time series reporting with Big Data analytics engines like Druid and SQL Databases.,"fili,analytics,druid,featured,webservice,restful-api,big-data,web",153
332,https://github.com/coral-streaming/coral.git,"Coral is a real-time analytics and data science platform. It transforms streaming events and extract patterns from data via RESTful APIs. Built on Scala, Akka, Cassandra and Spray.",,150
333,https://github.com/brightics/studio.git,Component based analytics studio on the web browser,,149
334,https://github.com/plausible/hosting.git,Example docker-compose setups for hosting Plausible Analytics,,149
335,https://github.com/segmentio/typewriter.git,Type safety + intellisense for your Segment analytics,"analytics,segment,typescript,mobile,web,nodejs,segment-protocols,ios",149
336,https://github.com/Sotera/distributed-graph-analytics.git,"Distributed Graph Analytics (DGA) is a compendium of graph analytics written for Bulk-Synchronous-Parallel (BSP) processing frameworks such as Giraph and GraphX. The analytics included are High Betweenness Set Extraction, Weakly Connected Components, Page Rank, Leaf Compression, and Louvain Modularity.",,149
337,https://github.com/OSBI/saiku-ui.git,A user interface for the Saiku analytical tool,,147
338,https://github.com/wa0x6e/ResqueBoard.git,ResqueBoard is an analytics software for PHP Resque. Monitor your workers health and job activities in realtime,,146
339,https://github.com/segmentio/analytics-react.git,[DEPRECATED AND UNSUPPORTED] The hassle-free way to integrate analytics into your React application.,"segment,react,create-react-app,analytics,react-boilerplate,quickstart",146
340,https://github.com/git-insights/git-insights.git,Git Insights is an analytics tool to give you insights on your software projects and teams.,,146
341,https://github.com/durul/The-Ultimate-List-of-App-Development.git,App Analytics and App Marketing Tools,,145
342,https://github.com/PyDataBlog/Python-for-Data-Science.git,A blog for data analytics using data science technologies,"python,finance,data-science",145
343,https://github.com/GoogleCloudPlatform/tensorflow-recommendation-wals.git,"An end-to-end solution for website article recommendations based on Google Analytics data.  Uses WALS matrix-factorization in TensorFlow, trained on Cloud ML Engine.  Recommendations served with App Engine Flex and Cloud Endpoints.  Orchestration is performed using Airflow on Cloud Composer.  See the solution tutorials at:",,145
344,https://github.com/octonion/soccer.git,Soccer analytics,,144
345,https://github.com/VojtaStavik/Trackable.git,Trackable is a simple analytics integration helper library. Itâ€™s especially designed for easy and comfortable integration with existing projects.,"swift,analytics,helper",143
346,https://github.com/josephernest/TinyAnalytics.git,"TinyAnalytics is a lightweight analytics tool (unique visitors count, etc.)",,142
347,https://github.com/matomo-org/matomo-php-tracker.git,PHP Client for Matomo Analytics Tracking API,"matomo,php-client,php",141
