,Url,Description,Topics,Stars
0,https://github.com/cayleygraph/cayley.git,An open-source graph database,"graph,graph-database,cayley,go,linked-data",13811
0,https://github.com/amark/gun.git,An open source cybersecurity protocol for syncing decentralized graph data.,"machine-learning,artificial-intelligence,big-data,blockchain,p2p,peer-to-peer,decentralized,graph,cryptography,crypto,offline-first,realtime,iot,crdt,protocol,database,end-to-end,encryption,dweb,dapp",12898
0,https://github.com/vesoft-inc/nebula.git,"  A distributed, fast open-source graph database featuring horizontal scalability and high availability","graph-database,distributed,database,graphdb,raft,cpp,nebula-graph,nebula,graph,nebulagraph",6184
0,https://github.com/jagenjo/webglstudio.js.git,"A full open source 3D graphics editor in the browser, with scene editor, coding pad, graph editor, virtual file system, and many features more.","3d,webgl,editor,graph-editor,scene-graph,webtool,webapp,rendering,shaders",4348
0,https://github.com/gephi/gephi.git,Gephi - The Open Graph Viz Platform,"graph,visualization,opengl,interactive,graph-analytics",4315
0,https://github.com/orientechnologies/orientdb.git,"OrientDB is the most versatile DBMS supporting Graph, Document, Reactive, Full-Text, Geospatial and Key-Value models in one Multi-Model product. OrientDB can run distributed (Multi-Master), supports SQL, ACID Transactions, Full-Text indexing and Reactive Queries. OrientDB Community Edition is Open Source using a liberal Apache 2 license.","orientdb,graph-database,document-database,dbms,nosql,graph-store,multi-master,multi-model-dbms,database,performance,fast,sql",4296
0,https://github.com/JanusGraph/janusgraph.git,"JanusGraph: an open-source, distributed graph database","graph-database,tinkerpop,gremlin,hbase,cassandra,elasticsearch,solr,bigtable,graphdb,graph",3965
0,https://github.com/AutoFixture/AutoFixture.git,"{""AutoFixture is an open source library for .NET designed to minimize the 'Arrange' phase of your unit tests in order to maximize maintainability. Its primary goal is to allow developers to focus on what is being tested rather than how to setup the test scenario, by making it easier to create object graphs containing test data.""}",,2281
0,https://github.com/NatronGitHub/Natron.git,Open-source compositing software. Node-graph based. Similar in functionalities to Adobe After Effects and Nuke by The Foundry.,,2046
0,https://github.com/vercel/og-image.git,"Open Graph Image as a Service - generate cards for Twitter, Facebook, Slack, etc","open-graph,image,generator,image-generator,twitter-cards,vercel",1969
0,https://github.com/MrKepzie/Natron.git,Open-source compositing software. Node-graph based. Similar in functionalities to Adobe After Effects and Nuke by The Foundry.,"c-plus-plus,vfx,cross-platform,openfx",1451
0,https://github.com/tschellenbach/Django-facebook.git,Facebook open graph api implementation using the Django web framework in python,,1423
0,https://github.com/microlinkhq/metascraper.git,"Scrape data from websites using Open Graph, HTML metadata & fallbacks.","metadata,scrape,parse",1318
0,https://github.com/terminusdb/terminusdb.git,Open source graph database and document store. Designed for collaboratively building data-intensive applications and knowledge graphs.,"prolog,knowledge-graphs,linked-data,graph-database,json-ld,terminusdb,database,collaboration,revision-control,immutable",1313
0,https://github.com/benedekrozemberczki/karateclub.git,Karate Club: An API Oriented Open-source Python Framework for Unsupervised Learning on Graphs (CIKM 2020),"community-detection,graph-clustering,deepwalk,networkx,louvain,network-science,machine-learning,unsupervised-learning,gcn,node2vec,graph2vec,supervised-learning,sklearn,networkx-graph,scikit,label-propagation,graph-embedding,network-embedding,node-embedding,2vec",1246
0,https://github.com/itteco/iframely.git,"oEmbed proxy. Supports over 1800 domains via custom parsers, oEmbed, Twitter Cards and Open Graph","embeds,oembed,twitter-cards,open-graph,responsive",1160
0,https://github.com/limccn/Android-Charts.git,"Open-source native Android graph/chart framework includes line chart,stick chart,candlestick chart,pie chart,spider-web chart etc. ",,806
0,https://github.com/Azure-Samples/active-directory-aspnetcore-webapp-openidconnect-v2.git,"An ASP.NET Core Web App which lets sign-in users (including in your org, many orgs, orgs + personal accounts, sovereign clouds) and call Web APIs (including Microsoft Graph)","quickstart,scenario-webapp-signin",710
0,https://github.com/marty-suzuki/URLEmbeddedView.git,URLEmbeddedView automatically caches the object that is confirmed the Open Graph Protocol.,"ogp,embedded,url,thumbnail,swift,carthage,cocoapods,ios,tvos",634
0,https://github.com/opencypher/openCypher.git,Specification of the Cypher property graph query language,"declarative,property,graph,query,language,standard,tck,grammar,cypher,database,specification",542
0,https://github.com/joernio/joern.git,Open-source code analysis platform for C/C++/Java based on code property graphs,"code-analysis,query-language,code-browser,fuzzy-parsing,syntax-tree,dataflow,controlflow",454
0,https://github.com/opensemanticsearch/open-semantic-search.git,"Open Source research tool to search, browse, analyze and explore large document collections by Semantic Search Engine and Open Source Text Mining & Text Analytics platform (Integrates ETL for document processing, OCR for images & PDF, named entity recognition for persons, organizations & locations, metadata management by thesaurus & ontologies, search user interface & search apps for fulltext search, faceted search & knowledge graph)","search,search-engine,search-interface,ocr,ui,python,semantic,skos,thesaurus,ontologies,text-mining,text-analysis,annotation,research-tool,named-entity-recognition,osint,faceted-search,fulltext-search,journalism,investigative-journalism",404
0,https://github.com/withspectrum/micro-open-graph.git,A tiny Node.js microservice to scrape open graph data with joy.,"nodejs,micro,microservices,opengraph,scraper",371
0,https://github.com/vesoft-inc/nebula-graph.git,"A distributed, fast open-source graph database featuring horizontal scalability and high availability","graph-database,distributed-database,distributed-system,nebula-graph,raft,cpp",368
0,https://github.com/nsanta/fbgraph.git,Facebook Open Graph API in Ruby,,328
0,https://github.com/mmangino/mogli.git,Facebook Open Graph Library,,310
0,https://github.com/jzachr/goldenorb.git,"{""GoldenOrb is an open-source implementation of Pregel, Google's graph processing framework""}",,293
0,https://github.com/jshemas/openGraphScraper.git,Node.js scraper service for Open Graph Info and More!,,287
0,https://github.com/e-oj/grabity.git,Generate link previews from pages with Open Graph or Twitter Cards markup. Just grab it! 🎣,"open-graph-protocol,twitter-cards",263
0,https://github.com/robsonvleite/optimizer.git,"Is a compact and easy-to-use tag creator to optimize your site (OnPage SEO de forma fácil e descomplicada, open graph, twitter card, facebook, google plus e outros)",,248
0,https://github.com/PrateekKumarSingh/Graphical.git,"Open-Source, Platform independent module that consumes data points as input and plots them on a 2D graph 📈📊💹 [Scatter / Bar / Line] on the PowerShell Console/Terminal","powershell,core,linux,windows,terminal,terminal-graphics,ascii-art",247
0,https://github.com/niallkennedy/open-graph-protocol-tools.git,Open Graph Protocol validator,,231
0,https://github.com/outmoded/metaphor.git,"Open Graph, Twitter Card, and oEmbed Metadata Collector",,230
0,https://github.com/limccn/Cocoa-Charts.git,"Open-source iPhone/iPad graph/chart framework includes line chart,stick chart,candlestick chart,pie chart,spider-web chart etc. Based on iOS graph SDK, Using native Objective-c Codes",,214
0,https://github.com/finiteloop/socialcookbook.git,"{""A social cookbook based on Facebook's Open Graph""}",,209
0,https://github.com/ogdf/ogdf.git,"This is a release mirror for OGDF, the Open Graph Drawing Framework/Open Graph algorithms and Data structure Framework.",,205
0,https://github.com/jacktuck/unfurl.git,"Metadata scraper with support for oEmbed, Twitter Cards and Open Graph Protocol for Node.js :zap:","ogp,open-graph,oembed,twitter-cards,scraper,metadata,embed,nodejs,slack,unfurl,meta-tags,micro,microservice",198
0,https://github.com/erikriver/opengraph.git,A python module to parse the Open Graph Protocol,"ogp,python",195
0,https://github.com/lanrat/certgraph.git,An open source intelligence tool to crawl the graph of certificate Alternate Names,,175
0,https://github.com/nju-websoft/OpenEA.git,"A Benchmarking Study of Embedding-based Entity Alignment for Knowledge Graphs, VLDB 2020","entity-alignment,knowledge-graph-embedding",171
0,https://github.com/opensemanticsearch/open-semantic-etl.git,"Python based Open Source ETL tools for file crawling, document processing (text extraction, OCR), content analysis (Entity Extraction & Named Entity Recognition) & data enrichment (annotation) pipelines & ingestor to Solr or Elastic search index & linked data graph database","etl,python,ocr,enrichment,enrichment-analysis,solr,elasticsearch,extract,extract-text,extractor,extract-information,rdf,solr-dataimporter,documents,pdf,named-entity-recognition,annotation,ingest,ingests-documents,ingestion-pipeline",167
0,https://github.com/ArcadeData/arcadeanalytics.git,"Arcade Analytics is the first Open Source Graph Analytics platform. Connect your Graph Database (Neo4j, OrientDB, Amazon Neptune, Microsoft CosmosDB, etc) and RDBMS (Oracle, MySQL, Postgres, Microsoft SQLServer, MariaDB) to create powerful dashboards.","graphdb,analytics,graph-analytics,dashboards,widgets,charts",162
0,https://github.com/ziyasal/pyley.git,Python package for an open-source graph database Cayley,"graph-database,cayley,python",150
0,https://github.com/hypergraphdb/hypergraphdb.git,"HyperGraphDB is a general purpose, extensible, portable, distributed, embeddable, open-source data storage mechanism. It is a graph database designed specifically for artificial intelligence and semantic web projects, it can also be used as an embedded object-oriented database for projects of all sizes.",,149
0,https://github.com/niallkennedy/open-graph-protocol-examples.git,Examples of Open Graph protocol markup,,148
0,https://github.com/johndeverall/opengraph-java.git,A Java object representation of the Open Graph protocol for a web page,,135
0,https://github.com/chuckreynolds/social-profile-image-sizes.git,"Social media profile image size reference guide. Open Graph, Twitter Cards, etc.",,119
0,https://github.com/chriskonnertz/open-graph.git,Library that assists in building Open Graph meta tags,"opengraph,open-graph,ogp,php,laravel,metatags,tags,open,graph,seo",114
0,https://github.com/invanalabs/invana-studio.git,Open source knowledge graphs visualiser and editor.,"gremlin,apache-tinkerpop,gremlin-enabled-databases,graph-visualization",111
0,https://github.com/kraison/vivace-graph-v3.git,VivaceGraph version 3. Open source Common Lisp graph database & Prolog implementation. Supersedes http://github.com/kraison/vivace-graph-v2.,,106
0,https://github.com/facebookresearch/opendialkg.git,OpenDialKG: Explainable Conversational Reasoning with Attention-based Walks over Knowledge Graphs,,102
0,https://github.com/quarkslab/qb-sync.git,"{""qb-sync is an open source tool to add some helpful glue between IDA Pro and Windbg. Its core feature is to dynamically synchronize IDA's graph windows with Windbg's position. ""}",,102
0,https://github.com/satoshi-takano/OpenGraph.git,A Swift wrapper for the Open Graph protocol (OGP).,"opengraph,ogp,swift-wrapper",101
0,https://github.com/Azure-Samples/ms-identity-aspnet-webapp-openidconnect.git,"A sample showcasing how to develop a web application that handles sign on via the unified Azure AD and MSA endpoint, so that users can sign in using both their work/school account or Microsoft account. The sample also shows how to use MSAL to obtain a token for invoking the Microsoft Graph, as well as incrementental consent.",,101
0,https://github.com/opensemanticsearch/open-semantic-entity-search-api.git,"Open Source REST API for named entity extraction, named entity linking, named entity disambiguation, recommendation & reconciliation of entities like persons, organizations and places for (semi)automatic semantic tagging & analysis of documents by linked data knowledge graph like SKOS thesaurus, RDF ontology, database(s) or list(s) of names","named-entity-recognition,linked-data,reconciliation,reconciliation-service,disambiguation,python,rest-api,api,linkeddata,semantic,semantic-annotation,semantic-analysis,linked-data-api,nlp,natural-language-processing,knowledge-graph,knowledgebase,entity-extraction,named-entities,thesaurus",100
0,https://github.com/ghorsey/OpenGraph-Net.git,.Net Open Graph Parser written in C#,"opengraph,opengraph-net,ogp,parse,c-sharp,nuget",98
0,https://github.com/shweshi/OpenGraph.git,A Laravel package to fetch Open Graph data of a website.,"opengraph,laravel,metadata-extraction,metadata,opengraph-tags,opengraph-data,laravel-package,laravel-opengraph",94
0,https://github.com/pedroborges/kirby-meta-tags.git,⬢ HTML meta tags generator for Kirby. Supports Open Graph and Twitter Cards out of the box.,"kirby-cms,kirby-plugin,meta-tags,open-graph,twitter-cards",94
0,https://github.com/bxshi/ConMask.git,ConMask model described in paper Open-world Knowledge Graph Completion.,"knowledge-graph-completion,conmask-model,dataset,tensorflow,network-embedding,representation-learning",88
0,https://github.com/minichiello/PyOpenGraph.git,PyOpenGraph is a library written in Python for parsing Open Graph protocol information from web sites.,,84
0,https://github.com/cagrimmett/jekyll-tools.git,"A collection of Liquid templates I made for my Jekyll-powered blog: Adding open graph and Twitter cards, Disqus comments, posts by tag, a heatmap calendar for posts, and a book review template",,84
0,https://github.com/openlink/rdf-editor.git,"The OpenLink Structured Data Editor enables editing of RDF documents (in TURTLE notation) stored in a variety of HTTP accessible documents. Actual document access requires the target document is served from a system that supports at least one of the following open standards: Linked Data Platform (LDP), WebDAV, SPARQL 1.1 Update, or the SPARQL Graph Protocol.","editor,rdf-triples,turtle,n3,ldp",84
0,https://github.com/openweb-nl/open-bank-mark.git,"A bank simulation application using mainly Clojure, which can be used to end-to-end test and show some graphs.","clojure,cljs,graphql,postgresql,kafka,banking-applications,end-to-end-testing,travis-ci,performance-testing,performance-visualization,avro,confluent,confluent-kafka,analytics,docker,docker-compose,confluent-platform",83
0,https://github.com/Orange-OpenSource/nifikop.git,"The NiFiKop NiFi Kubernetes operator makes it easy to run Apache NiFi on Kubernetes. Apache NiFI is a free, open-source solution that support powerful and scalable directed graphs of data routing, transformation, and system mediation logic.","nifi-operator,kubernetes-operator,golang,nifi,kubernetes",78
0,https://github.com/times/axisJS.git,Open source framework for creating simple interactive graphs,,74
0,https://github.com/openwisp/openwisp-network-topology.git,"Network topology collector and visualizer. Collects network topology data from dynamic mesh routing protocols or other popular networking software like OpenVPN, allows to visualize the network graph, save daily snapshots that can be viewed in the future and more.","mesh-networks,netjson,openwisp,network-graph,django,topology,network-visualization,hacktoberfest",72
0,https://github.com/fusonic/opengraph.git,A simple PHP library to read Open Graph data from the web or publish your own resources.,,69
0,https://github.com/theblackcat102/language-models-are-knowledge-graphs-pytorch.git,Language models are open knowledge graphs ( non official implementation ),"language-models,open-knowledge-graphs",69
0,https://github.com/Azure-Samples/active-directory-dotnet-webapp-webapi-multitenant-openidconnect.git,"A sample .NET 4.5 MVC SaaS web app that signs-up and signs-in users from any Azure AD tenant, and calls the Azure AD Graph API.",,67
0,https://github.com/OpenBioLink/OpenBioLink.git,OpenBioLink is a resource and evaluation framework for evaluating link prediction models on heterogeneous biomedical graph data.,,66
0,https://github.com/samholmes/node-open-graph.git,An Open Graph implementation for Node.js.,,65
0,https://github.com/YANG-DB/yang-db.git,"YANGDB Open-source, Scalable, Non-native Graph database (Powered by Elasticsearch)","graph,cypher-query-language,elasticsearch,ontology,search-engine,graphalgorithm,java-8,jooby,scale,distributed,gremlin,knowledge-graph,owl-ontology,rdf-triples,graph-databases",65
0,https://github.com/facebookresearch/SEAL_OGB.git,An open-source implementation of SEAL for link prediction in open graph benchmark (OGB) datasets.,,64
0,https://github.com/macx/SocialMediaEnhancer.git,"WordPress Plugin to enhance your WordPress blog with well formed informations for Facebook, Twitter and Google+ using the Open Graph Protocol (OGP) and sharing functions without the use of external JavaScript.",,64
0,https://github.com/LearnLib/automatalib.git,"A free, open-source Java library for modeling automata, graphs, and transition systems","java,java-library,automata,graph,transition-systems",59
0,https://github.com/nbrgraphs/mro.git,Creating Effective Graphs with Microsoft R Open,,58
0,https://github.com/fiann/jquery.ogp.git,Open Graph Protocol parser in jQuery,,58
0,https://github.com/DerwenAI/exsto.git,"{""Analyze the structure and dynamics of an open source project's developer community, using graph algorithms, etc.""}",,58
0,https://github.com/philipjkim/goreadability.git,"{""Webpage summary extractor using Facebook Open Graph and arc90's readability""}","readability,scraper,opengraph",58
0,https://github.com/reallylongaddress/iPhone-Facebook-Graph-API.git,!!NOTE!!:  this project is no longer maintained.  The official Facebook/iOS SDK can be found here:  https://github.com/facebook/facebook-iphone-sdk This project is an open source Objective-C (iPhone/iPad) library for communciating with the Facebook Graph API,,56
0,https://github.com/rubenrails/acts_as_opengraph.git,"{""ActiveRecord extension that turns your models into Facebook's Open Graph objects.""}",,55
0,https://github.com/tao-pr/vor-knowledge-graph.git, :mortar_board: Open knowledge mining and graph builder,"text-mining,graph-database,word2vec-model",54
0,https://github.com/zkreations/canvas.git,"Base for Blogger, seo, twitter card, open graph, optimization and performance","blogger,disqus,facebook,seo,template,blogger-api",52
0,https://github.com/wireapp/wire-ios-link-preview.git,🏷 Open Graph data parser used to generate link previews,,51
0,https://github.com/nodeca/embedza.git,"Create HTML snippets/embeds from URLs using info from oEmbed, Open Graph, meta tags.",,50
0,https://github.com/Astrotomic/php-open-graph.git,This package provides a fluent PHP OOP builder for Open Graph protocol.,"open-graph,open-graph-protocol,treeware,php-open-graph,twitter,hacktoberfest",49
0,https://github.com/aumuell/open-inventor.git,Open Inventor is an object oriented scene graph library implemented in C++ layered on top of OpenGL. It was originally developed by SGI.,"opengl,sgi,scenegraph,open-inventor",48
0,https://github.com/INK-USC/CPL.git,Collaborative Policy Learning for Open Knowledge Graph Reasoning (EMNLP 2019),,48
0,https://github.com/bugcloud/Customed-s7graphview.git,s7graphview is open source project for draw some graph in iPhone. I costomed it.,,46
0,https://github.com/opensemanticsearch/open-semantic-visual-graph-explorer.git,"Open Semantic Visual Linked Data Graph Explorer: Open Source tool (web app) and user interace (UI) for discovery, exploration and visualization of direct and indirect connections between named entities like persons, organizations, locations & concepts from thesarus or ontologies within your documents and knowledgegraph","linkeddata,visualization,graph,graph-visualization,explorer,exploration,semantic-ui,semantic,ui,user-interface,python,knowledge-discovery,discovery,named-entity-graph,graph-analysis,graph-visualisation,graph-analytics,network-visualization,network-analysis,network-virtualization",46
0,https://github.com/onassar/PHP-MetaParser.git,"PHP library that extracts/parses meta details of an x/html body, including open graph details, meta tags and images.",,45
0,https://github.com/lnshi/node-cayley.git,Node.js client for open-source graph database cayley(https://github.com/cayleygraph/cayley).,"graph-database,cayley,nodejs",44
0,https://github.com/yusttas/jk_opengraph.git,Adds the open graph meta tags to your Prestashop site. Open graph meta tags allow you to control what content shows up when a page is shared on Facebook.,"prestashop,prestashop-1-7,prestashop-free-module,prestashop-module,opengraph,opengraph-tags",41
0,https://github.com/brandontlocke/NERtwork.git,"NERtwork is a collection of scripts to help you create a network graph of co-occurring named entities using open source tools. This is done by using Stanford Named Entity Recognizer to identify named entities in the documents, then using NetworkX to create a bipartite projected network and exporting the node and edge lists for use in network visualization tools.",,40
0,https://github.com/sauravag/slam_karto_gtsam.git,Pose-graph SLAM with Open Karto as Front-end and GTSAM as Backend,,37
0,https://github.com/ngs/middleman-ogp.git,middleman-og is an extension for the Middleman static site generator that adds Open Graph helper.,"middleman,middleman-extension",37
0,https://github.com/linkpreview/linkpreview.git,"Open Graph, Twitter Card, Oembed preview. Shows visual cards that mimic link previews in Social Media like facebook, twitter, vk and other sites that support link preview.","opengraph,twittercard,oembed,react,linkpreview,nodejs,reactjs,redux,cheeriojs,scraping,scraper",37
0,https://github.com/sauravag/slam_karto_g2o.git,A ROS Package for Pose Graph SLAM that uses open_karto for the front end and G2O for backend,,36
0,https://github.com/pedroborges/meta-tags.git,"HTML meta tags generator for PHP. Supports Open Graph, Twitter Cards, and JSON Linked Data out of the box","php,meta-tags,seo,open-graph,twitter-cards,head,json-ld,schema",36
0,https://github.com/IBM/knowledge-enabled-textual-entailment.git,"Natural Language Inference is fundamental to many Natural Language Processing applications such as semantic search and question answering. The task of NLI has gained significant attention in the recent times due to the release of fairly large scale, challenging datasets. Present approaches that address NLI are largely focused on learning based on the given text in order to classify whether the given premise entails, contradicts, or is neutral to the given hypothesis. On the other hand, techniques for Inference, as a central topic in artificial intelligence, has had knowledge bases playing an important role, in particular for formal reasoning tasks. While, there are many open knowledge bases that comprise of various types of information, their use for natural language inference has not been well explored. In this work, we present a simple technique that can harnesses knowledge bases, provided in the form of a graph, for natural language inference.",,36
0,https://github.com/xclaesse/OpenGlucose.git,OpenGlucose is an application for diabetics that reads data from supported glucometer devices and display statistics and graphs.,,35
0,https://github.com/microsoft/openCypherTranspiler.git,This tool transpiles openCypher graph query language to a relational database query language. This project publishes a T-SQL for Microsoft SQL Server as the target query language.,"graph,t-sql,property-graph,cypher-query-language,opencypher,transpiler",35
0,https://github.com/awkward/Ocarina.git,A library to get metadata and Open Graph information from URLs,"swift,swift-3,ios",35
0,https://github.com/BobSimons/erddap.git,"ERDDAP is a scientific data server that gives users a simple, consistent way to download subsets of gridded and tabular scientific datasets in common file formats and make graphs and maps. ERDDAP is a Free and Open Source (Apache and Apache-like) Java Servlet from NOAA NMFS SWFSC Environmental Research Division (ERD).","data,environmental,scientific,server,noaa,erddap",35
0,https://github.com/ukyoda/ogpParser.git,Open Graph Protocol Parser for Node.js,"ogp,scraping",34
0,https://github.com/otiai10/opengraph.git,Open Graph Parser for Go,"go,html,ogp,ogp-meta,ogp-image,ogp-tags",33
0,https://github.com/artlung/Open-Graph-Protocol-Plugin-for-WordPress.git,"WordPress Plugin that adds Open Graph Protocol Metadata to your blog. To download a copy, click ""Download Source"" and choose the zip file. Unzip, and place the resulting folder in your WordPress installation under wp-content/plugins/",,33
0,https://github.com/kraison/vivace-graph-v2.git,Superceded by https://github.com/kraison/vivace-graph-v3  Open source Common Lisp graph database / RDF store / Prolog implementation.  Supersedes http://github.com/kraison/vivace-graph.,,31
0,https://github.com/mlavin/sickmuse.git,Sick Muse is an open source web application for graphing Collectd RRD data.,,31
