,Url,Description,Topics,Stars
1365,https://github.com/OnlyInAmerica/BLEMeshChat.git,"Android client for iOS to Android chat application over Bluetooth LE, using Android L APIs",,143
1366,https://github.com/eduardotkoller/convForm.git,A jQuery plugin that transforms a form into an interactive chat.,"jquery-plugin,jquery,chat,form,javascript,conversation,chatbot,plugin",143
1367,https://github.com/Dineshkarthik/telegram_media_downloader.git,Download media files from a telegram conversation/chat/channel up to 2GiB,"telegram,telegram-apps,python3,telegram-api,media-downloader,pyrogram,archiving-media,python,telegram-desktop",143
1368,https://github.com/Enjoylone1y/EzChat.git,"基于网易云信 IM SDK for Android，界面仿造QQ和微信，打造的一款简单的即时通讯 APP，目前可实现好友添加，个人资料修改，基础聊天功能（包括文字，表情，语音，视频，图片和位置信息发送接收功能），Based on Netease cloud letter IM SDK for Android, the interface mimics QQ and WeChat, to create a simple instant messaging APP, which can be realized by adding friends, modifying personal information, basic chatting functions (including text, emoticons, voice, video, Location information send and receive function).","instant-messaging,wechat-app,custom-view",143
1369,https://github.com/samczsun/Skype4J.git,Skype API written in Java. Does not support P2P chats,,142
1370,https://github.com/msaad1999/KLiK-SocialMediaWebsite.git,"Complete PHP-based Login/Registration system, Profile system, Chat room, Forum system and Blog/Polls/Event Management System.","blog-management-system,forum-site,event-management,poll-application,chatroom,social-media,ajax,chat-room,php,sql,sqli,js,jquery,bootstrap4,css,html,website,web-application,social-network,wamp",142
1371,https://github.com/rubygarage/react-native-firebase-chat.git,This repository contains the source code for a simple chat application built with React Native (frontend) and Firebase (backend).,"react-native,firebase,redux,ios,android",142
