,Url,Description,Topics,Stars
932,https://github.com/RedJanvier/Employee-management-API.git,A Restful API and database for an employee management system,"employee-management,task-force,nodejs,pern-stack,sequelize,nodemailer,xlsxjs,excel",6
933,https://github.com/josemmarneca/ManagementUsersLdap.git,"REST API project using Spring Boot, H2, Ldap Connector to management user in ldap",,6
934,https://github.com/kwakeroni/BusinessParameters.git,Provides an API and middle-ware to enable management of application parameters by business users.,,6
935,https://github.com/diegosm/keycloak-admin.git,PHP Library for Keycloak Rest API management,,6
936,https://github.com/contentjet/contentjet.github.io.git,Headless API-first content management system,"headless-cms,headless,api,cms,mit-license,api-first-cms,rest-api",6
937,https://github.com/imgix/imgix-management-js.git,A Javascript library that wraps the imgix management API,"imgix,management,api,javascript,nodejs",6
938,https://github.com/sldblog/rabbitmq-graph.git,Generate graphs from RabbitMQ topology via management API.,"rabbitmq,graph,topology",6
939,https://github.com/d6u/Dockership.git,Scriptable docker management tool build upon Docker remote API.,,6
940,https://github.com/jonjamz/meteor-settings.git,A minimalistic API for settings management in JS applications.,,6
941,https://github.com/rparang/oracle_srm_sample_app.git,"{""Example application using Oracle's Social Relationship Management API""}",,6
942,https://github.com/deitch/jsmx.git,simple API for management extensions to your nodejs application,,6
943,https://github.com/evolify/use-ctx.git,Simple、reactive state management based on React Context Api.,,6
944,https://github.com/CheckPointSW/UsefulManagementApiTools.git,Check Point Useful Management API Tools contain scripts and tools that were used as solutions for customers.,"management-api,gaia-api",6
945,https://github.com/TNRIS/api.tnris.org.git,"{""Django RESTful API and PostgreSQL backend database management system for maintaining and serving TNRIS's available data and content.""}","django,python,api,postgres,aws,lambda,carto,s3,content-management-system,backend,tnris,data",6
946,https://github.com/eamocanu/Facebook.Qt.APIs.git,more than Facebook Graph APIs - supports photo upload and photo posting on wall as well as multi user management,,6
947,https://github.com/pawartur/django-todo-lists.git,"This is a simple django application for todo management. It supports lists, contexts, tags and priorities. It consists in two components - RESTful AJAX API and javascript frontend.",,6
948,https://github.com/RobertoLangarica/api-client-wrapper.git,"Easy to use REST client that manage all the basics out of the box: Response homogenization, bulk calls, simultaneos calls, timeout and error management.",,6
949,https://github.com/evannorton/MentorMe-API.git,"API for MentorMe mobile app, developed with NodeJS and MySQL. Key functionality includes managing user data, handling payments with Stripe Connect and image management using multer and AWS.",,6
950,https://github.com/IBM-Cloud/cloud-event-management-sample.git,"This is a starter application for the Cloud Event Management service in Bluemix, that demonstrates how to send events via the API using a simple Node.js web application.",,6
951,https://github.com/Lucifier129/costate.git,A state management library for react inspired by vue 3.0 reactivity api and immer,"state-management,react,react-hooks,reactivity",6
952,https://github.com/loveunCG/Product-Mgmet-Portal.git,This web app is Product management portal and api server for mobile app,,6
953,https://github.com/loveunCG/Product-Mgmet-Portal.git,This web app is Product management portal and api server for mobile app,,6
954,https://github.com/aaronwong1989/aa-gateway.git,"API Gateway Build on SpringCloud Gateway, Provides dynamic routing management functions. 动态路由 mongodb","dynamic-routing,springcloud-gateway,mongodb",6
955,https://github.com/patarapolw/blogdown-cms.git,"Content Management System, to provide API endpoints for Static Site Generators or JAMStacks","blogdown-cms,heroku,cms",6
956,https://github.com/cassac/onlinestore.git,"Online store Django app with product management, shopping cart and checkout. Integrates Stripe and EasyPost APIs.",,6
957,https://github.com/anirudh83/TaskMaster1.1.git,TaskMaster1.1 is a tasks management system. It is built using : 1.)Spring 3 MVC 2.)Spring DI 3.)REST support for Spring MVC 4.)Twitter Bootstrap API 5.)Hibernate 3 6.)MySQL 5 7.)Tomcat 7  The project is build using maven. It uses mvn tomcat plugin.,,6
958,https://github.com/Autodesk-Forge/model.derivative-swift-sample.git,"{""Generate thumbnail from files: This sample shows how you can use the Data Management API to upload files to your application's own private bucket on OSS, get it translated using the Model Derivative API and then retrieve the generated thumbnail""}","model-derivative,viewer,swift",6
959,https://github.com/zuch/VulaMobi.git,"{""VulaMobi v2.0 using the CodeIgniter Framework. The back-end Ajax API for a mobile interface of The University Of Cape Town's Learning Management System(LMS) called Vula""}",,6
960,https://github.com/sundowndev/castle.git,Access token management library for Go. Designed for APIs that need a rate and time limited access control feature.,"authentication,access-token,api,web-service,redis,token-management,uuid,oauth2",6
961,https://github.com/coodoo/ImmutableContext.git,"{""Simple local state management approach based on react's new Context API and the state is immutable by default.""}",,6
962,https://github.com/TheOpenCloudEngine/uEngine-iam.git,"{""One of member of OCE's microservices-architecture components. Identity & Access Management conforming to OAuth2 and JWT spec and provides Web GUI for managing organizations, users, and permission scopes. REST APIs allows your application easily converted to MSA-style services accessing underlying back-end services through token-based security.""}","microservices-architecture,identity-management,access-management,oauth2-server,jwt-token",6
963,https://github.com/greatwitenorth/Producteev-PHP-Library.git,Producteev is a full featured taks management system that allows users to collaborate with one another. They have provided a full featured API that allows you to extend their platform to suit your needs. This library will help you to use the API in PHP.,,6
