,Url,Description,Topics,Stars
814,https://github.com/xmlexplorer/windows.git,"XML Explorer is an extremely fast, lightweight XML file viewer. It can handle extremely large XML files. It has been tested on files as big as 300MB. It allows fast viewing and exploration, copying of formatted XML data, evaluation of XPath expressions, and XSD schema validation.",,8
815,https://github.com/thukg/AMinerOpen.git,"An open source community who focuses on developing and publishing elegant algorithms, models and tools for science big data mining and knowledge intelligence with AMiner resources.","data-mining,academic-data,science-data,knowledge-intelligence,natural-language-processing",8
816,https://github.com/mymuli/R--data-mining.git,"利用R语言编写的数据挖掘大作业。着重分析朴素贝叶斯判别分析算法、 AdaBoost 算法以及随机森林算法在口红销量预测中的效果， 并在随机森林算法中进行模型优化。Using R language data mining big homework. The effects of Naive Bayesian Discriminant Analysis (Naive Bayesian Discriminant Analysis), AdaBoost and Random Forest Algorithms on lipstick sales forecasting were analyzed, and the model was optimized in Random Forest Algorithms.",,8
817,https://github.com/ritabratamaiti/Blooddonorprediction.git,"Thanks to digitization, we often have access to large databases, consisting of various fields of information, ranging from numbers to texts and even boolean values. Such databases lend themselves especially well to machine learning, classification and big data analysis tasks. We are able to train classifiers, using already existing data and use them for predicting the values of a certain field, given that we have information regarding the other fields. Most specifically, in this study, we look at the Electronic Health Records (EHRs) that are compiled by hospitals. These EHRs are convenient means of accessing data of individual patients, but there processing as a whole still remains a task. However, EHRs that are composed of coherent, well-tabulated structures lend themselves quite well to the application to machine language, via the usage of classifiers. In this study, we look at a Blood Transfusion Service Center Data Set (Data taken from the Blood Transfusion Service Center in Hsin-Chu City in Taiwan). We used scikit-learn machine learning in python. From Support Vector Machines(SVM), we use Support Vector Classification(SVC), from the linear model we import Perceptron. We also used the K.neighborsclassifier and the decision tree classifiers. We segmented the database into the 2 parts. Using the first, we trained the classifiers and the next part was used to verify if the classifier prediction matched that of the actual values.","ehr,classifier,machine-learning,scikit-learn,tpot,decision-tree-classifier,support-vector-machine",8
818,https://github.com/alexcaselli/Federated-Learning-for-Human-Mobility-Models.git,"{""Thanks to the proliferation of smart devices, such as smartphones and wearables, which are equipped with computation, communication and sensing capabilities, a plethora of new location-based services and applications are available for the users at any time and everywhere. Understanding human mobility has gain importance to offer better services able to provide valuable products to the user whenever it's required. The ability to predict when and where individuals will go next allows enabling smart recommendation systems or a better organization of resources such as public transport vehicles or taxis. Network providers can predict future activities of individuals and groups to optimize network handovers, while transport systems can provide more vehicles or lines where required, reducing waiting time and discomfort to their clients.   The representation of the movements of individuals or groups of mobile entities are called human mobility models. Such models replicate real human mobility characteristics, enabling to simulate movements of different individuals and infer their future whereabouts.  The development of these models requires to collect in a centralized location, as a server, the information related to the users' locations.  Such data represents sensitive information, and the collection of those threatens the privacy of the users involved. The recent introduction of federated learning, a privacy-preserving approach to build machine and deep learning models, represents a promising technique to solve the privacy issue. Federated learning allows mobile devices to contribute with their private data to the model creation without sharing them with a centralized server. In this thesis, we investigate the application of the federated learning paradigm to the field of human mobility modelling.  Using three different mobility datasets, we first designed and developed a robust human mobility model by investigating different classes of neural networks and the influence of demographic data over models' performance. Second, we applied federated learning to create a human mobility model based on deep learning which does not require the collection of users' mobility traces, achieving promising results on two different datasets. Users' data remains so distributed over the big number of devices which have generated them, while the model is shared and trained among the server and the devices.  Furthermore, the developed federated model has been the subject of different analyses including: the effects of sparse availability of the clients; The communication costs required by federated settings; The application of transfer-learning techniques and model refinement through federated learning and, lastly, the influence of differential privacy on the model’s prediction performance, also called utility""}","federated-learning,human-mobility,tensorflow-federated-learning",8
