,Url,Description,Topics,Stars
245,https://github.com/zinyando/hotel-booking.git,Laravel API Application for a hotel booking system following this tutorial http://bit.ly/1XH5R9w,,10
246,https://github.com/appintheair/aita-track-flight-scheme.git,"Deeplink generation + App in the Air URL Scheme to export flight from booking apps (iOS, Android)",,10
247,https://github.com/mikaeljorhult/segel.git,Vue component for creating Gantt-like timeline charts for bookings.,"vue,gantt,timeline",10
248,https://github.com/AryanNateq/NodeJS-Booking-App.git,An appointment booking server app written using JavaScript and powered by Node JS.,"booking-system,appointment,nodejs,javascript,gcal",10
249,https://github.com/fajarwz/rooming.git,"Rooming, Room Booking, with Laravel 8, Bootstrap 4","laravel,bootstrap",10
250,https://github.com/kaseya/Room-Booking-IoT.git,Meeting room booking system combining the powers of Windows Azure IoT with the Raspberry Pi and Windows 10 IoT Core.,,10
251,https://github.com/Theophilix/event-table-edit.git,"Event Table Edit is a free table plugin for Joomla 3.x to create a responsive, editable table with CSV / XML import and export, and a simple appointment booking system function. Any help in the development is highly appreciated.",,10
252,https://github.com/aanndch/hairstylist-app.git,A Flutter app for booking an appointment with your favorite hairstylist.,,10
253,https://github.com/RebelCode/edd-bookings.git,[DISCONTINUED] You can find the newer version of EDD Bookings over at https://github.com/RebelCode/eddbk,,10
254,https://github.com/lordzohar/priority-based-cab-search-engine.git,Taxi Aggregator app in which we compare the services provided by online cab booking companies and provide all the data to customer  giving him priority to choose among them and book online cab from them. This project is built in Android Studio.,"google,google-maps-api,json,json-api,android-application,android-studio-3,cab,taxi-app,aggregator,retrofit,firebase,google-authentication,google-location-api,google-autocomplete,uber,ola",10
255,https://github.com/AndresFMoya/ror-booking_cinema_frontend.git,This project consists of an small movie booking system using Ruby on Rails on back end and ReactJS on front end.,,10
256,https://github.com/CargoCoinRepo/Cargo-Coin.git,"CargoCoin is designed to be a smart contract, crypto currency platform, decentralising global trade and transport. The platform target is to facilitate and optimise the interaction amongst traders, freight forwarders, shipping lines, booking agents as well as all other parties involved in the international trade and transport of commodities and cargoes. The platform users experience outlines well-balanced ecosystem based on cutting edge crypto security and frictionless interaction. ",,10
257,https://github.com/hiteshsahu/Ticket-Booking-Layout.git,Layout for bus booking app,"bus-booking,ticket-management,android,custom-view",9
258,https://github.com/gustavomazzoni/booking-system.git,"{""Booking application with a simple 'booking flow' built with MEAN stack""}",,9
259,https://github.com/yasinuddowla/HallBookingSystem.git,Convention Hall Booking System,"php,bootstrap,project,html,css,management-system,php-project",9
260,https://github.com/lizhiquan/MovieBooking.git,Android: https://github.com/tranngoclam/movie-booking,"ios,state,movie,booking,seatmap",9
261,https://github.com/cajet/FilmGoGo.git,A movie ticket booking system,,9
262,https://github.com/MafujShikder/BlueHeavenRestaurant.git,"A restaurant management system project with user and admin accounts, graphical room booking, booking amount calculation and appropriate billing.",,9
263,https://github.com/simgoodies/real-ops.git,"Handle flights, routes, bookings and more with VATSIM Real Ops","vatsim,real-ops,flight-simulator,air-traffic-control,atc",9
264,https://github.com/GituMbugua/bus-board.git,An online booking system for bus tickets in Kenya,,9
265,https://github.com/CodingInfinite/FrisbeeKotlinApp.git,Cab Booking App With Realtime database and Google Maps ,"googlemaps,distancematrixapi,reversegeocode,distancematrix,reversegeocoding,current-location,current-location-marker,marker,googlemarker,markeranimation,cabbookingapp,carbookingapp,multiplemarkeranimation,firebase-database,firebase-realtime-database,firebase-realtime,driver-passenger-app,display-location",9
266,https://github.com/berndruecker/ticket-booking-camunda-cloud.git,"A ticket booking example using Camunda Cloud, RabbitMQ, REST and two sample apps (Java Spring Boot and NodeJS)",,9
267,https://github.com/vimalpillai21/online-movie-ticket-booking-system.git,This is an online movie ticket booking website  made using Django-2.0.3,"python3,django-framework",9
268,https://github.com/jamesnyakush/truck-hub.git,This is a truck booking app that i am building for AAD Certification revision,,9
269,https://github.com/vfsd/nutzerp.git,  财务报销预约信息管理系统 Financial reimbursement booking information management system,"java,erp,nutz",9
270,https://github.com/cleophasmashiri/Patient-Management-UI-Microsevices.git,Patient Booking and Consulting UI as microservice using Spring Cloud and Angular 5,,9
271,https://github.com/ShalithaCell/Online-Train-Reservation.git,"Designed a Railway ticket booking, reservation and cancellation system. Technologies used: HTML, PHP, jquery, ajax, MySQL database.Created for best practice php and jquery.","php,jquery,ajax,mysql,best-practices,train-reservation-system,train-reservations,university-project",9
272,https://github.com/agriya/tixmall.git,"Tixmall is an open source Event Booking Solutions that is capable to quickly set up, activate and optimize an event management marketplace.","angularjs,rest,swagger,event,event-booking",9
273,https://github.com/wgaggioli/Resource-View.git,"View Calendar Events corresponding to specific Resources (example use: Hotel Booking System, showing Reservations for Rooms across Time)",,9
274,https://github.com/jahid56/doctor.git,Hospital & Doctor Information System from Bangladesh. It has also Doctor admin panel to update a doctors information. One can also booking a doctor in this system,"laravel-framework,doctor,doctors-information,laravel,doctors,hospital-information-management,doctor-appointment-management,php,mysql,mysql-database,database,database-migrations,artisan-command,javascript,jquery,bootstrap,bootstrap3",9
275,https://github.com/upura/booking-challenge-2021.git,Repository for Booking.com Data Challenge 6th Place Solution,,9
276,https://github.com/saramoohead/makers_in_space.git,Craft-athon solo follow up: TDD Rails spaceflight booking app ,,9
277,https://github.com/Only1Ryu/HotelManagementSystem.git,Mainly depended on handling the Hotel Mgt. works like room booking and bill generation. Front End: Core Java & Back End: MySQL.,,9
278,https://github.com/solita/solita-rooms.git,Solita Rooms is a web application which can be used to view Microsoft Exchange room bookings.,"clojurescript,clojure,microsoft-exchange,microsoft-outlook",9
279,https://github.com/lukaswhite/driving-lesson-booking-widget.git,"A widget for booking driving lessons, via the Acuity Scheduling API.",,9
280,https://github.com/PeteAUK/bitsand.git,"Bitsand is an online booking system for live role play events. It was initially written for the Lions faction in the LT system, but it can now be used by any faction or guild.",,9
281,https://github.com/CODEHOMIE/Flutter-Taxi-Booking-App-UI-Concept.git,The main idea here is to show the concept of a mobile app for Taxi Booking App. You can run through the articles in different categories and read the latest news and trends,,9
282,https://github.com/jwachter/travel-service.git,"Backend that provides a fantasy scenario of finding flights, booking them and paying for them for some airline. University project during winter semester 2009/2010. Realized using Scala and especially Lift.",,9
283,https://github.com/ginosian/Restaurant-Manager-Spring-Cloud.git,"A restaurant table booking and а restaurant inner management program. There are 3 embedded authorization levels - “ADMIN”, “RESTAURANT” and ""GUEST"".  Users with role “ADMIN” can create, read, update and delete whole data - all guests, orders, tables and products in the restaurant with an exception that this user can\'t update the products in order and can\'t delete order without ""complete"" or ""canceled"" flag on it.    Users with role “RESTAURANT” are allowed to assign the order to a table, mark order as a complete, change products in order.  Users with role “GUEST” are allowed to create order and choose products from the menu of the restaurant, change products within the order, cancel the order, see whole their orders list.","microservices,discovery-service,oauth2,spring-boot,hibernate,ecache,gradle,oauth2-server,oauth2-client,restful,distributed-systems,transactions,mysql-database",9
284,https://github.com/awesome-academy/crb.git,[education] Conference Room Booking System,,8
285,https://github.com/dedocibula/hotel-booking-manager.git,Online hotel booking service,,8
286,https://github.com/mikaeljorhult/hydrofon.git,Equipment booking system.,"booking,equipment,php,laravel",8
287,https://github.com/GovTechSG/butler-bot.git,Telegram bot for booking meeting rooms,"telegram-bot,room-booking,bots,telegram",8
288,https://github.com/sdc/booked.git,Booked Scheduler software for Mobile Devices booking system.,,8
289,https://github.com/jasonsedwards/booking.git,A simple PHP MVC based Booking System,,8
290,https://github.com/basitmir/cab_booking.git,Cab Booking Application in FLUTTER,,8
291,https://github.com/the-vishal/IRCTC-tatkal_booking.git,"For fast railway tatkal ticket booking, automated by selenium","irctc,booking,trains,train-ticket,selenium-webdriver,selenium,selenium-python,automation,the-vishal",8
292,https://github.com/cermak-petr/actor-booking-scraper.git,Apify actor for extracting data about hotels from Booking.com.,,8
293,https://github.com/woocommerce/woocommerce-bookings-generator.git,"A small helper plugin for WooCommerce Bookings to generate a large number of Bookings on a test store, to measure how WooCommerce Bookings performs under high load.",,8
294,https://github.com/kaloraat/react-node-mern-hotel-booking-app.git,React Node MERN Stripe Hotel Booking App,,8
295,https://github.com/kevupton/bookings.git,Booking platform for laravel,,8
296,https://github.com/CHTJonas/roombooking.git,"{""The ADC Theatre's room booking system""}","ruby,ruby-on-rails,room-booking,adc-theatre,cambridge-university",8
297,https://github.com/DrBookings/drbookings.git,Booking managment through a rich graphical interface.,"airbnb,booking,bookingsystem,javafx,java,channel-manager",8
298,https://github.com/rishabhcha/Movie-Ticket-Booking-API.git,"{""Backend API's for movie ticket booking system using Node js, Express and MongoDB.""}","nodejs,mongo,expressjs,movies-api",8
299,https://github.com/hiejulia/flight-booking.git,Flight booking services,"microservice,docker,spring-cloud,spring-framework,sql,databases,distributedsystems,python,neo4j",8
300,https://github.com/vtsukur/take-a-REST.git,Sample booking service demonstrating RESTful service leveraging HATEOAS,,8
301,https://github.com/ankushjamdagani/E-commerce-Food-Ordering-Website.git,"Demo project for restaurant, venue and hotel booking","css,html,responsive,ecommerce",8
302,https://github.com/PrajinkyaPimpalghare/IRCTC-Automation-Tatkal-and-General-Ticket-Booking-.git,IRCTC Automation with GUI For booking Tatkal/General ticket with COD option(Verified).,,8
303,https://github.com/kenigbolo/strs-taxi.git,Taxi booking Application developed using Ruby on Rails for the backend API and Angular for the frontend,,8
304,https://github.com/eslavov11/Doctor-Appointment-Booking-System.git,Doctor Appointment Booking System | Spring MVC application w/ Thymeleaf & MySQL,,8
305,https://github.com/agriya/on-demand-service.git,"ON-Demand Service Booking platform is to organize all possible online services, while facilitating users as well as service providers by offering what they are looking for.","angularjs,rest,swagger,online-service,dog-care,baby-care,elder-care,health-care,worker-assistant",8
306,https://github.com/ashish0309/RestaurantTableBookingApp.git,A simple Restaurant Table booking app showing basic usage of Firebase realtime database,"swift,firebase,firebase-auth,firebase-database,database,restaurant-management,booking-system,booking-platform,restaurant",8
307,https://github.com/amadeus4dev/amadeus-flight-booking-django.git,Python/Django application demonstrating the Amadeus Self-Service flight booking APIs,,8
308,https://github.com/liondedan/booking_app.git,A progressive web booking app build with React.js,"react,booking-system,javascript,progressive-web-app",8
309,https://github.com/uify/movie-booking-app.git,Movie Booking App UI,"react,reactnative,javascript,mario-diez,movie-booking",8
310,https://github.com/shashirajraja/Train-Ticket-Reservation-System.git,"This is the website build for searching the Train Schedule , Seat Availability, Train Timings, Fare Enquiry, Trains Between Stations and Booking seats online.","train-schedule,trains,booking-system,reservation,seat-booking,train-scheduler,online-booking,train,seat-availability,stations,ticket-booking-system,train-ticket,book-tickets,online-ticket-booking,railway-reservation,railticket",8
311,https://github.com/kapilgarg1996/roadrunner.git,Django powered project which acts as Bus and Taxi booking portal for Travel Firm Owners. Fully Restful API for future integration with websites and mobile applications.,,8
312,https://github.com/flythecoop/FTC-Booking-System.git,A Booking system for FlyThe.Coop desks and Meeting Room,,8
313,https://github.com/devVinit/testdrive-app-api.git,A simple slot-booking system for test-drives.,"nestjs,typescript,api,mysql",8
314,https://github.com/Tortu-Ch/Laravel-Booking_Web_app.git,"Real Estate Booking app made using Laravel, Bootstrap.","laravel,booking,laravel-booking-app,webapplication,webapp,web-application,web-app",8
315,https://github.com/amogh-w/PlutoRailwayLogin.git,A simple Login and Booking page for a fictional company named Pluto Railway,"java,gui,swing-gui,login-page",8
316,https://github.com/siddh30/The-Airbnb-Classification-Project.git,This project is from the Airbnb Recruitment Challenge on Kaggle. The challenge is to solve a multi-class classification problem of predicting new users first booking destination.,"r-programming,data-mining,binary-classification,multi-class-classification,airbnb,kaggle-challenge",8
317,https://github.com/innovation-lab-prague/booking.git,Simple booking system based on Pull requests,"calendar,booking-system,fullcalendar-plugin",7
318,https://github.com/gaurang/voyager.git,Voyager Cab booking app,"traveling,cab,booking-system,transportation-network,transport,taxi-app,taxi,taxi-booking,business",7
319,https://github.com/ThiccPadx/e-konsulat.git,Automation script for poland visa appointment booking,"e-konsulat,poland,visa,userscript,appointment,hacking,vulnerable,embassy,automation,script,hack,etokenapp",7
320,https://github.com/OneScreenfulOfPython/booking-system.git,"A simple booking system, developed in screenful-sized steps",,7
321,https://github.com/bosnadev/sports-booking-system.git,Online sports booking system in Laravel,,7
322,https://github.com/boczeratul/Christopher.git,automatic booking script for RAW,,7
323,https://github.com/gorpoghosyan89/fastbooking-wordpress-booking-plugin.git,A free online hotel booking for WordPress,,7
324,https://github.com/AlmasB/LibraryLoan.git,Simplistic example of library booking system,,7
325,https://github.com/pcl-labs/BrowTricks.git,a hair salon booking app,hacktoberfest,7
326,https://github.com/kamilabs/BookingBundle.git,Booking Bundle for Symfony Applications,,7
327,https://github.com/chrisjsimpson/salon-booking-guru.git,On-line salon client booking and management system,,7
328,https://github.com/FavyTeam/Advanced_PHP_Scrapping.git,"Enhanment Scrapping API for six hotel booking website from Expedia.com, Booking.com, Bookhotelbeds.com. Hotels.com, Bestday.com, despegar.com","hotel,despegar,expedia,bookhotelbeds,bestday,booking,scraping",7
329,https://github.com/BookingKitti/bookingkitti.git,An online booking system based on Node.js,,7
330,https://github.com/BookingKitti/bookingkitti.git,An online booking system based on Node.js,,7
331,https://github.com/yalibek/chettam-telegram-bot.git,bot for booking chettam slots,,7
332,https://github.com/drioemgaoin/react-booking-calendar.git,"React responsive booking calendar component. This component manage your existing bookings, timetable and timetable exception.",,7
333,https://github.com/FongX777/hotel-booking-ddd.git,hotel booking app using ddd and clean architeucture to implement,"clean-architecture,hotel-booking,user-story,miro,event-storming,typescript",7
334,https://github.com/omarthamri/HotelApp.git,HotelApp is an iOS app for Hotel search and booking,"hotel-booking,hotel-reservation,hotel-search,swift,ios",7
335,https://github.com/ajmalpkc/Simple-Clinic-Managment-Project-In-Django.git,"This is simple clinic managment system with django admin,  receptionist dashboard and doctor dashboard and online booking for patient. ",,7
336,https://github.com/baperrou/WooBookings-Recurring-Booking.git,simple plugin to create reoccurring booking from single booking,,7
337,https://github.com/SourabhCA/InstaCareApp.git,InstaCare is Android app Developed for Practo Android Hiring Challenge.It aids in booking doctor appointment based on speciality and locality..,,7
338,https://github.com/elpassion/instaroom.git,Instant room booking,,7
339,https://github.com/RobertJGabriel/Third-Year-Group-Project.git,A Gym booking and content management system. Allows gym members to book training sessions. Allows them to enter their training sessions results and more.,"college-project,gym-booking,gym-members,php,side-project",7
340,https://github.com/yogeshymarathe/flutter_vertical_calendar.git,"vertical scroll calendar for Birthday, Booking",,7
341,https://github.com/mastefano64/angular-hotel-bookings.git,DEMO project that to show you how create an Angular component for hotel bookings,"angular,typescript,javascript,html,css,angular-material,component",7
342,https://github.com/shouheiyamauchi/green-yoga-website.git,"{""Green Park's Yoga business portfolio website / online booking system built with Node.js, React JS""}",,7
343,https://github.com/usmanmukhtar/Airline-Booking-SwiftUI.git,"This is a demonstration of creating airline booking UI, using SwiftUI 2.0",,7
344,https://github.com/prwteas/job-monitor.git,Monitor jobs advertised in the official Booking.com™ web site,,7
345,https://github.com/JasonLiTW/tkb-auto-booking.git,Auto booking script for a certain cram school.,"python,booking",7
346,https://github.com/jeremy02/BookIt.git,Taxi Booking Android App (Full UI Kit + Source Code),,7
347,https://github.com/bubba/room-booking-tcd.git,A web app for booking group study rooms within TCD,"react,bootstrap,cheerio,javascript,ruby,nokogiri,graphql",7
348,https://github.com/darkerror96/amateur-uber.git,Online Cab Booking System as an Android Application,"android-application,android,android-app,android-library,android-studio,android-development,android-ui,android-sdk,firebase,firebase-database,firebase-auth,firebase-realtime-database,firebase-storage,firebase-authentication,firebase-db,google-maps-api,google-maps,location-based-services,location-picker,location-services",7
349,https://github.com/zainthecoder/YO-CAB.git,YO CAB is a web application for online cab booking.,"web-application,php,html,css,css3,my-sql",7
350,https://github.com/pennlabs/student-life.git,API Server to manage student life @ Penn. Currently GSR Booking,,7
351,https://github.com/Verthon/restaurant-app.git,Alkinoos Taverna is simple restaurant application for small restaurants with integrated booking system and administrating tools for staff  ,,7
352,https://github.com/cypressf/covid-restaurant-booking.git,Free booking system for pickup and delivery during the COVID-19 (Coronavirus) pandemic,,7
353,https://github.com/robsel118/flutter_travel_app_challenge.git,Quick challenge I gave myself to make a Flutter app that replicates this dribble: https://dribbble.com/shots/6510521-Travel-App-for-booking-unique-experience,,7
354,https://github.com/KabohaJeanMark/fyurr-music-web-app.git,"A Full Stack music Restful API web app musical venue and artist booking site that facilitates the discovery and bookings of shows between local performing artists and venues. Front End: Vanilla JS, HTML5, CSS3. Backend: Flask, SQLAlchemy, PostgreSQL ",,7
355,https://github.com/simongomes/ship-to-ecourier.git,Ship To eCourier is a simple WordPress Plugin which gives you ability to send your parcel booking request to eCourier directly from your WooCommerce order dashboard.,"parcel,ecourier,ecourier-parcel-tracker,ecourier-booking,ecourier-parcel-booking,woocommerce-extension,woocommerce-to-ecourier,wordpress-to-ecourier,wordpress-plugin",7
356,https://github.com/CatsPlugins/ultimate-travel.git,"WordPress plugin to create & manage the tours, hotels, transportation service at ease. Specialized designed for travel & tour company - agency. Online booking is available","travel-plugin,travel,wordpress,wordpress-plugin,wordpress-tour,wordpress-development,tour,tour-operator,tournament,travel-agency,travel-tour,tour-package,tourism,trip,vacation,tour-booking,hotel-booking,car,car-booking",7
357,https://github.com/ChaoYou-Li/Hotel-Manager.git,"{""酒店后台管理系统（采用SSH框架开发），这个项目这要有四个功能模块。模拟酒店的正常员工的工作性质：前台、保洁、后厨、经理。前台主要是负责完成客户入住酒店的时候完成客户信息的注册、预定酒店房间的信息注册和客户预定餐饮的订单信息注册。保洁主要是在客户到前台退房后，收到前台通知“待打扫”房间信息，保洁前去打扫退订的房间完成后反馈打扫完成信息到前台，前台把房间标识为“待入住”，后厨主要是在接收到客户的订餐信息“待做餐”后，后厨完成相关逻辑操作后把订单标注为“可上餐”。经理主要是管理前台、保洁和后厨的人事工作。对酒店员工的招聘、辞退、员工信息管理和查看员工资料等功能。 Hotel management system (developed with SSH framework), this project has four functional modules. Simulate the nature of the work of the normal staff of the hotel: front desk, cleaner, kitchen, manager. The front desk is mainly responsible for completing the registration of customer information, the registration of information for booking hotel rooms, and the registration of order information for customers' reservations. Cleaning is mainly after the customer checks out at the front desk and receives the information of the room to be cleaned by the front desk. After cleaning and unsubscribing the room, the feedback cleaning completion information is sent to the front desk. The front desk identifies the room as “waiting to stay”. The kitchen is mainly after receiving the customer's order information “to be cooked”, after the kitchen finishes the relevant logic operation, the order is marked as “can be eaten”. The manager is mainly responsible for managing the front desk, cleaning and post-cooking personnel work. The recruitment, dismissal, employee information management and employee information of hotel staff.""}",,7
358,https://github.com/avijit1258/pigeon.git,Online Bus Ticket Booking System,"laravel-framework,ticketing-system,php7",6
359,https://github.com/suyash248/taxi.git,Basic cab/taxi booking app,"taxi,taxi-app,cab,python,flask,flask-sqlalchemy,sqlalchemy,flask-migrate,redis,postgresql",6
360,https://github.com/teachus/teachus.git,TeachUs booking system,,6
361,https://github.com/iamhosseindhv/Rentaly.git,Online Accommodation Booking Website,"nodejs,javascript,booking-system,airbnb,desktop,mysql-database",6
362,https://github.com/johnnyhuy/laravel-appointment-booking-system.git,Appointment booking system developed with Laravel.,"php,laravel",6
363,https://github.com/gyr0tron/Taxi_booking.git,Taxi booking app in React Native,,6
364,https://github.com/simplesteph/aws-lambda-septime.git,AWS Lambda function to find available bookings at Septime,,6
365,https://github.com/cmpe165spring2019/ReactApp.git,"A web application for booking hotels, made with React.",,6
366,https://github.com/amadeus4dev/amadeus-flight-booking-node.git,Node.js and Vue application demonstrating the Amadeus Self-Service flight booking APIs ,"travel,booking,apis,nodejs,vuejs,amadeus",6
367,https://github.com/imPatidar/Online-Movie-Ticket-Booking.git,Online Movie Ticket Booking System on JSP Servlet Technology.,,6
368,https://github.com/satishjhanwer/hotel-booking-mean-stack.git,Using MEAN stack to implement a simple hotel booking application where user can search hotels in database and book them.,,6
369,https://github.com/HamishMW/flight-booking-app.git,A flight booking app prototype,"react,threejs",6
370,https://github.com/analyticswithali/Airline-Demand-Forecasting.git,Minimize forecast errors by developing an advanced booking model using Python,"python,demand-forecasting,airline-booking",6
371,https://github.com/EngageSoftware/Engage-Booking.git,Engage: Booking is an appointment management tool for the DNN Platform.,"dnn,c-sharp",6
372,https://github.com/niconei/fullstack-booking.git,"Booking system for hotel. Full-Stack using Java, MySql, JS/HTML/CSS & Heroku","java,html-css-javascript,jquery-ajax,mysql-database,full-stack,servlet-jsp,maven-archetype",6
373,https://github.com/ajf8/seam-booking-ogm.git,The Seam 3 hotel booking example ported to use Hibernate Object Grid Mapper (OGM),,6
374,https://github.com/loveunCG/Taxi-API.git,This Web app is we portal and api server for taxi booking mobile app,,6
