,Url,Description,Topics,Stars
0,https://github.com/ankurp/APDropDownNavToolbar.git,iOS7 Messages App style toolbar that drops down from navigation bar when tapping on the UIBarButton item,,180
0,https://github.com/daepark/postmessage.git,window postmessage plugin for cross-window messaging,,179
0,https://github.com/MeshackMusundi/SignalChat.git,WPF-MVVM instant messaging application using SignalR,"wpf,mvvm,csharp,vbnet,signalr",178
0,https://github.com/alexjlockwood/gcm.git,Google Cloud Messaging for application servers implemented using the Go programming language.,,178
0,https://github.com/trailofbits/protofuzz.git,Google Protocol Buffers message generator,"fuzzer,protocol-buffers,protobuf",178
0,https://github.com/johnpaulett/python-hl7.git,A simple library for parsing messages of Health Level 7 (HL7) version 2.x into Python objects.,,178
0,https://github.com/deltachat/deltachat-ios.git,Email-based instant messaging for iOS.,"email,deltachat,messenger,ios",177
0,https://github.com/abeade/fcm-push-plugin.git,IntelliJ IDEA plugin to send pushes using Firebase Cloud Messaging (FCM),"android-studio,android,kotlin,intellij-plugin,push-notifications",177
0,https://github.com/smallhadroncollider/cmt.git,Write consistent git commit messages based on a custom template,"git,git-commit-messages,formatting,command-line",177
0,https://github.com/slack-scala-client/slack-scala-client.git,A scala library for interacting with the slack api and real time messaging interface,"hacktoberfest,scala,slack,scala-library,java",176
0,https://github.com/vardius/message-bus.git,Go simple async message bus,"message-bus,event-sourcing,ddd,async,message-queue,message-broker,broker,queue,pubsub",176
0,https://github.com/iotaledger/streams.git,"IOTA Streams, a framework for cryptographic protocols called Applications. Replaces Masked Authenticated Messaging (MAM). Alpha version.",,176
0,https://github.com/feflow/git-commit-style-guide.git,Make git commit message more readable and useful.,"git,commit,standard,workflow,feflow",176
0,https://github.com/pinax/pinax-messages.git,a Django app for allowing users of your site to send messages to each other,,176
0,https://github.com/tristanheaven/gtkhash.git,A cross-platform desktop utility for computing message digests or checksums,"c,gtk,checksum,hash,nautilus,gnome,cinnamon,xfce,caja,thunar,mate,nemo,linux,windows,md5,md5sum,sha1,sha256,blake2,sha3",176
0,https://github.com/react-hook-form/error-message.git,📋 Error message component,"forms,react,message,component,error-handling,errormessage,error-messages",175
0,https://github.com/samyk/dingdong.git,Digital Ding Dong Ditch -- RTL-SDR + Arduino + GSM/SMS/FONA + RF + GQRX to hack a wireless doorbell from a text message,,175
0,https://github.com/jeremy-compostella/org-msg.git,OrgMsg is a GNU/Emacs global minor mode mixing up Org mode and Message mode to compose and reply to emails in a Outlook HTML friendly style.,"emacs,emacs-mode,emacs-packages,mail,composing,org-mode,orgmode,outlook,html",175
0,https://github.com/akameco/extract-react-intl-messages.git,extract react intl messages,"react-intl,react-intl-auto,extract,messages,react,i18n",174
0,https://github.com/securityfirst/Umbrella_android.git,"Open source Android, iOS and Web app for learning about and managing digital and physical security. From how to send a secure message to dealing with a kidnap. Umbrella has best practice guides in over 40 topics in multiple languages. Used daily by people working in high risk countries - journalists, activists, diplomats, business travelers etc.","opensource,security,risk,human-rights-defenders,activism,infosec,journalism,hacking,lessons,travel,advice,encryption,umbrella,snowden,crypto,protest",174
0,https://github.com/mattg888/GCM-PHP-Server-Push-Message.git,GCM PHP Push Message,,173
0,https://github.com/szjani/predaddy.git,DDD/CQRS/EventSourcing framework with annotation driven message bus,,173
0,https://github.com/kazu-yamamoto/Mew.git,Messaging in the Emacs World,,172
0,https://github.com/mansona/ember-cli-notifications.git,⚛ Atom inspired notification messages for ember-cli,"ember-addon,ember,ember-cli,notifications,alerts",172
0,https://github.com/juanpabloaj/slacker-cli.git,Messages to slack from command line,"python,slack,command-line",172
0,https://github.com/we684123/Telegram_link_Line.git,用Telegram來收發Line的訊息，use telegram to Send and receive messages(from Line)。  或者把它當作Line的訊息備份也是可啦 😛,"google-apps-script,line,telegram,bot",172
0,https://github.com/clarkio/vscode-twitch-highlighter.git,This is a VS Code extension that will allow your Twitch chat to highlight a line of code via a command message. Example: `!line 8 server.js`. See master branch README.md for more details,"vscode,extension,twitch,visual-studio,visual-studio-code,visual-studio-code-extension,highlighter",172
0,https://github.com/benwilkins/laravel-fcm-notification.git,Laravel FCM (Firebase Cloud Messaging) Notification Channel,,171
0,https://github.com/plasticbrain/PhpFlashMessages.git,Session-based Flash Messages class for PHP,,171
0,https://github.com/zeromq/chumak.git,Pure Erlang implementation of ZeroMQ Message Transport Protocol.,"zmtp,erlang,zeromq",171
0,https://github.com/mercury2269/sqsmover.git,AWS SQS Message mover,"aws-sqs,cli,golang",170
0,https://github.com/murgo/IrssiNotifier.git,notifies android phones from irc private messages,,170
0,https://github.com/acrosa/kafka-rb.git,A simple Producer/Consumer client for Kafka (a distributed publish/subscribe messaging service),,170
0,https://github.com/ericliang/ticktick.git,An id generator for message service.,,170
0,https://github.com/maximbilan/Mac-OS-X-App-Menu-Bar-Popup.git,Mac OS X Application like a menu bar popup message,"popup-message,macosx,menubar,popup,tutorial",170
0,https://github.com/gytai/node-websocket-msg-sender.git,"基于websocket,Nodejs,socket.io,redis 的消息转发系统  message pusher written in nodejs based on socket.io and express4",,170
0,https://github.com/ChathuraHettiarachchi/TimeAgo.git,"This will help to get how much time have passed. Useful in showing messages, notifications time and etc.","timeago,notifications,android-library",169
0,https://github.com/checkymander/iMessagesBackdoor.git,A script to help set up an event handler in order to install a persistent backdoor that can be activated by sending a message.,,169
0,https://github.com/snok/django-guid.git,"Inject an ID into every log message from a Django request. ASGI compatible, integrates with Sentry, and works with Celery","django,django-rest-framework,logging,correlation-id,correlation,guid,django-guid,django-correlation-id,celery,sentry,asgi,django3,request-id,tracing",169
0,https://github.com/Mytherin/Tibialyzer.git,"Tibialyzer is an extension made for the MMORPG Tibia. It automatically scans the server log and messages from the Tibia client by reading its memory, and gathers various statistics, such as loot found from creatures, damage dealt by party members and experience gained every hour.",,169
0,https://github.com/aws/aws-php-sns-message-validator.git,Amazon SNS message validation for PHP,,168
0,https://github.com/Kuniwak/MirrorDiffKit.git,Graduation from messy XCTAssertEqual messages.,"swift,testing,diff,library,ios,macos,tvos,watchos",168
0,https://github.com/lezhnev74/openapi-psr7-validator.git,It validates PSR-7 messages (HTTP request/response) against OpenAPI specifications,"php,psr-7,openapi,openapi3,validation",168
0,https://github.com/worthwhile/django-herald.git,A Django messaging library,"notifications,django,disable-notifications,attachment,email,sms,preview,history",167
0,https://github.com/Ilshidur/action-discord.git,🚀 GitHub Action that sends a Discord message.,"github-actions,github-action",167
0,https://github.com/gagle/raspberrypi-motd.git,Message of the Day for the Raspberry Pi.,,167
0,https://github.com/phly/http.git,PSR HTTP Message implementations and node-like http.Server implementation,,167
0,https://github.com/otrv4/otrv4.git,Off-the-Record Messaging Protocol version 4. -This is a draft- This repository is a mirror of http://bugs.otr.im/otrv4/otrv4,"otr,otrv4,deniability",167
0,https://github.com/Mostafa-Samir/klyng.git,A message-passing distributed computing framework for node.js,"distributed-computing,parallel-computing,message-passing,nodejs,javascript",167
0,https://github.com/harshitsidhwa/WhatsApp-bot-selenium.git,This is a simple Web WhatsApp Bot developed in python using Selenium. Helpfull to send messages to whatsapp contacts automatically using web.whatsapp.com and web automation.,,167
0,https://github.com/nccgroup/blackboxprotobuf.git,Blackbox protobuf is a Burp Suite extension for decoding and modifying arbitrary protobuf messages without the protobuf type definition.,"protobuf,burp",166
0,https://github.com/CloudRail/cloudrail-si-java-sdk.git,"Unified API Library for: Cloud Storage, Social Log-In, Social Interaction, Payment, Email, SMS, POIs, Video & Messaging. Included services are Dropbox, Google Drive, OneDrive, OneDrive for Business, Box, Egnyte, PayPal, Stripe,  Google Places, Foursquare, Yelp, YouTube, Vimeo, Twitch, Facebook Messenger, Telegram, Line, Viber, Facebook, GitHub, Google+, LinkedIn, Slack, Twitter, Windows Live, Yahoo, Mailjet, Sendgrid, Twilio, Nexmo, Twizo.",,166
0,https://github.com/mperdeck/jsnlog.git,JSNLog for .Net. Combines jsnlog.js client side logging with .Net server side component to receive log messages and pass them to the server side logging package. Configure loggers in web.config.,,166
0,https://github.com/gbevin/ReceiveMIDI.git,Multi-platform command-line tool to monitor and receive MIDI messages,"midi,command-line-tool,midi-messages,command-line",165
0,https://github.com/fedora-infra/fedmsg.git,Federated Messaging with ZeroMQ,"python,zeromq,data-science,message-bus,fedora-project",164
0,https://github.com/ScaleDrone/webrtc.git,Video chat App with WebRTC using Scaledrone Realtime Messaging Service,"webrtc,video-chat,scaledrone,javascript",164
0,https://github.com/RicinApp/Ricin.git,"A dead simple, privacy oriented, instant messaging client! https://ricin.im","tox-client,vala,gtk3,unmaintained-dont-use",164
0,https://github.com/reachkrishnaraj/kafka-elasticsearch-standalone-consumer.git,"Kafka Standalone Consumer [Indexer] will read messages from Kafka, in batches, process and bulk-index them into ElasticSearch.",,164
0,https://github.com/ELENA-LANG/elena-lang.git,"ELENA is a general-purpose language with late binding. It is multi-paradigm, combining features of functional and object-oriented programming. Rich set of tools are provided to deal with message dispatching : multi-methods, message qualifying, generic message handlers, run-time interfaces","object-oriented,programming-language,language,compiler,elena,script-engine,mixins,multi-methods",164
0,https://github.com/nixzhu/Wormhole.git,A more elegant way for message passing between iOS apps and extensions.,,164
0,https://github.com/hikalkan/dotnetmq.git,DotNetMQ: .NET Message Queue,,163
0,https://github.com/wmluke/angular-flash.git,Flash messages for Angular JS,,163
0,https://github.com/HBM/node-jet.git,Realtime Message Bus for the Web. Javascript Implementation,"realtime,publish-subscribe,jet,websockets,distributed-systems",163
0,https://github.com/rodrigocfd/winlamb.git,"A lightweight modern C++11 library for Win32 API, using lambdas to handle Windows messages.","win32,winapi,winlamb,stl,cplusplus,cplusplus-11,cpp,cpp11",163
0,https://github.com/elm/error-message-catalog.git,A catalog of broken Elm programs / data to improve error messages,elm,163
0,https://github.com/akoidan/pychat.git,webchat via WebSockets/WebRTC that allows messaging/video call/screen sharing,"python,websockets,javascript,tornado,webrtc,django,sass,redis,pub-sub,mysql,filesystem-api,webassembly,canvas,docker,vue,typescript,webpack,electron,cordova",162
0,https://github.com/xing/beetle.git,High Availability AMQP Messaging With Redundant Queues,,161
0,https://github.com/php-enqueue/laravel-queue.git,"Laravel Enqueue message queue extension. Supports AMQP, Amazon SQS, Kafka, Google PubSub, Redis, STOMP, Gearman, Beanstalk and others","php,laravel,queue,messaging,amqp,stomp,kafka,sqs-queue,gearman,beanstalk",161
0,https://github.com/pnxtech/umf.git,Universal Messaging Format,,160
0,https://github.com/MatthieuLemoine/electron-push-receiver.git,A module to bring Web Push support to Electron allowing it to receive notifications from Firebase Cloud Messaging (FCM).,"electron,webpush,push-notifications,push-receiver,fcm,notifications,firebase-cloud-messaging",160
0,https://github.com/cubiclesoft/email_sms_mms_gateways.git,"A simple repo containing a list of known e-mail to SMS, MMS, and Rich Messaging carrier gateways in JSON format under a MIT or LGPL license.",,160
0,https://github.com/kelyvin/Google-Messages-For-Desktop.git,"A ""native-like"" OS X, Windows, & Linux desktop app for Google Messages","google,desktop,desktop-app,windows,macos,mac,electron,linux,nativefier,messages,android,android-messages,sms",160
0,https://github.com/easychen/telechan.git,message api for telegram bot  可供多人发送消息的 telegram 机器人 api ， 类似server酱的开源实现,,160
0,https://github.com/sclausen/ngx-mqtt.git,"{""This library isn't just a wrapper around MQTT.js for angular. It uses observables and takes care of subscription handling and message routing.""}","mqtt,angular,angular2,ngx,ngx-mqtt,angular5",160
0,https://github.com/longyan/phpkafka.git,"PHP Kafka client is used in PHP-FPM and Swoole. PHP Kafka client supports 50 APIs, which might be one that supports the most message types ever.","kafka,php,swoole",160
0,https://github.com/scalad/SpringBoot-RabbitMQ.git,"RabbitMQ为异步消息处理提出了一个很好的解决方案，它是一个非常好用的消息中间件，主要用于中间件的解耦，同时，Spring Boot为RabbitMQ提供了支持, Spring Boot为Rabbit准备了spring-boot-starter-amqp，spring-rabbit 支持 AMQP(即Advanced Message Queuing Protocol，高级消息队列协议，是应用层协议的一个开放标准)，并且为RabbitTemplate和RabbitMQ提供了自动配置选项","spring-boot,rabbitmq,gradle",160
0,https://github.com/greyli/sayhello.git,A simple message board application build with Flask.,,159
0,https://github.com/valinurovam/garagemq.git,AMQP message broker implemented with golang,"amqp0-9-1,amqp-server,queue,messaging,pubsub,amqp,rabbitmq,message-broker",159
0,https://github.com/jamesmunns/postcard.git,A no_std + serde compatible message library for Rust,,159
0,https://github.com/wolkykim/libasyncd.git,Embeddable Event-based Asynchronous Message/HTTP Server library for C/C++,,159
0,https://github.com/mindedsecurity/shhlack.git,Slack message encryptor/decryptor for desktop app and browser,,158
0,https://github.com/canove/whaticket.git,"A very simple Ticket System based on WhatsApp messages, that allow multi-users in same WhatsApp account.","whatsapp,bot,tickets,chat,javascript",158
0,https://github.com/Parquery/icontract.git,Design-by-contract in Python3 with informative violation messages and inheritance,,158
0,https://github.com/tyage/slack-patron.git,Log and view all Slack messages.,"slack,javascript,ruby,web-app,docker,react,react-redux,react-router,react-router-redux",157
0,https://github.com/nats-io/nats.ts.git," TypeScript Node.js client for NATS, the cloud native messaging system",,157
0,https://github.com/leogx9r/DiscordCrypt.git,End-To-End File & Message Encryption For Discord,"betterdiscord,betterdiscord-plugin,cryptography,encrypted,encryption,messages,messenger,privacy,security,protected,security-tools,discord,betterdiscord-plugins,betterdiscord-addon",157
0,https://github.com/apegroup/APESuperHUD.git,A simple way to display a HUD with a message or progress information in your application.,"hud,spinner,swift,cocoapods,carthage,progress",157
0,https://github.com/microsoft/CryptoNets.git,"CryptoNets is a demonstration of the use of Neural-Networks over data encrypted with Homomorphic Encryption. Homomorphic Encryptions allow performing operations such as addition and multiplication over data while it is encrypted. Therefore, it allows keeping data private while outsourcing computation (see here and here for more about Homomorphic Encryptions and its applications). This project demonstrates the use of Homomorphic Encryption for outsourcing neural-network predictions. The scenario in mind is a provider that would like to provide Prediction as a Service (PaaS) but the data for which predictions are needed may be private. This may be the case in fields such as health or finance. By using CryptoNets, the user of the service can encrypt their data using Homomorphic Encryption and send only the encrypted message to the service provider. Since Homomorphic Encryptions allow the provider to operate on the data while it is encrypted, the provider can make predictions using a pre-trained Neural-Network while the data remains encrypted throughout the process and finaly send the prediction to the user who can decrypt the results. During the process the service provider does not learn anything about the data that was used, the prediction that was made or any intermediate result since everything is encrypted throughout the process. This project uses the Simple Encrypted Arithmetic Library SEAL version 3.2.1 implementation of Homomorphic Encryption developed in Microsoft Research.","homomorphic-encryptions,data-encrypted,neural-networks,seal",157
0,https://github.com/bachors/Chat-Realtime.git,Public & Private message. MySQL & Firebase.,"realtime,firebase,chat-realtime,mysql,php,chat,chat-application,chat-room,chatting,jquery,ibacor",156
0,https://github.com/serso/android-messengerpp.git,Multi-protocol open source instant messaging client on Android,,156
0,https://github.com/adow/Dollarss.git,An Instant Message Client by XMPP on iPhone,,156
0,https://github.com/MrZhouYang/LAN_QQ.git,LAN Instant Messaging based on Qt5，Imitate the qq for interface design,,156
0,https://github.com/elodina/dropwizard-kafka-http.git,Apache Kafka HTTP Endpoint for producing and consuming messages from topics,,155
0,https://github.com/alainmeier/cryptonote.git,:lock: A simple open source web application that lets users encrypt and share messages that can only be read once.,,155
0,https://github.com/Arkham/priscilla.git,"{""Don't let your console messages drown in a wall of text, make them stand out!""}",,155
0,https://github.com/php-enqueue/enqueue.git,[READ-ONLY] Messaging solutions for PHP. ,,154
0,https://github.com/pagermon/pagermon.git,Multimon-ng pager message parser and viewer,"javascript,nodejs,angularjs,multimon,sdr,radio,pager,software-defined-radio,pocsag,hacktoberfest",154
0,https://github.com/FIXTradingCommunity/fix-simple-binary-encoding.git,A FIX standard for binary message encoding,"sbe,protocol,fixprotocol,presentation-layer",154
0,https://github.com/zssz/BerkananSDK.git,Bluetooth mesh messaging SDK for apps,"bluetooth,mesh-networks,messaging,ios,macos,watchos,tvos,maccatalyst,mesh-messaging,corebluetooth,background,protobuf,sdk-integrated,nearby-apps,range,berkanan,p2p,flooding,offline",154
0,https://github.com/mikeedwards/po2json.git,Pure Javascript implementation of Uniforum message translation.  Based on a great gist.,,154
0,https://github.com/nccgroup/BinProxy.git,BinProxy is a proxy for arbitrary TCP connections. You can define custom message formats using the BinData gem.,,154
0,https://github.com/arunoda/meteor-ddp-analyzer.git,Simple DDP Proxy which logs DDP messages,,153
0,https://github.com/osiegmar/logback-gelf.git,Logback appender for sending GELF messages with zero additional dependencies.,"logback,graylog,gelf-messages,udp,tcp,logback-appender,tls-configuration,gelf,gelf-appender",153
0,https://github.com/vlajnaya-mol/message-analyser.git,Statistical analysis of VKontakte and Telegram message history.,,153
0,https://github.com/gomidi/midi.git,Library for reading and writing of MIDI messages and MIDI files (SMF) with Go,"midi,midi-files,smf,music,golang,go",153
0,https://github.com/SteffeyDev/atemOSC.git,Control ATEM video switchers over the network with OSC messages,"atem,blackmagicdesign,osc,video-switchers,atem-video-switcher",152
0,https://github.com/kservices/gBridge.git,"gBridge.io allows you to control (almost) anything with Google Assistant, by translating voice commands to MQTT messages.","mqtt,mqtt-message,voice-commands,smarthome,assistant,google-assistant,google-assistant-api,diy,homeautomation",152
0,https://github.com/oarevalo/BugLogHQ.git,"BugLogHQ is a tool to centralize the handling of automated bug reports from multiple applications. BugLogHQ provides a unified view of error messages sent from any number of applications, allowing the developer to search, graph, forward, and explore the bug reports submitted by the applications.",,152
0,https://github.com/webianks/msgs.git,:inbox_tray: Messaging app utilising some of the sms APIs.,"messenger,android",151
0,https://github.com/judwhite/NsqSharp.git,"A .NET library for NSQ, a realtime distributed messaging platform","nsq,messaging,service-bus",151
0,https://github.com/eric-wieser/ros_numpy.git,Tools for converting ROS messages to and from numpy arrays,,151
0,https://github.com/daattali/shinyalert.git,🗯️ Easily create pretty popup messages (modals) in Shiny,"r,shiny,rstats,r-package,shiny-r",151
0,https://github.com/jazzychad/fanout.node.js.git,A simple fanout pubsub message server for node.js,,151
0,https://github.com/s3rvac/weechat-notify-send.git,A WeeChat script that sends highlight and message notifications through notify-send.,"weechat,notifications",151
0,https://github.com/Matthias247/jawampa.git,Web Application Messaging Protocol (WAMP v2) support for Java,,150
0,https://github.com/bulldog2011/luxun.git,"A high-throughput, persistent, distributed, publish-subscribe messaging system based on memory mapped file and Thrift RPC",,150
0,https://github.com/dotnet-architecture/Messaging.git,.NET Core Application blocks for message-based communication,,150
0,https://github.com/jpmens/mqtt-launcher.git,Execute shell commands triggered by published MQTT messages,,150
0,https://github.com/hjwp/pytest-icdiff.git,better error messages for assert equals in pytest,,150
0,https://github.com/hasinhayder/themeforest-wp-theme-approval-checklist.git,A comprehensive list of rejection messages which you should avoid to get your WordPress theme approved quickly in Themeforest,"wordpress,wordpress-plugin,wordpress-theme-development,wordpress-theme,themeforest,themeforest-wordpress-themes",150
0,https://github.com/planetargon/flash-message-conductor.git,A simple pattern for managing flash messages in your Ruby on Rails application.,,150
0,https://github.com/kristofferandreasen/react-announcement.git,📣 Push out beautiful website announcements in React 📣 An NPM package to quickly convey your message to visitors.,"react,reactjs,typescript,javascript,create-react-library,hacktoberfest",150
0,https://github.com/kutia-software-company/larafirebase.git,😍 Laravel Firebase Cloud Messaging. ✍️ Developed by Gentrit Abazi.,"laravel,laravel-firebase,larafirebase,laravel-firebase-push-notification,laravel-real-time,laravel-push-notifications,php,php-firebase,laravel-fcm,php-fcm,firebase-cloud-messaging,firebase,notifications",149
0,https://github.com/coderello/laraflash.git,⚡ Flash messages on steroids.,"laraflash,laravel,advanced,flash,messages",149
0,https://github.com/doodyparizada/word2vec-spam-filter.git,Using word vectors to classify spam messages,"react,word2vec,webpack,stylus,flask,typescript,antispam,glove-vectors,schematics,numpy",149
0,https://github.com/OpenSmpp/opensmpp.git,"OpenSmpp - Java library implementing the SMPP protocol, and allowing development of External Short Message Entities (ESMEs) and more.",,149
0,https://github.com/michaelkourlas/voipms-sms-client.git,"Popular Android messaging app for VoIP.ms, a Canadian VoIP provider","voip,voip-ms,sms,android,kotlin,java",148
0,https://github.com/finnp/gitter-irc-bot.git,:speech_balloon: Bot that synchronises messages from gitter and irc,,148
0,https://github.com/postcss/postcss-reporter.git,Log PostCSS messages in the console,,148
0,https://github.com/smorks/keepassnatmsg.git,KeePass plugin to expose credentials securely to a browser using Native Messaging,,148
0,https://github.com/emilsedgh/modem.git,Send and receive messages and make ussd queries using your GSM modems,,148
0,https://github.com/akiyamaSM/messager.git,A convenient way to handle messages between users in a simple way,"laravel,messaging,convenient",148
0,https://github.com/sirupsen/localjob.git,"Simple, self-contained background queue built on top of SysV message queues.",,148
0,https://github.com/Moocar/logback-gelf.git,Logback plugin to send GELF messages to graylog2 server,,147
0,https://github.com/jcmore2/BannerTime.git,BannerTime create a scheduled popup to show your personal message,,147
0,https://github.com/DanWahlin/AngularOverlay.git,AngularJS directive used to automatically intercept XHR requests and show an overlay and message in a web page.,,147
0,https://github.com/futuresimple/broadcast.git,A broadcasting microframework making publishing of messages to different services easy.,,147
0,https://github.com/marcosesperon/Messi.git, A simple message plugin for jQuery,,146
0,https://github.com/smancke/guble.git,websocket based messaging server written in golang,,146
0,https://github.com/leonid-shevtsov/unobtrusive_flash.git,Turnkey Flash messages for your Rails app,,146
0,https://github.com/domi007/silentSMS.git,This is a free Android app that can be used to send silent text messages.,,146
