,Url,Description,Topics,Stars
144,https://github.com/akhahaha/burn-android.git,Comeback crowdsourcing app,,4
145,https://github.com/engageis/crowdsourcing-conference.git,Website of Crowdsourcing Conference 2012,,4
146,https://github.com/sdfb/sdfb_spring2014IS.git,"This repository contains code to visualize a social network with a simple spreadsheet database, an early version of our crowdsourcing website reassembling the social network of early modern Britain.",,4
147,https://github.com/97amarnathk/FRG-Crowdsourcing.git,"A crowdsourcing platform built with PyBossa and Flask as a part of Eklavya Summer Internship, IIT Bombay",,4
148,https://github.com/PanosChristopoulos/Jekiri.git,Crowdsourcing Application using Google Location Data,,4
149,https://github.com/harryio/TaskHive.git,Open and distributed p2p crowdsourcing internet marketplace,,4
150,https://github.com/danmcquillan/sccs.git,"social media, crowdsourcing & citizen sensing (IS52035A, IS53038A)",,4
151,https://github.com/sig-gis/mapcha.git,"{""SIG's Image Analysis Crowdsourcing Platform""}",,4
152,https://github.com/tcha-tcho/free_kunigo.git,"{""a opensource crowdsourcing tool. 'Kunigo' means 'Aliance' in Esperanto.""}",,4
153,https://github.com/sdmunozsierra/DrivingSensorData.git,"{""Android Application for Crowdsourcing Road Topology using Smartphone's Sensors""}","sensors,android,research-project,big-data,crowdsourcing",4
154,https://github.com/aekpalakorn/crowdsourced-label-aggregator.git,Estimating true labels from multiple workers in crowdsourcing tasks,,4
155,https://github.com/SionHu/Fairvision.git,Use crowdsourcing to detect bias in visual datasets,,4
156,https://github.com/KevinRoitero/crowdsourcingTruthfulness.git,"repository for the papers: ""Crowdsourcing Truthfulness: The Impact of Judgment Scale and Assessor Bias"" and ""Can The Crowd Identify Misinformation Objectively? The Effects of Judgment Scale and Assessor\'s Background""",,4
157,https://github.com/adradr/Consensys-Bootcamp-Final-Project-researchDAO.git,researchDAO is a platform for crowdsourcing and coordinating research of all kind,"dao,solidity,ethereum,consensys,consensys-academy,research,researchdao",4
158,https://github.com/johnjosephhorton/Hagglebot.git,A GAE program for negotiating about payment rates in a paid crowdsourcing setting,,4
159,https://github.com/regardscitoyens/consultation_an.git,"{""Site du crowdsourcing de la consultation sur l'égalité femme/homme""}",,4
160,https://github.com/geotagx/geotagx-pybossa-archive.git,Open-source crowdsourcing (microtasking) platform with a focus on volunteer contribution and making it super-easy to create a crowd-sourcing app.,,4
161,https://github.com/ESA-PhiLab/buried-archaeology.git,Task generating and task run processing scripts as well as task presenter HTMLs for the Buried Archaeology crowdsourcing project hosted on PyBossa.,"buried-structures,archaeological-structures,rescue-archaeology,archaeology,crowdsourcing,esa",4
162,https://github.com/leodc/repubikla.git,"Tool that with a crowdsourcing strategy seeks to generate and centralize data of non-motorized urban mobility, the aim is to complement official information and offer a diagnosis of the citizen perception of public space.",,4
163,https://github.com/ahmed-hazem-refaie/django_Crowd-Funding-web-app.git,"Crowdfunding is the practice of funding a project or venture by raising small amounts of money from a large number of people, typically via the Internet. Crowdfunding is a form of crowdsourcing and alternative finance. In 2015, over US$34 billion was raised worldwide by crowdfunding. (From Wikipedia) The aim of the project: Create a web platform for starting fundraise projects in Egypt. The web app should include the following features: 1 - Authentication System: - Registration: - First name - Last name - Email - Password - Confirm password - Mobile phone [validated against Egyptian phone numbers] - Profile Picture - Activation Email after registration - Once the user register he should receive an email with the activation link. The user shouldn’t be able to login without activation. The activation link should expire after 24 hours.  - Login - The user should be able to login after activation using his email and password - Bonus: Allow users to login with facebook account - Forgot Password (Bonus) - The user should have an option to reset his password if he forgot it to receive a password reset link to his email  - User Profile, The user can view his profile which: - He can view his profile - He can view his projects - He can view his donations - He can edit all his data except for the email - He can have extra optional info other than the info he added while registration (Birthdate, facebook profile, country) - User can delete his account (Note that there must be a confirmation message before deleting) - Bonus: User must enter his password to delete his account  2 - Projects: - The user can create a project fund raise campaign which contains: - Title - Details - Category (from list of categories added previously by admins) - Multiple pictures - Total target (i.e 250000 EGP) - Multiple Tags - Set start/end time for the campaign - Users can view any project and donate to the total target - Users can add comments on the projects - Bonus: Comments can have replies - Users can report inappropriate projects - Users can report inappropriate comments - Users can rate the projects - Project creator can cancel the project if the donations are less than 25% of the target - Project page should show the overall average rating of the project - Project page should show the project pictures in a slider  - Project page should show 4 other similar projects based on project tags 3 - Homepage should contains the following: - A slider to show the highest five rated running projects to encourage users to donate - List of the latest 5 projects - List of latest 5 featured projects (which are selected by the admin) - A list of the categories. User can open each category to view its projects - Search bar that enables users to search projects by title or tag",,4
164,https://github.com/kaixiong/bersih-pemantau.git,Bersih Pemantau crowdsourcing site,,3
165,https://github.com/ubriela/geocrowd.git,A Server-Assigned Spatial Crowdsourcing Framework,,3
166,https://github.com/ubriela/geocrowd-priv.git,A framework for protecting worker location privacy in spatial crowdsourcing,,3
167,https://github.com/sdubinsky/fencing-database.git,Website for crowdsourcing a fencing stats database,,3
168,https://github.com/ubriela/geocrowd-priv-demo.git,Private Spatial Crowdsourcing Demo,,3
169,https://github.com/wazho/Tree-of-Savior-Chinese-Translation-Voting.git,MMORPG Tree of Savior - Chinese translation crowdsourcing system.,,3
170,https://github.com/David-Jackson/RoadQuality.git,An Android app to make roads better by crowdsourcing road quality.,,3
171,https://github.com/justin-cotarla/CaptionThis.git,An online crowdsourcing caption platform.,,3
172,https://github.com/transifex/transifex-old-core.git,"Translation workflow & crowdsourcing for agile teams. Older, open-source codebase of Transifex.com",,3
173,https://github.com/cjld/ANNO-server.git,An online crowdsourcing annotation tool for large scale image segmentation.,,3
174,https://github.com/turkeyes/bubbleview.git,Crowdsourcing human attention using a cursor-based moving-window methodology.,,3
175,https://github.com/Interque/interque.git,interque is a resource for crowdsourcing technical interview questions,,3
176,https://github.com/Open-Speech-EkStep/crowdsource-dataplatform.git,This will hold the crowdsourcing platform to be used to store voice data from various speakers which will act as input dataset for speech-to-text pipeline,,3
177,https://github.com/KevinLu/htn2020.git,Crowdsourcing platform for datasets. Request data from the community and contribute to open source data!,,3
178,https://github.com/ails-lab/crowdheritage.git,Crowdheritage is an open crowdsourcing platform fot the enrichment of cultural heritage metadata.,,3
179,https://github.com/sohanvichare/SwiftAssist.git,Crowdsourcing emergency response to save lives when 911 cannot get there fast enough.,,3
180,https://github.com/chgrl/mapillRy.git,An R interface to Mapillary.com - a service for crowdsourcing street level photos,,3
181,https://github.com/ishaanjav/BirdWatch.git,A better tracking of endangered bird species using machine learning and crowdsourcing.,"computer-vision,machine-learning,android,android-application,webapp,bird-species,endangered-species,birdwatch,firebase",3
182,https://github.com/markng/camfin.git,Campaign Finance Crowdsourcing,,3
183,https://github.com/TarekAwwad/CrowdED.git,Crowdsourcing Evaluation Dataset,,3
184,https://github.com/karthikb351/notonzomato.in.git,Crowdsourcing street food!,,3
185,https://github.com/ProjectTwentyFive/task-sourcing.git,Taskr - Crowdsourcing Tasks Made Simple,"crowdsourcing,tasksourcing,php,laravel,sql,postgresql",3
186,https://github.com/geogeeks-au/maps-for-lost-towns.git,Georeferencing historic maps through crowdsourcing,,3
187,https://github.com/julianmichael/spacro.git,Single-Page Applications for Crowdsourcing,,3
188,https://github.com/DAC-2014-Equipe-3/sujet-2.git,Crowdsourcing application for scholar projets,,3
189,https://github.com/RadicalImaging/crowdquant.git,A stripped down viewer for crowdsourcing measurements ,,3
190,https://github.com/CollaboRateMgmt/CollaboRate.git,A crowdsourcing process and software tool.,"crowdsourcing,software-engineering,project-management,visual-programming",3
191,https://github.com/XLab-Tongji/crowdsourcing-mart-api.git,the crowdsourcing mart server api project.,,3
192,https://github.com/veniversum/crowdify.git,🎧Music from everyone. Crowdsourcing Spotify playlists.,"spotify,playlist",3
193,https://github.com/WilhelmWillie/auxq.git,A service for crowdsourcing the aux cord ,,3
194,https://github.com/soulintzis/Google-maps-Location-Takeout-Visualizer.git,Crowdsourcing application using Google Timeline Data,"web-development,javascript,html-css,ejs-express,nodejs",3
195,https://github.com/BUAA-BDA/SpatialCrowdsourcing-Survey.git,The paper list of our survey on spatial crowdsourcing,"spatial-crowdsourcing,spatial",3
196,https://github.com/CSBP-CPSE/JARCID.git,Monitoring tool for the Crowdsourcing with OpenStreetMap project,,3
197,https://github.com/linux-ram/Evaluate-Crowd-Participant.git,Evaluating Crowdsourcing Participants in the Absence of Ground-Truth,,3
198,https://github.com/xinranxiao/AskMeteor.git,Crowdsourcing answers to questions one. piece. at. a. time.,,3
199,https://github.com/yooli23/LEGOEval.git,A toolkit for dialogue system evaluation via crowdsourcing,,3
200,https://github.com/melissayu/DeliveryPlease.git,Android application project for CS160: App for crowdsourcing restaurant delivery,,3
201,https://github.com/lunaroyster/urgency-sort.git,A system for crowdsourcing urgent requests from keralarescue.in,,3
202,https://github.com/Kongwtf/crowdball.git,A simple crowdsourcing game built with HTML5 and XMPP,,3
203,https://github.com/DionWu/crowder.git,Crowdsourcing Marketing Campaigns from everyday individuals with social media,,3
204,https://github.com/dwh-outsite/artpiece.git,🖼 Crowdsourcing and crowdfunding an LGBT+ art piece in Delft,,3
205,https://github.com/esalazar/WAMITurk.git,WAMITurk is a combination of different technologies used to enhance speech recognition training through crowdsourcing.,,3
206,https://github.com/FreeUKGen/FromCursiveToDatabase.git,"An open-source suite of tools for manipulating facsimiles, crowdsourcing transcription and searching transcripts",,3
207,https://github.com/RoundPegs9/vote-the-internet-chrome-extension.git,Crowdsourcing trust on the internet by voting on the content of ANY website.,"decentralized-applications,nodejs,chrome-extension,javascript,mongodb,hacktoberfest,hacktoberfest2020",3
208,https://github.com/Ukuli-Data/Ukuli-Tulevaisuus-Site.git,"Crowdsourcing open source website about our possible future scenarios. Data feeds, visualizations and analysis.","crowdsourcing,data-science,social-network,laravel,python,r,react,data-visualization,datascience,social-sciences,social-networks,discussion-forum,open-source,php7,data-mining,content-management",3
209,https://github.com/thecraftman/Outreachy.git,Project Tracker for Outreachy 2020:  Crowdsourcing Translation for @chaoss Diversity & Inclusion Badging. ,"outreachy,chaoss,project-tracker,outreachy-2020,i18n,translation",3
210,https://github.com/bcsaldias/yes-no-crowdsourcing.git,A Full Probabilistic Model for Yes/No Type Crowdsourcing in Multi-Class Classification,,3
211,https://github.com/maribelacosta/crowdsourcing-tutorial.git,Tutorial that introduces the most popular approaches to microtask crowdsourcing for Semantic Web problems.,,3
212,https://github.com/qiusihang/vcrowd.git,VirtualCrowd: A Web-based Crowdsourcing DEVS (Discrete EVent System) Simulation Platform,,3
213,https://github.com/uw-hai/guru.git,Reinforcement learning agent that maximizes crowdsourcing quality by teaching and testing,,3
214,https://github.com/syrnick/portable-task-interface.git,Portable task interface provides a generic task framework for crowdsourcing. The task can be independent of the crowdsourcing platform and allows any platform to run existing tasks in a blast. ,,3
215,https://github.com/Guppster/HackingCancer.git,:cancer: Game design project utilizing the power of crowdsourcing to improve cancer research. Made for HackWestern in 36 Hours,,3
216,https://github.com/x-risk/x-risk.git,The Existential Risk Research Assessment (TERRA) application uses crowdsourcing and machine learning to help produce an open-access bibliography of publications about existential risk and global catastrophic risk.,,3
217,https://github.com/sarbabi/SolveIt.git,"SolveIt is a crowdsourcing game developed in D3.js, which employs wisdom of the crowd to solve NP-hard location allocation problems. The study published in Springer Computing 2019.","crowdsourcing,game-development,d3js",3
218,https://github.com/RajkumarPadilam/CrowdSourcing_QuestionAnsweringSystem.git,"Its a CrowdSourcing based Question and Answering Android Application that uses Data mining techniques to segregate Users. It has features like Map based Location Service, Notifications to Users, Gallery based Image Taxonomy , etc",,3
219,https://github.com/SlashRoot/django-crowdsourcing.git,"Django-crowdsourcing is an MIT-licensed survey and report tool for journalists, supporting many types of survey questions and a wide variety of reporting options. A reusable Django application, it is designed to be installed easily in any Django site, including multi-site installations. Its surveys are entirely configured within the admin interface that ships with Django.  While the primary focus of development is support for crowdsourcing projects, the survey tool is general purpose and can be used for a variety of applications. It is easy enough to handle simple polls with pie charts, yet powerful enough to handle complicated surveys with rich multimedia responses plotted on a map with custom icons. ",,3
220,https://github.com/soulmachine/crowdcrawler.git,Crawling Data with Crowdsourcing,,2
221,https://github.com/MAPC/massbuilds-legacy.git,Crowdsourcing authoritative info on recent & ongoing developments in Massachusetts.,,2
222,https://github.com/datea/datea-webapp.git,"Web client for Datea, a crowdsourcing and civic engagement platform.",,2
223,https://github.com/cestastanford/crowdsourcing.git,Web files for the Crowdsourcing project,,2
224,https://github.com/mpgallage/Sinhala-WordNet-CSS.git,This is the Sinhala wordnet crowdsourcing system.,,2
225,https://github.com/occamLab/eye-helper-cv.git,Prototyping computer vision/crowdsourcing features for an assistive technology project ,,2
226,https://github.com/shivtools/OpenTrckr.git,OpenTrckr - crowdsourcing live data on the Zika Virus to help governments and their citizens.,,2
227,https://github.com/SkyTruth/pybossa_tools.git,Crowdsourcing tools based on PyBossa,,2
228,https://github.com/ThinerZQ/CrowdSourcing.git,a crowdsourcing application based on business object oriented workflow engine. the best crowdsourcing platform.(一个基于面向业务对象的众包平台),,2
229,https://github.com/ubriela/geocrowd-complex.git,Maximum Complex Task Assignment in Spatial Crowdsourcing,,2
230,https://github.com/nicolas17/kuona.git,Kuona - Crowdsourcing web app for HOT,,2
231,https://github.com/ernestoho/consamables.git,A social networking application for crowdsourcing food-related delivery orders and group outings.,,2
232,https://github.com/hkumar1993/Guardian-Angel.git,Crowdsourcing community outreach. Use your phone to reach out to those who need the help,"social-impact,nodejs,graphql,mongodb,react-native,apollo,expo",2
233,https://github.com/STIPCommonsLab/ccsinventory.git,"Crowdsourcing and citizen science inventory, by Commons Lab",,2
234,https://github.com/maqqbu/MMSR.git,The code for NeurIPS 2020 paper: Adversarial Crowdsourcing Through Robust Rank-One Matrix Completion.,,2
235,https://github.com/kev5/dVote.git,Decentralized voting and crowdsourcing application using Ethereum and Node.js :ballot_box_with_check:💲,,2
236,https://github.com/alternaDev/crazyPI.git,Crowdsourcing Pi,,2
237,https://github.com/WillForan/metaImage.git,crowdsourcing events,,2
238,https://github.com/organisciak/crowdy.git,Crowdsourcing platform,,2
239,https://github.com/rainble/crowd_server.git,crowdsourcing server ,,2
240,https://github.com/douglas-watson/crowdcalls.git,Crowdsourcing hotlines,,2
241,https://github.com/qinzhewudao/Youma.git,Youma Crowdsourcing website,,2
242,https://github.com/salmafg/beehive-server.git,A crowdsourcing annotation platform.,,2
243,https://github.com/tamarasaurus/latemate.git,crowdsourcing for GTFS data,,2
244,https://github.com/clarabayarri/crowd.git,Generic crowdsourcing platform,,2
245,https://github.com/AlgoHive/AlgoHive-Nexus.git,Crowdsourcing cryptocurrency prediction algorithms.,,2
246,https://github.com/larsmagne/csid.git,Crowdsourcing Is Dead,,2
247,https://github.com/JustSnow/news_portal.git,crowdsourcing news portal,,2
248,https://github.com/david-gay/2340.git,Group project: Crowdsourcing freshwater,,2
249,https://github.com/mfuery/communitycache.git,CommunityCache - Crowdsourcing disaster relief,,2
250,https://github.com/qiusihang/ticktalkturk.git,TickTalkTurk: Conversational Crowdsourcing Made Easy,,2
251,https://github.com/mtopping/Guess-Weather.git,Mobile app for crowdsourcing weather,,2
252,https://github.com/Agile-Puppers/Clean-Water.git,Clean Water Crowdsourcing JavaFX application,,2
253,https://github.com/CopenhagenCityArchives/Kildetaster.git,Frontend for crowdsourcing archival material,,2
254,https://github.com/linkedjazz/linked-jazz-prototype-52nd.git,A prototype test crowdsourcing tool,,2
255,https://github.com/idearun/TechPin.git,"TechPin is simply an Open sourced, Crowdsourced, Non-profit project. The Main Goal of TechPin is to promote and share startups and products in global market, with a crowdsourcing solution.","django,python",2
256,https://github.com/AmrARaouf/beehive-webapp.git,Beehive | A crowdsourcing annotation platform.,"angular2,angular-cli,javascript,typescript",2
257,https://github.com/crowdhorn/horngame.git,Crowdsourcing of Horn clause abduction,,2
258,https://github.com/fela/prosncons.git,crowdsourcing pros and cons on controversial issues,,2
259,https://github.com/Scifabric/project-realtimeresults.git,Real time crowdsourcing image pattern recognition.,"pybossa,realtime,webhook",2
260,https://github.com/lysdexia/messhaul.git,Simple service for crowdsourcing pickup and delivery.,,2
261,https://github.com/CrowdsourcingGeek/CrowdBenchmark.git,BATC2 - benchmarking aggregation techniques in crowdsourcing environment,,2
262,https://github.com/volontariat/voluntary_text_creation.git,Volontari.at crowdsourcing product text creation,,2
263,https://github.com/MaastrichtU-IDS/crowdsourcing-workshop.git,Slides for the Workshop on Crowdsourcing,,2
264,https://github.com/volontariat/voluntary_translation.git,Translation product for crowdsourcing plattform gem voluntary,,2
265,https://github.com/sunziping2016/crowdsourcing-platform-server.git,Sever Side for Our Crowdsourcing Platform,,2
266,https://github.com/mershack/graphunit.git,GraphUnit-Evaluating interactive visualizations using crowdsourcing. ,,2
267,https://github.com/drewstone/truecoin.git,Peer-prediction mechanisms for crowdsourcing information,,2
268,https://github.com/BUAA-BDA/SpatialCrowdsourcing-LTC.git,Latency-oriented Task Completion via Spatial Crowdsourcing,"spatial-crowdsourcing,task-assignment,latency-control",2
269,https://github.com/InovaUFRPE/Cerana.git,O projeto Cerana é um sistema multiplataforma para consulta através de perguntas ou pesquisa numa base de dados organizada em um sistema baseado no crowdsourcing.,,2
270,https://github.com/crowd-tools/CrowdClick.git,Backend of affordable solution that combines traffic and quantitative data to the advertiser through a crowdsourcing click to view reward model,,2
271,https://github.com/trifectalabs/roadquality.git,Crowdsourcing road quality and traffic safety data for cyclists.,"scala,cycling,strava,crowdsourcing,slick,slick-pg,play-framework,elm-lang,elm-css,road-quality",2
272,https://github.com/alex952/CrowdTransEval.git,A toolkit for evaluating machine translation systems using crowdsourcing,,2
273,https://github.com/CrowdCafe/CrowdKitchen.git,System to manage crowdsourcing tasks via UI or API,,2
274,https://github.com/zozas/topcoder.git,Crowdsourcing in Software Development: Empirical Support for Configuring Contests,,2
275,https://github.com/scottnakada/MissingKids.git,Missing Kids Network - Crowdsourcing the search for Missing Children,,2
276,https://github.com/stheakanath/Crowdify.git,Crowdsourcing Spotify playlists for house parties using P2P mobile networks. ,,2
277,https://github.com/rupakg/traffictweet.git,Twitter App for Crowdsourcing Traffic and Disaster Information,,2
278,https://github.com/fernandesi2244/CrowdCS.git,A Fun and Engaging Crowdsourcing App for Learning Programming Languages,"crowdsourcing,android,learning,online-database,android-studio,back4app",2
279,https://github.com/BUAA-BDA/SpatialCrowdsourcing-MWATP.git,Multi-Worker-Aware Task Planning in Real-Time Spatial Crowdsourcing,"spatial-crowdsourcing,task-assignment,spatial",2
280,https://github.com/saiteja-talluri/Fake-News-Detection-using-CrowdSourcing.git,Web App for crowdsourcing the verification of spurious news articles.,"database-management,database-design,ajax,js,sql,crowdsourcing,fake-news",2
281,https://github.com/gaarangoa/ARGminer.git,Curation of Antibiotic Resistance Genes by using crowdsourcing,"antibiotic-resistance,crowdsourcing,database",2
282,https://github.com/turkeyes/zoommaps.git,Crowdsourcing human attention via the pinch zoom mobile device gesture.,,2
283,https://github.com/galamorake/Rute-Map.git,A crowdsourcing site for public transport routes in Botswana. ,,2
284,https://github.com/yob/subjct.git,A sinatra app for crowdsourcing links between BIC and BISAC subjects,,2
285,https://github.com/jeffreyshen19/TranscribePA.git,An extensible platform for rapidly transcribing historical documents using machine-learning and crowdsourcing. ,"digital-humanities,libraries,transcribing-handwritten-documents,transcription",2
286,https://github.com/DGFF-Harmonyhack/Frontend-React-Native.git,Mobile app for anonymous local help requests. Crowdsourcing witnesses and evidence collection.,"evidence,local,map,react,rails,safety,recording",2
287,https://github.com/danjac/rentalerts.git,An idea for crowdsourcing apartment search. Written in Python and Django.,,2
288,https://github.com/ZC-Wei/slua-mobile.git,Android application for “Dynamic Worker Selection for Mobile Spatial Crowdsourcing Leveraging Location-based Social Networks”.,,2
289,https://github.com/RohlederCPH/Master-Thesis-Crowdfinding.git,"Crowdfinding, Localization, Android, Crowdsourcing, Pervasive Computing, Bluetooth Low Energy, BLE, RSSI, Network-assisted location",,2
290,https://github.com/jatorre/flushtopiwi.git,A crowdsourcing project to know where private swimming pools are in Spain,,2
291,https://github.com/TrentoCrowdAI/crowdhub-api.git,CrowdHub sits on top of major crowdsourcing platforms to intelligently assists customers in performing classification tasks.,"crowdsourcing,crowdsourcing-experiments,crowdsourcing-platforms",2
292,https://github.com/jmorg/synapse.git,A low data crowdsourcing app to share information in the wake of a disaster,,2
293,https://github.com/st1064870/city-lens.git,"{""Crowdsourcing application aggregating users' voluntareely shared activity data exported from Google, into heatmaps and graphs.""}",,2
294,https://github.com/uzh/PPLib.git,PPLib People Programming LIBrary: Easily find the best Crowdsourcing process for your application,,2
295,https://github.com/anup-a/Vidyakosh.git,A Nodejs based webapp built on expressjs for crowdsourcing data of Institute courses.,,2
296,https://github.com/saracope/citsci-toolkit-styleguide.git,Style guide for the federal crowdsourcing and citizen science innovation toolkit.,,2
297,https://github.com/heathd/twentyfiveten.git,A hacky experiment to support the 25/10 crowdsourcing liberating structure online,liberatingstructures,2
298,https://github.com/samhinsh/Rise-App.git,"{""A mobile platform crowdsourcing peoples' perspectives to craft visual histories of prominent events.""}",,2
299,https://github.com/jLukeC/PReTweet.git,an app that uses crowdsourcing to determine how audiences will react to specific tweets,,2
300,https://github.com/justrdk/redadas-de-obama.git,A web app for crowdsourcing immigration raid info so undocumented people can avoid them.,,2
301,https://github.com/jLukeC/PReTweet.git,an app that uses crowdsourcing to determine how audiences will react to specific tweets,,2
