,Url,Description,Topics,Stars
0,https://github.com/codeforboston/urbanite.git,"{""Urbanite: Boston is an app that allows users to access 'hidden' cultural gems in their local environment by leveraging social media streams from local venues and cultural organizations like bands, artists, authors, chefs, etc. It's based on the idea that most major media outlets don't necessarily know or report on what bands are playing at the Middle East or what movies are at the Brattle, but those places are promoting their lineups on their own Facebook and Twitter feeds. By aggregating those feeds by category and sub-category, we can let people explore cultural events in their neighborhoods. ""}",,10
0,https://github.com/android-bash/AndroidBash-FirebaseAdmob.git,"{""Admob is the #1 mobile advertising platform to grow your app business and is powered by Google’s ad technology. You can integrate AdMob in your android application and start earning right away. The best way to use AdMob is with Firebase, though Google Mobile Ads SDK remains available as a standalone SDK which can also be used to integrate Admob with your android application. Admob publishers can start taking advantage of Firebase's free and unlimited analytics solution to monetize more intelligently, just by linking with Firebase and importing the Firebase SDK into your android application. In this tutorial we will be showing how to integrate Admob with your android application using Firebase.  <p>Now let us create an android application on which we can integrate Firebase Admob to display Banner ads, Interstitial ads and Native Ads.</p> 1. We will display a <strong>Banner ad</strong> at the bottom of the activity. 2. We will display an <strong>Interstitial ad</strong> covering the whole screen, once the user clicks on an item in the list of movies. 3. We will display <strong>Native ads</strong> in between the list of movies displayed in a RecyclerView. The steps will be described in five detailed yet simple parts.""}",,10
0,https://github.com/MozzieMD/Popcorn.git,Watch movies easier,,9
0,https://github.com/esentis/Flutter-Movies-Application.git,A movies application made with Flutter / Dart.,"movies-application,flutter-movies,flutter-app,flutter-online-movies,flutter-movie-app",9
0,https://github.com/blue-troy/porn.git,auto download 91porn hot movies,"scrapy,porn,crawler,python",9
0,https://github.com/leschzinerlab/Motion-correction.git,Scripts for aligning cryo-electron microscopy direct electron detector movies on whole movies or individual particle trajectories,,9
0,https://github.com/madrasthemes/masvideos.git,"MAS Videos is a free plugin that allows you to to create and list movies, videos and TV shows.",,9
0,https://github.com/theshubhagrwl/MyMovieTime.git,See how much time you spent on watching awesome movies!,"reactjs,js,react,movie,webapp,movies",9
0,https://github.com/BuddhaNag12/Movie-Intent.git,movies listing app,"movie-database,movieapp,movies,themoviedb,search-movies,movie-intent,tmdb",9
0,https://github.com/CouchPotato/Alfred-Workflow.git,Alfred 2 Workflow to easily add movies,,9
0,https://github.com/zapat0s/NetflixClone.git,A simple netflix clone that allows users to browse and watch movies and tv shows.,,9
0,https://github.com/abdulhannanali/moviedb-popular-moives.git,TheMovieDB popular movies front end using ReactJS and component libraries such as react-bootstrap,,9
0,https://github.com/amanciobouza/movieontology.git,The movie ontology MO provides a controlled vocabulary to semantically describe and specify everything related to movies.,,9
0,https://github.com/Kaede-No-Ki/moviecorner-app.git,"An Android Application for streaming Anime, Movies and Series.","anime-streaming,movie-streaming,hacktoberfest",9
0,https://github.com/fadoaglauss/stremio-brazilian-addon.git,Stremio addon for dubbed movies in portuguese.,,9
0,https://github.com/AmruthPillai/ReelDB.git,This is a website for movie buffs. Visit the directory below to see a list of movies in our collection!,,9
0,https://github.com/shb9019/FmoviesDownloader.git,Script to download movies and series from Fmovies,,9
0,https://github.com/Crossoufire/MyLists.git,My Lists - Track all your TV shows and Movies,"website,flask,tv-shows,lists",9
0,https://github.com/Leo555/Top250-IMDB.git,IMDB Top250 movies ,"movies,imdb,vue,spider",9
0,https://github.com/demanuel/dessubdb.git,download (or upload) subtitles for your movies from the thesubdb.com database.,,9
0,https://github.com/thegenuinegourav/Movies-Recommender.git,A system to recommend movies according to ratings provided by users using Collaborative Filtering Learning Algorithm.,"movies-recommendation,recommender-system,recommendation-algorithms,matlab,octave,collaborative-filtering,machine-learning,machine-learning-algorithms",9
0,https://github.com/tanmayrajani/cinephi1e.git,"A Messenger chatbot that suggests movies, provides plot summary.. things like that","messenger,messenger-chatbot,nodejs",9
0,https://github.com/gilmaimon/Discord-Movies-Bot.git,A discord bot to fetch torrent downloads and subtitles for movies,"discord,discord-bot,movies,torrent,subtitles",9
0,https://github.com/SaadatRizvi/Movie-Recommendation-System.git,"Implemented Content-based filtering, Collaborative filtering and K-Means Clustering on MovieLens Dataset(https://www.kaggle.com/rounakbanik/the-movies-dataset/data)","recommender-system,content-based-recommendation,collaborative-filtering,k-means-clustering",9
0,https://github.com/xxczaki/movies-cli.git,🎥 Get information about your favorite movies,"movies,tmdb,tmdb-api,graphql,api,movie,film,cli,cli-app,app,nodejs,npm,cinema,db,database,imdb,search,info,got,chalk",9
0,https://github.com/jone/plex-trakt-syncer.git,Sync watched movies from plex to trakt.,,9
0,https://github.com/harvard-lil/shelfio.git,"Build and share shelves of books, movies, albums, and most anything on the web ",,9
0,https://github.com/redd29/movii.git,[wip]: An android app to show everything you want to know about the movies and TV shows!,"android-application,tmdb-api,omdb-api,mvp-android,rxjava2,rxandroid,retrofit2",9
0,https://github.com/danielmiessler/Self.git,"A tracking system for everything me, e.g.: beliefs, passions, must-haves, must-dos, favorite movies, favorite quotes, favorite aphorisms, etc.",,9
0,https://github.com/oliveira-marcio/popular-movies-clean.git,"{""Udacity's Popular Movies project with Clean Architecture""}","clean-architecture,android,state-machine,tmdb-api,udacity",9
0,https://github.com/odwrtw/polochon.git,Organizes your movies and shows with Kodi metadata,hacktoberfest,9
0,https://github.com/ArionMiles/Diomedes.git,Email alerts for your favorite movies about to hit theaters,"django,redis,docker,docker-compose,nginx,gunicorn,postgresql",9
0,https://github.com/Nukesor/encarne.git,:tv: Reencode all your movies to h.265,"encoding,video-container,x265,python3",9
0,https://github.com/mariotacke/radarr-ombi-sync.git,Remove available movies from your Radarr watch list,"radarr,ombi,sync,api,nodejs",9
0,https://github.com/felixarntz/movie-log.git,"Log the movies your watch in WordPress, using IMDB.",,9
0,https://github.com/mickey0524/douban-movie.git,"🎬a website based on python (flask) and react , for data display and data visualization analysis through crawling Douban movies","flask,react,crawler",9
0,https://github.com/ImprontaAdvance/react-native-media-player.git,A React Native module that allows you to use the native Media Player Framework Reference to play movies,,9
0,https://github.com/b-alidra/MyTransmission.git,"My Transmission is a Titanium application, for iOS & Android, that lets you browse the largest existing database of movies and TV shows. Trailers, casting and the most important ... torrents.",,9
0,https://github.com/LiTO773/trakt-mpv.git,A MPV script that checks in your movies and shows with Trakt.tv,,9
0,https://github.com/clipperhouse/piracydata.git,A site which correlates the most pirated movies with their legal availability.,,9
0,https://github.com/rishavanand/bookmyshow-cli.git,:movie_camera: CLI for listing movies playing in your city via BookMyShow,"bookmyshow,bookmyshow-cli,typescript,npm",9
0,https://github.com/achvaicer/OpenSubtitleDownloader.git,A simple windows service that download the subtitle of movies and series on a specific directories.,,9
0,https://github.com/bmedicke/arvakr.git,autonomous motorized 📸 camera slider 🤖 to create dynamic timelapse movies with a DSLR. programmable via a smartphone,"stepper-motor,stepper-driver,bluetooth,photography,time-lapse,avr,c,hardware,camera-slider,dolly",9
0,https://github.com/kzisme/MovieTrack.git,A little python programming exercise that can track and rate movies viewed.  ,,9
0,https://github.com/benjaminreid/bitpodcast.com.git,"Bit is a podcast about games, movies, design & development from the mouths of @DavidDarnes & @benjaminreid.",,9
0,https://github.com/Dudemullet/tenna.git,"{""Stream videos from your computer to your iPad, iPhone, x360, Xbone, ps4, android devices and other laptops or pc's in your home network. Makes streaming the movies to a device already connected to your tv, easy.""}",,9
0,https://github.com/codedentwickler/PopularMovies.git,"A Functioning Android App built for the Udacity Associate Android Developer course. App displays a Grid View of Movies from themoviedb API, showcasing MVP pattern, Retrofit, RxJava, Dependency Injection.","mvp-android,rxandroid,retrofit2,glide,guava,mvp-architecture,mvp-pattern,popularmovies,rxjava,gson,dependency-injection",9
0,https://github.com/Chillee/MovieRankings.git,Movies that people living in 110D Dryden Road have watched since the beginning of the 2018-2019 school year,,9
0,https://github.com/roadfire/SwiftTopMovies.git,Lists top movies from the iTunes RSS feed. Learn how to build it in the Beginning Swift course.,,9
0,https://github.com/debugleader/Netflix.git,"Netflix is a streaming service that offers a wide variety of award-winning TV shows, movies, anime, documentaries, and more on thousands of internet-connected devices. ","netflix,clone,react,netlify",9
0,https://github.com/the-fang/Netflix-Movie-recommender-system.git,"Developed a recommendation system in Python using Netflix prize dataset and MovieLens data set using collaborative filtering technique to recommend movies to a user, based on their preferences.",,9
0,https://github.com/natansh25/MVVM_MovieApp.git,"Built an app, to help users discover popular and highly rated movies on the web. It displays a scrolling grid of movie trailers, launches a details screen whenever a particular movie is selected, allows users to save favorites, play trailers, and read user reviews. This app utilizes core Android user interface components and fetches movie information using themoviedb.org web API.","mvvm-architecture,architecture-components,mvvm-android,room-persistence-library,livedata,viewmodel,respository,rxjava2,rxandroid,reactive-programming",9
0,https://github.com/snehalnair/als-recommender-pyspark.git,"Recommender System is an information filtering tool that seeks to predict which product a user will like, and based on that, recommends a few products to the users. For example, Amazon can recommend new shopping items to buy, Netflix can recommend new movies to watch, and Google can recommend news that a user might be interested in. The two widely used approaches for building a recommender system are the content-based filtering (CBF) and collaborative filtering (CF).",,9
0,https://github.com/hugojing/imovie.git,Node.js | Website about movies.,,8
0,https://github.com/neo4j-examples/movies-java-server-extension.git,Neo4j Movies Demo App in java with server-extension,,8
0,https://github.com/itemsapi/itemsapi-example-data.git,"Set of various JSON collections (movies, restaurants, recipes, etc) for demos and tutorials","open-data,example-data",8
0,https://github.com/string-MFathi/Movies_Flutter_App.git,Full Movies Flutter App,"flutter,flutter-ui,flutter-material,flutter-package,json-api,blocpattern,application,android-application,ios-app",8
0,https://github.com/mehulsatardekar/movie-streaming-webapp.git,Movies-streaming-webapp,"json,html,bootstrap,slick-carousel,javascript,jquery,css,media-queries,google-fonts,netflix-ui,hacktoberfest2020,netflix,netflix-clone",8
0,https://github.com/scummvm-director/continuity.git,Tools for working with Macromedia Director movies.,,8
0,https://github.com/neo4j-examples/movies-ruby-neo4jrb.git,Neo4j Movies Demo App in ruby with neo4jrb,,8
0,https://github.com/Pradyuman7/MovieBook.git,"An android app that lets you search for movies and their cast, and helps you discover your taste of movies","movies,recommend-movies,android,android-application,machine-learning,algolia-instantsearch,algolia",8
0,https://github.com/kushalpandya/poster.git,"A React + Redux webapp to list upcoming movies and maintain a watchlist, powered by TMDb",,8
0,https://github.com/popcorn-official/popcorn-sdk.git,SDK for Popcorn Time applications making it easier to retrieve movies / shows with metadata,"popcorn,sdk,popcorn-sdk,movie,metadata,shows",8
0,https://github.com/akkhilaysh/Movie-Recommendation-System.git,Recommender System using Item-based Collaborative Filtering Method using Python. Used “Pandas” python library to load MovieLens dataset to recommend movies to users who liked similar movies using item-item similarity score.,,8
0,https://github.com/nelstrom/radiant-movies-extension.git,"Allows you to manage embedded movies from youTube, vimeo etc.",,8
0,https://github.com/rizbud/TeravinMovie.git,Simple application that displays a list of popular movies.,,8
0,https://github.com/deeps2/Cinema.git,Movie app which shows trailers and plot for upcoming and In-theater movies,"android,recyclerview,glide,grid-layout,cardview,java,youtube-api",8
0,https://github.com/tomiok/movie-suggester.git,This movie suggester get lot of movies from a public database and then you can create a wish list from those. Will recommend some movies for you in the future ,,8
0,https://github.com/DOsinga/pydroste.git,Small python project to generate movies with a droste effect,,8
0,https://github.com/jamerst/AutoTag.git,Automatic tagging and renaming of TV show episodes and movies,"tvdb-api,c-sharp,tags,metadata,automatic,tv,tv-episodes,mp4,mkv,taglib-sharp,rename",8
0,https://github.com/Tolsee/movie-explorer.git,Simple movies explorer app built with :heart: in React.js,"react,flow,react-router-dom",8
0,https://github.com/mikolalysenko/electricorder.git,Records movies with electron,,8
0,https://github.com/umeshsati54/Trending-TV-App.git,"Trending TV is an android app for watching TV episodes and movies on your device. This mobile application delivers the best experience anywhere, anytime. You can instantly watch and download hundreds of TV episodes & movies on your mobile device",,8
0,https://github.com/7color94/movie-rating-distribution-predict.git,Pre-Release Prediction of Crowd Opinion on Movies by Label Distribution Learning,label-distribution-learning,8
0,https://github.com/dkhamsing/fastmdb.git,":mag: Fast iOS app to browse and search movies, tv, actors, credits","swift,ios,tmdb,newsapi,movies,tv",8
0,https://github.com/ttdonovan/emberjs-movies.git,Movies app built with Ember.js and Ember Data (DS.BasicAdapter),,8
0,https://github.com/jogeshpi03/omdb-react.git,"Simple React App to display Movies, Series and Episode - OMDB API ","reactjs,useeffect,usestate,omdb-api",8
0,https://github.com/zeddysoft/MovieAppUsingRxJava.git,This is an app to discover top rated and popular movies using Rx Java ,"rxjava,android,retrofit,rxandroid",8
0,https://github.com/Devcyclops/moviesOget.git,download movies at a go ,,8
0,https://github.com/arindam-modak/YRASS-Media-Player.git,"YRASS Media Player desktop application. Watch videos, movies, listen songs with cool interactive user interface and features.","mediaplayer,java,javafx,fxml,gui,desktop-app",8
0,https://github.com/multi-vac/FrameBars.git,Generate colour palettes of your favourite movies!,,8
0,https://github.com/vycius/udacity-popular-movies.git,Android developer nanodegree: Project Popular Movies app,"movie,android-developer-nanodegree,udacity,popularmovies,android",8
0,https://github.com/DroidGeeks/BigUpMovies.git,"A movie application. Get latest, top rated, upcoming and even theater movies along side there ratings and reviews etc.",,8
0,https://github.com/amazon-archives/fully-automated-neo4j-to-neptune.git,"This AWS CDK app helps you migrate the simple Neo4j movies graph database to Amazon Neptune in a hands-free, fully automated way.","aws-cdk,amazon-neptune,neo4j,migration-tool,aws-cli,amazon-s3-bucket,amazon-iam",8
0,https://github.com/FrancescoCioria/cinema-italy.git,CLI to list movies and cinemas in Italy,,8
0,https://github.com/JerloPH/HomeCinema.git,Organize your local collection of Movies and TV Shows,"media-catalog,cataloguing,cataloging-app,cataloging,homecinema,home-cinema,windows,media-organizer,movie-organizer,tv-show-organizer,movie-information,local-database,movie,movie-database",8
0,https://github.com/DineshSolanki/FoliCon.git,"Creates Folder icons for Movies, Serials, Music, and Games Folders","folder-icons,movies,shows,games,games-folders,icons,poster,professional,folicon,movie-icon-changer,movie-icon,game-icon-changer,rating,customized,ultimate-folder-icon-customizer,automatic,music-icons,music-collection,tmdb-api,hacktoberfest",8
0,https://github.com/derekr/wheredamoviesat.git,Map of all movies in a given location,,8
0,https://github.com/mostafawahied/Cineflix.git,"a flutter application about movies,Tv Shows and Anime.",,8
0,https://github.com/mr-mad-e/angularjs-demo.git,An angular js working demo template with movies database,"angularjs,movies,demo,javascript,sql,prestige,php,template,html",8
0,https://github.com/dikshit18/redux-movie-app.git,"First Redux App setup, calling a 3rd party to API to fetch movies data with infinite pagination",,8
0,https://github.com/khuong291/Flutter-Movie.git,"Full HD Movie For Free. High quality movies every time, everywhere. NodeJS and TheMovieDB for backend side.",,8
0,https://github.com/Ch00k/clapperboard.git,A web app that lists Planeta Kino (http://planeta-kino.com.ua/lvov/) movies and sorts them by IMDB rating,,8
0,https://github.com/desecho/movies.git,"The web application on Django 3, Vue.js 2, Bootstrap 4. Create movie lists (""Watched"" and ""To watch""), rate movies, and add comments.","movie,django",8
0,https://github.com/odaridavid/Smoovie-android-TMDb.git,"A Movies Android App built on TMDB API showcasing popular,trending and upcoming movies.Refactored to MVVM architecture using arch components.","movie,tmdb-api,movies,nanodegree,room-persistence-library,roomdatabase,room,moviedb-api,android,tmdb,udacity,mvvm,architecture-components",8
0,https://github.com/rileypredum/Webscraping-and-Analysis.git,"A two part repo consisting of scraping Sci-Fi movies from IMDB.com and cleaning the data in part one. In part two, I perform EDA and machine learning. More on part two coming soon.",,8
0,https://github.com/Ahmad-Magdy-Osman/WhereIsItStreaming.git,:computer: Streaming Services Finder and Movies DB Explorer Web App :movie_camera:,"movies,movie-database,movies-api,movie-recommendation,streaming-service,python3,login-system,flask,sqlite,imdb,webapp,website",8
0,https://github.com/0Adiber/MinecraftMovies.git,A Spigot Plugin to watch Videos/Movies in Minecraft (proof of concept),"spigot,minecraft,plugin,vanilla,movies,videos,discord,jdm,bot",8
0,https://github.com/RadekSimkanic/Subtitle-Mass-Renamer.git,script for rename subtitles or another files via movies file or another file.,,8
0,https://github.com/fxthomas/VideoLift.git,"Automatic TV shows and movies library, based on the Trakt API",,8
0,https://github.com/bdwilson/XBMCnfo.git,Perl-based XBMC nfo Creator (TV and Movies) and Image Grabber,,8
0,https://github.com/akampjes/trakt-list-import.git,Python script to help you import a list of movies in a file into trakt.,,8
0,https://github.com/prabhuignoto/flixy.git,Delightful React App to discover your favorite Movies and TV Shows,"movies,react-movie-search,react-app,tv,movies-app,react-movies,tmdb,react",8
0,https://github.com/vegidio/imdb-scraper.git,"A java class to get IMDb information of movies, series, etc","java,imdb",8
0,https://github.com/trhura/DatShin.git,"Your second fastest way to find out movies, show times and cinemas in Myanmar ",,8
0,https://github.com/Mouadabdelghafouraitali/TMVDB-Flutter.git,🎬 A Movies & TV Shows flutter app built using the movie db api,"flutter,flutterapp,moviedb-api,flutterui,flutter-plugin,flutter-widget,flutter-package,flutter-apps",8
0,https://github.com/mjdave/FluidNoise.git,"Fluid Noise Generator is a simple fractal noise generator, which can generate tiling looping images and movies from scratch, using Perlin noise to create reliable and repeatable results.",,8
0,https://github.com/mayankkasera/Movie-Stack.git,Movie Stack is Demo App for The Movie Database. it gives you the overview of Movies TV shows & Actors from the largest community network The Movie Database (TMDb),"mvvm,rxjava-android,dagger2-android,databinding,paging,room,kotlin-android,androidjetpack",8
0,https://github.com/haijeploeg/excludarr.git,A Python project that deletes movies from Radarr that are also present on streaming services like Netflix and Amazon,,8
0,https://github.com/Madalena-15/Showbox-3D.git,Showcasing a rotating 3D cube covered with videos for signup page of a fictional streaming movies service,,8
0,https://github.com/josephcc/organic_hash.git,Hash a string into readable names extracted from sci-fi novels and movies using a part-of-speech tagger.,,8
0,https://github.com/prakash-simhandri/Jio_Saavan.com.git,"In this project, I scraped (https://www.jiosaavn.com/) website movies songs List, here different type of Language song scrape.",,8
0,https://github.com/prachi1210/imdb_movie_lookup.git,":tv: Python script that looks up all movies in a folder on IMDb and gets the ratings, genre and plot of the movie and stores it in an excel sheet",,8
0,https://github.com/DouweM/beamer-remote.git,Use your iPhone to browse through media on your Mac and instantly stream movies and TV shows to your Apple TV—without ever having to get off the couch.,,8
0,https://github.com/digitalbazaar/bitmunk.git,"An open source, copyright-aware peer-to-peer client that enables browser-based buying/selling of music, movies and television by fans.",,8
0,https://github.com/scottcarter/VideoCompositionSimulatorBug.git,Shows a bug (hang) that occurs on the Xcode simulator when certain movies are processed by adding an instance of AVAssetReaderVideoCompositionOutput to an  AVAssetReader object.,,8
0,https://github.com/anandpatel504/IMDB-Scraper.git,"In this project, I have made a IMDB Scraper in which I have scraped a total of 250 movies using BeautifulSoup and Requests Library.",,8
0,https://github.com/ErinMorelli/em-media-handler.git,"A comprehensive media handling app for use via command line or with a torrenting program. Handles TV shows, movies, music, and audiobooks. Integrates with push notifications via Pushover.","automation,media-server,media-manager,push-notifications,pushbullet,pushover,audiobook,audiobooks,torrent,deluge,deluge-plugin,music,beets,beets-scripts,filebot,python",8
0,https://github.com/daedlock/MovieMate.git,Moviemate 🎥 is an electron based desktop app that will change your movie night experience by indexing and syncing all your movies and showing you movie information from different sources in a sexy way. You can stream your media inside MovieMate or choose to stream to an external source.,,8
0,https://github.com/hjorturlarsen/IMDB-top-100.git,"{""School project. Website based on IMDB's top 100 movies with login and rating system.""}",,7
0,https://github.com/elliotzhao/Recommend-movies.git,ML v.s DL for recommend movies,,7
0,https://github.com/kushalsharma/Cinephile.git,Android Udacity - Project 1 - Explore movies!,,7
0,https://github.com/piotr-bojanowski/actor-action.git,Action and character recognition in movies.,,7
0,https://github.com/octalmage/TV.git,Watch movies with your friends! ,,7
0,https://github.com/yashrajkakkad/movie-recommendation.git,"Recommend movies based on user specified movies, genres and associated people using graph algorithms.","graph,graph-algorithms,graph-theory,recommender-system,recommendation-system,recommendation-engine,ieee,django,django-project,movies,movie-recommendation",7
0,https://github.com/francisdb/belgiantv.git,What movies to watch on Belgian TV?,"movies,playframework,scala,belgium,tv",7
0,https://github.com/re5et/rotten-tomatoes.git,Fetch information regarding movies from rottentomatoes.com,,7
0,https://github.com/filipenevola/wantch.git,App to manage Movies that you want to Watch: Wantch,"meteor,react",7
0,https://github.com/LeviHassel/.net-flicks.git,.NET Core sample app for renting digital movies,"dotnet,dotnet-core,layered-architecture,sample-app,starter-template,sample,example-project",7
0,https://github.com/BuddhaNag12/Movies-intent-app-flutter.git,simple app for fetching movies from the movie db,"movies,search-movies,tmdb,flutter-apps,flutter",7
0,https://github.com/jupyterlab/jupyterlab-media.git,Repository storing movies and other media for JupyterLab tutorials and documentation,,7
0,https://github.com/GaronSmith/marvelous-movies.git,Clone of GoodReads re-imagined for movies. ,,7
0,https://github.com/EladBenDavid/TMDb.git,The movies database ,,7
0,https://github.com/dividuum/mmbukkit.git,Miners Movies Bukkit Plugin (Experimental),,7
0,https://github.com/deepak525/Investigate_TMDb_Movies.git,"Investigating Movies Dataset contains information about 10,000+ movies collected from The Movie Database (TMDb)","udacity,udacity-nanodegree,machine-learning,data-analysis,data-visualization,udacity-machine-learning-nanodegree,pandas,numpy,seaborn,matplotlib,tmdb,investigate-tmdb-movies",7
