,Url,Description,Topics,Stars
264,https://github.com/margotkurfess/NASA-TRMM.git,Using TRMM rainfall data from NASA for MSc in Economics thesis,"nasa,rainfall,economics",3
265,https://github.com/quanghoan/networks-on-economics-and-social-science.git,A final report for the course NETWORKS IN ECONOMICS AND SOCIAL SCIENCE Sede: VENEZIA(6cfu) [CM0500],,3
266,https://github.com/bachmeil/handbook.git,"Code, data, and additional materials for our chapter in the Handbook of Energy Economics","energy,macroeconomics,code,survey,dsge,svar,oil",3
267,https://github.com/setzler/EconData.git,Data repository and R package to manage publicly-available economics data.,,3
268,https://github.com/marcodpt/awesome-libertarianism.git,"Curated list of awesome books and authors on libertarianism, anarcho-capitalism and austrian school of economics","economics,books,awesome,liberty,libertarianism,libertarian,libertarianismo,ancap,anarchism,anarcocapitalismo,mises,money,capitalism,market",3
269,https://github.com/cran/erer.git,:exclamation:\xa0This\xa0is\xa0a\xa0read-only\xa0mirror\xa0of\xa0the\xa0CRAN\xa0R\xa0package\xa0repository.  erer\xa0—\xa0Empirical\xa0Research\xa0in\xa0Economics\xa0with\xa0R  ,,3
270,https://github.com/tanmay2298/Advanced-Machine-Learning.git,My coursework on the Advanced Machine Learning Specialisation offered by National Research University Higher School of Economics on Coursera,"machine-learning,coursera,tensorflow,keras",3
271,https://github.com/autonomio/pandemik.git,"An end-to-end pipeline for simulating behavior change and mitigation effect on economics, psychology, and mortality.","simulator,pandemic,epidemiology,behavior,economics,modelling,covid-19,coronavirus",3
272,https://github.com/lujun94/sponsored_search_auction_simulation.git,Program bidding agents to participate in a generalized second-price (GSP) auction and explore the effect that the design of payment rules has on revenue in a simulated environment.(Harvard CS136 Economics and Computation),,3
273,https://github.com/aelkus/LowTrustMarket.git,Simple agent-based simulation of a low-trust market populated by agents that can manipulate their own memory structures in response to social interactions.  Term project for CSS 695: Agent-Based Computational Economics. ,,3
274,https://github.com/sukanka/LaTeX-SWUFE-Bachelor-Thesis.git,LaTeX template for bachelor thesis of Southwestern University of Finance and Economics    西南财经大学本科毕业论文 LaTeX 模板,,3
275,https://github.com/hoangson0409/Deep-Learning-Techniques-in-Stock-Forecasting.git,"As a graduate majoring in Economics and Finance, I combined my passion of capital market with newly acquired programming skills for an end to end machine learning projects, from crawling data, model testing and writing reports based on latest literature",,3
276,https://github.com/QSD-Group/Bwaise-sanitation-alternatives.git,"This repository contains a model designed to evaluate the resource recovery potential, economics, and greenhouse gas emissions associated with three sanitation scenarios (the existing sanitation system and two alternatives) in Bwaise, Uganda.",,3
277,https://github.com/SReissl/JEEC.git,"Files necessary to reproduce the simulations shown in ""Heterogeneous expectations, forecasting behaviour and policy experiments in a hybrid Agent-based Stock-flow-consistent model"" (submitted to Journal of Evolutionary Economics)",,3
278,https://github.com/carlleston/Sales_Analytics.git,"This project is a playground of time series and regression models, the data was got in a coursera competition in Kaggle,that provided with daily historical sales data. My goal for this project was creating a Machine Learning model to forescast the main invoice resource in Games Market in the Russia using economics exogenous variables as GDP, Unemployment Rate, Moex and the RUB value in Dollar.",,3
279,https://github.com/Shawn-Xiaoyu-Du/2019_MCM_Contest_Problem_C_Meritorious_Winner.git,"In 2019, we three students from SCU, department of Math and department of Economics participated into the MCM contest for Big Data Problem C. 2019美国大学生数学建模竞赛M奖大数据题C",,3
280,https://github.com/manjunath5496/The-Best-Economics-Books.git,"""Once you realize that trickle-down economics does not work, you will see the excessive tax cuts for the rich as what they are -- a simple upward redistribution of income, rather than a way to make all of us richer, as we were told.""― Ha-Joon Chang",,3
281,https://github.com/xploitspeeds/Bookmarklet-Hacks-For-School.git,"* READ THE README FOR INFO!! * Incoming Tags- z score statistics,find mean median mode statistics in ms excel,variance,standard deviation,linear regression,data processing,confidence  intervals,average value,probability theory,binomial distribution,matrix,random numbers,error propagation,t statistics analysis,hypothesis testing,theorem,chi square,time series,data collection,sampling,p value,scatterplots,statistics lectures,statistics tutorials,business mathematics statistics,share stock market statistics in calculator,business analytics,GTA,continuous frequency distribution,statistics mathematics in real life,modal class,n is even,n is odd,median mean of series of numbers,math help,Sujoy Krishna Das,n+1/2 element,measurement of variation,measurement of central tendency,range of numbers,interquartile range,casio fx991,casio fx82,casio fx570,casio fx115es,casio 9860,casio 9750,casio 83gt,TI BAII+ financial,casio piano,casio calculator tricks and hacks,how to cheat in exam and not get caught,grouped interval data,equation of triangle rectangle curve parabola hyperbola,graph theory,operation research(OR),numerical methods,decision making,pie chart,bar graph,computer data analysis,histogram,statistics formula,matlab tutorial,find arithmetic mean geometric mean,find population standard deviation,find sample standard deviation,how to use a graphic calculator,pre algebra,pre calculus,absolute deviation,TI Nspire,TI 84 TI83 calculator tutorial,texas instruments calculator,grouped data,set theory,IIT JEE,AIEEE,GCSE,CAT,MAT,SAT,GMAT,MBBS,JELET,JEXPO,VOCLET,Indiastudychannel,IAS,IPS,IFS,GATE,B-Tech,M-Tech,AMIE,MBA,BBA,BCA,MCA,XAT,TOEFL,CBSE,ICSE,HS,WBUT,SSC,IUPAC,Narendra Modi,Sachin Tendulkar Farewell Speech,Dhoom 3,Arvind Kejriwal,maths revision,how to score good marks in exams,how to pass math exams easily,JEE 12th physics chemistry maths PCM,JEE maths shortcut techniques,quadratic equations,competition exams tips and ticks,competition maths,govt job,JEE KOTA,college math,mean value theorem,L hospital rule,tech guru awaaz,derivation,cryptography,iphone 5 fingerprint hack,crash course,CCNA,converting fractions,solve word problem,cipher,game theory,GDP,how to earn money online on youtube,demand curve,computer science,prime factorization,LCM & GCF,gauss elimination,vector,complex numbers,number systems,vector algebra,logarithm,trigonometry,organic chemistry,electrical math problem,eigen value eigen vectors,runge kutta,gauss jordan,simpson 1/3 3/8 trapezoidal rule,solved problem example,newton raphson,interpolation,integration,differentiation,regula falsi,programming,algorithm,gauss seidal,gauss jacobi,taylor series,iteration,binary arithmetic,logic gates,matrix inverse,determinant of matrix,matrix calculator program,sex in ranchi,sex in kolkata,vogel approximation VAM optimization problem,North west NWCR,Matrix minima,Modi method,assignment problem,transportation problem,simplex,k map,boolean algebra,android,casio FC 200v 100v financial,management mathematics tutorials,net present value NPV,time value of money TVM,internal rate of return IRR Bond price,present value PV and future value FV of annuity casio,simple interest SI & compound interest CI casio,break even point,amortization calculation,HP 10b financial calculator,banking and money,income tax e filing,economics,finance,profit & loss,yield of investment bond,Sharp EL 735S,cash flow casio,re finance,insurance and financial planning,investment appraisal,shortcut keys,depreciation,discounting","hacking,javascript,bookmarks,school,exploits,exploit,school-project,exploitation,lua,javascript-library,javascript-tools,electronics,technology,tech,tagsforlikes,electronic,hack,computers,laptops,matrix",3
282,https://github.com/Aryia-Behroziuan/neurons.git,"An ANN is a model based on a collection of connected units or nodes called ""artificial neurons"", which loosely model the neurons in a biological brain. Each connection, like the synapses in a biological brain, can transmit information, a ""signal"", from one artificial neuron to another. An artificial neuron that receives a signal can process it and then signal additional artificial neurons connected to it. In common ANN implementations, the signal at a connection between artificial neurons is a real number, and the output of each artificial neuron is computed by some non-linear function of the sum of its inputs. The connections between artificial neurons are called ""edges"". Artificial neurons and edges typically have a weight that adjusts as learning proceeds. The weight increases or decreases the strength of the signal at a connection. Artificial neurons may have a threshold such that the signal is only sent if the aggregate signal crosses that threshold. Typically, artificial neurons are aggregated into layers. Different layers may perform different kinds of transformations on their inputs. Signals travel from the first layer (the input layer) to the last layer (the output layer), possibly after traversing the layers multiple times.  The original goal of the ANN approach was to solve problems in the same way that a human brain would. However, over time, attention moved to performing specific tasks, leading to deviations from biology. Artificial neural networks have been used on a variety of tasks, including computer vision, speech recognition, machine translation, social network filtering, playing board and video games and medical diagnosis.  Deep learning consists of multiple hidden layers in an artificial neural network. This approach tries to model the way the human brain processes light and sound into vision and hearing. Some successful applications of deep learning are computer vision and speech recognition.[68]  Decision trees Main article: Decision tree learning Decision tree learning uses a decision tree as a predictive model to go from observations about an item (represented in the branches) to conclusions about the item\'s target value (represented in the leaves). It is one of the predictive modeling approaches used in statistics, data mining, and machine learning. Tree models where the target variable can take a discrete set of values are called classification trees; in these tree structures, leaves represent class labels and branches represent conjunctions of features that lead to those class labels. Decision trees where the target variable can take continuous values (typically real numbers) are called regression trees. In decision analysis, a decision tree can be used to visually and explicitly represent decisions and decision making. In data mining, a decision tree describes data, but the resulting classification tree can be an input for decision making.  Support vector machines Main article: Support vector machines Support vector machines (SVMs), also known as support vector networks, are a set of related supervised learning methods used for classification and regression. Given a set of training examples, each marked as belonging to one of two categories, an SVM training algorithm builds a model that predicts whether a new example falls into one category or the other.[69] An SVM training algorithm is a non-probabilistic, binary, linear classifier, although methods such as Platt scaling exist to use SVM in a probabilistic classification setting. In addition to performing linear classification, SVMs can efficiently perform a non-linear classification using what is called the kernel trick, implicitly mapping their inputs into high-dimensional feature spaces.   Illustration of linear regression on a data set. Regression analysis Main article: Regression analysis Regression analysis encompasses a large variety of statistical methods to estimate the relationship between input variables and their associated features. Its most common form is linear regression, where a single line is drawn to best fit the given data according to a mathematical criterion such as ordinary least squares. The latter is often extended by regularization (mathematics) methods to mitigate overfitting and bias, as in ridge regression. When dealing with non-linear problems, go-to models include polynomial regression (for example, used for trendline fitting in Microsoft Excel[70]), logistic regression (often used in statistical classification) or even kernel regression, which introduces non-linearity by taking advantage of the kernel trick to implicitly map input variables to higher-dimensional space.  Bayesian networks Main article: Bayesian network  A simple Bayesian network. Rain influences whether the sprinkler is activated, and both rain and the sprinkler influence whether the grass is wet. A Bayesian network, belief network, or directed acyclic graphical model is a probabilistic graphical model that represents a set of random variables and their conditional independence with a directed acyclic graph (DAG). For example, a Bayesian network could represent the probabilistic relationships between diseases and symptoms. Given symptoms, the network can be used to compute the probabilities of the presence of various diseases. Efficient algorithms exist that perform inference and learning. Bayesian networks that model sequences of variables, like speech signals or protein sequences, are called dynamic Bayesian networks. Generalizations of Bayesian networks that can represent and solve decision problems under uncertainty are called influence diagrams.  Genetic algorithms Main article: Genetic algorithm A genetic algorithm (GA) is a search algorithm and heuristic technique that mimics the process of natural selection, using methods such as mutation and crossover to generate new genotypes in the hope of finding good solutions to a given problem. In machine learning, genetic algorithms were used in the 1980s and 1990s.[71][72] Conversely, machine learning techniques have been used to improve the performance of genetic and evolutionary algorithms.[73]  Training models Usually, machine learning models require a lot of data in order for them to perform well. Usually, when training a machine learning model, one needs to collect a large, representative sample of data from a training set. Data from the training set can be as varied as a corpus of text, a collection of images, and data collected from individual users of a service. Overfitting is something to watch out for when training a machine learning model.  Federated learning Main article: Federated learning Federated learning is an adapted form of distributed artificial intelligence to training machine learning models that decentralizes the training process, allowing for users\' privacy to be maintained by not needing to send their data to a centralized server. This also increases efficiency by decentralizing the training process to many devices. For example, Gboard uses federated machine learning to train search query prediction models on users\' mobile phones without having to send individual searches back to Google.[74]  Applications There are many applications for machine learning, including:  Agriculture Anatomy Adaptive websites Affective computing Banking Bioinformatics Brain–machine interfaces Cheminformatics Citizen science Computer networks Computer vision Credit-card fraud detection Data quality DNA sequence classification Economics Financial market analysis[75] General game playing Handwriting recognition Information retrieval Insurance Internet fraud detection Linguistics Machine learning control Machine perception Machine translation Marketing Medical diagnosis Natural language processing Natural language understanding Online advertising Optimization Recommender systems Robot locomotion Search engines Sentiment analysis Sequence mining Software engineering Speech recognition Structural health monitoring Syntactic pattern recognition Telecommunication Theorem proving Time series forecasting User behavior analytics In 2006, the media-services provider Netflix held the first ""Netflix Prize"" competition to find a program to better predict user preferences and improve the accuracy of its existing Cinematch movie recommendation algorithm by at least 10%. A joint team made up of researchers from AT&T Labs-Research in collaboration with the teams Big Chaos and Pragmatic Theory built an ensemble model to win the Grand Prize in 2009 for $1 million.[76] Shortly after the prize was awarded, Netflix realized that viewers\' ratings were not the best indicators of their viewing patterns (""everything is a recommendation"") and they changed their recommendation engine accordingly.[77] In 2010 The Wall Street Journal wrote about the firm Rebellion Research and their use of machine learning to predict the financial crisis.[78] In 2012, co-founder of Sun Microsystems, Vinod Khosla, predicted that 80% of medical doctors\' jobs would be lost in the next two decades to automated machine learning medical diagnostic software.[79] In 2014, it was reported that a machine learning algorithm had been applied in the field of art history to study fine art paintings and that it may have revealed previously unrecognized influences among artists.[80] In 2019 Springer Nature published the first research book created using machine learning.[81]  Limitations Although machine learning has been transformative in some fields, machine-learning programs often fail to deliver expected results.[82][83][84] Reasons for this are numerous: lack of (suitable) data, lack of access to the data, data bias, privacy problems, badly chosen tasks and algorithms, wrong tools and people, lack of resources, and evaluation problems.[85]  In 2018, a self-driving car from Uber failed to detect a pedestrian, who was killed after a collision.[86] Attempts to use machine learning in healthcare with the IBM Watson system failed to deliver even after years of time and billions of dollars invested.[87][88]  Bias Main article: Algorithmic bias Machine learning approaches in particular can suffer from different data biases. A machine learning system trained on current customers only may not be able to predict the needs of new customer groups that are not represented in the training data. When trained on man-made data, machine learning is likely to pick up the same constitutional and unconscious biases already present in society.[89] Language models learned from data have been shown to contain human-like biases.[90][91] Machine learning systems used for criminal risk assessment have been found to be biased against black people.[92][93] In 2015, Google photos would often tag black people as gorillas,[94] and in 2018 this still was not well resolved, but Google reportedly was still using the workaround to remove all gorillas from the training data, and thus was not able to recognize real gorillas at all.[95] Similar issues with recognizing non-white people have been found in many other systems.[96] In 2016, Microsoft tested a chatbot that learned from Twitter, and it quickly picked up racist and sexist language.[97] Because of such challenges, the effective use of machine learning may take longer to be adopted in other domains.[98] Concern for fairness in machine learning, that is, reducing bias in machine learning and propelling its use for human good is increasingly expressed by artificial intelligence scientists, including Fei-Fei Li, who reminds engineers that ""There’s nothing artificial about AI...It’s inspired by people, it’s created by people, and—most importantly—it impacts people. It is a powerful tool we are only just beginning to understand, and that is a profound responsibility.”[99]  Model assessments Classification of machine learning models can be validated by accuracy estimation techniques like the holdout method, which splits the data in a training and test set (conventionally 2/3 training set and 1/3 test set designation) and evaluates the performance of the training model on the test set. In comparison, the K-fold-cross-validation method randomly partitions the data into K subsets and then K experiments are performed each respectively considering 1 subset for evaluation and the remaining K-1 subsets for training the model. In addition to the holdout and cross-validation methods, bootstrap, which samples n instances with replacement from the dataset, can be used to assess model accuracy.[100]  In addition to overall accuracy, investigators frequently report sensitivity and specificity meaning True Positive Rate (TPR) and True Negative Rate (TNR) respectively. Similarly, investigators sometimes report the false positive rate (FPR) as well as the false negative rate (FNR). However, these rates are ratios that fail to reveal their numerators and denominators. The total operating characteristic (TOC) is an effective method to express a model\'s diagnostic ability. TOC shows the numerators and denominators of the previously mentioned rates, thus TOC provides more information than the commonly used receiver operating characteristic (ROC) and ROC\'s associated area under the curve (AUC).[101]  Ethics Machine learning poses a host of ethical questions. Systems which are trained on datasets collected with biases may exhibit these biases upon use (algorithmic bias), thus digitizing cultural prejudices.[102] For example, using job hiring data from a firm with racist hiring policies may lead to a machine learning system duplicating the bias by scoring job applicants against similarity to previous successful applicants.[103][104] Responsible collection of data and documentation of algorithmic rules used by a system thus is a critical part of machine learning.  Because human languages contain biases, machines trained on language corpora will necessarily also learn these biases.[105][106]  Other forms of ethical challenges, not related to personal biases, are more seen in health care. There are concerns among health care professionals that these systems might not be designed in the public\'s interest but as income-generating machines. This is especially true in the United States where there is a long-standing ethical dilemma of improving health care, but also increasing profits. For example, the algorithms could be designed to provide patients with unnecessary tests or medication in which the algorithm\'s proprietary owners hold stakes. There is huge potential for machine learning in health care to provide professionals a great tool to diagnose, medicate, and even plan recovery paths for patients, but this will not happen until the personal biases mentioned previously, and these ""greed"" biases are addressed.[107]  Hardware Since the 2010s, advances in both machine learning algorithms and computer hardware have led to more efficient methods for training deep neural networks (a particular narrow subdomain of machine learning) that contain many layers of non-linear hidden units.[108] By 2019, graphic processing units (GPUs), often with AI-specific enhancements, had displaced CPUs as the dominant method of training large-scale commercial cloud AI.[109] OpenAI estimated the hardware compute used in the largest deep learning projects from AlexNet (2012) to AlphaZero (2017), and found a 300,000-fold increase in the amount of compute required, with a doubling-time trendline of 3.4 months.[110][111]  Software Software suites containing a variety of machine learning algorithms include the following:  Free and open-source so","aryia-behroziuan,artificial-intelligence,wikipedia,an-ann,neural-network,android,bootstrap,csharp,deep-learning,expressjs,firebase",3
283,https://github.com/ogaway/ExEcon.git,Experimental Economics,,2
284,https://github.com/QuantEcon/GC_CUNY_workshop_2019.git,Notebooks for introduction to using Python for economics,,2
285,https://github.com/jonduan/Economics_note.git,Computational material for Economics courses at UVic ,,2
286,https://github.com/dendisuhubdy/compecon.git,Computational Economics and Finance Toolbox by Doctor Paul Fackler,,2
287,https://github.com/asking28/HSE-NLP-Solution.git,Solutions to Coursera Course on Natural Language Processing by Higher School of Economics (HSE).,,2
288,https://github.com/bzafiris/softeng-project-template.git,A simple template for organizing source code and Markdown/Umlet documentation for the purposes of Software Engineering Course (INF138) of Athens University and Economics and Business,,2
289,https://github.com/seanpm2001/Economica.git," A game based on Economics, and to emulate games like AdVenture Capitalist/AdVenture Communist. With offline functionality.","clicker,idle,game,adcap,adcom,capitalist,capitalism,communist,communism,cplusplus,economics,socialist,socialism,csv,wiki,hyperhippo",2
290,https://github.com/korenmiklos/Diversification-Through-Trade-Replication.git,"Caselli, Francesco, Miklós Koren, Milan Lisicky, Silvana Tenreyro. 2020. ""Replication Package for Diversification Through Trade."" The Quarterly Journal of Economics.",,2
291,https://github.com/datastarteu/python-edh.git,Materials for the Python course at Economics Discovery Hub,,2
292,https://github.com/thermatk/HSEWifi.git,Small helper for Higher School of Economics WiFi network,,2
293,https://github.com/jax79sg/webecon2017.git," UCL COMPGW02 Web Economics assignment Group 5, 2017",,2
294,https://github.com/RDeconomist/observatory.git,Data and visualisation code for use in Economics Observatory articles,,2
