,Url,Description,Topics,Stars
44,https://github.com/jqno/equalsverifier.git,EqualsVerifier can be used in Java unit tests to verify whether the contract for the equals and hashCode methods is met.,"java,equals,testing",511
45,https://github.com/pact-foundation/pact-net.git,".NET version of Pact. Enables consumer driven contract testing, providing a mock service and DSL for the consumer project, and interaction playback and verification for the service provider project.","hacktoberfest,pact,contract-testing,apis",506
46,https://github.com/paritytech/ink.git,"{""Parity's ink! to write smart contracts""}","smart-contracts,webassembly,wasm,substrate,domain-specific-language",486
47,https://github.com/pact-foundation/pact-go.git,Golang version of Pact. Pact is a contract testing framework for HTTP APIs and non-HTTP asynchronous messaging systems.,"pact,consumer-driven-contracts,test-framework,golang,hacktober,hacktoberfest",486
48,https://github.com/quii/mockingjay-server.git,"Fake server, Consumer Driven Contracts and help with testing performance from one configuration file with zero system dependencies and no coding whatsoever",,484
49,https://github.com/EOSIO/eosio.cdt.git,EOSIO.CDT (Contract Development Toolkit) is a suite of tools used to build EOSIO contracts,"wasm,eosio",479
50,https://github.com/BANKEX/web3swift.git,Elegant Web3js functionality in Swift. Native ABI parsing and smart contract interactions on Ethereum network.,"web3,ethereum,smart-contracts,swift,ios,wallet,bankex,cryptoswift,transaction,json-rpc,cryptocurrency",463
51,https://github.com/ethereum/sharding.git,"Sharding manager contract, and related software and tests","ethereum,python,sharding,vyper",459
52,https://github.com/Synthetixio/synthetix.git,Synthetix Solidity smart contracts,"synthetix,ethereum,defi,blockchain,derivatives",454
53,https://github.com/blockchain/thunder.git,Off-Chain Bitcoin payments using smart contracts ,"bitcoin,thunder,lightning",449
54,https://github.com/kadena-io/juno.git,Smart Contracts Running on a BFT Hardened Raft,,447
55,https://github.com/sc-forks/solidity-coverage.git,Code coverage for Solidity smart-contracts ,,446
56,https://github.com/EthWorks/Waffle.git,Library for writing and testing smart contracts.,,435
57,https://github.com/manojpramesh/solidity-cheatsheet.git,Cheat sheet and best practices for solidity. Write smart contracts for Ethereum.,"solidity,solidity-cheatsheet,ethereum,blockchain,best-practices",419
58,https://github.com/dapperlabs/cryptokitties-bounty.git,Bounty program for CryptoKitties smart contract,,418
59,https://github.com/nonsalant/contract.git,A signable contract that lives in a single file,,394
60,https://github.com/facade/ignition-contracts.git,The contracts used to display solutions on Ignition and Flare,"flare,solutions,error,reporting",395
61,https://github.com/juanfranblanco/vscode-solidity.git,Visual Studio Code language support extension for Solidity smart contracts in Ethereum,"solidity-contracts,solidity,ethereum,visual-studio",391
62,https://github.com/safemoonprotocol/Safemoon.sol.git,safemoon contract,,387
63,https://github.com/Overtorment/awesome-smart-contracts.git,🕶 List of awesome platforms for smart contracts,"awesome,awesome-list,cryptocurrency,smart-contracts,lists,resources",383
64,https://github.com/gogotanaka/Rubype.git,":dromedary_camel: Super simple, clean. Contracts for Ruby",,378
65,https://github.com/slowmist/eos-smart-contract-security-best-practices.git,A guide to EOS smart contract security best practices,"smart-contracts,security,blockchain,eosio",371
66,https://github.com/curvefi/curve-contract.git,Vyper contracts used in Curve.fi exchange pools.,"ethereum,vyper,defi",370
67,https://github.com/JoinColony/colonyNetwork.git,Colony Network smart contracts,"ethereum,solidity,solidity-contracts,smart-contracts,blockchain,ethereum-contract",357
68,https://github.com/poanetwork/token-wizard.git,(Discontinued) TokenWizard is an DApp to create and manage crowdsale and token contracts using a simple UI,"ethereum,ico,dapps,dapp-react,react,mobx,crowdsale,crowdsale-contract",357
69,https://github.com/dapphub/dappsys.git,Composable building blocks for Ethereum contracts,"ethereum,solidity,dappsys",355
70,https://github.com/kadena-io/pact.git,The Pact Smart Contract Language,"pact,smart-contracts,blockchain",351
71,https://github.com/AndreaCensi/contracts.git,"PyContracts is a Python package that allows to declare  constraints on function parameters and return values.  Contracts can be specified using Python3 annotations, or inside a docstring. PyContracts supports a basic type system, variables binding,  arithmetic constraints, and has several specialized contracts and an extension API.",,351
72,https://github.com/ethereum/fe.git,Emerging smart contract language for the Ethereum blockchain.,,348
73,https://github.com/pact-foundation/pact-python.git,"Python version of Pact. Enables consumer driven contract testing, providing a mock service and DSL for the consumer project, and interaction playback and verification for the service provider project.","hacktoberfest,pact,contract-testing,apis",348
74,https://github.com/makerdao/developerguides.git,"{""Developer guides to integrate with MakerDAO's smart contracts, SDKs, APIs, products, and partners""}",,337
75,https://github.com/certikfoundation/security-oracle-smart-contracts.git,Smart Contracts for CertiK Security Oracle,,334
76,https://github.com/remote-es/remotes.git,This is a repository listing companies which offer full-time remote jobs with Spanish contracts,,327
77,https://github.com/ethereum/remix-project.git,Remix is a browser-based compiler and IDE that enables users to build Ethereum contracts with Solidity language and to debug transactions.,"remix,remix-ide,solidity,smart-contracts,evm,vyper,blockchain,ethereum",326
78,https://github.com/Uniswap/uniswap-v1.git,🐍Uniswap V1 smart contracts,"vyper,decentralized-exchange,ethereum,smart-contracts,cryptocurrency,market-maker,erc20",324
79,https://github.com/Uniswap/uniswap-v2-periphery.git,🎚 Peripheral smart contracts for interacting with Uniswap V2,"ethereum,smart-contracts,erc20,decentralized-exchange,cryptocurrency",324
80,https://github.com/ConsenSys/surya.git,A set of utilities for exploring Solidity contracts ,,320
81,https://github.com/erasureprotocol/NMR.git,The Numeraire Ethereum Smart Contract,"ethereum-contract,numerai,ethereum,smart-contracts",315
82,https://github.com/yearn/yearn-protocol.git,Yearn smart contracts,"ethereum,ethereum-contract,defi,blockchain",313
83,https://github.com/msz/hammox.git,🏝 automated contract testing via type checking for Elixir functions and mocks,"elixir,testing,mock,mox,contract-testing,typechecker,typechecking,typespec,dialyzer,contracts,behaviours,contract,behaviour,behaviour-typespec,unit-testing,typespecs,mocks,explicit-contracts,type-checking,type-checker",309
84,https://github.com/deadpixi/contracts.git,An implementation of contracts for Python.,,306
85,https://github.com/azagniotov/stubby4j.git,"An HTTP server for stubbing external systems in both Docker and non-containerized environments for integration, contract and behavior testing.","stub-server,mock-server,http-stub,api-testing,stubbed-endpoints,record-and-replay,rest-test-api,api-mocking,integration-testing,cdc,consumer-driven-contracts,stubbed-data,rest-api-test,contract-testing,contract-tests,service-stubbing,stubbing-framework,service-virtualization,microservices-testing,stubby4j",305
86,https://github.com/KyberNetwork/smart-contracts.git,"Main smart contracts for Kyber Network, including the main platform contract, reserve contracts etc.",,295
87,https://github.com/dapphub/dapple.git,EVM contract system developer multitool,,295
88,https://github.com/ivicanikolicsg/MAIAN.git,MAIAN: automatic tool for finding trace vulnerabilities in Ethereum smart contracts,,295
89,https://github.com/spring-cloud-samples/spring-cloud-contract-samples.git,Samples for Spring Cloud Contract project,,292
90,https://github.com/aragon/aragon-apps.git,(Aragon 1) Aragon apps developed by Aragon Core Devs (smart contracts + webapps),"aragon,ethereum,solidity-contracts,solidity-dapps,ethereum-dapp,aragon-app,solidity",288
91,https://github.com/papertrail/legal-docs.git,"Free, unencumbered NDA(s), employment agreement(s), and other legal contracts",,288
92,https://github.com/ivy-lang/ivy-bitcoin.git,A high-level language and IDE for writing Bitcoin smart contracts.,,287
93,https://github.com/EOSIO/eosio.contracts.git,Smart contracts that provide some of the basic functions of the EOSIO blockchain,"eosio,smart-contracts",285
94,https://github.com/Uniswap/uniswap-v3-periphery.git,🦄 🦄 🦄 Peripheral smart contracts for interacting with Uniswap v3,"ethereum,smart-contracts,automated-market-maker,periphery",285
95,https://github.com/eventeum/eventeum.git,A resilient Ethereum event listener that bridges your smart contract events and backend microservices,"ethereum,ethereum-blockchain,blockchain,event-broadcasting,event-driven,smart-contracts,kafka,event-listener",282
96,https://github.com/PolymathNetwork/polymath-core.git,Core Ethereum Smart Contracts for Polymath - The Securities Token Platform,"st-20,ethereum,securities",281
97,https://github.com/pventuzelo/octopus.git,Security Analysis tool for WebAssembly module (wasm) and Blockchain Smart Contracts (BTC/ETH/NEO/EOS),"security-analysis,disassembler,blockchain,smart-contracts,ethereum,neo,eos,webassembly,wasm,security,evm-bytecode,control-flow-analysis,call-flow-analysis",272
98,https://github.com/loomnetwork/plasma-cash.git,"Plasma Cash Contract & Client. ERC721, ERC20, and ETH compatible ","ethereum,loom,plasma",268
99,https://github.com/modular-network/ethereum-libraries.git,Library contracts for Ethereum,,266
100,https://github.com/skywinder/web3swift.git,Elegant Web3js functionality in Swift. Native ABI parsing and smart contract interactions.,"web3,web3js,web3-dapp,dapp,ethereum,json-rpc,smart-contracts,cryptoswift,crypto,geth,infura,web3swift,web3j,web3-solidity,hacktoberfest,abi-parsing",266
101,https://github.com/second-state/smart-contract-search-engine.git,"{""Takes a link to a smart contract's raw ABI file and an RPC URL and then indexes all instances of that smart contract""}","search-engine,smart-contracts,blockchain,apache2,flask,python,solidity,ethereum,cybermiles,second-state",264
102,https://github.com/pirapira/ethereum-formal-verification-overview.git,The start page about my efforts around smart contract verification,,263
103,https://github.com/truffle-box/drizzle-box.git,"{""This box comes with everything you need to start using smart contracts from a react app with Drizzle. It includes drizzle, drizzle-react and drizzle-react-components to give you a complete overview of Drizzle's capabilities.""}","drizzle,react,redux",259
104,https://github.com/sec-bit/awesome-buggy-erc20-tokens.git,A Collection of Vulnerabilities in ERC20 Smart Contracts With Tokens Affected,"smart-contracts,erc20-tokens,vulnerabilities,solidity,security,ethereum,tokens,awesome-list,awesome,erc20,dapp",257
105,https://github.com/codemix/babel-plugin-contracts.git,Design by Contract for JavaScript via a Babel plugin.,,255
106,https://github.com/trufflesuite/truffle-artifactor.git,A contract packager for Ethereum and Javascript (formerly ether-pudding),,254
107,https://github.com/runtimeverification/verified-smart-contracts.git,Smart contracts which are formally verified,,250
108,https://github.com/miguelmota/ethereum-input-data-decoder.git,Ethereum smart contract transaction input data decoder,"ethereum,decoder,smart-contracts,abi,javascript,solidity,remix,utility,library",250
109,https://github.com/CosmWasm/cosmwasm.git,Library for building cosmos-compatible wasm smart contracts,,247
110,https://github.com/tokenika/eosfactory.git,Python-based EOS smart-contract development & testing framework,"eos,smart-contracts,python,unit-testing,testnet",246
111,https://github.com/0mkara/etheratom.git,Solidity compilation and Ethereum contract execution interface for hackable atom editor,"solidity-compiler,ethereum-node,atom-ethereum-interface,solidity-codes,ethereum,ethereum-dapp,atom,ethereum-client",244
112,https://github.com/airtasker/spot.git,"Spot is a concise, developer-friendly way to describe your API contract.","openapi,swagger,typescript,api-blueprint,dsl,json-schema,openapi3",242
113,https://github.com/fogus/trammel.git,Contracts programming with Clojure,,241
114,https://github.com/raineorshine/solidity-by-example.git,A collection of short yet fully-functional contracts that demonstrate Solidity language features.,"ethereum,solidity",239
115,https://github.com/MichaelBurge/pyramid-scheme.git,Pyramid is a language to create Ethereum smart contracts,,236
116,https://github.com/nrc/libhoare.git,Design by contract style assertions for Rust,,233
117,https://github.com/pipermerriam/ethereum-datetime.git,Date-Time utilities for ethereum contracts.,,232
118,https://github.com/flintlang/flint.git,The Flint Programming Language for Smart Contracts,"ethereum,smart-contracts,language,compiler,swift,verification,ecosystem,flint,flint-compiler,caller-protections,flint-programming-language",228
119,https://github.com/php-deal/framework.git,Design by Contract framework for PHP,"design-by-contracts,php,invariants,preconditions,contracts-programming,dbc",228
120,https://github.com/crytic/building-secure-contracts.git,Guidelines and training material to write secure smart contracts,,225
121,https://github.com/metadevpro/openapi3-ts.git,TS Model & utils for creating and exposing OpenAPI 3.x contracts.,"openapi,ts",225
122,https://github.com/reedhong/fomo3d_clone.git,clone fomo3d contract source,,223
123,https://github.com/deroproject/derosuite.git,"DERO: Secure, Anonymous Blockchain with Smart Contracts.  Subscribe to Dero announcements by sending mail to lists@dero.io with subject: subscribe announcements","cryptonote,dero,blockchain,golang,go,privacy,crypto,protocol",223
124,https://github.com/argentlabs/argent-contracts.git,Smart Contracts for Argent Wallet,,222
125,https://github.com/FactomProject/FactomCode.git,"Factom Servers begin by providing proof of existence services, but then move on to provide proof of existence of transforms.  A list of such entries can be thought of as a FactomChain.  A FactomChain can be used to implement private tokens, smart contracts, smart properties, and more.",,221
126,https://github.com/pooltogether/pooltogether-pool-contracts.git,PoolTogether prize-linked savings game Solidity smart contracts.,,220
127,https://github.com/Bounties-Network/StandardBounties.git,Smart Contracts in Solidity to serve as a Standard for Bounties for EVM dApps,,220
128,https://github.com/LoopringSecondary/protocol.git,Loopring Protocol Smart Contract on Ethereum,"decentralized,ethereum,erc20,token,exchange,protocol",220
129,https://github.com/danecjensen/subscribely.git,**Available for Contract Work** A boilerplate for building your own subscription site with stripe integration or stripe subscription service or saas site or membership site or billing service.  Subscribely was built for my own subscription service integrating stripe SockClub.com.  ,,219
130,https://github.com/Sparkleloyalty/Sparkle-Proof-Of-Loyalty.git,Sparkle Proof of Loyalty Contract ,"loyalty,loyalty-contract,ethereum,solidity,truffle,smart-contract",217
131,https://github.com/MetaMask/contract-metadata.git,A mapping of ethereum contract addresses to broadly accepted icons for those addresses.,,215
132,https://github.com/jackmorgan/the-plain-contract.git,"The Plain Contract is a crowsourced, open source freelance contract template, written in plain language.","freelancer,freelance,contract,template,document,microsoft-word,google-docs,plain-english,customizable,editable,designer,developer,legal,legal-documents,legal-texts,legal-templates,legal-writing,legalese,contracting,contractor",215
133,https://github.com/SmartContractSecurity/SWC-registry.git,Smart Contract Weakness Classification and Test Cases,"ethereum,security,smart-contracts",213
134,https://github.com/uport-project/uport-identity.git,uPort Contracts for managing identity DEPRECATED,,209
135,https://github.com/openethereum/pwasm-tutorial.git,A step-by-step tutorial on how to write contracts in Wasm for Kovan,,209
136,https://github.com/cloudframeworks-blockchain/user-guide-fabric-smart-contract.git,"[云框架]基于区块链的智能合约 / Blockchain, Fabric Hyperledger, Smart Contract ／ 区块链, Fabric Hyperledger, 智能合约",,209
137,https://github.com/bitconch/bitconch-core.git,A new distributed web protocol for smart contracts and decentralized applications.,"blockchain,distributed-database,crytpocurrency,dlt,distributed-ledger,rust,golang",205
138,https://github.com/enjin/erc-1155.git,ERC-1155: Smart Contract Sample Implementation,,205
139,https://github.com/OpenZeppelin/openzeppelin-test-helpers.git,Assertion library for Ethereum smart contract testing,,202
140,https://github.com/recruit-tech/agreed.git,agreed is Consumer Driven Contract tool with JSON mock server.,mock-server,202
141,https://github.com/rstormsf/multisender.git,"Token Multisender Dapp smart contract. Airdrop tokens. Batch sending ERC20, ETH, Ethereum tokens. Send thousands of transfers in a few transactions. It can help user to save more tx fee and time than sending one by one","ethereum,erc20,solidity,batch,dapp,metamask,transfers,transaction,multisender,bulksender,eth-send,batch-send,batch-script",201
142,https://github.com/onflow/cadence.git,"Cadence, the resource-oriented smart contract programming language 🏃\u200d♂️","cadence,language,programming-language,smart-contracts,onflow",197
143,https://github.com/etherdelta/smart_contract.git,EtherDelta smart contract,,194
144,https://github.com/hyperledger/fabric-chaincode-java.git,Hyperledger Fabric Contract and Chaincode implementation for Java https://wiki.hyperledger.org/display/fabric,"hyperledger-fabric,java,smart-contracts",194
145,https://github.com/trusttoken/smart-contracts.git,TrustToken smart contracts,,193
146,https://github.com/Zilliqa/scilla.git,Scilla - A Smart Contract Intermediate Level Language,"smart-contracts,blockchain,verification,zilliqa,scilla,ocaml",193
147,https://github.com/PureStake/moonbeam.git,An Ethereum-compatible smart contract parachain on Polkadot,"moonbeam,polkadot,substrate,ethereum,frontier,cumulus,parachain",190
148,https://github.com/fifikobayashi/Flash-Arb-Trader.git,Smart contract that flash borrows from Aave and uses the flash liquidity for arbitrage between Sushiswap and UniswapV2 within the same transaction,,189
149,https://github.com/madeinussr/exop.git,Elixir library that provides macros which allow you to encapsulate business logic and validate incoming parameters with predefined contract.,"elixir,coercion,ddd,operation-invocation,policy-evaluation,parameters,validation",187
150,https://github.com/life4/deal.git,"{""Design by contract for Python with static checker and tests' generation.""}","python,contracts,pre,post,invariant,contracts-programming,decorators,functional-programming,design-by-contract,pythonic,deal,validation,interface,linter,flake8,property-based-testing,dbc",186
151,https://github.com/Sparkleloyalty/Sparkle-Callisto-Audit.git,Smart Contract Security Audit  ,,185
152,https://github.com/armors/armors-solidity.git,Armors-solidity is a framework to build secure smart contracts on Ethereum.,"ethereum,blockchain,armors,evm,smartcontract,truffle",184
153,https://github.com/rust-ethereum/ethabi.git,Encode and decode smart contract invocations,"rust,ethereum,evm,abi",182
154,https://github.com/DOkwufulueze/eth-vue.git,"{""Featured in Awesome Vue [https://github.com/vuejs/awesome-vue], a curated list maintained by vuejs of awesome things related to the Vue.js framework, and Awesome List [https://awesomelists.net/150-Vue.js/3863-Open+Source/18749-DOkwufulueze-eth-vue], this Truffle Box provides everything you need to quickly build Ethereum dApps that have authentication features with vue, including configuration for easy deployment to the Ropsten Network. It's also Gravatar-enabled. Connecting to a running Ganache blockchain network from Truffle is also possible -- for fast development and testing purposes. Built on Truffle 5 and Vue 3, eth-vue uses vuex for state management, vuex-persist for local storage of app state, and vue-router for routing. Authentication functionalities are handled by Smart Contracts running on the Ethereum blockchain.""}","vuejs,ethereum,ethereum-contract,dapp,ethereum-dapp,eth-vue,blockchain,truffle,truffle-framework,vue-router,vue-components,contracts,boilerplate,vuex,vuex-persist,web3",182
155,https://github.com/maticnetwork/contracts.git,Smart contracts comprising the business logic of the Matic Network,"ethereum,blockchain,decentralised-exchange,payment,cryptocurrencies,dapps,scalability",181
156,https://github.com/xasos/awesome-decentralized-papers.git,"Influential papers in decentralized systems (cryptocurrencies, contracts, consensus, etc.)","bitcoin,ethereum,cryptocurrency,contracts,consensus",181
157,https://github.com/loomnetwork/go-loom.git,Go package for building plugins and Go Smart Contracts for Loom DAppChains,,180
158,https://github.com/eth-sri/securify.git,[DEPRECATED] Security Scanner for Ethereum Smart Contracts,"evm,ethereum,solidity,static-analysis,datalog,security,smart-contract,chainsecurity,depricated,obsolete",179
159,https://github.com/dapperlabs/nba-smart-contracts.git,"Smart contracts and transactions for Topshot, the official NBA digital collectibles game on the Flow Blockchain","smart-contracts,blockchain,nft,collectibles,nba",179
160,https://github.com/s-tikhomirov/smart-contract-languages.git,A curated collection of resources on smart contract programming languages,"smart-contracts,programming-languages",179
161,https://github.com/rhlsthrm/typescript-solidity-dev-starter-kit.git,Starter kit for smart contract development using Typescript,"buidler,ethereum,typescript,solidity,dapps",178
162,https://github.com/OpenZeppelin/openzeppelin-contracts-upgradeable.git,"Upgradeable variant of OpenZeppelin Contracts, meant for use in upgradeable contracts. ",,176
163,https://github.com/Nikhil22/angular-truffle-starter-dapp.git,"Angular CLI + Truffle Starter Dapp; write, compile & deploy smart contracts on Ethereum blockchains","truffle,truffle-framework,ethereum,ethereum-contract,ethereum-dapp,blockchain,javascript,solidity,angular2,angular2-cli,dapp,decentralized-applications,ethereum-client,angular4,angular4-seed",176
164,https://github.com/Neufund/smart-contract-watch.git,A tool to monitor a number of smart contracts and transactions,"solidity,ethereum,dapp,blockchain,transaction,scanning-transactions",175
165,https://github.com/microsoft/verisol.git,A formal verifier and analysis tool for Solidity Smart Contracts,,174
166,https://github.com/yearn/yearn-vaults.git,Yearn Vault smart contracts,"yearn,yearn-finance,ethereum,ethereum-contract,defi,blockchain,vyper",173
167,https://github.com/docknetwork/voting.git,Dock governance proposals and smart contract,"solidity,smart-contracts",173
168,https://github.com/wzmyyj/ZYMK.git,:crown: 一款采用MVP-contract的仿《知音漫客》漫画APP。,,173
169,https://github.com/eshon/conference.git,A simple Ethereum smart contract + DApp example,,172
170,https://github.com/marbleprotocol/flash-lending.git,Flash lending smart contracts,,171
171,https://github.com/truffle-box/react-auth-box.git,"Truffle, Webpack, React, Redux boilerplate with routing and authentication via a smart contract.","ethereum,ethereumjs,react,redux,webpack,truffle,solidity",171
172,https://github.com/rkalis/truffle-plugin-verify.git,✅ Verify your smart contracts on Etherscan from the Truffle CLI,"truffle,etherscan,ethereum,web3,solidity",170
173,https://github.com/ProjectOpenSea/opensea-erc1155.git,"Example semi-fungible collectible, to demonstrate OpenSea integration for an ERC-1155 contract",,170
174,https://github.com/Sparkleloyalty/Sparkle-Quillhash-Audit.git,Smart Contract Security Audit  ,,169
175,https://github.com/pact-foundation/pact-php.git,"PHP version of Pact. Enables consumer driven contract testing, providing a mock service and DSL for the consumer project, and interaction playback and verification for the service provider project","hacktoberfest,pact,contract-testing,apis",168
176,https://github.com/makerdao/pymaker.git,Python API for Maker contracts,"ethereum,maker-keeper,dai,stablecoin",165
177,https://github.com/blockstarter/ico-contracts.git,Ethereum smart contracts that have been used during successful ICOs,"ico,crowdsale,solidity,ethereum,smart-contracts,blockchain,ethereum-contract,ethereum-token,erc20,ico-contracts",163
178,https://github.com/itleaks/eos-contract.git,"Tutorial on writing smart contracts on EOS EOS智能合约教程,从零开始学习EOS智能合约, DApp安全漏洞(security)及攻击实践(EOS Contract)(Powered by Itleaks)","eos,smart-contracts,eos-contracts,contract-security,eos-contract,eos-security",163
179,https://github.com/RobWin/assertj-swagger.git,A Swagger assertj test library which compares a contract-first Swagger YAML/JSON file with a code-first Swagger JSON,,162
180,https://github.com/bitstat/paperstencil.git,"A cross between word processor and web form. Paperstencil helps enterprises to roll-out data collection solutions, contracts, signatures, payment related solutions of their business needs in few minutes.",,159
181,https://github.com/dappuniversity/eth-todo-list.git,Blockchain Todo App Tutorial Powered by Ethereum Smart Contracts,,158
182,https://github.com/SmartIdentity/smartId-contracts.git,Here are all the contracts pertaining to SmartID,,158
183,https://github.com/thec00n/smart-contract-honeypots.git,This repo contains a collection of smart contract honeypots.,,158
