,Url,Description,Topics,Stars
338,https://github.com/littlebtc/font-awesome-sass-rails.git,"Font Awesome, SASS version, with assets pipeline, for Rails 3.1+",,251
339,https://github.com/aMarCruz/react-native-text-size.git,Measure text accurately before laying it out and get font information from your App.,"react-native,measure,text,size,height,width,precompute,layout,multiline,fonts",250
340,https://github.com/hwding/pdf-unstamper.git,"Remove textual watermark of any font, any encoding and any language with pdf-unstamper now!","pdf,pdf-merge,stamp,tool,command-line-tool,pdfbox",250
341,https://github.com/wch/extrafont.git,Tools for using fonts in R graphics,,249
342,https://github.com/Dalgona/neodgm.git,Modern TrueType font based on an old-but-good Korean bitmap font.,"font,korean,bitmap-font,truetype,elixir,open-font-license,ofl,ttf",249
343,https://github.com/keremciu/sketch-use-fontawesome.git,Font awesome plugin for sketch,,246
344,https://github.com/quran/quran.com-images.git,images using fonts from King Fahed Complex / qurancomplex.org,,245
345,https://github.com/foliojs/font-manager.git,A C++ module for Node.js providing access to the system font catalog.,,245
346,https://github.com/tomolt/libschrift.git,A lightweight TrueType font rendering library,"suckless,truetype,c,library",244
347,https://github.com/fontello/ttf2woff.git,"Font convertor, TTF to WOFF, for node.js",,244
348,https://github.com/nfroidure/svgicons2svgfont.git,Concatenate SVG icons and ouput an SVG font,,243
349,https://github.com/ButTaiwan/gensen-font.git,A free font family derived from Source Han Sans.,,241
350,https://github.com/openMF/community-app.git,"This is the default web application built on top of the Apache Fineract platform. The Mifos X Web App (formerly called Community App) is maintained by the Mifos Initiative as a reference solution for the financial inclusion community. It is a Single-Page App (SPA) written in web standard technologies like JavaScript, CSS and HTML5. It leverages common popular frameworks/libraries such as AngularJS 1.5, Bootstrap and Font Awesome",hacktoberfest,241
351,https://github.com/haoyuns/EyesAsia.git,"{""A font if you need tiny shapes for China's provinces or east Asian countries as a design element.""}",,240
352,https://github.com/bluemix/Tourism-Demo.git,"Flutter app backed by Redux, shows animations, internationalization (i18n), ClipPath, fonts and others...","flutter,i18n,internationalization,arabic,english,animations,rotation,fonts,clippath,redux,restful",237
353,https://github.com/alif-type/amiri.git,Amiri Font Project.,"font,arabic,naskh",237
354,https://github.com/maoruibin/ReView.git,"{"":art: A view to help developers and designers view the View's font size, color, and border.""}",developer-tools,236
355,https://github.com/RedHatOfficial/RedHatFont.git,"{""Red Hat's Open Source Fonts - Red Hat Display and Red Hat Text""}",,233
356,https://github.com/JuanPotato/Tofu.git,The complete opposite of a font,,233
357,https://github.com/0xced/FontReplacer.git,Easily create nibs with custom fonts,,232
358,https://github.com/jenskutilek/sudo-font.git,"Sudo, a font for programmers and command line users.","font,coding-font,tools",232
359,https://github.com/character-map-uwp/Character-Map-UWP.git,"A modern, native UWP replacement for the Win32 Character Map and Windows Font Viewer with flawless high DPI and touch support.","uwp,windows-10",232
360,https://github.com/hchargois/gohufont.git,A monospace bitmap font.,font,231
361,https://github.com/RazrFalcon/ttf-parser.git,"A high-level, safe, zero-allocation TrueType font parser.","truetype,opentype,ttf,otf",231
362,https://github.com/perrychan1/fonts.git,"My favorite fonts: SF Pro Text, Pingfang SC, Avenir Next, Roboto, Uber and more.",,230
363,https://github.com/adi1090x/termite-style.git,Simple script to change color-schemes and fonts for Termite.,"terminal,termite,termite-config,terminal-emulator,terminal-colors,terminal-themes,linux-terminal,linux-terminal-emulator,arch-linux,archcraft,ubuntu,debian,color-schemes,adi1090x,unixporn",230
364,https://github.com/johnkil/Android-Icon-Fonts.git,Material and Holo iconic fonts.,"android,iconic-fonts,material,html,holo",229
365,https://github.com/frontendbeast/list-fonts.git,PhotoShop script to list fonts used in a PSD,,227
366,https://github.com/ikocijan/MagicViews.git,Set custom font in Android application,,227
367,https://github.com/mimalef70/fontara.git,Font ARA Font Changer ( Cross browser Extension),,226
368,https://github.com/martndemus/ember-font-awesome.git,ember-cli addon for using Font Awesome icons in Ember apps,"font-awesome,ember,ember-addon,icons,javascript,addon",226
369,https://github.com/joypixels/emoji-toolkit.git,"{""The world's largest independent emoji font.""}",,225
370,https://github.com/xz/fonts.git,"A fast, open-source CDN for open-source fonts",,222
371,https://github.com/android-awesome/Awesome-Material.git,"Combination of Font Awesome, Material Design, and Bootstrap!",,222
372,https://github.com/mmstick/fontfinder.git,"{""GTK application for browsing and installing fonts from Google's font archive""}","font-finder,rust,gtk",221
373,https://github.com/eugeneching/consolas-powerline-vim.git,"Fixed Consolas font for use with Vim Powerline. Font has all variants: regular, bold, italic, bold-italic.",,221
374,https://github.com/FortAwesome/react-native-fontawesome.git,Official React Native component for Font Awesome 5,,221
375,https://github.com/1nfinityLoop/Sudoku-Solver-AI.git,"I made a real time Sudoku solver using the camera, it looks for the edges of the Sudoku in the frame, extracts it, solves it and overlays the solution on the puzzle itself. For the digit recognition, I used a CNN, trained using Keras with printed characters from the different ubuntu fonts. For the image processing part, I used OpenCV for the edge detection.",,220
376,https://github.com/marcohc/roboto-calendar-view.git,Easy calendar view with custom fonts,,219
377,https://github.com/optional-is/Meyrin.git,The Terminal font-face we created at the CERN Hackday,,219
378,https://github.com/cpitclaudel/monospacifier.git,Convert variable-pitch fonts to monospace (useful for unicode and indentation-friendly programming) ,,218
379,https://github.com/fontworks-fonts/RocknRoll.git,A font file available from Google Fonts.,,217
380,https://github.com/somq/consolas-ligaturized.git,Standard Consolas font with FiraCode ligatures.,"font,consolas,ligatures,firacode",214
381,https://github.com/deni2s/IBCustomFonts.git,IBCustomFonts category allows you to use custom fonts from Interface Builder (IB) when building your iOS apps. Apps using IBCustomFonts category are approved by Apple App Store (check readme.md on latest info). Tested on iOS6 - iOS11.,"custom-fonts,interface-builder,ios,fonts",214
382,https://github.com/LumingYin/macOSLucidaGrande.git,"{""A small utility to set Lucida Grande as your Mac's system UI font.""}",,214
383,https://github.com/jsdelivr/FontFamous.git,Font Famous is the free vector media logo font.,,213
384,https://github.com/RobBrazier/svelte-awesome.git,"Awesome SVG icon component for Svelte JS, built with Font Awesome icons. Based on Justineo/vue-awesome","icons,font,svg-icon-component,font-awesome,svelte,icon,svg",211
385,https://github.com/ButTaiwan/genyog-font.git,A free font family derived from Source Han Sans.,,210
386,https://github.com/onecoolx/picasso.git,"Picasso is a high quality 2D vector graphic rendering library. It support path , matrix , gradient , pattern , image and truetype font.","graphics,vevtor,image,rendering,font,path,svg,2d,2d-graphics,render,rendering-engine,vector-graphics,canvas,canvas2d",210
387,https://github.com/fontworks-fonts/Train.git,A font file available from Google Fonts.,,208
388,https://github.com/rosettatype/yrsa-rasa.git,Yrsa &\xa0Rasa: fonts for Latin and Gujarati,"font,gujarati,latin,google-fonts,fonts,libre",207
389,https://github.com/wspr/fontspec.git,Font selection in LaTeX for XeTeX and LuaTeX,"luatex,xetex,font-selection",207
390,https://github.com/rastikerdar/vazir-code-font.git,A Persian (farsi) Monospaced Font for coding - فونت (قلم) فارسی وزیرکد برای کد نویسی,,207
391,https://github.com/jsmarcus/Iconize.git,Use icon fonts in your Xamarin.Forms application!,,206
392,https://github.com/alexmyczko/fnt.git,"apt for fonts, the missing font manager for macOS/linux","debian,individual-fonts,macos,fonts,typography,haiku-os,freebsd,cli",206
393,https://github.com/marcologous/Open-Sauce-Fonts.git,"{""Open Sauce Fonts is a font super family that I developed for Creative Sauce's internal type system. It is a compact typeface that is optimised for better viewing small text on screen and print. Open Sauce fonts (Sans, One and Two) are under the SIL Open Font License and is going to be actively developed, improved and tested.""}","fonts,typeface,alfredo-marco-pradil,sil,ofl",206
394,https://github.com/wixette/dotted-chinese-fonts.git,Dotted Chinese Pixel Fonts 点点像素 | 开源的中文像素字体,,206
395,https://github.com/dfrg/swash.git,"Font introspection, complex text shaping and glyph rendering.",,206
396,https://github.com/alectro/SCSScale.git,"{""Typographic modular scale starter based on body's font-size built on SCSS.""}","scss,css,typography,font,font-size,hierarchy,modular-scale,ratio",206
397,https://github.com/xdanaux/fontawesome-latex.git,"LaTeX mappings for Font Awesome, the icons font",,204
398,https://github.com/rastikerdar/sahel-font.git,A Persian (farsi) Font - فونت (قلم) فارسی ساحل,,203
399,https://github.com/johnkil/Print.git,A lightweight Android library for use iconic fonts.,"android,iconic-fonts,imageview,typeface",202
400,https://github.com/andreinitescu/IconFont2Code.git,Generate C# class with constant fields for the icons in your font,,202
401,https://github.com/MorbZ/OpenSansEmoji.git,OpenSans based font which includes the full iOS Emoji set,,201
402,https://github.com/imkira/unity-sysfont.git,unity-sysfont is a Unity3D plugin for rendering dynamic text using the fonts available on the mobile device/computer. ,,200
403,https://github.com/XiangWuShuo/EFIconFont.git,Yet another stupid wrapper of icon font.,"iconfont,icon,font,icon-font,iconfonts,iconfont-icon",200
404,https://github.com/astiopin/webgl_fonts.git,WebGL font rendering,,199
405,https://github.com/gowravshekar/font-awesome-webpack.git,font-awesome package for webpack,,198
406,https://github.com/sebschub/FontPro.git,"{""LaTeX support for Adobe's Pro opentype fonts: Minion Pro, Myriad Pro, Cronos Pro and possibly more""}",,197
407,https://github.com/riccardonobile/Bootstrap3-Webmin-Theme.git,BWTheme - A simple and beautiful theme for Webmin and Usermin made using Bootstrap and Font Awesome,,197
408,https://github.com/hoeflerco/proofs.git,Documents and tools for proofing fonts,,195
409,https://github.com/filamentgroup/font-loading.git,Research on fonts,,194
410,https://github.com/googlefonts/nototools.git,Noto fonts support tools and scripts plus web site generation,,193
411,https://github.com/Heydon/Community-Icon-Font.git,To create a collaborative font using SVG,,193
412,https://github.com/awesome-inc/FontAwesome.Sharp.git,A library for using Font Awesome in WPF & Windows Forms applications,"fontawesome,icon,material-design,dotnet-core,wpf,windows-forms",193
413,https://github.com/Ishmeetsingh97/FontometricsLibrary.git,Android Library to use custom fonts with ease.,,191
414,https://github.com/components/font-awesome.git,Shim repository for Font Awesome.,,191
415,https://github.com/kanjialive/kanji-data-media.git,"Japanese language data on kanji and radicals, media files, fonts and related resources from Kanji alive","japanese,japanese-study,japanese-radicals,kanji-animations,kanji-strokes,kanji,kana,japanese-language,japanese-font",191
416,https://github.com/donbright/font_to_svg.git,Render characters from font files into an SVG path ,,191
417,https://github.com/google/myanmar-tools.git,"Detect and convert the Zawgyi-One font encoding in C++, Java, JavaScript, PHP, and Ruby",,191
418,https://github.com/chrs1885/Capable.git,"Keep track of accessibility settings, leverage high contrast colors, and use scalable fonts to enable users with disabilities to use your app.","accessibility,handicap,swift,colors,dynamic-type,ios,wcag,custom-fonts,a11y",191
419,https://github.com/mrmrs/awesome-system-fonts.git,An awesome list of websites that use system fonts,,188
420,https://github.com/Pythonity/icon-font-to-png.git,"Python script (and library) for exporting icons from icon fonts (e.g. Font Awesome, Octicons) as PNG images","python,font-awesome,octicons,command-line-tool,icon-font",188
421,https://github.com/tokotype/PlusJakartaSans.git,"+Jakarta Sans is a open-source fonts. Designed for Jakarta ""City of collaboration"" program in 2020.","typeface,typography,font,ofl",187
422,https://github.com/andrewgioia/mana.git,Magic: the Gathering mana symbol pictographic font,,186
423,https://github.com/wentin/typedetail.git,Annotating beautiful details of web fonts,,184
424,https://github.com/thoughtbot/fistface.git,DIY @font-face web service.,,184
425,https://github.com/xtoolkit/Micon.git,"Micon, The iconic windows 10 font and CSS toolkit.","icons,font,custom-fonts,font-tooklit,iconic-toolkit,micon,bower,css",184
426,https://github.com/liweitianux/resume.git,My Chinese and English Resumes in LaTeX with Font Awesome 5,"resume,cv,template,latex,font-awesome-5,chinese",183
427,https://github.com/file-icons/icons.git,Source files for the custom icon-font used by the File-Icons package.,icons,183
428,https://github.com/grimfang4/SDL_FontCache.git,A generic font caching C library with loading and rendering support for SDL.,,183
429,https://github.com/scriptum/UBFG.git,Ultimate Bitmap Font Generator,,182
430,https://github.com/avocode/avocode.git,"Get CSS, SVG, image assets, fonts, colors. All without Photoshop or Sketch.",,182
431,https://github.com/yuweiming70/Style_Migration_For_Artistic_Font_With_CNN.git,"基于卷积神经网络的风格迁移，制造出带有艺术风格的字体（艺术字），部分效果可达PS水平，可以辅助设计人员做设计；Convolutional neural network based style migration to create a font with artistic style (WordArt), some effects up to PhotoShop level, it can assist designers to do design",,182
432,https://github.com/riuson/lcd-image-converter.git,"Tool to create bitmaps and fonts for embedded applications, v.2","lcd,graphical,image-converter,glcd,display,conversion",181
433,https://github.com/wspr/unicode-math.git,XeLaTeX/LuaLaTeX package for using unicode/OpenType maths fonts,"typesetting,unicode-math,latex-package",181
434,https://github.com/hwkr/BitIcon.git,A programming language glyph font,,181
435,https://github.com/new299/hackterm.git,experimental sdl based terminal with gnu unifont font rendering using libvterm,,181
436,https://github.com/johnsmclay/icnfnt.git,"{""Many of Grant and Clay's clients wanted to use the fantastic FontAwesome Icon Font, but didn't want to make their users download more icons than necessary.  Icnfnt was originally a weekend project built to solve this problem. Since it worked so well, Grant and Clay decided to put it online for anyone to use.  Built with Angular.js, Bootstrap, Flask, FontForge, and lots of pizza.""}",,181
437,https://github.com/wernight/powerline-web-fonts.git,Powerline Web Fonts for Chromebook,"chromebook,fonts,powerline,web-fonts,woff,inconsolata,font,crosh-window",180
438,https://github.com/MuseScoreFonts/Leland.git,A SMuFL-compliant OpenType music font,,180
439,https://github.com/svendvd/Fontinator.git,"Fontinator is an Android-Library make it easy, to use custom Fonts.",,179
440,https://github.com/feathericon/feathericon.git,"simply generic vector icon collection - including sketch file, svg files, and font files.","webfonts,icons,svg,svg-icons,svg-sprites,sketch,sass,css,fontcustom,npm-package,vector-icons,vector",179
441,https://github.com/JohnWong/IconFont.git,IconFont is a way to build lossless images of pure color with font file。IconFont是一种通过字体文件来构建纯色图的方案。,"icon-font,lossless-images,fontforge",179
442,https://github.com/rolandwalker/unicode-fonts.git,Configure Unicode fonts for Emacs,,175
443,https://github.com/jongio/AngularJS-WebApi-EF.git,"AngularJS CRUD Grid with WebApi, EF, Bootstrap, Font Awesome & Toastr",,174
444,https://github.com/dharmatype/Sometype-Mono.git,Sometype Mono / Monospaced font,,174
445,https://github.com/entria/react-native-fontawesome.git,React Native Font Awesome Icons,"react-native,icons,fontawesome,custom-fonts",173
446,https://github.com/0matgal0/AutoMono.git,"Programming font derived from Roboto Mono (with a hint of Monaco, SF Mono, Gotham & Futura)",,173
447,https://github.com/fontworks-fonts/Reggae.git,A font file available from Google Fonts.,,172
448,https://github.com/fontello/fontelico.font.git,Opensource iconic font from Fontello project,,172
449,https://github.com/crozynski/comicneue.git,Comic Neue is a font that fixes the shortcomings of Comic Sans,,171
450,https://github.com/eBay/ebay-font.git,A small utility to efficiently load custom web fonts ,,170
451,https://github.com/mattdesl/fontpath.git,Font to vector path tools,,169
452,https://github.com/mishamyrt/Lilex.git,🤘Open source programming font,"font,ligatures,programming-ligatures,opentype-features",169
453,https://github.com/etiennepinchon/aframe-fonts.git,🅰️ Google Fonts for A-Frame - All of them.,,167
454,https://github.com/simmel/urxvt-resize-font.git,URxvt Perl extension for resizing the font,,167
455,https://github.com/hanspeide/anytextview.git,"{""An extension of Android's TextView, EditText and Button that let's you use the font of your choice ""}",,167
456,https://github.com/fffaraz/awesome-persian.git,"A curated list of amazingly awesome Persian supporting tools, fonts, and development resources.",,166
457,https://github.com/renkun-ken/MacType.Decency.git,A MacType profile that provides decent solution to font rendering and font substitutions for Windows operating systems.,,166
458,https://github.com/Grawl/Grands.git,social icon font,,165
459,https://github.com/mcufont/mcufont.git,A font rendering library for microcontrollers.,,164
460,https://github.com/aiekick/ImGuiFontStudio.git,Font Helper Gui Tool for programming,"imgui,font,subset-font,embedded,theme,font-icons,font-awesome,tool,software,font-merge,batch-job,codepoint,free-software,dear-imgui,windows,linux,macos,osx,cross-platform",163
461,https://github.com/jaywcjlove/svgtofont.git,Read a set of SVG icons and ouput a TTF/EOT/WOFF/WOFF2/SVG font.,"svgtofont,svg2font,ttf,ttf2woff,ttf2eot,ttf2woff2,eot,svg2ttf,icon,icons,webfont,icon-font,font,svg-icons",163
462,https://github.com/dse/routed-gothic.git,"A clean vintage drafting, avionics, routed signage, and keyboard legend font.","avionics,blueprints,doric,drafting,engineering,engraved,font,keyboard-legends,keuffel-esser,leroy,lettering,mid-century,monoline,office-signage,technical,vintage,block-letters,uniform-stroke-width,sans-serif,rounded-terminals",163
463,https://github.com/rewtnull/amigafonts.git,Faithfully remade multi platform Amiga fonts in Amiga aspect,,162
464,https://github.com/framework7io/framework7-icons.git,Free iOS-icons font for Framework7,"icon-font,framework7-icons,font-files",161
465,https://github.com/steinbergmedia/bravura.git,"Bravura music font, reference font for SMuFL (Standard Music Font Layout)","fonts,smufl,bravura,bravura-music-font,music-notation,music,ofl,opentype-fonts",161
466,https://github.com/ludwigpacifici/modern-cpp-font-lock.git,C++ font-lock for Emacs,"melpa,syntax-highlighting,emacs,elisp",161
467,https://github.com/automat/sketch-text-tools.git,"Sketch App Typography Plugin for working with font metrics, aligning text-layers and building typographic systems.",,161
468,https://github.com/fontworks-fonts/Stick.git,A font file available from Google Fonts.,,160
469,https://github.com/SorkinType/Merriweather.git,"Merriweather is a serif typeface. It is offered in Variable font format and static formats ( OTF, TTF WOFF etc). ",,160
470,https://github.com/Lorp/samsa.git,Variable font inspector,"variable-fonts,visualization,fonts,parametric-fonts,polyfill,node,axis-praxis",159
471,https://github.com/jeerbl/webfonts-loader.git,Make an icon font from SVGs!,"webpack-loader,font-icons,icon-font,ttf,eot,woff,woff2,svg,svg-icons",158
472,https://github.com/rionmonster/Glyphfriend.git,Glyphfriend is a Visual Studio Extension to add previews for various icon/glyph fonts to Visual Studio.,"visual-studio,visual-studio-extension,glyphs,autocompletion,icons,font-awesome",158
473,https://github.com/douzifly/android-lrc-view.git,"Display standard lyric file of songs on android, also can move to seek progress and multi touch to scale font size.",,158
474,https://github.com/choffmeister/roboto-fontface-bower.git,Bower package for the Roboto font-face,,157
475,https://github.com/prasunroy/stefann.git,:fire: STEFANN: Scene Text Editor using Font Adaptive Neural Network @ The IEEE/CVF Conference on Computer Vision and Pattern Recognition (CVPR) 2020.,"stefann,fannet,colornet,scene-text-editor,font-generation,color-transfer,computer-vision,deep-learning,cvpr,cvpr2020",157
476,https://github.com/bdusell/webfont-generator.git,Locally convert fonts to web formats and generate CSS rules,"font-converter,woff,woff2,fontforge,fonts,svg-font,ttf,eot,font-face,font-face-generator,sfntly",155
477,https://github.com/cod-ed/handwrite.git,Handwrite generates a custom font based on your handwriting sample.,"python,cli,handwriting,typography,fonts,fontforge",154
478,https://github.com/Figma-Linux/figma-linux-font-helper.git,Font Helper for Figma for Linux x64 platform,"figma,helper,linux,fonts,rust",154
479,https://github.com/tryWabbit/Layout-Helper.git,"Layout Helper is created to solve the issue of constraint based layout where the developer are bound by the size classes for the  same traits but have different screen sizes. Layout Helper will give the Developer the freedom to update Constraints, Fonts of various UI element for every single device. ",,153
480,https://github.com/k0sukey/TiIconicFont.git,Iconic font wrapper for Titanium.,,152
481,https://github.com/shalinguyen/socialicious.git,A social media icons library in font form.,,152
482,https://github.com/rikrd/geomerative.git,"Geomerative is a library for Processing. It extends 2D geometry operations to facilitate generative geometry. Includes a TrueType font and an SVG interpreters. This library exposes the shapes (such as vector drawings or typographies) in a more approchable way. Geomerative makes it easy to access the contours, the control points and the curve points, making it easy to develop generative typography and geometry pieces in Processing.",,152
483,https://github.com/bp2008/BetterClearTypeTuner.git,A better way to configure ClearType font smoothing on Windows 10.,,151
484,https://github.com/kemie/Source-Sans-Yosemite-System-Font-Replacement.git,Modified Source Sans family to replace the default system font on Mac OS X Yosemite,"font,yosemite,helvetica,macos",151
485,https://github.com/TheRobotFactory/EightBit-Atari-Fonts.git,Fonts generated from original bitmaps from Atari 8bit computers,,150
486,https://github.com/EtheaDev/IconFontsImageList.git,"Components to simplify use of ""Icon fonts"": resize, color, opacity and more... with full support for High-DPI apps. Rendering optimized with GDI+","delphi,icons,material-icon-fonts,icons-pack,material-ui,fmx,manage-icon-fonts,fonts,vcl-styles,vcl,demo,gdi-plus",150
487,https://github.com/appfarms/CoreTextLabel.git,"With CoreTextLabel you are able draw NSAttributedString or HTML with custom font and color in iOS (>= 5.0) applications. ""numberOfLines"" and ""truncation"" (NSLineBreakByTruncatingTail) is also supported.",,150
488,https://github.com/pavius/the-dot-factory.git,Generates fonts for dot matrix displays,,149
489,https://github.com/matthewjberger/scoop-nerd-fonts.git,A scoop bucket for installing nerd fonts,"scoop,scoop-bucket,nerd-fonts,powershell",149
490,https://github.com/IamManchanda/gulp-webpack.git,Gulp 4 + Webpack 4 + Babel + BrowserSync + Font Awesome 5 (Modern JavaScript + Sass/CSS),,149
491,https://github.com/ButTaiwan/genseki-font.git,A free font family derived from Source Han Sans.,,149
492,https://github.com/rmrevin/yii2-fontawesome.git,Asset Bundle for Yii2 with Font Awesome http://fortawesome.github.io/Font-Awesome/,"php,icons,css,font,fontawesome,assets",148
493,https://github.com/tomkra/font_awesome5_rails.git,font_awesome_5_rails is font awesome 5 gem bundled for rails asset pipeline,"rails,font-awesome",148
494,https://github.com/averyvery/hieroglyph.git,Generate an icon font from a directory of vector files,,148
495,https://github.com/OSAS/strapping-mediawiki.git,"base skin for MediaWiki, based on Bootstrap — layer your own style (fonts, graphics, color) on top",,147
496,https://github.com/litefeel/Unity-BitmapFontImporter.git,An unity editor extension for bitmap font.,"unity3d-plugin,unity-editor,unity,bitmap-font",147
497,https://github.com/zaiste/foundation-icons-sass-rails.git,Foundation Font Icons on Sass for Rails,,147
498,https://github.com/frostming/python-cfonts.git,Sexy fonts for the console,"cli,command-line-app,terminal-colors,click,command-line-tools",146
499,https://github.com/ninjaprox/Inkwell.git,An inkwell to use custom fonts on the fly.,"font,google-fonts,inkwell,fonts,uifont",146
500,https://github.com/sursly/sono.git,A soft monospace variable font,,146
501,https://github.com/gjunge/rateit.js.git,"{""Rating plugin for jQuery.  Fast, Progressive enhancement, touch support, icon-font support, highly customizable, unobtrusive JavaScript (using HTML5 data-* attributes), RTL support, supports as many stars as you'd like, and also any step size.""}","star,rating-plugin,rateit,jquery,rating",146
