,Url,Description,Topics,Stars
0,https://github.com/nsqio/nsq.git,A realtime distributed messaging platform,"go,messaging,distributed-systems,queue,message-queue,nsq",19649
0,https://github.com/telegramdesktop/tdesktop.git,Telegram Desktop messaging app,"telegram,telegram-desktop,messenger,telegram-solution,multi-platform",15554
0,https://github.com/LMAX-Exchange/disruptor.git,High Performance Inter-Thread Messaging Library,"disruptor,java,concurrency",13720
0,https://github.com/marcuswestin/WebViewJavascriptBridge.git,An iOS/OSX bridge for sending messages between Obj-C and JavaScript in UIWebViews/WebViews,,13648
0,https://github.com/akka/akka.git,"Build highly concurrent, distributed, and resilient message-driven applications on the JVM","reactive,distributed-systems,concurrency,high-performance,akka,actor-model,distributed-actors,cloud-native,streaming,hacktoberfest",11547
0,https://github.com/jessesquires/JSQMessagesViewController.git,An elegant messages UI library for iOS,"messaging,message,messenger,ios,viewcontroller,jsqmessagesviewcontroller,ios-ui",11232
0,https://github.com/OptimalBits/bull.git,Premium Queue package for handling distributed jobs and messages in NodeJS.,"nodejs,message-queue,job-queue,queue,job,message,priority,scheduler,rate-limiter",10590
0,https://github.com/howdyai/botkit.git,"Botkit is an open source developer tool for building chat bots, apps and custom integrations for major messaging platforms.","botkit,botkit-studio,microsoft-bot-framework,bot-application,slack,facebook,twilio,cisco-spark,bots,sms,conversational-ui,workplacebyfacebook,microsoft-teams,bot,facebook-bot,facebook-messenger,glitch,making-bots,web-bot,chatbot",10335
0,https://github.com/carloscuesta/gitmoji.git,An emoji guide for your commit messages. 😜 ,"emoji,gitmoji,commits",9728
0,https://github.com/nats-io/nats-server.git,"High-Performance server for NATS.io, the cloud and edge native messaging system.","go,golang,messaging,message-bus,message-queue,cloud-native,microservices-architecture,nats-server,distributed-systems,cloud,cloud-computing",9301
0,https://github.com/apache/pulsar.git,Apache Pulsar - distributed pub-sub messaging system,"pulsar,pubsub,messaging,streaming,queuing,event-streaming",8446
0,https://github.com/slackhq/SlackTextViewController.git,⛔️**DEPRECATED** ⛔️ A drop-in UIViewController subclass with a growing text input view and other useful messaging features,,8432
0,https://github.com/conventional-changelog/commitlint.git,📓 Lint commit messages,"git,commit,lint,conventions",8181
0,https://github.com/apache/arrow.git,"Apache Arrow is a cross-language development platform for in-memory data. It specifies a standardized language-independent columnar memory format for flat and hierarchical data, organized for efficient analytic operations on modern hardware. It also provides computational libraries and zero-copy streaming messaging and interprocess communication. Languages currently supported include C, C++, Java, JavaScript, Python, and Ruby.",arrow,7909
0,https://github.com/emqx/emqx.git,EMQ X Broker - Scalable Distributed MQTT Message Broker for IoT in the 5G Era,"mqtt,iot,mqtt-broker,erlang,erlang-mqtt-broker,iot-middleware,broker,m2mqtt,m2m,pubsub,messaging,coap,coap-server,lorawan,lorawan-server,5g,5g-messaging,mqtt-server,iot-broker,iot-server",7835
0,https://github.com/antirez/disque.git,Disque is a distributed message broker,,7778
0,https://github.com/guzzle/psr7.git,PSR-7 HTTP message library,,7076
0,https://github.com/needim/noty.git,⛔️ DEPRECATED - Dependency-free notification library that makes it easy to create alert - success - error - warning - information - confirmation messages as an alternative the standard alert dialog.,"javascript,notifications,library,push,depracated,obsolete,archived",6760
0,https://github.com/webmozarts/assert.git,Assertions to validate method input/output with nice error messages.,,6752
0,https://github.com/php-fig/http-message.git,The purpose of this PSR is to provide a set of common interfaces for HTTP messages as described in RFC 7230 and RFC 7231,"psr,php,php-fig,http",6199
0,https://github.com/RomuloOliveira/commit-messages-guide.git,A guide to understand the importance of commit messages and how to write them well,,6122
0,https://github.com/SwiftKickMobile/SwiftMessages.git,A very flexible message bar for iOS written in Swift.,"swift,ios,nib,ui,nib-files,snackbar,alerts,ui-components,banner,swift4,ios11,iphone-x",6073
0,https://github.com/ramboxapp/community-edition.git,Free and Open Source messaging and emailing app that combines common web applications into one.,"windows,macos,linux,whatsapp,messenger,skype,email,gmail,outlook,icloud,hangouts,slack,telegram,microsoft-teams,facebook-workplace,custom-services,discord,hipchat,inbox,tweetdeck",5896
0,https://github.com/gotify/server.git,A simple server for sending and receiving messages in real-time per WebSocket. (Includes a sleek web-ui),"golang,notifications,api,react,javascript,gotify,selfhosted,self-hosted,privacy,cloud,hosting,free-software,self-hosting",5798
0,https://github.com/real-logic/aeron.git,"Efficient reliable UDP unicast, UDP multicast, and IPC message transport","messaging,java,c-plus-plus,ipc,multicast-streams,c",5520
0,https://github.com/tinode/chat.git,"Instant messaging platform. Backend in Go. Clients: Swift iOS, Java Android, JS webapp, scriptable command line; chatbots","chat,chat-application,chatapp,go,golang,instant-messaging,messenger,messaging,messaging-api,grpc,chatbots,chatserver,webchat-server,whatsapp,telegram,xmpp",5404
0,https://github.com/conventional-changelog/conventional-changelog.git,"{""Generate changelogs and release notes from a project's commit messages and metadata.""}","changelog,history,git,tag,metadata",5390
0,https://github.com/ValveSoftware/GameNetworkingSockets.git,Reliable & unreliable messages over UDP.  Robust message fragmentation & reassembly.  P2P networking / NAT traversal.  Encryption.,"reliable-messages,networking,game-development,realtime-messaging,peer-to-peer",5244
0,https://github.com/RichardKnop/machinery.git,Machinery is an asynchronous task queue/job queue based on distributed message passing.,"go,golang,task,task-scheduler,queue,amqp,rabbitmq,redis,memcached,mongodb,aws-sqs",5204
0,https://github.com/centrifugal/centrifugo.git,Scalable real-time messaging server in language-agnostic way. Set up once and forever.,"sockjs,websocket,redis,real-time,messaging,scalability",5035
0,https://github.com/KrauseFx/TSMessages.git,💌 Easy to use and customizable messages/notifications for iOS à la Tweetbot,"notifications,tsmessages,objective-c,cocoapods,ios,library",4935
0,https://github.com/processone/ejabberd.git,"Robust, Ubiquitous and Massively Scalable Messaging Platform (XMPP, MQTT, SIP Server)","erlang,xmpp,jabber,chat,messaging,sip,voip,iot,pubsub,broker,groupchat,stun,turn,ejabberd,jabber-server,mqtt,brokers,server,sip-server",4863
0,https://github.com/berty/berty.git,"Berty is a secure peer-to-peer messaging app that works with or without internet access, cellular data or trust in the network","berty,ipfs,libp2p,mobile-app,ios,android,cybersecurity,privacy,p2p,orbitdb,react-native,gomobile,encryption,censorship,surveillance,monorepo,offline-first,crdt,messaging",4506
0,https://github.com/faye/faye.git,Simple pub/sub messaging for the web,,4327
0,https://github.com/Redth/PushSharp.git,"A server-side library for sending Push Notifications to iOS (iPhone/iPad APNS), Android (C2DM and GCM - Google Cloud Message), Windows Phone, Windows 8, Amazon, Blackberry, and (soon) FirefoxOS devices!",,4321
0,https://github.com/xhzengAIB/MessageDisplayKit.git,"An IM App like WeChat App has to send text, pictures, audio, video, location messaging, managing local address book, share a circle of friends, drifting friends, shake a fun and more interesting features.",,4302
0,https://github.com/HubSpot/messenger.git,Growl-style alerts and messages for your app. #hubspot-open-source,,4074
0,https://github.com/google/end-to-end.git,"End-To-End is a crypto library to encrypt, decrypt, digital sign, and verify signed messages (implementing OpenPGP)","openpgp,javascript,otr,cryptography",3987
0,https://github.com/meetfranz/franz.git,"Franz is a free messaging app for services like WhatsApp, Slack, Messenger and many more.","messaging,electron,franz,messenger,whatsapp,slack,telegram,productivity,office",3975
0,https://github.com/mutualmobile/MMWormhole.git,Message passing between iOS apps and extensions.,,3795
0,https://github.com/seanpowell/Email-Boilerplate.git,The email boilerplate for sending out nicely formatted messages.,,3709
0,https://github.com/hyperoslo/Whisper.git,:mega: Whisper is a component that will make the task of display messages and in-app notifications simple. It has three different views inside,"ios,swift,message,notifications",3700
0,https://github.com/ricochet-im/ricochet.git,Anonymous peer-to-peer instant messaging,"tor,c-plus-plus,messaging,privacy,gui,cross-platform",3531
0,https://github.com/ssbc/patchwork.git,A decentralized messaging and sharing app built on top of Secure Scuttlebutt (SSB).,"scuttlebutt,ssb,social,social-network,decentralized,offline,off-grid,p2p,nodejs,electron,macos,linux,decentralized-messaging,windows,server,javascript",3449
0,https://github.com/nats-io/nats.go.git,"Golang client for NATS, the cloud native messaging system.","go,golang,nats,microservices,microservices-architecture,pub-sub,cloud-native,cloud-native-architectures,cloud-native-microservices",3350
0,https://github.com/actorapp/actor-platform.git,Actor Messaging platform,,3311
0,https://github.com/daimajia/AndroidViewHover.git,An elegant way to show your menu or messages.,,3176
0,https://github.com/twitter-archive/kestrel.git,"simple, distributed message queue system (inactive)",,2787
0,https://github.com/nixzhu/MonkeyKing.git,MonkeyKing helps you to post messages to Chinese Social Networks.,"wechat,weibo,qq,alipay",2656
0,https://github.com/power-assert-js/power-assert.git,Power Assert in JavaScript. Provides descriptive assertion messages through standard assert interface. No API is the best API.,"power-assert,assert",2615
0,https://github.com/ehForwarderBot/ehForwarderBot.git,An extensible message tunneling chat bot framework. Delivers messages to and from multiple platforms and remotely control your accounts.,"chat-bot,chatbot,tunnel-bot,chat-tunneling,framework,eh-forwarder-bot,python-3",2533
0,https://github.com/vernemq/vernemq.git,A distributed MQTT message broker based on Erlang/OTP. Built for high quality & Industrial use cases.,"mqtt,m2m,scalable,broker,erlang,distributed,messaging,pubsub,vernemq,iot-middleware,iot,vernemq-users,vernemq-documentation,industrial-iot,industrial-communication,industrial-automation,industry-40,message-queue,manufacturing",2463
0,https://github.com/real-logic/simple-binary-encoding.git,Simple Binary Encoding (SBE) - High Performance Message Codec,"codec,java,c-plus-plus,golang,encoder-decoder",2419
0,https://github.com/vuvuzela/vuvuzela.git,Private messaging system that hides metadata,"vuvuzela,metadata,privacy,messaging,chat,cryptography,golang,research",2397
0,https://github.com/oyvindkinsey/easyXDM.git,"A javascript library providing cross-browser, cross-site messaging/method invocation.",,2386
0,https://github.com/loopj/jquery-tokeninput.git,"Tokeninput is a jQuery plugin which allows your users to select multiple items from a predefined list, using autocompletion as they type to find each item. You may have seen a similar type of text entry when filling in the recipients field sending messages on facebook.",,2383
0,https://github.com/OpenHFT/Chronicle-Queue.git,Micro second messaging that stores everything to disk,"chronicle,queue,java,performance,low-latency,persistance",2329
0,https://github.com/nanomsg/nng.git,nanomsg-next-generation -- light-weight brokerless messaging,,2268
0,https://github.com/QNJR-GROUP/EasyTransaction.git,"A distribute transaction solution（分布式事务） unified the usage of TCC , SAGA ,FMT (seata/fescar AutoCompensation)， reliable message, compensate and so on;","transaction,tcc,base,saga,distributed-transaction",2244
0,https://github.com/elevenetc/TextSurface.git,A little animation framework which could help you to show message in a nice looking way,"animation,animation-framework,android,android-library,android-ui",2167
0,https://github.com/celery/kombu.git,Messaging library for Python.,"celery,messaging,python,message-queue,kombu,python-library,python3,python-3,python2,rabbitmq,sqs",2146
0,https://github.com/liftbridge-io/liftbridge.git,"Lightweight, fault-tolerant message streams.","nats,streaming,messaging,cloud-native,grpc,distributed-systems,liftbridge,golang,go,message-queue,pubsub",2064
0,https://github.com/acani/Chats.git,Open-Source Messaging App (no longer working),,2062
0,https://github.com/cmgmyr/laravel-messenger.git,Simple user messaging package for Laravel,"laravel,php,laravel-messenger,messenger,composer,composer-packages,package,hacktoberfest",2039
0,https://github.com/victornpb/deleteDiscordMessages.git,Undiscord - Delete all messages in a Discord channel or DM (Easy and fast) Bulk delete,"discord,delete-multiple,bulk-operation,discord-channel,discordapp,userscript",1975
0,https://github.com/php-enqueue/enqueue-dev.git,"Message Queue, Job Queue, Broadcasting, WebSockets packages for PHP, Symfony, Laravel, Magento. DEVELOPMENT REPOSITORY - provided by Forma-Pro","message-queue,message-bus,rabbitmq,amqp,stomp,job-queue,amazon-sqs,redis,doctrine-dbal,rabbitmq-client,message-passing,beanstalkd,gearman,kafka,symfony,google-pubsub,wamp,wamp-client,sns,hacktoberfest",1901
0,https://github.com/nicklockwood/NullSafe.git,NullSafe is a simple category on NSNull that returns nil for unrecognised messages instead of throwing an exception,,1892
0,https://github.com/millermedeiros/js-signals.git,Custom Event/Messaging system for JavaScript inspired by AS3-Signals,,1879
0,https://github.com/terryworona/TWMessageBarManager.git,An iOS manager for presenting system-wide notifications via a dropdown message bar.,,1800
0,https://github.com/ruby-shoryuken/shoryuken.git,A super efficient Amazon SQS thread based message processor for Ruby,"ruby,shoryuken,aws-sdk-ruby,aws-sqs,concurrent-ruby,message-processor,sqs-commands,rails,activejob",1768
0,https://github.com/linkedin/kafka-monitor.git,"Xinfra Monitor monitors the availability of Kafka clusters by producing synthetic workloads using end-to-end pipelines to obtain derived vital statistics - E2E latency, service produce/consume availability, offsets commit availability & latency, message loss rate and more.","kafka-monitor,kafka-cluster,monitor-topic,partition,broker,partition-count,leader,latency,cluster,metrics,kmf,kafka-broker,xinfra-monitor,monitor-single-clusters,reassigns-partition,jmx-metrics,clusters,xinfra,monitor,topic",1747
0,https://github.com/tdryer/hangups.git,the first third-party instant messaging client for Google Hangouts,"python,asyncio,python-3,chat,google-hangouts",1737
0,https://github.com/mukulhase/WebWhatsapp-Wrapper.git,An API for sending and receiving messages over web.whatsapp [Working as of 18th May 2018],,1735
0,https://github.com/evollu/react-native-fcm.git,react native module for firebase cloud messaging and local notification,"notifications,fcm,android,firebase,ios,local-notifications",1729
0,https://github.com/Yoctol/messaging-apis.git,Messaging APIs for multi-platform,"messaging,messenger,line,api-client,chatbot,slack,telegram,bot,viber,wechat",1668
0,https://github.com/liuchengxu/git-commit-emoji-cn.git,😁 git commit message emoji 使用指南,"git,emoji",1637
0,https://github.com/mailboxer/mailboxer.git,A Rails gem to send messages inside a web application,,1634
0,https://github.com/softwaremill/elasticmq.git,In-memory message queue with an Amazon SQS-compatible interface. Runs stand-alone or embedded.,"scala,sqs-interface,elasticmq,amazon-sqs,aws,aws-sqs,messaging",1625
0,https://github.com/fbsamples/messenger-platform-samples.git,Messenger Platform samples for sending and receiving messages. Walk through the Get Started with this code. https://developers.facebook.com/docs/messenger-platform/quickstart,,1619
0,https://github.com/kilim/kilim.git,"Lightweight threads for Java, with message passing, nio, http and scheduling support.",,1613
0,https://github.com/zendframework/zend-diactoros.git,PSR-7 HTTP Message implementation,,1575
0,https://github.com/testshallpass/react-native-dropdownalert.git,"A simple alert to notify users about new chat messages, something went wrong or everything is ok.","react-native,dropdown,alert,notification",1570
0,https://github.com/sandglass/sandglass.git,"Sandglass is a distributed, horizontally scalable, persistent, time sorted message queue.","distributed,message-queue,taskqueue,go,distributed-systems,messaging",1531
0,https://github.com/messageformat/messageformat.git,ICU MessageFormat for Javascript - i18n Plural and Gender Capable Messages,"messageformat,language",1528
0,https://github.com/squaremo/rabbit.js.git,Messaging in Node.JS made easy using RabbitMQ,,1517
0,https://github.com/jay0lee/got-your-back.git,"{""Got Your Back (GYB) is a command line tool for backing up your Gmail messages to your computer using Gmail's API over HTTPS.""}",,1509
0,https://github.com/smrchy/rsmq.git,Redis Simple Message Queue,"rsmq,queue,message-queue,fifo,redis,nodejs,npm",1493
0,https://github.com/discourse/message_bus.git,A reliable and robust messaging bus for Ruby and Rack,,1483
0,https://github.com/reenhanced/gitreflow.git,"Reflow automatically creates pull requests, ensures the code review is approved, and squash merges finished branches to master with a great commit message template.","ruby,git,git-workflow,workflow,hacktoberfest",1474
0,https://github.com/tj/axon.git,message-oriented socket library for node.js heavily inspired by zeromq,,1472
0,https://github.com/taskforcesh/bullmq.git,BullMQ - Premium Message Queue for NodeJS based on Redis,,1470
0,https://github.com/zeffy/wufuc.git,"Disables the ""Unsupported Hardware"" message in Windows Update, and allows you to continue installing updates on Windows 7 and 8.1 systems with Intel Kaby Lake, AMD Ryzen, or other unsupported processors.","windows-7,windows-8-1,windows-server,windows-updates,reverse-engineering,intel,amd,intel-kaby-lake,amd-ryzen",1467
0,https://github.com/dromara/myth.git,Reliable messages resolve distributed transactions,"translation,dubbo,springcloud,motan,rocketmq,activemq,kafka,rabbitmq,aop,soa,spring,springboot,kryo,protobuf",1455
0,https://github.com/uber-archive/cherami-server.git,"Distributed, scalable, durable, and highly available message queue system. This project is deprecated and not maintained.",,1421
0,https://github.com/mainflux/mainflux.git,Industrial IoT Messaging and Device Management Platform,"golang,iot-platform,edge-computing,distributed-systems,iot-cloud,iot-gateway,message-broker,mqtt,coap,web-socket,lorawan,opc-ua,iiot,lora,iot,internet-of-things,lwm2m,messaging,edge,telecom",1413
0,https://github.com/esl/MongooseIM.git,MongooseIM is a mobile messaging platform with focus on performance and scalability,"mongooseim,erlang,xmpp,jabber,messaging,chat",1413
0,https://github.com/songtianyi/wechat-go.git,go version wechat web api and message framework for building wechat robot,"wechat,golang,web,api,robot,bot,framework",1395
0,https://github.com/nahid/talk.git,Talk is a real-time users messaging and chatting system Laravel.,"realtime-message,message-threads,conversation,talk,laravel-message,laravel-chat,inbox,laravel-talk,laravel-package",1393
0,https://github.com/loklak/loklak_server.git,"Distributed Open Source twitter and social media message search server that anonymously collects, shares, dumps and indexes data http://api.loklak.org",,1391
0,https://github.com/envoyproxy/protoc-gen-validate.git,protoc plugin to generate polyglot message validators,"protoc,constraints,protoc-plugin,protocol-buffers,validation",1369
0,https://github.com/matrixxun/MaterialBadgeTextView.git,"As the name describes, this is an Android library that you can use to show new messages badge and new features badge.","android,textview,badge,android-library",1337
0,https://github.com/discord/manifold.git,Fast batch message passing between nodes for Erlang/Elixir.,"erlang,elixir,message-passing,performance",1320
0,https://github.com/matryer/vice.git,Go channels at horizontal scale (powered by message queues),"golang,channels,queues,idiomatic",1309
0,https://github.com/message-db/message-db.git,Microservice native message and event store for Postgres,"event-store,event-sourcing,event-driven,pub-sub,event-stream,message-queue,postgres",1308
0,https://github.com/killme2008/Metamorphosis.git,"A  high available,high performance distributed messaging system.",,1300
0,https://github.com/paolosalvatori/ServiceBusExplorer.git,"The Service Bus Explorer allows users to connect to a Service Bus namespace and administer messaging entities in an easy manner. The tool provides advanced features like import/export functionality or the ability to test topic, queues, subscriptions, relay services, notification hubs and events hubs.","service-bus,notification-hubs,messaging-entities,azure-service-bus,azure-eventhub,azure-event-hubs,azure-event-hub,azure-servicebus,azure-relay,azure-notificationhub,azure-notification-hubs,azure,dotnet,windows-forms",1298
0,https://github.com/ToothlessGear/node-gcm.git,A NodeJS wrapper library port to send data to Android devices via Google Cloud Messaging,"gcm,node-gcm,notifications,javascript,firebase-cloud-messaging,android,push-notifications,nodejs",1290
0,https://github.com/cloudhut/kowl.git,"Apache Kafka Web UI for exploring messages, consumers, configurations and more with a focus on a good UI & UX.","kafka,apache-kafka,search-interface,web,ui,dataops,gui",1282
0,https://github.com/cossacklabs/themis.git,Easy to use cryptographic framework for data protection: secure messaging with forward secrecy and secure data storage. Has unified APIs across 14 platforms.,"cryptography-library,cryptography,security,golang,ios,swift,objective-c,python,ruby,php,java,javascript,authentication,secure-messenger,secure-storage,encryption,symmetric-cryptography,asymmetric-cryptography,rust,owasp",1274
0,https://github.com/Eric-Guo/wechat.git,"API, command and message handling for WeChat in Rails","wechat-sdk,wechat-oauth,wechat-framework,wechat",1255
0,https://github.com/kamranahmedse/jquery-toast-plugin.git,Highly customizable jquery plugin to show toast messages,"toast,toast-message,jquery-toast-plugin,toastr,notifications,growl,growl-notifications",1251
0,https://github.com/ppwwyyxx/wechat-dump.git,Cracking encrypted wechat message history from android,"wechat,android",1242
0,https://github.com/line/line-bot-sdk-python.git,LINE Messaging API SDK for Python,"line,bot,sdk,python",1235
0,https://github.com/jevakallio/git-notify.git,🙉 📣 Communicate important updates to your team via git commit messages,"git,githooks,husky,developer-tools,typescript",1221
0,https://github.com/kfei/slack-cleaner.git,:speech_balloon: Bulk delete messages and files on Slack,,1200
0,https://github.com/koudelka/visualixir.git,A process/message visualizer for BEAM nodes.💪👁,"elixir,visualizer,beam,erlang",1184
0,https://github.com/maknz/slack.git,"A simple PHP package for sending messages to Slack, with a focus on ease of use and elegant syntax.",,1174
0,https://github.com/atpaino/deep-text-corrector.git,"Deep learning models trained to correct input errors in short, message-like text",,1166
0,https://github.com/jaredhanson/connect-flash.git,Flash message middleware for Connect and Express.,,1154
0,https://github.com/tang-jie/NettyRPC.git,"NettyRPC is high performance java rpc server base on Netty,using kryo,hessian,protostuff support message serialization.","netty,rpc,jmx,parallel,spring",1146
0,https://github.com/didi/DDMQ.git,"DDMQ is a distributed messaging product with low latency, high throughput and high availability.",,1133
0,https://github.com/dcalsky/zzkia.git,Generate Nokia message picture for fun! 1k star  🥳  🥳  🥳,,1105
0,https://github.com/Clivern/Beaver.git,"💨 A real time messaging system to build a scalable in-app notifications, multiplayer games, chat apps in web and mobile apps.","pusher,beaver,websocket,pubsub,socket-io,realtime,messaging,messaging-service,socketjs",1084
0,https://github.com/php-http/message-factory.git,Factory interfaces for PSR-7 HTTP Message,,1078
0,https://github.com/ivanvorobei/SPAlert.git,"Native alert from Apple Music & Feedback. Contains Done, Heart & Message and other presets.","alert,popup,swift,apple,native,applemusic,appstore,feedback,animated,ui,ui-components,uikit,apple-music,alert-controller,ios",1063
0,https://github.com/Visgean/Zeus.git,"NOT MY CODE! Zeus trojan horse - leaked in 2011, I am not the author. This repository is for study purposes only, do not message me about your lame hacking attempts. ","c,c-plus-plus,malware,russian,virus,leaks",1059
0,https://github.com/rabbitmq/rabbitmq-delayed-message-exchange.git,Delayed Messaging for RabbitMQ,"rabbitmq,plugin,exchange,rabbitmq-plugin",1020
0,https://github.com/php-http/message.git,HTTP Message related tools,,1012
0,https://github.com/ptaoussanis/carmine.git,Redis client and message queue for Clojure,"clojure,epl,taoensso,redis,message-queue",1004
0,https://github.com/tmijs/tmi.js.git,💬 Javascript library for the Twitch Messaging Interface. (Twitch.tv),"twitch,chatbot,javascript,nodejs,tmi,tmijs,twitchdev",1003
0,https://github.com/reactiflux/discord-irc.git,Connects Discord and IRC channels by sending messages back and forth.,,992
0,https://github.com/nats-io/nats.js.git,"Node.js client for NATS, the cloud native messaging system.",,989
0,https://github.com/Slyce-Inc/SlyceMessaging.git,A messaging library for Android,"android,ui",978
