,Url,Description,Topics,Stars
768,https://github.com/matzigno/CSML21.git,"Notebook repository for the course ""Computational Statistics and Machine Learning"" - First Level Master in Data Science for Economics, Business and Finance at the University of Milan",,1
769,https://github.com/belkin1667/finch_backend.git,"Belkin Mike (Backend) & Artem Goncharov (Frontend) Software Engineering Course Work at National Research University Higher School of Economics, Faculty of Computer Science Moscow, Russia 2021","spring-boot,spring-security,rest-api,postgresql,lombok,spring-data-jpa,java,gradle,github-actions,docker,swagger,google-cloud-run,google-cloud-sql,jwt,postman",1
770,https://github.com/nishchayp/algorithms-on-graphs.git,"Contains my code submission for Algorithms on Graphs course as offered by University of California, San Diego & National Research University Higher School of Economics on Coursera. ",,1
771,https://github.com/SergeyPetrakov/Economics_Projects.git,Here you can observe some projects that I have made during my undergraduate studies at the Faculty of Economics of Lomonosov Moscow State University,,1
772,https://github.com/djsaunde/NutritionDataCoding.git,Work done for professor Christian Rojas of the UMass Amherst Resource Economics department. These python scripts restructure semi-structured nutrition data scanned from nutrition information texts.,,1
773,https://github.com/xoabperez/SomeAlgorithmExercises.git,"Exercises for an online course offered on Coursera and by University of California, San Diego & National Research University Higher School of Economics",,1
774,https://github.com/bhuyanamit986/HSE-Introduction-to-deep-learning.git,"{""Here are my assignments that I completed in my course Introduction to Deep Learning by coursera from Higher School of Economics on coursera's environment.""}",,1
775,https://github.com/onefineday01/Algorithmic-Toolbox---Coursera.git,"This Repository Contains my solution to the problems from the Course Algorithmic Toolbox by University of California San Diego & National Research University Higher School of Economics, on Coursera",,1
776,https://github.com/banda13/Carrecognizer.git,This project is part of my Carrecognizer-project group and was developed as a part of my master thesis at the Budapest University of Technology and Economics,,1
777,https://github.com/HaosenHe/Econ-with-Mathematica.git,"Visualize and algebraically solve Economic problems with Wolfram Mathematica. For more interesting applications of Mathematica in Econ, visit:  https://demonstrations.wolfram.com/topic.html?topic=economics&limit=20",,1
778,https://github.com/akosdudas/Algoritmusok-Tobbmagos-Demo.git,This repository is for the students of the Budapest University of Technology and Economics taking the course Algorithms and Data Structures in Multi-core Environment,,1
779,https://github.com/nishchayp/data-structures.git," Contains my code submission for Data Structures course as offered by University of California, San Diego & National Research University Higher School of Economics on Coursera. ",,1
780,https://github.com/simonschoe/imbalanced-learning.git,"This workshop is part of the ""Machine Learning in R"" graduate course held at University of Münster, School of Business and Economics (winter term 2020/21). :mortar_board:","imbalanced-learning,workshop,machine-learning,sampling-methods",1
781,https://github.com/dlsouza42/Advanced-Machine-Learning-Specialization.git,I share here the tasks that I performed during the specialization offered by the National Research University Higher School of Economics,,1
782,https://github.com/IamRakibAhmed/Algorithmic-Toolbox.git,1st course of the Specializatiton course Data Structures and Algorithms offered by University of California San Diego & National Research University Higher School of Economics.,,1
783,https://github.com/epelaaez/AlgorithmicToolbox.git,Repository to store code for the Algorithmic Toolbox course by University of California in San Diego & National Research University Higher School of Economics.,,1
784,https://github.com/GITenberg/Historical-materialism-and-the-economics-of-Karl-Marx_39653.git,"Historical materialism and the economics of Karl Marx by Meredith, C. M. Croce, Benedetto\n is a Project Gutenberg book, now on Github.",,1
785,https://github.com/stathoula/Gelling-and-Melting-Large-Graphs-by-Edge-Manipulation.git,"Bonus assignment for the course **Algorithms and Data Structures** *Department of Management Science and Technology*, Athens University of Economics and Business.",,1
786,https://github.com/mca91/OekonThesisTemp.git,An RMarkdown template for seminar papers and degree theses supervised by chairs of the Faculty of Management and Economics @ University of Duisburg-Essen,,1
787,https://github.com/sghalebikesabi/Tag-Recommendation-in-StackOverflow.git,Project work submitted as part of the MSc Statistics course on Bayesian Machine Learning at the London School of Economics and Political Science,,1
788,https://github.com/ateniolatobi/Alogrithmic-Toolbox.git,Repository for my solutions to the Algorithmic-Toolbox course offered by the University of California San Diego and the National Research University Higher School of Economics through Coursera,,1
789,https://github.com/jaygkay/Academic-Projects.git,"{""Historical academic papers to obtain Bachelor's/Master's degrees in Mathematics Economics, and Data Science. Personal and group projects are included.""}",,1
790,https://github.com/rwv/sufe-wifi-connector.git,Shanghai University of Finance and Economics Wi-Fi connector 上海财经大学 Wi-Fi 自动登录,,1
791,https://github.com/dormeir999/Paper-Replication-Does-Price-Matter-in-Charitable-Giving-a-Large-Scale-Natural-Experiment.git,Paper Replication: Does Price  Matter in Charitable Giving? Evidence from a Large-Scale Natural Field Experiment https://economics.mit.edu/files/24,,1
792,https://github.com/zsmate13/info2-hazi.git,This repository is for a web application written as a homework for the course VIAUAB01 at Budapest University of Technology and Economics.,"php,html,database,css,javascript,sql",1
793,https://github.com/mathew-jose/Google-Earth-Engine-Project.git,"A Data Extraction, Analysis and a Project to find Spurious Correlation done as part of the Economics Course Using Google Earth Engine.",,1
794,https://github.com/nishchayp/algorithmic-toolbox.git,"Contains my code submission for Algorithmic Toolbox course as offered by University of California, San Diego & National Research University Higher School of Economics on Coursera.",,1
795,https://github.com/AashitaK/CGU-ML.git," The course material for the 14th August Guest Lecture session for the intensive 4-week machine learning course at Division of Politics and Economics, Claremont Graduate University (CGU) ",,1
796,https://github.com/AimVoma/NLP_Chatbot.git,"{""Chat-bot Project as a part of the Coursera hands-on 'Advanced Natural Language Processing' course offered by Moscow HSE University of Economics""}",,1
797,https://github.com/RebeccaMqamelo/Grassroots-Economics-Impact-Evaluation.git,"This is the final assignment for my Minerva CS112 course, ""Information Based Decisions"". I analyzed public data provided by Grassroots Economics, a community currency program in Kenya.",,1
798,https://github.com/svmiller/territorial-threats-corruption-attitudes.git,"Repository for ""External Territorial Threats and Tolerance of Corruption: A Private/Government Distinction"", forthcoming at Peace Economics, Peace Science and Public Policy",,1
799,https://github.com/csp98/image-recognition.git,"Image Recognition Neural Net developed for the ""Media Informatics Systems"" subject at Budapest University of Technology and Economics (BME). 2018/2019-1",,1
800,https://github.com/storyofcoder/book-store.git,"{""A online book store offers you millions of titles across categories like Children's Books, Free eBooks, Audiobooks, Business & Economics, and Literature""}",,1
801,https://github.com/SFG-UCSB/The-economics-of-fishing-the-high-seas.git,"This repo contains code, analyses, and data for the paper: The Economics of Fishing the High Seas by Sala et al, 2018 ",,1
802,https://github.com/doctor-phil/XSFS_Scripts.git,Generates a series of scripts for streamlining the interface between our local ztree-unleashed VM and the FSU Economics XSFS server,,1
803,https://github.com/maliars/GSSA.git,"The folder “GSSA_Two_Models” contains MATLAB software for generalized  stochastic-simulation algorithm (GSSA) accompanying the article ""Numerically  Stable and Accurate Stochastic Simulation Approaches for Solving Dynamic  Economic Models"" by Kenneth L. Judd, Lilia Maliar and Serguei Maliar,  published in Quantitative Economics (2011), 2/2, 173–210.  ",,1
804,https://github.com/velkokamenov/World-Bank-Maps-Application-in-R.git,"R Shiny Application allowing eurostat data plotting on number of topics such as Economics, Finance, Education and Technology. The application is devoped leveraging on the R Shiny framework as well as the wbstats package developed by Jesse Piburn. The latest version of the package is available here https://cran.r-project.org/web/packages/wbstats/index.html",,1
805,https://github.com/SebastienML/loan-simulator.git,This project is a loan simulator. You can easily see with charts your evolution during years and the fee of the Bank. depending on the percentage of the loan. All the project is based on the french Economics of 2017.,,1
806,https://github.com/gchoumos/research-paper-classifier.git,"Implementation of a Machine Learning project in the context of the ""Data Science Challenge"" course. This course is part of the Master\'s Degree in Data Science of the Athens University of Economics and Business.",,1
807,https://github.com/MichaelBeeli/National_Deworming_Day_Thesis.git,"Code, figures, and tables for my Senior Thesis in Economics: ""How can National Programs and Robust State Capacity Neutralize Infectious Health Risks? Quasi-experimental Evidence from India’s NationalDeworming Day""",,1
808,https://github.com/megagreg72/2015_vanderbilt_cs396_planar_SPE.git,"An independant research project I did for the course cs396 ""Computational Economics"".  The work was later improved upon (with co-authors) and resulted in the paper ""Security Games on a Plane"", which can be read at http://www.briangauch.com/",,1
809,https://github.com/ahammer3/NRUHSE-AdvancedMachineLearning.git,These are a series of 7 courses on advanced machine learning techniques by the National Research University Higher School of Economics. I have included python jupyter notebook assignments for future use and reference.,,1
810,https://github.com/AndreaVisma/Economics_Dissertation_2020.git,"{""This repository contains all the materials needed to replicate my Economics Dissertation, plus a couple of additional tables that didn't find space in the final version of the dissertation.""}",,1
811,https://github.com/konkyrkos/sentiment-classifier-classic-algorithms.git,Tweet Sentiment Classifier using Classic Machine Learning Algorithms. This repository provides my solution for the 2nd Assignment for the course of Text Analytics for the MSc in Data Science at Athens University of Economics and Business.,"sentiment-classifier,classifier-metrics-precision,f1-scores,recall,probabilistic-classifiers,dummyclassfier,sgd,logistic-regression,random-forest,multinomial-naive-bayes,metrics,statistical-significance-test,learning-curve,statistics,python,sklearn",1
812,https://github.com/ali-wetrill/DistributionalNationalAccounts-Pakistan.git,"Economics honors thesis linking tax, survey and national accounts data to estimate income inequality in Pakistan. To my knowledge, this is the first paper that recreates income distribution in Pakistan since Haq (1964). Advised by Gabriel Zucman.","inequality,income-inequality,distributional-national-accounts,world-inequality-database",1
813,https://github.com/ifferent/study_on_the_trade_cycle_of_real_estate_in_taiwan-demo_result.git,"This is the Master thesis research result in department of economics, NTU. The result is using the R to analyze and shiny to package it.This code could demo about the Spectral analysis, choherence and any about frequency domain analysis. ",,1
814,https://github.com/SolB77/Managerial-Economics-Senior-Thesis.git,"Researched the quantitative effect the introduction of sharing economy firms (Uber, Grubhub, Airbnb etc.) has had on the financial performance of closely related incumbent firms for my managerial economics senior thesis",,1
815,https://github.com/mkochanowski/hackathon-uek-platforma-frontend.git,An online platform developed at UEK Hack Cup designed for students and faculty staff of Cracow University of Economics.  Allows for distribution of important messages targeted to specific groups tied to different channels selected by the user.,,1
816,https://github.com/insight-decentralized-consensus-lab/Insight-Modular-Consensus.git,"Deconvolute the separate components of decentralized consensus networks (cryptoeconomics, consensus mechanism, communication layer, etc) and create a hyper-modular sandbox for easy R&D (e.g. $ start-sandbox --consensus=./ProofOfStake.mech --economics=./smooth_decay.curve)",,1
817,https://github.com/denis-mironov/coursera-algorithmic-toolbox-course.git,"By University of California San Diego & National Research University Higher School of Economics. Basic algorithmic techniques and ideas for computational problems arising frequently in practical applications: sorting and searching, divide and conquer, greedy algorithms, dynamic programming.",,1
818,https://github.com/lukw34/Mutu.git,It is simple web aplication. The main purpose of this aplications is picking up opinions about lectures in University of Economics. I used framework like Node.js and Angular.js also i used angular-fullstack,,1
819,https://github.com/bryanparthum/WTV_stormwater.git,"This repository is for all data and code from ""Willingness-to-Volunteer and Stability of Preferences Between Cities: Estimating the Benefits of Stormwater Management"". 2019. Journal of Environmental Economics and Management.",,1
820,https://github.com/thinkingTEA/repoTEA.git,"This repository contains the group projects undertaken during the course ""Text Engineering and Analytics"" taught by Prof. Ion Androutsopoulos in the context of Msc. in Data Science at Athens University of Economics and Business.","jupyter-notebook,text-engineering,text-analytics,neural-networks,text-classification,pos-tagging,ngram-language-model,kneser-ney-smoothing,python,keras-neural-networks",1
821,https://github.com/nschaefer1211/Hot-Hand.git,"This repository provides my Bachelor Thesis in Economics including the supplement material (R code etc.). The thesis is about momentum in binary data sequences, and more specifically about the hot-hand phenomenon in basketball. ",,1
822,https://github.com/elasanchez/depreciation-engineering-econ-scripts.git,"I created these scripts to double check my engineering economics homework on four standard depreciation methods, Straight-Line, Sum-Of-Years-Digit (SOYD),  Double Declining Balance (DDB), and Modified Accelerated Cost Recovery System (MACRS) for Non-residential property.",,1
823,https://github.com/petedodd/dtree.git,"Simple R package for specifying decision tree models in health economics via a version of the DOT language, including utilities for visualisation and applying model to arbitrary PSA data.",,1
824,https://github.com/KareemErgawy-TomTom/ibn-khaldun.git,A library of compiler optimization algorithms. This is a project in which I learn about and practice writing optimizing compilers. Ibn-Khaldun is a famous Muslim scholar with significant contributions to economics.,"compiler,optimization,control-flow-analysis",1
825,https://github.com/dcuoliveira/FGV_Financial_Econometrics.git,This repository will be used to organize all the codes and notes written on the Financial econometrics course given at the school of economics at FGV-SP on 2020 by prof. Pedro Valls.,"eesp-fgv,econometrics,lecture-notes,finance,homework",1
826,https://github.com/NDelventhal/hu_wiwi_grades.git,"{""hu_wiwi_grades is a Python library for searching, viewing and scraping published students' grading of the Faculty of Economics and Business Administration of the Humboldt University of Berlin""}","humboldt-university,grades,grading,grading-data",1
827,https://github.com/UPstartDeveloper/adam-smith-tweet-generator.git,"A TweetBot for Adam Smith, the father of capitalism and one of the most contentious intellectual figures of classical economics. Created using a 7th order Markov Chain, originally inspired by the CS 1.2 class at Make School.",,1
828,https://github.com/errabundo/trump-low-pump-.git,"In this project, I would try to predict USA elections 2020. I chose as approach a political economics issue: how the incumbent candidate would try to keep a low gas price at the stations.  ",,1
829,https://github.com/ReduxPeter/bio.git,"23. Los Angeles born & raised. Double major in Economics and Television Production from California State University Northridge, graduated in 2020, then moved to Cleveland to co-develop Ugly Box AI in partnership with Soltys Cameras.  ",,1
830,https://github.com/AnOnYmOus001100/Algorithmic-Toolbox.git,This contains of all the assignments and programs realted to the Coursera course Algorithmic Toolbox under the Specializtion Data Structures and Algorithms provided by National Research University Higher School of Economics,,1
831,https://github.com/JackDunne5877/CompEconTermProject.git,This codebase is a term project for a computational economics course. We built a model to simulate social media interactions to better understand the influence it has on our political landscape. Attached to this repository is a pdf of our findings.,,1
832,https://github.com/chnaveen138/Divide-and-Conquer-Algorithms-Implementation-and-case-studies.git,This repository contains java code of divide and conquer algorithms. The topics and questions are taken from Data Structures and Algorithms Specialization offered by UNIVERSITY OF CALIFORNIA SAN DIEGO NATIONAL RESEARCH UNIVERSITY HIGHER SCHOOL OF ECONOMICS. This repository is only for reference purpose and coursera is strict about honor code.,,1
833,https://github.com/Heicyberg/Ecosum.git,"{""This is a project will scrape news from economics of the Bloomberg, give users's choice to save the articles they are interested in, with the notes they took. The clean sites with free adds will keep users form being distracted.""}",,1
834,https://github.com/ysh329/wordsDB.git,"As the march of project Chinese-word-segmentation, I found that I should create and sustain a words database first. In this projec, mainly concentrating on the general words (come from modern Chinese dictionary, which as the first part) and professional words about financial, stock, fund and economics aspects.",,1
835,https://github.com/Minoritier/Paper-Replication.git,"The code replication (maybe not so graceful...) of analysis process and results in working paper “Fischer, T. , & Krauss, C. . (2017). Deep learning with long short-term memory networks for financial market predictions. Fau Discussion Papers in Economics, 270(2).” in Jupyter Notebook using Python",,1
836,https://github.com/ValentinDonchev/GunViolence.git,This is my Economics Departmental Honors project that I am working on at college. I am looking at the influence socioeconomic factors and gun laws have on the frequency of gun violence in America on a state-wide basis from 2010-2018. ,,1
837,https://github.com/beam-ntth/Trading-Economics-Analyzer.git,"Web application uses Numpy and Matplotlib to parsed data from the API, calculate, and plot graphs for different indicators and countries provided by Trading Economics. The user can do simple analytics to see the similarities and differences in GDP for their selected countries",,1
838,https://github.com/chnaveen138/Data-structures-and-algorithms-specialization---Greedy-algorithms-solutions-implementation.git,This repository contains java code of Greedy algorithms solutions implementation. The topics and questions are taken from Data Structures and Algorithms Specialization offered by UNIVERSITY OF CALIFORNIA SAN DIEGO NATIONAL RESEARCH UNIVERSITY HIGHER SCHOOL OF ECONOMICS. This repository is only for reference purpose and coursera is strict about honor code.,,1
839,https://github.com/Nithyashree-2022/Economics-notes.git,"Some basic and common Economics notes that I used for my end exam.These notes can extremely help candidates save their valuable time and prepare smartly for their tests without having to read any textbook much.Besides,these notes have been prepared using Gregory Mankiw Textbook for reference.",,1
840,https://github.com/chnaveen138/Coursera-Data-Strucures-and-Algorithms-Specialization.git,The topics and questions are taken from Data Structures and Algorithms Specialization offered by UNIVERSITY OF CALIFORNIA SAN DIEGO NATIONAL RESEARCH UNIVERSITY HIGHER SCHOOL OF ECONOMICS. This repository contains implementation solutions of programming assignments of this specialization. This repository is only for reference purpose and coursera is strict about honor code.,,1
841,https://github.com/Camilamila/Capstone-project.git,"Code used for the dissertation ""Who won the contract?  An analysis of bidder networks and collusion in public procurement"" .  A dissertation submitted to the Department of Methodology of the London School of Economics and Political Science for the degree MSc Applied Social Data Science",,1
842,https://github.com/manjunath5496/21-Most-Influential-Economic-Papers-Of-All-Time.git,"""One of the Great Rules of Economics According to John Green If you are rich, you have to be an idiot not to stay rich. And if you are poor, you have to be really smart to get rich."" ― John Green",,1
843,https://github.com/Mtriady/Mouthews.git,"Mouthnews Times:is a leading source of news, entertainment, movies, television, music, politics, business, health, technology, travel, sports, environment, economics, autos, jobs, real estate and other topics affecting, Leading source for news, video and opinion on politics, business, world and national news, science, travel, entertainment and more. Our local coverage includes reporting on education, crime, weather, traffic, real estate, jobs and cars. Offering award-winning opinion writing, entertainment information and restaurant reviews. Mouthnews, latest breaking news around the world.",,1
844,https://github.com/chalg/EDA-ARRD.git,"The Australian Road Deaths Database (ARDD) is maintained and published by the Bureau of Infrastructure, Transport and Regional Economics (BITRE). It commenced in 1989 and is updated on a monthly basis. The ARDD contains basic demographic and crash details of people who have died in an Australian road crash. Every fatal road traffic crash in Australia is in scope, and information is included for all people who were killed.",,1
845,https://github.com/snissn/FuelToken.git,"Fuel token is an experimental token that rewards hash power to miner of the block chain proportional to the difficulty of the block. This is interesting, especially with ASIC compatible hashing functions as the difficulty is proportional to the number of hashes that went into finding a block, and the number of hashes is proportional to the energy spent by the miner with their devices. Each token thereby is proportional to energy and money spent into acquiring the token. This has much different economics from the main token reward for securing the block chain which stays constant as the difficulty of the network increases. ",,1
846,https://github.com/VJ-P/EasyDocs--DeltaHacks5.git,"{""Doctors listed the burden of paperwork as their top concern in the Medical Economics 89th Annual Physician Report (Dahl, 2018). We aim to drastically reduce the burden medical facilities face, by providing an automated solution to create and update patient records.. EasyDocs reduces the time clinicians spend on paperwork by automatically providing them with up to date electronic patient information. This helps doctors learn of their patients' health condition and risks more efficiently, allowing for more time with patients and less time with paper.""}",,1
847,https://github.com/Davidglezc/World-Happiness-Score.git,"The World Happiness Report is a landmark survey on the state of global happiness. The first report was published in 2012, the second in 2013, the third in 2015, and the fourth in the 2016 update. The World Happiness 2017, which ranks 155 countries according to their levels of happiness, was launched at the United Nations in a event that celebrates the international day of happiness on March 20. The report continues to gain global recognition as happiness indicators are increasingly used by governments, organizations, and civil society to inform their policy-making decisions. Leading experts in all fields - economics, psychology, survey analysis, national statistics, health, public policy, and more - describe how measures of well-being can be used effectively to assess the progress of nations.",world-happiness-report,1
