,Url,Description,Topics,Stars
0,https://github.com/lbryio/lbry-sdk.git,"The LBRY SDK for building decentralized, censorship resistant, monetized, digital content apps.","lbry,blockchain,python,decentralized,bittorrent,cryptocurrency,protocol,bitcoin,p2p,dht,kademlia",7161
0,https://github.com/mayeaux/nodetube.git,"Open-source YouTube alternative that offers video, audio and image uploads, livestreaming and built-in monetization","youtube,alternative,video-streaming,audio-streaming,image-hosting,livestreaming,monetization",1979
0,https://github.com/madawei2699/awesome-seo.git,Google SEO Research and Web Traffic Monetization,"seo,google,awesome-list,awesome,search-engine,optimization,collections,tips,marketing,best-practices,semrush,moz-seo,ahrefs-seo,google-seo,seo-twitter,search-engine-optimization",1114
0,https://github.com/saasify-sh/saasify.git,The easiest way to monetize your API. 🚀,"saas,apis,saas-api,monetization,oss,funding,passive-income,serverless,faas,faas-platform",946
0,https://github.com/floatinghotpot/cordova-admob-pro.git,":fire: Cordova Plugin for Google AdMob, DFP, ADX. Easy monetization using mobile Ad, with single line of JavaScript. Compatible with Cordova CLI, Inoic, PhoneGap Build, etc.","cordova,admob,monetization,cordova-plugin,google-admob,admob-plugin,ionic,phonegap,doubleclick",690
0,https://github.com/AudiusProject/audius-protocol.git,"Audius gives everyone the freedom to share, monetize, and listen to any audio content.",,251
0,https://github.com/WICG/webmonetization.git,Proposed Web Monetization standard,,233
0,https://github.com/floatinghotpot/coding-to-monetization.git,"{"":book: From Coding to Monetization：Programmer's Financial Freedom Approach""}","admob,cordova,javascript,monetization,book",154
0,https://github.com/thomasbnt/awesome-web-monetization.git,"🕶️ Stuffs about Web Monetization. Packages, articles, documentation links and others tools.","web-monetization,monetization,webmonetization,coil,javascript,ilp,ilp-payment,awesome-list,awesome,gatehub,stronghold,hacktoberfest",153
0,https://github.com/Apress/monetizing-machine-learning.git,"{""Source code for 'Monetizing Machine Learning' by Manuel Amunategui and Mehdi Roopaei ""}",,112
0,https://github.com/philippgille/ln-paywall.git,Go middleware for monetizing your API on a per-request basis with Bitcoin and Lightning ⚡️,"go,golang,middleware,micropayments,pay-per-call,api,bitcoin,lightning,paywall,web-service,lnd",110
0,https://github.com/remp2020/remp.git,"{""REMP - Reader's engagement and monetization platform. Set of open-source tools for publishers to engage with their audience. Repository is public mirror of our internal private repo.""}",,106
0,https://github.com/admob-google/admob-cordova.git,"Google AdMob plugin for Cordova, Phonegap and Intel XDK ,support ios and android,support admob v1 and admob v2 ,Monetize your html5 app with one javascript line.api is easy to use.",,63
0,https://github.com/swisscodemonkeys/appbrain-sdk.git,AppBrain SDK to monetize Android apps,"sdk,interstitials,appbrain-sdk,java,unity,android,promotion,monetization,appbrain",47
0,https://github.com/coilhq/web-monetization-projects.git,"{""Coil projects that use Web Monetization. Primarily Coil's browser extension and related WM polyfills.""}",,41
0,https://github.com/sabinebertram/hugo-webmonetization-component.git,Hugo theme component that enables web monetization and exclusive content,,35
0,https://github.com/FIWARE-TMForum/Business-API-Ecosystem.git,"The FIWARE/TMForum Business API Ecosystem allows the monetization of different kind of assets (both digital and physical) during the whole service life cycle, from offering creation to its charging, accounting and revenue settlement and sharing","fiware,tmforum,monetization",30
0,https://github.com/simondlr/mememarkets.git,A protocol for the decentralized monetization of *all* information (memes) and its network effects.,,29
0,https://github.com/guidovizoso/react-monetize.git,Helpers and hooks to speed up your integration with Web Monetization API,,26
0,https://github.com/dsound/dsound.git,DSound is a decentralized sound publishing and monetization platform based on Blockchain and IPFS technology,,25
0,https://github.com/kartben/iota-mosquitto-demo.git,A simple demonstration of using IOTA as a way to monetize an MQTT data stream,"iota,iot,javascript,mqtt,mosquitto-mqtt-broker",24
0,https://github.com/Radiomyme/Radio-Play-for-iOS-and-tvOS.git,"Radio Play is the ultimate app for your Radio Station ! Compatible from iOS 9 to iOS 13, it includes the best features for your iPhone, iPad or iPod. Easy to customize, monetization with ads, powerful by adding unlimited number of stations, useful when displaying Artist, Name and Album Cover while playing… Radio Play for iOS is for you !  Best of all, Radio Play now includes all the files to build your application for tvOS. Compatible with tvOS 9 and higher, it includes all the features of TVML (Remote controlled app via a server), with easy customization, player, single or multiple stations, slides, logo… Radio Play for tvOS is for you !",,24
0,https://github.com/flattr/flattr-extension.git,Flattr web extension - monetize your content effortlessly.,"flattr,monetization,javascript,firefox,google-chrome",23
0,https://github.com/wobsoriano/svelte-monetization.git,A minimal and lightweight wrapper for the Web Monetization API,"svelte,web-monetization,hacktoberfest,hacktoberfest2020",21
0,https://github.com/oss-fund/monetization-platforms.git,Crowdsourced list of monetization platforms for creators,"bounties,donations,crowdfunding,paywall,grants,advertising,subscription",19
0,https://github.com/sharafian/react-web-monetization.git,React component that lets you access the state of Web Monetization,,19
0,https://github.com/conwetlab/wstore.git,"WStore provides functionality for the monetization of different kind of digital assets, including the management of assets and offerings as well as support for acquisitions, charging, billing, and accounting of pay-per-use services.",,19
0,https://github.com/sharafian/web-monetization-access.git,Serve exclusive content securely with web monetization,,17
0,https://github.com/Futurewei-io/blue-marlin.git,Blue Marlin is a critical web infrastructure for advertising based monetization. It is a cloud platform that adds intelligence to a plain Ad System.,,17
0,https://github.com/adrianhopebailie/web-monetization.git,Web Monetization Explainer and Specification for submission to the WICG,,17
0,https://github.com/esse-dev/akita.git,A browser extension that gives you insight into your engagement with Web Monetization.,"web-monetization,webmonetization,interledger,interledger-protocol,monetization",17
0,https://github.com/sidtechnical/hakuna-metadata-1.git,Browsing  metadata visualization tool: Explore how ISPs can see and monetize your browsing history.,"firefox,python,linux,browser-history,visualization",17
0,https://github.com/codius/codius-faas.git,Web monetized OpenFaaS Cloud,,16
0,https://github.com/interledgerjs/web-monetization-scripts.git,Scripts to help you web monetize your site and/or API,,15
0,https://github.com/digicrafts/MoPub-ANE.git,This Mopub ANE add supprt to using MoPub Mobile monetization platform with Adobe Air. Supports Android and iOS.,,14
0,https://github.com/understory-garden/understory.garden.git,"{""Understory is a digital garden, a micro-publishing space for you to plant the seeds of your ideas and grow them into bi-directionally linked web portals. It's a social zettelkasten that lets users use Web Monetization to get paid when people spend time with their content.""}","zettelkasten,digital-garden,pod,understory,solid",14
0,https://github.com/TheRoccoB/web-monetization-unity-webgl.git,Unity WebGL Asset for the Web Monetization API,,13
0,https://github.com/ownership-labs/DataToken.git,Decentralized access control for off-chain data sharing and monetization,"blockchain-technology,distributed-tracing,asset-management,data-exchange,cryptocurrency,decentralized,data-unions",13
0,https://github.com/signalnerve/openmonetizationwallet.git,👛 Tools for managing a vanity Web Monetization wallet,,12
0,https://github.com/sunchayn/monetize.js.git,An event-driven library to manage and simulate Web Monetization.,"monetization,web-monetization,event-driven,simulation,web-monetization-simulator",12
0,https://github.com/apigee/apigee-m10n-drupal.git,Add monetization features to a Drupal developer portal,"drupal-8,drupal,drupal-9",11
0,https://github.com/worldwide-asset-exchange/defi.git,WAX has created a new tokenomic model that marries the explosive growth of NFTs with the superior monetization capabilities of DeFi. The core element of the new WAX tokenomics system is its inter-blockchain design,,11
0,https://github.com/photonstorm/gamewebmonetization.git,"An easy-to-use Web Monetization Plugin for HTML5 game frameworks, including Phaser and Pixi.","canvas,webgl,webgl-game,phaser,pixi,html5,game-development,monetization,webmonetization",11
0,https://github.com/mikesson/apigee-mint-node.git,Node.js tool for Apigee Monetization,,10
0,https://github.com/cosmicjs/bitblog.git,Monetize your content with crowd-sourced cryptocurrency mining. Think of it as an alternative to advertising.,,10
0,https://github.com/michael1011/lncall.git,Monetize your API with LND,"lightning,lightning-network,lnd,bitcoin,node-js,node-module,javascript",10
0,https://github.com/DanCanetti/eleventy-plugin-monetization.git,An Eleventy plugin to monetize posts and site content,,10
0,https://github.com/android-bash/AndroidBash-FirebaseAdmob.git,"{""Admob is the #1 mobile advertising platform to grow your app business and is powered by Google’s ad technology. You can integrate AdMob in your android application and start earning right away. The best way to use AdMob is with Firebase, though Google Mobile Ads SDK remains available as a standalone SDK which can also be used to integrate Admob with your android application. Admob publishers can start taking advantage of Firebase's free and unlimited analytics solution to monetize more intelligently, just by linking with Firebase and importing the Firebase SDK into your android application. In this tutorial we will be showing how to integrate Admob with your android application using Firebase.  <p>Now let us create an android application on which we can integrate Firebase Admob to display Banner ads, Interstitial ads and Native Ads.</p> 1. We will display a <strong>Banner ad</strong> at the bottom of the activity. 2. We will display an <strong>Interstitial ad</strong> covering the whole screen, once the user clicks on an item in the list of movies. 3. We will display <strong>Native ads</strong> in between the list of movies displayed in a RecyclerView. The steps will be described in five detailed yet simple parts.""}",,10
0,https://github.com/Sergix/gridsome-plugin-monetization.git,Web monetization for Gridsome.,,9
0,https://github.com/interledgerjs/web-monetization-receiver.git,Server-side library for advanced Web Monetization functionality,,9
0,https://github.com/interledgerjs/koa-web-monetization.git,Charge for content and endpoints server-side with web monetization,,9
0,https://github.com/appsfire/Appsfire-iOS-SDK.git,The Appsfire SDK for iOS enables you to natively monetize your application and engage with your users.,,9
0,https://github.com/VerizonAdPlatforms/VerizonVideoPartnerSDK-iOS.git,The Verizon Video Partner SDK (formerly named Oath Video Partner SDK) is a native iOS SDK that makes it easy to play and monetize videos from the Verizon/Oath Video Partner network on iOS-based platforms.,,9
0,https://github.com/philnash/web-monetization-components.git,A collection of web components you can use on your web monetized websites.,,8
0,https://github.com/coilhq/coil-wordpress-plugin.git,"{""Coil's Wordpress Web Monetization Plugin""}",,7
0,https://github.com/TumblrCode/CemeteryMania.git,Night of the Monetization of the Dead,,7
0,https://github.com/OfficeDev/office-add-in-saas-monetization-sample.git,Monetize your Office 365 add-in through Microsoft Commercial Marketplace,,7
0,https://github.com/maxrossi/Monetization-Framework.git,iOS Monetization Framework in Swift,,7
0,https://github.com/TicTacTi/HTML5-Ads-Engine-SDK.git,"Cross platform monetization – Desktop, IOS, ANDROID, WIN8. Supports video, interactive ad formats and standard IAB. Yield optimization. Suites any type of HTML5 App.",,7
0,https://github.com/InMobi/api-monetization.git,This library project can be used for making API 2.0 calls to InMobi servers to fetch ads for monetization purpose,,7
0,https://github.com/michaelfolkson/bcoin-hackathon.git,Bcoin Hackathon Project - Monetizing Full Nodes,,7
0,https://github.com/dtinth/monetizer.git,A monetization meta tag manager.,,7
0,https://github.com/DLTcollab/data-marketplace.git,Decentralized Data Marketplace and Monetization,"decentralized-applications,iot,sensor-data,iota,tangle,tangleid,solidity-contracts",7
0,https://github.com/harshitgindra/Xamarin.AdmobExample.git,"{""This project showcases how to use Google's Admob for monetizing your Xamarin Forms mobile app""}",,7
0,https://github.com/spekulatius/vuepress-plugin-web-monetization.git,Adds the web-monetization metatag to your VuePress website,"vuepress,vuepress-plugin,web-monetization,monetization,webmonetization",7
0,https://github.com/VladimirMikulic/tessy.git,🧪 Advanced Web Monetization testing library with powerful declarative API.,"library,testing-library,webmonetization,cypress,selenium,puppeteer",7
0,https://github.com/sayzlim/revenue.js.git,Revenue.js is an open source script based on BuySellAds Monetization API that helps creators make money through relevant and beautiful ads.,"ads,javascript",7
0,https://github.com/khaled-mahmud/Unity-Project-Dungeon-Escape.git,This is a Unity project for Android Build including monetization with Unity Ads feature according to the tutorial Jonathan Weinberger which is authorized by Unity Technologies on Udemy.,"game,game-development,unity3d,2d-game,game-engine,gamedev,unity-game,csharp,csharp-code,android,android-game,android-sdk",6
0,https://github.com/solid/webmonetization.git,Discussions about Solid + Web Monetization,,6
0,https://github.com/dpgailey/radbots-botpress-monetization.git,Monetization plugin for botpress (powered by RadBots),"botpress,bots,botkit",6
0,https://github.com/interledgerjs/ilp-wm-provider.git,Personal Web Monetization provider using Moneyd,,6
0,https://github.com/RueNetwork/RueClient.git,"The RueClient is part of the Rue Network\'s ""Rue Framework"" project allowing users to build Ethereum dApps using WordPress in a private and decentralized way while connecting to the Rue Network to empower low cost transactions, identity management and monetization.",,6
0,https://github.com/myorca-io/Honest_Data_Market.git,"ORCA is a personal finance management tool which offers users the ability to securely aggregate their banking and cryptocurrency information. This aggregated data is used to present insights into the user’s financial life, helping them make better decisions and even profit from monetizing their data. ",,6
