,Url,Description,Topics,Stars
0,https://github.com/apache/spark.git,Apache Spark - A unified analytics engine for large-scale data processing,"python,scala,r,java,big-data,jdbc,sql,spark",29611
1,https://github.com/metabase/metabase.git,"The simplest, fastest way to get business intelligence and analytics  to everyone in your company :yum:","analytics,businessintelligence,dashboard,reporting,slack,clojure,database,metabase,postgres,postgresql,mysql,bi,visualization,data,data-analysis,sql-editor,data-visualization,business-intelligence",24759
2,https://github.com/influxdata/influxdb.git,"Scalable datastore for metrics, events, and real-time analytics","influxdb,monitoring,database,time-series,metrics,go,react",21405
3,https://github.com/osquery/osquery.git,"SQL powered operating system instrumentation, monitoring, and analytics.","security,monitoring,intrusion-detection,sql,hacktoberfest",17901
4,https://github.com/ClickHouse/ClickHouse.git,ClickHouseÂ® is a free analytics DBMS for big data,"dbms,olap,analytics,sql,distributed-database,big-data,mpp,clickhouse,hacktoberfest",15834
5,https://github.com/matomo-org/matomo.git,Liberating Web Analytics. Star us on Github? +1. Matomo is the leading open alternative to Google Analytics that gives you full control over your data. Matomo lets you easily collect data from websites & apps and visualise this data and extract insights. Privacy is built-in. We love Pull Requests! ,"analytics,php,piwik,log,website,privacy,mobile,intranet,web-analytics,marketing,growth,matomo,mysql,hacktoberfest,security",14906
6,https://github.com/plotly/dash.git,"Analytical Web Apps for Python, R, Julia, and Jupyter. No JavaScript Required.","dash,plotly,data-visualization,data-science,gui-framework,flask,react,python,finance,bioinformatics,technical-computing,charting,plotly-dash,web-app,productivity,modeling,r,rstats,jupyter,julia",14466
7,https://github.com/apache/druid.git,Apache Druid: a high performance real-time analytics database.,druid,10822
8,https://github.com/cube-js/cube.js.git,ðŸ“Š Cube.js â€” Open-Source Analytical API Platform,"chart,analytics,serverless,microservice,javascript,cube,postgresql,mysql,athena,nodejs,hive,presto,spark,bigquery",10345
9,https://github.com/vuestorefront/vue-storefront.git,"The open-source frontend for any eCommerce. Built with a PWA and headless approach, using a modern JS stack. We have custom integrations with Magento, commercetools, Shopware and Shopify and total coverage is just a matter of time. The API approach also allows you to merge VSF with any third-party tool like CMS, payment gateways or analytics. Newest updates: https://blog.vuestorefront.io. Always Open Source, MIT license.","vue-storefront,pwa,headless,vue,ecommerce,magento,storefront,mobile,e-commerce,nuxt,magento2,shopware,shopify,commercetools,vue3,open-source,typescript,hacktoberfest,headless-commerce,ecommerce-platform",8475
10,https://github.com/apache/arrow.git,"Apache Arrow is a cross-language development platform for in-memory data. It specifies a standardized language-independent columnar memory format for flat and hierarchical data, organized for efficient analytic operations on modern hardware. It also provides computational libraries and zero-copy streaming messaging and interprocess communication. Languages currently supported include C, C++, Java, JavaScript, Python, and Ruby.",arrow,7876
11,https://github.com/plausible/analytics.git,"Simple, open-source, lightweight (< 1 KB) and privacy-friendly web analytics alternative to Google Analytics.","analytics,privacy,elixir,phoenix,postgresql,tailwindcss,clickhouse,plausible-analytics,google-analytics,web-analytics,website-stats,cloud,charts,statistics,metrics,website-analytics,website,marketing",7641
12,https://github.com/usefathom/fathom.git,"Fathom Lite. Simple, privacy-focused website analytics. Built with Golang & Preact.","website-analytics,analytics,metrics,privacy,fathom,google-analytics,fathom-dashboard,fathom-analytics",6872
13,https://github.com/mikecao/umami.git,"Umami is a simple, fast, website analytics alternative to Google Analytics.","analytics,charts,statistics,google-analytics,web-analytics",6814
14,https://github.com/apache/zeppelin.git,"Web-based notebook that enables data-driven, interactive data analytics and collaborative documents with SQL, Scala and more.","scala,java,big-data,zeppelin,javascript,spark,flink,database,nosql",5244
15,https://github.com/Alluxio/alluxio.git,"Alluxio, data orchestration for analytics and machine learning in the cloud","alluxio,memory-speed,hadoop,spark,presto,tensorflow,data-analysis,data-orchestration,virtual-distributed-filesystem",5077
16,https://github.com/googleanalytics/autotrack.git,Automatic and enhanced Google Analytics tracking for common user interactions on the web.,,4826
17,https://github.com/statping/statping.git,"Status Page for monitoring your websites and applications with beautiful graphs, analytics, and plugins. Run on any type of environment.","statuspage,status-page,website-monitor,uptime,monitoring,prometheus,application-monitoring,server-monitor,docker,golang-plugin,prometheus-exporter,notifier,statping",4736
18,https://github.com/segmentio/analytics.js.git,The hassle-free way to integrate analytics into any web application.,,4660
19,https://github.com/greenplum-db/gpdb.git,"Greenplum Database - Massively Parallel PostgreSQL for Analytics. An open-source massively parallel data platform for analytics, machine learning and AI.","greenplum-database,gpdb,mpp,postgresql,data-warehouse,database,htap,analytics",4514
20,https://github.com/react-ga/react-ga.git,React Google Analytics Module,"react,google-analytics,react-google-analytics,javascript",4469
21,https://github.com/PostHog/posthog.git,"ðŸ¦” PostHog is developer-friendly, open-source product analytics.","analytics,python,docker,django,react,dashboards,heroku,postgres",4089
22,https://github.com/youtube/api-samples.git,"Code samples for YouTube APIs, including the YouTube Data API, YouTube Analytics API, and YouTube Live Streaming API. The repo contains language-specific directories that contain the samples.",,3862
23,https://github.com/quantopian/pyfolio.git,Portfolio and risk analytics in Python,,3749
24,https://github.com/igrigorik/ga-beacon.git,Google Analytics collector-as-a-service (using GA measurement protocol).,,3470
25,https://github.com/ankane/ahoy.git,"Simple, powerful, first-party analytics for Rails","analytics,first-party-analytics,rails,visits,events",3323
26,https://github.com/dagster-io/dagster.git,"A data orchestrator for machine learning, analytics, and ETL.","data-pipelines,dagster,workflow,data-science,workflow-automation,python,scheduler,data-orchestrator,etl,analytics",3217
27,https://github.com/mnutt/hummingbird.git,Real time web analytics using node.js and web sockets,,2956
28,https://github.com/uber/aresdb.git,A GPU-powered real-time analytics storage and query engine. ,"analytics,data,real-time,gpu-programming,database,storage,cuda,golang,query,cgo",2743
29,https://github.com/PMSI-AlignAlytics/dimple.git,An object-oriented API for business analytics,,2724
30,https://github.com/weld-project/weld.git,High-performance runtime for data analytics applications,"stanford,data,analytics,machine-learning,code-generation,performance,rust,llvm,pandas",2587
31,https://github.com/electerious/Ackee.git,"Self-hosted, Node.js based analytics tool for those who care about privacy.","website-analytics,analytics,google-analytics,privacy",2540
32,https://github.com/spatie/laravel-analytics.git,A Laravel package to retrieve pageviews and other data from Google Analytics,"laravel,php,analytics,google,statistics",2459
33,https://github.com/0xnr/awesome-analytics.git,"A curated list of analytics frameworks, software and other tools.",,2371
34,https://github.com/yyx990803/build-your-own-mint.git,"Build your own personal finance analytics using Plaid, Google Sheets and CircleCI.",,2306
35,https://github.com/robcowart/elastiflow.git,"Network flow analytics (Netflow, sFlow and IPFIX) with the Elastic Stack","netflow,ipfix,sflow,elasticsearch,logstash,kibana,elk",2197
36,https://github.com/zgoat/goatcounter.git,Easy web analytics. No tracking of personal data.,"go,analytics,golang",1987
37,https://github.com/angulartics/angulartics.git,Analytics for AngularJS applications.,"angular,analytics,google-analytics,pageview-tracking,event-tracking",1969
38,https://github.com/orta/ARAnalytics.git,Simplify your iOS/Mac analytics,,1835
39,https://github.com/elastic/elasticsearch-hadoop.git, :elephant: Elasticsearch real-time search and analytics natively integrated with Hadoop,,1814
40,https://github.com/MatteoGabriele/vue-analytics.git,Google Analytics plugin for Vue,"vue,google-analytics,analytics,tracking,vue-plugin,vue-analytics,vuejs",1758
41,https://github.com/torodb/stampede.git,The ToroDB solution to provide better analytics on top of MongoDB and make it easier to migrate from MongoDB to SQL ,"nosql,sql,nosql-database,analytics,sql-database",1748
42,https://github.com/ClimbsRocks/auto_ml.git,[UNMAINTAINED] Automated machine learning for analytics & production,"machine-learning,data-science,automated-machine-learning,gradient-boosting,scikit-learn,python,machine-learning-pipelines,machine-learning-library,production-ready,automl,lightgbm,analytics,feature-engineering,hyperparameter-optimization,deep-learning,xgboost,keras,deeplearning,tensorflow,artificial-intelligence",1536
43,https://github.com/Open-Web-Analytics/Open-Web-Analytics.git,"Web Analytics, open sourced. Open Web Analytics is an open source alternative to commercial tools such as Google Analytics. Stay in control of the data you collect about the use of your website or app.  Please consider sponsoring this project.","php,web-analytics,privacy,website-traffic,owa",1535
44,https://github.com/sryza/aas.git,"{""Code to accompany Advanced Analytics with Spark from O'Reilly Media""}",,1447
45,https://github.com/activecm/rita.git,Real Intelligence Threat Analytics (RITA) is a framework for detecting command and control communication through network traffic analysis.,"rita,network-traffic,threat,scanning,offensive-countermeasures,bro-ids,blueteam,security,logs,analytics,analysis,bhis,beacon,beacon-sniffer,dns,dns-tunneling,dga",1415
46,https://github.com/ebidel/appmetrics.js.git,A small (< 1kb) library for measuring things in your web app and reporting the results to Google Analytics.,"metrics,appmetrics,google-analytics,user-timing,lib",1381
47,https://github.com/milesmcc/shynet.git,"Modern, privacy-friendly, and detailed web analytics that works without cookies or JS.","web-analytics,monitoring,django,python,docker,kubernetes,privacy,a17t,self-hosted,analytics,security,noscript",1376
48,https://github.com/Codecademy/EventHub.git,An open source event analytics platform,,1302
49,https://github.com/Azure/Azure-Sentinel.git,Cloud-native SIEM for intelligent security analytics for your entire enterprise.,"sample-code,cybersecurity",1293
50,https://github.com/kaaproject/kaa.git,"Kaa Internet of Things platform for device management, data collection, analytics and visualization, remote control, software updates and more","iot,platform,embedded,kaa-platform",1274
51,https://github.com/kaz-Anova/StackNet.git,"StackNet is a computational, scalable and analytical Meta modelling framework",,1271
52,https://github.com/cswinter/LocustDB.git,"Massively parallel, high performance analytics database that will rapidly devour all of your data.","analytics,database,rust",1266
53,https://github.com/OSBI/saiku.git,Saiku Analytics - The Worlds Greatest Open Source OLAP Browser,,1237
54,https://github.com/dipanjanS/text-analytics-with-python.git,"Learn how to process, classify, cluster, summarize, understand syntax, semantics and sentiment of text data with the power of Python! This repository contains code and datasets used in my book, ""Text Analytics with Python"" published by Apress/Springer. ","text-analytics,text-summarization,text-classification,python,natural-language,natural-language-processing,clustering,sentiment,semantic,sentiment-analysis,nltk,stanford-nlp,spacy,pattern,scikit-learn,gensim",1203
55,https://github.com/uber-archive/AthenaX.git,SQL-based streaming analytics platform at scale,"calcite,flink,sql,uber,streaming,stream,analytics,data",1185
56,https://github.com/idehub/react-native-google-analytics-bridge.git,React Native bridge to the Google Analytics libraries on both iOS and Android.,,1165
57,https://github.com/philipwalton/analyticsjs-boilerplate.git,Examples and best practices for using analytics.js,,1140
58,https://github.com/cobub/razor.git,Cobub Razor - Open Source Mobile Analytics Solution,,1117
59,https://github.com/googleanalytics/ga-dev-tools.git,A showcase of demos and tools built with the various Google Analytics APIs and Libraries.,,1093
60,https://github.com/robflaherty/scroll-depth.git,Google Analytics plugin to track visitor scroll depth,,1000
61,https://github.com/TIBCOSoftware/snappydata.git,"Project SnappyData - memory optimized analytics database, based on Apache Sparkâ„¢ and Apache Geodeâ„¢. Stream, Transact, Analyze, Predict in one cluster ","snappydata,spark,memory-database,analytics,stream,transaction,scale",1000
62,https://github.com/shirosaidev/diskover.git,"File system crawler, disk space usage, file search engine and file system analytics powered by Elasticsearch ","python,elasticsearch,crawler,filesystem-visualization,filesystem-analysis,filesystem-indexer,disk-space,disk-usage,storage-analytics,storage,filesystem,file-indexing,duplicatefilefinder,metadata,duplicate-files,botnet,file-tagging,disk-space-analyzer",992
63,https://github.com/angulartics/angulartics2.git,Vendor-agnostic analytics for Angular2 applications.,"angular,angular2,google-analytics,angulartics2,analytics,piwik,baidu-analytics,google-tag-manager,mixpanel,kissmetrics,facebook-pixel,application-insights,angulartics,segmentio,ngx,angular4,angular5",974
64,https://github.com/antvis/AVA.git,ðŸ¤– A framework for automated visual analytics.,,963
65,https://github.com/HaveAGitGat/Tdarr.git,"Tdarr - Distributed transcode automation using FFmpeg/HandBrake + Audio/Video library analytics + video health checking (Windows, macOS, Linux & Docker)","transcode,automation,video,audio,ffmpeg,handbrake",957
66,https://github.com/pentaho/mondrian.git,Mondrian is an Online Analytical Processing (OLAP) server that enables business users to analyze large quantities of data in real-time.,"mondrian,olap,java,mdx,database",953
67,https://github.com/ranaroussi/quantstats.git,"Portfolio analytics for quants, written in Python","quant,algotrading,algorithmic-trading,quantitative-trading,quantitative-analysis,algo-trading,python,visualization,plotting",948
68,https://github.com/mixpanel/mixpanel-iphone.git,iPhone tracking library for Mixpanel Analytics,"mixpanel,mixpanel-iphone,mixpanel-sdk,objective-c,cocoapods,carthage,analytics,sdk",943
69,https://github.com/cloudera/flume.git,"WE HAVE MOVED to Apache Incubator. https://cwiki.apache.org/FLUME/ .   Flume is a distributed, reliable, and available service for efficiently collecting, aggregating, and moving large amounts of log data. It has a simple and flexible architecture based on streaming data flows. It is robust and fault tolerant with tunable reliability mechanisms and many failover and recovery mechanisms. The system is centrally managed and allows for intelligent dynamic management. It uses a simple extensible data model that allows for online analytic applications.",,942
70,https://github.com/WallStreetAnalytics/wallstreetanalytics.git,An endeavor to create an analytics tool to democratize the information hedge funds are creating teams to collect.,,918
71,https://github.com/jazzband/django-analytical.git,Analytics services for Django projects,"python,django,analytics,templates",905
72,https://github.com/peaksandpies/universal-analytics.git,"{""A node module for Google's Universal Analytics and Measurement Protocol""}",,905
73,https://github.com/ankane/ahoy_email.git,First-party email analytics for Rails,"analytics,first-party-analytics,rails",884
74,https://github.com/DavidWells/analytics.git," Lightweight analytics abstraction layer for tracking page views, custom events, & identifying visitors         ","analytics,telemetry,metrics,analytics-utils,privacy,gdpr-compliant",880
75,https://github.com/Doist/bitmapist.git,Powerful analytics and cohort library using Redis bitmaps,,864
76,https://github.com/san089/goodreads_etl_pipeline.git,"An end-to-end GoodReads Data Pipeline for Building Data Lake, Data Warehouse and Analytics Platform.","etl-pipeline,etl-framework,spark,apache-spark,apache-airflow,airflow,redshift,emr-cluster,livy,s3,warehouse,data-lake,scheduler,data-migration,data-engineering,data-engineering-pipeline,python,goodreads-data-pipeline,airflow-dag,etl-job",810
77,https://github.com/design4use/gb-sketch-segmentcircle.git,"Sketch plugin creates circular graphics for diagrams, instrumentation and analytics.",,780
78,https://github.com/rotki/rotki.git,"A portfolio tracking, analytics, accounting and tax reporting application that protects your privacy","cryptocurrencies,accounting,cryptocurrency-exchanges,blockchain,tax,tax-reporting,bitcoin,ethereum,analytics,tracking,cryptocurrency-portfolio,portfolio-tracker,cryptocurrency-portfolio-tracking,hacktoberfest",774
79,https://github.com/anfederico/stocktalk.git,Data collection tool for social media analytics,"data-mining,sentiment-analysis,twitter",773
80,https://github.com/vesparny/fair-analytics.git,"{""ðŸ“Š  An analytics server that doesn't undermine user's privacy""}","analytics,p2p,distributed,ga,fair,nodejs",754
81,https://github.com/UnlyEd/next-right-now.git,"Flexible production-grade boilerplate with Next.js 10.2, Vercel and TypeScript. Includes multiple opt-in presets using Storybook, Airtable, GraphQL, Analytics, CSS-in-JS, Monitoring, End-to-end testing, Internationalization, CI/CD and SaaS B2B multi single-tenancy (monorepo) support","typescript,typescript-boilerplate,zeit-now,isomorphic-react,universal-app,universal-react,sentry,amplitude,amplitude-analytics,emotion,font-awesome,graphql,graphcms,i18next,locize,cypress,jest,web-font-loader,react-framework,monorepo",752
82,https://github.com/micro-analytics/micro-analytics-cli.git,Public analytics as a Node.js microservice. No sysadmin experience required! ðŸ“ˆ,"analytics,nodejs,microservice,micro,analytics-server,node-microservice",744
83,https://github.com/devinpleuler/analytics-handbook.git,Getting started with soccer analytics,,728
84,https://github.com/rapidsai/cugraph.git,cuGraph - RAPIDS Graph Analytics Library,,704
85,https://github.com/lazerwalker/Theseus.git,An open-source iOS personal analytics tool,,703
86,https://github.com/IENT/YUView.git,The Free and Open Source Cross Platform YUV Viewer with an advanced analytics toolset,"yuv,video,player,analysis,hevc,h265,video-coding,video-player,yuv-player,ffmpeg,raw-video",703
87,https://github.com/danwilson/google-analytics-plugin.git,"{""Cordova (PhoneGap) Plugin to connect to the native Google's Universal Analytics SDK 3.0""}",,694
88,https://github.com/facebookarchive/jcommon.git,"concurrency, collections, stats/analytics, config, testing, etc",,676
89,https://github.com/kaiwaehner/kafka-streams-machine-learning-examples.git,"This project contains examples which demonstrate how to deploy analytic models to mission-critical, scalable production environments leveraging Apache Kafka and its Streams API. Models are built with Python, H2O, TensorFlow, Keras, DeepLearning4 and other technologies.","kafka,kafka-streams,kafka-client,machine-learning,deep-learning,open-source,h2o,h2oai,tensorflow,deeplearning4j,keras,keras-tensorflow,dl4j,ksql,java,python",672
90,https://github.com/JuliaData/JuliaDB.jl.git,Parallel analytical database in pure Julia,"juliadb,parallelism,julia",671
91,https://github.com/cra-ros-pkg/robot_localization.git,"robot_localization is a package of nonlinear state estimation nodes. The package was developed by Charles River Analytics, Inc. Please ask questions on answers.ros.org.",,668
92,https://github.com/Fosome/garb.git,A Ruby wrapper for the Google Analytics API,,666
93,https://github.com/revolunet/angular-google-analytics.git,Google Analytics tracking for your AngularJS apps,,665
94,https://github.com/pulsarIO/realtime-analytics.git,"Realtime analytics, this includes the core components of Pulsar pipeline.",,664
95,https://github.com/rangle/redux-beacon.git,Analytics integration for Redux and ngrx/store,"redux,ngrx,react,angular,google-analytics,redux-beacon,analytics,react-native",650
96,https://github.com/firmai/data-science-career.git,"Career Resources for Data Science, Machine Learning, Big Data and Business Analytics Career Repository","data-science,analytics,career,machine-learning,resources,big-data,business-analytics,business-intelligence",641
97,https://github.com/elcuervo/minuteman.git,Fast analytics using Redis,,637
98,https://github.com/Countly/countly-sdk-android.git,Countly Product Analytics Android SDK,"android-sdk,java,crash,crash-reporting,crash-reports,push-api,push-notifications,open-source,sdk,messaging,notifications",626
99,https://github.com/googleapis/nodejs-storage.git,"Node.js client for Google Cloud Storage: unified object storage for developers and enterprises, from live data serving to data analytics/ML to data archiving.","nodejs,storage",619
100,https://github.com/OpenGamma/Strata.git, Open source analytics and market risk library from OpenGamma,"opengamma,java,strata,market-risk,finance,derivatives,otc,etd,quantitative-finance",618
101,https://github.com/atc-project/atomic-threat-coverage.git,Actionable analytics designed to combat threats,"mitre-attack,threat-model,threathunting,incidentresponse,threatintelligence,threatdetection",617
102,https://github.com/hashview/hashview.git,A web front-end for password cracking and analytics,"hashcat,analytics,passwords,hashes,pentesting,distributed,penetration-testing,security-tools,password-cracking",617
103,https://github.com/x0uid/SpotifyAdBlock.git,"Protect your privacy by blocking all annoying Spotify ads & analytics in Linux, OSX and Windows with hosts file.","spotify,whitelist,linux,privacy,local-machine",617
104,https://github.com/jparise/chrome-utm-stripper.git,"Browser extension that strips Google Analytics (UTM) parameters, and various other click tracking tokens, from URL query strings","chrome,chrome-extension,utm,google-analytics,firefox,firefox-addon",603
105,https://github.com/railslove/rack-tracker.git,Tracking made easy: Donâ€™t fool around with adding tracking and analytics partials to your app and concentrate on the things that matter.,"rack-middleware,google-analytics,ruby,ecommerce,rack,facebook,tracking,tracking-pixels",602
106,https://github.com/CardinalPath/gas.git,Google Analytics on Steroids. A Google Analytics implementation with more power features.,,600
107,https://github.com/nfl/react-metrics.git,An analytics module for React,,599
108,https://github.com/ContinuumIO/docker-images.git,Repository of Docker images created by Continuum Analytics,,594
109,https://github.com/logpai/loghub.git,A large collection of system log datasets for AI-powered log analytics,"logs,console-log,unstructured-logs,log-analysis,log-parsing,datasets,anomaly-detection",590
110,https://github.com/Countly/countly-sdk-ios.git,"Countly Product Analytics iOS SDK with macOS, watchOS and tvOS support. ","sdk,objective-c,tvos,watchos,analytics,push-notifications,rating,crash-dump,crash-reporting,macos,ios,ios-sdk,view-tracking,product-analytics,product-analytics-report,mobile,mobile-analytics,telemetry,telemetry-collection,telemetry-",589
111,https://github.com/amitt001/pygmy.git,"An open-source, feature rich & extensible url-shortener + analytics written in Python :cookie:","url-shortener,python3,python,flask,django,urlshortener,pygmy,shortener,analytics",574
112,https://github.com/theiconic/php-ga-measurement-protocol.git,Send data to Google Analytics from the server using PHP. Implements GA measurement protocol. ,"google-analytics,tracking,php,analytics",573
113,https://github.com/nuxt-community/google-analytics-module.git,Google Analytics Module,"analytics,google-analytics,nuxt,vue-analytics,nuxt-module",565
114,https://github.com/jehna/ga-lite.git,"Small, cacheable and open version of Google Analytics JS client",,559
115,https://github.com/18F/analytics-reporter.git,"Lightweight analytics reporting and publishing tool for Google Analytics data. Powers https://analytics.usa.gov, http://analytics.phila.gov, http://analytics.cityofsacramento.org, and more.","analytics,google-analytics",551
116,https://github.com/datafuselabs/datafuse.git,"A Modern Real-Time Data Processing & Analytics DBMS with Cloud-Native Architecture, written in Rust","olap,query-engine,rust,distributed-computing,sql,clickhouse,query-processing,database,streaming,cloud-native",549
117,https://github.com/kislyuk/watchtower.git,Python CloudWatch Logging: Log Analytics and Application Intelligence,"aws,aws-cloudwatch-logs,cloudwatch-logs,python,python-logging",548
118,https://github.com/matomo-org/docker.git,Official Docker project for Matomo Analytics,,535
119,https://github.com/zentralopensource/zentral.git,"Zentral is an open-source solution for infrastructure monitoring and endpoint event stream processing. It provides build-in orchestration of macOS security components (Santa, Osquery, et-al.), event correlation and event management. It consolidates its features with various data store backends (ElasticStack, Azure Log Analytics, Splunk, et-al.).","logging,sysadmin,macos,osquery,santa,munki,open,puppet,monitor,puppetdb,mdm,dep,azure,elastic,zentral,inventory",533
120,https://github.com/yhilpisch/dx.git,DX Analytics | Financial and Derivatives Analytics with Python,,531
