,Url,Description,Topics,Stars
0,https://github.com/Scifabric/pybossa.git,"{""PYBOSSA is the ultimate crowdsourcing framework (aka microtasking) to analyze or enrich data that can't be processed by machines alone.""}","crowdsourcing,pybossa,python,citizenscience,citizen,science,microtasking,opensource,knowledge,research,crowd",674
1,https://github.com/nytlabs/hive.git,"A platform for backing crowdsourcing websites, built in golang for elasticsearch",,354
2,https://github.com/ninuxorg/nodeshot.git,Django based tools to create crowdsourcing web apps.,,321
3,https://github.com/crowdresearch/daemo.git,The Daemo crowdsourcing platform,"python,postgres,angular,material-design,crowdsourcing",146
4,https://github.com/seanbell/opensurfaces.git,"{""Crowdsourcing pipeline and website for OpenSurfaces [SIG '13] and Intrinsic Images in the Wild [SIG '14]""}",,139
5,https://github.com/benwbrum/fromthepage.git,FromThePage is a wiki-like application for crowdsourcing transcription of handwritten documents.,,133
6,https://github.com/LibraryOfCongress/concordia.git,Crowdsourcing platform for full text transcription and tagging. https://crowd.loc.gov,"transcription,volunteers,loc,crowdsourcing,django",116
7,https://github.com/wq/wq.db.git,"{""☁🌐 wq's db library, extending Django REST framework to support apps for geospatial field data collection, citizen science, and crowdsourcing. ""}","django,rest-api,data-collection,wq-framework,citizen-science,django-rest-framework",103
8,https://github.com/Cosecha/redadalertas.git,A web app for crowdsourcing immigration raid data.,"react,redux,redux-saga,semantic-ui,immigration,social-justice,gplv3",95
9,https://github.com/kort/kort.git,"Kort is a cross-platform, crowdsourcing app aimed to improve OpenStreetMap using the concept of gamification (2012-2016).",,88
10,https://github.com/qq547276542/LabelMarker.git,A small tools for marking training set label in machine learning task.(crowdsourcing),"crowdsourcing,django,marking,machine-learning,tool",83
11,https://github.com/propublica/transcribable.git,Drop in crowdsourcing for your Rails app. Extracted from Free the Files.,,83
12,https://github.com/microsoft/P.808.git,"This is an open-source implementation of the ITU P.808 standard for ""Subjective evaluation of speech quality with a crowdsourcing approach"" (see https://www.itu.int/rec/T-REC-P.808/en). It uses Amazon Mechanical Turk as the crowdsourcing platform. It includes implementations for Absolute Category Rating (ACR), Degradation Category Rating (DCR), and Comparison Category Rating (CCR). ",,79
13,https://github.com/facebookresearch/Mephisto.git,A suite of tools for managing crowdsourcing tasks from the inception through to data packaging for research use,,75
14,https://github.com/marchowardbegins/AlgoHive.git,Crowdsourcing cryptocurrency prediction algorithms.,,74
15,https://github.com/borismus/CrowdForge.git,Django framework for crowdsourcing complex tasks using MTurk,,60
16,https://github.com/medtagger/MedTagger.git,A collaborative framework for annotating medical datasets using crowdsourcing.,"labeling,medical-imaging,crowdsourcing,deep-learning,data-validation,data-science",60
17,https://github.com/CrowdTruth/CrowdTruth.git,"Version 1.0 of the CrowdTruth Framework for crowdsourcing ground truth data, for training and evaluation of cognitive computing systems. Check out also version 2.0 at https://github.com/CrowdTruth/CrowdTruth-core. Data collected with CrowdTruth methodology: http://data.crowdtruth.org/. Our papers: http://crowdtruth.org/papers/","crowdtruth-framework,crowdtruth-work-ow,quality,microtasks,javascript,evaluation",59
18,https://github.com/JakobRogstadius/CrisisTracker.git,CrisisTracker is an open-source web platform that extracts situation awareness reports from public tweets during humanitarian disasters. It combines automated processing with crowdsourcing to quickly detect new events and bring structure to millions of  updates in real-time.,,58
19,https://github.com/ipeirotis/Get-Another-Label.git,Quality control code for estimating the quality of the workers in crowdsourcing environments,,57
20,https://github.com/markaspot/mark-a-spot.git,Public Civic Issue Tracking and Crowdsourcing / Mapping Platform based on Drupal 8. Open311 Server and Client Software,,47
21,https://github.com/appirio-tech/connect-app.git,Build your next project on Connect with the power of crowdsourcing,,42
22,https://github.com/CrowdTruth/CrowdTruth-core.git,CrowdTruth framework for crowdsourcing ground truth for training & evaluation of AI systems,"crowdsourcing,inter-annotator-agreement,human-computer-interaction,annotations,annotation-processing,ambiguity,ambiguity-resolver,natural-language-processing,python,data-science,nlp,artificial-intelligence,ai",37
23,https://github.com/suchow/awesome-crowds.git,"A curated list of awesome resources on crowdsourcing, human computation, and online behavioral experiments.","crowdsourcing,experiments,games,prediction-markets,crowdfunding,citizen-science",35
24,https://github.com/cs-education/classTranscribe.git,"ClassTranscribe provides accessible, searchable lecture videos with captions using automated Speech-to-text and crowdsourcing techniques. This repository represents a 2018 version. The 2019 brand new version of the code is at https://github.com/classtranscribe",,32
25,https://github.com/dividiti/crowdsource-video-experiments-on-android.git,Crowdsourcing video experiments (such as collaborative benchmarking and optimization of DNN algorithms) using Collective Knowledge Framework across diverse Android devices provided by volunteers. Results are continuously aggregated in the open repository:,"dnn,dnn-benchmarking,dnn-tuning,dnn-optimization,collaborative-dnn-optimization,collaborative-optimization,collective-knowledge,crowd-benchmarking,crowd-tuning,openmp,opencl,cuda,android-app,android-device,mobile-devices,iot,machine-learning,data-mining,open-research,reproducible-experiments",31
26,https://github.com/LibCrowds/libcrowds.git,The frontend for the LibCrowds crowdsourcing platform,"vuejs,crowdsourcing,microtasks,pybossa,british-library",30
27,https://github.com/ctuning/ck-crowdtuning-platforms.git,"Meta information about platforms participating in experiment crowdsourcing using Collective Knowledge Framework (OS,CPU,GPU,GPGPU,NN...):","json-api,json-metadata,experiment-crowdsourcing,collective-knowledge,platforms-properties,crowdsourcing,reproducible-experimentation,reproducible-research,collaborative-research,open-research",30
28,https://github.com/radumas/bikeways4everybody.git,Crowdsourcing bike routes in Boston. Making pretty maps from it.,"carto,bikeways,crowdsourcing,crowdmap,leaflet-draw,postgis",29
29,https://github.com/ctuning/ck-crowdnode.git,"Standalone, thin and portable server to let users participate in experiment crowdsourcing using Windows devices via Collective Knowledge Framework:","collaborative-optimization,collective-knowledge,workload-automation,windows,server,crowdsourcing-experiments,json-api,adb-like-server",29
30,https://github.com/wnyc/django-crowdsourcing.git,"Django-crowdsourcing is an MIT-licensed survey and report tool for journalists, supporting many types of survey questions and a wide variety of reporting options. A reusable Django application, it is designed to be installed easily in any Django site, including multi-site installations. Its surveys are entirely configured within the admin interface that ships with Django. While the primary focus of development is support for crowdsourcing projects, the survey tool is general purpose and can be used for a variety of applications. It is easy enough to handle simple polls with pie charts, yet powerful enough to handle complicated surveys with rich multimedia responses plotted on a map with custom icons.",,26
31,https://github.com/CancerDataScience/CrowdsourcingDataset-Amgadetal2019.git,"Use this to download all elements of the dataset described in: Amgad M, Elfandy H, ..., Gutman DA, Cooper LAD. Structured crowdsourcing enables convolutional segmentation of histology images. Bioinformatics. 2019. doi: 10.1093/bioinformatics/btz083",,26
32,https://github.com/squidsoup/django-crowdsourcing.git,"Django-crowdsourcing is a highly configurable survey and report tool for journalists, with a feature set that supports a wide range of useful crowdsourcing projects.",,25
33,https://github.com/open-city/recycling.git,Crowdsourcing data about which residential buildings do not have recycling in Chicago,,24
34,https://github.com/dssg/ushine-learning.git,An API that uses machine learning to help the Ushahidi nonprofit do smarter crisis crowdsourcing.,,24
35,https://github.com/ctuning/crowdsource-experiments-using-android-devices.git,Android application to participate in experiment crowdsourcing (such as workload crowd-benchmarking and crowd-tuning) using Collective Knowledge Framework and open repositories of knowledge: ,"crowdsource-experiments,open-research,collaborative-research,reproducible-research,mobile-devices,android-application,collaborative-benchmarking,performance-benchmarking,performance-tuning,automation,crowd-tuning,knowledge-sharing",24
36,https://github.com/Ajapaik/ajapaik-web.git,"Crowdsourcing of data for historic imagery (geotagging, face tagging, rephotography)",,23
37,https://github.com/workmachine/crowd-sh.git,MapReduce for Crowdsourcing Workflow on Mechanical Turk Using Airtable,,23
38,https://github.com/sdfb/sdfb.git,A crowdsourcing website reassembling the social network of early modern Britain,,23
39,https://github.com/kluther/Pipeline.git,"Free, open-source software for crowdsourcing creative projects",,22
40,https://github.com/rekrei/rekrei.git,Platform for crowdsourcing the digital recreation of lost heritage,"heritage,photogrammetry",21
41,https://github.com/LibCrowds/libcrowds-viewer.git,A Vue component for crowdsourcing Web Annotations.,"vuejs,iiif,crowdsourcing",21
42,https://github.com/RefugeRestrooms/refugerestrooms-ios.git,"[DECOMMISSIONED] iOS app for Refuge Restrooms, crowdsourcing safe restrooms for the trans community","refuge,safe-restrooms,refuge-restrooms,lgbt,trans,transgender,ios-app,objective-c",20
43,https://github.com/carteiro/ceps.git,Crowdsourcing Database para Códigos Postais Brasileiros,"brazil,cep,correios,zipcode,json",19
44,https://github.com/wboykinm/hoodsproj.git,Crowdsourcing Neighborhood Boundaries,,17
45,https://github.com/hack4impact-upenn/Kiva.git,Kiva Crowdsourcing Project,,17
46,https://github.com/Rhapsod/software-crowdsourcing-papers.git,A list of publications on the use of crowdsourcing in software engineering,,17
47,https://github.com/nextgis/nextgiscrowd.git,Web-based crowdsourcing tool to collect and edit spatial data,,17
48,https://github.com/ipeirotis/Troia-Server.git,Quality Control API for Crowdsourcing Applications,,16
49,https://github.com/nathanathan/Language.git,A crowdsourcing approach to natural language programming,,16
50,https://github.com/simonw/cryptozoology.git,Crowdsourcing a directory of cryptids and their range maps.,"cryptozoology,cryptids",16
51,https://github.com/GaryJones/genesis-child-theme-index.git,Crowdsourcing an index of all available Genesis child themes.,,16
52,https://github.com/everypolitician/gender-balance.git,Crowdsourcing platform for gathering gender information about politicians to improve the data in EveryPolitician,,16
53,https://github.com/beeldengeluid/waisda.git,Crowdsourcing video annotation software,,15
54,https://github.com/OfficeDev/microsoft-teams-apps-crowdsourcer.git,QnA bot that works on the concept of crowdsourcing information in teams,,15
55,https://github.com/openknowledgebe/W4P.git,W4P is an easy-to-configure crowdsourcing platform,,15
56,https://github.com/rodrigoberriel/streetview-crosswalk-classification.git,Automatic Large-Scale Data Acquisition via Crowdsourcing for Crosswalk Classification: A Deep Learning Approach,"deep-learning,streetview,crosswalk",14
57,https://github.com/okfn/yourtopia.git,Web app for crowdsourcing preferences about index weighting such as the Human Development Index. Powers the YourTopia site - Global Development beyond GDP.,,14
58,https://github.com/TraceyLauriault/COMS2200A.git,COMS2200A Big Data Society - Crowdsourcing,,14
59,https://github.com/PRImA-Research-Lab/prima-gwt-lib.git,Library with user interface elements and client-server communication classes based on Google Web Toolkit (GWT) that can be used for crowdsourcing applications.,,14
60,https://github.com/mitmedialab/ajl.ai.git,A web application for crowdsourcing image annotations.,,13
61,https://github.com/nouvelingenieur/Refresh.git,"{""Plateforme de crowdsourcing pour l'enseignement supérieur""}",,13
62,https://github.com/laroyo/watsonc.git,Watson-Crowdsourcing,,13
63,https://github.com/Toloka/crowd-kit.git,Python libraries for crowdsourcing,"data-science,data-mining,yandex,python3,crowd,toloka,toloka-crowdsourcing,labeling,annotation,aggregations",13
64,https://github.com/nypl-spacetime/brick-by-brick.git,Simple JSON API for small crowdsourcing apps,,13
65,https://github.com/bmcbride/request-assistance.git,"A simple, responsive web application for crowdsourcing requests for assistance.",,12
66,https://github.com/esa/jupiter_tour.git,A javascript crowdsourcing experiment to prove you can fly a spacecraft through planetary systems,,12
67,https://github.com/sparkica/crowdsourcing.git,An extension for OpenRefine for creating jobs and uploading data to CrowdFlower crowdsourcing service ,,12
68,https://github.com/scify/Crowdsourcing-Platform.git,Laravel web application for Crowdsourcing projects and Questionnaires,"laravel,laravel-framework,web,webpack,web-application,web-app,laravel-mix,laravel-application,javascript,bootstrap4,bootstrap-4,adminlte3,adminlte-template,adminlte,bootstrap,laravel7,laravel7-bootstrap4,laravel7x",11
69,https://github.com/radhikasethi2011/awesome-business-ideas.git,Crowdsourcing the ideas for trends and verbs to create unique business ideas,,11
70,https://github.com/ColumbusCollaboratory/MITRE_NIST.git,"A Crowdsourcing Exchange for mapping various sources of security vulnerabilities, exposures, threats, and controls data",,11
71,https://github.com/namwkim/bubbleview.git,BubbleView: an interface for crowdsourcing image importance maps and tracking visual attention,,11
72,https://github.com/gvanhorn38/crowdsourcing.git,Crowdsourcing tools to construct datasets.,,10
73,https://github.com/barrelo89/IEEE-Internet-of-Things-Journal.git,"Small Profits and Quick Returns: An Incentive Mechanism Design for Crowdsourcing under Continuous Platform Competition,","mechanism-design,auction,munkres",10
74,https://github.com/ui-libraries/DIYHistory-transcribe.git,A crowdsourcing manuscript transcription platform built with Omeka,,10
75,https://github.com/ethanp/crowdsourcing.git,machine learning algorithms to reduce crowdsourcing costs,,10
76,https://github.com/SDESC/SpatialCrowdsourcing.git,paper list of spatial crowdsourcing,,9
77,https://github.com/FlorianPusse/Lingoturk.git,Creating crowdsourcing based experiments made easy,,9
78,https://github.com/tmacwill/crowdcl.git,A framework for crowdsourcing GPU-based computational problems.,,9
79,https://github.com/themoonsheep/moonsheep.git,"Moonsheep digitizes huge, messy paper and PDF archives through crowdsourcing and cutting edge technology.",,9
80,https://github.com/UKPLab/emnlp2017-cmapsum-corpus.git,"Accompanying code for our EMNLP 2017 publication ""Bringing Structure into Summaries: Crowdsourcing a Benchmark Corpus of Concept Maps""",,9
81,https://github.com/salsowelim/tawseem.git,NLP crowdsourcing platform for word-level annotations,"nlp,word-segmentation,crowdsourcing,golang,postagging,annotation-tool",9
82,https://github.com/brianckeegan/INFO-3501-5501.git,"Syllabus for ""Peer Production and Crowdsourcing"" course.",,9
83,https://github.com/hamstar/legislat0r.git,An open source system for crowdsourcing creation and analysis of legislature,,9
84,https://github.com/publiclab/mapmill.git,A Hot-or-Not styled crowdsourcing engine for sorting raw map imagery,,8
85,https://github.com/mozilla/m-response.git,Crowdsourcing Mozilla responses to Google Play Store reviews,,8
86,https://github.com/crowdresearch/daemo-api-client.git,Python API Client for Daemo Crowdsourcing Platform,"python,websockets,client-sdk",8
87,https://github.com/julianmichael/qasrl.git,Tools for working with QA-SRL data and annotating it with crowdsourcing.,,8
88,https://github.com/spring-epfl/MCSAuditing.git,Evaluation code for mobile crowdsourcing privacy (paper: On (The Lack Of) Location Privacy in Crowdsourcing Applications -- USENIX Security 2019),,8
89,https://github.com/alex-konovalov/gnu.git,Crowdsourcing project for the database of numbers of isomorphism types of finite groups,,8
90,https://github.com/stripstarter/stripstarter.git,Social Crowdsourcing,,8
91,https://github.com/lenaschimmel/aufschreiStat.git,"Spezielle Software, um eine statistische Auswertung der #aufschrei-Tweets per Crowdsourcing zu ermöglichen.",,8
92,https://github.com/awatson1978/payment-crowdsourcing.git,Meteor package to drop in a crowdsourcing payment page using Stripe.,,8
93,https://github.com/moreeyesplz/meep_scanner.git,Integrate this action into your repository to start crowdsourcing feedback for your commits!,"moreeyesplz,github-actions",8
94,https://github.com/Ev4ngelos/Atmos-iOS.git,Atmos iOS is an open source project for crowdsourcing user and sensor generated data about the weather on iOS devices.,"mobile-app,ios-swift,crowdsourcing,weather-data",8
95,https://github.com/danlassiter/Submiterator.git,"{""Python script to streamline the process of posting external HITs to Amazon's Mechanical Turk crowdsourcing website.""}",,7
96,https://github.com/orchidproject/active-crowd-toolkit.git,ActiveCrowdToolkit: Benchmarking tools for crowdsourcing research,,7
97,https://github.com/Lewis-Ho/Subwayz.git,A crowdsourcing web application to retrieve subway status and further prediction,,7
98,https://github.com/refugeetech/platform.git,"The platform connects tech projects, public and private initiatives, problems, crowdsourcing of   problems and crowdsourcing of ideas to solve problems, resources (cash, products & services, etc)   and their respective sponsors, volunteers.",,7
99,https://github.com/TsinghuaDatabaseGroup/Crowd-topk.git,"crowdsourcing operators, systems, and inference for cost, quality, and latency optimiations",,7
100,https://github.com/codeforamerica/aedmapper.git,crowdsourcing defibrillator locations,,7
101,https://github.com/socialnews/app.git,Distributed link aggregator for crowdsourcing the news,,7
102,https://github.com/charleslipku/TIPRDC.git,TIPRDC: Task-Independent Privacy-Respecting Data Crowdsourcing Framework for Deep Learning with Anonymized Intermediate Representations,,7
103,https://github.com/skasberger/crowd-bib.git,php website for crowdsourcing of bibliographic data in various scientific fields.,,7
104,https://github.com/crowdsourcing-class/crowdsourcing-class.github.io.git,Crowdsourcing and Human Computation (UPenn NETS 213),,6
105,https://github.com/ubriela/geocrowd-priv-dynamic.git,Dynamic Private Crowdsourcing,,6
106,https://github.com/CodeandoMexico/centro-de-apertura-de-datos.git,Crowdsourcing the opening of public data,,6
107,https://github.com/bounswe/culturage-bounswe2017group11.git,"Culturage - Crowdsourcing project for ""Cultural Heritages""","cultural-heritage,bogazici-university,software-engineering",6
108,https://github.com/jmiramant/staance.git,"Crowdsourcing Political Influence. Built with Eadon Jacobs, Josh Miramant, Lloyd Taylor and Shiv Kumar",,6
109,https://github.com/CancerDataScience/NuCLS.git,"NuCLS: A scalable crowdsourcing, deep learning approach and dataset for nucleus classification, localization and segmentation",,6
110,https://github.com/turkeyes/codecharts.git,Crowdsourcing human attention via a self-report codecharts methodology.,,6
111,https://github.com/uiuc-sst/mcasr.git,Mismatched Crowdsourcing Automatic Speech Recognition,,6
112,https://github.com/YaleDHLab/ensemble-at-yale.git,Crowdsourcing the transcription of Yale playbills - http://bit.ly/ensemble-at-yale,"web-app,crowdsourcing",6
113,https://github.com/streetlives/streetlivesnyc.git,[DEPRECATED] A map based crowdsourcing site providing information for and from the homeless population of New York City http://streetlives.nyc,,6
114,https://github.com/nimoffline/loonarium.git,Crowdsourcing analysis of Youtube MVs with time-annotated videos,,6
115,https://github.com/volontariat/volontari.at.git,Open source crowdsourcing platform based on Ruby gem voluntary.,,6
116,https://github.com/BUAA-BDA/SpatialCrowdsourcing-GOMA.git,GOMA is a two-sided online task assignment problem in Spatial Crowdsourcing.,"spatial-crowdsourcing,online-matching,spatial",6
117,https://github.com/wq/wq.create.git,wq.create: Project scaffolding tools for creating a new crowdsourcing or citizen science application with the wq framework.,"django,django-project-template,wq-framework,offline,cra-template,create-react-app,rollup-plugin,rollup",6
118,https://github.com/maryamkhidir/freelancer-bl.git,"Freelancer-bl is a crowdsourcing marketplace website, which allows potential employers to post jobs that freelancers can then bid to complete. It was inspired by Freelancer.com. Developed with Laravel and Bootstrap. You can clone and modify it for your next project. A live preview is available at",,6
119,https://github.com/svc/social-venture-commons.git,Social Venture Commons is an open-source micro-messaging Rails application aimed at accellerating fulfillment of organizational needs by crowdsourcing the efforts.,,6
120,https://github.com/genomicsengland/panelapp.git,"Genomics England PanelApp - A crowdsourcing tool to allow gene panels to be shared, downloaded, viewed and evaluated by the Scientific Community","python,django",6
121,https://github.com/ThinerZQ/CrowdSourcingWithWWF.git,a crowdsourcing platform besed on state machine workflow of window workflow fundation(使用微软的状态机工作流实现的众包平台),,6
122,https://github.com/Classlocus/ClassLocus.git,"This application will simply and quickly show users where their classroom is on campus. Through crowdsourcing, users will help each other out with tips about classrooms and buildings - where to find them and what to expect.",,6
123,https://github.com/TsinghuaDatabaseGroup/CrowdTI.git,A truth inference tool in crowdsourcing,,5
124,https://github.com/topcoderinc/va-online-memorial.git,Repo for http://crowdsourcing.topcoder.com/VA-Online-Memorial,"topcoder,veterans",5
125,https://github.com/MaastrichtU-IDS/crowdED.git,🤖 Guideline for designing optimal crowdsourcing experiments,"crowdsourcing,optimization,python,shiny",5
126,https://github.com/ruofeidu/USketch.git,USketch: A crowdsourcing tool for SketchyScenes,"usketch,sketch",5
127,https://github.com/volontariat/voluntary.git,Crowdsourcing management system for Ruby on Rails which powers Volontari.at.,,5
128,https://github.com/daguar/cheap-beer-price-index.git,Crowdsourcing price/brand data for the cheapest beer option at bars,,5
129,https://github.com/cbdb-project/crowdsource-webapp.git,Crowdsourcing System for Association Data 社會關係數據眾包系統,"cbdb,cbdb-data,docker-container,crowdsourcing",5
130,https://github.com/UCI-Libraries/Ming-Titles-Dictionary.git,Crowdsourcing English translations of unusual government office titles from the Chinese Ming dynasty,,5
131,https://github.com/CrowdCafe/crowdcafe.git,CrowdCafe - Mobile Crowdsourcing Platform ,,5
132,https://github.com/codeforeurope/TagCheckScore.git,Crowdsourcing application for tagging images,,5
133,https://github.com/NCBI-Hackathons/Metadata_categorization.git,A crowdsourcing/expert curation platform for metadata categorization.,,5
134,https://github.com/surfriderfoundationeurope/LabelCV.git,"LabelCV is a service used to build a labeled image dataset via crowdsourcing. Researchers, companies and datascientists can use LabelCV to spinup a website where people can tag an existing image dataset or contribute to this dataset by uploading images.",,5
135,https://github.com/OriShapira/LitePyramids.git,"Method for evaluating system summaries manually, via crowdsourcing, using a summarization dataset that includes reference summaries.",,5
136,https://github.com/digitalepidemiologylab/crowdbreaks-paper.git,"Material related to paper ""Crowdbreaks: Tracking Health Trends using Public Social Media Data and Crowdsourcing""",,5
137,https://github.com/cap-ntu/iTCM-Datasets.git,"These datasets are collected for the GBIC project to conduct research about indoor human thermal comfort. The GBIC research project proposes to develop online thermal comfort models via a deep-learning approach and apply them to behavioral studies to drive “greener, smarter and healthier buildings” in the tropics (e.g., Singapore). Leveraging privacy-preserving data analytics over information acquired from smartphone crowdsourcing and in-situ wearables measurements, the project plans to develop and validate an integrative, economical and scalable thermal comfort management system.","thermal-comfort,hvac,pmv",5
138,https://github.com/AI-Collaboratory/Scribe.git,A crowdsourcing platform for transcribing scanned documents.,"crowdsourcing,ruby-on-rails,archive,transcribe,mongodb",4
139,https://github.com/Tibia-WindBot/WindBot-Docs.git,Public repository to help with crowdsourcing the WindBot documentation.,,4
140,https://github.com/iisharvard/platemate.git,PlateMate: crowdsourcing nutritional analyses from food photographs,,4
141,https://github.com/whathood/whathood.git,WhatHood is a neighborhood border crowdsourcing web application,,4
142,https://github.com/XLab-Tongji/crowdsourcing-front.git,the frontend for the crowdsourcing web project,,4
143,https://github.com/sparkica/CrowdFlowerClient.git,A simple client for Crowdflower crowdsourcing service,,4
