,Url,Description,Topics,Stars
0,https://github.com/ghostandthemachine/DroidGraph.git,Open GL ES Scene graph library for Android,,3
0,https://github.com/zubair1024/SocialMashV1.git,Facebook Application using the Facebook Open Graph API,,3
0,https://github.com/kwonoh/LibOGDF.uplugin.git,OGDF (Open Graph Drawing Framework) Plugin for Unreal Engine 4,"ogdf,unreal-engine,graph-drawing,graph",3
0,https://github.com/CrawlScript/ogb_lite.git,A lite version of the Open Graph Benchmark (OGB) that does not rely on torch.,,3
0,https://github.com/wasimusu/graphs.git,An open-source modern graph library built for ease of use.,"cpp,cpp-library,graph-algorithms,graph-theory,open-source,graph",3
0,https://github.com/w2g/graph.global.git,"An open RDF style entity graph (people, places) for cross-domain, entity resolved semantic #tagging",,3
0,https://github.com/likr/emogdf.git,Experimental port of Open Graph Drawing Framework (OGDF) for the Web,,3
0,https://github.com/rnagle/embeddit.git,A simple lib for fetching oEmbed info with fallback to Open Graph.,,3
0,https://github.com/alexpate/oggy.git,🍭 A microservice to generate beautiful open graph images for your blog,"microservice,open-graph,zeit,now",3
0,https://github.com/Mohit-15/Motion_Detector-using-Python-and-OpenCV.git,"In this, we are using python and open source computer vision for detecting the object.For analysing and creating the dataFrame we use pandas library. For plotting the graph I have used ""Bokeh"" library. In this what we do is we capture the first frame of the video and find the difference of it with other frames when a moving object comes in and save the entry and exit time in the dataframe named Times. csv.",,3
0,https://github.com/marcantondahmen/automad-meta-tags.git,This Automad extension creates meta tags in templates. It also supports the Open Graph protocol to create beautiful preview cards for Facebook and Twitter.,"meta-tags,twitter,facebook,html,composer,automad",3
0,https://github.com/hadialaddin/cpgraph.git,An open-source extensive source of useful material for anyone looking into implementing the CoursePeer Knowledge Graph APIs in their applications.,,3
0,https://github.com/l4ci/kirby-seo-og-plugin.git,"Plugin for Kirby CMS to add seo relevant meta- and open graph data to templates and blueprints, for easy editing these information via the kirby panel.","kirby-plugin,kirby-panel,kirby,kirby-cms",3
0,https://github.com/mrafayaleem/community-clusters.git,"{""We look to apply big data techniques to perform large-scale graph mining on web crawl data. We utilize the Common Crawl web dataset, which is an open dataset hosted on Amazon Web Services' cloud platform. This is an extremely large dataset that consists of petabytes of web crawl data.""}",,3
0,https://github.com/maayami/Fitly.git,"{""We are making a cross-platform and open-source application Fitly. Fitly is a community app for fitness lovers. It has awesome native features like notifying a user for fitness checkup. It has an animated graph showing the user's progress. explore tab is there to give a user more socialised experience. User can also share his progress over other platforms.""}","react-native,react-native-app,react-native-navigation,react-native-vector-icons",3
0,https://github.com/VerizonAdPlatforms/verizon-media-connectid.git,"{""The Verizon Media ConnectID is designed to enable ad tech platforms to recognize and match users consistently across the open web. The Verizon Media ConnectID is built on top of Verizon Media's robust and proprietary ID Graph, delivering a higher find rate of audiences on publishers' sites user targeting.""}",,3
0,https://github.com/saliez/IMMM.git,"IMMM,  Interactive Medical Mind Maps A project of the Open Source Working Group of the ISfTeH, International Society for Telemedicine.  The objective is to facilitate understanding and collaboration between the members of a Care Team in charge of a common patient, acroos Internet by means of graphs.  ",,3
0,https://github.com/whallysson/seotags.git,"Is a compact and easy-to-use tag creator to optimize your site (OnPage SEO de forma fácil e descomplicada, open graph, twitter card, facebook, google plus e outros)",,3
0,https://github.com/edwardfung123/phantomjs-facebook.git,"{""Since Facebook does not allow using their own Open Graph API to get the user's friend list, I, as an Facebook user, have to get my friend list with this little phantomjs script.""}",,3
0,https://github.com/cara-tm/pat_article_social.git,"{""Create social links and share counters for articles with Open Graph Meta tags. Embedded status into article's body (Twitter, facebook, G+, Instagram or Gist), blocks of text (quotes) followed by share links below it. Google AMP capable.""}","textpattern,textpattern-plugin,social-network",3
0,https://github.com/elswork/tensorflow.git,"DEPRECATED - A Docker image for Tensorflow, an open source software library for numerical computation using data flow graphs that will let you play and learn distinct Machine Learning techniques over JupyterLab an open-source web application that allows you to create and share documents that contain live code, equations, visualizations and explanatory text. Computational Narratives as the Engine of Collaborative Data Science. All this under Python 2.7 language.","tensorflow,docker,docker-image,armv7,jupyter-notebook,arm,python,jupyterlab",3
0,https://github.com/devall-eu/Mysql-data-with-monitoring-in-real-time-graph.git,"Monitoring and control over the database, data flow, open connections and processes. Suitable for optimizing the database, searching for maximum load and slow queries. Graphs in real time and responsive visual display. Basic settings and other parameters, easy to set up, without additional programming skills.","mysql,data,monitoring,php,codeigniter,graph,realtime",3
0,https://github.com/nomankhalil/GitHub-Desktop-Overview-Release-Notes-Help-Release-Notes-for-Windows-View-release-notes-for-Ma.git,"{""GitHub Desktop Overview   Release Notes  |  Help Release Notes for Windows View release notes for Mac  2016/09/22v3.3.3 Chocolate-Covered Yaks  UPDATEDGit Shell updated to v2.10.2 2016/09/22v3.3.2 Chocolate-Covered Yaks  UPDATEDGit Shell updated to v2.10.1 which updates Curl to 7.50.3 and fixes some issues working with repositories over HTTPS with domains that use self-signed certificates. FIXEDUnable to resize the app to a width of 1024. 2016/09/22v3.3.1 Chocolate-Covered Yaks  UPDATEDForce usage of TLS 1.2 when the client supports the protocol. 2016/09/06v3.3.0 Chocolate-Covered Yaks  UPDATEDGit Shell updated to v2.10 which includes major performance improvements to interactive rebase among other enhancements. UPDATEDGit LFS updated to v1.3.1. FIXEDDpi scaling on Windows 10 Anniversary Edition caused blurry fonts. 2016/07/26v3.2.0 War on Emus  ADDEDNew button to open a repository in Atom or Visual Studio. UPDATEDGit Shell updated to v2.9.0.1. IMPROVEDBetter error message when publishing a repository that already exists on the server. FIXEDCrash due to an unhandled COMException thrown by the default text input spellchecker 2016/05/06v3.1.1 Oh Darth, Where Art Thou?  FIXEDCrash when using a Windows theme with drop shadows enabled. 2016/05/04v3.1.0 Oh Darth, Where Art Thou?  NEWDark theme now available from Options menu. ADDEDIcons indicating whether a file was added, removed or modified. FIXEDUnable to add repository which exists at drive root. FIXEDCrash due to incorrect handling of input arguments on launch. FIXEDCrash due to COM exception when interacting with Taskbar. FIXEDCrash when scanning filesystem for local repositories. FIXEDCreated SSH keys not added to ssh-agent on first launch. FIXEDCrash due to decoding malformed parameters on restart. UPDATEDPosh-Git now includes new icons in prompt. UPDATEDGit Shell updated to v2.8.1. UPDATEDGit LFS updated to v1.2.0. UPDATEDGit Shell adds Visual Studio 2015 developer tools and other common tools to $PATH. 2016/03/31v3.0.17 Proctional Fungramming  FIXEDCrash when updating the Windows taskbar with information but the taskbar is not ready or not found. 2016/03/24v3.0.16 Proctional Fungramming  FIXEDExcessive memory allocations in large repositories that caused out of memory errors. FIXEDCommit selection would stop working if one commit failed to load. FIXEDVarious memory and performance improvements. UPDATEDGit Shell updated to v2.7.4. 2016/03/15v3.0.15 Proctional Fungramming  IMPROVEDReduced memory consumption when pruning merged branches. IMPROVEDReduced memory consumption by requesting smaller avatars. 2016/03/03v3.0.14 Proctional Fungramming  FIXEDPosh-Git update does not work for users running Powershell v2. 2016/03/02v3.0.13 Proctional Fungramming  ADDEDIssue suggestions when creating commit messages by pressing the # key. UPDATEDGit Shell updated to v2.7.1. UPDATEDPosh-Git now includes new icons in prompt FIXEDCrash when trying to rapidly load diffs for multiple Git-LFS files. IMPROVEDLocal branches that have been merged into the default branch are automatically pruned. IMPROVEDArrow keys and Page Up/Down can can be used to scroll through diffs. 2016/01/22v3.0.12 Only You Can Shave Yakkind  FIXEDUpdated Authenticode certificate to replace obsolete SHA1 certificate. FIXEDRare crash when hovering over commit graph. 2015/12/17v3.0.11 No Type Remains  FIXEDUnable to view diffs in LFS-enabled repositories 2015/12/16v3.0.10 One Type Remains  IMPROVEDCTRL + ~ opens Git Shell in addition to ~. IMPROVEDCTRL + Enter creates a PR when used within the pull request panel. IMPROVEDUpdated Git LFS to v1.1.0. FIXEDCloning large Git LFS-enabled repositories would fail when exceeding one hour. FIXEDRare crash when saving git attributes in repository settings. FIXEDExtracting Git shell components could fail when using certain anti-virus programs. FIXEDGit LFS accessible when launching using shell.ps1 2015/11/25v3.0.9 Totally Texas  FIXEDGit Shell would load incorrect assembly, impacting git-remote-https operations. 2015/11/24v3.0.8 Totally Texas  UPDATEDGit command line updated to v2.5. FIXEDDiff generation failed for specific scenarios. FIXEDAvatars disappearing when switching repositories. FIXEDTutorial would get automatically selected on start up until completed or removed. FIXEDRepository list lost focus while using keyboard navigation due to automatic focusing of commit title. FIXEDRare crash when hovering over a commit in the graph. FIXEDGit LFS attributes created in repository settings now match those creating using the CLI. 2015/10/29v3.0.7 Never Gonna Git You Up  IMPROVEDAuto focus commit summary when switching to changes tab. FIXEDError rendering diffs for modified renamed files. FIXEDWrong changelog showing for users on the beta program. FIXEDCrash when attempting to show diff for large file storage assets. FIXEDCloning GitHub wikis using the 'Clone in Desktop' button. UPDATEDGit LFS updated to v1.0.2 2015/10/09v3.0.6 Berge Mase  ADDEDFrom the Git Shell, you can now open the GitHub Desktop application to a specific repository from the command line by passing the path to the repository to github.exe. FIXEDLogging in on multiple machines could cause other sessions to be revoked. FIXEDComparison graph sometimes showed the wrong current branch. FIXEDFailing to load the correct commits when scrolling in the history tab. FIXEDRare crash when account transitioned between authenticated and unauthenticated. FIXEDTutorial repository showing after opening settings, about or option view. IMPROVEDNew tab header styles. IMPROVEDQuick sign in from clone dialog when not authenticated. IMPROVEDHelpful messaging when failing to push to, or delete, a protected branch. IMPROVEDMore detailed messaging when failing to render a diff. IMPROVEDLong branch names are now truncated in repository view and menus. IMPROVEDDisabled buttons in comparison graph no longer have hover states. 2015/09/08v3.0.5 Realtime Baking  ADDEDEasily switch between Changes and History using the tabs. ADDEDDelete the current branch from the gear menu. IMPROVED@mentions list is refreshed more frequently. IMPROVEDReduced memory usage when browsing history. FIXEDA rare crash when accessing a repository's config file. 2015/08/24v3.0.4 The Last Free Monad  IMPROVEDscrolling animations inside comparison graph. FIXEDCloning forked repository not displaying correct graph initially. FIXED'Update from {branch}' uses tracked branch if defined. FIXEDA potential crash when appending commits in history view. FIXEDPull Request tooltip showing incorrect message. FIXEDA potential crash when extracting tutorial repository. 2015/08/14v3.0.3 The Last Free Monad  IMPROVEDScrolling commits is now way faster! FIXEDNew commits weren't reflected in the history. FIXEDUndoing commits weren't reflected in the history. FIXEDRemote commits were inserted at the end of the history when syncing. 2015/08/12v3.0.2 The Last Free Monad  FIXEDA crash when fetching commits in rare cases. FIXEDA crash when opening the base branch popover. FIXEDA crash when failing to load files in commits. FIXEDA crash when restarting the tutorial. FIXEDChanged files appearing under the commit form. 2015/08/12v3.0.1 The Last Free Monad  FIXEDA potential crash while generating the comparison graph. 2015/07/06v3.0.0 The Last Free Monad  NEW'Use the comparison graph to compare two branches and keep them in sync.' Overview   Release Notes  |  Help © 2016 GitHub, Inc. All rights reserved.""}",,3
