,Url,Description,Topics,Stars
0,https://github.com/metabase/metabase.git,"The simplest, fastest way to get business intelligence and analytics  to everyone in your company :yum:","analytics,businessintelligence,dashboard,reporting,slack,clojure,database,metabase,postgres,postgresql,mysql,bi,visualization,data,data-analysis,sql-editor,data-visualization,business-intelligence",24769
1,https://github.com/odoo/odoo.git,Odoo. Open Source Apps To Grow Your Business.,"odoo,python,business,management,odoo-apps,erp,apps",21288
2,https://github.com/diem/diem.git,Diem’s mission is to build a trusted and innovative financial network that empowers people and businesses around the world.,blockchain,15848
3,https://github.com/EnterpriseQualityCoding/FizzBuzzEnterpriseEdition.git,FizzBuzz Enterprise Edition is a no-nonsense implementation of FizzBuzz made by serious businessmen for serious business purposes.,,14494
4,https://github.com/monicahq/monica.git,"Personal CRM. Remember everything about your friends, family and business relationships.","laravel,crm,friends,family,social,prm,php,hacktoberfest",12855
5,https://github.com/asLody/VirtualApp.git,Virtual Engine for Android(Support 12.0 in business version),"android,plugin,framework,plugin-manager",7757
6,https://github.com/Activiti/Activiti.git,"{""Activiti is a light-weight workflow and Business Process Management (BPM) Platform targeted at business people, developers and system admins. Its core is a super-fast and rock-solid BPMN 2 process engine for Java. It's open-source and distributed under the Apache license. Activiti runs in any Java application, on a server, on a cluster or in the cloud. It integrates perfectly with Spring, it is extremely lightweight and based on simple concepts. ""}","java,bpm,spring,cloud,microservices,business-process,activiti,product-activiti,bpmn",7714
7,https://github.com/digoal/blog.git,"Everything about database,business.(Most for PostgreSQL).","postgresql,oracle,greenplum,enterprisedb,database,gpdb,hawq,mysql,mongodb,pgsql,postgres,pg",5738
8,https://github.com/alibaba/MNN.git,"MNN is a blazing fast, lightweight deep learning framework, battle-tested by business-critical use cases in Alibaba","mnn,convolution,vulkan,embedded-devices,winograd-algorithm,machine-learning,deep-learning,ml,deep-neural-networks,arm",5653
9,https://github.com/uber/cadence.git,"Cadence is a distributed, scalable, durable, and highly available orchestration engine to execute asynchronous long-running business logic in a scalable and resilient way.","uber,cadence,workflows,orchestration-engine,workflow-automation,distributed-systems,service-bus,service-fabric,services-platform,golang,java",4902
10,https://github.com/qor/qor.git,"QOR is a set of libraries written in Go that abstracts common features needed for business applications, CMSs, and E-commerce systems.","go,golang,cms,admin,api",4725
11,https://github.com/flowable/flowable-engine.git,"A compact and highly efficient workflow and Business Process Management (BPM) platform for developers, system admins and business users.",,4070
12,https://github.com/bytefury/crater.git,Free & Open Source Invoice App for Freelancers & Small Businesses,"invoices,php,laravel,javascript,vue,payment,laravel-framework",3882
13,https://github.com/corda/corda.git,"{""Corda is an open source blockchain project, designed for business from the start. Only Corda allows you to build interoperable blockchain networks that transact in strict privacy. Corda's smart contract technology allows businesses to transact directly, with value.""}","corda,kotlin,distributed-ledger,dlt",3600
14,https://github.com/bagisto/bagisto.git,A Free and Opensource Laravel eCommerce framework built for all to build and scale your business.,"ecommerce-framework,laravel,vue,php,warehouse-management,ecommerce,ecommerce-platform,laravel-application,laravel-ecommerce,laravel-package,opensource,multivendor-ecommerce,multi-tenant,multi-tenancy-plugin,opensource-ecommerce-framework,hacktoberfest2020,hacktoberfest",3563
15,https://github.com/Budibase/budibase.git,"Budibase is a free and open-source development platform that helps you build business apps on your own infrastructure, in minutes 🚀 ","nocode,lowcode,webdevelopment,webdev,opensource,selfhosted,developer-tools,internal-tools,internal-project,internal-tool,docker,docker-compose,automation,low-code,workflow-automation,low-code-development-platform,low-code-development,web-development,web-dev,web-development-tools",3177
16,https://github.com/ankane/blazer.git,Business intelligence made simple,"business-intelligence,charts,sql",2925
17,https://github.com/jiajunhui/PlayerBase.git,The basic library of Android player will process complex business components. The access is simple。Android播放器基础库，专注于播放视图组件的高复用性和组件间的低耦合，轻松处理复杂业务。,"player,video,listvideo,widget,fullscreen,android,surfaceview,textureview,exoplayer,mediaplayer,listplay,ijkplayer",2770
18,https://github.com/PMSI-AlignAlytics/dimple.git,An object-oriented API for business analytics,,2724
19,https://github.com/alibaba/QLExpress.git,"QLExpress is a powerful, lightweight, dynamic language for the Java platform aimed at improving developers’ productivity in different business scenes.",,2671
20,https://github.com/everpix/Everpix-Intelligence.git,"Uncensored Everpix metrics, financials and business data for your perusing",,2431
21,https://github.com/async-labs/saas.git,"Build your own SaaS business with SaaS boilerplate. Productive stack: React, Material-UI, Next, MobX, WebSockets, Express, Node, Mongoose, MongoDB. Written with TypeScript.","saas,boilerplate,react,material-ui,nextjs,mobx,express,mongoose,mongodb,typescript,google-api,passport,aws-ses,aws-s3,mailchimp,saas-boilerplate,saas-business,saas-product",2360
22,https://github.com/beberlei/assert.git,Thin assertion library for use in libraries and business-model,,2145
23,https://github.com/serenity-is/Serenity.git,Business Apps Made Simple with Asp.Net Core MVC / TypeScript,"aspnet-core,asp-mvc,mvc,business,admin,serenity,typescript,dotnetcore,c-sharp",2094
24,https://github.com/wesdoyle/design-patterns-explained-with-food.git,"GoF Design Patterns with ""Real-World"" examples involving Food-Related Businesses and mock dependencies","design-patterns,gang-of-four,dotnet,object-oriented-design",2034
25,https://github.com/kumailht/flakes.git,"Flakes is an Admin Template Framework. A combination of CSS Libraries, JavaScript Libraries and Design files that help you build business tools very quickly.",,1853
26,https://github.com/shzlw/poli.git,An easy-to-use BI server built for SQL lovers. Power data analysis in SQL and gain faster business insights.,"business-intelligence,sql,dashboard,data-visualization,sql-editor,jdbc,bigdata,reporting,spring-boot,reactjs",1797
27,https://github.com/jeffbski/redux-logic.git,Redux middleware for organizing all your business logic. Intercept actions and perform async processing.,,1771
28,https://github.com/SpecFlowOSS/SpecFlow.git,"#1 .NET BDD Framework. SpecFlow automates your testing & works with your existing code. Find Bugs before they happen. Behavior Driven Development helps developers, testers, and business representatives to get a better understanding of their collaboration","specflow,xunit,mstest,nunit,bdd,gherkin,hacktoberfest",1711
29,https://github.com/DevExpress/devextreme-reactive.git,Business React components for Bootstrap and Material-UI,"react,react-components,material-ui,material-design,bootstrap,datagrid,charts,scheduler,calendar",1656
30,https://github.com/chris1610/pbpython.git,"Code, Notebooks and Examples from Practical Business Python","python,pandas,datascience,scikit-learn,data-analysis,data-visualization",1599
31,https://github.com/pencilblue/pencilblue.git,"Business class content management for Node.js (plugins, server cluster management, data-driven pages)",,1593
32,https://github.com/AaronLasseigne/active_interaction.git,:briefcase: Manage application specific business logic.,"ruby,activemodel,service-object,method-object,command-pattern",1571
33,https://github.com/szad670401/HyperLandmark.git,Deep Learning Based Free Mobile Real-Time  Face Landmark Detector. Contact:jack-yu-business@foxmail.com,"face-landmark,cnn,android,tracking,106-points,face-alignment",1511
34,https://github.com/thirtythreeforty/businesscard-linux.git,A Buildroot distribution small enough to run on my business card,"buildroot,linux,allwinner-f1c100s,lichee-nano",1488
35,https://github.com/ONLYOFFICE/CommunityServer.git,"Free open source office suite with business productivity tools: document and project management, CRM, mail aggregator.","onlyoffice,collaboration,dms,document-management,project-management,crm,file-sharing,csharp,tsql",1406
36,https://github.com/cypriss/mutations.git,Compose your business logic into commands that sanitize and validate input.,,1323
37,https://github.com/Tencent/paxosstore.git,"PaxosStore has been deployed in WeChat production for more than two years, providing storage services for the core businesses of WeChat backend. Now PaxosStore is running on thousands of machines, and is able to afford billions of peak TPS.","paxos,database,distributed-database,consensus",1315
38,https://github.com/aws-samples/lambda-refarch-webapp.git,"The Web Application reference architecture is a general-purpose, event-driven, web application back-end that uses AWS Lambda, Amazon API Gateway for its business logic. It also uses Amazon DynamoDB as its database and Amazon Cognito for user management. All static content is hosted using AWS Amplify Console.","serverless,lambda,aws,aws-lambda,amplify,dynamodb",1257
39,https://github.com/kiegroup/jbpm.git,a Business Process Management (BPM) Suite,"jbpm,bpm,bpmn,business-process,case-management,workflow,bpmn2,process-engine,opensource",1243
40,https://github.com/drhenner/ror_ecommerce.git,"Ruby on Rails Ecommerce platform, perfect for your small business solution.",,1201
41,https://github.com/frappe/books.git,Free Desktop book-keeping software for small-businesses and freelancers.,"accounting,open-source,javascript,electron,frappe,vuejs,book-keeping,double-entry-accounting,frappejs,offline",1166
42,https://github.com/mining/mining.git,"Business Intelligence (BI) in Python, OLAP","bi,business-intelligence,data-analytics,olap,olap-cube,python",1141
43,https://github.com/Mahmoudz/Porto.git,Porto is a Modern Software Architectural Pattern that scales with your business!,"architecture,architectural-patterns,porto,porto-sap,software-architecture",1139
44,https://github.com/rails/activeresource.git,Connects business objects and REST web services,,1090
45,https://github.com/MyCollab/mycollab.git,"An open source, free, high performance, stable and secure Java Application Business Platform of Project Management and Document","java,mysql,project-management,collaboration,agile,kanban,kotlin,mysql-server,microservices,spring-boot,springframework,vaadin,mybatis,opensource,onpremises,mybatis3,rest-api,quartz-scheduler,guava",1078
46,https://github.com/YetiForceCompany/YetiForceCRM.git,Our team created for you one of the most innovative CRM systems that supports mainly business processes and allows for customization according to your needs. Be ahead of your competition and implement YetiForce!,"crm,crm-platform,crm-system,php,php7,accounts,contacts,workflow,leads,mulit-lang,opportunities,quotes,web-application,yetiforce,erp,open-source,open-source-project,open-source-crm",1075
47,https://github.com/brazilian-utils/brazilian-utils.git,Utils library for specific Brazilian businesses,"cpf,cnpj,brazilian,validator,mask,formatter,cep,boleto,phone,states,email,inscricao-estadual,pis,processo-juridico,boleto-bancario,validador,gerador,estados,generator,format",1039
48,https://github.com/bokmann/business_time.git,Support for doing time math in business hours and days,,991
49,https://github.com/jpmorganchase/python-training.git,Python training for business analysts and traders,"python,jupyter,jupyterlab,binder,binder-ready,data-science,finance,banking",985
50,https://github.com/skerkour/bloom.git,"The simplest way to de-Google your life and business: Inbox, Calendar, Files, Contacts & much more","rust,privacy,vue,vuejs,automation,workspace,drive,files,bloom,cloud,self-hosted,productivity,inbox,calendar,self-hosting,analytics,chat,messaging",982
51,https://github.com/pentaho/mondrian.git,Mondrian is an Online Analytical Processing (OLAP) server that enables business users to analyze large quantities of data in real-time.,"mondrian,olap,java,mdx,database",953
52,https://github.com/mariusandra/insights.git,Open Source Self-Hosted Business Intelligence Platform,"business-intelligence,visualization,data-analytics,kea,react,insights,dashboard,feathersjs",933
53,https://github.com/microsoft/CDM.git,"The Common Data Model (CDM) is a standard and extensible collection of schemas (entities, attributes, relationships) that represents business concepts and activities with well-defined semantics, to facilitate data interoperability. Examples of entities include: Account, Contact, Lead, Opportunity, Product, etc.",,904
54,https://github.com/MarimerLLC/csla.git,A home for your business logic in any .NET application.,"csla,c-sharp,windows-forms,wpf,blazor,xamarin,xamarin-forms,netstandard,asp-net,asp-net-core,asp-net-mvc,uwp,webforms,web-forms,windowsforms,winforms,aspnetcore,aspnet,webassembly,mono",887
55,https://github.com/metasfresh/metasfresh.git,"We do Open Source ERP - Fast, Flexible & Free Software to scale your Business.","metasfresh,javascript,react,java,management,business,erp,manufacturing,accounting,crm,docker-image,spring-boot,postgresql,hacktoberfest",852
56,https://github.com/jsreport/jsreport.git,javascript based business reporting platform :rocket:,"reporting,pdf,excel",818
57,https://github.com/gavenwangcn/vole.git,"SpringCloud Micro service business framework , SpringCloud 微服务商业脚手架","java,springcloud,micro-service",811
58,https://github.com/Tivix/django-cron.git,"Write cron business logic as a Python class and let this app do the rest! It enables Django projects to schedule cron tasks, tracks their success / failures, manages contention (via a cache) etc. Basically takes care of all the boring work for you :-)",,763
59,https://github.com/thelia/thelia.git,Thelia is an open source tool for creating e-business websites and managing online content. Repo containing the new major version (v2),"php,e-commerce,symfony,mysql,thelia",757
60,https://github.com/twilio/OpenVBX.git,OpenVBX is a web-based open source phone system for business.,,695
61,https://github.com/eventuate-local/eventuate-local.git,"The on premise, open source version of Eventuate, which is a platform for developing transactional business applications that use the microservice architecture.",,688
62,https://github.com/Lymphatus/caesium-image-compressor.git,"Caesium is a cross-platform image compression software aimed at helping photographers, bloggers, webmasters, businesses or casual users at storing, sending and sharing digital pictures. Based on libcaesium.","image-compression,caesium,libcaesium,mozjpeg,zopfli,compression,cross-platform",661
63,https://github.com/timeoff-management/timeoff-management-application.git,Simple yet powerful absence management software for small and medium size business (community edition),"web-app,businessapp,employees,absence,timeoff,calendar,node-js,absence-management,employee-absence,sickness,sequelizejs,hr",653
64,https://github.com/opieters/business-card.git,A business card in LaTeX. ,"latex,business-card,xelatex,tex,latex-template",650
65,https://github.com/chrisjpatty/flume.git,Extract business logic from your apps with a user-friendly node editor powered by React.,"react,flume,node,javascript",643
66,https://github.com/rbei-etas/busmaster.git,"BUSMASTER is an Open Source Software tool to simulate, analyze and test data bus systems such as CAN. BUSMASTER was conceptualized, designed and implemented by Robert Bosch Engineering and Business Solutions (RBEI). Presently it is a joint project of RBEI and ETAS GmbH. ",,643
67,https://github.com/firmai/data-science-career.git,"Career Resources for Data Science, Machine Learning, Big Data and Business Analytics Career Repository","data-science,analytics,career,machine-learning,resources,big-data,business-analytics,business-intelligence",641
68,https://github.com/venmo/business-rules.git,Python DSL for setting up business intelligence rules that can be configured without code,,633
69,https://github.com/apache/isis.git,"Apache Isis™ software is a framework for rapidly developing domain-driven apps in Java. Write your business logic in entities, domain services or view models, and the framework dynamically generates a representation of that domain model as a webapp or as a RESTful API. For prototyping or production. ","java,web-framework,domain-driven-design,ddd,rapid-application-development,rad,naked-objects,restful-objects",618
70,https://github.com/funkygao/cp-ddd-framework.git,A lightweight flexible development framework for complex business architecture with full ecosystem！轻量级业务中台开发框架，中台架构的顶层设计和完整解决方案！,"ddd,extension,ddd-architecture,business-architecture,clean-architecture,framework,enterprise-architecture,java,plugin,domain-driven-design,hot-reload,hot-module-replacement,complex-business-architecture,flexible,business-framework,landscape,dddplus,headless-commerce,clean-code,design-patterns",585
71,https://github.com/Widle-Studio/Grocery-App.git,"Flutter Grocery Shopping App (Mobile App, Web App) - Want to develop similar solutions for your business? Connect with us - info@widle.studio Or just submit an inquiry we will connect with you within 24 hours - https://forms.gle/L9EBUnSasYcUAn8Q9","flutter,dart,flutter-apps,ecommerce-application,ecommerce,ecommerce-store,ecommerce-shopping-solution,material-design,material-ui,flutter-material,grocery,flutter-demo,flutter-examples,flutter-material-app,flutter-showcase,flutter-app,flutter-ui,flutter-widget,flutter-web,florida",584
72,https://github.com/firmai/business-machine-learning.git,"A curated list of practical business machine learning (BML) and business data science (BDS) applications for Accounting, Customer, Employee, Legal, Management and Operations (by @firmai)","business-machine-learning,practical-machine-learning,jupyter-notebook,jupyter,example,datascience,machine-learning",582
73,https://github.com/CloudRail/cloudrail-si-android-sdk.git,"Unified API Library for: Cloud Storage, Social Log-In, Social Interaction, Payment, Email, SMS, POIs, Video & Messaging. Included services are Dropbox, Google Drive, OneDrive, OneDrive for Business, Box, Egnyte, PayPal, Stripe,  Google Places, Foursquare, Yelp, YouTube, Vimeo, Twitch, Facebook Messenger, Telegram, Line, Viber, Facebook, GitHub, Google+, LinkedIn, Slack, Twitter, Windows Live, Yahoo, Mailjet, Sendgrid, Twilio, Nexmo, Twizo.",,571
74,https://github.com/adempiere/adempiere.git,"ADempiere Business Suite ERP/CRM/MFG/SCM/POS done the Bazaar way in an open and unabated fashion. Focus is on the Community that includes Subject Matter Specialists, Implementors and End-Users.",,565
75,https://github.com/rinvex/laravel-subscriptions.git,"{""Rinvex Subscribable is a flexible plans and subscription management system for Laravel, with the required tools to run your SAAS like services efficiently. It's simple architecture, accompanied by powerful underlying to afford solid platform for your business.""}","php,laravel,subscriptions,recurring",521
