,Url,Description,Topics,Stars
1233,https://github.com/wbelk/apihelper-for-shopify-docs.git,API Helper simplifies AJAX email sign ups and discount code creation for Shopify.,,1
1234,https://github.com/Pickausernaame/PapaJohns.git,"{""Vouchers downloader. These vouchers give 30% discount for all positions in Papa John's.""}",,1
1235,https://github.com/anachronism/Max-s-Notes-Public.git,Have to update because my student discount is running out lol,,1
1236,https://github.com/willunicamp/nuuvemdiscount.git,Scrapy script to extract games from nuuvem.com with a given discount,,1
1237,https://github.com/flycartinc/woo-discount-rules-compatible.git,Which helps to make woo discount rules compatible with other plugin,,1
1238,https://github.com/LuaDist/lua-discount.git,"A binding to Discount, a fast C implementation of the Markdown text to HTML markup  system.",,1
1239,https://github.com/kpodemski/phdiscountbybankwire.git,Simple solution for having discount automatically applied while paying with a bankwire payment in PrestaShop,,1
1240,https://github.com/xarch/pp.git,PP is a Popular Purchases microservice for the Discount Ascii Warehouse ecommerce platform.,,1
1241,https://github.com/richardswei/ticket-alert.git,A notification system for discount tickets to sports games | v1.0,,1
1242,https://github.com/goodidea0616/scraping-compare-price.git,Compare Price of Argentina Supermarkets with scraping the sales and discount data,,1
1243,https://github.com/pekingstyle/CurveMaker.git,"Make a curve for financial instruments valuation. e.x. Yield Curve, Discount Factor.",,1
1244,https://github.com/Brutus5000/remittance-assigner.git,Simple tool to match a list of invoices against a remittance considering early payment discount,,1
1245,https://github.com/SoftwareEnGroup/Surplus.git,A website to find discounted food about to go to waste,"laravel,php,mysql,html,css,vue",1
1246,https://github.com/dmack6464/NeverBreak.git,A discount version of RealDark that should be immune to Discord updates.,,1
1247,https://github.com/LeonVortmeyer/DiscountedCashFlowModel.git,In Progress: Full Discounted Cash Flow & Trading Comparables (Intrinsic vs. Relative) Valuation for US Public companies.,,1
1248,https://github.com/kalyanparimi/IIM-Captstone-Bank-Loan-Prediction-using-ML.git,Predicting whether or not people tend to opt for a loan over discounted rates,"python,data,datascience,datasciencemachinelearning,tableau",1
1249,https://github.com/ron-amit/Discount_as_Regularizer.git,"Code for the paper ""Discount Factor as a Regularizer in Reinforcement Learning"" ICML 2020",,1
1250,https://github.com/Hkakashi/nintendo-one.git,Nintendo One is a website that keeps you updated with the latest game discount at NS,,1
1251,https://github.com/mayankmardia/QuickDCF.git,Quick and dirty projection of discounted cash flows (DCF) for corporate valuation,,1
1252,https://github.com/CartThrob/Discounts-BuyXGetPercentageOff.git,Adding X number of items to the cart gets you a percentage off discount,,1
1253,https://github.com/KimaruThagna/pyFinance.git,A journey through applying python and numpy for financial analysis and discounting models,,1
1254,https://github.com/ericeijkelenboom/QrCampaign.git,Scan a QR code and get discount. Including admin interface for shop owners. ,,1
1255,https://github.com/AleksZelenchuk/discount_title.git,Magento 2: add suffix to product name after add to cart depending on discount,,1
1256,https://github.com/TaraTritt/dn-auction-dapp.git,Discount Note Auction DApp built with React & Solidity for the Ethereum Network,,1
1257,https://github.com/ShahzainAhmed/Electricity-Bill.git,Java program to create a Electricity Bill with added tax and discount.,,1
1258,https://github.com/Gomavijayan/billingforthings.git,A basic website on billing for products using tax and discount,website-development,1
1259,https://github.com/HabeebCycle/Hotel-App-Spring-Boot.git,"a hotel chain that is building its reservation system and wants to provide its clients with an application to search for and book rooms. The owners of the hotel need to define various business policies to calculate booking rates, such as early booking discounts or last-minute offers. They may need to modify these policies to adapt to different travel seasons and exceptional events, for example. They may also want to add more policies in the future on special offers or loyalty programs.",,1
1260,https://github.com/ZonCon/Ecommerce-Morningmist-IOS.git,"Native IOS Application for Ecommerce (online shopping). Features - Product Catalogue Builder, Product Categories & Product Items, Secure Shopping Cart, Payment Gateway, Comprehensive pricing, availability & taxation, Shipping Locations, Customer Accounts, Exhaustive Discounting & Couponing options, Email-based invoicing, Order Management & Tracking, Push notifications",,1
1261,https://github.com/megedsh/TransactionTaxCalculator.git,"Calculating financial transaction sum and tax (VAT) - supports multiple tax groups and rates, add or extract tax method, global discount percent or global discount amount, positive and negative quantity of items in the same transaction ","tax,vat,vat-validator,vat-rates,financial,pos,point-of-sale,transaction,tax-rates,tax-calculator",1
1262,https://github.com/tadadiop/Streaming-Services.git,Built an app using Angular that allows users to compare streaming services and sign up directly through the app. And allow users to save money for streaming services by comparing active discounts offered by each streaming service,,1
1263,https://github.com/roweyerboat/Northwind_Discounts.git,This project utilizes SQL queries within jupyter notebook to bring together data from the Northwind companies databases. It then uses these queries to analyze and find proposals for how to utilize discounts to incentivize customers. ,"northwind,revenue,discount,sql,python",1
1264,https://github.com/haniyacoub/Directing-Customers-to-Subscription-Through-App-Behavior-Analysis-.git,"{""Find out based upon a customer's app behavior who is likely to NOT enroll in the paid version. The company wants to offer these individuals special discounts, thus increasing their chances to buy the paid version.""}",,1
1265,https://github.com/jeeali/business_finance_app.git,"This App is the example of Discounting Formula in Business Finance. User give the Current Value of the Cash Flow, Rate(Percentage) and the years. The App will generate the graph with Discounting Formula.",,1
1266,https://github.com/iryna-horbachova/LoyalS-mobile-ios.git,"iOS app for users to make check-ins in different places (restaurants, hotels, theatres, etc.) and get coins which can be exchanged for discounts. Utilized Swift, Alamofire, SwiftyJSON and Firebase.",,1
1267,https://github.com/jonsdaniel/Car-Payment-Calculator.git,"iOS application to calculate a monthly payment for a vehicle loan given variable inputs. I created this app to include more specific input fields to consider additional costs for a car purchase (registration, service/protection plans, discounts, etc.). ",,1
1268,https://github.com/IP-CAM/Price-Range-plus-Opencart-v.3.x.git,"The «Price Range+» extension is for Opencart 3.x CMS. It allows to display range of a product prices based on manually entered min/max values or on price, discounts and options of this product.",,1
1269,https://github.com/fawzy-tat/VoucherPool.git,PHP - Project quick task using Slim framework - A voucher pool is a collection of (voucher) codes that can be used by customers (recipients) to get discounts in a web shop,,1
1270,https://github.com/TimothyLks/SellingBooks.git,"Add books from a list to a basket (or remove them). Then calculate the price of the selected book/s, and there will be some discounts applied (depending of the publication date or the sum of the price)",,1
1271,https://github.com/DavidJoshuaK/HotelReservationSchema.git,"I created a relational database meant to represent a hotel reservation system. This database uses bridge tables and one-to-many relationships to keep track of rooms, floors, occupancy, amenities, contact information for guests, reservation dates, room rates, discounts, etc.","sql,mysql-database,relational-databases,many-to-many,one-to-many,one-to-one,normalization",1
1272,https://github.com/JohnatanT/EasyMoney.git," A simple sales system. With this system you can register products, make sales, calculate freight, give discounts for a certain period and still receive by e-mail sales made 💰","php,html5,css3,boo,sass,my,compo,mvc,javascript",1
1273,https://github.com/armancodv/offgard-app.git,"Offgard was an app for showing discounts of local shops, which was active between 2017 and 2018 in Iran. Right now, the code is published publicly to be used for other users.",,1
1274,https://github.com/vishrutkohli/Info-me.git,An android application which uses Beacon technology to give you information of any  good offers(discounts) you are passing by also tells you about various features of historic places and tourist spots.,,1
1275,https://github.com/iThrivLocal/ithrivlocal.git,"Web Series hosted by Will E. & Darling T. that will highlight diverse destinations while giving tangible steps to thrive from local industry professionals, drive traffic to local businesses, and offer discounts from partners.",,1
1276,https://github.com/artem-tkachuk/HackSC.git,Get growing car rental discounts by persistently obeying the speed limits and make confident and reasonable decisions about trusting / not trusting the potential car renter as a car owner ,"google-maps-api,google-cloud-platform,aws-aurora,nodejs,appengine,aws-amplify-react,mysql",1
1277,https://github.com/armancodv/offgard-api.git,"Offgard was an app for showing discounts of local shops, which was active between 2017 and 2018 in Iran. Right now, the code is published publicly to be used for other users.","off,discount,localshop,api,app",1
1278,https://github.com/prashant008/Medical-Vending-Machine.git,"Medicine Vending Machine that deals with the customer as well as the seller. Customers can check the price, available quantity, and generate bills with discounts and taxes. the seller can add a new medicine, check stock, and also can check medicine under stock medicine, and can also add the occasional discount and has features to get daily sales.",,1
1279,https://github.com/Shahaf-F-S/amazon-products-scraper.git,"This program scrapes from amazon website all of the products named in the title of the searching expression. Then, it calculates the discounts of each product and after returning the output of the results and saving them in files, it returns the product with the biggest discount.",,1
1280,https://github.com/RubyHe-hub/B2B-Customized-Pricing-Optimization.git,"Proper discounts could attract more customers, increase sales, and thus increase total revenue. In this case, we would like to optimize the discounts for a B2B company to increase the total expected revenue. The dataset we used contains 1505 records, including information about product type, discount amount, promotion time periods etc. Models are trained on the first 1200 records and the rest is used for evaluation of our result. The expected revenue is calculated by the formula: R=Prob(Y=1│p,d)×(p-d)",,1
1281,https://github.com/IDRob/Bootstrap-Discount-Factor-Curve-with-Cubic-Spline-Interpolator.git,This programme uses market data on par interest rate swaps to bootstrap a discount factor curve using cubic spline interpolation,,1
1282,https://github.com/vjfuenzalida/evalua-bk.git,"{""Selenium Bot built to autimatically answer Burger King (and Mc Donald's) surveys (which gives discount codes).""}",,1
1283,https://github.com/SolankeBhagwat/Shopping-cart.git,"Shopping cart console application contains the base operation required for shopping like selecting product , add to cart, add discount etc.",,1
1284,https://github.com/MANOJMANI07/notificationbanner.git,Notification banner is jQuery plugin which can be used to display discount or some kind of banner in your websites. ,,1
1285,https://github.com/cplpearce/IGA-Price-Checker.git,"{""A simple python script to read all of IGA's online sales and report them by highest discount!""}",,1
1286,https://github.com/annadanilec/angular2shopfront.git,"Shop front-end based on Angular2 with category filter, product view and cart component with discount calculation.",,1
1287,https://github.com/xhuanhuan/Happy-Shopping.git,To provide customers with discount sales about all kinds of brands;this app is based on Vue ,,1
1288,https://github.com/larnzo/Business-Opportunities.git,"ONE STOP Marketing Group. Business Opportunities, Work at Home, Make Money on Internet, Internet Business. Discount Shopping. Save Money",,1
1289,https://github.com/amaan2398/woocommerce-plugin-for-loyalty-based-discount-to-customer.git,This is an Plugin for WooCommerce which is an interface of Loyalty based Discount API to the WooCommerce,,1
1290,https://github.com/mertdusunceli/la-hacks-2018.git,An app that helps restaurants not to waste food by offering them on discount at the times they want,,1
1291,https://github.com/mandarsawant/LocalBanyaScraper.git,"Web crawler + scraper to extract product list with name,price and discounted price. Extracted information is stored in Excel format.",,1
1292,https://github.com/EvgeniyKrasnoshtan/cardApplication.git,This is an add-on that simplifies the creation of discount cards for customers in the NaftaPos program.,"csharp,mysql,winforms,sql",1
1293,https://github.com/Haizanjs/RPFNoSQL.git,An rvExtension designed to allow users to read/write data in an organised manner for their mission data. - Discounted atm.,,1
1294,https://github.com/Karagul/Rational-Asset-Pricing-Model.git,Implementation of Discounting Model under Time-Varying Expected Returns for a term project in ECON406 (Advanced Topics in Microeconomics),,1
1295,https://github.com/Kezzya/dmarketBot.git,"Bot which notifies you (with music) when item with discount >23% is appeared ( but item has some filters: price, relevance)  ",,1
1296,https://github.com/sachinkale/QRcodeMemberScript.git,"scripts for qr code pasted membership card, scanning and adding discount to openbravopos also maintaining database of members",,1
1297,https://github.com/Ahlyab/udemy-course-grabber.git,A program that fetches Udemy coupons with 100% discount from different sites and store it in a text file,,1
1298,https://github.com/KapilKhanal/Sales_Impact.git,"The impact of discount on sales for different categories of customers. Uses statistical techniques like CausalImpact, time series and KMeans. ",,1
1299,https://github.com/jod35/costCalc.git,This is an app that calculates selling prices of products basing on the markup and discount  a seller can offer,,1
1300,https://github.com/phongnt570/ngram-lm.git,"A Python implementation of n-gram language model as a trie. Two available smoothing variants: Lidstone, absolute discounting.","python,language-model,lidstone-smoothing,trie",1
1301,https://github.com/easydigitaldownloads/edd-add-discount-to-payment.git,This plugin for Easy Digital Downloads adds the option to update the discount code recorded on a purchase record.,,1
1302,https://github.com/soratobukuroneko/discount-cpp-wrapper.git,A C++11 wrapper for discount markdown library (http://www.pell.portland.or.us/~orc/Code/markdown/),,1
1303,https://github.com/ladj82/prizebox-slot-machine.git,Advertising solution developed for shopping malls to use kiosk like machines to print discount coupons for customers.,,1
1304,https://github.com/bnc119/point_of_sale.git,"{""This point-of-sale exercise models a checkout terminal that you might find in a grocery store.  The program reads in discount/bulk sale data, and then begins to start 'scanning' items of unique cost/price, applying discounts along the way.  I probably should refactor this code to use ranges.  It would be more idiomatic and expressive than the way I currently have it implemented.  There are a number of RSpec tests written to exercise different aspects of the code.""}",,1
1305,https://github.com/maxt3r/jQuery.payWithTweet.git,"This jQuery ""Pay with a tweet"" plugin lets you ask your users to tweet before they get access to a download, a discount coupon, etc. ",,1
1306,https://github.com/annu12340/deal-finder.git,A simple web scraper that searchs for the price an item in different shopping sites and displays the site with the highest discount,,1
1307,https://github.com/danalain/JP_Morgan_DCF.git,"This repository includes codes for Discounted Cash Flow model using Python. It is a great learning opportunity, but significant improvement is needed for accurate valuation.",,1
1308,https://github.com/olivia-ea/hackthon-project.git,Slashed is a marketplace that provides clothing at a discounted rate for people in need. To visit: http://159.89.154.13:5000/,,1
1309,https://github.com/DivinoIndianMemoirzToursPvtLtd/India-Tour.git,"India Tour – Indian Memoirz offers Best Discount on India Tours,India Tour Packages,India Travel,Indian Travel Packages,India Tour Operator,India Travel Agency",,1
1310,https://github.com/OnlineTattooWholesale/Tattoo-Equipments.git,"Wholesale tattoo supplies & equipment. International tattoo suppliers, Up to 30% discount on wide range of tattoo machines, ink, needles & medical supplies",,1
1311,https://github.com/ShettyGaneshprasad/Amazon-Tracker.git,This app lets you get a notification to your Gmail if your desired products get discount and gets into your budget.,,1
1312,https://github.com/stefanomarra/woocommerce-coupon-url.git,"Wordpress WooCommerce plugin that enables the application of a coupon code from query string parameter ""coupon"" and show discounted product price instead of the regular/sale price",,1
1313,https://github.com/Gabriel2233/Discounter.git,"App made to list discount codes released in many online websites, related to many fields such as education, tech, shopping, food and many more","reactjs,nextjs,typescript,styled-components,graphql,cms,framer-motion",1
1314,https://github.com/shagumnic/shagumSite.git,A website that notifies you when there is a discount for a game on Steam or when a game has been released,,1
1315,https://github.com/sucksido/online_store_hhpty.git,"This is an online shop application that allows user to purchase 1 item at a time, it also offers discount on higher prices",,1
1316,https://github.com/KMiller67/Walmart_Webscrape.git,"{""Web scraping script using Python's BeautifulSoup package to scrape Walmart clearance electronics products, current price, old price, and the amount of the discount.""}",,1
1317,https://github.com/ADudija/OpenCart-Specific-Payment-Discount.git,This extension can be used to apply a certain discount to customers who choose to pay for your products using your specified payment method.,"payment,discount",1
1318,https://github.com/JaxtonHale/DCF-Machine.git,A Python3 project that utilizes yfinance to read a list of stocks and pick those that meet appropriate discounted cash flow criteria. WIP,,1
1319,https://github.com/ryonsmth/Malaysia-Flights.git,Compare and book best deals on Malaysia Flights  Also get flights availability information avail Malaysia Flights  Discount Deals and Special airfare offers.,,1
1320,https://github.com/makiisthenes/mcdonaldsVoucherCodeGenerator.git,From the code on McDonalds UK reciept will autocomplete customer experience survey and output the the voucher code used for discounted food... saves time.,,1
1321,https://github.com/anujpahade/Ad2Charity.git,A chrome extension that incentivizes users to donate to charity/relief funds by giving them discount on any purchase by watching a short ad video.,,1
1322,https://github.com/lukecalderon/micros-simphony-eotho.git,SIM Script & Detail on how to setup the UK Government Eat Out to Help Out discount on Micros Simphony (Version 2.7 +),,1
1323,https://github.com/fortuneshi/classiced-hardy.git,"2010 New Style  Ed Hardy Clothing For Sale! Buy Cheap &amp; Discount Ed Hardy Clothing From Classicedhardy Online Shop. 75% OFF, FREE Shipping Worldwide!",,1
1324,https://github.com/ShettyGaneshprasad/AmazonTracker-DEAL.git,This app lets you get a notification to your Gmail if your desired products get discount and gets into your budget.,,1
1325,https://github.com/JeanCG7/WebScraping.git,"{"".Net Core Console Application that scrap Pelando's website (products in discount) and generate a .CSV file with product's name, price, comments quantity, temperature* and link""}",,1
1326,https://github.com/ariss95/discount_notifier.git,"a python script to produce desktop notifications when there is a discount in products i like from a shoes shop, using notify2, requests_html and beautifulSoup4","python3,notify2,bs4",1
1327,https://github.com/sitekwb/eshop-prediction.git,"Deciding, to whom we should give a discount in Internet shopping platform. Machine Learning Engineering (IUM) project for WUT, Poland. By @maciejkasprzyk and @sitekwb",,1
1328,https://github.com/vijays91/Magento-Custom-Fee.git,This extension is used to add the custom fee like additional Credit Card Fee or Gift Pack Free or Affiliate Discount or any other order total.,,1
1329,https://github.com/MirjalolRakhmonov/Online-Daily-Goceries.git,"A nice clean #Online Grocery Store app #UI by using #Android studio, where you can show up all items by category, recently visited and most discounted.",,1
1330,https://github.com/SatvikVejendla/TicTacToe-AI.git,A simple Q-learning Reinforcement Learning TicTacToe AI which uses the Epsilon Greedy and Gamma Discount Factor algorithms to simulate neuroevolution,,1
1331,https://github.com/ionescuvlad97/black-friday-app.git,Non-official application that determines whether the prices of discounted Black Friday products on Altex are really lower than usual. Disclaimer: Developed for educational purposes only.,,1
1332,https://github.com/alinolandry/EXTREMUM.git,"EXTREMUM is a complete financial mathematics application. This application will allow you to achieve all your financial mathematical operations. You can calculate the interest, the discount ...",,1
1333,https://github.com/mciotola/func_simp_bubble.git, Simple bubble model generator utilizing efficiency-discounted exponential growth functions. This is a Ruby only program (no Rails). Run it from a Linus/Unix command line.,,1
1334,https://github.com/Ranmal-Dewage/Public-Transport-Ticketing-System.git,"Ticketing System for a Public Transport Network with features such as Social Logins, View Real-Time Ticket Availability, Email and SMS Notification, Discount Schema and Admin Panel.","javascript,reactjs,nodejs,expressjs,twilio-sms-api,public-transportation,e-ticket,qrcode-generator,admin-dashboard,email-notifications,sms-notifications,report-generation",1
1335,https://github.com/Shivam720855/shopkeeperbilldesc.git,this is a window form appicatiaon  that is help a shopkeepr to print bill of item and calulate price and discount ,,1
1336,https://github.com/gemstone-zz/Gemstone-Beads.git,J-beads is wholesale gemstone beads supplier and exporter. Offer quality precious and semi precious beads with 20% EXTRA GOODS DISCOUNT.,,1
1337,https://github.com/araitatsuya/Foundamental.git,Quick and dirty fundamental analysis based on P/E and P/BV. You may find some discount stocks out of S&P 500. ,,1
1338,https://github.com/vijays91/Magento-Custom-Product-List.git,"Display the selected category in front end page, its useful for displaying special offer,discount and deal products in this page.",,1
1339,https://github.com/rishabh89007/DCF.git,"A Step-by-step guide on how to build a sturdy discounted cash flow model to calculate NPV, IRR, Payback Period and Multiple Invested Capital (MOIC) using Python.",,1
1340,https://github.com/TutorExilius/Costimizer.git,Optimize your shopping by comparing your shopping prices of each item from different discounters and generate your next shopping list on the basis of your acknowledgment,,1
1341,https://github.com/BiggT76/DiscountDemo.git,This is a Blazor Wasm application running on .NET 5 RC-1.  It will demonstrate the use of SOLID techniques to implement a reusable discount calculation engine. ,,1
1342,https://github.com/sofandani/BingoDeals.git,"Bingo is an innovative smart phone app uses android with GPS technology which helps user to get daily updates such as deals/discounts from hotels, restaurants, cafes, movie theatres, super markets or virtually anything near according to his/her current location.",,1
1343,https://github.com/AgustinMachiavello/bolsitapp-react-native.git,"{""'Bolsitapp' saves you money everytime you use a recyclable bag whenever you go shopping. Scan your bag, and save points for scpecial offers and discounts. This app accumulates points by helping to reduce the amount of plastic bags on the market :)""}",,1
1344,https://github.com/Samanta7080/SamantaCashBack.git," Hi, I’ve been using CashbackEarners.co.uk to save money online and I think you should start using it as well! If you sign up now you will instantly receive 6.50 CashCoins!  Click or copy and paste the link into your browser to get discounts when shopping:  https://www.cashbackearners.co.uk/u/1173225   Make money with CashbackEarners!  Best wishes,  Samanta Braziuliene",,1
1345,https://github.com/GabrielOprea/Toy-Store.git,"A program used for working with CSV files of products for a toy store. Once run, it acts as a command-line terminal, allowing the user to change the store currency, add some discounts, add a new currency, list all the products in the store and much more.",,1
1346,https://github.com/austinschrader/console-bakery-app.git,"{""C# & .NET program that allows the user to order Bread/Pastries from Pierre's Bakery. The program will prompt the user for how many loaves of bread and how many pastries they would like to buy. The program then takes those two inputs and calculates the order total for the customer - including Buy Two, Get One Free discounts.""}",,1
