,Url,Description,Topics,Stars
901,https://github.com/agusmakmun/django-address-model.git,"django abstract model that provide the complete address, eg: no, na/rt, ca/rw, village/desa, sub district/kecamatan, district/kabupaten, province, country, postal code, currency code, phone code, etc.","django,django-models,django-address,django-address-model,django-plugin",8
902,https://github.com/sahelahmd/Cryptocurrency-Market-Stats-Web-Application-Tracker.git,"A Cryptocurrency market tracker with the tracking and data compiled of over 1500 cryptocurrencies.  Users are able to view market data, prices, charts, rankings, and more on any device browser, with active tracking of currency information. An application interacting with the web application was also created for android. ",,8
903,https://github.com/drbh/wasm-bellman-ford.git,🚤 Fast WASM+Rust Bellman-Ford implementation. Bellman Ford is an efficient way to detect negative cycles in a fully connected graph which can surface arbitrage opportunity in multi currency trading pairs 💱,,8
904,https://github.com/FSharesLab/fsc.git,"{""FutureSharesChain Core，Futuredex is a non-profit decentralized trading platform based on DPOS PBFT consensus public chain technology. The realization of the full-currency cryptocurrency transaction can be permanently traced, the transaction can not be falsified, and the three-party trust relationship between the trading platform party, the blockchain project party and the cryptocurrency investor is solved, so that every transaction of the cryptocurrency investor can be found. Real decentralized community play to absorb quality projects. We adhere to the principle of fair, open and fair service, and take the benign development of quality projects and the safety of users' investment.""}",,8
905,https://github.com/grengojbo/python-money.git,Primitives for working with money and currencies in Python,,7
906,https://github.com/hfgcoding/01_01_currency_reloaded.git,Exercise 01 - currency converter reloaded,,7
907,https://github.com/nyxpay/nyx.git,NNOVATIVE and DECENTRALIZED crypto currency,"masternode,cryptocurrency,neoscrypt,bitcoin,nyxcoin",7
908,https://github.com/karkranikhil/react-dashboard.git,Crypto currency Dashboard using React.js,"react,dashboard,styled-components,highcharts,cryptocompare-api,lodash,async,cssgrid,fuzzy-search,localstorage",7
909,https://github.com/arpitbatra123/CurrencyConverter.git,"🤑 Currency Converter, an Android Application to Convert between different currency formats.","android,api,json,java",7
910,https://github.com/myarchive/meteor-currencies.git,Currencies package for Meteor,,7
911,https://github.com/CapsLock-Studio/crypto-miner.git,Crypto currencies miners management platform built with Laravel,,7
912,https://github.com/chovy/crypto-icons.git,"Crypto currency icons, including font icon files.",,7
913,https://github.com/bismuthfoundation/BismuthRPC.git,[Released] A Json-RPC Server for Bismuth Crypto Currency ,"bismuth,crypto,python,json-rpc",7
914,https://github.com/muatik/financial-crawler.git,"clients for crude oil, stock price, parrities and currencies",,7
915,https://github.com/PlayerNguyen/OptEco.git,Paper/Spigot/Bukkit Points System Currency for your server,"placeholderapi,spigot,mysql,opteco,bukkit,papermc",7
916,https://github.com/NearHuscarl/py-currency.git,"A python library to convert currency, prettify price and get various currency info","currency-converter,currency,money",7
917,https://github.com/aisayko/django-xe-currencies.git,Django currencies REST api. Allows a conversions beetween currencies rates. Integrated with XE api.,,7
918,https://github.com/outlaylol/BotFarmer.git,Selfbot which gains currencies from other bots automatically.,,7
919,https://github.com/Baizey/UniversalAutomaticCurrencyConverter.git,A currency converter for chrome and firefox which supports a large amount of currencies and can automatically convert websites,,7
920,https://github.com/spree/spree.git,"Open Source multi-language/multi-currency/multi-store E-commerce platform for Ruby on Rails with a modern UX, PWA frontend, REST API, GraphQL, several official extensions, and 3rd party integrations. ","spree,spreecommerce,rails,ecommerce,e-commerce,ruby,rubyonrails,cart,headless-commerce,ecommerce-platform,store,shop,spree-commerce,graphql",11232
921,https://github.com/dogecoin/dogecoin.git,very currency,,9100
922,https://github.com/dillidon/alerts-and-pickers.git,"Advanced usage of UIAlertController and pickers based on it: Telegram, Contacts, Location, PhotoLibrary, Country, Phone Code, Currency, Date...","uialertcontroller,picker,image-picker,pickerview,textfield,datepicker,swift,uitextfield,alert,color-picker,login,signin,country-picker,currency-picker,phonecode,telegram-picker,telegram,contacts,location,map",5123
923,https://github.com/openexchangerates/accounting.js.git,"A lightweight JavaScript library for number, money and currency formatting - fully localisable, zero dependencies.",,4694
924,https://github.com/input-output-hk/cardano-sl.git,Cryptographic currency implementing Ouroboros PoS protocol,"haskell,stake-blockchain-protocol,cryptocurrency",3575
925,https://github.com/Zheaoli/awesome-coins.git,₿ A guide (for humans!) to cryto-currencies and their algos.,"cryptocurrency,algorithms,bitcoin,ethereum,awesome,awesome-list,coin,wallet,algo,nicehash,btc,guide,documentation,kennethreitz",3322
926,https://github.com/bitpay/wallet.git,Bitpay Wallet (formerly Copay) is a secure Bitcoin and other crypto currencies wallet platform for both desktop and mobile devices.,"bitcoin,wallet,hardware-wallet,wallet-service,blockchain,copay,bitpay",3200
927,https://github.com/fixerAPI/fixer.git,A foreign exchange rates and currency conversion API,"foreign-exchange-rates,ruby,currencies,exchange-rate,historical-rates,money",2526
928,https://github.com/RubyMoney/money.git,A Ruby Library for dealing with money and currency conversion.,"money,exchange-rate,ruby",2393
929,https://github.com/scurker/currency.js.git,A javascript library for handling currencies,"currency-values,javascript,javascript-library,money,currency",2003
930,https://github.com/countries/countries.git,"All sorts of useful information about every country packaged as convenient little country objects. It includes data from ISO 3166 (countries and states/subdivisions ), ISO 4217 (currency), and E.164 (phone numbers).",,1657
931,https://github.com/autoNumeric/autoNumeric.git,autoNumeric is a standalone library that provides live as-you-type formatting for international numbers and currencies. ,"autonumeric,javascript,javascript-library,maskedinput,inputmask",1572
932,https://github.com/antonioribeiro/countries.git,Laravel countries and currencies,"laravel,laravel-countries,countries,languages,timezones,states,php",1487
933,https://github.com/openexchangerates/money.js.git,"money.js is a tiny (1kb) javascript currency conversion library, for web & nodeJS",,1397
934,https://github.com/rinvex/countries.git,"Rinvex Country is a simple and lightweight package for retrieving country details with flexibility. A whole bunch of data including name, demonym, capital, iso codes, dialling codes, geo data, currencies, flags, emoji, and other attributes for all 250 countries worldwide at your fingertips.","php,countries,capitals,flags",1372
935,https://github.com/dr5hn/countries-states-cities-database.git,"🌍 World countries, states, regions, provinces, cities, towns in JSON, SQL, XML, PLIST, YAML, and CSV. All Countries, States, Cities with ISO2, ISO3, Country Code, Phone Code, Capital, Native Language, Timezones, Latitude, Longitude, Region, Subregion, Flag Emoji, and Currency. #countries #states #cities","cities,countries,states,city,state,country,json,sql,regions,region,world-regions,plist,xml,csv,yaml,countries-states-cities,country-state-city,mysql,api,provinces",1303
936,https://github.com/winauth/winauth.git,Authenticator on Windows for Battle.net / Steam / Guild Wars 2 / Glyph / Runescape / SWTOR / Bitcoin and digital currency exchanges,,1265
937,https://github.com/florianv/swap.git,:currency_exchange: Currency exchange rates library,"php,currency,exchange-rates,currency-exchange-rates,money,currency-exchange,currency-converter,currency-rates",1207
938,https://github.com/realadvisor/rifm.git,"React Input Format & Mask, tiny (≈800b) component to transform any input component into formatted or masked input. Supports number, date, phone, currency, credit card, etc",,1144
939,https://github.com/jmfernandes/robin_stocks.git,"This is a library to use with Robinhood Financial App. It currently supports trading crypto-currencies, options, and stocks. In addition, it can be used to get real time ticker information, assess the performance of your portfolio, and can also get tax documents, total dividends paid, and more. More info at","robinhood-api,robinhood-python,trading,quantitative-finance,trading-api,robinhood,robinhood-portfolio,cryptocurrency,trading-algorithms,stock-trading,stock-market,options-trading",1063
940,https://github.com/garethdmm/gryphon.git,"Powerful, proven, and extensible framework for building trading strategies at any frequency, with a focus on crypto currencies. Battle-tested with billions traded.",,999
941,https://github.com/danthorpe/Money.git,Swift value types for working with money & currency,,927
942,https://github.com/bitcoin-abe/bitcoin-abe.git,Abe: block browser for Bitcoin and similar currencies,,914
943,https://github.com/plentz/jquery-maskmoney.git,jQuery plugin to mask data entry in the input text in the form of money (currency).,,909
944,https://github.com/brick/money.git,A money and currency library for PHP,"php,money,currency,exchange-rates,currency-converter",891
945,https://github.com/manu354/cryptocurrency-arbitrage.git,A cryptocurrency arbitrage opportunity calculator. Over 800 currencies and 50 markets.,"arbitrage-opportunity,trading-bot,cryptocurrency,altcoins,ethereum,cryptocurrency-arbitrage,bitcoin,litecoin",854
946,https://github.com/apple/swift-system.git,Swift System provides idiomatic interfaces to system calls and low-level currency types.,,836
947,https://github.com/Flight-School/Money.git,"A precise, type-safe representation of a monetary amount in a given currency","swift,money,currency,decimal,gyb",834
948,https://github.com/sebastianbergmann/money.git,"{""Value Object that represents a monetary value (using a currency's smallest unit).""}",,740
949,https://github.com/rsvp/fecon235.git,Notebooks for financial economics. Keywords:  Jupyter notebook pandas Federal Reserve FRED Ferbus GDP CPI PCE inflation unemployment wage income debt Case-Shiller housing asset portfolio equities SPX bonds TIPS rates currency FX euro EUR USD JPY yen XAU gold Brent WTI oil Holt-Winters time-series forecasting statistics econometrics,"jupyter-notebook,pandas,federal-reserve,gdp,inflation,housing,equities,bonds,fx,gold,time-series,econometrics,statistics,asset-pricing,finance,interest-rates,economics,employment,python,fecon236",718
950,https://github.com/vuejs-tips/v-money.git,Tiny (<2k gzipped) input/directive mask for currency,,682
951,https://github.com/annexare/Countries.git,"Countries, Languages & Continents data (capital and currency, native name, calling codes).","countries,country-codes,json,sql,iso3166,csv,currencies,continent,capital,locales,language,emoji,typings,iso639,iso639-1,iso3166-1,calling-codes,language-codes,umd,es5",673
952,https://github.com/turtlecoin/turtlecoin.git,"{""TurtleCoin is a decentralized Peer-2-Peer open source electronic currency. It's easy to get, completely private, and ready for you today.""}",,672
953,https://github.com/bonesoul/CoiniumServ.git,Next-gen crypto currency mining pool software,"bitcoin,csharp,stratum,pool,server,vardiff,pool-server,scrypt,payment,cryptocurrency",662
954,https://github.com/leekchan/accounting.git,money and currency formatting for golang,,649
955,https://github.com/datasets/country-codes.git,"Comprehensive country code information, including ISO 3166 codes, ITU dialing codes, ISO 4217 currency codes, and many others",,645
956,https://github.com/webpatser/laravel-countries.git,"Laravel Countries is a bundle for Laravel, providing Almost ISO 3166_2, 3166_3, currency, Capital and more for all countries.",,645
957,https://github.com/JerBouma/FinanceDatabase.git,"This is a database of 180.000+ symbols containing Equities, ETFs, Funds, Indices, Futures, Options, Currencies, Cryptocurrencies and Money Markets.","finance,database,financials,analysis,equities,etfs,funds,indices,futures,options,currencies,cryptocurrencies,fundamental-analysis,sector-analysis,fundamentals,stock-data,stock-market",638
958,https://github.com/osrec/currencyFormatter.js.git,A super simple currency formatting library,,635
959,https://github.com/yam-finance/yam-protocol.git,A stablizing reserve currency protocol,,599
960,https://github.com/miaolz123/samaritan.git,An Algorithmic Trading Framework for Digital Currency.,"trading-bot,algorithmic-trading-engine,bitcoin",545
961,https://github.com/JECSand/yahoofinancials.git,"A powerful financial data module used for pulling data from Yahoo Finance. This module can pull fundamental and technical data for stocks, indexes, currencies, cryptos, ETFs, Mutual Funds, U.S. Treasuries, and commodity futures.","stock-data,yahoo-finance,financial-data,stock-quotes,fundamentals,cryptocurrencies,forex,commodities,etfs,mutual-funds,bonds",537
962,https://github.com/jjxtra/ExchangeSharp.git,"ExchangeSharp is a powerful, fast and easy to use .NET/C# API for interfacing with many crypto currency exchanges. REST and web sockets are supported.","cryptocurrency,api,csharp,bitfinex,bitstamp,gdax,poloniex,gemini,bittrex,exchange,kraken,bitstamp-api,bittrex-api,gdax-api,poloniex-api,kraken-exchange-api,bitcoin,ethereum,bithumb,blockchain",519
963,https://github.com/zack-bitcoin/basiccoin.git,The smallest currency I can make,,503
964,https://github.com/OpenBookPrices/country-data.git,"Country related data such as ISO codes, currencies etc",,472
965,https://github.com/Crypto-toolbox/bitex.git,Crypto-currency Exchange API Framework,"framework,api-wrapper,endpoint-communication,crypto-exchanges,exchange,crypto-currency-exchanges,python3",459
966,https://github.com/wlox/wlox.git,"Fully functional multi-currency Bitcoin exchange, adaptable to other cryptocurrencies.",,410
967,https://github.com/coinfoundry/miningcore.git,Miningcore is a high-performance Mining-Pool Engine that runs on Linux and Windows and supports a variety of crypto-currencies.,"mining-pools,mining-software-repositories,bitcoin,litecoin,monero,ethereum,zcash",402
968,https://github.com/bitrich-info/xchange-stream.git,XChange-stream is a Java library providing a simple and consistent streaming API for interacting with Bitcoin and other crypto currency exchanges via WebSocket protocol.  It is build on top of of XChange library providing new interfaces for streaming API. User can subscribe for live updates via reactive streams of RxJava library.,"xchange,xchange-stream,streaming-api,bitcoin,websocket",402
969,https://github.com/FellowTraveler/Open-Transactions-old.git,"{""Open-Transactions democratizes financial and monetary actions. You can use it for issuing currencies/stock, paying dividends, creating asset accounts, sending/receiving digital cash, writing/depositing cheques, cashier's cheques, creating basket currencies, trading on markets, scripting custom agreements, recurring payments, escrow, etc.  Open-Transactions uses strong crypto. The balances are unchangeable (even by a malicious server.) The receipt history is destructible. The transactions are unforgeable. The cash is unlinkable. The cheques are non-repudiable. Etc.""}",,400
970,https://github.com/MicroPyramid/forex-python.git,"Foreign exchange rates, Bitcoin price index and currency conversion using ratesapi.io","python,package,bitcoin,currency,currency-exchange-rates,currency-converter",396
971,https://github.com/Ekliptor/WolfBot.git,Crypto currency trading bot written in TypeScript for NodeJS,"typescript,webpack,webpack3,html5,html,nodejs,javascript,css,bitcoin,cryptocurrency,cryptocurrencies,trading,trading-bot,trading-strategies,trading-algorithms,ethereum,exchange,trade,bitmex,deribit",383
972,https://github.com/kipcole9/money.git,Elixir implementation of Money with Currency ,,367
973,https://github.com/kevinongko/vue-numeric.git,Input field component to display a formatted currency value based on Vue.js,"vue,vue-numeric,numeric,input,currency,vue2,maskedinput,currency-prefix,separator-symbol,money",353
974,https://github.com/xxczaki/cashify.git,"💸 Lightweight currency conversion library, successor of money.js","cashify,money,moneyjs,cash,currency,rates,currency-rates,exchange,currency-exchange,convert,converter,convert-currencies,convert-currency-rates,npm,package,open-exchange-rates,fixer,exchange-rates",334
975,https://github.com/BlacKCaT27/CurrencyEditText.git,A module designed to encapsulate the use of an Android EditText field for gathering currency information from a user. Supports all ISO-3166 compliant locales/currencies.,,321
976,https://github.com/mukeshsolanki/country-picker-android.git,"A simple library that displays a beautiful list of all the countries allowing the user to pick the country he wishes and provide details like country code, iso code name,currency and flag.","country-picker,country,gradle,android,android-development",321
977,https://github.com/pariz/gountries.git,"Gountries provides: Countries (ISO-3166-1), Country Subdivisions(ISO-3166-2), Currencies (ISO 4217), Geo Coordinates(ISO-6709) as well as translations, country borders and other stuff exposed as struct data.",,309
978,https://github.com/dm4t2/vue-currency-input.git,Easy input of currency formatted numbers for Vue.js.,"vue,currency-format,input-mask,i18n",306
979,https://github.com/florianv/laravel-swap.git,:dollar: Currency exchange rates for Laravel and Lumen,"php,exchange-rates,laravel,currency-exchange-rates,lumen,currency,currency-converter,currency-rates",301
980,https://github.com/py-moneyed/py-moneyed.git,Provides Currency and Money classes for use in your Python code.,"python,money",299
981,https://github.com/thenewboston-developers/Account-Manager.git,Account manager desktop application for thenewboston digital currency.,,297
982,https://github.com/jin5354/alfred3-workflow-CurrencyConvert.git,This alfred3 workflow can convert currency conveniently.,,297
983,https://github.com/benschwarz/currency.io.git,"An offline-capable, html5 currency converter app for the iPhone",,295
984,https://github.com/akaunting/laravel-money.git,Currency formatting and conversion package for Laravel,"php,laravel,money,currency,currency-converter,akaunting",285
985,https://github.com/balance-io/balance-open.git,Balance Open: A GPL3-licensed macOS menu bar app for all the world’s currencies.,"swift,bitcoin,bitcoin-wallet,ethereum,ethereum-dapp,macos,mac,iphone,ios",279
986,https://github.com/jammy928/CoinExchange_CryptoExchange_Java.git,"The best Java open source crypto currency exchange platform, bitcoin exchange based on Java | BTC exchange | ETH exchange | digital currency exchange | trading platform | matching trading engine. This project is based on the development of Spring Cloud microservices and can be used to build and secondary development of digital currency exchanges. It has a complete source code for matching trading engines, back-end management (back-end + front-end), front-end (transaction page, activity page, personal center, etc.), Android APP source code, Apple APP source code, currency wallet RPC source code. Contact Email: 877070886@qq.com","cryptocurrency-exchanges,coinexchange,otc,cryptocurrency",278
987,https://github.com/Torann/laravel-currency.git,This provides Laravel with currency functions such as currency formatting and conversion using up-to-date exchange rates.,,269
988,https://github.com/JPStrydom/Crypto-Trading-Bot.git,Automated Bittrex crypto-currency technical analysis and trading tool,"bittrex,bittrex-api,crypto-signals,crypto-currencies,crypto,bitcoin,etherium,trading,trading-bot,technical-analysis",266
989,https://github.com/JavaMoney/jsr354-api.git,JSR 354 - Money and Currency API,"java,money,jcp,jsr,jsr-spec,currency,standard,units,jsr354,javamoney",264
990,https://github.com/kennethreitz/coinbin.org.git,₿ A Human–Friendly API Service for Crypto Currency Information.,"bitcoin,btc,eth,ethereum,ripple,litecoin,api,for-humans,kennethreitz",253
991,https://github.com/duniter/duniter.git,Crypto-currency software to manage libre currency such as Ğ1. Mirror of:,"duniter,cryptocurrencies,libremoney,wot",249
992,https://github.com/techbanca/coinai.git,"Seed applications based on AI for digital currency quantitative analysis, medium-term forecast and asset allocation for the secondary market of the BANCA community",,240
993,https://github.com/bojanz/currency.git,Currency handling for Go.,,239
994,https://github.com/umpirsky/currency-list.git,:moneybag: List of all currencies with names and ISO 4217 codes in all languages and all data formats.,,239
995,https://github.com/kwn/number-to-words.git,Number to string standalone PHP library with i18n. Drivers for numbers and currency included.,"number-transformer,currency-transformer,number-to-words,number,string",238
996,https://github.com/diem/website.git,Libra’s mission is to enable a simple global currency and financial infrastructure that empowers billions of people.,,237
997,https://github.com/lhartikk/GenesisH0.git,SHA256/scrypt/X11/X13/X15 genesis blocks for virtual currencies,,233
998,https://github.com/bengourley/currency-symbol-map.git,A function to lookup the currency symbol for a given currency code,,233
999,https://github.com/unterstein/binance-trader.git,Experimental trading bot for crypto currency on Binance.com,"binance,trade,bot,trading,java",231
1000,https://github.com/toorop/go-bittrex.git,Go  binding for the Bittrex crypto-currency exchange API.,,229
1001,https://github.com/mazipan/vue-currency-filter.git,🍒 Lightweight vue currency filter based on accounting.js,"vue,vue2,vue-filters,vue-currency,vue-filter-currency,vue-currency-filter",228
1002,https://github.com/aktau/gofinance.git,"Financial information retrieval and munging (stocks, ETFs, funds, currencies, ...). Libs and app written in golang. Uses multiple datasources: Yahoo Finance, Bloomberg, et cetera.",,227
1003,https://github.com/flyingcircusio/pycountry.git,"A Python library to access ISO country, subdivision, language, currency and script definitions and their translations.",,220
1004,https://github.com/BirdAPI/Google-Search-API.git,"Python based api for searching google web, images, calc, and currency conversion.",,212
1005,https://github.com/currency-cop/currency-cop.git,👮💸 Currency Cop is the net worth calculator for Path of Exile,"pathofexile,currency",209
1006,https://github.com/cesarrew/ng2-currency-mask.git,A very simple currency mask directive that allows using a number attribute with the ngModel.,,205
1007,https://github.com/yqh231/CoinQuantitave.git,Digital currency quantitative trading,"go,bitcoin,quantitative-trading",201
1008,https://github.com/smirzaei/currency-formatter.git,[NOT ACTIVELY MAINTAINED] A simple Javascript utility that helps you to display currency properly,,197
1009,https://github.com/carlospalol/money.git,Python money class with optional CLDR-backed locale-aware formatting and an extensible currency exchange solution.,,196
1010,https://github.com/meritlabs/merit.git,"{""Merit aims to be the world's most adopted digital currency.""}","merit,digital-currency,wallet,blockchain",196
1011,https://github.com/currencybot/open-exchange-rates.git,Open Exchange Rates API - free / open source hourly-updated currency data for everybody,,194
1012,https://github.com/chathudan/CountryCodePicker.git,"{""Android CountryCodePicker will help users to  search and select a country and retrieve selected country's country name,code,currency and dial code (Sri Lanka,LK,LKR,+94)""}","java,android,countrycodepicker",191
1013,https://github.com/scrapinghub/price-parser.git,Extract price amount and currency symbol from a raw text string,,188
1014,https://github.com/HandlebarLabs/currency-converter-starter.git,Code for the React Native Basics: Build a Currency Converter Course,,183
1015,https://github.com/CoinSpace/CoinSpace.git,Coin Crypto currency wallet,,181
1016,https://github.com/RubyMoney/google_currency.git,Ruby Money::Bank interface for the Google Currency exchange data,,181
1017,https://github.com/jsillitoe/react-currency-input.git,React component for inputing currency amounts,"currency,react,javascript,es6",179
1018,https://github.com/unitusdev/unitus.git,"Source for Unitus - a merged mined, multi-algorithm crypto-currency.",,175
1019,https://github.com/sthewissen/Mynt.git,"An Azure Functions-based crypto currency trading bot; featuring 10 exchanges, 25 indicators, custom strategy support, backtester and more","cryptocurrency,bot,trading-bot,trading-algorithms,trading-strategies,azure-functions,csharp",174
1020,https://github.com/xxczaki/cash-cli.git,💰💰 Convert currency rates directly from your terminal!,"exchange,rates,currency,javascript,exchange-rates,cli,terminal,nodejs,npm,npm-package,open-source,money,currencies,convert-currency-rates,cash-cli,xo,fixer-io",167
1021,https://github.com/brandonrobertz/BitcoinTradingAlgorithmToolkit.git,"A framework for logging, simulating, and analyzing prices of currencies on various exchanges using technical analysis, fuzzy logic, and neural networks.",,167
1022,https://github.com/nbfontana/ngx-currency.git,📦 Currency mask module for Angular,"angular,angular2,components,currency,mask,money,aot,firefox,chrome,directive",163
