,Url,Description,Topics,Stars
448,https://github.com/mariazevedo88/travels-java-api.git,"An API for travel management. It is built with Java, Spring Boot, and Spring Framework. A toy-project to serve as a theoretical basis for the Medium series of articles I wrote about Java+Spring.","java,java11,java-11,api,api-service,api-restful,rest-api,rest,medium-article,http,http-rest-api,restful-api,swagger-api,swagger-documentation,java-api,java-api-for-restful-web-services,java-rest-api,java-restful-api,spring-boot,spring-framework",94
449,https://github.com/stormpath/stormpath-sdk-node.git,Official Node.js SDK for the Stormpath User Management REST API,,94
450,https://github.com/contentjet/contentjet-api.git,Headless API-first content management system,"headless,headless-cms,cms,api-first-cms,rest-api,node,koa2,objectionjs,api",92
451,https://github.com/gravitee-io/gravitee-management-rest-api.git,Gravitee.io - API Management - Management Rest API,,90
452,https://github.com/bkjones/pyrabbit.git,A Python module to communicate w/ the RabbitMQ HTTP Management API,,89
453,https://github.com/Azure-Samples/Serverless-APIs.git,Guidance for building serverless APIs with Azure Functions and API Management.,,88
454,https://github.com/fortinet-solutions-cse/fortiosapi.git,Python library aimed to be used by configuration management system using Fortigate/Fortios devices (REST API),"fortigate,vdom,fortiosapi-library",88
455,https://github.com/cyberark/epv-api-scripts.git,"These API scripts enable CyberArk users to automate privileged account management task like account creation, user management, and more.","rest-api,privileged-access-security,privileged-access-management,powershell-scripts,automation",87
456,https://github.com/minhtc/react-recontext.git,"A lightweight state management inspired by Flux, Redux, based on the latest React Context API.","react,react-native,redux,contex,react-context,flux,state-management,state,reactjs,lightweight",85
457,https://github.com/googleads/googleads-adsense-examples.git,Samples for the AdSense Management API,,84
458,https://github.com/JeremyGrosser/repoman.git,A reprepro and pbuilder management API with a RESTful interface,,84
459,https://github.com/PixarAnimationStudios/ruby-jss.git,"ruby-jss is a Ruby framework for interacting with the REST API of the JAMF Software Server (JSS), the core of Jamf Pro, an enterprise-level management tool for Apple devices from JAMF Software, LLC. The module abstracts API objects as Ruby classes, which interact to allow simpler automation of Jamf-related tasks.",,84
460,https://github.com/csinghdev/laravel-starter.git,"Laravel starter project with JWT + Auth APIs + Registration, Email Verification and Forgot Password APIs + Response Management + Backup Management + API Logging + Laravel Telescope + TDD environment setup","laravel,apis,rest-api,authentication,backup,jwt,tdd",81
461,https://github.com/kubernetes-sigs/cluster-api-provider-digitalocean.git,The DigitalOcean provider implementation of the Cluster Management API,k8s-sig-cluster-lifecycle,79
462,https://github.com/BosNaufal/vue-freeze.git,Simple state management whitout bloating API and Concept for Vue.js.,,77
463,https://github.com/only2dhir/angular6-example.git,"In this article we will be building an Angular 6 application step by step from scratch with sample example. We will be generating our Angular 6 Hero application using angular CLI and then modify it to have a user management project where there will be a login screen for an admin and post login he can perform CRUD operations such as create, read, update and delete user with the sample REST API exposed using HttpClientModule. ","angular6,example,sample-project",77
464,https://github.com/EdgeApp/airbitz-core.git,"Bitcoin wallet C/C++ API for building cross-platform applications that require user authentication, encryption, backup, and meta-data management. This library alone implements the full functionality of the Airbitz Edge Security platform and bitcoin wallet minus the graphical interface. ",,76
465,https://github.com/fndmiranda/simple-address.git,"Management, geocoding and address search by postcode in multiple Api`s","address,postcode,zipcode,cep,correios,geocode,addresses",74
466,https://github.com/stormpath/stormpath-sdk-php.git,PHP SDK for the Stormpath User Management and Authentication REST+JSON API,"php,stormpath,authentication,authorization,oauth,user-management",73
467,https://github.com/township/township-accounts-api.git,route handlers to use in your REST API to handle user management,township,73
468,https://github.com/sl1673495/react-composition-api.git,:art: Simple React state management. Made with @vue/reactivity and ❤️.,"reactivity,react,state,state-management,vue3,react-vue,react-setup,reactive-programming,es6-proxy,react-state,reactjs,vue-reactive,vue-react",72
469,https://github.com/luckyshot/CRMx.git,"CRMx is a super-flexible micro-CRM system for personal, freelance and small businesses. It can be customized very quickly for Customer Relationship Management, Lead Management System, Project Management, To-Do List or any other usage due to its flexibility in customization and scalable code. CRMx allows unlimited users to work in the same or different environments very flexibly. CRMx works through a RESTful API which allows third-party services and other software to interact neatly. CRMx also has a User Access Control system (UAC) to define permissions for each user and have maximum control over the organization.","php,crm,crm-online,crm-system,mysql-database,productivity,sales,business,freelance,bootstrap",70
470,https://github.com/globocom/GloboNetworkAPI.git,"API to automate IP Networking management, resource allocation and provisioning.","network-programming,cloud,provisioning,automation,datacenter,network-topology,ipam,dcim",69
471,https://github.com/apinf/platform.git,Apinf - Open source API management platform with multi proxy and protocol support,"api-management,javascript,swagger,analytics,visualization,api-gateway,api-documentation,api-umbrella,api-manager,iot,mqtt,api-catalog,developer-experience,developer-portal,swagger-ui,swagger-codegen",66
472,https://github.com/coincubellc/coincube.git,A Python/Vue.js crypto portfolio management and trade automation program with support for 10 exchanges.,"crypto-portfolio-management,bitcoin,exchange,exchanges,api,trading,trade,crypto,cryptocurrency,portfolio,portfolio-management",66
473,https://github.com/adobe-apiplatform/user-sync.py.git,Application for synchronizing Adobe customer directories via the User Management API,,65
474,https://github.com/libstorage/libstoragemgmt.git,A library for storage management,"c,python,storage,api",64
475,https://github.com/contentful/contentful.net.git,"{"".NET SDK for Contentful's Content Delivery and Management API""}","contentful,content-delivery,content-management",64
476,https://github.com/techiediaries/django-crm.git,A Simple Django CRM (Customer Relationship Management) RESTful API Project ,"django,django-rest-framework,crm",64
477,https://github.com/paymoapp/api.git,API documentation for Paymo project management software,,63
478,https://github.com/dadi/publish.git,Publish provides beautiful editorial interfaces for the management of content within API,"headless,cms,publishing,cope",63
479,https://github.com/kubernetes-sigs/cluster-api-provider-packet.git,Cluster Management API provider for Packet,"k8s-sig-cluster-lifecycle,k8s-sig-cluster-api,hacktoberfest",62
480,https://github.com/faubertin/scala-play-rest-example.git,RESTful API for a fictive user management microservice.,,62
481,https://github.com/rmoriz/hetzner-api.git,"{""A wrapper for Hetzner.de's server management API""}",,61
482,https://github.com/CheckPointSW/cpAnsible.git,"{""Ansible module provides control over a Check Point Management server using Check Point's web-services APIs.""}","management-api,gaia-api",61
483,https://github.com/theopolis/smc-fuzzer.git,Apple SMC (System Management Controller) API fuzzer,,60
484,https://github.com/bedita/bedita.git,"BEdita, ready to use back-end API, extensible API-first Content Management","php,bedita,cakephp,api-first,restful-api,php7,api-server,mysql,postgres,backend",60
485,https://github.com/foxfolio/foxfolio-desktop.git,Cryptocurrency portfolio management application which automatically retrieves balances and trades using exchange APIs,"portfolio,altcoin,bitcoin,ethereum,litecoin,cryptocurrencies,cryptocurrency-exchanges,cryptocurrency",60
486,https://github.com/stoxy-js/stoxy.git,Stoxy is a state management API for all modern Web Technologies,"webcomponent,javascript,state-management,state,async,typescript,indexeddb,react,lit,preact",60
487,https://github.com/CheckPointSW/cp_mgmt_api_python_sdk.git,Check Point API Python Development Kit simplifies the use of the Check Point Management APIs.,"management-api,gaia-api",59
488,https://github.com/dcos/cosmos.git,"Provides an API for the orderly, harmonious, and complete management of DC/OS service packages","universe,cosmos,packaging,scala,dcos,dcos-orchestration-guild",59
489,https://github.com/microsoft/SmartKG.git,This project accepts excel files as input which contains the description of a Knowledge Graph (Vertexes and Edges) and convert it into an in-memory Graph Store. This project implements APIs to search/filter/get nodes and relations from the in-memory Knowledge Graph. This project also provides a dialog management framework and enable a chatbot based on its knowledge graph.,,59
490,https://github.com/mubaidr/SPA-asp.net-api-vuejs-.git,A Vue.js single page application for basic Management By Objective tasks using ASP .NET Webapi 2 and SQL server,"vuejs,sql-server,api,asp,website",58
491,https://github.com/mindcollapse/SoftEtherPy.git,SoftEther VPN Server Python Management API,,57
492,https://github.com/incuna/django-user-management.git,User management model mixins and api views.,"django,user-management,users,django-rest-framework,python",57
493,https://github.com/ElMassimo/vuex-stores.git,"🗄 Store objects for Vuex, a simple and more fluid API for state-management.","vuex,vuex2,vuex3,vuex-store,vuex-plugin,vuex-modules,vue,maintainability,js",57
494,https://github.com/stephaneey/azure-apim-extension.git,Full Azure API Management suite and more VSTS extension,,55
495,https://github.com/secrethub/secrethub-go.git,Golang SDK for the SecretHub Secrets Management API,"go,secrets,devops,security,golang,secrets-management,hacktoberfest",55
496,https://github.com/apigee/apigee-management-api-postman.git,Official repo of Apigee Management API Postman collection,,54
497,https://github.com/Samsung/restful.git,"Suggesting standard and optimized codes for RESTful API including filter/annotator for allowing user access and validating input data, user management, data management and some utils such as protecting data using 128/256-bit AES encryption.",,54
498,https://github.com/EverythingMe/vertex.git,Go API management framework,,52
499,https://github.com/ggtd/Let-s-Encrypt-Certificates-Management-Console-API.git,Homepage: http://genia.sk/lets-encrypt-certificates-management-console-api/,,52
500,https://github.com/stelace/marketplace-demo.git,"Open-source marketplace front-end powered by Stelace API including search, platform automation, user management, transactions, real-time messaging, ratings and much more :zap:","api,marketplace,search,automation,headless-cms,serverless,jamstack,stelace-api,vue,quasar,stripe,netlify",51
501,https://github.com/ssrdio/IdentityUI.git,"IdentityUI is a simple platform for administrative management of users and admins with a graphical interface. It is easy to set up, has a clean API, and runs on all recent .NET Core releases.",,51
502,https://github.com/3scale/porta.git,"Red Hat 3scale API Management, Porta","api,api-management,ruby-on-rails,3scale,redhat,hacktoberfest",50
503,https://github.com/EasyNetQ/EasyNetQ.Management.Client.git,EasyNetQ.Management.Client is a .NET client for the RabbitMQ RESTful management API,,50
504,https://github.com/contentful/contentful.objc.git,"{""Objective-C SDK for Contentful's Content Delivery API and Content Management API.""}",,50
505,https://github.com/axept/open-parse.git,"Get RESTful API to your data store, schemas, users and security management and bring up your own BaaS in a few minutes",,50
506,https://github.com/Drivemode/SpotifyApi.git,Spotify Web API Wrapper with Retrofit and OkClients just for Android. This library includes authentication and account token management feature.,,48
507,https://github.com/cznewt/architect-api.git,"Architect API is server-side of service modeling, management and visualization platform. Supports SaltStack, Ansible, Puppet, Chef, Terraform, AWS, OpeStack and Kubernetes.",metadata-information,48
508,https://github.com/Azure/API-Management.git,Repository with Azure API Management release notes.,"azure,api-management",48
509,https://github.com/filestack/filestack-php.git,Official PHP SDK for Filestack - API and content management system that makes it easy to add powerful file uploading and transformation capabilities to any web or mobile application.,"filestack,documentation,php,sdk,upload-file,upload-images,transforming-files",47
510,https://github.com/devhammed/use-global-hook.git,Painless global state management for React using Hooks and Context API in 1KB!,"global-hooks,react-hooks,hook-store,context-api,react",45
511,https://github.com/VineGlobal/AngularJS-eCommerce.git,"{""Super Lightweight eCommerce Platform -- Built with AngularJS and Google Sheets API v3.  The eCommerce platform's data is stored in Google Sheets. The product catalog, category management, and multi-lingual support are maintained using Google Sheets. Real-time data updates to the storefront.""}","angularjs,google-sheets,ecommerce,ecommerce-framework,product-catalog,digital-commerce,angularjs-ecommerce,php,landed-cost,duties,taxes,classification",45
512,https://github.com/structureddynamics/OSF-Web-Services.git,"The Open Semantic Framework (OSF) is a generally RESTful middleware API layer that provides the bridge between existing content, structure and schemas, legacy content management systems and RDF data stores. The OSF Web Services is the set of OSF web services that are used to manage all the content indexed in OSF.",,45
513,https://github.com/ME1312/SubServers-2.git,SubServers | The Minecraft Server Management Platform,"subservers,subdata,bungeecord,spigot,bukkit,minecraft,java,addon,plugin,api",44
514,https://github.com/adzerk/adzerk-management-sdk-ruby.git,"{""Ruby SDK for Adzerk's Management APIs""}",,43
515,https://github.com/contentjet/contentjet-ui.git,Headless API-first content management system,"headless,headless-cms,api,cms,api-first-cms,rest-api,react,single-page-app",42
516,https://github.com/chrivand/Firepower_O365_Feed_Parser.git,This is a Sample Script that can parse the O365 Web Service API and upload it to Firepower Management Center as Group Objects.,"cisco,firepower,fmc,firepowerapi,office365,o365",42
517,https://github.com/k8ssandra/management-api-for-apache-cassandra.git,RESTful / Secure Management Sidecar for Apache Cassandra,"cassandra,sidecar,kubernetes,cloud-native",41
518,https://github.com/SAP/apibusinesshub-api-recipes.git,"Accelerate integration projects using SAP Cloud Platform API Management with crowdsourced best practices, curated by experts, designed for developers.","sample,sample-code,api-management,sap-cloud-platform,api",41
519,https://github.com/ihaiker/aginx.git,management API service for nginx,"nginx,api,admin,management",41
520,https://github.com/itthinx/groups.git,"Groups provides group-based user membership management, group-based capabilities and content access control. It integrates standard WordPress capabilities and application-specific capabilities along with an extensive API.",,41
521,https://github.com/filestack/filestack-ios.git,Official iOS SDK for Filestack - API and content management system that makes it easy to add powerful file uploading and transformation capabilities to any web or mobile application.,"filestack,filestack-ios-sdk,xcode,carthage,picker,cloud-providers,files,upload,uploader",41
522,https://github.com/crypto-chassis/ccapi.git,A header-only C++ library for cryptocurrency market data streaming and order execution management. Bindings for other languages such as Python are provided.,"algo-trading,altcoin,api,arbitrage,automated-trading,backtest,bitcoin,cpp,c-plus-plus,crypto,cryptocurrency,exchange,library,market-data,strategy,trading-bot,execution,orderbook,python",41
523,https://github.com/gmr/rabbitmq-pulse.git,"rabbitmq-pulse is a RabbitMQ plugin that publishes node and queue information, pushing stats instead of polling the Management API",,41
524,https://github.com/yciabaud/kong-plugin-prometheus.git,Prometheus metrics exporter for Kong API management,,40
525,https://github.com/segunolalive/helloBooks.git,"A Single-Page Library Management App built with nodejs, express and react and redux","pwa,progressive-web-app,progressive-enhancement,hellobooks,library-management-system,library,react,react-components,react-router-v4,redux,react-redux,api,express,javascript,component,offline-first,nodejs",40
526,https://github.com/texterify/texterify.git,The localization management system.,"localization,internationalization,texterify,i18n,translate,docker,cloud,on-premise,api,rails,typescript",40
527,https://github.com/alchemy-fr/RabbitMQ-Management-API-Client.git,A OO PHP client for the RabbitMQ Management Plugin API,,39
528,https://github.com/mongodb-js/mongodb-topology-manager.git,Localhost MongoDB Topology Management API,,39
529,https://github.com/LauraBeatris/gympoint-api.git,"Rest API of a gym management application - built with Express, Postgres, Redis, and Nodemailer.","api-rest,nodejs,express,javascript,nodemailer,postgresql,redis,mailgun",39
530,https://github.com/innogames/serveradmin.git,Configuration management database system of InnoGames,"python3,api,eav,virtualization,networking,ipam,dcim,cmdb,itsm",39
531,https://github.com/inshopgroup/inshop-crm-ecommerce.git,"{""Inshop CRM / ERP ecommerce. It's powerful framework allows to build systems for business with different workflows. It has on board multi language support, clients management, projects & tasks, documents, simple accounting, inventory management, orders & invoice management, possibilities to integrate with third party software, REST API, and many other features.""}","vuejs,vuex,nuxt,rest-api,pwa,javascript,ecommerce,vuetify",39
532,https://github.com/AnimeThemes/animethemes-server.git,AnimeThemes.moe resource management & API,"anime,anime-opening,anime-database,animethemes",38
533,https://github.com/filestack/filestack-python.git,Official Python SDK for Filestack - API and content management system that makes it easy to add powerful file uploading and transformation capabilities to any web or mobile application.,"python,sdk-python,transforming-files,upload-file,upload-images,hacktoberfest",38
534,https://github.com/cornflourblue/node-mysql-registration-login-api.git,"Node.js + MySQL API for User Management, Authentication and Registration",,37
535,https://github.com/m-muhsin/woosesh-store.git,A WooCommerce mobile app built with React Native. Uses Context API for cart management.,,37
536,https://github.com/Amine-Smahi/PostGraduation.git,University management platform dedicated for post-graduation in computer science field using django rest framework.,"django,django-rest-framework,material-design,university,final-year-project,post-graduation,api",37
537,https://github.com/Autodesk-Forge/forge-php-client.git,"Forge PHP SDK: Enables you to easily integrate the Forge REST APIs into your application, including OAuth, Data Management,Model Derivative, and Design Automation",,37
538,https://github.com/3scale/3scale-amp-openshift-templates.git,3scale API Management OpenShift Templates,,36
539,https://github.com/microsoft/vscode-apimanagement.git,VS Code extension for Azure API Management.,"azure-api-management,vscode-extension,microsoft,azure,serverless,apim",35
540,https://github.com/City-of-Helsinki/respa.git,Resource reservation and management app and API,"booking-system,booking-engine,reservation,reservation-system,resource-management,room-booking,meeting-room-booking,booking,booking-api,resource-api,access-control,microsoft-exchange,payment",35
541,https://github.com/haythem/SoundCloud.NET.git,Sound Cloud Library For API Management Written In C#,,35
542,https://github.com/AudienceHero/AudienceHero.git,"API centric, multi-tenant, audience management system. ","symfony,community-management,creators,independent,api-centric",35
543,https://github.com/KayLerch/alexa-skills-kit-tester-java.git,"{""This framework lets you script and execute complex conversations with your Alexa skills. Conversations are specified in YAML format. The SDK uses Skill Invocation API and Skill Simulation API of the Amazon's Skill Management API ""}",,35
544,https://github.com/sentialabs/coto.git,Undocumented AWS Management Console APIs SDK for Python,,34
545,https://github.com/tradingticket/TradeItIosTicketSDK2.git,TradeIt iOS SDK to integrate trading and portfolio management.,"finance,fintech,investing,stocks,fx,fxtrade,portfolios,brokerage,brokers,trading,stock-market,api,portfolio,portfolio-aggregation,broker-api,trading-api,stock-portfolio,financial-portfolio-management,stock-trading",34
546,https://github.com/CAAPIM/Microgateway.git,"Security and management for microservices, with rich functionalities of the CA API Gateway family","api-gateway,microservices,api-management,apis,iot,docker,service-discovery,service-mesh",34
547,https://github.com/jeffkl/ManagedDism.git,A managed wrapper for the native Deployment Image Servicing and Management (DISM) API. ,,34
548,https://github.com/beachio/chisel.git,An API-first content management app built on parse-server with react.js,,34
549,https://github.com/yydzxz/ByteDanceOpen.git,"Bytedance(TikTok, Toutiao)third party open platform backend SDK, provides easy-to-use authorization, template management, code package management and other APIs.字节跳动(抖音, 头条)第三方开放平台小程序sdk, 提供了简单易用的授权,模版管理,代码包管理等api. ","bytedance-sdk,toutiao-sdk,douyin-sdk,bytedance-open,toutiao-open,douyin-open,bytedance-miniprogram,bytedance-miniapp,bytedance,miniapp,miniprogram,toutiao,douyin,sdk,tiktok,douyin-miniapp",34
550,https://github.com/codekuu/webnetter-API.git,Plug and Play Network Management API built on Netmiko with optional GUI,"netmiko,fastapi,webnetter-api,docker,gui,swagger-ui,api,json-schema,swagger,async",34
551,https://github.com/blackawa/micropress.git,micropress is the API based Contents Management System engine.,,34
552,https://github.com/ArtisanByteCrafter/KaceSMA.git,A module for interacting with a Quest Kace Systems Management Appliance API via Powershell.,"kace,sma,api,powershell",33
553,https://github.com/mtallentb/react_inventory_manager.git,"Inventory Management System built with React, Redux and Rails API",,32
554,https://github.com/voyages-sncf-technologies/hesperides.git,Configuration management tool providing universal text file templating and properties editing through a REST API or a webapp (backend part),"hesperides,templating,configuration-management,mongodb,spring-boot,backend,java,mustache,hacktoberfest",32
555,https://github.com/3scale/3scale-istio-adapter.git,"{""Red Hat 3scale Istio Mixer Adapter - Add 3scale's API Management to the Service Mesh""}","istio,3scale,kubernetes,openshift-cluster,maistra,openshift,api-management",31
556,https://github.com/3scale-labs/3scale_ws_api_for_php.git,"3scale integration plugin for PHP applications. 3scale is an API Infrastructure service which handles API Keys, Rate Limiting, Analytics, Billing Payments and Developer Management. Includes a configurable API dashboard and developer portal CMS. More product stuff at http://www.3scale.net/, support information at http://support.3scale.net/.",,31
557,https://github.com/leapcode/leap_web.git,"Web application for the LEAP platform, providing user management, tickets, billing, and REST API. Uses CouchDB for data storage, written in Ruby, released under the AGPL.",,31
558,https://github.com/sibyperiyar/Easy-HotSpot.git,Easy HotSpot is a super easy WiFi hotspot user management utility for Mikrotik RouterOS based Router devices.  Voucher printing in 6 ready made templates are available.  Can be installed in any PHP/MySql enabled servers locally or in Internet web servers.  Uses the PHP PEAR2 API Client by boenrobot.,"easy-to-use,easy-hotspot,wifi,hotspot-user-management,mikrotik,mikrotik-routerboards,mikrotik-routeros-script,mikrotik-hotspot,mikrotik-routeros-api,wifi-network,wifi-hotspot,routeros,routeros-api,php-applications,php-client,bootstrap,bootstrap3,javascript-ajax,php-pdo-mysql,voucher-printing",31
559,https://github.com/TheOpenCloudEngine/uEngine-cloud.git,"{""OCE's main component includes :  PaaS (Self-service) Portal, Dev-ops, Cloud orchestrator. Also includes microservices-architecture components: Identity & Access Management conforming to OAuth2 and JWT spec and Zuul-based API proxy that interacts with IAM and the service registry (Eureka).""}",,31
560,https://github.com/ciathyza/tetragon.git,"Tetragon is an Open Source cross-platform game engine used to develop games and applications for the web, desktop and mobile devices. It is written purely in ActionScript 3 and comfortably allows to write source code once and deploy builds to several different target platforms. Unlike most other Flash-based game engines and frameworks that allow you to develop a specific type of game or that provide a subset API to support game development, Tetragon provides a complete foundation with that any type of game can be developed, incl. resource management, debugging facilities, multi-locale support, layered extendability, a game-oriented data structure, and a lot more.",,31
