,Url,Description,Topics,Stars
347,https://github.com/Neufund/ESOP.git,legal and smart contracts framework to implement Employee Stock Options Plan,"solidity,legal,ethereum,smart-contracts,esop",72
348,https://github.com/gnosis/conditional-tokens-contracts.git,Smart contracts for conditional tokens.,,71
349,https://github.com/singnet/platform-contracts.git,Smart contracts for running Agents and Services on the SingularityNET open network.,snet-platform,71
350,https://github.com/terra0project/source.git,A collection of experimental smart contracts for environmental management ,,71
351,https://github.com/SiamKreative/Contract-Killer-Generator.git,"Based on the popular open-source contract for web designers and developers, this generator lets you create a contract within minutes and export it to PDF.",,71
352,https://github.com/keep-network/keep-core.git,The smart contracts and reference client behind the Keep network,"cryptocurrency,privacy,interoperability",70
353,https://github.com/AlisProject/ico-contracts.git,:tada: ICO Contracts of the ALIS.,"smart-contracts,ico,tokensale,solidity,ethereum,ico-contracts,geth",70
354,https://github.com/TPL-protocol/tpl-contracts.git,Proof of concept for the contracts implementing TPL,,70
355,https://github.com/SergeyTeplyakov/ReSharperContractExtensions.git,Set of extensions for R# that simplifies Design by Contract programming using Code Contracts.,,70
356,https://github.com/Proof-Of-Humanity/Proof-Of-Humanity.git,Proof-of-Humanity smart contract,,70
357,https://github.com/codemix/contractual.git,"Unobtrusive, backwards compatible, syntactic sugar for Design by contract in JavaScript.",,70
358,https://github.com/ambrosus/Ambrosus.git,Ambrosus Protocol Contracts,,69
359,https://github.com/dydxprotocol/perpetual.git,Ethereum Smart Contracts and TypeScript library used for the dYdX Perpetual Contracts,,69
360,https://github.com/quantstamp/solidity-analyzer.git,A dev repository for analyzing and finding bugs smart contracts,,69
361,https://github.com/PolymathNetwork/polymath-core-deprecated.git,Core Ethereum Smart Contracts for Polymath - The Securities Token Platform,,69
362,https://github.com/Parquery/gocontracts.git,A tool for design-by-contract in Go,,69
363,https://github.com/hpb-project/ico.git,HPB ico contracts,,68
364,https://github.com/CosmWasm/wasmd.git,Basic cosmos-sdk app with web assembly smart contracts,,68
365,https://github.com/blockstack/docs.git,All you need to build decentralized apps and write smart contracts.,"blockstack,documentation,smart-contracts,web3,decentralized,nextjs,docs,typescript",68
366,https://github.com/dice2-win/contracts.git,dice2.win smart contract,,68
367,https://github.com/bokkypoobah/BokkyPooBahsTokenTeleportationServiceSmartContract.git,"{""BokkyPooBah's Token Teleportation Service Smart Contract""}","erc20,ethereum,solidity-contracts,tokens",68
368,https://github.com/zenswapnetwork/smart-contract.git,Zenswap Network Token Smart Contract,,68
369,https://github.com/IBM/BlockchainSmartContractTrading-CompositeJourney.git,WARNING: This repository is no longer maintained :warning: The Create and execute blockchain smart contracts from IBM Cloud has been sunset. This repository will not be updated. The repository will be kept available in read-only mode. Refer to https://github.com/IBM/SmartContractTrading-wFabric1-4-VSCodeExt for a similar example.,"ibmcode,hyperledger-composer,blockchain",68
370,https://github.com/kieranelby/KingOfTheEtherThrone.git,"An Ethereum ÐApp (a ""contract""), living on the blockchain, that could have made you a King or Queen, granted you riches, or immortalized your name. It\'s no longer updated, but visit kingoftheether.com to find out more about my first solidity project.",,68
371,https://github.com/ProjectWyvern/wyvern-ethereum.git,Project Wyvern Ethereum Smart Contracts,"ethereum,solidity,project-wyvern,smart-contracts,dex",67
372,https://github.com/substrate-developer-hub/substrate-contracts-workshop.git,A guided tutorial for building smart contracts on Parity Substrate,,67
373,https://github.com/Capgemini-AIE/blockchain-insurance.git,Blockchain Car Insurance with Smart Contracts on Hyperledger,"blockchain-insurance,chaincode,hyperledger",67
374,https://github.com/michaelherold/interactor-contracts.git,Add contracts to your interactors,"interactor,hacktoberfest",67
375,https://github.com/kesar/eos-awesome-contracts.git,List of open source contracts for EOSIO blockchains,"eosio,eos,eos-contracts",67
376,https://github.com/teamnsrg/erays.git,Ethereum smart contract reverse engineering,,67
377,https://github.com/smartcontractkit/LinkToken.git,LINK Token Contracts for the Chainlink Network,,66
378,https://github.com/ericandrewlewis/web-development-contract.git,Web Development Contract,,66
379,https://github.com/gnosis/ethcontract-rs.git,Generate type-safe bindings for interacting with Ethereum contracts.,,66
380,https://github.com/deanpress/neo-dapp-starter-kit.git,Starter-kit for interacting with Smart Contracts on the NEO Blockchain using NodeJS and neon-js.,,66
381,https://github.com/eternaltrusts/eternal-smart.git,Eternal Trusts Smart-Contract MVP,,66
382,https://github.com/hashgraph/hedera-services.git,"Crypto, token, consensus, file, and smart contract services for the Hedera public ledger",,66
383,https://github.com/ProofSuite/tokensale-contracts.git,Official Repository for the Proof Token Sale Smart Contracts,,65
384,https://github.com/smartcontractkit/truffle-starter-kit.git,An example smart contract utilizing Chainlink,,65
385,https://github.com/Tectract/ethereum-demo-tools.git,"Useful tool info and examples for learning to write Ethereum smart-contracts, to accompany my BlockGeeks article",,65
386,https://github.com/RyuuGan/sol-merger.git,Merges all imports into single file for solidity contracts,"solidity,smart-contracts,merger",65
387,https://github.com/dropbox/vsmc.git,Vendor Security Model Contract,,64
388,https://github.com/EOSLaoMao/BankofStaked-CE.git,A smart contract to enable CPU&NET leasing on EOS,,64
389,https://github.com/poanetwork/posdao-contracts.git,"Smart contracts for POSDAO (Proof of Stake Decentralized Autonomous Organization consensus), a DPOS consensus implemented in Solidity and running within EVM with swappable BFT consensus",,64
390,https://github.com/uport-project/uport-registry.git,Core uPort registry contract for linking attributes to uPort identities. DEPRECATED,,64
391,https://github.com/rpearce/react-expanding-textarea.git,React textarea component to automatically expand and contract your textareas.,"reactjs,textarea,textarea-component,autosize,textarea-autoresize,react,react-component,text-resize,expanding-textarea,typescript",64
392,https://github.com/Uniswap/uniswap-lib.git,📖 Solidity libraries that are shared across Uniswap contracts,,63
393,https://github.com/pbrudny/learning-solidity-2018.git,Basic examples of Solidity smart contracts,"ethereum,solidity,smart-contracts,blockchain",63
394,https://github.com/relevant-community/contracts.git,Relevant Bonding Curve and Token Contracts,,63
395,https://github.com/quartzjer/pennybank.git,Bitcoin Microtransaction Smart Contracts,,63
396,https://github.com/hunterlong/ethereum-ico-contract.git,Tested Ethereum ICO Contract for Token Crowdsales,"ethereum,ethereum-contract,ethereum-ico,ico-contracts,ico,sale-contract,crowdsale,ethereum-ico-contract,crowdsale-contract,smart-contracts",63
397,https://github.com/adridadou/eth-contract-api.git,EthereumJ native API or how to call contracts easily and with type safety,"ethereum,java,blockchain,rpc,ethereumj",63
398,https://github.com/0xbitcoin/0xbitcoin-token.git,Bitcoin implemented as a token smart contract on Ethereum. ,,63
399,https://github.com/Lamarkaz/parasol.git,Agile Smart Contract Development Environment,,63
400,https://github.com/gnosis/contract-proxy-kit.git,Enable batched transactions and contract account interactions using a unique deterministic Gnosis Safe.,,63
401,https://github.com/kleros/kleros-interaction.git,Smart contracts able to interact with Kleros,"blockchain,ethereum,solidity,arbitrable,smart-contract",62
402,https://github.com/WeTrustPlatform/rosca-contracts.git,Ethereum Contracts for WeTrust ROSCA,,62
403,https://github.com/cosmo-project/meteor-dapp-cosmo.git,Meteor dapp for building and vetting solidity contracts.,,62
404,https://github.com/poanetwork/poa-network-consensus-contracts.git,"Main repository for POADAO consensus. Includes contracts for Initial Ceremony, Governance, Management of Validators","solidity,governance,consensus",62
405,https://github.com/nexofinance/NEXO-Token.git,Ethereum Smart Contract for NEXO ERC20 Token,,62
406,https://github.com/cryptofinlabs/cryptofin-solidity.git,A collection of Solidity libraries for building secure and gas-efficient smart contracts on Ethereum.,"solidity,ethereum,library,gas",62
407,https://github.com/stove-labs/granary.git,Tezos smart contract & dapp development toolkit,"tezos,tezos-blockchain,reasonml,ocaml,docker",62
408,https://github.com/Turing-Chain/Honeypots-on-Blockchain.git,This repo collects almost all the smart contract honeypots that you could find in the first three pages of Google search.,"blockchain,hack,security,smart-contracts,ethereum,honeypots",62
409,https://github.com/mdexSwap/contracts.git,mdex contracts,,61
410,https://github.com/paxosglobal/pax-contracts.git,Solidity smart contracts for the Paxos Standard ERC20 stablecoin PAX,,61
411,https://github.com/hyperledger-labs/private-data-objects.git,"The Private Data Objects lab provides technology for confidentiality-preserving, off-chain smart contracts.",,61
412,https://github.com/unchained-capital/ethereum-multisig.git,"Ethereum 2/3-multisig smart contract & dApp for cold storage, hardware wallets.",,61
413,https://github.com/IC3Hydra/Hydra.git,"Framework for cryptoeconomic contract security, decentralized security bounties.  Live on Ethereum.","ethereum,smartcontracts,bounties,security",61
414,https://github.com/kinecosystem/kin-token.git,Kin token contracts.,"kin,ethereum,solidity,truffle,ganache",60
415,https://github.com/singnet/snet-cli.git,SingularityNET CLI for interacting with SNET blockchain contracts and deployed services.,snet-platform,60
416,https://github.com/ethereum-optimism/smock.git,[Optimism] Solidity mock contracts in JavaScript,,60
417,https://github.com/phantasma-io/PhantasmaChain.git,Blockchain with native storage and smart contract integration.,"blockchain,smart-contracts,storage,api,decentralized,kademlia,dht,wallet,virtual-machine",60
418,https://github.com/EthWorks/Doppelganger.git,Smart contract mocking tool,,60
419,https://github.com/amazingandyyy/solidity-contracts.git,📦 Resources for the Ethereum Smart Contract Development tutorial series.,"ethereum,solidity,solidity-contracts,ethereum-contract,ethereum-dapp,truffle,truffle-framework,tutorial,smart-contracts,testrpc",60
420,https://github.com/blopa/Contract-Builder.git,Easily build and maintain any kind of contract. Free and Open Source,"legal,documents,contract,lawsuit,agreements,construction,resume,google-spreadsheet,contract-builder,vue,jquery",60
421,https://github.com/gnosis/dex-contracts.git,Smart contracts for the Gnosis Protocol v1,"ethereum,decentralized-exchange,solidity,batch-auction,stablecoin,decentralized-application,hacktoberfest,gnosis-protocol",59
422,https://github.com/perlin-network/smart-contract-rs.git,Write WebAssembly smart contracts for Wavelet in Rust.,"rust,webassembly,smart-contracts,dapp,wavelet,p2p,blockchain",59
423,https://github.com/jorisbontje/cll-sim.git,Ethereum CLL Contract Simulator,,59
424,https://github.com/tonlabs/samples.git,"Samples of Free TON smart contracts in Solidity, C++ and C",smart-contracts,59
425,https://github.com/cryptopunksnotdead/awesome-cryptopunks-bubble.git,Awesome CryptoPunks Bubble (Anno 2021) - Modern 24x24 Pixel Crypto Art on the Blockchain since 2017 - 10 000 Unique Collectible Characters Generated Algorithmically ++ Bonus: Inside the CryptoPunksMarket Contract Service,"cryptopunk,cryptopunks,cryptocollectibles,blockchain,bubble,mania,24x24,2021,10000,cryptoart,cryptoaliens,cryptozombies,wpunks,cryptotulips,substrapunks,binancepunks,punkverse,pixelart",59
426,https://github.com/ConsenSysMesh/Stow-Smart-Contracts.git,Formerly Linnia-Smart-Contracts,"ethereum,smart-contracts",58
427,https://github.com/airswap/contracts-v1.git,AirSwap atomic swap and token smart contracts.,,58
428,https://github.com/algorand/pyteal.git,Algorand Smart Contracts in Python,"smart-contracts,blockchain,algorand,cryptocurrency,python-language-binding",58
429,https://github.com/celer-network/cChannel-eth.git,CelerPay contracts on Ethereum,,58
430,https://github.com/jrossignol/ContractConfigurator.git,A config file based solution for creating new contracts for Kerbal Space Program.,,58
431,https://github.com/dbolin/Apex.Serialization.git,High performance contract-less binary serializer for .NET,"serializer,graph,binary,c-sharp,fast,custom-serialization,serialization,netcore",58
432,https://github.com/TrueFlip/trueflip-contracts.git,TrueFlip Token and ICO contracts for Ethereum ,,57
433,https://github.com/alice-si/contracts.git,Alice smart contracts,"ethereum,smart-contracts,donations,dapp,truffle,solidity",57
434,https://github.com/openethereum/pwasm-std.git,WASM contracts standard library for Rust,,57
435,https://github.com/figs999/Ethereum.git,Useful sample code for various Ethereum smart contracts,,57
436,https://github.com/NoharaHiroshi/upgradability-solidity-demo.git,可升级的以太坊智能合约设计模式 Upgradable smart contracts in solidity,,57
437,https://github.com/thoughtnirvana/augment.git,Python utils for contract-based programming and method hooks.,,57
438,https://github.com/appliedblockchain/k0.git,A Zerocash based private token (and asset) implementation that integrates with both Ethereum and HL Fabric - create private tokens on smart contract consortium blockchains,,57
439,https://github.com/Neufund/ico-transparency-monitor.git,"ICO Monitor is a tool that tracks the ICO behavior to make sure it is transparent. Giving charts and statistics about this ICO as well as giving a score for each ICO depending on answering a set of questions, where answers depend only on smart contract code analysis",,57
440,https://github.com/decentraland/marketplace-contracts.git,🔖 Decentraland Marketplace Contracts,,56
441,https://github.com/itecreator/eos-ite.git,ITE DAPP contract code,,56
442,https://github.com/zincwork/contracts.git,Identity smart contract mesh - developed by Zinc,,56
443,https://github.com/mklemm/jaxb2-rich-contract-plugin.git,Implements some JAXB plugins to generate advanced contract scenarios from XSD,,56
444,https://github.com/ConsenSys/security-workshop-for-devs.git,Secure smart contract development workshop hosted by ConsenSys Diligence and MythX.,,56
445,https://github.com/jet/FsCodec.git,F# Event-Union Contract Encoding with versioning tolerant converters supporting System.Text.Json and Newtonsoft.Json,"fsharp,converters,json,json-net,union-encoder,typeshape,discriminated-unions,codec,system-text-json,unionconverter",56
446,https://github.com/CirclesUBI/circles-contracts.git,Fully automated luxury gay space communism contracts,"smart-contracts,ethereum",55
447,https://github.com/nearprotocol/NEARStudio.git,IDE for building smart contracts on NEAR Protocol,"blockchain,smart-contracts,ide,typescript,assemblyscript,webassembly",55
448,https://github.com/SwissRealCoin/src-token.git,Smart Contract of the SwissRealCoin token,,55
449,https://github.com/bitclave/Multiownable.git,BitClave implementation of Multiownable contract,,55
450,https://github.com/EOSMore/eos-contracts.git,EOS Contract Demo,"eos,contract,demo",55
451,https://github.com/JoranHonig/vertigo.git,Mutation Testing for Ethereum Smart Contracts,"ethereum,mutation-testing,solidity,mutations,testing,security",55
452,https://github.com/tZERO-dev/T0ken.git,"Regulatory compliant smart contracts built for the future of securities, leveraging the power, security, and transparency of the blockchain",,55
453,https://github.com/oleiman/sweet-contracts.git,A collection of sweet.js macros that provide contract support for JavaScript!,,55
454,https://github.com/skalenetwork/skale-consensus.git,"SKALE BFT consensus is universal, modern, modular, high-performance, asynchronous, provably-secure, agent-based Proof-of-Stake blockchain consensus engine in C++ 17.   Used by SKALE elastic blockchains.  Easy and flexible enough to implement your own blockchain or smart contract platform. BLS signatures and Binary Asynchronous Consensus are main building blocks. ","bft,consensus,cryptography,asynchronous,cpp,distributed-systems,consistency",55
455,https://github.com/EdgelessCasino/Smart-Contracts.git,Edgeless Token Smart Contracts,,54
456,https://github.com/Lunyr/crowdsale-contracts.git,Crowdsale contracts,,54
457,https://github.com/ProofSuite/proof-cryptodollar.git,Official repository for the Proof CryptoDollar contracts,,54
458,https://github.com/dappuniversity/ipfs_image_uploader.git,IPFS Image Uploads dApp With Ethereum Smart Contracts,,54
459,https://github.com/JuliaComputing/Miletus.jl.git,Writing financial contracts in Julia,"julia,finance,options-trading,options-pricing",54
460,https://github.com/naddison36/eth-scratch3.git,Scratch 3 extensions for Ethereum contracts,"ethereum,scratch,javascript",54
461,https://github.com/maticnetwork/pos-portal.git,Smart contracts that powers the PoS (proof-of-stake) based bridge mechanism for Matic Network,"ethereum,matic,web3,blockchain",54
462,https://github.com/FundRequest/contracts.git,"Contracts for FundRequest (platform, token, crowdsale)","ethereum,solidity-contracts,solidity,ethereum-contract,dapp,ethereum-dapp",54
463,https://github.com/springframeworkguru/spring-cloud-contract-oa3.git,Spring Cloud Contract Open API 3.0,,54
464,https://github.com/gliechtenstein/erc20.git,Full stack ERC20 Token App (Contract + Web + Mobile),,54
465,https://github.com/wbobeirne/eth-balance-checker.git,Solidity contract to batch balance checks in one call,,54
466,https://github.com/second-state/lity.git,A rule-based contract-oriented high-level language.,"lity,solidity,language",54
467,https://github.com/cjgdev/smart-contract-patterns.git,"Smart-Contract Patterns written in Solidity, collated for community good",,54
468,https://github.com/decentraland/ethalarm.git,⏰ Get notifications whenever an Ethereum smart contract triggers an event.,,54
469,https://github.com/tronprotocol/tron-contracts.git,Solidity smart contracts for the TRON blockchain https://tron.network,,53
470,https://github.com/PeterBorah/smart-contract-security-examples.git,Some example patterns for building fault-tolerant Ethereum smart contracts,,53
471,https://github.com/ProofSuite/presale-contracts.git,Solidity Smart Contract Bundle for Token Presales,,53
472,https://github.com/EricR/sol-function-profiler.git,Solidity Contract Function Profiler,"ethereum,solidity",53
473,https://github.com/microsoft/azure-devops-extension-api.git,REST client libraries and contracts for Azure DevOps web extension developers.,,53
474,https://github.com/ethereum/act.git,Smart contract specification language,,53
475,https://github.com/iudex/iudex.git,Iudex is a smart contract based reputation system.,,53
476,https://github.com/tokenized/smart-contract.git,Autonomous Agent for Running a Smart Contract,,53
477,https://github.com/Charterhouse/pysnark.git,Python-based system for zk-SNARK based verifiable computations and smart contracts,,53
478,https://github.com/scorelab/EtherBeat.git,"With the growing popularity of BitCoin in the last couple of years, other blockchains have been in development for solving various problems that need distributed consensus. Ethereum blockchain is one example, that gives users to develop ""smart contracts"" that runs in the blockchain.  This gives the ability to develop decentralized applications (or dApps). Users do not need to \'trust\' anything or anybody.  In addition to that, dApps are always available and will be guaranteed to be available in the future as well.  Also, it is resistant to traditional attacks such as DDoS.  This framework has given many developers to write a decentralized application without much effort, without needing distributed systems or cryptography knowledge. Many startups are actively developing applications for Ethereum such as Ethereum Name Service (ENS), Etheria or WeiFund.  Unfortunately, because the technology being used is bleeding edge it is inevitable that attacks or hacks will target these apps for monetary reasons.  Last year DAO suffered a severe attack because of its security flaws. Due to that attack, 3.6m ether was stolen from DAO\'s smart contract.  Also, once you publish a smart contract in Ethereum it is not possible to modify or update it as a regular web application. Thus, even developers identify a critical bug in the contract it is not possible to push a bugfix in a straightforward way.  Thus, in order to fill the gap of not having a proper \'smart contract\' compatible monitoring service, we propose to build a web application that can monitor other smart contracts in Ethereum and give the capability to safeguard it\'s critical functions (Ether send and receive) and interact and visualize with smart contract functions in a much simpler way.  Also depending smart contracts can using our base smart contracts to gain the advantage of having \'circuit-breaker\' which will pause the activity if things go wrong in an unexpected way.",,53
479,https://github.com/gregbkr/geth-truffle-docker.git,Start programming your first ethereum contract with this quick docker setup: geth + truffle + netstats,"geth,ethereum,parity,truffle,devchain",53
480,https://github.com/getmanfred/contracts.git,Contract Templates to be used by a Talent Agency or a Recruitment Company,"docs,contracts",53
481,https://github.com/makerdao/tx-manager.git,Solidity contract to make multiple calls in one Ethereum transaction. Used by Maker keepers.,"solidity,ethereum-contract,maker-keeper",53
482,https://github.com/es-shims/es-shim-api.git,"API contract, and rudimentary tests, for modules that conform to the *es-shim API*",es-shim,53
483,https://github.com/dobtco/openrfps-scrapers.git,Scraping government contracting opportunities.,,52
484,https://github.com/DeFiOptions/DeFiOptions-core.git,Core smart contracts of defi options,,52
485,https://github.com/sonm-io/presale-token.git,main smart-contract and crowdsale application,"ethereum,solidity,crowdsale",52
486,https://github.com/BitcoinHEX/contract.git,"{""Source code: https://etherscan.io/address/0x2b591e99afe9f32eaa6214f7b7629768c40eeb39#contracts | All rights are reserved. IT IS NOT LICENSED FOR COPYING. We don't use github for dev.""}","cryptocurrency,smart-contract,token,coin",52
487,https://github.com/humaniq/ico-contract.git,ICO Contract,,51
488,https://github.com/ArweaveTeam/SmartWeave.git,"Simple, scalable smart contracts on the Arweave protocol.",,51
489,https://github.com/dogethereum/dogethereum-contracts.git,Ethereum contracts for the Dogecoin <-> Ethereum bridge,"ethereum,dogecoin,blockchain,scrypt",51
490,https://github.com/hackingbeauty/react-dapp-boilerplate.git,A Truffle box with a superior React UI foundation for Ethereum Smart Contracts ,,51
491,https://github.com/paritytech/cargo-contract.git,Setup and deployment tool for developing Wasm based smart contracts via ink!,,51
492,https://github.com/ledgerlabs/ethereum-getting-started.git,"A ""Getting Started"" guide for building decentralized apps and smart contracts on Ethereum",,51
493,https://github.com/ethereum-lists/4bytes.git,List of 4byte identifiers to common smart contract functions,"ethereum,4byte,signatures,evm,solidity",51
494,https://github.com/NodeFactoryIo/solidity-node-docker-starter.git,"Starter project for developing Ethereum smart contracts with Solidity, Truffle and Node.js as a backend server.","solidity,solidity-contracts,truffle,docker,docker-compose,nodejs,express",51
495,https://github.com/0age/HomeWork.git,"HomeWork is an autonomous utility for finding, sharing and reusing home addresses for contracts.","ethereum,smart-contracts,erc721,homework,account",51
496,https://github.com/KadenZipfel/smart-contract-attack-vectors.git,A collection of smart contract attack vectors along with prevention methods.,,51
497,https://github.com/epsanchezma/elixir-contracts.git,Desing by Contracts for Elixir,,50
498,https://github.com/gemini/dollar.git,Gemini dollar contract source code,"gemini,erc20,stablecoin,ethereum",50
499,https://github.com/pinknetworkx/atomicassets-contract.git,Smart Contract of the AtomicAssets standard.,,50
500,https://github.com/Instadapp/smart-contract.git,InstaDApp Smart Contracts.,instadapp,49
501,https://github.com/dappuniversity/social-network.git,Blockchain social network powered by Ethereum smart contracts,,49
502,https://github.com/emilianobonassi/gas-saver.git,Gas Saver is a collection of smart contracts to save gas on Ethereum,,49
503,https://github.com/Swagger2Markup/swagger2markup-maven-project-template.git,This is a Swagger2Markup Maven template project which uses the swagger2markup-maven-plugin to convert a contract-first Swagger specification into an AsciiDoctor-based HTML documentation.,,49
504,https://github.com/lidofinance/lido-dao.git,Lido DAO smart contracts,,48
505,https://github.com/DigixGlobal/digixdao-contracts.git,Solidity contracts for DigixDAO,,48
506,https://github.com/SmartBillions/SmartBillions.git,SmartBillions lottery smart contract,,48
507,https://github.com/getdock/dock-token.git,DOCK ERC20 Ethereum contract,"erc20,solidity,solidity-contracts",48
508,https://github.com/google/safe-html-types.git,Security contract types,,48
509,https://github.com/hifi-finance/prb-math.git,Smart contract library for advanced fixed-point math,"library,ethereum,evm,math,smart-contracts,solidity,hardhat",48
