,Url,Description,Topics,Stars
0,https://github.com/karthramach/KOLIBRI-GAMES.git,Supported Kolibri games by providing eCPM analysis results on their monthly data by delivering insights on which countries and OS platforms they should focus on strategizing their ad monetization for better ad revenue.,,0
0,https://github.com/karthramach/KOLIBRI-GAMES.git,Supported Kolibri games by providing eCPM analysis results on their monthly data by delivering insights on which countries and OS platforms they should focus on strategizing their ad monetization for better ad revenue.,,0
0,https://github.com/sherinch/food-stories.git,"A food blog with hundreds of simple, healthy recipes and food blogging resources for food photography and blog monetization. we can easily identify the best foods available in cochin,north indian foods in cochin,best pizza shop",,0
0,https://github.com/adleralonso/youtube-cc-monetization.git,"Its a proyect intented to procedurally download Creative Commons Media and Generate Compilations of them for reuse and online monetization, avoiding the slow and tidious task to edit manually",,0
0,https://github.com/sanyaade-teachings/joomla-hd-flv-player.git,"Need to enhance the quality of your Joomla sites? Joomla HD FLv player will do that for you! With some of its salient features like Lighttpd, RTMP streaming, Monetization, Native language support and Bookmarking, the player falls to be ultimat",,0
0,https://github.com/Murathe/BlockBlog.git,"A social blog site that helps in crowd posting to various social sites. The blog is intended to bring in the capability of content monetization by allowing cross-posting to Steemit, Whaleshares and other social blockchain sites. ",,0
0,https://github.com/darmie/rubiqubesdk.git,"RubiQube is a reward – based advertising platform that drives engagement and monetization opportunities for online publishers, while delivering rewards to their end users and providing advertisers with engaged customers.",,0
0,https://github.com/MobileCore/android-mobilecore-sdk.git,"The mobileCore Android SDK provides monetization and user-engagement solutions for Android apps. Compliant with Google Play Store Developer Content Policy (Aug. 2014), the SDK supports Android OS version 2.3 and up (API level 9).",,0
0,https://github.com/srhboo/open-studio.git,"Multiplayer digital space for sharing and engaging in artworks, using Web Monetization API as a way for creators to fairly exchange information. Built on React, Socket.io, Three.js",,0
0,https://github.com/dennismuturia/AudienceNetworkdemo.git,THis is an android application that demonstrates how a you can monetize your application on Facebook using ads,,0
0,https://github.com/suiteplugins/sp-bp-premiums.git,BP Premiums is an addon for monetizing social networks. Charge users a premium for accessing features on your network.,,0
0,https://github.com/nstudio/nativescript-smart-adserver.git,SmartAdserver SDK implementation for NativeScript. Monetize your app with the power of smart ads from SmartAdserver! :money_with_wings: :moneybag:,,0
0,https://github.com/jonasreycian/snap_n_go.git,Snap a great places while you travel. It can be monetize if people wants to use your picture.,,0
0,https://github.com/jinyk/video_policy.git,"This video\xa0policy\xa0system checks the\xa0rights\xa0of \xa0videos\xa0in\xa0a\xa0given\xa0country. Possible\xa0policies\xa0include  monetize,\xa0free,\xa0and\xa0block.",,0
0,https://github.com/kailanwyatt/bp-premiums.git,BP Premiums is an addon for monetizing social networks. Charge users a premium for accessing features on your network.,,0
0,https://github.com/anthonyaje/Closet.git,Hack UST 2015 - Android App that allows popular social media users monetize their outfits by renting them to others. ,,0
0,https://github.com/TheDash/my-projects.git,"Code for my resume! Includes Open source contributions, self-designed projects, working projects, and code that was once monetized.",,0
0,https://github.com/Atmosplay/Help-Center-for-Publisher.git,Here are everything you want to know about how to use Atmosplay platform to monetize your app.,,0
0,https://github.com/AnssetRG/NeonMission_OpenSourceVersion.git,This project is a Open Source Version of the video game with assets. Do not monetize without email and permission.,,0
0,https://github.com/khinds10/Android-AndroidFremium.git,"The Default project that implements all the latest ""Freemium"" model promotional and monetizing elements included from the start.",,0
0,https://github.com/alexpmorris/SteemitPostVoteSliderAndPastPayoutMonetizer.git,"enables slider for steemians with at least 72SP, and allows monetizing posts after 7 days via comments!",,0
0,https://github.com/Techspeedy/ZIGICOIN.git,"Zigi lets anyone create, share, and monetize AI services at scale. The world’s decentralized AI network has arrived.",,0
0,https://github.com/kah-bot/money-making-sports-game-real-money.git,Monetized sports game based on the wide world of sports with personal name analyzer w/created player with career mode ,,0
0,https://github.com/WPPlugins/mobile-monetizer.git,"This is a mirror of the svn repo: https://plugins.svn.wordpress.org/mobile-monetizer/, the master is always the latest release.",,0
0,https://github.com/vahidebadi/2243001.git,"Yes, this tank is designed to monetize and exit from the bad economic situation of the community! Very grateful and thankful that God has shown me this way",,0
0,https://github.com/2point1creations/NEVERDIECoin.git,THE NEVERDIE ICO WILL FINANCE THE DEVELOPMENT OF A MULTI-PLATFORM API FOR MONETIZED GAMING INFRASTRUCTURE TO SUPPORT A TRILLION DOLLAR VIRTUAL GOODS ECONOMY,,0
0,https://github.com/eboss2k9/StyleTrail.git,"StyleTrail is an online marketplace that helps beauty establishment owners monetize their empty space and provides professional work environments to barbers, hair stylists, and all other beauty professionals. ",,0
0,https://github.com/strifejester/alwaysfreessl.git,Repository for www.alwaysfreessl.com my efforts to fill a void that was created by other sites partnering with ZeroSSL and monetizing letsencrypt.org certificates.,,0
0,https://github.com/leintelligensia/Legal-Services.git,Le Intelligensia Law Firm enables entrepreneurs to safeguard their IP and educates the clients to monetize using the Intellectual Property they hold. ,,0
0,https://github.com/johnelauria/php-reviewer.git,An android app which serves as a reviewer for those taking Zend Certification exam. This app will contain ads for monetizing,,0
0,https://github.com/manancholera/Thomas-Analytics.git,A data visualization and dashboard bank designed to provide insights to existing clients and prospective customers of ThomasNet and eventually monetize the Thomas Net data.,,0
0,https://github.com/Arrowson/alaskaAir-HTML-CSS.git,A purely educational look at HTML and CSS. Essentially a copy of Alaskaair.com without any functionality or intent to monetize.,,0
0,https://github.com/WPPlugins/roundcloud-monetize.git,"This is a mirror of the svn repo: https://plugins.svn.wordpress.org/roundcloud-monetize/, the master is always the latest release.",,0
0,https://github.com/EricDeschenes/LSCasino-Client-.git,This repository contains the code for the client-side of an online casino. It was made as a university project and never intended to be monetized.,,0
0,https://github.com/Priyank77/PocketDateProject.git,"With a team, developed a mostly functional dating app. We will be working on over the next few months to possibly monetize it.",,0
0,https://github.com/WillRMoore/outdoorsThumos.git,Monetized blog website about outdoor activities. On the site I offer affiliate products and services that could be of value to the viewers.,,0
0,https://github.com/chicasoy/bebi.git," Bebi is the leading mobile and web games online advertising network. Buy banner ads to bring you quality traffic at flexible cpm,or monetize your website with us.",,0
0,https://github.com/ScoreMilk/ScoreMilk.git,Score Milk is a gaming ecosystem that allows gamers to test their abilities while allowing game developers to monetize their games. Everyone earns.,,0
0,https://github.com/SolarSamaritan/Dobawattsup.git,dropshipper 3dcart bitcoin ecomm cart and merchant /combined with a Automatic call tracking and web hook automation package. for the up and RUNNINg bitcoin entra - monetized for residual .,,0
0,https://github.com/thechucklingatom/MTGCollectionManagerBeforeKotlin.git,"My android learning project, making a collection manager for magic the gathering, will not be monetized and a portfolio style app.",,0
0,https://github.com/marieayscue/WP-Jobs2CareersApi-Integration.git,Backfill and monetize your job board using the Jobs2Careers API. Jobs2careers jobs will be displayed in list format linking offsite (without full descriptions).,,0
0,https://github.com/VinoosIr/tapsell-plus-cordova-plugin.git,"Ultimate Cordova Plugin for Tapsell Plus to monetize hybrid apps. Show mobile Ad with single line of JavaScript. Compatible with Cordova CLI, PhoneGap Build, Ionic, etc.",,0
0,https://github.com/theabundanceframework/theabundanceframework.git,the Abundance Framework looks to use the latest technologies to solve poverty by creating software that allows contributors and users to track and monetize their contributions.,,0
0,https://github.com/khinds10/Android-AndroidFremiumPlus.git,"The Default project that implements all the latest ""Freemium"" model promotional and monetizing elements included from the start. (Includes built-in app menus)",,0
0,https://github.com/asv0018/Monetization-of-parking-slots.git,Monetizing parking slots is a new way to charge the customers based on the hours they keep their vehicle in the parking slot using IoT and embedded system,,0
0,https://github.com/blaze-fire/Hackerearth_Image_classification.git,create a solution using deep learning to discern whether a post is holiday-related in an effort to better monetize the platform,,0
0,https://github.com/Calldorado/FreeSDK.git,Re-engage and monetize your active and inactive users with caller ID in your app’s look and feel. Get the free Calldorado SDK at www.calldorado.com,,0
0,https://github.com/buyersaver/KauaiGuy.git,"{""I'm a serial entrepreneur seeking a core team for a startup that monetizes 7 ways right out of the gate""}",,0
0,https://github.com/AkhilaGitDS/Data-Analysis.git,"Data analysis, to help business to monetize by making impactful changes by following phases in order like Ask >> Prepare >> Process >> Analyze >> Share >> Act.","data-science,infographics,descriptive-statistics,exploratory-data-analysis,inferential-statistics,regression-analysis",0
0,https://github.com/MacSweeney339/Harmonic-Linguistics.git,"{""Harmonic Linguistics exists to help you discover which artists rap about similar subjects and explore their music in new and meaningful ways. When this site is up and running I'd like to come up with a monetization method that would fund stem and creative arts programs in predominantly african american communities. ""}",,0
0,https://github.com/NDCLord/startapp_banner.git,"{""StartApp is a new monetization and distribution platform focusing on free applications for mobile phones. As of today, it is available on Android only. You can ask for theirs SDK using this link and you'll get 25$ after first 100 downloads as an entry gift: http://startapp.com/rf7dzh2 Download the jar and place it in your app folder ""}",,0
0,https://github.com/omsamara/Tic-Tac-Lime.git,Tic-Tac-Lime is a classic game of Tic-Tac-Toe where the user plays against a semi-intelligent AI. The main purpose of creating this application was practice implementing AI as well as the monetization of an Android application. The app is available now on the Google Play Store,,0
0,https://github.com/Makewebbetter/enhanced-woocommerce-convertkit-integration.git,"{""This plugin unifies the potential of ConvertKit with customers' diversity of WooCommerce stores in real-time. It helps brands to identify loyal customers, segment customers based on recency, frequency and monetization(RFM) and build a powerful strategy for ConvertKit automation and sequences. It makes the best of your customer information.""}","convertkit,email,marketing,embed-form,woowoocommerce-convertkit",0
0,https://github.com/Apptha/Joomla-HD-FLV-Player.git,"{""eed to enhance the quality of your Joomla sites? Apptha's Joomla HD FLV player will do that for you! With some of its salient features like Lighttpd, RTMP streaming, Monetization, Native language support and Bookmarking, the player falls to be ultimat""}",,0
0,https://github.com/Jchavez/MonetizeAndroidApps-Lesson2.git,"Learn how to monetize Android apps without adversely affecting the user experience. We will present the best practices of advertising, monetizing and publishing your Android app. We will also present an introduction to business models that will help you make money from an app using Google AdMob, Google’s mobile advertising platform specifically designed for mobile apps.","monetization,android",0
0,https://github.com/jensdev/cordova-admob-io.git,"Ultimate Cordova Plugin for Google AdMob and DFP to monetize hybrid apps. Show mobile Ad with single line of JavaScript. Compatible with Cordova CLI, PhoneGap Build, Intel XDK/Crosswalk, Google ChromeApp, Ionic, Meteor, etc.",,0
0,https://github.com/jgbinegar/2048-Game.git,"This is a recreation of the popular game 2048. I do not own the original problem, nor is this in any way an attempt to monetize this game. This is merely for enjoyment of programming, and learning new coding techniques.",,0
0,https://github.com/izzoh/android-ads.git,This is an android application that shows how android ads work and how to configure then into your application. Inspired by the udacity course on Monetizing your android apps using admob.,,0
0,https://github.com/msomkuti/Hooked.git,"My Python clone of the cheesy text story app, Hooked. This is an exploration of graphical programming in PyGame, specifically in dynamic visualization, and is in no way intended to monetized.",,0
0,https://github.com/johnpozzi1/Global-Resource-Bank-Network.git,Welcome to the Global Resource Bank Network ~ GRBnet GRB shareholders monetize Earth’s wealth of natural resources with GRB ecos (e). The GRB eco is a natural resource backed cryptocurrency that affords everyone sufficient and sustainable eco income for life.,,0
0,https://github.com/sanjeevbishnoi/Thrift.git,"Budget tracking/Accounting application. The first project I built in flutter earlier in 2019. It does not implement any in-app payments, ads or other monetizations strategies. It is built solely with a purpose to get some experience.",,0
0,https://github.com/kravenoff42/MealMaker.git,"An app that will allow you to create and track your recipes and generate a shopping list from a selection of meals. META[WIP, easily monetized, easily completed, interesting domain, working with others, personal tool, prerequisite, getting paid]",,0
0,https://github.com/InfluenceChainProject/InfluenceChainProject.git,Influence chain creates a token based ecosystem that exploits the advantages of private blockchain by building up a token exchange where influential power (individualized intellectual property) can be monetized into digital assets for the token holders.,,0
0,https://github.com/BlondelSeumo/React-Native-apps-for-your-directory-listing.git,"A web directory or link directory is an online list or catalog of websites. It helps you create, manage, organize and monetize websites and apps like Yelp, Airbnb, Booking.com and TripAdvisor. This will be excellent for your Wordpress theme.",,0
0,https://github.com/diegoob11/GalaxyAtWar.git,This repository contains the code for a third-person space shooter engine based on the Star Wars universe. It was made as a University project and was never intended to be monetized. ,,0
0,https://github.com/sakib-rahman-bangladesh/literate-devops-microservices.git,"make product live with awesome ui/x, literate-devops, grow user base, monetize business with dark launching technique. move first, make stable, revise and fix, get shit done. following philo. RERO: release early, release often, listen to customers...",,0
0,https://github.com/eishta-christy/my-dream-app.git,"Angular blog application with Jam Stack based on tutorial at the WITOnlineFestival 2020 (WORKSHOP: Riding the JAMStack wave to monetize your web development skills in COVID times by Natalia Venditto, Principal Front-End Software Engineer, Netcentric) ",,0
0,https://github.com/agnejff/NICHE-MARKETING-KIT-REVIEW.git,"Niche Marketing Kit is a Pioneer kit that allows affiliate marketers and bloggers to gain access to all Essential Training to monetize the website.The kit contains all kinds of Tools, Products, and Strategies required to Engage, Interact and Sell",,0
0,https://github.com/wizzybright/Steem-Digital-Marketplace.git,"Steem Digital Marketplace (SMD) is a platform that offers writers, singers poets and other owners of digital products the ability to monetize their contents and  also makes the products available to the end user. ",,0
0,https://github.com/VinoosIr/tapsell-cordova-plugin.git,"Ultimate Cordova Plugin for Tapsell to monetize hybrid apps. Show mobile Ad with single line of JavaScript. Compatible with Cordova CLI, PhoneGap Build, Intel XDK/Crosswalk, Google ChromeApp, Ionic, Meteor, etc.",,0
0,https://github.com/shawncraine/admob-cordova-plugin.git,"Google AdMob plugin for Cordova, Phonegap and Intel XDK ,support ios and android,support admob v1 and admob v2 ,Monetize your html5 app with one javascript line.api is easy to use.",,0
0,https://github.com/olumide025/Builders-Platform.git,Open source web app to self-publish and sell books or other online content.  A fully comprehensive web app for publishing and monetizing your books and other online content.,,0
0,https://github.com/TheQuadraticKing/Diplomacy-Westeros.git,"{""Although there is no way I'd be able to monetize this project since it utilizes a lot of elements, from which I do not own the IP, I figured it would be a very fun game""}",,0
0,https://github.com/malkesh-m/cthdirectory.git,"This is the react-native application for our directory and listing WordPress themes. Help you create, manage, organize and monetize websites and apps like Yelp, Airbnb, Booking.com and TripAdvisor",,0
0,https://github.com/agnejff/DFY-REVIEW-FUNNEL-REVIEW---3-IN-1-REVIEW-FUNNEL-SUITE..git,"DFY Review Funnel is a 3-in-one Funnel suite that helps your customers Generate Leads, Monetize these leads, and rake huge affiliate commissions from these, with a built-in 100% FREE Viral Traffic System.",,0
0,https://github.com/NatalieNov/Affmy.git,"{""Affmy is an international affiliate network and, at the same time, a developer of unique solutions for affiliates’ сonversions growth.  Our official web site: https://affmy.com/   What we do and who we are?  + We provide exclusive offers + in-house funnels; + We are actively present on the international market; + Our headquarters is based in Cyprus; + We've grown pretty fast since Affmy is launched in 2017; + We work with global traffic & provide expertise in Asian affiliate marketing.  Affmy is not only professionals but also a team of like-minded people.  We believe in change. That is why we are constantly in search of the best innovative ways to monetize the traffic of our affiliates. And to raise the revenues of our affiliates we are moving the quality of traffic monetizing to the next level, which they have never experienced before.   Maximize your affiliate profit with our individual money-making approach: For Networks: - Increased monetization & fill-rate - Beneficial terms for large volumes - Promo of any type & size - Easy & stable integration  For Media Buyers:  - Access to less competitive markets - Great ROI from affordable traffic - Individual extended caps - Educational cases & expertise  For Webmasters & Site Owners:  - Additional monetization solution for your site - Premium rates for CPS offers - New offers your users have never seen - Your very own exclusive native promos   For E-mail & Social Marketers:  - Increased rates for e-mail & social traffic - Individual custom flow for e-mail users - API integration & suppression lists  We know how to elevate your traffic profit. We constantly create new high-converting products & bring innovative funnels on the market.  Contact Information: Website: Affmy.com E-mail: affiliates@affmy.com Skype: affmy_1""}",,0
0,https://github.com/kyleau00/FRESH-CUT-BG-SBLC-AVAILABLE-FOR-LEASE-PURCHASE-.git,"FRESH CUT BG/SBLC AVAILABLE FOR LEASE & PURCHASE:   I Am a Direct Mandate to a trusted and proven Provider/Issuer of Fresh cut Bank Guarantee(BG), Standby Letter of Credit(SBLC), Project Funding, Loan facilities and Monetization. We can partner with brokers and financial consultants around the world. Our Purchasing fee for BG/SBLC is: 32%+2% while our Leasing fee is: 4%+2%. Will be glad to share our working procedures with you upon request via below email.  Mr. Kyle Augustine  Email: kyleau001@gmail.com Whatsapp: \u202a+13027512426",,0
0,https://github.com/OscarValencia/w5d1-as1.git,Firebase Android Codelab  https://codelabs.developers.google.com/codelabs/firebase-android/#0  Firebase Authentication Firebase Realtime Database Firebase Cloud Messaging Firebase Remote Config Google Analytics for Firebase Firebase App Invites Monetizing with AdMob Firebase Crash Reporting Firebase Test Lab for Android,,0
0,https://github.com/tohby/Avanter.git,Avanter is a basic CRUD web application. The look design of the site is inspired by Avanter a magento theme developed by theme forest. This project is only for learning purposes and is in not created to sell or monetize in any way.  ,,0
0,https://github.com/mudassarwurfel/AdMobDemo.git,AdMob is a multi platform mobile ad network that allows you to monetize your android app. By integrating AdMob you can start earning right away. It is very useful particularly when you are publishing a free app and want to earn some money from it.,,0
0,https://github.com/npontorno/FakeTwitter.git,A simple bare-bones Twitter clone created by myself for my modern web development course. I have no affiliation with Twitter and I have no intention of monetizing this project; it exists purely for educational purposes. The JS code makes calls to a class shared API that to retrieve and store data used in the app.,,0
0,https://github.com/anrmk/alizee-react.git,"{""Alizee Platform is a community which gives you the freedom to be your own boss and to monetize your content. It's a space where you can express yourself without restrictions. Users and creators have an opportunity to connect and collaborate with each other, build a closer relationship with each other.""}",,0
0,https://github.com/wall-ads/Wall-Ads.git," New AdsRising Development Monetize Social Media  We also play a major role in seeding the development of new Trend Publishing, helping to launch aspiring entrepreneurs and expanding opportunities for our Publisher. Just Share the ads to your FaceBook Wall ,You will getting weekly paid up to 30%-70% anually. http://www.wall-ads.tv",,0
0,https://github.com/Tuna668/HTY-Token.git,"Hyper Technology is the first ever STO and Sidechain project on the Ethereum Blockchain. Hyper Technology stands for an open platform for data analysis, preserving privacy by design. The blockchain-based ecosystem allows anyone to stay in control of their data while monetizing it in an anonymous way.",,0
0,https://github.com/Alok255/Android-How-to-Integrate-Google-AdMob-in-your-App.git,AdMob is a multi platform mobile ad network that allows you to monetize your android app. By integrating AdMob you can start earning right away. It is very useful particularly when you are publishing a free app and want to earn some money from it.,,0
0,https://github.com/sajithar99/CPS.git,"A Centralized Print Server using CUPS to be implemented at college aimed to track,control and monetize printing from a network printer shared over LAN. Consists of a server-side and client-side softwares along with a Web Interface for Clients.  Tea4CUPS Wrapper",,0
0,https://github.com/PullMeUnderr/ART_HOUSE.git,"ART [HOUSE] NFT-marketplace The concept of the site implies the possibility of monetizing the creativity of artists of any skill. We want to promote aspiring artists by giving them the motivation to improve. It is important for us to develop a structure where there is a place for every creative person, weeding out low-quality content.",,0
0,https://github.com/sajithar-99/CPS.git,"A Centralized Print Server using CUPS to be implemented at college aimed to track,control and monetize printing from a network printer shared over LAN. Consists of a server-side and client-side softwares along with a Web Interface for Clients.",,0
0,https://github.com/vladventura/bountodo.git,"A twist to the normal ToDo apps: users can set a bounty to each todo, and gain gold/exp that they can use to buy backgrounds, themes, and some other stuff as well. Most likely will monetize the app with ads and whatnot.",,0
0,https://github.com/Greedisawesome/Space-Brothers_monetization.git,"We have data on events for the mobile game Space Brothers. Players have to create their own space programs and try to colonize the galaxy.  The dataset contains data on the first users of the app — the cohort of users who began playing the game between May 4 and 10, inclusive.  The dataset contains data on users in the first stage of the game. To reach the second stage, they need to do one of the following:  Defeat the first boss Build an orbital satellite-assembly system Research question: What monetization strategy should be used? For now, showing ads on the screen where the user selects the type of objects to be constructed is proposed",,0
