,Url,Description,Topics,Stars
523,https://github.com/deepaksabat/AutoPlus.git,"Auto Plus – Laravel Car Wash Booking is built for Car Wash, Car Cleaning, Auto Wash, Garages, Automobile Mechanicals, Auto Painting, Car Workshop, Auto Workshop, Car Service, Tires, Auto Care, Car Care, Car Maintenance, Vehicle Diagnostics, Auto Glass, Body Shops, Auto Inspections etc.","laravel,car,mysql,carwash",5
524,https://github.com/DinosXa/e-barber-django-implementation.git,this is a barbershop booking site implemented in django that mainly focuses on the idea of creating a user that can both book and create his own barbershop. ,,5
525,https://github.com/osmangoninahid/microservice_k8s_nats.git,"An example boilerplate for Event-driven Microservice for a ticket booking e-commerce platform with NodeJS/Typescript, MongoDB, NATs, Kubernetes and Docker. ","microservices-architecture,docker,skaffold,nats-streaming,typescript,nodejs,expressjs,kubernetes,reactjs,nextjs",5
526,https://github.com/satyamnaithani/Roomer.git,Roomer is an online Hotel Booking Web Application. It also consist the Roomer-Enterprise where one can upload his/her hotel rooms which can be booked by the customers. Session Handling is maintained properly hence multiple users can access the website by just creating an account and signing in.,"java,javaee8,servlet-jsp,jdbc,mysql-database,tomcat-server,session,html-css,bootsrtap4,animate-css,roomservice,hotel-booking,enterprise,database-management,webapp,full-stack",5
527,https://github.com/OlehFylypiv/OnlineMovieTicketsBooking.git,"{""I'm working on creating a simple application for booking tickets at the cinema. This app deployed on Heroku. Front-End part: React/Redux + Bootstrap. Back-End part: NodeJS/ExpressJS + Firebase.""}",,5
528,https://github.com/Ryanhustler420/ReactRoomApp.git,"{""react-rooms is a clone web app of popular Hotel/Room Booking service name airbnb. But it's just partly like airbnb! however it still have all functionality of CRUD.""}","authentication,react,booking,crud,api,node,javascript,npm,open-source",5
529,https://github.com/bouaik/Cars-booking.git,"This is a Booking app for cars, users can take an appointment to test a car and then decide if they want to buy it or not, built with react and rails API.","react,rails-api",5
530,https://github.com/UtsabSen/Cafe_Management_System.git,"{""This C++ program is designed in such a way that  the administrator can log in the cafe management system. The users can register, login, change their account password if forget or if they want. There is a functionality that the program can record each and every one's information even after program has been terminated. It consists of Master entry, customer entry, giving offer, register new user, delete or update data, booking, charges, renewal, giving offer and much more.""}",,5
531,https://github.com/thecargocoin/cargocoin.git,"CargoCoin is designed to be a smart contract & crypto currency platform, decentralising global trade and transport. The eco-system will be facilitating and optimising the interaction amongst traders, freight forwarders, ship owners, booking agents and other parties involved in the international trade and transport of commodities and cargoes. The platform users will experience a well-balanced eco-system based on cutting edge crypto security and frictionless interactions. Its objective is to provide environment and tools for flawless exchange of trade & cargo documents and payment options at low cost in real time.  The platform architecture is based on the principles of high level of security, transparency, traceability and accountability. ",,5
532,https://github.com/LinterexEvilCommunity/penblood.git,"{""License Compatible Python2x Python3x  Pure Blood v2 A Penetration Testing Framework created for Hackers / Pentester / Bug Hunter  Menu Web Pentest / Information Gathering: Banner Grab Whois Traceroute DNS Record Reverse DNS Lookup Zone Transfer Lookup Port Scan Admin Panel Scan Subdomain Scan CMS Identify Reverse IP Lookup Subnet Lookup Extract Page Links Directory Fuzz (NEW) File Fuzz (NEW) Shodan Search (NEW) Shodan Host Lookup (NEW) Web Application Attack: (NEW) Wordpress     | WPScan     | WPScan Bruteforce     | Wordpress Plugin Vulnerability Checker         Features: // I will add more soon.         | WordPress Woocommerce - Directory Craversal         | Wordpress Plugin Booking Calendar 3.0.0 - SQL Injection / Cross-Site Scripting         | WordPress Plugin WP with Spritz 1.0 - Remote File Inclusion         | WordPress Plugin Events Calendar - 'event_id' SQL Injection Auto SQL Injection     Features:     | Union Based     | (Error Output = False) Detection     | Tested on 100+ Websites Generator: Deface Page Password Generator // NEW Text To Hash //NEW Author's Words: This project is managed / enhanced everyday and sorry if it takes a while before another version is published. Well, I'm the only one who is managing this and also I have personal daily activities. This tool is for everyone. So please open an issue if you run into a bug. Well I can only test it in Windows and Kali Linux since that's the only device I have. Also please try the new AUTO SQL Injection that I'm proud of currently. I created a video already on how I created it. Check it out on my Youtube Channel. The WPScan is also checked for Windows and Kali Linux. If you are using other Linux Distro please add wpscan in your ~/.bashrc.  Installation Any Python Version.  $ git clone https://github.com/cr4shcod3/pureblood $ cd pureblood $ pip install -r requirements.txt""}",,5
533,https://github.com/villalon/reservasalas.git,Moodle plugin for booking study rooms and class rooms,,4
534,https://github.com/SeasonFour/BookingApp.git,A hotel booking android App,,4
535,https://github.com/HammerAndRay/Java-hotel-booking-program.git,A simple java hotel booking program created for an assignment ,,4
536,https://github.com/aidansean/hotel.git,"Javscript, PHP, MySQL based room booking service",,4
537,https://github.com/sanchit234/Movie-Booking.git,Php based movie booking website with MySQL database,,4
538,https://github.com/MrRisoni/otaredux.git,"Online Travel Agency Booking App (React,ContextAPI)",,4
539,https://github.com/Holdo/travel-agency.git,A system for online holidays booking.,,4
540,https://github.com/salemmosbahi/TaxiDriver.git,App android - Taxi Driver booking,,4
541,https://github.com/mahmoudadev/Hotel-booking-system.git,Hotel Booking system built with laravel 5.6,,4
542,https://github.com/haganbt/N27-Booking.git,"N27 Booking is a web based booking system designed for small businesses, communities and individuals. ",,4
543,https://github.com/saelsa/fyyur.git,Fyyur: Artist Booking Site - Project within the Udacity Fullstack Nanodegree,,4
544,https://github.com/ghassen1khalil/HotelBooking.git,Android App for Online Hotel search and booking,,4
545,https://github.com/sissythem/Ecommerce.git,Android Application for booking residences,"android,restful,json",4
546,https://github.com/rounakbanik/airbnb.git,The Springboard Capstone Project to predict new Airbnb User Bookings.,,4
547,https://github.com/pranavkhurana/Movie-seat-booking.git,Simple Movie Seat picking and booking system on Java-Spring,"java,spring-mvc,java-spring-web,movie-ticket,booking-system,bootstrap,maven",4
548,https://github.com/kamil-nawrot/iCinema.git,webapp for booking cinema tickets online,,4
549,https://github.com/trevorprinn/room-bookings.git,Web Room Booking System,"room-booking,php",4
550,https://github.com/Jberczel/Flight_Booker.git,Simple Flight Booking App with search and nested forms,,4
551,https://github.com/CDH-Studio/Jarvis.git,Simplified room booking web application.,,4
552,https://github.com/madanpandey97/AppointmentBooking.git,Android application for booking online appointment with doctors,,4
553,https://github.com/raniaSayed/Basic-Flight-Reservation--ReactJs.git,ReactJs consume single page api for booking flight seats.,"reactjs,consumer-app,javascipt,nodejs,react-components",4
554,https://github.com/neontribe/cottage-booking.git,Cottage Booking front end booking path using CanJS,,4
555,https://github.com/shivank1404/getmehome1.git,getmehome is a simple bus booking website.,"php,mysql,mysql-database,phpmyadmin,css,website,localhost",4
556,https://github.com/Olaf202057/react-redux-magichat-demo-booking-system-master.git,Meeting Room Booking System,,4
557,https://github.com/reuelrds/booking-app.git,A Room Booking App,"angular,ionic4",4
558,https://github.com/Lunch-Time/lunch-time.git,Lunch booking system.,,4
559,https://github.com/OPEN-ENT-NG/rbs.git,Application de réservation de ressources : salles et matériels.(Remote Booking System) pour OPEN ENT NG,,4
560,https://github.com/tastyigniter/ti-ext-reservation.git,A TastyIgniter extension that accepts restaurant reservations and table bookings online,,4
561,https://github.com/bikram-choudhury/travellers.git,a simple hotel booking system,"php,codeigniter,mysql,css,jquery,map",4
562,https://github.com/titancamp/travely.git,"An open-source web based software solution for travel agencies specialized on incoming tourism to help them manage their customers, bookings and help them save money by avoiding booking penalties due to late cancellations.",,4
563,https://github.com/siddhantmishra1305/YoKoSo.git,YoKoSo is an online cab booking iOS Application based on mvvm,"ios-app,swift,cab,taxi-app,mvvm,ola,uber",4
564,https://github.com/mitirius/booking-react.git,A react.js based room booking web frontend application,,4
565,https://github.com/ruslanss/HackerRank.BookingCom.WeekendAway.git, Booking.com > Hack a Holiday: City Break Edition > Weekend away,,4
566,https://github.com/eokoneyo/booking_hackathon_stepup.git,Repo for StepUp idea Conceived at a booking.com Hackathon,,4
567,https://github.com/clementmbr/band-booking.git,Useful custom Odoo modules for DIY band booking and management.,"band,booking,music,manager,booker,diy,odoo,odoo-addons",4
568,https://github.com/shermangore/SalonSite.git,"Website for a salon with appointment booking, product management, and staff management",,4
569,https://github.com/maillouxc/git-rekt.git,"{""Group project for FGCU's intro to Software Engineering. A resort management/booking desktop application.""}",,4
570,https://github.com/UB-Mannheim/MArs.git,MAnnheim reservation system (MArs) is a web application used for seat booking in Mannheim University Library.,,4
571,https://github.com/syntacstudio/booking-meeting-room.git,System booking meeting room online with Laravel,,4
572,https://github.com/Recras/online-booking-js.git,JS library for easy online booking integration,,4
573,https://github.com/alexweininger/Test-Device-Booking.git,Web app for managing test device booking,"node,nodejs,express,react,javascript",4
574,https://github.com/arijitthehacker/E-Cabs.git,Our Final Year Project: An Online Cab Booking System designed using Django Framework. ,,4
575,https://github.com/project-nomad/booking-module.git,"{"" A recreation of AirBnb's booking module, made with React, Express, MySQL & Styled Components.""}",,4
576,https://github.com/vivekku/BookDeTicket.git,"{""It's a movie online booking website with real time seat allocation system""}","html,css,php,javascript,jquery",4
577,https://github.com/metacoder-bgy/bookmeal.git,Automatic meal booking convenient tool for Guangzhou Country Garden School,,4
578,https://github.com/hobby203/rails_booking.git,"A2 Coursework, Room booking system implemented in Ruby on Rails",,4
579,https://github.com/pratik0197/Ticket-Booking.git,A ticket booking Application for the DBMS project,"nodejs,expressjs,dbms-project,mongodb,database,atlas,heroku-deployment,mit-license,html,css,bootstrap4,semantic-ui,backend-webdevelopment,routing,hacktoberfest,hacktoberfest2020",4
580,https://github.com/nakardo/HotelCompass.git,Search for Hotels nearby using Booking.com API.,,4
581,https://github.com/hansfpc/MovieTickets.git,🎞 React Native app for booking movie tickets (with Redux),,4
582,https://github.com/marcinmajkowski/booking-system-api.git,Booking system REST API built with Spring Boot.,,4
583,https://github.com/lspagnol/jitsi-jmb.git,Jitsi Meet Booking / Gestion réservation et planification sur Jitsi Meet,"jitsi-meet,moderation,booking-system,shibboleth,apache,authorization,authentication,reservation-system,reminder,jicofo",4
584,https://github.com/bmarshall511/book-it-transportation.git,A complete management system for your transportation business enabling you to easily accept and manage your transportation bookings.,,4
585,https://github.com/travala/Booking-SC.git,Booking-SmartContract,,4
586,https://github.com/rinvex/cortex-bookings.git,"{""Cortex Bookings is a front layer of a generic resource booking system for Laravel, with the required tools to run your SAAS like services efficiently. It's simple architecture, accompanied by powerful underlying to afford solid platform for your business.""}",,4
587,https://github.com/starrepublic/meetrix.git,Android App for viewing and booking conference rooms connected to Google G Suite,,4
588,https://github.com/bookwize/wp-bookwize-form.git,Wordpress booking form for Bookwize Hotel Booking Engine,,4
589,https://github.com/chrisj-skinner/AngularJS-Booking-Form.git,An AngularJS powered online booking form posting form contents to an email address via a php script.,,4
590,https://github.com/sangqle/mysql-crud-nodejs.git,The webapp to booking movie online and payment with google pay then check QR code to coming,"nodejs,mysql-server,sample-project",4
591,https://github.com/itggot-TE4/Yabs.git,Yet another booking system,,4
592,https://github.com/arxitim/abstract_anticafe.git,Small table booking service,"python,django,html-css-javascript,django-rest-framework,ajax,bootstrap4,sweetalert2,xdsoft-datetime-picker,qr-code,recaptcha",4
593,https://github.com/gz89/my-crib.git,Booking App ( Quasar ),"quasar,crib,app,cross-platform,vue",4
594,https://github.com/JaredRombough/Wrestling.git,Wrestling booking simulation,,4
595,https://github.com/thangchung/cinema-booking.git,Cinema Booking Application,,4
596,https://github.com/JuliaSlipchuk/BookingUZ.git,Booking tickets to trains,"csharp,javascript,jquery,ajax,mssql,pdf,smtp,jquery-val",4
597,https://github.com/prashantjeena/TBS.git,Movie Ticket Booking System,,4
598,https://github.com/boularbahsmail/Movie-Seat-Booking.git,Movie Seat Booking,,4
599,https://github.com/Bahaaib/EventApp.git,Event booking App,,4
600,https://github.com/cargie/booking-plugin.git,booking plugin for octobercms,,4
601,https://github.com/EliteDev0227/Ionic-SmartBeach.git,Online Sunbeds Booking System.,,4
602,https://github.com/samir321-pixel/Django_Cinema_Mall.git,cinema booking api development,"django,django-rest-framework,python,allauth,authtoken",4
603,https://github.com/dwyfrequency/backroads-gatsby.git,ecommerce site for booking tours,,4
604,https://github.com/djaus2/AEGymBook.git,Athletics Essendon GYm Bookings App,,4
605,https://github.com/manojnaidu619/react-movie-seat-booking.git,A movie seat booking app,"movie-seat-booking,react,movie,seating",4
606,https://github.com/restuwahyu13/express-booking-room-rest-api.git,express booking room rest api,,4
607,https://github.com/ProsperChuks/Movie-Buff.git,Movie Booking System using Java,,4
608,https://github.com/SPF-UiO/spbm.git,"The Student Personnel Booking Manager, by and for the Student Cellar Pub Personnel Organsiation at the University of Oslo.","django,payroll,student-management,invoicing,booking,spbm",4
609,https://github.com/OmkarVedak/Railway-Reservation-System.git,"Website for searching trains,checking availability of seats and booking the tickets. ",,4
610,https://github.com/Jakeippo/p2doctoroffice.git,"Doctor office in salesforce with patient logins, appointment booking, and a symptom checker",,4
611,https://github.com/codenamev/bookings.git,"Ruby gem to allow any model to take booking requests, and confirm them",,4
612,https://github.com/shubhamtewari/BusBookingApp.git,"A Bus Booking Android Application for a college level, Transport Network Company.",,4
613,https://github.com/aerele/real_estate.git,Frappe application to manage real estate site bookings and payment tracking on EMIs,"hacktoberfest,hacktoberfest2020",4
614,https://github.com/dxuk/UKOfficeHours.git,Home for the source code of the DX UK Office Hours Booking Site,,4
615,https://github.com/paucls/court-booking-ddd-kotlin.git,A Domain Driven Design exercise around a Sports Court Booking application,,4
616,https://github.com/dmast3r/Ambulance-Booking-Application-a-Taxi-Booking-App-or-an-Ola-Uber-Clone-for-Ambulances.git,This a clone of Taxi Booking Apps like Ola/Uber but for Ambulances.  The inspiration of this project was taken from a problem statement submiited by Ministry of Chhatisgarh in Smart India Hackathon 2018.,,4
617,https://github.com/superJackiee/TravelBooking-System.git,This is the booking system for travelers.,,4
618,https://github.com/dave-d-code/Codeigniter-Auto-Book.git,Codeigniter 3: Complete Calendar Auto Booking System,,4
619,https://github.com/saksham1991999/TaxoTaxi.git,TaxoTaxi.com: A Taxi Booking/Management Platform.,,4
620,https://github.com/Monyancha/Hotel-Management-System.git,Hotel Commerce is Hotel Booking & Reservarion system . Using this you can easily launch your hotel booking website and even manage your offline booking too . ,,4
621,https://github.com/iamraufu/burj-al-arab.git,Hotel Room Booking System in React,,4
622,https://github.com/mycognitive/booking_timeslots_example_site.git,Example site for booking functionality demo.,,4
623,https://github.com/kongminghan/ionic-hotel.git,A hybrid mobile application for hotel booking,,4
624,https://github.com/IrfanHasani/online-booking-laravel.git,"Online Booking, Laravel and FullCalendar.io",,4
625,https://github.com/jessepearson/woocommerce-bookings-order-item-meta.git,WooCommerce Bookings Order Item Meta Addon,,4
626,https://github.com/minhphan156/Abode.git,an online website for hotel booking ,,4
627,https://github.com/eincode/FrizTravel.git,A simple UI for travel booking purposes,,4
628,https://github.com/nix-user/Xamarin.BookMe.git,Xamarin application for room booking system,,4
629,https://github.com/wahib-ouahib/travel-site.git,:unamused: UI for travel booking and calendar,,4
630,https://github.com/nix-user/Xamarin.BookMe.git,Xamarin application for room booking system,,4
631,https://github.com/Woseseltops/booking-crawler.git,"A crawler to make text corpora from booking.com. No longer maintained or working, only here for reference and inspiration for later versions.",,4
632,https://github.com/702webdev/Google-Calendar-API-Booking-Form.git,This is a Booking Form that uses Google Calendar API to automatically put the booking into your Google Calendar and send a confirmation email to you and the customer/client.,,4
633,https://github.com/prajwal714/Movie-Booking-and-Recommendation-Website.git,"Movie Booking Website. Explore Movies, See available Seats, Book Tickets, Generate Invoice, Get History of Bookings, etc. Admin Panel Include Managing Screens, Scheduling Movies, Adding and Updating New Movies. Collaborative filtering suggests movies based on previous bookings. Tech Used: NodeJS, Express, MongoDB-Atlas, EJS Templates, HTML, CSS, Bootstrap.","nodejs,express,mongodb,mongodb-atlas,mongoose,html,css,js,bootstrap3,ejs-templates,movie-booking,movie-database,omdb-api,admin-dashboard,passport,session-management,nosql-database,hacktoberfest",4
634,https://github.com/felix2056/muzbnb.git,"MUZBNB is a vacation rental solution with contemporary features to manage all your rental bookings. Seamlessly get reservations & payments online. Easy way to manage bookings. MUZ is a trending & effective choice for business owners to start business quickly on online marketplace. An online marketplace that enables people to list, find, then rent vacation homes for a processing fee.","airbnb-eslint,vacation,clone,laravel,laravel-framework,laracasts,robots,vacation-rental,airbnb,airbnb-clone",4
635,https://github.com/akshaykhanna/Hotel-Booking-website.git,"Website is created via ASP .NET using C#. Software used are Visual Studio 2010 ( for front + back end development) , SQL server management 2008 ( for DB) and Crystal Report ( for generating booking receipts). For reference ITC hotels are taken for booking . User can book rooms in hotels of ITC using it only if there desired room in desired hotel is available (i.e vacant rooms of that type are available.). If that is not case then user will not be allowed to proceed for booking and instead will be prompted to choose different date or room. For doing all this a great logic is  developed.To know more regarding this logic checkout this link https://akshaykhanna93.wordpress.com/2014/09/14/searching-for-booking-website-logic/",,4
636,https://github.com/yuhanyen/Meeting-Room-Booking-System.git,"MRBS is a free, GPL, web application using PHP and MySQL/pgsql for booking meeting rooms or other resources.",,4
637,https://github.com/redhatdemocentral/rhcs-travel-agency-demo.git,Project to showcase a travel industry booking application known as JBoss Travel Agency Demo in the Cloud.,,4
638,https://github.com/fullDev9233/Booking-By-Django-Vue.git,"Booking website was built with Django, Vue and Bootstrap",,4
639,https://github.com/dchobarkar/Smart_India_Hackathon_2018_Railway_Ministry.git,Digital platform for Guest house booking of Indian Railway Ministry.,"html,css,bootstrap,javascript,node,express,mongodb",4
640,https://github.com/andyljones/driving-test-booker.git,Spots cancellations in the UK driving test booking schedule,,4
641,https://github.com/Ifunanyacollins/oragon.git,"Bus  Booking  App built with React , context Api and firebase",,4
642,https://github.com/towa-digital/booking-com-sdk.git,Developer SDK for the Booking.com API v2,"developer-sdk,sdk,booking-com,booking-com-sdk,booking-com-api",4
643,https://github.com/burakcantimucin/AddingDatesMoreThanOne.git,"{""It's an application for any booking area.""}",,4
644,https://github.com/samsanders23/Cinema-Booking-System.git,"{""An interactive booking system built using Python's Tkinter GUI""}",,4
645,https://github.com/deadshot674gam/General-Cab-booking-System.git,It is a general cab booking system. It ,,4
646,https://github.com/spidah/holidaybooker.git,A website simplifying the holiday booking process for a company,,4
647,https://github.com/rossmmurray/Django-Cinema.git,A cinema booking website created using Python + Django,,4
648,https://github.com/Binsabbar/iBOfficeBeacon.git,Open source project for smart room booking for iOS,,4
649,https://github.com/mhmo91/dahabguide.git,An open source local alternative for airbnb and booking ,"angular,angularcli,firebase,firebase-hosting,travis-ci,software-as-a-service,ngrx,airbnb,booking-platform",4
650,https://github.com/abdullahmujahidali/car-template.git,"An HTML, CSS design for a simple car booking website ",,4
651,https://github.com/mikaeljorhult/d3-schedule.git,JavaScript module for creating gantt-like timeline charts for bookings.,,4
652,https://github.com/calebharnell/fitazfk-frontend.git,ReactJS frontend for FitazFK Gym class-booking app,,4
653,https://github.com/MidigoF/Beauty-Salon-SPA.git,Website for a salon for advertising and appointment booking,,4
654,https://github.com/emilnymann/1AarsProjekt.git,"Førsteårsprojekt - FRBSPORT app til beskeder, booking og øvelser.",,4
655,https://github.com/booking-system/booking-ticket-server.git,"ticket-booking-server is a good system that can help you to build a booking architecture based node, mongodb, and docker.","docker,booking-system,architecture,microservice,nodejs,mongodb-replica-set",4
656,https://github.com/CodeforAustralia/vla-orbit.git,"ORBIT is an online, referral, booking and information tool that helps staff and volunteers make accurate referrals across the legal assistance sector in Victoria.",,4
657,https://github.com/henrymike/RoomScheduler.git,A calendar-booking tool that allows a room to be reserved,,4
658,https://github.com/dzimchuk/book-fast-docker.git,A sample demonstrating how to implement a containerized multitenant facility management and accommodation booking application.,"azure-keyvault,azure-services,azure-search,docker,microservices,netcore,microservices-architecture,azure-ad",4
659,https://github.com/counterpoint-studio/artgift.git,An open source web application for booking and managing Art Gifts,"webapp,gatsby,firebase,typescript,art,culture,react",4
660,https://github.com/tforster/boadroom-clock.git,Raspberry Pi + NodeJS + Google Calendar API + 2x16 LCD = Upcoming boardroom bookings displayed,,4
661,https://github.com/pylonweb/refinerycms-bookings.git,A awesome simple engine for available/occupied booking calendar on frontend and backend,,4
662,https://github.com/MdRubelRana/Airline-Ticket-Booking-System.git,Airline Ticket Booking System. This Project is developed in C programming language.,"programming-language,programming,project,project-management,airplane,airline,c,cprogramming,cproject",4
663,https://github.com/therezacuet/Airline-Management-System.git,Air Ticket booking and Management System based on PHP and MySql,,4
664,https://github.com/nating/scss-glassrooms.git,📖 A Flask application for booking Glass Rooms in Trinity College Dublin.,"trinity-college-dublin,flask",4
665,https://github.com/hakubishin3/booking-challenge-2021.git,Booking.com Challenge  -  WebTour 2021 ACM WSDM workshop https://www.bookingchallenge.com/,,4
666,https://github.com/Vicra/MeetingRoomBookingSystem.git,Meeting Rooms Booking System is an application developed in NodeJs using HapiJs Framework,"booking-system,meeting-rooms,nodejs,hapijs,mysql,swagger,hapijs-generator,boostrap4",4
667,https://github.com/hasimy-as/Bookinglab-User.git,"Ini adalah projek sekolah SMK Telkom Malang, tentang website Booking Lab di sisi User.",,4
668,https://github.com/AnkurTambe/HotelManagementSystem.git,A Java Project used for booking rooms and services and generates check-out bills.,"java,vscode",4
