,Url,Description,Topics,Stars
699,https://github.com/framgia/fepas-cbs.git,[FEPAS] Conference room Booking Service,,3
700,https://github.com/HBurakKaradag/MVC_Course_Booking.git,MVC DomainDrivenDesign Booking Sample,,3
701,https://github.com/munna-singh/HotelPOC.git,POC for Travel Edge Hotel Bookings,,3
702,https://github.com/pratik14/booking.git,Real time notification using websockets of theater seats while booking,,3
703,https://github.com/cubetaxi/uber-clone-app.git,Taxi Booking App Development,"uber-clone,taxi-app,taxi-booking,iphone-app,androidapplication,taxi,entrepreneurs",3
704,https://github.com/haryphamdev/doctors-appointment-booking-system.git,Doctors appointment booking system,,3
705,https://github.com/antrix1/flight-booker.git,Ruby on Rails Flight Booking app,,3
706,https://github.com/shubhi101/shramps.git,A floorplan layout integrated restaurant booking platform,,3
707,https://github.com/anevsky/HotelBookingSystem.git,Hotel Booking System - Native Java Web,"java,jsp,booking,booking-system,mvc",3
708,https://github.com/surajdidwania/Quantum-Cinemas-Android-Applicaion-.git,Quantum-Cinemas-Movie Booking App(Android-Applicaion),,3
709,https://github.com/obiefy/booking-system.git,Laravel venues booking system,"laravel,booking-system",3
710,https://github.com/tompato/box-office.git,A simple ticket booking system built in Python using Flask,,3
711,https://github.com/LAXITKUMAR/Bus-Ticket-Booking.git,Sample Angularjs App for showing bus ticket bookings,,3
712,https://github.com/nhsconnect/NHS-Booking-API.git,FHIR Implementation Guide for NHS Booking API,,3
713,https://github.com/stackroute-immersive/ibm-w2-buzzup-server.git,IBM wave 2 - An open platform product for events/seats/ticket booking - Server Repository,,3
714,https://github.com/indico/indico-maps.git,Tileserver microservice for Indico Maps (Room Booking),,3
715,https://github.com/sjstone2838/booking_bot.git,Booking Bot,,3
716,https://github.com/hajirodeon/booking-pasien.git,booking-pasien,"booking,pasien,periksa,rumah,sakit,klinik,php,mysql,jquery,biasawae",3
717,https://github.com/dipanjan92/BoxOffice.git,Django based Movie Ticket Booking System,,3
718,https://github.com/shahbazgithub/Doctor-Sahab-Website.git,Finding and booking of nearby doctors.,"html5,css,javascript,css-framework",3
719,https://github.com/VarunBhandia/Student-Club-Payment-Portal.git,Online Booking portal for Student Club IITR,,3
720,https://github.com/shahbazgithub/Doctor-Sahab-Website.git,Finding and booking of nearby doctors.,"html5,css,javascript,css-framework",3
721,https://github.com/arihantsethia/IITG-Gymkhana-Automation-Portal.git,Automated System for Event/Venue Booking at IIT Guwahati,,3
722,https://github.com/palashjhabak/erpnext-restaurant.git,App to Handle Restaurant Bookings based on Frappe Framework,,3
723,https://github.com/alxwrd/specsavers.git,:eyeglasses: A Python wrapper around the Specsavers appointment booking API,"python,reverse-engineering,client,api-client,specsavers,testing",3
724,https://github.com/ajomadlabs/MBook.git,Hospital Appointment Booking App,"vuejs2,bootstrap3,node-js,express-js,docker-image,mongodb",3
725,https://github.com/book/Acme-CPANAuthors-Booking.git,Booking.com CPAN authors,,3
726,https://github.com/AjayPoshak/blubus.git,🚌 Bus Booking Clone PWA,"react,redux,redux-thunk,webpack4,jest,enzyme",3
727,https://github.com/Seitenbau/RoomieReloaded.git,Zimbra room booking overview,,3
728,https://github.com/medabdallahh8/GofundRoom.git,Booking Hotel App,"react,reactnative,reactnavigation5,javascript,bookinghotelapp,reactjs,android,ios",3
729,https://github.com/iParthaSarathi/train_booking_system.git,a online train booking system,,3
730,https://github.com/Nditah/bus-booking.git,bus booking with ionic angular,,3
731,https://github.com/adriandmitroca/ticketify.git,[LEGACY] Simple Ticket Booking app in Laravel 4.2,,3
732,https://github.com/thesabbir/cawar.git,Clash of clans war base booking application backend,,3
733,https://github.com/kcbighuge/p5-capstone.git,Udacity MLND Capstone Project: Airbnb New User Bookings,,3
734,https://github.com/teamhangover/Group-Project.git,A website for booking keepers to keep your Pet,"google-maps-api,places-api,places-autocomplete,spring-boot,spring-security,mysql,bootstrap,jquery,javascript,java,bootstrap4,paypal-rest-api,ajax-request,multipart-uploads,roles",3
735,https://github.com/kzaf/GetARoom.git,Android application for hotel and motel booking and management,,3
736,https://github.com/Coder-Academy-Patterns/rails_bnb.git,"AirBnB clone with Geocoder, Countries, Devise, Bookings, Stripe",,3
737,https://github.com/JuliRash/Jembe-Restaurant.git,A Django web application for booking tables and meals in a restaurant. :),,3
738,https://github.com/mehakmeet/BTBapp.git,"Online Bus Ticket booking android app that uses real-time database,firebase.",,3
739,https://github.com/MiKinshu/SRPS-Flights.git,An android App for airline booking.,,3
740,https://github.com/Kaushalvashisth/EasyBook.git,Movie ticket booking & Movie details reference website.,,3
741,https://github.com/cmdrkeene/booking.git,Web application for booking our apartment,,3
742,https://github.com/Airportia/booking-com-sdk.git,Simple wrapper around booking.com API,"booking-com-sdk,booking-com-api",3
743,https://github.com/avastamin/booking_management.git,"Booking management with Laravel, angularjs and Fullcalendar",,3
744,https://github.com/EmmanuelSage/fyyur.git,Fyyur is a musical venue and artist booking site that facilitates the discovery and bookings of shows between local performing artists and venues.,,3
745,https://github.com/EgorSmutkin/BookingHotels.git,"APS .NET MVC application for hotels booking, leaving feedbacks and uploading images",,3
746,https://github.com/iambaljeet/trips_flutter_app.git,"A mobile application for trip booking developed in Flutter for all platforms Android, iOS and Web.","flutter,flutter-apps,flutter-examples,flutter-demo,flutter-app,flutter-widget,flutter-material,flutter-ui,application,app,apps,mobile-app,mobile-development,android-application,ios,website,dart,dartlang,dart-web",3
747,https://github.com/SuperSaaS/supersaas-php-api-client.git,Online bookings/appointments/calendars in PHP using the SuperSaaS scheduling platform - https://supersaas.com,,3
748,https://github.com/dhpradeep/vb-project.git,"Point of sale(POS) system build on .net framework, having bill printing, room booking, mailing functionality.",,3
749,https://github.com/Hanupriya26/CSE-Automation.git,Creation of Room Booking Management system with the help of PHP,,3
750,https://github.com/dhvanilp/OuRCTC.git,This gives an implementaion for railway booking system. This is made using Django,"railway-reservation,database-management,mysql-database,server-client,ticket,station,book-tickets,region,django",3
751,https://github.com/Developers-Society-Jadavpur-University/venue-booking.git,"This is the Project Related to the Venue booking and management System for our own university and it will be an integrated system for booking of various seminar Halls/classrooms via faculty , officials with a less paperwork and good automation",,3
752,https://github.com/19tanisha/Movie-Ticket-Booking-.git,"The objective of the Movie Ticket Booking System is to manage the details of Seats, Booking, Customer, Payment and Shows. The puprose is to reduce the manual work for managing the Booking System. It tracks all the details about the Customer, Payment, Shows",,3
753,https://github.com/akshay-kr/Hotel-Management-System.git,Hotel Management System is developed in java platform. It helps the user in easy booking of rooms or use of restaurant in hotel industry.,,3
754,https://github.com/dipanjanS/online-movie-booking.git,This project consist of a template which can be used for handling operations related to typical online movie booking websites.,,3
755,https://github.com/grvsachdeva/Ticket-Booking-Platform---Udaan-dev-challenge.git,This project exposes the API for Ticket booking Platform :ticket: . It is made using NodeJS and MySql as database,"nodejs,express,mysql-database,cleardb,sequelize-orm",3
756,https://github.com/amamenko/GlowLabs.git,MERN stack application for appointment booking and employee/client management,"square,booking,booking-appointments,consent-forms,card-information,twilio,mjml,staff-management,calendar,appointments,shopping,skincare",3
757,https://github.com/james-muriithi/bus.git,"A simple bus booking project in html, css, Jquery","bus-reservation-system,bus-reservation,seat-booking,bus",3
758,https://github.com/openactive/models-php.git,PHP Models for the OpenActive Opportunity and Booking Specifications,"implementation-support,php,pre-release",3
759,https://github.com/jelic98/petplus_api.git,API for an application for booking private mentoring.,,3
760,https://github.com/saukr1006/Railway-Reservation-Management.git,Nodejs app that manages the booking of tickets in railways.,"nodejs,mongoose,passportjs,passport-local,expressjs,bcryptjs,database-management,hbs,html5,css",3
761,https://github.com/ayatmaulana/cekBookingKeretaCLI.git,":train2: Best CLI tool to check the Indonesian railway booking code as easily, quickly, and elegantly.","cli,nodejs,npm,kereta,train,train-bookin",3
762,https://github.com/chintamanand/Online-Movie-Ticket-Booking---using---Jsp.git,Online Movie Ticket Booking project with full database Connectivity using Jsp,"movie,ticket,booking-system,jsp,sql,sqlyog,html-css,javascript,java-8,java-library,sql-server,tomcat-server,apache",3
763,https://github.com/pyatl/podium.git,A simple web app for booking and scheduling Python Atlanta talks,,3
764,https://github.com/billmeiss/mongodb-nextjs-appointments.git,"An example project integrating a booking system with Next.js, mongoDB and tailwindCSS (UI Design). ",,3
765,https://github.com/dhirajpatra/bookyourstand.git,Full backend [Laravel] & frontend [AngulaJs] application for map based event/seat booking application.,"laravel5,mysql,angularjs,phpunit,rest-api",3
766,https://github.com/rojagtap/Book_My_Train.git,Online Railway Ticket Booking Web App developed using the Python-Django Framework. ,"django,python,html,css",3
767,https://github.com/sensatyaki/Doctor-FInder-android-application.git,"An android application to find nearby doctors(Based on location),booking appointmnets,recommendation system for patients",,3
768,https://github.com/Blaked84/ResaSKZ.git,Booking system for the biggest student skiing event in France - SKZ ,,3
769,https://github.com/jbossdemocentral/bpms-dv-travel-agency-integration-demo.git,A JBoss BPM Suite with JBoss Data Virtualization integration demo project around a travel agency booking workflow with disparate data sources behind services.,,3
770,https://github.com/a05110511t/NTUH_Booking.git,Booking NTUH,,3
771,https://github.com/VilllageBookBuilders/VBBPortal.git,A basic Django Rest Framework/React app for booking mentoring sessions with students in the villagebookbuilders libraries across the world.,"village,book,builders,villagebookbuilders,nonprofit,django,react,mentoring,mentorship,booking,booking-platform,literacy,education,development,community",3
772,https://github.com/jagjot444/Cushy-Cabs.git,There are two android mobile applications that come with Cushy Cabs  app such as  Passenger App for booking and tracking cabs and  Driver App which the drivers can use for accepting the requests for mobile booking.,,3
773,https://github.com/ntwarijoshua/Avalanche.git,Booking platform saas,,3
774,https://github.com/vudayagirivaibhav/HealthCare-Emergency-Management.git,"An Emergency Application A Mobile & Web based application providing the shortest path a user can en-route during emergencies. It also helps in booking appointments, searching doctors, and booking ambulances.",,3
775,https://github.com/ienders/icottage.git,Alexander Cottage booking site,,3
776,https://github.com/m0h1t98/Python.git,Air Ticket Booking System,,3
777,https://github.com/surendhar007/Software-project-.git,Online movie ticket booking ,,3
778,https://github.com/sirmmo/RaMBo.git,Resource Booking Manager,,3
779,https://github.com/camunigeog/bookings.git,Online slot booking system,,3
780,https://github.com/m0h1t98/Python.git,Air Ticket Booking System,,3
781,https://github.com/sirmmo/RaMBo.git,Resource Booking Manager,,3
782,https://github.com/camunigeog/bookings.git,Online slot booking system,,3
783,https://github.com/partha7278/CarShowRoom.git,Car Booking desktop application,"test-drive,car-pre-booking,car-booking,csharp,desktop-application",3
784,https://github.com/gsofter/vacation-rentals-booking.git,Booking Automation Site,,3
785,https://github.com/kashaf12/TripPlanner.git,Android Hotel Booking App,,3
786,https://github.com/waeltech/booking-calendar.git,php booking calendar,,3
787,https://github.com/garg3133/fossee.git,FOSSEE - Room Slot Booking,,3
788,https://github.com/jmccarth/mad-booking.git,MAD booking system v2,,3
789,https://github.com/mymedialab/booking.git,A resource-booking API.,,3
790,https://github.com/terencelimzhengwei/active-sg-badminton.git,Badminton Bookings in Singapore,,3
791,https://github.com/MuhammadAliKhan1/Flutter_Gunsel_Lines.git,A bus booking software,,3
792,https://github.com/robertogds/rlb-iOS.git,Really Late Booking,,3
793,https://github.com/staypress/staypressbooking.git,The StayPress Booking plugin,,3
794,https://github.com/robertogds/ReallyLateBooking.git,Really Late Booking,,3
795,https://github.com/honestworker/webcms.git,The Laravel Booking project,,3
796,https://github.com/croath/meeting.git,Meeting rooms booking system.,,3
797,https://github.com/dbellotti/musigigs.git,music gig booking service,,3
798,https://github.com/milosrancic/reactjs-website.git,ReactJS Booking website ,"react,booking,bootstrap,scss",3
799,https://github.com/arvidbjorkstrom/Booking-System.git,Bookingsystem for handling bookings,,3
800,https://github.com/Sudhanshu124/Web.git,Online restaurant booking system,,3
801,https://github.com/SatyaS7/BookingApp.git,Spring Restful Booking Application,,3
802,https://github.com/prakhargupt00/Vixigo-Hotel-app.git,Hotel booking system,,3
803,https://github.com/manishm05/Restaurant-App-Android-.git,"Restaurant app is an android based application that helps in booking seats online in a restaurant, viewing menu, and check the ratings of the restaurant.","restaurant-management,restaurant-app,restaurant-menu,rating-bar,android-app,android,android-based-restaurant-app",3
804,https://github.com/BCS-io/schedule_gardener.git,Website for booking a gardener,,3
805,https://github.com/tricaodo/Movie-Booking-System-App.git,Movie Booking System for theaters,,3
806,https://github.com/evanchristians/hotel_booking.git,HotelBooking - PHP/MYSQL BOOKING APP,,3
807,https://github.com/elhusseiniali/andromeda.git,A Flask flight booking engine.,,3
808,https://github.com/restuwahyu13/express-booking-room-graphql.git,express booking room graphql api,,3
809,https://github.com/pedroherub/bookinglab.git,HCMUT computer lab booking system,,3
810,https://github.com/kenigbolo/openSalon.git,An open source saloon booking and management system for beauty/hair care providers and the general public,,3
811,https://github.com/pedroherub/bookinglab.git,HCMUT computer lab booking system,,3
812,https://github.com/pkel/ghm.git,Booking management for small guesthouses,"postgrest,ocaml",3
813,https://github.com/fragaLY/booking-system-api.git,The booking-system api template.,,3
814,https://github.com/BrainSugar/hotel-booking.git,Another hotel booking wordpress plugin.,,3
815,https://github.com/kpturner/sails_events.git,Event booking system using Sails,,3
816,https://github.com/alicankustemur/tatil-yap.git,Tatil Yap  - Holiday Bookings Project,,3
817,https://github.com/SRvSaha/CoWinVaccineSlotFinder.git,Console App to Fetch the Available Slots & Booking the Appointment Schedule for COVID-19 Vaccination using the Publicly available APISetu APIs from Govt Of India,"cowin,vaccine-tracker,vaccine-availability,vaccination,covid-19,vaccine-appointments,cowin-vaccine-tracker",3
818,https://github.com/kyle-c-simmons/cinema-website.git,"Full stack Cinema website with payment, movies API and booking system","html5,css3,scss,javascript,vuejs,java-spring-boot,bootstrap4",3
819,https://github.com/vbertoletti/Event-Booking.git,"An event booking system built using React.js, GraphQL, Node.js and MongoDB.",,3
820,https://github.com/avar/linux-smaps-tiny.git,A tiny and fast alternative to Linux::Smaps that does what booking needs,,3
821,https://github.com/Jacwutang/OpenTummy.git,"A live  restaurant booking application. Built with Ruby on Rails, React/Redux","react-redux,javascript,ruby-on-rails,postgresql",3
822,https://github.com/JesperBry/MERN-booking-system.git,📆Booking system created with the MERN-stack (bolierplate used: https://github.com/JesperBry/MERN-boilerplate),,3
823,https://github.com/lifei96/FeiFlight.git,A flight booking system (course project for Introduction to Database Systems),"database-systems,flight-booking,mysql,flask",3
824,https://github.com/Adamouization/MOVON.git,:soccer: :basketball: :tennis: :football: Sports facilities booking-system for Universities (Launchpad 2017 Hackathon),"hackathon,bath,launchpad,sports,website,html,css,javascript,nodejs,expressjs,handlebars",3
825,https://github.com/apple0032/Laravel-Hotel-Booking-System.git,"Laravel 5 based application for Hotel Booking. Develop with Laravel Framework, Bootstrap 3, Jquery. ",,3
826,https://github.com/pamcy/React-Hotel-Booking-Ajax.git,"Build a hotel booking website with React, React Router and Axios.","react,react-router,axios,ajax-request,form-validation,datepicker",3
827,https://github.com/reeversedev/urban-events.git,"Event Booking Application using GraphQL, MongoDB, Node.js and React.js",,3
828,https://github.com/sujit420/hindibot.git,hindi chat bot for cab booking,"chatbot,hindibot,ner",3
829,https://github.com/zain08816/Flightinator.git,Flight Booking Site built in React,,3
830,https://github.com/pushpendraGit/Airbnb-Clone-Restaurant-Booking-Site-.git,Restaurant Booking Site Using React.js,,3
831,https://github.com/FxxkTheLife/LibraryIsMyHome.git,The library booking CRACKING system in CJLU.,,3
832,https://github.com/iamraufu/cruisequeen.git,"Online Launch Ticket Booking, Launch Routes, Launch Timings, Launch Tickets, Launch Booking, Launch Service, Launch Fares, Travels. Online Booking, Online Ticket System",,3
833,https://github.com/surajkumarbhagat71/Thebus.git,The advance future of bus booking system,,3
834,https://github.com/codeasylums-bootcamp/team_poison_may-19.git,Auto fill Booking Portal - IRCTC etc.,,3
835,https://github.com/khyamay/awesomeMovie.git,Simple Angular.js App for Movie Booking,,3
836,https://github.com/dipakkr/appointment-booking.git,"Appointment Booking Application Using ReactJS, JavaScript","reactjs,loadash,react-icons,bootstrap",3
837,https://github.com/team11-softeng2/team11-PULSeBS.git,Pandemic University Lecture Seat Booking System,,3
838,https://github.com/sofianemajdoub/BookingAndroid.git,booking for restaurants and the nightclubs,,3
839,https://github.com/jakub-g/no-urgency.git,Block fake urgency messages on booking websites,,3
840,https://github.com/surajkumarbhagat71/Thebus.git,The advance future of bus booking system,,3
841,https://github.com/KajdeMunter/Ictlab-Application.git,Ionic room booking application for INFLAB01,,3
842,https://github.com/ajinkyagholape1998/Movie-Ticket-Booking-Management.git,Project on online movie ticket booking system,,3
843,https://github.com/trivago/express-booking-selfconnect-api.git,trivago Express Booking - Self Connect API,,3
844,https://github.com/pavankpdev/MovieTown.git,"Online movie booking app, built with MERN","reactjs,nodejs,expressjs,mongodb,razorpay-api,tmdb-api",3
845,https://github.com/huyhungdev/cgv.git,Project movie tickets online booking use MERN,,3
846,https://github.com/blazeteam/events-manager-booking-payments-with-woocommerce.git,Events Manager - Booking Payments with WooCommerce,,3
847,https://github.com/mayankroot/ParkKingg.git,Android app based parking slot booking system.,"android-studio,parking-management,java,sqlite,android-app,android,android-app-car-parking,car-parking-slot-booking-app,slot-booking-app,notification-service",3
848,https://github.com/patrick333/fullcalendar-reservation.git,"Easy online revervation/booking using fullcalendar, bootstrap.",,3
849,https://github.com/efurban/VRBookingSynchronization.git,"booking sync related: airbnb, wimdu, bookingsync, mysql",,3
850,https://github.com/kibson/Vehicle-Booking-System.git,Taxi Booking System. Tagline Executive cabs company,embucountybookingsystsem,3
851,https://github.com/Droy24/YourBus.git,RestFul Api for online bus booking,"spring-boot,spring-data-jpa,spring-security,repository,api,api-rest,oauth2,spring-oauth2-security,spring-oauth2-rest",3
852,https://github.com/w-devin/Seat.git,booking and checking writen by python.flask,,3
853,https://github.com/nebulae-pass/Booking.git,"A room Booking Application, developed by kotlin",,3
854,https://github.com/ndulue/php-golf-tournament-booking.git,Online golf tournament booking for shivas 2020,,3
855,https://github.com/SamuSan/SWEN302_RumBukka_Project.git,Room booking system for Victoria University,,3
856,https://github.com/erridius/SigmaSoftware.git,CRUD Booking service on ASP NET MVC,,3
857,https://github.com/BlomstermalaBuss/BlomstermalaBuss.git,A web application for booking bus trips,,3
858,https://github.com/rahull247/OnlineDoctorAppointmentSystem.git,ASP .NET Project of Appointment Booking,,3
859,https://github.com/ans-group/booking-powerapp.git,Booking Application built with Microsoft PowerApps,powerapps,3
860,https://github.com/abhisheksaxena1998/Assignment.git,MOVIE TICKET BOOKING SYSTEM USING REST APIs,ticket,3
861,https://github.com/imKashyap/Driven.git,A Taxi Booking App built in flutter,"flutter,taxi-app,dart,android-application,mapbox,firebase",3
862,https://github.com/MiamiCoder/jquerymobile-tutorial-user-reg-login-logout-screens.git,"Source code for jQuery Mobile tutorial that shows how to create the screens that will handle user registration, login and logout screens. See tutorial here: http://miamicoder.com/2014/jquery-mobile-tutorial-user-registration-login-and-logout-screens-for-the-meeting-room-booking-app/",,3
863,https://github.com/cam-technologies/time-booker.git,"Web based time booking application, build using the MEEN stack. This application will allow users to manually enter work times in blocks of hours and minutes for each day of the week.",,3
864,https://github.com/DuhastMish/BookingParser.git,"Booking hotel information scraper and parser. Collects all possible information from booking.com, except reviews and accommodation options.","parser,python,sqlalchemy,analyzer,booking",3
865,https://github.com/VidulaDakshitha/Clinic-Managemnt-System-using-Laravel.git,"This is a web application for a homeopathy clinic. contains all features for booking doctors, payments, pdf document generations etc. ",,3
866,https://github.com/bose4awesome/ticketbooking.git,A Java Based project to demonstrate how movie ticket booking system works in the user as well as admin domain.,"javafx-project,mvc-pattern,java,sqlite-database",3
867,https://github.com/MehaRima/online_ambulance_booking_service.git,"Source code for creating online ambulance booking system using Php,Css,Html,Xampp Server & MySql database,PhpMyAdmin etc.","ambulance,php,mysql-database,xampp-server,bca-project,booking-system,online,service,help-wanted,ambulance-booking,major-project,css,html-css-javascript,code,meharima,aarogya,sahelibasu",3
868,https://github.com/BaseMax/TaxiBookingMap.git,A web page for booking a taxi with some feature to convert address to latitude and longitude to display the route on the map.,"js,javascript,map,maps,google-maps-api,google-maps,google-maps-javascript-api,google-maps-javascript,google-map,google-map-api,google-maps-services,taxi,taxi-booking",3
869,https://github.com/sghariha/Airbnb_Recommendations.git,"{""An Airbnb destination recommendation system (Kaggle competition) to predict a new user's booking destination given their demographics, web session records, and other summary statistics. Coded in Python.""}",,3
870,https://github.com/ccordenier/tapestry5-hoteldb.git,Hotel booking data module used for my Tapestry 5 presentation,,3
871,https://github.com/matijakovacevic/CommentScraper.git,Site comment scraper (Booking.com & Tripadvisor.com in-built),,3
872,https://github.com/elprs/BookingPlatform.git,An one-page front-end example of a booking system. ,,3
873,https://github.com/Nazukao80/ionic2-hotel-booking.git,A ionic 2 scaffolding app to booking hotels,,3
874,https://github.com/devrchancay/everymundo-booking-practical-exercise.git,"✈️ Knowledge test, React / Redux / Jest / Enzyme. Building a booking mask.","reactjs,redux,tailwindcss,jest,enzyme",3
875,https://github.com/Kalpesh209/flutter_movie_booking_ticket_app.git,On Demand Movie Ticket Booking App In Flutter,"flutter,dart,flutter-apps,flutter-examples,flutter-ui,flutter-movie-ticket-app,flutter-movie-app,dart-library,dart-package,dart-web,flutter-web,flutter-firebase,cross-platform,hybrid-apps,flutter-movies,movie-ticket-booking,movie-ticket-management,flutter-movie-search",3
876,https://github.com/vago/migrationsverket.git,scheduled task to find booking slot for biometrics on migrationsverket,,3
877,https://github.com/Tahmid-islam/burj-al-arab.git,"React hotel booking app with google firebase auth, react router",react,3
878,https://github.com/peterrobert/Hotel-Booking-frontEnd.git,This is the front end of my hotel booking application,,3
879,https://github.com/kamaubrian/BookingGraphQLAPI.git,"A GraphQL API written in Node Js to handle bookings, ","graphql,nodejs,apis,academind,express,express-graphql,mongoose,mongodb",3
880,https://github.com/imboogieman/Boogi.git,Boogi - booking and touring platform for music professionals,,3
