,Url,Description,Topics,Stars
156,https://github.com/lxgw/LxgwWenKai.git,"{""An open-source Chinese font derived from Fontworks' Klee One. 一款基于 FONTWORKS 的 Klee One 的开源中文字体。""}",,582
157,https://github.com/googlefonts/Inconsolata.git,Development repo of Inconsolata Fonts by Raph Levien,"inconsolata,google-fonts,inconsolata-fonts",566
158,https://github.com/svenkapudija/Android-Action-Bar-Icons.git,Font Awesome and Android Stock icons in holo_light/holo_dark and ldpi/mdpi/hdpi/xhdpi/xxhdpi versions,,564
159,https://github.com/jpswalsh/academicons.git,An icon font for academics,"css,icons,font,icon-font,academicons,icon-set",562
160,https://github.com/romeovs/creep.git,a pretty sweet 4px wide pixel font.,"font,pixel-font,haskell-syntax,box-drawing,fontforge,sparkline,drawille",559
161,https://github.com/mixu/electroshot.git,"Capture website screenshots with optional device and network emulation as jpg, png or pdf (with web fonts!) using Electron / Chrome.",,552
162,https://github.com/mooman219/fontdue.git,"The fastest font renderer in the world, written in pure rust.","rust,font,truetype,rasterizer,opentype,ui",550
163,https://github.com/akosma/CoreTextWrapper.git,An Objective-C wrapper around Core Text for creating multi-column text and loading custom fonts,,544
164,https://github.com/sunaku/tamzen-font.git,"💌 Bitmapped programming font, based on Tamsyn","font,monospace-font,bitmap-font",544
165,https://github.com/alerque/libertinus.git,The Libertinus font family,"font,math,opentype",538
166,https://github.com/darwiin/yaac-another-awesome-cv.git,YAAC: Another Awesome CV is a template using Font Awesome and Adobe Source Font.,"latex,latex-template,cv,resume-template,resume,cv-template,font-awesome,template,overleaf",533
167,https://github.com/jquery-textfill/jquery-textfill.git,Resizes font-size of text to fit into container,,531
168,https://github.com/juliettef/IconFontCppHeaders.git,"C, C++ headers and C# classes for icon fonts: Font Awesome, Fork Awesome, Material Design, Kenney game icons and Fontaudio","codepoints,headers,header-files,font-icons,icon-font,font-awesome,material-design,imgui,ui,library,gui,icons,fontawesome,icon-fonts,fontawesome5,c,cpp,c-plus-plus,csharp,gamedev",528
169,https://github.com/fizzed/font-mfizz.git,Font Mfizz - Vector Icons for Technology and Software Geeks,,526
170,https://github.com/WordPress/dashicons.git,"Dashicons, the WordPress admin icon font. For the official resource, please see the WordPress Developer Hub.",,522
171,https://github.com/lucy/tewi-font.git,small bitmap font,,521
172,https://github.com/itsjavi/fontawesome-iconpicker.git,Font Awesome Icon Picker component for Bootstrap.,"fontawesome,fontawesome-icons,bootstrap,js,javascript,icon-picker,font,chrome-extension,fontawesome5",520
173,https://github.com/tmm1/emoji-extractor.git,extracts high-resolution emoji pngs from /System/Library/Fonts/Apple Color Emoji.ttf,,500
174,https://github.com/csstools/system-font-css.git,Use the native system font of the OS running the browser,,499
175,https://github.com/linebender/runebender.git,A font editor written in Rust.,,498
176,https://github.com/antijingoist/open-dyslexic.git,What I intend to be an opensource font for dyslexics and for high readability,,496
177,https://github.com/jpt/barlow.git,Barlow: a grotesk variable font superfamily,,494
178,https://github.com/kylehickinson/Sketch-SF-UI-Font-Fixer.git,"{""A Sketch plugin that adjusts the character spacing on text layers using iOS 9's SF UI Text/SF UI Display fonts to what it would be when used in an iOS app.""}","sketch,plugin,font,sketch-plugin,san-francisco",492
179,https://github.com/unicode-org/last-resort-font.git,Last Resort Font,"font,truetype,ttf,unicode",483
180,https://github.com/googlefonts/fontmake.git,"Compile fonts from sources (UFO, Glyphs) to binary (OpenType, TrueType).",,481
181,https://github.com/keremciu/font-bundles.git,Main font-bundle for sketch icon-font plugin.,,480
182,https://github.com/AvisoNovate/pretty.git,"Library for helping print things prettily, in Clojure - ANSI fonts, formatted exceptions","clojure,feedback,ansi-colors",476
183,https://github.com/GcsSloop/FontsManager.git,help you change the module font easily.(方便快速的为应用内所有组件更换字体),,476
184,https://github.com/fcambus/spleen.git,Monospaced bitmap fonts,"monospaced,bitmap-font,bdf,pcf,psf",473
185,https://github.com/schreiberstein/lucidagrandeyosemite.git,"{""An Automator/Apple-script to use 'Lucida Grande' as system font on OS X Yosemite""}",,466
186,https://github.com/supercomputra/SF-Mono-Font.git,SF Mono Font,"typeface,sf-mono-font",463
187,https://github.com/spacerace/romfont.git,VGA and BIOS rom font extraction,"vga,font,bitmap-font,ega,cga,mda,pc,ibm,xt,at,tandy,tseng,ati,3dfx,nvidia,s3,v7,spea,bios,ami",458
188,https://github.com/memononen/fontstash.git,Light-weight online font texture atlas builder,,453
189,https://github.com/norbusan/jfontmaps.git,dvipdfmx map files and support programs for Japanese font setup,,452
190,https://github.com/AudioKit/ROMPlayer.git,"AudioKit Sample Player (ROM Player) - EXS24, Sound Font, Wave Player","sound,exs24,exs,player,sampler,music,audio,keyboard,piano,synth,synthesizer,soundfont,wave,aiff,samples,reverb,delay,midi,knob,knobs",451
191,https://github.com/thomaspark/glyphsearch.git,"Search for icons from Font Awesome, Glyphicons, IcoMoon, Ionicons, and Octicons","octicons,icomoon,ionicons,glyphicons,font,font-awesome,icon-font",449
192,https://github.com/khrome/ascii-art.git,"A Node.js library for ansi codes, figlet fonts, ascii art and other ASCII graphics","javascript,ascii-art,ansi-styles,ascii,ansi-codes,tables,figlet,images,compositing,terminal-graphics,command-line-tool",448
193,https://github.com/yeslogic/allsorts.git,"Font parser, shaping engine, and subsetter implemented in Rust","rust,font-subset,opentype,font-shaping,font-layout",444
194,https://github.com/adi1090x/termux-style.git,Simple script to change color-schemes and fonts for Termux.,"termux,termux-style,termux-styling,termux-font,termux-tool,termux-tools,terminal,android,android-terminals,color-schemes,themes,bash,zsh,fish,ohmyzsh,adi1090x",440
195,https://github.com/PascalPixel/pokemon-font.git,"GAME BOY font from Pokémon R/G/B/Y/G/S/C, Unicode extended.","font,glyphs,pokemon-font,ligatures,latin,character,game,video-game,gameboy,katakana,web-fonts,unown,pkmn,hiragana,japanese",439
196,https://github.com/elliakou/proxima-nova-web-fonts.git,Proxima Nova Web Fonts,,435
197,https://github.com/IamDH4/ttf-wps-fonts.git,Symbol fonts required by wps-office.,,433
198,https://github.com/gamecreature/QtAwesome.git,QtAwesome - Font Awesome support for Qt applications,"qtawesome,qt-application,icons,c-plus-plus,font",433
199,https://github.com/joe-bell/next-google-fonts.git,A tiny Next.js helper for loading Google Fonts fast and asynchronously ⏩,"nextjs,google-fonts,font-loading",430
200,https://github.com/notwaldorf/font-style-matcher.git,⚡️🎨 Matches the x-heights and widths of two fonts,,429
201,https://github.com/domness/DWTagList.git,"Create a list of tags from an NSArray to be show in a view with customisable fonts, colors etc.",,428
202,https://github.com/FontFaceKit/open-sans.git,Open Sans @font-face kit,,426
203,https://github.com/ButTaiwan/genyo-font.git,Free font derived from Source Han Serif,,425
204,https://github.com/allanguys/font-spider-plus.git,font-spider-plus（字蛛+）是一个智能 WebFont 压缩工具，它能自动分析出本地页面和线上页面使用的 WebFont 并进行按需压缩。,,425
205,https://github.com/SSNikolaevich/DejaVuSansCode.git,Monospaced font with programming ligatures based on DejaVu Sans Mono,,423
206,https://github.com/majutsushi/urxvt-font-size.git,Change the urxvt font size on the fly,,422
207,https://github.com/vsvankhede/EasyFonts.git,Useful library to use custom fonts in your android app,,417
208,https://github.com/drinchev/monosocialiconsfont.git,Mono Social Icons Font,,416
209,https://github.com/davedelong/sfsymbols.git,Export the shapes in the SF Symbols font,"maintainer-wanted,sf-symbols-font,sf-symbols",415
210,https://github.com/kenangundogan/fontisto.git,"The iconic font and CSS toolkit. Fontisto gives you scalable vector icons that can instantly be customized: size, color, drop shadow and anything that can be done with the power of CSS.","font,icon,icon-font,icon-pack,font-library,font-icon,font-icon-libraries,fontisto,web-font,web-icons,icon-set,sass,less,stylus,addon,extension,iconic-fonts,glyph-icons",415
211,https://github.com/rroylance/phaser-ce-npm-webpack-typescript-starter-project.git,"Project to get you started with your Phaser-CE (using the npm module) game using Typescript and Webpack for building! No hassle asset management, Google Web Font loader, live server, development vs distribution build pipeline, Electron packaging for desktop builds, and more...","phaser,typescript,template,npm,node,webpack,game,electron,app,desktop,mobile,windows,osx,mac,linux,loader,phaser-ce",415
212,https://github.com/xero/figlet-fonts.git,my collection of figlet / toilet ascii art fonts,"fonts,ascii,ascii-art,figlet,toilet,command-line,collection,custom",409
213,https://github.com/ynakajima/ttf.js.git,JavaScript font library for Node.js and browser.,,406
214,https://github.com/chrislewiscodes/font-to-width.git,Font-To-Width,,398
215,https://github.com/expo/google-fonts.git,Use any of the 977 fonts (and their variants) from fonts.google.com in your Expo app.,,398
216,https://github.com/byte-foundry/prototypo.git,Create your own font in a few clicks,"prototypo,font,parametric-fonts,font-generator,typography",394
217,https://github.com/edihbrandon/RictyDiminished.git,Ricty Diminished --- fonts for programming,,392
218,https://github.com/googleprojectzero/BrokenType.git,TrueType and OpenType font fuzzing toolset,,392
219,https://github.com/andryblack/fontbuilder.git,Bitmap font generator,,390
220,https://github.com/atermenji/IconicDroid.git,IconicDroid is a custom Android Drawable which allows to draw icons from several iconic fonts.,,389
221,https://github.com/azadis/MC-GAN.git,Multi-Content GAN for Few-Shot Font Style Transfer at CVPR 2018,,386
222,https://github.com/trufont/trufont.git,TruFont is a streamlined and hackable font editor. À l’ancienne.,"fonts,vector-graphics,desktop",386
223,https://github.com/zoltan-dulac/css3FontConverter.git,"A shell script that can use other command line tools to produce @font-face compatible fonts in all browsers.  Works under Windows (using Cygwin), Mac OS X and Linux",,383
224,https://github.com/ookamiinc/kinto.git,均等 — Kinto is a Japanese font family adapted to match size & balance with Latin characters in user interfaces. A project based off Google Noto fonts.,,382
225,https://github.com/lxgw/kose-font.git,A Chinese handwriting font derived from SetoFont / Naikai Font / cjkFonts-AllSeto. 一款衍生于「濑户字体」「内海字体」「cjkFonts 全濑体」的中文手写字型。,,382
226,https://github.com/shanzi/myicons.git,Your flat icons manager and font builder.,,379
227,https://github.com/fontello/svg2ttf.git,SVG -> TTF font convertor,,378
228,https://github.com/cyanharlow/PureCSS-Font.git,"For secrecy or CAPTCHA purposes: a customizable, scalable font made entirely of CSS and HTML, delivered in a single JS file.","css,font,js",377
229,https://github.com/servo/font-kit.git,A cross-platform font loading library written in Rust,,374
230,https://github.com/pcaro90/hermit.git,"Hermit is a monospace font designed to be clear, pragmatic and very readable.",,374
231,https://github.com/spyder-ide/qtawesome.git,Iconic fonts in PyQt and PySide applications,,372
232,https://github.com/shannpersand/comic-shanns.git,a classy font,,372
233,https://github.com/klepas/open-baskerville.git,An open font project to create a revival of Fry’s Baskerville,"font,typeface,baskerville",372
234,https://github.com/nschum/FontAwesomeIconFactory.git,A factory for turning Font Awesome icons into images for user interface controls. Works for iOS and OS X.,,371
235,https://github.com/dekatotoro/GoogleMaterialDesignIcons.git,Google Material Design Icons Font for iOS,,368
236,https://github.com/kaandedeoglu/Shark.git,"Swift CLI for strong-typing images, colors, fonts and localizations",,367
237,https://github.com/CatharsisFonts/Cormorant.git,Cormorant open-source display font family,,366
238,https://github.com/liaohuqiu/icon-font-for-multiple-platforms.git,"Extra icons from Sketch file, generate font files, demos how to use font files on Web, iOS and Android.",,364
239,https://github.com/googlefonts/sfntly.git,"A Library for Using, Editing, and Creating SFNT-based Fonts",,363
240,https://github.com/s9w/font_compare.git,Programming font comparison,,362
241,https://github.com/nathco/jQuery.fontFlex.git,Extension for responsive font sizes,,358
242,https://github.com/Twixes/SF-Mono-Powerline.git,"{""🌁 Apple's SF Mono font patched for Powerline support""}","sf-mono-font,san-francisco-font,powerline,powerline-font,powerline-fonts,powerline-support,sf-mono-powerline",354
243,https://github.com/dtinth/YosemiteAndElCapitanSystemFontPatcher.git,Change the system font of Mac OS X Yosemite.,,354
244,https://github.com/bBoxType/FiraSans.git,Fira is a large Open Font typeface family licensed under OFL,,352
245,https://github.com/yixuan/showtext.git,Using Fonts More Easily in R Graphs,"font,graphics,r-graphics,graphics-device",348
246,https://github.com/sahibjotsaggu/San-Francisco-Pro-Fonts.git,The entire collection of San Francisco Pro Fonts,fonts,347
247,https://github.com/coderJianXun/Operator-Mono.git,Coding Font Operator Mono,,344
248,https://github.com/yusugomori/csssans.git,"CSS SANS is the font created with CSS, the computer language for web designing and typesetting.",,344
249,https://github.com/impallari/Raleway.git,Raleway Fonts,,340
250,https://github.com/ButTaiwan/genryu-font.git,A free font family derived from Source Han Serif.,,337
251,https://github.com/material-foundation/google-fonts-flutter.git,A Flutter package for accessing the Google Fonts API,,334
252,https://github.com/kosimst/Firicico.git,Combined programming mono font with italics and font ligatures made from Fira Code and Pacifico for Italics,,334
253,https://github.com/mmacneil/devfolio.git,"A simple, responsive, single-page portfolio and resume for developers built with Bulma, Sass, Font Awesome and Flickity.","portfolio-page,bulma,sass,portfolio-template,portfolio-website,portfolio,resume-template,flickity",334
254,https://github.com/eugene1g/font-blast.git,"{""Give me an icon-font, and I'll create individual SVG/PNG files for all icons in it""}",,332
255,https://github.com/powerline/fontpatcher.git,Script to patch arrow and symbol glyphs into fonts for usage with  Powerline and other compatible plugins.,,331
256,https://github.com/bramstein/homebrew-webfonttools.git,Homebrew formulae for font tools,,330
257,https://github.com/ellerbrock/fish-shell-setup-osx.git,":blowfish: Tutorial: Fish, Fisher, Powerline Fonts + iTerm2","fish,shell,iterm2,powerline-fonts,fisher,budspencer-theme",328
258,https://github.com/iamakulov/googlefonts-font-display-helper.git,A snippet generator to speed up Google Fonts rendering with font-display,,325
259,https://github.com/googlefonts/fontbakery.git,Font quality assurance tool written in Python 3.,,324
260,https://github.com/undercasetype/Fraunces.git,Git Repository for Fraunces Font Family,"font,variable-fonts,google-fonts",324
261,https://github.com/stipub/stixfonts.git,"OpenType Unicode fonts for Scientific, Technical, and Mathematical texts",,323
262,https://github.com/termux/termux-styling.git,Termux add-on app for customizing the terminal font and color theme.,"termux,android",323
263,https://github.com/rastikerdar/samim-font.git,A Persian (Farsi) Font - فونت (قلم) فارسی صمیم,,322
264,https://github.com/ButTaiwan/genwan-font.git,A free font family derived from Source Han Serif.,,322
265,https://github.com/patcito/angularjs_scaffold.git,"A rails plugin for scaffolding views using Angular.js, Twitter bootstrap and font-awesome.",,320
266,https://github.com/ThomasJockin/lexend.git,Lexend is a variable font empirically shown to significantly improve reading-proficiency.,"font,lexend,legibility",318
267,https://github.com/graphitemaster/breaking_the_physical_limits_of_fonts.git,Breaking the physical limits of fonts,,315
268,https://github.com/silenc3r/fedora-better-fonts.git,Better looking fonts for Fedora,,314
269,https://github.com/lightglitch/bootstrap-xtra.git,DEPRECATED - Use Font-Awesome or Font-Awesome-More,,313
270,https://github.com/larstvei/Focus.git,Dim the font color of text in surrounding paragraphs,,313
271,https://github.com/metapolator/metapolator.git,Design fonts and font families faster,,312
272,https://github.com/androidessence/PinchZoomTextView.git,A TextView library that allows the user to increase/decrease font size with a two finger gesture by the user.,,311
273,https://github.com/huajh/awesome-latex-cv.git,Latex CV template built with Font Awesome.,"latex-cv,xelatex,lualatex,latex-template,cv,resume-template",310
274,https://github.com/diverted247/txtjs.git,A <canvas> font and typesetting engine for @CreateJS.,,310
275,https://github.com/chriscoyier/coding-fonts.git,https://coding-fonts.css-tricks.com/,"font,coding-fonts",309
276,https://github.com/hypernewbie/VEFontCache.git,Single-header minimalistic pragmatic GPU font rendering library.,,309
277,https://github.com/dhepper/font8x8.git,8x8 monochrome bitmap fonts for rendering,,307
278,https://github.com/alyssais/Sass-Web-Fonts.git,"A Sass mixin to allow easy, efficient usage of Google Web Fonts.",,306
279,https://github.com/zengabor/zenfonts.git,A tiny JavaScript module to observe and control the loading of web fonts,,306
280,https://github.com/AlexDenisov/FontasticIcons.git,ObjC wrapper for the iconic fonts.,,305
281,https://github.com/forsigner/web-fontmin.git,Pick font from font file.,,303
282,https://github.com/fontello/brandico.font.git,Font with logos of social services & messagers,,303
283,https://github.com/keshikan/DSEG.git,7-segment and 14-segment font 7セグ・14セグフォント,"font,7-segment,14-segment,weather-icons",303
284,https://github.com/fontworks-fonts/DotGothic16.git,A font file available from Google Fonts.,,301
285,https://github.com/djyde/Picas.git,Generate Wordmark Logo with Google Fonts,,301
286,https://github.com/cmvnd/fonts.git,tiny bitmap fonts,,301
287,https://github.com/mekkablue/Glyphs-Scripts.git,Python scripts for the Glyphs font editor,,296
288,https://github.com/qrac/yakuhanjp.git,Yakumono-Hankaku Only Web Fonts,"font,webfont,yakuhan,yakumono,hankaku,japanese,yakuhanjp",295
289,https://github.com/capricorncd/zx-editor.git,"The HTML document (rich text) editor in Smart phone browser or webview, supporting mixed layout, reference, headline, unordered list, font color, bold and italics. 移动端HTML文档（富文本）编辑器，支持图文混排、引用、大标题、无序列表，字体颜色、加粗、斜体","editor,html5,smart-phone",294
290,https://github.com/BlackFoundryCom/InriaFonts.git,Fonts and UFO Masters of Inria Serif and Inria Sans Typeface,"fonts,typeface,inria,ofl,ufo,design,typedesign",292
291,https://github.com/danmarshall/google-font-to-svg-path.git,Create an SVG path from a Google font,"google-fonts,svg-path,svg-paths",291
292,https://github.com/stubbornella/type-o-matic.git,A browser extension that finds all the fonts on a page,,291
293,https://github.com/filamentgroup/a-font-garde.git,A variety of test cases and tools for safe font-icon usage.,,290
294,https://github.com/mapbox/tiny-sdf.git,Browser-side SDF font generator,,286
295,https://github.com/notlmn/awesome-icons.git,A curated list of awesome downloadable SVG/PNG/Font icon projects,"awesome,awesome-list,icons,free-svg-icons,icon-set,logo",285
296,https://github.com/impallari/Libre-Franklin.git,Libre Franklin Fonts,,284
297,https://github.com/andrewgioia/keyrune.git,Magic: the Gathering set symbol pictographic font,"font,css,mtg,magic-the-gathering,icons,icon-font",283
298,https://github.com/rastikerdar/shabnam-font.git,A Persian (Farsi) Font - فونت (قلم) فارسی شبنم,,283
299,https://github.com/googlefonts/fontview.git,"Demo app that displays fonts with a free/libre/open-source text rendering stack: FreeType, HarfBuzz and Raqm",,281
300,https://github.com/vjpr/monaco-bold.git,The Monaco font with a bold variant,,280
301,https://github.com/blobject/agave.git,succulent monospaced programming font,"font,typeface,truetype,programming-font,programming-fonts,coding-fonts,monospaced-font,monospaced",280
302,https://github.com/ukn530/FontFinder.git,Sketch Plugin to find font items in a current page,,280
303,https://github.com/adam7/delugia-code.git,Can we add Nerd Fonts to Cascadia Code Font using a GitHub Action,"nerd-fonts,cascadia",278
304,https://github.com/johanmattssonm/birdfont.git,"A font editor for creating fonts in TTF, EOT, SVG and BIRDFONT format.","font-editor,ttf,svg,fonts,otf",278
305,https://github.com/zats/AdjustFontSize-Xcode-Plugin.git,Instant font size adjustment with control – / control +,,278
306,https://github.com/chick-soups/TextFilesForTextMeshPro.git,When using TextMeshPro in Unity Editor，we can create a Font Asset from a text file.Here are some text files.I think they can help you customize your own Font Asset.The more text files are coming soon.,"unity3d,textmeshpro",278
307,https://github.com/leibnizli/panda.git,"A font processing App, Support for macOS and Windows. With which you can manipulate fonts as you like.",,277
308,https://github.com/BanzaiTokyo/webhostinghub-glyphs.git,"WebHostingHub Glyphs is a most comprehensive set of glyph icons available as font. The goal is to be fully compatible with Bootstrap and other frameworks and CMSs. It will be constantly updated so if you have ideas for new icons, do let us know.",,274
309,https://github.com/tancredi/fantasticon.git,Icon font generation tool,,273
310,https://github.com/cyrealtype/Lora-Cyrillic.git,Lora fonts —\xa0serif family for text. Variable Open Source Font,"opensource,font,cyrillic,typeface,variable-fonts,lora-font",272
311,https://github.com/smart-fun/SmartFonts.git,Smart Fonts for Android is a Library which makes it easy to use Custom Fonts in Apps,,272
312,https://github.com/Developmint/nuxt-webfontloader.git,Efficient web font loading has never been easier!,"nuxtjs,nuxt,nuxt-module,webfont,font,webfontloader",272
313,https://github.com/TypeNetwork/Decovar.git,A multistyle decorative variable font by David Berlow,"variations-font,font",271
314,https://github.com/tupadr3/plantuml-icon-font-sprites.git,plantuml-font-icon-sprites,"plantuml,font-awesome,devicons,uml,diagram",269
315,https://github.com/graphicore/librebarcode.git,Libre Barcode: barcode fonts for various barcode standards.,,267
316,https://github.com/kudakurage/LigatureSymbols.git,Ligature Symbols is WebFont project to display the symbol with a ligature features. This Font is licensed under the SIL Open Font License.,,267
317,https://github.com/dialex/JColor.git,An easy syntax to format your strings with colored fonts and backgrounds. ,"java,log,color-font,java-library,utilities,ascii-art,ansi-colors,cross-platform,ansi",266
318,https://github.com/lukas-w/font-logos.git,"{""An icon font providing popular linux distro's logos""}","icon-font,linux,logos",266
319,https://github.com/alif-type/xits.git,XITS - OpenType implementation of STIX fonts with math support,"font,math,opentype",263
320,https://github.com/Templarian/MaterialDesign-Webfont.git,@mdi/font Dist for Material Design Icons.,"material-design,web-fonts,icons",260
321,https://github.com/RoelN/SansBullshitSans.git,Source for the Sans Bullshit Sans font,,260
322,https://github.com/mathew-kurian/CharacterMap.git,:tada: Online Character Map / Glyph / Icon / Font Viewer,,259
323,https://github.com/turquoise-hexagon/cherry.git,another bitmap font,"bitmap,font",259
324,https://github.com/opensourcedesign/fonts.git,"Archived since there are many great open source font sites already, see https://github.com/opensourcedesign/fonts/issues/21","fonts,free-fonts,design,opensourcedesign,open-source-design,open-source",258
325,https://github.com/dharmatype/Bebas-Neue.git,Bebas Neue font,,256
326,https://github.com/mokagio/Stencils.git,Speedup your iOS app development using icon fonts,,256
327,https://github.com/itfoundry/Poppins.git,"Poppins, a Devanagari + Latin family for Google Fonts.",,256
328,https://github.com/microsoft/vscode-codicons.git,The icon font for Visual Studio Code,,256
329,https://github.com/ZeroSpree/CSSans.Pro.git,"CSSans Pro - The Colourful, Sassy, CSS Font","css,font,cssans,pro",256
330,https://github.com/knowbody/react-native-text.git,React Native Text scales the font size based on a device width,,255
331,https://github.com/TypeNetwork/Amstelvar.git,a parametric variable font by David Berlow,"variations-font,font",254
332,https://github.com/ayoy/fontedit.git,"A desktop app to import, edit and export fonts as byte arrays for use in embedded systems","font,embedded,epaper,lcd,generator,raspberry-pi",254
333,https://github.com/bigxixi/Font-Packer.git,A Sketch plugin to collect font files you used in your sketch file.,,254
334,https://github.com/LayoutFarm/Typography.git,"C# Font Reader (TrueType / OpenType / OpenFont / CFF / woff / woff2) , Glyphs Layout and Rendering","truetype,opentype,font,typography,msdf,ttf,otf,rendering,layout,contour,glyph,emoji,dotnet,netstandard,cff,woff2,webfonts,woff",253
335,https://github.com/shamanland/fonticon.git,Android implementation of font-based icons.,,252
336,https://github.com/bluescan/proggyfonts.git,Monospaced fonts for programming.,,251
337,https://github.com/firamath/firamath.git,Sans-serif font with Unicode math support,"font,unicode-math,fira",251
