,Url,Description,Topics,Stars
0,https://github.com/OpenBankProject/OBP-API.git,"An open source RESTful API platform for banks that supports Open Banking, XS2A and PSD2 through access to accounts, transactions, counterparties, payments, entitlements and metadata - plus a host of internal banking and management APIs.","xs2a,xs2a-interface,xs2a-connector,psd2,psd2-xs2a-interface,openbanking,openbanking-api",1322
0,https://github.com/Sbanken/api-examples.git,Examples on how to use the Sbanken Open Banking API,"dotnet-core,swagger-documentation,electron,nodejs",133
0,https://github.com/PavelBastov/opencbs.git,Open-source core banking system for microfinance institutions,,110
0,https://github.com/apigee/openbank.git,An Open Banking Reference Implementation with Apigee  ,,103
0,https://github.com/atp-team/Gustav.git,Open source internet banking built on the top of WebAPI of Česká spořitelna,,72
0,https://github.com/quantmind/awesome-open-finance.git,A curated list of open finance and open banking resources,"api,finance,payment,banking,awesome,awesome-list",67
0,https://github.com/rhubarb/bankjob.git,Bankjob is a command-line ruby program for scraping online banking sites and producing statements in OFX (Open Fincancial Exchange) or CSV (Comma Separated Values) formats. ,,66
0,https://github.com/adorsys/open-banking-gateway.git,"{""Provides RESTful API, tools, adapters, and connectors for transparent access to open banking API's (for banks that support PSD2 and XS2A as well as HBCI/FinTS)""}","tpp,psd2,xs2a,banking-gateway,adorsys,berlin-group,banking-apis,open-banking,fintech-api,fintech,hbci,payment-gateway,hbci-sandbox,xs2a-interface,xs2a-connector,psd2-xs2a-interface,openbanking,openbanking-api",65
0,https://github.com/OpenBankingUK/opendata-api-spec-compiled.git,Official Open Banking UK Open Data API specifications,"open-banking,api",57
0,https://github.com/not-a-bank/open-banking-tracker-data.git,The open banking API directory,"openbanking,api,psd2,obie,fintech,finance,data,banking,bank,institutions,tracker",54
0,https://github.com/bigcompany/safewallet.git,Safewallet open-source crypto-currency banking software,,46
0,https://github.com/OpenBankingUK/reference-applications.git,Suite of reference applications to facilitate development and testing relating to Open Banking APIs,,45
0,https://github.com/BankNegaraMY/oapi-banking.git,Open API specification for Banking industry,,44
0,https://github.com/wultra/powerauth-crypto.git,"PowerAuth - Open-source solution for authentication, secure data storage and transport security in mobile banking.","security,authentication,mobile-security,banking-applications,signed-requests,protocol,encryption,banking,authorization",41
0,https://github.com/LukePrior/Australian-Open-Banking-Data-Database.git,This is an ongoing collection of Open Banking Data APIs for Australian deposit taking institutions.,"consumer-data,banking-apis,cdr,open-banking",41
0,https://github.com/OpenBankingUK/account-info-api-spec.git,Swagger files for the Open Banking Account and Transaction API,"swagger,openbanking",35
0,https://github.com/OpenBanking-Brasil/mock-api.git,Este repositório contém um workflow que gera automaticamente uma imagem docker com um Api Mock  baseado no Swagger oficial do Open Banking Brasil.,,29
0,https://github.com/apigee/consumer-data-standards-au.git,Consumer Data Standards Australia - Open Banking Reference Implementation,"openbanking-api,openbanking,cds,australia,apigee,banking-apis",26
0,https://github.com/thauska/desafio-tecban.git,"Hackathon TecBan 2020 - BICOS, an React-Native app for connection and contracting service provision. BICOS was born to democratize access to Open Banking to those who were previously invisible.","hackathon,shawee,tecban,openbanking,hackathon-project,react-native-app",26
0,https://github.com/arussellsaw/budgie.git,Sync your bank transactions with google sheets using Open Banking APIs,"open-banking,cloud-run,golang,finance,google-sheets",25
0,https://github.com/Czech-BA/COBS.git,This repository contains the public issue tracker for the Czech Standard for Open Banking (mainly PSD2).,,25
0,https://github.com/nearform/open-banking-reference-app.git,NearForm reference application for open banking - https://community.nearform.com/api-banking,,22
0,https://github.com/stone-co/go-stone-openbank.git,A Go library to connect with Stone Open Banking API,,19
0,https://github.com/ConsumerDataStandardsAustralia/banking-products-comparator.git,A PoC of banking products view/comparison web app utilising the open banking product API,,18
0,https://github.com/bemre/bankbot-mazain.git, Analysis of BankBot/Mazain: An Open Source Banking Trojan That Targets Android Devices ,"android,malware-analysis,report,bankbot",18
0,https://github.com/ExtraBB/open-psd2.git,"{""An open source framework for using banking API's built for PSD2 regulation.""}","banking,api,open,psd2,authorization,ing,abn,http,finance,bank,help-wanted",18
0,https://github.com/peterjskaltsis/up-banking-web-unofficial.git,"An unofficial web app client for Up Banking, built with their new open banking API ⚡️","open-banking,up,nextjs,experiment",18
0,https://github.com/TiagoDanin/OpenTecBan-Service.git,Hackathon TecBan 2020 - Open Banking API Service,,17
0,https://github.com/ForgeRock/OpenBanking-UK-Datamodel-Java-SDK.git,A Java SDK to help implementing the Open Banking standard : https://www.openbanking.org.uk/read-write-apis/,"openbanking,openbanking-sdk",16
0,https://github.com/ForgeRock/ForgeRock-OpenBanking-Sample.git,ForgeRock Open Banking Sample code. Examples to help you discovering the Open Banking standard,,15
0,https://github.com/magnobiet/open-banking-brazil.git,🏦 A curated list of Brazilian open banking,"banks,brazil,open-banking",15
0,https://github.com/NordeaOB/swaggers.git,Nordea Open Banking API Swagger and Postman files,,14
0,https://github.com/robinryden/swedbank-open-banking.git,Go package for Swedbanks Open Banking API,"swedbank,swedbank-open-banking,open-banking,go",14
0,https://github.com/openbankingnigeria/api.git,"The Open Banking Nigeria is a way to bring a standard banking system in Nigeria, for which any bank can follow to make life easier for all players in the ecosystem.","openbanking,nigeria,bank,fintech",12
0,https://github.com/SensibleWood/open-banking-graphql.git,Open Banking API Specifications -> GraphQL schemas -> ?,,12
0,https://github.com/uberswe/nordeago.git,NordeaGo is a wrapper for the Nordea Open Banking API written in Go,"nordea,golang,api",12
0,https://github.com/OpenBankingUK/directory-api-specs.git,Open Banking Directory API specifications,,11
0,https://github.com/sebgroup/openbanking.git,SEB is banking outside the box! Find additional documentation here that will help you integrate with our APIs.,,11
0,https://github.com/yapily/yapily-sdk-nodejs.git,Javascript SDK compatible with Node JS generated against the Yapily API. This SDK can be used to connect to Open Banking entities.,"sdk-nodejs,openbanking,psd2,fintech,javascript,sdk,oauth2,banking-applications,openapi,connectivitymanager,yapily,financial-institutions,yapily-sdk,yapily-api,openbanking-sdk,payments-sdk,payments,openbanking-api",11
0,https://github.com/shyam999/Django-Bank.git,Django-Bank is an open source full fledged Banking Website Developed in Django and designed with Bottstrap.It offers every service that a banking web application should...,,11
0,https://github.com/yapily/yapily-sdk-java.git,Java SDK generated against the Yapily API. This SDK can be used to connect to Open Banking entities.,yapily-sdk,11
0,https://github.com/open-accelerators/open-banking.git,"This repository contains a developer portal, mock data and other configurations for creating micro services based platform to support  open banking",,10
0,https://github.com/OpenBanking-Brasil/specs-seguranca.git,Documentação das especificações do GT de Segurança do Open Banking Brasil. As especificações ainda estão em versão draft e não devem ser utilizadas para implementação.,,10
0,https://github.com/caracreative/awesome-open-banking.git,A collection of awesome Open Banking APIs,,9
0,https://github.com/OpenBankingStandard/framework.git,Framework for the delivery of the Open Banking Standard,,9
0,https://github.com/enablebanking/OpenBankingJSExamples.git,Sample JavaScript code showing how to use Open banking APIs (PSD2 AISP & PISP) using enable:Banking JS library,"open-banking,psd2,openbanking,openbanking-sdk,openbanking-api,example-code,pisp",9
0,https://github.com/yapily/yapily-sdk-python.git,Python SDK generated against the Yapily API. This SDK can be used to connect to Open Banking entities.,"python,devtools,openbanking,psd2,sdk-python,fintech-utility,oauth2,python-sdk,yapily,sdk,financial-institutions,yapily-api,yapily-sdk,openbanking-sdk",9
0,https://github.com/finlabsuk/open-banking-connector-swift.git,Software that simplifies access to UK Open Banking APIs,"swift,swift5,swift-server,swift-nio,asynchronous-io,high-performance,open-banking,multi-threaded,linux,macos",9
0,https://github.com/jbossdemocentral/openbanking-workshop.git,Red Hat Open Banking Platform Workshop,,8
0,https://github.com/openMF/open-banking-app.git,Stand-alone application for third-party fintechs and PISPs to build and demonstrate open banking use cases. ,,8
0,https://github.com/Dan2552/Monies.git,Open source quick-access iOS banking app,,8
0,https://github.com/murilokprado/open-banking-endpoints.git,Repository to centralize information Open Banking docs & endpoints all companies in Brazil.,,8
0,https://github.com/Liques/BestBankPortugalConnect.git,SDK to connect to the Open Banking API of the portuguese bank Banco Best.,,8
0,https://github.com/apiplaybook/open-banking-brasil.git,"Este repositório contém uma aplicação construída em JavaScript com a biblioteca React. Ela é capaz de realizar chamadas às APIs do Open Banking Brasil, gerar uma matriz de comparação e tabelas com os valores retornados.","open-banking,open-banking-brasil,open-banking-brazil,api,apis,javascript,react,http,https,requests,banking,comparator,bacen,febraban,banco,central,openbanking,openbanking-brasil",8
0,https://github.com/OpenBankProject/OBP-JVM.git,Open Bank Project JVM Library. This project can be used by OBP-API or indpendently to connect to core banking resources via transports including Kafka.,,7
0,https://github.com/enablebanking/OpenBankingPythonExamples.git,Sample Python code showing how to use Open banking APIs (PSD2 AISP & PISP) using enable:Banking Python library ,"open-banking,psd2,openbanking,openbanking-sdk,openbanking-api,pisp,example-code",7
0,https://github.com/enablebanking/OpenBankingJavaExamples.git,Sample Java code showing how to use Open banking APIs (PSD2 AISP & PISP) using enable:Banking Java library,"openbanking,open-banking,openbanking-api,psd2,openbanking-sdk,pisp,example-code",7
0,https://github.com/pavolbiely/tatrabanka-api.git,"{""PHP REST API Client for Tatra Banka's Open Banking TB.""}","tatrabanka,rest-api,rest-client,api-client,oauth2,openbanking",7
0,https://github.com/rpadma/Rappay.git,"{""My entry for ICICI Bank Hackathon 2016- Proposed a mobile app with the following functionality     1)      A bank account is at the crux of a user’s relationship with the bank. However, a personalized interface for the user with the bank is still not a reality. I believe this can be changed once a common medium is found. Through this, we will be able to generate highly personalized data analysis to the user for free. This can be represented as simply as a pie diagram or a bar graph. Through this, the user will be able to understand his expenses and also find ways to minimize expenses and save more money. As there is a common medium, we will also find ways for the user to save and invest in the form of discount coupons for the user’s favorite restaurant, cinema hall, etc. We can also offer him stock/mutual fund options suited to his monthly savings and encourage him/her to do more with the data. This information can be conveyed to the user in a form he is familiar with. We can also make mock pitches that contain information post-investment, mutual funds, and its effect on his savings account, etc. This helps in finding potential customers for the bank. All the information will only act as an advisory to the user and the investments/savings will be at his discretion. No such service is available right now.    2)      It is simple, fast, and efficient from both the user and the vendor's point of view. Imagine being able to scan a QR on a bill to make a payment, without entering debit card details or getting redirected to a net banking website or having to open your physical wallet. Welcome to the Future J   ""}","icici,hackathon,java,android,qrcode,payment",7
0,https://github.com/jmiddleton/mybank-poc.git,Australia Open banking - Account Aggregator (TPP) reference implementation,"openbanking,australia,banking,serverless,vue",6
0,https://github.com/transferwise/openbanking-client.git,Java client for using the UK Open Banking API ,,6
0,https://github.com/barrymichaeldoyle/investec-openapi.git,"{""A JavaScript/TypeScript wrapper to get up and running fast with Investec's Open API for programmable banking.""}","javascript,typescript,investec,openbanking,programmable-banking,api-wrapper",6
0,https://github.com/enablebanking/open_banking_eidas_broker.git,Microservice using eIDAS certificates for signing Open Banking / PSD2 API requests and accessing banks’ APIs over mTLS,"eidas-broker,mtls,openbanking,eidas,psd2,client-certificate",6
0,https://github.com/danifitz/ibmwatson-fb-messenger-chatbot.git,An Open Banking chatbot powered by IBM Watson and Facebook messenger ,,6
0,https://github.com/Alea4jacta6est/Chatbot-banking-service.git,Banking chatbot based on Rasa open source machine learning tools for developers to create contextual AI assistants and chatbots that go beyond answering simple questions,,6
0,https://github.com/imjenal/PrivateX.git,"{""A Chrome (http://bit.ly/ChromePrivateX) and Firefox (http://tiny.cc/privatex) browser extension which provide safe access by reminding the user to open Banking sites using Private Browsing mode. Also, this extension by default chops off the Google Analytics tracking (i.e. Urchin Tracking Monitor) tokens from the URL's query string before the web Request is made.""}","web-extensions,firefox-addon,firefox,webextensions-apis,firefox-extensions",6
0,https://github.com/OpenBaraza/openBaraza.git,"Java, XML RAD platform with over 10 stable projects in Business, HR, payroll, time and attendance, projects, banking, sacco, chama, judiciary, university management",,5
0,https://github.com/skalena/openbankingBR.git,Repositório de tecnologias e informações Open Banking Brasil,,5
0,https://github.com/bitcapital-hq/marketplace-sample.git,An open marketplace to buy and sell products using Bitcapital digital banking accounts platform.,"typescript,postgresql,stellar,bitcapital",5
0,https://github.com/ryukinix/warsaw-openrc.git,Warsaw Banking Security software known as CaaS (Cancer as a Service) by GAS modified to working fine with OpenRC,"manuel,initial-d,gas-gas-gas,warsaw,bb,brazil,banking",4
0,https://github.com/revolut-engineering/oba.git,Open Banking API Documentation,,4
0,https://github.com/fdut/psd2-app.git,Sample of a Web app using Open Banking PSD2 Api powered by IBM API Connect,,4
0,https://github.com/havardgulldahl/grisebank.git,An app for Sbanken open banking automation,"openbanking,python3,sbanken",4
0,https://github.com/Mogbo/Customer-Clustering-Segmentation-Challenge.git,"My work for the KPMG (open to public) challenge for bank customer segmentation based on its annual banking industry survey. Dimension of dataset 40,000rows x 150 columns ",,4
0,https://github.com/inmite/imt-banking-for-glass-prototype.git,A prototype of a banking application for Google Glass. Uses open REST API by Fio banka.,,4
0,https://github.com/fintradetec/psd2.git,European and Non-EU PSD2 oriented Open Banking API Standards Collection,"psd2,payment-standards,openbanking-api,openbankproject,berlingroup,stet,polandapi",4
0,https://github.com/tsainte/SaveIt.git,iOS / WatchOS app to show your balances / transactions from banks in the UK by using Open (banking) APIs . For now integrated with Monzo and Starling! ❣️,,4
0,https://github.com/pingidentity/pf-open-banking-plugin.git, PingFederate open banking software statement assertion plugin,,3
0,https://github.com/fintechblocks/open-banking-auth-sdk-nodejs.git,Open Banking Authorization NodeJS SDK,,3
0,https://github.com/ForgeRock/PSD2-Accelerators.git,"Collection of assets / code / config for Open Banking (PSD2), NextGen PSD2, and Yes.com Kits. ",,3
0,https://github.com/OpenBankingToolkit/openbanking-reference-implementation.git,ForgeRock OpenBanking Reference Implementation is an example of how you can bundle all the micro-services together to create an Open Banking eco-system,"openbanking,psd2,forgerock,oidc",3
0,https://github.com/OpenBankingStandard/open-data.git,Open Banking Data,,3
0,https://github.com/lucamaf/open-banking-roadshow.git,open banking roadshow,,3
0,https://github.com/lbroudoux/openbanking.git,Repository for Open Banking API stuffs,,3
0,https://github.com/sitomani/ExamineSpending.git,Small iOS app for browsing account transactions in layered treemap navigator using Nordea and OP PSD2/Open Banking interfaces,"psd2,openbanking,nordea,op,swift,ios",3
0,https://github.com/adrianhopebailie/investec.git,A CLI tool for using the Investec Open Banking APIs,,3
0,https://github.com/nzws/bank-monitor.git,An open online-banking app written in React Native.,,3
0,https://github.com/hanse/kafka-life-stream.git,"Kafka Life Stream: Activity Tracking (Strava), Open Banking (Sbanken) and what not","sbanken,psd2,strava,kafka,typescript",3
