,Url,Description,Topics,Stars
479,https://github.com/HariSekhon/SQL-scripts.git,"100+ SQL Scripts - PostgreSQL, MySQL, Google BigQuery, MariaDB, AWS Athena. DevOps / DBA / Analytics / performance engineering. Google BigQuery ML machine learning classification.","sql,postgresql,postgres,mysql,mariadb,aws,gcp,athena,aws-athena,bigquery,google-bigquery,bigquery-ml,devops,dba,performance,machine-learning,rds,rds-database,google-cloudsql-mysql,google-cloud-sql",94
480,https://github.com/Burton/Analysis-of-Competing-Hypotheses.git,"{""An analytic technique created at the CIA, ACH helps you analyze complex situations with multiple hypotheses and countless pieces of evidence. Multiple people can collaborate on a single problem, and ACH will compare everyone's analyses and pinpoint the precise areas of disagreement, allowing for a more focused debate.""}",,94
481,https://github.com/segmentio/analytics-java.git,The hassle-free way to integrate analytics into any java application.,,93
482,https://github.com/amplitude/react-amplitude.git,A React component library for easy product analytics instrumentation,"react,javascript,js,amplitude,analytics",93
483,https://github.com/taniarascia/setup.git,"My own front end web development set up, covering everything from operating system to analytics.","css-framework,css-preprocessor,sass,cloud-computing,stack,lamp,seo,cdn,analytics,webdevelopment,frontend,hosting,operating-system",93
484,https://github.com/Texera/texera.git,Big Data Analytics Using Interactive Workflows,"declarative-ui,nlp,texera,workflow,data-analytics,machine-learning",92
485,https://github.com/zhuravljov/yii2-queue-monitor.git,Yii2 Queue Analytics Module,"yii2,queue,analytics,module",92
486,https://github.com/NickCH-K/introcausality.git,"Class materials for ""Economics, Causality, and Analytics""",,92
487,https://github.com/raviriley/agency-jekyll-theme.git,"Jekyll version of the newest Agency Bootstrap theme, plus new features: Google Analytics, Markdown support, custom pages, and more!","jekyll,jekyll-theme,jekyll-themes,bootstrap-theme,liquid,ruby,ruby-gem,rubygems,bootstrap,remote-theme,github-pages",92
488,https://github.com/Pintea/tiniest-analytics.git,VERY simple cross-platform C++ analytics for games (using Google Analytics),,92
489,https://github.com/AgarwalPragy/GATE2016_MarksEvaluator.git,DEPRECATED. Use https://github.com/GATEOverflow/gate_analytics ,,92
490,https://github.com/danielbayerlein/middleman-google-analytics.git,ðŸ“ˆ A @middleman plugin to handle generating your Google Analytics tracking code.,"middleman,google-analytics,middleman-extension",91
491,https://github.com/twoixter/trackoid.git,Trackoid is an easy scalable analytics tracker using MongoDB and Mongoid,,91
492,https://github.com/husky-team/husky.git,"A more expressive and most importantly, more efficient system for distributed data analytics.",,90
493,https://github.com/ryanto/ember-google-analytics.git,Ember.JS Plugin that makes Google Analytics just work.,,90
494,https://github.com/klaussinani/rels.git,Github release analytics for the console,"github,release,cli,analytics",90
495,https://github.com/IBM-Cloud/logistics-wizard.git,"The Logistics Wizard is an end-to-end, smart supply chain management solution that showcases how to execute hybrid cloud, microservices, and predictive data analytics in the real world.","bluemix,microservices,openwhisk,serverless,cloudfoundry,react,loopback,python,nodejs,ibm-cloud-solutions",90
496,https://github.com/EngaugeAI/engauge.git,"Product Analytics, Business Intelligence, and Product Management in a fully self-contained box","analytics-tracking,business-intelligence,self-hosted,self-contained,product-management,mobile-analytics,web-analytics,engagement",90
497,https://github.com/Jeff-sjtu/HybrIK.git,"Official code of ""HybrIK: A Hybrid Analytical-Neural Inverse Kinematics Solution for 3D Human Pose and Shape Estimation"", CVPR 2021","3d-pose-estimation,smpl,inverse-kinematics",90
498,https://github.com/cmackay/google-analytics-plugin.git,Cordova Google Analytics Plugin for Android & iOS,"google-analytics,cordova,android,ios,cordova-plugin",89
499,https://github.com/hotosm/osm-analytics.git,OSM Analytics lets you interactively analyze how specific OpenStreetMap features are mapped in a specific region.,"openstreetmap,openstreetmap-data,osm-qa-tiles,vector-tiles,analytics,osm-analytics,visualization",89
500,https://github.com/datariot/meteor-ganalytics.git,Google Analytics for Meteor,,88
501,https://github.com/crflynn/pypistats.org.git,PyPI downloads analytics dashboard,"python,pypi-packages,download-counts,python-packages,pypi",88
502,https://github.com/segmentio/analytics-vue.git,The hassle-free way to integrate analytics into your Vue application.,"analytics,vuejs,segment,vue-boilerplate,quickstart,create-vue-app",88
503,https://github.com/BranchMetrics/Branch-Example-Deep-Linking-Branchster-Android.git,"Branch Metrics Example application for Android mobile deep linking / deeplinking - the Branchster app. Branch helps mobile apps grow with deep links / deeplinks that power referral systems, sharing links and invites with full attribution and analytics.",,88
504,https://github.com/OnGridSystems/CATEd.git,CATEd - Cryptocurrency Analytics and Trading Engine for Django,"cryptocurrency,trading,trading-bot,bitcoin,ethereum,celery,wallet",87
505,https://github.com/segmentio/Analytics.NET.git,The hassle-free way to integrate analytics into any C# / .NET application.,,86
506,https://github.com/adashofdata/intro-to-text-analytics.git,introduction to text analytics in python training for odsc west 2018,,85
507,https://github.com/jose-lpa/django-tracking-analyzer.git,User actions tracking and analytics for Django sites  :bar_chart:,,85
508,https://github.com/stefanwalther/awesome-qap.git,"{""A list of awesome solutions on top of Qlik's APIs & Qlik Analytics Platform (QAP).""}","awesome,qlik,qlik-sense,qlik-analytics-platform,qap,visual-analytics",85
509,https://github.com/dogsheep/dogsheep.github.io.git,Tools for personal analytics using SQLite and Datasette,"datasette,sqlite,dogsheep",85
510,https://github.com/Datavault-UK/dbtvault.git,"A free to use dbt package for creating and loading Data Vault 2.0 compliant Data Warehouses (powered by dbt, an open source data engineering tool,  registered trademark of Fishtown Analytics)","datavault20,dbt,datawarehousing,datavault,etl,snowflake,dataengineering,datawarehouse,datalake,elt,data-vault,sql",85
511,https://github.com/oslabs-beta/projectArtemis.git,An analytic tool for GraphQL queries to external APIs with a Graphical User Interface to view performance metrics.,"analytics,performance-metrics,graphql-queries,deno,aleph,graphql,api",85
512,https://github.com/rayokota/kafka-graphs.git,Graph Analytics with Apache Kafka,,84
513,https://github.com/matomo-org/matomo-mobile-2.git,Matomo Mobile 2 App - The official Git repository! Liberating Web Analytics on the go!,,84
514,https://github.com/toolboc/Intelligent-Video-Analytics-with-NVIDIA-Jetson-and-Microsoft-Azure.git,A repository demonstrating an end-to-end architecture for Intelligent Video Analytics using NVIDIA hardware with Microsoft Azure,,84
515,https://github.com/preethamvishy/socialytics.git,Desktop and web app for Instagram analytics in under 10 seconds. ðŸš€ https://preethamvishy.github.io/socialytics,"instagram-analytics,instagram,analytics,socialmediamarketing",84
516,https://github.com/qubole/quark.git,Quark is a data virtualization engine over analytic databases. ,,84
517,https://github.com/nikodraca/PostTrends.git,Simple analytics platform for Instagram.,"instagram,analytics,python,flask",83
518,https://github.com/ethen8181/Business-Analytics.git,"Data Analytics, Statistics, Visualization (R / Python)",,83
519,https://github.com/Acrotrend/Awesome-Customer-Analytics.git,A curated list of awesome customer analytics content,"customer-segments,case-study,text-analysis",82
520,https://github.com/keenlabs/KeenClient-iOS.git,Official iOS client for the Keen IO API. Build analytics features directly into your iOS apps.,,82
521,https://github.com/andjosh/gatrack.js.git,Easily track user events with Google Analytics.,,82
522,https://github.com/dipanjanS/deep_transfer_learning_nlp_dhs2019.git,"{""Contains the code and deck for the presentation on Applying Deep Transfer Learning for NLP in Analytics Vidhya's DataHack Summit 2019""}",,82
523,https://github.com/rockymadden/gap.git,:nut_and_bolt: Fix default Google Analytics tracking methodologies and track micro user behaviors.,,82
524,https://github.com/mrpaulandrew/procfwk.git,A cross tenant metadata driven processing framework for Azure Data Factory and Azure Synapse Analytics achieved by coupling orchestration pipelines with a SQL database and a set of Azure Functions.,"azure,data-factory,adf,azure-functions,azure-sql-database,metadata,framework,adfprocfwk,data-engineering,pipelines,processing",82
525,https://github.com/CognonicLabs/awesome-AI-kubernetes.git,":snowflake: :whale:  Awesome tools and libs for AI, Deep Learning, Machine Learning, Computer Vision, Data Science, Data Analytics and Cognitive Computing that are baked in the oven to be Native on Kubernetes and Docker with Python, R, Scala, Java, C#, Go, Julia, C++ etc","kubernetes,kubernetes-ai,kubernetes-ml,ai,ml,data-science,kubernetes-data-science,docker,analytics,kubernetes-analytics,cognitive-science,python-ml,big-data,scala,spark,spark-kubernetes,spark-ml,kubeflow,seldon-core,pachyderm",82
526,https://github.com/NVIDIA-AI-IOT/deepstream-occupancy-analytics.git,"This is a sample application for counting people entering/leaving in a building using NVIDIA Deepstream SDK, Transfer Learning Toolkit (TLT), and pre-trained models. This application can be used to build real-time occupancy analytics applications for smart buildings, hospitals, retail, etc. The application is based on deepstream-test5 sample application.",,82
527,https://github.com/narayanan2004/GraphMat.git,GraphMat graph analytics framework,"graphs,graph,graph-processing,distributed,pagerank,shortest-paths,breadth-first-search,latent-dirichlet-allocation,collaborative-filtering,triangle-counting,topological-sort,delta-stepping",81
528,https://github.com/giuem/ga-proxy.git,Accelerate Google Analytics,,81
529,https://github.com/lnklnklnk/ga-bq.git,Stream raw hit-level Google Analytics data into BigQuery,,81
530,https://github.com/yhilpisch/cloud-python.git,Deploying Python for Data Analytics and Jupyter Notebook in the Cloud.,,81
531,https://github.com/ibm-watson-data-lab/spark.samples.git,tutorials and samples that show you how get the most out of IBM Analytics for Apache Spark,,81
532,https://github.com/colekennelly1/awesome-defi-trackers.git,"A curated list of DeFi (decentralized finance) project trackers, analytics dashboards, and resources.",,81
533,https://github.com/parkr/ping.git,":bar_chart: Your very own Google Analytics replacement, without all of the Google. Simple as pie.","go,google-analytics,privacy,pie,analytics",81
534,https://github.com/udacity/ud381.git,Real-Time Analytics with Storm,,80
535,https://github.com/GaelVaroquaux/sklearn_pandas_tutorial.git,EuroScipy 2014 tutorial: Introduction to predictive analytics with pandas and scikit-learn,,80
536,https://github.com/gluc/ahp.git,Analytical Hierarchy Process (AHP) with R,,80
537,https://github.com/angdev/chocolat.git,Self-Hosted Event Analytics Service,,80
538,https://github.com/OpenVisualCloud/Dockerfiles.git,"Optimized media, analytics and graphics software stack images. Use the dockerfile(s) in your project or as a recipe book for bare metal installation.","ffmpeg,gstreamer,rtmp,vaapi,container,nginx,analytics,openvino,encoding,media,webrtc,svt,vcac-a,media-analytics,media-delivery,docker-images,dockerfiles,stack-images,inferencing-engine",80
539,https://github.com/randomuserid/Tylium.git,"Primary data pipelines for intrusion detection, security analytics and threat hunting",,80
540,https://github.com/tpitale/mongolytics.git,"{""DO NOT USE! Use MongoDB and it's speed to do basic analytics tracking in Rails""}",,80
541,https://github.com/GeneaLabs/laravel-mixpanel.git,Intuitive drop-in analytics.,"laravel,mixpanel,analytics,package",79
542,https://github.com/aws/aws-sdk-mobile-analytics-js.git,Amazon Mobile Analytics JavaScript SDK,,79
543,https://github.com/groupon/luigi-warehouse.git,A luigi powered analytics / warehouse stack,"luigi,redshift,workflow,python,etl,salesforce,teradata,google-sheets,typeform,postgresql,mysql,hive,aws,spark",79
544,https://github.com/panalysis/Google2Pandas.git,Query Google Analytics and get the results as a pandas.DataFrame,,79
545,https://github.com/tjanczuk/nodalytics.git,Google Analytics for Node.js HTTP APIs,,79
546,https://github.com/matomo-org/matomo-for-wordpress.git,"Get a fully functioning Matomo Analytics for your WordPress. Star us on Github? +1. Matomo is the leading open alternative to Google Analytics that gives you full control over your data. Privacy is built-in. 100% data ownership, no one else can see your data. We love Pull Requests! ","matomo,analytics,wordpress,tagmanager,web,statistics,privacy,intranet,piwik",79
547,https://github.com/flipkart-incubator/okhttp-stats.git,OkHttp Analytical library to get stats like average network speed. Also get global callbacks for network errors and successes. Can be used for logging errors to Fabric or Firebase analytical tools,"okhttp,analytical,okhttp-stats,networking,success,error,network-monitoring",79
548,https://github.com/duneanalytics/abstractions.git,SQL views for Dune Analytics,,78
549,https://github.com/jdeboer/ganalytics.git,Interact with Google Analytics using R,"google-analytics,analytics-api,r,google-tag-manager",78
550,https://github.com/yew1eb/DM-Competition-Getting-Started.git,"æ•°æ®æŒ–æŽ˜ç«žèµ›(Kaggle,Data Castle,Analytics Vidhya,DrivenData)å…¥é—¨å®žè·µ",,78
551,https://github.com/OpenVisualCloud/Smart-City-Sample.git,"The smart city reference pipeline shows how to integrate various media building blocks, with analytics powered by the OpenVINOâ„¢ Toolkit, for traffic or stadium sensing, analytics and management tasks.","ffmpeg,gstreamer,analytics,openvino,object-detection,openvisualcloud,traffic-monitoring,stadium-management,people-counting,crowd-counting,smart-city,queue-counting",78
552,https://github.com/dataquestio/analytics_pipeline.git,Code to build a simple analytics data pipeline with Python,,77
553,https://github.com/chonthu/Codeigniter-Google-Analytics-Class.git,Codeigniter 2 class for google analytics api,,77
554,https://github.com/capacitor-community/firebase-analytics.git,Enable Firebase Analytics for Capacitor Apps,"capacitor,firebase,analytics,plugin",77
555,https://github.com/lumoslabs/aleph.git,Empower Curiosity / Redshift analytics platform,,77
556,https://github.com/orionmelt/snoopsnoo.git,SnoopSnoo â€” reddit user and subreddits analytics,,77
557,https://github.com/microsoft/peek.git,"Azure Usage/Billing Analytics Solution for EAs, CSPs and Direct Subscriptions.",,77
558,https://github.com/GeostatsGuy/GeostatsPy_Intro_Course.git,Introduction to spatial data analytics and machine learning with GeostatsPy Python package,,77
559,https://github.com/manucaralmo/GlowCookies.git,"GlowCookies - Cookie Consent Banner In JavaScript for Google Analytics, Facebook Pixel & more","gdpr,gdpr-cookie,gdpr-consent,gdpr-compliant,cookies,cookies-alert,cookies-consent,cookie-banner,javascript,google-analytics,analytics,facebook-pixel,facebook,frontend,cookies-banner,accept-cookies,disable-cookies,manage-cookies",77
560,https://github.com/tj/go-cli-analytics.git,Unobtrusive disk-buffered analytics for CLI tools powered by Segment,"segment,analytics,cli",77
561,https://github.com/BranchMetrics/documentation.git,"The Branch Metrics Developer Documentation. Branch helps mobile apps grow with deep links / deeplinks that power referral systems, sharing links and invites with full attribution and analytics.",,77
562,https://github.com/qonversion/react-native-sdk.git,"React Native SDK for cross-platform (iOS and Android) in-app purchase and subscription infrastructure, revenue analytics, engagement automation, and integrations","in-app-purchases,subscriptions,trials,renewal,in-app-receipt,receipt-validation",77
563,https://github.com/grafos-ml/okapi.git,Large-scale ML & graph analytics on Giraph,,76
564,https://github.com/reywood/meteor-iron-router-ga.git,Google analytics for Iron Router,"meteor,iron-router,google-analytics",76
565,https://github.com/wso2/product-sp.git,"An open source, cloud-native streaming data integration and analytics product optimized for agile digital businesses","stream-processing,complex-event-processing,analytics,real-time-processing,streaming-data-integration",76
566,https://github.com/KeithGalli/generate-analytics-report.git,Generating Covid-19 Analytics Report PDFS with Python,,76
567,https://github.com/adswerve/Swift-GA-Tracker-for-Apple-tvOS.git,Google Analytics tracker for Apple tvOS provides an easy integration of Google Analyticsâ€™ measurement protocol for Apple TV.,,76
568,https://github.com/pyAHP/pyAHP.git,Python library to perform Analytic Hierarchy Process.,"python,analytic,process,ahp,hierarchy",76
569,https://github.com/OzanKurt/google-analytics.git,Google analytics,,75
570,https://github.com/google/chatbase-node.git,Quickly integrate your Node.js chatbot with Chatbase Analytics,"bots,nodejs,chatbase,analytics",75
571,https://github.com/keenlabs/KeenClient-Java.git,Official Java client for the Keen IO API. Build analytics features directly into your Java apps.,,75
572,https://github.com/BlueQuartzSoftware/DREAM3D.git,"Data Analysis program and framework for materials science data analytics, based on the managing framework SIMPL framework.","c-plus-plus,microstructure,filter,analysis,multimodal-data,materials-science,materials-informatics,data-science,data-analysis",75
573,https://github.com/yavin-dev/framework.git,A framework for rapidly building production quality analytics applications,"node,javascript,emberjs,reports,dashboards,visualizations,big-data,hacktoberfest,yavin",74
574,https://github.com/mhthnz/hashfair-chrome.git,Hashflare browser addon for google chrome. Analytics for HashFlare cloud mining.  Supplement that shows real income on site hashflare.io. ,,74
575,https://github.com/qonversion/android-sdk.git,"Android SDK for cross-platform in-app purchase and subscription infrastructure, revenue analytics, engagement automation, and integrations","purchases,android,purchase-android,google-play-billing,billing,google-billingclient,subscriptions",74
576,https://github.com/kooparse/bast.git,:monkey: Web analytics focusing on privacy and simplicity.,"analytics,rust,javascript,typescript",74
577,https://github.com/saturn-lab/FBDQA-2021S.git,"Financial Big Data and Quantitative Analytics, Spring 2021.",,73
578,https://github.com/FranGoitia/basketball-analytics.git,SQLAlchemy Models for basketball analytics,,73
579,https://github.com/zwetan/as3-universal-analytics.git,Google Universal Analytics for AS3,"measurement-protocol,universal-analytics,google-analytics,actionscript,air,command-line",73
580,https://github.com/davepacheco/kartlytics.git,Mario Kart 64 analytics,,73
581,https://github.com/ethanopp/fitly.git,Self hosted web analytics for endurance athletes,"dash-plotly,dash,plotly,plotly-dash,dashboards,fitness,fitness-tracker,fitness-tracking,python,data-visualization",73
582,https://github.com/microsoft/ctsTraffic.git,ctsTraffic is a highly scalable client/server networking tool giving detailed performance and reliability analytics,"ctstraffic,networking,network-analysis,performance-testing,performance-analysis,performance,winsock,winsock2,sockets,tcp,tcp-server,tcp-client,udp,rio,overlapped-io",73
583,https://github.com/dssg/energywise.git,An energy analytics tool to make commercial building more energy efficient,,73
584,https://github.com/aws-samples/amazon-kinesis-analytics-taxi-consumer.git,"Sample Apache Flink application that can be deployed to Kinesis Analytics for Java. It reads taxi events from a Kinesis data stream, processes and aggregates them, and ingests the result to an Amazon Elasticsearch Service cluster for visualization with Kibana.",,73
585,https://github.com/AdobeDocs/analytics-2.0-apis.git,Documentation for the Adobe Analytics 2.0 APIs,,72
586,https://github.com/jaibeermalik/searchanalytics-bigdata.git,"Customer Product search clicks analytics using big data Hadoop, Hive, Oozie, ElasticSearch, Akka, Spring Data",,72
587,https://github.com/nexus-devs/NexusHub.git,ðŸ“ˆ Warframe and WoW Classic Economy Analytics,"nexus-stats,warframe,trade,statistics,nexushub",72
588,https://github.com/dwyl/learn-google-analytics.git,:chart_with_upwards_trend: A quick guide to learning/using google analytics for your web app.,,72
589,https://github.com/leoilab/react-native-analytics-segment-io.git,A React Native module for Segment Analytics,"react-native,analytics,segment",71
590,https://github.com/wp-statistics/wp-statistics.git,Complete WordPress Analytics and Statistics for your site!,"wordpress-plugin,statistics,wordpress,geoip,search-engine,chart,report,visit,visitors",71
591,https://github.com/pimlie/nuxt-matomo.git,Matomo analytics for Nuxt.js,"matomo,piwik,analytics,nuxt,middleware,nuxt-module",71
592,https://github.com/iopipe/iopipe-python.git,"Python agent for AWS Lambda metrics, tracing, profiling & analytics","iopipe,aws-lambda,telemetry,python,serverless,tracing,profiling,analytics,monitoring,aws,lambda,iopipe-agent",71
593,https://github.com/snowplow/snowplow-android-tracker.git,Snowplow event tracker for Android. Add analytics to your Android apps and games,,71
594,https://github.com/segment-boneyard/analytics.js-integrations.git,All of the third-party analytics.js integrations.,,71
595,https://github.com/opawg/user-agents.git,"An open, platform-agnostic list of user-agent and referrer regexes for use in podcast analytics services",,71
596,https://github.com/sofakingforever/solid-kotlin-analytics.git,"SOLID Analytics Interface for Android, written in Kotlin","analytics,solid-principles,kotlin,android,firebase-analytics,fabric-analytics,flurry-analytics,mixpanel-api,abstraction-layer",71
597,https://github.com/derrickreimer/fathom-client.git,A Fathom Analytics library to help with client-side routing ,"analytics,fathom-analytics",71
598,https://github.com/GitbookIO/micro-analytics.git,"A micro multi-website analytics database service designed to be fast and robust, built with Go and SQLite.",,71
599,https://github.com/aws-samples/realtime-web-analytics-workshop.git,AWS Realtime Web Analytics Workshop with Kinesis Data Analytics,,70
600,https://github.com/18F/api.data.gov.git,"A hosted, shared-service that provides an API key, analytics, and proxy solution for government web services.",,70
601,https://github.com/MattTuttle/titanium-google-analytics.git,Google analytics for Appcelerator Titanium,,69
602,https://github.com/PacktPublishing/Predictive-Analytics-with-TensorFlow.git,"Predictive Analytics with TensorFlow, published by Packt",,69
603,https://github.com/PacktPublishing/Python-Social-Media-Analytics.git,"Python Social Media Analytics, published by Packt",,69
604,https://github.com/Countly/countly-sdk-cordova.git,"Countly Product Analytics SDK for Cordova, Icenium and Phonegap","analytics,mobile,mobile-analytics,mobile-web,data-analysis,data-analytics,big-data,bigdata,insights,sdk,notifications,phonegap,icenium,javascript",69
605,https://github.com/dem108/Awesome-Azure-Advanced-Analytics.git,Awesome big data and advanced analytics resources for the Microsoft Azure Cloud,,69
606,https://github.com/fed/react-router-ga.git,Google Analytics component for React Router,"react,react-router,react-component,google-analytics",69
607,https://github.com/citruspi/Flask-Analytics.git,Analytics snippets generator extension for the Flask framework.,,69
608,https://github.com/sassoftware/covid-19-sas.git,"Collaboration space for SAS and others to understand, model, and mitigate COVID-19 through analytics",,69
609,https://github.com/spatie/analytics-statistics.git,An opinionated php package to retrieve Google Analytics data.,,69
610,https://github.com/GeostatsGuy/Resources.git,"Inventory of all the educational content that I share on spatial data analytics, geostatistics and machine learning. I hope these resources are helpful, Prof. Michael Pyrcz",,69
611,https://github.com/andrewstellman/pbprdf.git,Generate linked data for advanced basketball analytics. Reads basketball play-by-play files and generates RDF to import into a semantic graph database like RDF4J.,,69
612,https://github.com/pierre/meteo.git,Realtime Analytics,,68
613,https://github.com/smore-inc/react-native-segment-io-analytics.git,"{""React Native wrapper for SegmentIO's Analytics SDK""}",,68
614,https://github.com/soccermetrics/soccermetrics-client-py.git,Python client library for the Soccermetrics soccer analytics APIs.,,68
615,https://github.com/Skookum/nodealytics.git,Server-side google analytics collection for node.js,,68
616,https://github.com/mbiamont/google-analytics-annotations.git,Android library to easily use Google Analytics through annotation,,68
617,https://github.com/dipanjanS/nlp_crash_course_plugin20.git,Contains relevant notebooks for the hands-on NLP workshop for the Analytics India Magazine Plugin Conference -2020 Edition,,68
618,https://github.com/TalwalkarLab/paleo.git,An analytical performance modeling tool for deep neural networks.,"paleo,deep-learning,deep-neural-networks,distributed-computing",68
619,https://github.com/edx/edx-analytics-dashboard.git,Dashboard to display course analytics to course teams,,67
620,https://github.com/praekeltfoundation/django-google-analytics.git,Django Google Analytics app allowing for server side/non-js tracking.,,67
