,Url,Description,Topics,Stars
676,https://github.com/yeun/open-arrow.git,Open Arrow is an open-source font that contains 112 arrow symbols from U+2190 to U+21ff,"font,symbol,arrow,glyph,unicode",90
677,https://github.com/vernnobile/OswaldFont.git,repo for the Oswald font family,,89
678,https://github.com/hikikomori82/osifont.git,Free TrueType font for CAD projects,,89
679,https://github.com/fredrikloch/hugo-uno.git,"{""A responsive hugo theme with awesome font's, charts and lightbox galleries""}",,89
680,https://github.com/takahirom/DownloadableCalligraphy.git,This library provides a way to set default (downloadable) fonts using Support Library Font Resource and chrisjenx/Calligraphy methods.,,89
681,https://github.com/donmccurdy/msdf-bmfont-web.git,Web tool for creation of MSDF bitmap font spritesheets and JSON,,89
682,https://github.com/purcell/diredfl.git,Extra Emacs font lock rules for a more colourful dired,,89
683,https://github.com/garrickvanburen/Fontue.git,"Fontue is a Rack-based, open-source, web font server built for Kernest.com. This project also includes font optimization scripts for use with FontForge",,89
684,https://github.com/Crosse/font-install.git,Cross-platform font installer.,,88
685,https://github.com/raphaelbastide/Whois-mono.git,A simple monospace font,,88
686,https://github.com/rastikerdar/tanha-font.git,A Persian (Farsi) Font - فونت (قلم) فارسی تنها,,88
687,https://github.com/RikkaApps/FontProvider.git,Provide NotoCJK  (and other) fonts to other app.,,87
688,https://github.com/OliverLew/fontpreview-ueberzug.git,A POSIX shell script to preview fonts in fzf,"shell,font,preview,fzf,ueberzug",87
689,https://github.com/brodykenrick/text_on_OpenSCAD.git,"A library for putting customised ""text on"" 3D shapes in OpenSCAD with changeable fonts, languages/scripts, text direction.",,87
690,https://github.com/arrowtype/type-x.git,Test your fonts across the web by easily overriding fonts on any webpage.,,87
691,https://github.com/vusion/icon-font-loader.git,A webpack loader to convert svgs into font icons in CSS.,,87
692,https://github.com/zachleat/postcss-foft-classes.git,A postcss plugin to automatically add classes for various font loading strategies.,"postcss,font,web-font",87
693,https://github.com/MichMich/XMCircleType.git,"XMCircleType is a UIView that allows you to display an NSString as a cicular text. Is will take font kerning into account, so no weird spacings.",,87
694,https://github.com/Resike/Overwatch.git,Overwatch fonts and resources,,86
695,https://github.com/vernnobile/MuliFont.git,Git Repository for the Muli Font Family,,86
696,https://github.com/youzan/iconfount.git,离线icon font生成工具,,86
697,https://github.com/MitchTalmadge/Emoji-Tools.git,Multiple useful tools to help Android and iOS/OSX developers with creating and modifying Emoji Font files.,"java,android,osx,ios,emojis,javafx,swing,png",86
698,https://github.com/didierfranc/gatsby-plugin-google-fonts.git,Bring Google Fonts to Gatsby https://www.gatsbyjs.org/,"react,gatsby,fonts",85
699,https://github.com/chrismwendt/bront.git,A few tweaked fonts geared for programming,,85
700,https://github.com/tryvin/figma-linux-font-helper.git,Figma Linux Font Helper,"figma,python,fonts,linux",85
701,https://github.com/forwardemail/custom-fonts-in-emails.git,An extremely easy way to use custom fonts in emails without having to use art software.,"custom,fonts,emails,email,render,alternative,dynamic,text,font,view,engine,template,templates,renderer,static,image,asset,png,svg,responsive",85
702,https://github.com/artemnovichkov/zepcode.git,"⚗️ Zeplin extension that generates Swift snippets from colors, fonts, and layers","zeplin,extension,zeplin-extension,swift",85
703,https://github.com/dreamRs/gfonts.git,:abc: Offline Google Fonts for rmarkdown and shiny,"r,shiny,rmarkdown,fonts",85
704,https://github.com/pbnjay/pixfont.git,"A simple, lightweight Pixel Font package for Go that works with the standard image/draw package.",,85
705,https://github.com/LettError/mutatorSans.git,"Source font data for a small 2 dimensional designspace, for testing all sorts of variable math and making it not look stupid.",,85
706,https://github.com/lxgw/yozai-font.git,A Chinese handwriting font derived from YozFont. 一款衍生于 YozFont 的中文手写字型。,,85
707,https://github.com/hiun/NanumBarunGothic.git,NanumBarunGothic Web Fonts,,84
708,https://github.com/tracyone/program_font.git,fonts for programmer,"consola,font,programmer",84
709,https://github.com/sebsan/Bagnard.git,Bagnard Font,,84
710,https://github.com/dbader/large-type.com.git,"Display & share text in a large font, directly from your browser",,84
711,https://github.com/marella/material-icons.git,Material design icon font and CSS framework for self hosting the icons.,"material-icons,material-design-icons,material-design,iconfont,icons,font,css,sass",84
712,https://github.com/truewebartisans/bottle-vue-kickstart.git,"🍕 Very basic Bottle kickstart kit with Vue.js and Webpack. Included Axios, Autoprefixer, Babel, Webpack config, demo app with Bulma and Web font loader.","bottlepy,bulma-css-framework,vuejs,kickstart,kit,webpack,bottle,bulma,axios,vuejs2,pipenv,vue,autoprefixer",84
713,https://github.com/sanemat/homebrew-font.git,Install fonts,"homebrew,font",83
714,https://github.com/SirPole/google-fonts-plugin.git,Webpack plugin that downloads fonts from Google Fonts and encodes them to base64,"webpack-plugin,webpack,google-fonts,google-font",83
715,https://github.com/sammdot/roadgeek-fonts.git,A set of fonts replicating various road sign typefaces.,,83
716,https://github.com/icons8/svg-caster.git,SVG font to SVG converter,,83
717,https://github.com/TiroTypeworks/Castoro.git,Castoro libre fonts,,82
718,https://github.com/joaoffcosta/UILabel-FormattedText.git,An iOS UILabel extension to enable easy definition of multiple colors and fonts,,82
719,https://github.com/mrmrs/css-system-fonts.git,A css module for utilizing system fonts across platforms,,82
720,https://github.com/patrickmarabeas/jQuery-FontSpy.js.git,Style your @font-face elements while they load or upon catastrophic failure,,82
721,https://github.com/dimadin/disable-google-fonts.git,Disable enqueuing of Open Sans and other fonts used by WordPress from Google.,,81
722,https://github.com/d3plus/d3plus-text.git,A smart SVG text box with line wrapping and automatic font size scaling.,,81
723,https://github.com/zhm/symbola.git,An icon font made for TileMill and Mapnik,,81
724,https://github.com/hsuehic/vue-kit.git,"[Deprecated]A Vue.js project, base on vue-webpack template(vue 2.x and vue-router 2.x), with bulma, chart.js, font awesome, Weui. Aims to be a quick start for building demo applications or product prototypes.",,81
725,https://github.com/RoelN/Font-Falsehoods.git,Falsehoods programmers believe about fonts,,80
726,https://github.com/olimsaidov/pixeden-stroke-7-icon.git,A series of iOS 7 inspired vector icons in a custom @font-face icon font that can be styled dynamically using CSS. ,"font-face,pixeden,icon-font,icon-pack,font-icon,css,vector-icons",80
727,https://github.com/sebdesign/cap-height.git,Calculate the cap height of fonts loaded with Web Font Loader,"typography,web-font-loader,height-calculation,font-metrics",80
728,https://github.com/googlefonts/pyfontaine.git,Python tool to check font files for language/character set support,,80
729,https://github.com/nuxt-community/fontawesome-module.git,Module to use Font Awesome icons in Nuxt.js,"nuxt,nuxt-module,fontawesome,font-awesome,icons",80
730,https://github.com/vanniktech/VNTFontListPreference.git,ListPreference for Android which displays fonts,"android,font,preference",79
731,https://github.com/CocoaPods-Fonts/OpenSans.git,A podspec encapsulating OpenSans font for iOS,,79
732,https://github.com/gaplo917/Ligatured-Hack.git,Automatically patch latest Hack Font with latest JetBrains Mono / FiraCode Ligatures,"font,hack-font,ligature",79
733,https://github.com/MattMcFarland/com.mattmcfarland.fontawesome.git,Font Awesome meets Appcelerator Titanium Alloy,,78
734,https://github.com/championswimmer/awesome-jetbrains.git,A collection of awesome Fonts and Color Schemes to be used in Jetbrains IDEs.,,78
735,https://github.com/qdsang/ttf2svg.git,"Font convertor, TTF to SVG, for node.js","ttf,svg,font-convertor",78
736,https://github.com/ceteio/styled-components-rhythm.git,Vertical Rhythm and Font Baselines with Styled Components,"styled-components,bsaeline,vertical-rhythm,css,font,css-in-js",78
737,https://github.com/jonathantneal/google-fonts-complete.git,A complete list of Google Web Fonts and their sources,,77
738,https://github.com/sebsan/Cotham.git,Cotham Font,,77
739,https://github.com/Bodmer/TFT_ILI9341.git,A fast Arduino IDE compatible graphics and fonts library including a driver for the ILI9341 based TFT displays.,,77
740,https://github.com/raulghm/Font-Awesome-Stylus.git,Stylus port for font-awesome 4.7.0,"font-awesome,fontawesome,icons,stylus,stylus-port,css,font",77
741,https://github.com/clovaai/dmfont.git,Official PyTorch implementation of DM-Font (ECCV 2020),"font-generation,pytorch,eccv2020,dmfont,few-shot",77
742,https://github.com/khaledhosny/euler-otf.git,An abandoned OpenType/Unicode math port of AMS Euler font,,77
743,https://github.com/EngrAhsanAli/AACustomFont.git,"[UNMAINTAINED] AACustomFont is a lightweight custom font binder in XML directly in TextView, Button, EditText, RadioButton, CheckBox tags. The library is aimed to avoid custom views for custom fonts in XML and to minimize the JAVA code for setting the TypeFaces for each view.","custom-view,fonts,databinding,xml,customview",77
744,https://github.com/kakwa/kakwafont.git,"Kakwafont, a 12px monospace bitmap font based on Terminus","font,bitmap",77
745,https://github.com/CyanoHao/Resource-Han-Rounded.git,"Resource Han Rounded, a rounded font family derived from Source Han Sans.",,77
746,https://github.com/NathanWalker/nativescript-ngx-fonticon.git,Use custom font icon collections seamlessly with NativeScript + Angular.,,76
747,https://github.com/xpressengine/XEIcon.git,Beautiful transformable iconic font made for the web.,"icnos,glyphs,font,icon-font,xpressengine",76
748,https://github.com/mapshakers/mapkeyicons.git,The icon font especially for cartographical use.,,76
749,https://github.com/nongthaihoang/google_sans_plus_font.git,Google Sans Font for Android,,76
750,https://github.com/Codeinwp/themeisle-icons.git,A free icon font from ThemeIsle ,"icons,line-icons,web",76
751,https://github.com/oracle/font-apex.git,Font APEX is an open source icon library from the Oracle APEX team.,"oracle-apex,icons,icon-library,font-icons,iconset",76
752,https://github.com/kiamazi/kateb.git,Install and update free Farsi fonts,,76
753,https://github.com/markgoodyear/postcss-vertical-rhythm.git,A PostCSS plugin to create a custom vertical rhythm unit from the base font-size and line-height.,,76
754,https://github.com/mapskin/mapskin.git,Geospatial Web Font,,75
755,https://github.com/jasewarner/gulp-shopify.git,"Blank slate Shopify theme for Developers, packaged with Gulp.js for processing SCSS, JavaScript (ES6), images and fonts","shopify,shopify-theme,gulp,themekit,shopify-skeleton-theme,scss,es6,shopify-themes",75
756,https://github.com/CodeZombie/TypeRip.git,Adobe Fonts (formerly TypeKit) font ripper,,74
757,https://github.com/railslove/fontello_rails_converter.git,"CLI gem for comfortably working with icon fonts (open, download, convert) from http://fontello.com for usage in Rails apps.",,74
758,https://github.com/daktales/UIFontWDCustomLoader.git,An iOS custom font loader,,74
759,https://github.com/rosettatype/hyperglot.git,Hyperglot: a database and tools for detecting language support in fonts,"language,language-support,language-codes,character-sets,font",74
760,https://github.com/LingDong-/chinese-hershey-font.git,Convert Chinese Characters to Single-Line Fonts using Computer Vision,"chinese,hershey-fonts,computer-vision,convert,typography,font",74
761,https://github.com/posteroffonts/sanfran.git,"Originally only for San Francisco, now I just dump all the font dirs of macOS. San Francisco is in /S/L/F. Fonts from developer.apple.com/fonts are in respective directories. Kaiti.ttc is compressed as .tar.xz. Emoji font is too large for GitHub, even compressed. Font Book optional downloads (mostly CJK) are in com_apple_MobileAsset_Font6.",,74
762,https://github.com/kgn/UIImage-Vector.git,UIImage category for dealing with vector formats like PDF and icon fonts.,,74
763,https://github.com/nathanford/min-max-font-size.git,Using vw or vh CSS units? Set a min or max font-size for your type.,,74
764,https://github.com/designjockey/material-design-fonticons.git,Material Design Fonticons is a font converted version of the Google Material Design Icon set.,,74
765,https://github.com/brandon-rhodes/unixpc-font-bdf.git,Convert the venerable AT&T UNIX PC font to the modern BDF bitmap format,,74
766,https://github.com/raphaelbastide/ofont.git,Listing fonts? YEAAHRR.,,73
767,https://github.com/ecomfe/gulp-fontmin.git,Minify font seamlessly,,73
768,https://github.com/AndreLZGava/font-awesome-extension.git,Simple Font Awesome Extension,,73
769,https://github.com/ahume/webfontjson.git,Turn a set of web fonts into one json file,,73
770,https://github.com/boraunal/FontAwesome-AdobeExperience-Design-XD.git,Font Awesome pictographic icon Library for Adobe Experience Design,,73
771,https://github.com/notofonts/noto-sans-nushu.git,Nüshu script enters the Noto Sans font family...,"writing-systems,women,hanzi,local-dialects,hunan,noto,china,calligraphy,linguistics,nushu",73
772,https://github.com/jpt/meow.git,Meow: a font for cats,,73
773,https://github.com/AriZuu/ttf2ugui.git,Simple utility to convert TTF fonts into uGUI bitmap fonts.,,72
774,https://github.com/bpmn-io/bpmn-font.git,A BPMN 2.0 symbol font,"bpmn,font",72
775,https://github.com/iij/fontmerger.git,DEPRECATED: FontForge script for to merge any fonts,,72
776,https://github.com/hodefoting/kernagic.git,Semi-automatic font spacing tool,,72
777,https://github.com/syakuzen/DelaGothic.git,fat sans-serif font,,72
778,https://github.com/jstart/Swiftly-Typed-Resources.git,"A playground showing how Swift makes Strings, Colors, Fonts, Images, etc easier to deal with.",,72
779,https://github.com/nsfmc/chartjunk.git,a font for quickly embedding spark lines in a webpage.,,72
780,https://github.com/GianCastle/FiraMonaco.git,Monaco Font with Firacode ligatures and patched for Powerline 📝,"font,ligature,programming-fonts,monaco,firacode,ligatures,monospace",72
781,https://github.com/karloespiritu/Bastard.git,":metal: A Free Boilerplate Responsive Theme for Ghost blogging platform. Built with Bootstrap, SASS, Font Awesome, HighlightJs, and Gulp",,72
782,https://github.com/YuanshengZhao/Garamond-Math.git,An OTF math font matching the EB Garamond.,,72
783,https://github.com/amio/embedded-google-fonts.git,Embed (base64 encoded) google fonts into css.,,71
784,https://github.com/scotu/ubuntu-mono-powerline.git,"Ubuntu Mono fonts patched for the ""Powerline"" vim plugin: https://github.com/Lokaltog/vim-powerline/ (Just don\'t trust me leaving it here forever: download, fork whathever)",,71
785,https://github.com/Typogram/Anicons.git,Anicons: a new kind of icon fonts with baked-in animation and colors,"variablefonts,icons,materialdesign",71
786,https://github.com/digital-sound-antiques/ymfont.git,A latin font inspired by characters on retro LSI surface,,71
787,https://github.com/martinberlin/cale-idf.git,"CALE is an Epaper component driver for the ESP-IDF framework with GFX and font support, optional touch interface, compatible with all variants of ESP32 / ESP32S2 / ESP32C3","epaper,esp32,espressif,eink,esp-idf,touch,esp32s2,esp32c3",71
788,https://github.com/addy-dclxvi/bitmap-font-collections.git,"Custom bitmap fonts, based on M+, Tewi, Lemon, and Siji",,70
789,https://github.com/geordanr/xwing-miniatures-font.git,Web font for the X-Wing Miniatures game.,,70
790,https://github.com/shoorick/russian-road-sign-font.git,Font which used for road signs in USSR and Russia,"font,fontforge,road-signs,russian,soviet,gost,latin-alphabet,cyrillic-characters",70
791,https://github.com/MeetMe/font-compat.git,An easy to use library for using custom font families in your Android applications.,,70
792,https://github.com/Viglino/font-gis.git,Icon font and SVG for use with GIS and spatial analysis tools,"gis,geospacial,font,icons,map,geo,svg,svg-sprites,svg-icons,webfont",70
793,https://github.com/zenozeng/font-detect.js.git,"Detect font without flash, simply using javascript & @font-face",,70
794,https://github.com/ayaka14732/FanWunMing.git,"A Simplified-Chinese-to-Traditional-Chinese font based on GenYoMin, which can handle the one-to-many problem | 繁媛明朝是基於源樣明體開發的簡轉繁字型，能處理一簡對多繁","font,ttf,chinese-characters",70
795,https://github.com/websygen/owfont.git,OpenWeatherMap Font,,69
796,https://github.com/epk/SF-Mono-Nerd-Font.git,"{""Apple's SF Mono font patched with the Nerd Fonts patcher""}",,69
797,https://github.com/CodeheadUK/CBFG.git,"{""Codehead's Bitmap Font Generator""}",,69
798,https://github.com/codeman38/PressStart2P.git,A bitmap font based on 1980s video games.,,69
799,https://github.com/inconvergent/gridfont.git,grid-based system for designing simple symbols and fonts. including an example font. mainly intended for plotter drawings.,"font,grid,symbols,plotter,svg",69
800,https://github.com/trishume/numderline.git,Font patcher to using shaping tricks to make it easier to pick out digit groups in numbers without commas,,69
801,https://github.com/googlefonts/gf-docs.git,Documentation for things related to github.com/google/fonts,,68
802,https://github.com/lvgl/lv_font_conv.git,Converts TTF/WOFF fonts to compact bitmap format,,68
803,https://github.com/pettarin/glyphIgo.git,glyphIgo is a Swiss Army knife for dealing with fonts and EPUB eBooks,,68
804,https://github.com/codeAdrian/gatsby-omni-font-loader.git,Font loader optimized for maximum performance. Removes render-blocking font resources and loads them asynchronusly. Handle FOUT & FOUC with font loading status watcher. Supports both local-hosted fonts and web fonts.,"web-fonts,gatsby,css,font,react,reactjs",68
805,https://github.com/silnrsi/FDBP.git,Font Development Best Practice documentation,,68
806,https://github.com/alphapeter/fa-svelte.git,Font Awesome 5 for svelte.js,"fontawesome5,sveltejs,svelte-components,font-awesome,javascript,fontawesome,svelte",68
807,https://github.com/EkType/Baloo.git,Baloo is a display font available in ten Indian scripts along with Latin.,,68
808,https://github.com/intuxicated/css-persian.git,Persian CSS Fonts,,67
809,https://github.com/idleberg/sublime-icon-fonts.git,"Completions for popular icon fonts such as Font Awesome, Glyphicons and many more!","sublime-snippets,icon-fonts,font-awesome,glyphicon,octicons,ionicons,glyphicons",67
810,https://github.com/oldj/node-font-list.git,Get the list of fonts installed in the system.,"font,nodejs,electron",67
811,https://github.com/dreampulse/computer-modern-web-font.git,The Computer Modern LaTeX font for the web,,67
812,https://github.com/OdedEzer/heebo.git,"Heebo open source Hebrew font, designed by Oded Ezer",,67
813,https://github.com/ctrlcctrlv/kjv1611.git,A complete digital OpenType font restoration of the typeface found in the 1611 King James Bible,,67
814,https://github.com/11ty/eleventy-cache-assets.git,"Utility to cache any remote asset: Image, Video, Web Font, CSS, JSON, etc",,67
815,https://github.com/usagimaru/Sketch-AppleSystemFont-Plugin.git,A Sketch plugin for applying Apple system font to text layers. (For Japanese designers.),,67
816,https://github.com/JenniferSimonds/FontDetect.git,"A JavaScript class you can use to determine whether a webfont got loaded, which font is being used by an element, or react to a webfont getting loaded (or failing to load).",,67
817,https://github.com/makovich/google-fonts-offline.git,Google Fonts Offline — use Google Fonts locally,,66
818,https://github.com/aguegu/BitmapFont.git,decode bitmap fonts,,66
819,https://github.com/lalitmee/fonts.git,A collection of fonts for coding and everything.,"fonts,coding-fonts,system-fonts,linux-fonts,ligatures",66
820,https://github.com/gabriel/font-detect-js.git,Font detection using Javascript and Flash,,66
821,https://github.com/seiyria/gameicons-font.git,An icon font for game-icons/icons.,"game-icons,font,webfont,icon-font",66
822,https://github.com/abrudz/APL386.git,APL385 Unicode font evolved,"apl,font,fontforge,truetype",66
823,https://github.com/mattdesl/gl-sprite-text.git,bitmap font rendering for stackgl,,66
824,https://github.com/zhenruyan/codefont.git,60余种常用的等宽字体    愉快的code吧  欢迎issues我  收录更多字体  Happy code bar with more than 60 common fonts of equal width. Welcome issues. I include more fonts.,"linux,fonts,shell,code,mono,emoji,google",66
825,https://github.com/rjinxx/RJTextView.git,Text view with font size automatically adjustment according to its frame size.,,66
826,https://github.com/LingDong-/hfmath.git,Render LaTeX math with Hershey Fonts,"hershey-fonts,latex,svg,math",66
827,https://github.com/Mindgrub/Swash.git,"Fonts in iOS made safe, expressive, and dynamic.","ios,swift,cocoapods,fonts,font,uifont,accessibility,carthage,custom-fonts,dynamic",66
828,https://github.com/Fingertips/FTFontSelector.git,A clone of the font selector found in Apple’s iOS Pages app.,,66
829,https://github.com/doheexkim/100daysoffonts.git,A #100DaysProject featuring a google font pairing everyday for 100 days.,,66
830,https://github.com/dzog/ImgGlyph.git,ImgGlyph for iOS is a collection of drop-in replacements for UILabel and UITextView that allow for font-sized in-line images (image glyphs) by auto-replacing specified strings with specified images. ,,66
831,https://github.com/ali1234/bitmap2ttf.git,Convert bitmap fonts to ttf fonts using font forge.,,65
832,https://github.com/jeffmcneill/thai-font-collection.git,Free and Open Source Thai Fonts,"fonts,thai,thai-language,free,open,source,opensource,typefaces,typography",65
833,https://github.com/Alecaddd/gulp-es6.git,"Gulpfile setup for Javascript ES6 compiling, plus SCSS, images, and fonts handling","es6,ecmascript2015,scss,gulp",65
834,https://github.com/tholman/palettab.git,New fonts and colors with every new tab.,,65
835,https://github.com/jrenner/gdx-smart-font.git,(LibGDX) Generate bitmap fonts in proportion to screen size and cache them to file.,,65
836,https://github.com/colindean/homebrew-fonts-nonfree.git,Nonfree font installers for Homebrew & Caskroom,,65
837,https://github.com/yizzuide/XFDialogBuilder.git,"A configable dialog for IOS. Developer can custom mask layer,window size,UI theme,text content,font,layout content,push and pop Animation. ","dialog,alertview,ios",65
838,https://github.com/tonsky/font-writer.git,Monospaced font for long-form writing,,65
839,https://github.com/adewes/instant-feedback.git,"A Flask application that allows you to add inline feedback elements to any website and collect user feedback on-the-fly. Built with Bootstrap, jQuery, font-awesome and MongoDB.",,65
840,https://github.com/impallari/Encode-Sans.git,Encode Sans Fonts,,64
841,https://github.com/Haixing-Hu/latex-chinese-fonts.git,Simplified Chinese fonts for the LaTeX typesetting.,,64
842,https://github.com/ryanseddon/font-dragr.git,Drag and drop font testing,,64
843,https://github.com/MartinTopfstedt/FontAwesome5.git,"WPF controls for the iconic SVG, font, and CSS toolkit Font Awesome 5.","fontawesome,fontawesome5,wpf,uwp,netcore3",64
844,https://github.com/FortAwesome/font-awesome-less.git,Font-Awesome LESS gem for use in Ruby on Rails projects,,64
845,https://github.com/simoncozens/atokern.git,Neural network based font kerning,,64
846,https://github.com/purcell/default-text-scale.git,Easily adjust the font size in all Emacs frames,,64
847,https://github.com/nicolalamacchia/powerline-consolas.git,Patched version of the font Consolas for Powerline,,64
848,https://github.com/FontStruct/fonthx.git,Font File Generation in Haxe,"font,font-generator,truetype,haxe,opentype,font-generation,cff",64
849,https://github.com/rastikerdar/gandom-font.git,A Persian (Farsi) Font - فونت (قلم) فارسی گندم,,64
850,https://github.com/s-a/digital-numbers-font.git,A fixed width (web)font in a cool liquid-crystal display (LCD) style.,,64
851,https://github.com/mattt/UIFontSerialization.git,Encode and decode between UIFont and Postscript font data,,64
852,https://github.com/MatteoGuadrini/fontpreview.git,Python library for font previews,"python,python-library,font-previews,font,banner-generator,banners,python3,truetype,opentype,image-processing",64
853,https://github.com/dumbledore/AlbiteREADER.git,"{""A feature-rich e-book reader for the Java Mobile platform. Currently works with txt, xhtml and epub files.   Supported features include touch scrolling, images, styling and multilingual hyphenation, on-touch   dictionaries, units converter, table of contents. Uses the Droid Serif font through it's own font   implementation scheme.""}",,64
854,https://github.com/kori/lavender-font.git,"Console font, inspired by Sun Gallant and the XNU console font.",,64
855,https://github.com/Vekseid/FontReaper.git,"Node script to break up icon fonts into css classes with embedded svg backgrounds, while retaining similar syntax.",,64
856,https://github.com/yayolius/react-native-font-list.git,A demo in react-native to show the Native Fonts in iOS,,63
857,https://github.com/opcon/QuickFont.git,A Modern OpenGL Font Rendering Library for OpenTK,"opengl,opentk,font,rendering,c-sharp,cross-platform",63
858,https://github.com/BboyHanat/TextGenerator.git,OCR dataset Text-Detection dataset Font-Classification dataset generator,"ocr-dataset-generate,text-detect-dataset-generate",63
