,Url,Description,Topics,Stars
0,https://github.com/k4m4/movies-for-hackers.git,🎬 A curated list of movies every hacker & cyberpunk must watch.,"hacking,movies,curated-list,collection,sexy-lists,awesome,awesome-list,list",8670
0,https://github.com/Radarr/Radarr.git,A fork of Sonarr to work with movies à la Couchpotato.,"movies,couchpotato,nzb,torrent,movie,usenet,bittorrent",5154
0,https://github.com/android10/Android-CleanArchitecture-Kotlin.git,"This is a movies sample app in Kotlin, which is part of a serie of blog posts I have written about architecting android application using different approaches.","android,architectural,lessons-learned,android-cleanarchitecture-kotlin,kotlin,kotlin-android,architectural-patterns,functional-programming,android-development,clean-architecture,mobile-development",3241
0,https://github.com/rubensousa/PreviewSeekBar.git,A SeekBar suited for showing a preview of something. As seen in Google Play Movies.,,3237
0,https://github.com/saulmm/Material-Movies.git,[Deprecated] An application about movies with material design,,2457
0,https://github.com/junedomingo/movieapp.git,Discover Movies and TV shows -  React Native ,"movieapp,redux,react-native,react-native-navigation,wix,wix-react-native-navigation",1743
0,https://github.com/UweTrottmann/SeriesGuide.git,Track your favorite TV shows and movies on Android devices.,"android,java,tv,movies,kotlin,seriesguide",1556
0,https://github.com/streamio/streamio-ffmpeg.git,Simple yet powerful ruby ffmpeg wrapper for reading metadata and transcoding movies,,1516
0,https://github.com/jclem/gifify.git,gifify turns movies into gifs.,,1090
0,https://github.com/alberanid/imdbpy.git,"IMDbPY is a Python package useful to retrieve and manage the data of the IMDb movie database about movies, people, characters and companies","imdb,movies,actors,cinema,movie-database,python,database,sql,cast,internet-movie-database,character,company,movie,db,parser,scraper",809
0,https://github.com/infobyte/spoilerwall.git,Spoilerwall introduces a brand new concept in the field of network hardening. Avoid being scanned by spoiling movies on all your ports!,"devops,pranks,pentesting,pentest,ctf,firewall,spoilerwall",754
0,https://github.com/guymorita/recommendationRaccoon.git,"A collaborative filtering based recommendation engine and NPM module built on top of Node.js and Redis. The engine uses the Jaccard coefficient to determine the similarity between users and k-nearest-neighbors to create recommendations. This module is useful for anyone with a database of users, a database of products/movies/items and the desire to give their users the ability to like/dislike and receive recommendations.",,754
0,https://github.com/peterljq/OpenMMD.git,"OpenMMD is an OpenPose-based application that can convert real-person videos to the motion files (.vmd) which directly implement the 3D model (e.g. Miku, Anmicius) animated movies.",,573
0,https://github.com/framefield/tooll.git,"Tooll is a new multi-purpose application for creating interactive 3d content and animations. It combines the best aspects of animation, compositing, and coding into a lightweight and intuitive UI. Your designs can be shared as executable or rendered to movies.",,573
0,https://github.com/popcorn-official/popcorn-api.git,"Popcorn Time is a multi-platform, free software BitTorrent client that includes an integrated media player.  Compatible API Anime/Movies/Show Scrapper ","popcorn-api,trakt,metadata,popcorn,popcorn-time,episodes",542
0,https://github.com/jlmd/UpcomingMoviesMVP.git,Sample project of MVP and Material Design using as repository a list of upcoming movies,,516
0,https://github.com/char0n/ffmpeg-php.git,"{""FFmpegPHP is a pure OO PHP port of ffmpeg-php library that was written in C. It adds an easy to use, object-oriented API for accessing and retrieving information from video and audio files. It has methods for returning frames from movie files as images that can be manipulated using PHP's image functions. This works well for automatically creating thumbnail images from movies. FFmpegPHP is also useful for reporting the duration and bitrate of audio files (mp3, wma...). FFmpegPHP can access many of the video formats supported by ffmpeg (mov, avi, mpg, wmv...) ""}","php,ffmpeg,ffprobe,video,audio,avconv",449
0,https://github.com/wells/airflix.git,🍿 An AirPlay friendly web interface to stream your movies and TV shows from a home server.,"airplay,laravel,vue",421
0,https://github.com/sjlleo/netflix-verify.git,流媒体NetFlix解锁检测脚本 / A script used to determine whether your network can watch native Netflix movies or not,,411
0,https://github.com/neo4j-examples/movies-java-spring-data-neo4j.git,Neo4j Movies Example with Spring Data Neo4j,,404
0,https://github.com/lardbit/nefarious.git,Web application for automatically downloading TV & Movies,"transmission,jackett,django,angular,tmdb,torrent,python,docker,torrent-downloader",393
0,https://github.com/maddox/magic-cards.git,"🎩 Queue music, play movies, or trigger events with RFID cards.","home-automation,music,diy,sonos,home-assistant,channels,movies",382
0,https://github.com/SAGARSURI/MyMovies.git,A Flutter app which shows a list of popular movies.,"flutter,android,ios,dart,rxdart,cross-platform,dependency-injection,blocpattern,mobile-app,google,mobile-development,api-rest,json,test-driven-development,bloc-pattern,pagination",377
0,https://github.com/l3uddz/traktarr.git,Script to add new series & movies to Sonarr/Radarr based on Trakt lists.,,377
0,https://github.com/JasonHHouse/gaps.git,Find the missing movies in your Plex Server,,369
0,https://github.com/graysky2/xscreensaver-aerial.git,xscreensaver that randomly selects one of the Apple TV4 aerial movies,,360
0,https://github.com/dezelin/movies.git,movies,,356
0,https://github.com/davidgatti/How-to-Stream-Movies-using-NodeJS.git,🎥 How to Stream Movies to a HTML 5 video tag using NodeJS,"stream,stream-movies,nodejs,article,video-tag",339
0,https://github.com/martinraison/ascii-tv.git,Stream ASCII movies over HTTP,,331
0,https://github.com/orinocoz/pirateflix.git,:movie_camera: Stream piratebay movies directly from CLI,,328
0,https://github.com/lawloretienne/MovieHub.git,"Showcases popular movies, tv shows, and people from The Movie Database","rxjava2,retrofit2,mvp-clean,android,realm,material-design,picasso,okhttp3,butterknife,timber,trestle,rxandroid,junit4,espresso,dagger2",324
0,https://github.com/tungs/timecut.git,Record smooth movies of web pages with JavaScript animations,,310
0,https://github.com/maksim-m/Popular-Movies-App.git,"A simple Android app, that helps user to discover movies. Project 1 & 2 of Udacity Android Developer Nanodegree.","android,app,movies,material-design,udacity,android-application,java,instrumentation-tests,rxjava",294
0,https://github.com/mythsman/hexo-douban.git," :cd: A simple plugin for hexo that helps us generate pages for douban books ,movies and games.","hexo,douban,yilia,hexo-theme,hexo-plugin,movie,book,next,indigo,landscape,aath,hexo-douban",284
0,https://github.com/murillo94/cine-the-guide-movie.git,"A React Native app that interacts with the TMDb API showing the info about movies, series, actors and also for searching what you want in this context",,278
0,https://github.com/Taxel/PlexTraktSync.git,"A python script that syncs the movies, shows and ratings between trakt and Plex (without needing a PlexPass or Trakt VIP subscription)",,275
0,https://github.com/zerratar/SubSync.git,Automatically download subtitles for your movies,"subtitle-downloader,subsync,dotnet-core2,subtitle,csharp",274
0,https://github.com/markriedl/WikiPlots.git,"A dataset containing story plots from Wikipedia (books, movies, etc.) and the code for the extractor.",,263
0,https://github.com/neo4j-examples/neo4j-movies-template.git,A Neo4j movies React application with backends in Python/Flask and Node/Express.,"flask-api,neo4j,swagger,imdb,react,express",236
0,https://github.com/sjlu/popular-movies.git,Tries to create a list of popular movies based on a series of heuristics,"movies,heuristics",233
0,https://github.com/talhashraf/major-scrapy-spiders.git,"Scrapy spiders of major websites. Google Play Store, Facebook, Instagram, Ebay, YTS Movies, Amazon","ebay,facebook,instagram,amazon,python,scrapy-spider,android,googleplay,yts,yts-movie,movies,torrent",232
0,https://github.com/sameera-madushan/SubtitleBOX.git, Python script to download subtitles for your movies.,"subtitle-downloader,python,subtitles,downloader,subdbapi",218
0,https://github.com/kelciour/movies2anki.git,Convert movies with subtitles to watch them with Anki. Inspired by subs2srs,"anki,anki-flashcards,subs2srs,language-learning,flashcards,english,learning,subtitles,movies",214
0,https://github.com/neo4j-examples/movies-python-bolt.git,Neo4j Movies Example application with Flask backend using the neo4j-python-driver,"python,graph,graph-database,bolt,cypher,movies-api,neo4j",209
0,https://github.com/hadley/data-movies.git,Download data from IMDB movies and parse into useful form,,204
0,https://github.com/ewintory/udacity-popular-movies.git,"Android developer nanodegree, Projects 1 & 2: Popular Movies app",,203
0,https://github.com/ngovil21/Plex-Cleaner.git,A script to clean up movies and episodes in Plex Media Server,"plex,python",202
0,https://github.com/bimsina/Matinee-Flutter.git,"This is an app that displays you details of movies that you can search for , or browse.","flutter,flutter-apps,flutter-ui",202
0,https://github.com/Ullaakut/camerattack.git,An attack tool designed to remotely disable CCTV camera streams (like in spy movies),"cctv,camera,security,attack,hack,csec,rtsp,ddos",198
0,https://github.com/int128/gpup.git,A command to upload photos and movies to Google Photos Library using the official Google Photos Library API,"google-photos,golang,google-api",198
0,https://github.com/guygodin/VirtualDesktop.git,"Connect wirelessly to your computer(s) to watch movies, browse the web, play games on a giant virtual screen or stream PCVR games. Virtual Desktop is a highly optimized, native application developed for low latency, high quality streaming.",,198
0,https://github.com/DeluxeAlonso/UpcomingMovies.git,"Movies app written in Swift 5 using the TMDb API and demonstrating Clean Architecture, Dependency Injection, MVVM and Coordinators.","ios,ios-app,themoviedb,themoviedb-api,swift,landscape,portrait,coredata,storyboards,mvvm,dark-mode,uikit,coordinator-pattern,accesibility,voice-over,fastlane,dependency-injection,dependency-injection-container,swinject,widgetkit",196
0,https://github.com/DenBeke/YouTube-Downloader-for-macOS.git,Simple menu bar app to download YouTube movies on your Mac,"swift,youtube-dl,youtube-downloader,macos,menubar,download",189
0,https://github.com/appcornerit/iTunesPicker.git,"Discover, search and compare world rankings for apps, ibooks, movies, music videos and music from iTunes (and AppStore) in any available country.",,183
0,https://github.com/ZeroQI/YouTube-Agent.bundle.git,Plex Metadata Agent for Movies and TV Series libraries,"plex,metadata,agent",182
0,https://github.com/brentvatne/flix.git,Swipe Netflix movies as if they were people on Tinder - built with Angular/Ionic/Auth0 for frontend & Rails on the backend,,182
0,https://github.com/mlabouardy/movies-restapi.git,RESTful API to manage movies written in Go and uses MongoDB as storage,"mongodb,golang,api,rest-api",169
0,https://github.com/iCHAIT/moviemon.git,:movie_camera: Everything about your movies within the command line. ,"movies,movies-sorted,python,movie-recommendation",167
0,https://github.com/meisnate12/Plex-Meta-Manager.git,"Python script to update metadata information for movies, shows, and collections as well as automatically build collections.",,165
0,https://github.com/crashfort/SourceDemoRender.git,"Multithreaded, hardware accelerated solution to create high quality movies for the Source engine.","source-engine,valve,steam",163
0,https://github.com/JasanHdz/backendnodejs.git,"backend of an api rest for movies, with some examples of server-side nodejs",,156
0,https://github.com/LagradOst/CloudStream-2.git,"CloudStream 2 is an android streaming app for movies, tv-shows and anime","streaming,anime,movies,tv-shows,chromecast,android,imdb,mal,anilist",154
0,https://github.com/tuttleofx/TuttleOFX.git,Tuttle OFX is a library to connect and batch operations with OpenFx plugins. It comes with a set of plugins that allows you to batch process on movies and file sequences.,,154
0,https://github.com/kishan0725/AJAX-Movie-Recommendation-System-with-Sentiment-Analysis.git,Content-Based Recommender System recommends movies similar to the movie user likes and analyses the sentiments on the reviews given by the user for that movie.,"python,ajax,machine-learning,nlp,sentiment-analysis,recommendation-system,api,movie-recommender,movie-recommendation,movie-recommendation-system",147
0,https://github.com/Diblo/KODI-Popcorn-Time.git,With KODI Popcorn Time you can search for movies that you can see immediately in KODI.,,146
0,https://github.com/ronak-manglani/watchlist.git,"{""Android App: Keep track of which movies you've watched & want to watch""}",,146
0,https://github.com/harkle/roadtrip.git,A script to make movies from Google StreetView images,,142
0,https://github.com/TorrentLookup/Flixtor.git,"Flixtor streams movies, series, videos and animes from Torrents.",,141
0,https://github.com/brittanyrw/emojiscreen.git,"EmojiScreen is a listing of movies, TV shows and musicals depicted through emojis.","emojis,musicals,tv-shows,movies,beginner-friendly",140
0,https://github.com/matcornic/subify.git,Subify - Download subtitles for your favorite TV shows and movies,"subtitle,golang-application,golang,opensubtitles,download-subtitles,video,movie",140
0,https://github.com/cardoso/ReduxMovieDB.git,🎥 See the upcoming movies! ReSwift + RxSwift 💖 Hacktoberfest 🎃,"hacktoberfest,redux,swift,ios,ios-app,rxswift,reswift,reactive",137
0,https://github.com/theapache64/topcorn.git,"{""A minimalistic movie listing app to browse IMDB's top 250 movies, built to demonstrate MVVM with latest hot-trending Android development tools.""}","kotlin,coroutines,android-lifecycle,dagger2,retrofit,moshi,room-android,mvvm,android-jetpack-components,jaba,imdb,kotlin-flow",137
0,https://github.com/custom-cards/upcoming-media-card.git,"📺 A card to display upcoming episodes and movies from services like: Plex, Kodi, Radarr, Sonarr, and Trakt.",,135
0,https://github.com/appointmind/fakenames.git,"List of names from movies, tv shows and books to be used for testing during development of an application.",,134
0,https://github.com/blue-troy/91porn-crawler.git,"91 porn crawler. 自动爬取并下载你想要的91porn热门视频。Automatically download your ""favorite"" 91porn hot movies. ","porn,91porn,91,crawler,java",132
0,https://github.com/neo4j-examples/movies-javascript-bolt.git,Neo4j Movies Example with webpack-in-browser app using the neo4j-javascript-driver,"javascript,neo4j,graph,graph-database,bolt,cypher,movies-api",131
0,https://github.com/manikandanraji/spiderx-frontend.git,SpiderX allows you to watch movies by scraping data from the internet,,129
0,https://github.com/delight-im/MovieContentFilter.git,Watch movies with the freedom (not) to filter,"movies,tv,tv-shows,tv-series,filter,content,parental-control,ratings,movie-reviews,movie-ratings,youth-protection,movie,rating",127
0,https://github.com/hasura/gqless-movies-demo.git,A movies app using Hasura and gqless,"graphql,gqless,hasura",127
0,https://github.com/Kraymer/flinck.git,"Sort your movies on filesystem by dates, ratings, etc using symlinks.","movie,symlink,python",126
0,https://github.com/dmbaranov/evemovies-bot.git,"{""You won't miss your favorite movies anymore!""}",,122
0,https://github.com/learnbyexample/curated_resources.git,":books: Curated lists for programming, books, movies, music, games, etc","curated-lists,programming,books,tv-shows,movies,android,python,linux,vim,math,physics,perl,computer-science",120
0,https://github.com/PTCE-Public/popcorn-desktop.git,"Allow anyone to easily watch his favorite movies, shows, and anime. | This is a public mirror of the Popcon Time Community Edition repository. All pull requests are ignored. This repository may recieve forced updates.",,119
0,https://github.com/NabiKAZ/filimo-downloader.git,Download movies from filimo.com | لینک جایگزین جهت احتیاط: https://gitlab.com/NabiKAZ/filimo-downloader,"filimo,download,movies,ffmpeg,film,aparat,php",116
0,https://github.com/mynttt/UpdateTool.git,A tool to update the IMDB ratings for Plex libraries that contain movies/series and use the IMDB agent to receive ratings,"plex,plex-media-server,plex-server,plexmediaserver,plex-library,imdb,imdb-rating,java,plex-libraries",114
0,https://github.com/Ajatt-Tools/mpvacious.git,Adds mpv keybindings to create Anki cards from movies and TV shows.,"anki,mpv,subs2srs,language-learning,spaced-repetition,subtitles,flashcards,mpv-script,anki-cards,yomichan",110
0,https://github.com/Nitrino/easysubs.git,Browser extension for learning languages with watching movies and TV shows,"hacktoberfest,youtube,netflix,kinopub,learn-languages,browser-extension",109
0,https://github.com/gjtorikian/Shelves.git,"An Android application that manages your collection of apparel, board games, books, comics, gadgets, movies, music, software, tools, toys, and video games.","java,android",109
0,https://github.com/tugcanolgun/vigilio.git,"Your own movie streaming service. Easy to install, easy to use. Download, manage and watch your favorite movies conveniently from your browser or phone. Install it on your server, access it anywhere and enjoy.","streaming-service,streaming,streaming-server,movies",109
0,https://github.com/mayankchd/movie.git,A CLI for getting information about movies and comparing two movies,,104
0,https://github.com/manikandanraji/spiderx-native.git,SpiderX allows you to stream movies by scraping links available on the internet,,104
0,https://github.com/Go-phie/gophie.git,An Aggregator Engine for searching and downloading movies free - NO ADs!,"cli,download-movies,scraping-websites,web-api,no-ads,downloader,download-videos,free,movies,free-software,anime-downloader,movie-downloader,stream,movie-sites,gophie",103
0,https://github.com/DmitryMalkovich/popular-movies-app.git,"{""Popular Movies App is the second project in Udacity's Android Developer Nanodegree.""}",,101
0,https://github.com/jfainberg/self_dialogue_corpus.git,"The Self-dialogue Corpus - a collection of self-dialogues across music, movies and sports","corpora,nlp,dialogue",98
0,https://github.com/nervous-systems/ffmpeg-opengl.git,Filter for applying GLSL shaders to movies via ffmpeg,,97
0,https://github.com/fnk0/MoviesTMDB.git,Android TV tutorial of how to build a TMDB client to browse movies,,97
0,https://github.com/maxmahlke/SolarSystemOrbiter.git,Plot orbits of the planets. Calculate Hohmann Transfer Orbits between them and extract movies of the motions in the Solar System,,97
0,https://github.com/Yalir/sfeMovie.git,"{""sfeMovie is a simple C++ library that lets you play movies in SFML based applications. It relies on FFmpeg to read medias and remains consistent with SFML's naming conventions.""}",,95
0,https://github.com/tnychn/torrodle.git,"⚡️ A magnet link scraper for streaming videos (movies, tv shows, anime, porn) along with subtitles.","golang,cli,scraper,torrent,magnet,downloader,streaming,subtitles,movies,tv-shows,anime,porn,nsfw",94
0,https://github.com/kelciour/playphrase.git,Search and play phrases from movies and audiobooks,,91
0,https://github.com/NabiKAZ/namava-downloader.git,Download movies from `namava.ir` website. | لینک جایگزین جهت احتیاط: https://gitlab.com/NabiKAZ/namava-downloader,"namava,download,movie,ffmpeg,film,php",91
0,https://github.com/Lazhari/Movies-Finder.git,Movies finder is a small Angular 5 app https://movies-finder.firebaseapp.com/,"angular-cli,typescript,angular5",89
0,https://github.com/FlixtorMe/FlixtorMe.git,"Flixtor streams movies, series, videos and animes from Torrents.",,89
0,https://github.com/0zz4r/bashflix.git,Streaming of Movies and Series on Mac and Linux,"torrents,bash,streaming,movies,series,linux,macos",89
0,https://github.com/ZorrillosDev/watchit-desktop.git,Open movies,,88
0,https://github.com/OwenRay/Remote-MediaServer.git,"A NodeJS based media server: Manage, watch and share your movies and tv series.","mediaserver,nodejs,browser,chromecast,mediaplayer,movies,tv,p2p",87
0,https://github.com/JuliaImages/ImageView.jl.git,Interactive display of images and movies,,85
0,https://github.com/jbusecke/xmovie.git,A simple way of creating movies from xarray objects,"xarray,movie,plot,creating-movies",85
0,https://github.com/hitanshu-dhawan/PopCorn.git,:popcorn: Movies and TV Shows App powered by TMDb,"android,tmdb,tmdb-api,movies,tvshows",83
0,https://github.com/rdp/sensible-cinema.git,"Clean Editing Movie Player (sensible cinema/play it my way) allows you watch edited movies by applying delete lists (EDL\'s)  (i.e. ""mute out"" or ""cut out"" scenes) to DVD\'s/files, with preliminary support for also applying them to arbitrary web/internet based players like netflix instant, hulu/hulu plus etc. http://playitmyway.org",,83
0,https://github.com/gokselkoksal/Movies.git,Simple movies app for architectural experiments.,"mvvm,software-architecture,redux,unidirectional-data-flow,viper,ios,swift,macos",81
0,https://github.com/ivangfr/springboot-react-keycloak.git,The goal of this project is to secure movies-app using Keycloak(with PKCE). movies-app consists of two applications: one is a Spring Boot Rest API called movies-api and another is a ReactJS application called movies-ui.,"spring-boot,reactjs,keycloak,semantic-ui-react,pkce",79
0,https://github.com/gen2brain/bukanir.git,Bukanir streams movies and TV shows from bittorrent magnet links,,79
0,https://github.com/andrew-ld/smart-tv-telegram.git,stream movies from telegram to smart tv over http using upnp and dlna (and chromecast),"upnp,telegram,mtproto,streaming,http,python,asyncio,dlna,avtransport,chromecast,bot,docker,kodirpc,kodi",79
0,https://github.com/pjay79/MoviesApp.git,"React Native Movies App: AWS Amplify, AWS AppSync, AWS Cognito, GraphQL, DynamoDB","react-native,aws,appsync,aws-amplify-react-native,aws-appsync,graphql,dynamodb,subscriptions,offline-capable",79
0,https://github.com/samaronybarros/movies-app.git,Movies App,,78
0,https://github.com/dotnet-architecture/RecommendationEngine.git,Recommendation Engine using Azure ML Studio to recommend related movies. ,,76
0,https://github.com/Honlan/starwar-visualization.git,data analysis and visualization of  knowledge graph for star war movies,,76
0,https://github.com/aws-samples/aws-serverless-crud-sample.git,"An example implementation of a mobile backend for a movies database using AWS Lambda, API Gateway and DynamoDb",,76
0,https://github.com/rajandev17/Plasma.git,"An Android Application written using latest Android Jetpack components and best practices, which displays trending movies/TV shows and cast, user can search movies and TV shows and also add them to watchlist.","android,android-application,mvvm-architecture,jepackcompose,navigation,lazygrid,composeanimation,daggerhilt,hilt-android,jetpackdatastore,coroutines,coroutines-flow,multimodule,bottomnavigationview,declarative-ui,compose,password,sample,demo",76
0,https://github.com/jpillora/media-sort.git,Automatically organise your movies and tv series,,75
0,https://github.com/mislav/movieapp.git,"Mark movies you watched, liked, or plan to watch, and share with your friends.",,75
0,https://github.com/nst/ScreenTime.git,create movies from periodic screenshots,,74
0,https://github.com/Electronickss/TheaterTrailers.git,Watch the same trailers as the movie theater plays before their movies,,74
0,https://github.com/axtgr/Ultimate-Counter-Strike-Movie-Collection.git,"{""World's largest collection of Counter-Strike movies""}","counter-strike,movie,frag",73
0,https://github.com/gauravtheP/Netflix-Movie-Recommendation-System.git,A Machine Learning Case Study for Recommendation System of movies based on collaborative filtering and content based filtering.,,72
0,https://github.com/robinp7720/Oblecto.git,"Oblecto is a media server, which streams media you already own, and is designed to be at the heart of your entertainment experience. It runs on your home server to index and analyze your media such as Movies and TV Shows and presents them in an interface tailored for your media consupmtion needs.","media,mediacenter,mediaserver,rest-api,movie,tv-shows,storage,datahoarder,tracking,real-time,streaming-video,streaming,streaming-server,database,tvshows,hacktoberfest,self-hosted",72
0,https://github.com/dacort/mwhich.git,"Generic API to search for movies or TV shows across Netflix, Hulu, iTunes, and Amazon Video on Demand",,71
0,https://github.com/okode/movies-app.git,Ionic 4 Movies App,"ionic4,ios,android,app,angular6,cordova",70
0,https://github.com/naholyr/show-time.git,Watch TV shows and movies with a simple CLI,"showrss,opensubtitles,tv-shows,movies,torrent,popcorn-time,javascript,nodejs",70
0,https://github.com/Shashank02051997/MovieFinderUsingMVVM-Android.git,"🔥 MVVM + Clean Architecture + Best Practices | 🍿Movie Finder is a sample Android application 📱to search movies using OMDb API which is built to demonstrate use of Modern Android development tools - (Kotlin, Coroutines, Kodein, Architecture Components, MVVM, Retrofit, Gson, Material Components) 😊😊😉","kotlin,kotlin-android,mvvm,mvvm-architecture,livedata,livedata-databinding,coroutines-android,gson,retrofit2,material-design,android,android-app,gson-converter,gson-library,material-ui,viewmodel",69
0,https://github.com/codepath/android-rottentomatoes-demo.git,Android networking demo for displaying Box Office Movies using the RottenTomatoes API,,68
