,Url,Description,Topics,Stars
0,https://github.com/NikitashP/banking-application.git,Simple banking application to Open Bank account and process payments,,0
0,https://github.com/open-banking/products.git,Open Banking Products API built on top of light-4j,"light-4j,openapi3,open-banking,products",0
0,https://github.com/ianrobrien/valuta.git,Currency API implementation using DNB Open Banking Currencies API,,0
0,https://github.com/open-banking/beneficiaries.git,Open Banking Beneficiaries API built on top of light-4j,"open-banking,light-4j,beneficiaries",0
0,https://github.com/PauloRobert/openapp.git,"Web project, just for demonstrating the course work, has NOTHING to do with Open App or Open Banking","bootstrap,jquery,css,html,study-project",0
0,https://github.com/sebipap/openbank.git,"Home Banking app prototype with money transfer to friends or with QR code, currency exchange and more",,0
0,https://github.com/pingidentity/open-banking-sample-pisp-app.git,sample application to demonstrate a payment transaction that complies with the Open Banking security profile ,,0
0,https://github.com/akbertram/openbanking-nl.git,Small set of tools to enable Dutching banking clients to freely and programatically access their own data. ,,0
0,https://github.com/baroda/iPhone-BankBalance.git,Open source iPhone Banking Application for Irish Banks: AIB (Allied Irish Banks) and BOI (Bank of Ireland) online banking services.,,0
0,https://github.com/vishr99/Open_banking_hackathon_2018.git,Open banking hackathon (Using AI/ML to reduce risk and aid decision making in lending out loan to companies. ),,0
0,https://github.com/therealgaryj/open-banking-api-java.git,A full featured Java SDK for interacting with financial institutions (ASPSPs) who have implemented the Open Banking (UK) API specifications.,,0
0,https://github.com/hschaffner/solace_openshift_json_datagenerator.git,Openshift Data SImulator of JSON Messages simulating ATM and Online Banking Transactions via Solace Messaging using Spring,,0
0,https://github.com/parvez99/FacebookBotAndOpenbank.git,This is a demo facebook bot that pulls sample banking transactions from Openbank and displays in the facebook bot messanger,,0
0,https://github.com/SecureBankingAccessToolkit/securebanking-openbanking-uk-functional-tests.git,Software testing to validate and coverage the implemented open banking functionalities and ensure that these satisfies the functional requirements.,"testing,testing-framework,testsuite,tests,test,gradle,kotlin",0
0,https://github.com/nherac/TransactionDataApi.git,Following open project https://www.manning.com/liveproject/create-an-open-banking-app-using-openapis-and-spring-boot,,0
0,https://github.com/ricardoschullerSL/ricardo-bank-server.git,Home made implementation of the Open Banking UK APIs on Spring Boot. ,,0
0,https://github.com/fuaad001/bank-account.git,A banking app that enables user to make deposits and withdrawals. To open live site click:,,0
0,https://github.com/gdaver/VaR.git,Banking and Finance. VaR. Value at Risk. Excel. VBA. Visual Basic Applications. Open Project.,,0
0,https://github.com/open-banking/standingOrders.git,Open Banking Standing Orders API built on top of light-4j,"openapi3,open-banking,light-4j,standing-orders",0
0,https://github.com/open-banking/directDebits.git,Open Banking Direct Debits API built on top of light-4j,"openapi3,open-banking,light-4j,direct-debits",0
0,https://github.com/Jyotiraditya-kumar/Banking-Application-Python-GUI-Tkinter.git,"Perform Basic Banking Operations like Open New Account,Deposit,Withdrawal,Statement etc.",,0
0,https://github.com/angelbelando/MyCBP.git,"{""Création Projet Open Source de Core Banking System : Mon retour d'expérience""}",,0
0,https://github.com/zhoucyster/simple-banking-system.git,"simple banking system, come and try to open an account here.",,0
0,https://github.com/Code-ax/Banking-Management-System.git,we are making an open source project named as Banking Management System using C++ Language.,,0
0,https://github.com/seher100/allied.git,Seher will open her allied bank personal account and get digital banking,,0
0,https://github.com/sparkassen-hub/ahoi-swagger-fetchclient.git,API client automatically generated with Swagger for the AHOI Open Banking API,"openbanking,openbanking-sdk",0
0,https://github.com/openbanking-simulator/ob_api_interface.git,Open Banking API Interfaces generated on top of ACCC Data61 Specs v1.5.0,,0
0,https://github.com/furstenberg/bank.git,"{""Faster and minimal bank frontend using Sbanken's Open Banking API""}",,0
0,https://github.com/open-banking/scheduledPayments.git,Open Banking Scheduled Payment API built on top of light-4j,"openapi3,open-banking,light-4j,scheduled-payments",0
0,https://github.com/niho/psd2.git,An OTP library implementing PSD2 Open Banking APIs for some major banks.,,0
0,https://github.com/00benallen/BPBankAPI.git,"Backend system for BP bank, and open source simple Online Banking application, for fun!",,0
0,https://github.com/fschutte/obsandboxplayground.git,Spring Boot application for accessing the UK Open Banking Sandbox Directory,"openbanking,spring-boot-application,kotlin",0
0,https://github.com/matheussousaf/bussola-financeira.git,A project based on open-banking technology to make your economy look easy.,,0
0,https://github.com/freamon/truelayer-scripts.git,Scripts to use with API at TrueLayer.com (open banking provider) ,,0
0,https://github.com/foresthpark/atb_hackathon2020.git,Expense tracking app that won Grand Prize at the 2020 ATB Open Banking Hackathon,,0
0,https://github.com/thomas-armena/cibc-hackathon-finstagram.git,Prototype of mainstream financial aid app which leverages open banking API ,,0
0,https://github.com/yogimeizalputra/Easybank.git,EASYBANK is leverage Open Banking to turn your bank account into your financial hub,,0
0,https://github.com/LukeCruz/App-CashMoney.git,A aplicação desenvolvida com visão no open banking que une soluções para cashback,,0
0,https://github.com/n9d02016/CMAOpenBankingReferenceData.git,This repository contains the daily snapshot of CMA Open Banking Reference data.,,0
0,https://github.com/av1611/swbank.git,A new R CRAN package to handle Open Banking Swedbank facilities,,0
0,https://github.com/open-banking/react-client.git,A react single page application as consumer for open banking services,,0
0,https://github.com/myquartz/bank-integration-stuff.git,Integration stuff for Banking/E-commerce Open API Connect and Interoperating,,0
0,https://github.com/bizaio/deepthought.git,"The Deep Thought project is intended to be a reference Data Holder for the Australian Consumer Data Right (aka ""open banking""). It is currently being developed by Biza.io as part of it\'s DataRight Lab initiative.","australian-consumer-data,deepthought,amazon-ami,cdr,open-banking,australian-consumer-data-right",0
0,https://github.com/eric-erki/OBP-API.git,"An open source RESTful API platform for banks that supports Open Banking, XS2A and PSD2 through access to accounts, transactions, counterparties, payments, entitlements and metadata - plus a host of internal banking and management APIs.",,0
0,https://github.com/mintlyfresh/mintly-project.git,"An open-source project for creating a free-to-use banking service that is simple, social, and secure. ",,0
0,https://github.com/nathanbcrocker/better-banking-public.git,Public resources for https://www.manning.com/liveproject/create-an-open-banking-app-using-openapis-and-spring-boot,,0
0,https://github.com/Rohanfizz/PY-Bank.git,"Banking service which can open new accounts, deposit,withdraw and check balance.Includes errors and exceptions handling,",,0
0,https://github.com/zxiao013/Banking_Management_System.git,"A simplified banking management system using Java with such features as open and close account, withdraw and deposit money, etc",,0
0,https://github.com/gbonjubee/voicehack.git,Voicehack is a voice banking API built on open source voice api and deployed on IBM bluemix ,,0
0,https://github.com/Vitorhpx/wallet.git,"{""All in one wallet for BTG Code competition based on the use of Open Banking API's""}",,0
0,https://github.com/element36-io/cash36-frontend.git,"React frontend for cash36.io,  a system to create public and private ERC20 stablecoins based on open banking standards .",,0
0,https://github.com/reisricardo/technee-safra.git,O Acesso a plataforma é feito pelo link: http://127.0.0.1:8000/open-banking/v1/pages/login,,0
0,https://github.com/esuomi/channels-test.git,Clojure core.async test with the idea that I might use this for Nordea Open Banking API.,,0
0,https://github.com/sanchibansal340/cheqeasy-amex-hackathon.git,Built an app to make cheque payment easy & online using Open Banking as part of the Amex Hackathon,"react-native,firebase",0
0,https://github.com/SourcePrimer/FinnickCore.git,"Open Source fully customizable, Core banking system. From ATM software, to loans, and Checking and Savings account. Start your own bank with an open source system",,0
0,https://github.com/phthom/OpenShift-Overview.git,"OpenShift Container Platform is a platform for developing and running containerized applications. It is designed to allow applications and the data centers that support them to expand from just a few machines and applications to thousands of machines that serve millions of clients.  With its foundation in Kubernetes, OpenShift Container Platform incorporates the same technology that serves as the engine for massive telecommunications, streaming video, gaming, banking, and other applications. Its implementation in open Red Hat technologies lets you extend your containerized applications beyond a single cloud to on-premise and multi-cloud environments.",,0
0,https://github.com/phantom820/Easy-Banking.git,"A dummy mobile banking application that aims to provide users with an easy,reliable and convenient banking experience. Users open their preferred account type upon registration and synthetic transactions are generated along with other user account details.",,0
0,https://github.com/jfrank1120/Banking_Website.git,"A fully functioning Banking web interface that allows for users to create an account, open different types of banking accounts, and view their accounts. Includes database integration using Oracle Database systems.",,0
0,https://github.com/ZachThomasAU/JENNY.git,The Java Excel baNking Network thingY (or JENNY for short) is an open source tool to edit spreadsheets and automate daily cashier banking workflows for the University of Queensland Union.,,0
0,https://github.com/bradlead/digital-reward-frontend.git,"Using React, Node.Js and Sass to create a customer loyalty app for small business to offer their customers. Authentication using Monzo Open Banking API",,0
0,https://github.com/EQQU1NOX/AutomatedBanker.git,"Java program that automates the personal banking role. The system will be able to take teller transactions, open accounts, and gather info. ",,0
0,https://github.com/Rutujajagtap10/Java-Project.git,"This project  is based on banking applications like Open Account, Deposit Money, Balance Enquiry , Withdraw Money, Account Details using sign up sign in method.",,0
0,https://github.com/dmnd/nabtab.git,💰 A Chrome extension to force nab.com.au internet banking to open in a new tab instead of an annoying new window,,0
0,https://github.com/priyanshu1803/-Banking-system-with-database.git,"Made a banking system where user can open account,deposit,withdraw,check balance and close account.I used SQL for database",,0
0,https://github.com/mayankvaid88/EBS.git,"EBS is an E-Banking system project which tries to facilities like Open Account, Fund Transfer, RD/FD, Pay bills and many more",,0
0,https://github.com/Ranjit-Code/bankify.git,"Online banking application, in which user can open multiple accounts, deposit money, withdraw money, transfer money within the same user or inter user transfer.",,0
0,https://github.com/OBA-Amigu/amigu.git,OBA - Open Banking Amigu. A solução diferenciada que permite emprestar e pedir dinheiro emprestado com boas taxas baseadas no seu comportamento!  ,,0
0,https://github.com/PloRad/BankingApp.git,"A simple, Java based banking application. The user can open debit/credit accounts, fill the accounts and transfer money from one account to another.  ---(work in progress)",,0
0,https://github.com/joanamaciel/desafio-stone-regulatory-ops.git,"Desafio proposto pela Stone a respeito do cumprimento das exigências da LGPD no contexto de Open Banking, bem como apresentação de soluções a partir do conceito de RegTech",,0
0,https://github.com/CarlosOrtegaGonzalez/ob-consent-manager.git,This is a project aimed at learning Java. It implements a service that can be used to simulate how consents can be manipulated in an Open Banking environment.,,0
0,https://github.com/Jaddm2/blog-bfsi-jobs-in-india-latest-job-opening-job-search-online.git,"Many people wish to get jobs in the BFSI sector. Like them, are you willing to grab the opportunities in India’s Banking, Financial Services and Insurance? If you say yes, then we are here to help you get BFSI jobs in India. BFSI has created multiple job opportunities in the current time. And it is expected to grow more. People who want to get hired by BFSI Organizations would be liable to hold the desirable skills. This specific sector demands experts for the entire management of the system. Thus, as a recognized banking and finance recruitment staffing firms. We are involved in helping BFSI job aspirants to achieve their expectations. ",,0
0,https://github.com/sanoits/Job-openings.git,"Dear All, Greetings From SANOITS Pvt Ltd one of our reputed clients looking for below requirements:- 1.\tUI Developers 3–7 years of experience.  2.\t TechSupport (0-5Years of Experience)(Voice Process) 3.\t TechSupport (0-3 Years Experience) (Non-Voice-Chat Process) 4.\t PHP, Work experience on E-Commerce portals. 5.\tJava, Work experience on (Core java, EXTJS, struts, J2ee, spring, Hibernate). 6.\tJava Backend and Frontend Developers   i)  Work experience on Java Backend Development                Skills Like (J2EE Development, Spring/ATG, SQL, Web services).            ii) Work experience on Java Front End Development                                      Skills (JavaScript, Jquery, HTML5, &CSS3, AJAX, Angular JS, JS) 7.\tUS IT recruiter’s, HR IT recruiter’s. 8.\tJava Developer - 3-4 Years’ experience, Hyderabad Location, Immediate Hiring  Job Description •\t3 -5 experience in core Java development.  •\tIntegration Technologies: ESB, Apache Camel, CXF, KARAF and web services REST/SOAP, CORBA, Apache Active MQ •\tExperience constitutes architecture definition, architecture assessment, performance assessments, capacity planning, and application/server tuning •\tMust have extensively worked in Apache Tomcat/ Jboss Application server .  •\tExcellent Knowledge on Spring & Hibernate.  •\tMust have extensively worked on OOPS Concepts.  •\tProduct life cycle development & Good architecture/design knowledge.  •\tTools: Eclipse, ANT, Maven, Quest TOAD, XMLSpy, Putty, JIRA, Subversion  9.\tJava Tech Lead, Java Developer, Senior Java Developer 5 - 8 yrs  Hyderabad / Secunderabad Job Description •\tPassion for building scalable, global, complex enterprise systems for Banking FINANCE  to solve problems with proven ability to deliver high quality software •\tSolid understanding of Object-Oriented design and concepts. •\tExpert knowledge of Java/j2ee is a must. •\tInnovative and creative with Web technologies to build high performing web applications •\tDemonstrated proficiency with AJAX,  Javascript, JDBC, Servlet, Jsp, Ejb, CSS is a plus •\tSelf-directed and capable of working effectively in a highly innovative and fast-paced environment •\tBE/ B.Tech or MS or in a relevant Engineering discipline. •\t5+ years of industry experience  Upload your profiles to http://www.end2search.com/uploadresume.aspx  and activate the account it mandatory and share your profile to hr@sanoits.com  CONTACT DETAILS: 302, KTC ILLUMINATION TOWERS Opposite westin, Raheja Mindspace, Madhapur, Hyderabad – 500081 Phone: - 040-32933445, 9985403555",,0
0,https://github.com/IdeaFactoryLabs/NeuralBanking.git,"This python module describes the basic core of neural banking. The implementation of linking the banking APIS applied to neural. Banking hasn’t being so easier it just takes one thought to accomplished the intention and hint for the the transaction to be done. The Implementation of Neural Banking Zones or register safe zones to bank. Bank frot he comfort of your home or by approaching a safe banking zone. Bank as you go. Broker accounts, saving account global, money market accounts This document  is intended contains the project description of a for profit project.  All the information contained in this documents are proprietary of the company. The copyrights and patents to the documents are reserved. A. The project abides by the current  policy in regulations by the Federal Government of The United States of America. This writ safeguards the intellectual property globally as per international agreement on International Court of Law Netherlands La Hague.  All the ideas in this document are reserved to the author Guillermo Antonio Herrera Argueta.. Algie Bookshelves. This includes the patents pending of the development of software, the designing of process, protocols and the implementation of hardware. U.S.C Title 17 and Intellectual property Rights. Designed in Upland, California USA. Any attempt or theft of this ideas will results in the prosecution of the violators under Federal Law, holding monetarily liable any person that steals, copies, or trolls this patents pertaining to the company Idea Factory Labs Limited. We reserved the rights of use and the patents for the process of development of implementation of each idea into the market. It is a Federal Crime to embezzle intellectual property. We will prosecute and not hesitate to ignite legal action. The Intellectual property is for every government that is open to do business with the research firm. Every law disregard the jurisdiction and or territorial extension will be applied. International Policy and Treaties safeguard the position of the firm developing protocols for the Banking system. For every Financial institution and or governmental agency interested in conducting business with the firm may obtain a business plan with pricing about buying the intellectual property and patent for the process from the research firm.  We reserve the intellectual property globally. This includes the legal strategies of bridging causes against agencies, countries and other financial institutions. The Embezzlement of such will result in Criminal Prosecution for Theft of Trade Secrets. § 499 CA PEN Code. Table of Authorities that safeguard the intellectual property for the company.",,0
0,https://github.com/alfaisalsakib/Bank-Management-using-java.git,"Fully bank management system. the client can open account, deposit or withdraw money, can request for loan. the bank officers can perform the banking activity using the same software. for officers and client there are separate login , valid authentication process",,0
0,https://github.com/p-cherukuri/mt-mp-bank.git,"A Unix online banking system with a multithreaded client and multiprocessing server. When a session is opened, the client can check account balance, make deposits and withdrawals. Built with C.",,0
0,https://github.com/tenny7/bankingApplication.git,"Java Banking Application that can read data from a csv file and open customer accounts, autogenerating unique safety deposit box IDs and Pins, account numbers and Pin, Checking account and Pin. It has features like withdrawal, transfer, deposit, check balance ",,0
0,https://github.com/prats37/DemoBankApplication.git,"{""This is a basic banking application which enables bank to open an single/joint account for it's customer. Customer can transfer funds to another account and edit their personal details.""}",,0
0,https://github.com/CarlosOrtegaGonzalez/ob-shared.git,"This is a project aimed at learning Java. It stores classes that can be shared with other projects related to Open Banking, like ob-consent-manager and ob-accounts-api.",,0
0,https://github.com/eviehwy/RCBS.git,"A small-scale banking system created for tellers to open a deposit account and issue an ATM card to customers, and for customers to activate and enquire available balance in his/her ATM card.",,0
0,https://github.com/avaiil001/Saving-account-solution-Avaiil.git,"Open a business bank account, find credit cards, apply for a loan, and discover cash Explore small business banking solutions plus investment options get all these things from Avaiil",,0
0,https://github.com/APIHub-CdC/subscriptions-simulation-client-python.git,This API lets you manage the subscriptions to API Hub asynchronous events. It enables you to receive notifications (asynchronous events) from Círculo de Crédito next-generation products (Open Banking & Data Aggregation).,,0
0,https://github.com/sartajhs/1-C--Project-Banking-System-.git,"This Banking System Project is completed in C++ language. It mainly provides the features to users like open new account, deposit and withdraw amount, etc. There is used of concept of class , data hiding, file handling , abstraction and many more.",,0
0,https://github.com/APIHub-CdC/subscriptions-simulation-client-php.git,This API lets you manage the subscriptions to API Hub asynchronous events. It enables you to receive notifications (asynchronous events) from Círculo de Crédito next-generation products (Open Banking & Data Aggregation).,,0
0,https://github.com/APIHub-CdC/subscriptions-client-java.git,This API lets you manage the subscriptions to API Hub asynchronous events. It enables you to receive notifications (asynchronous events) from Círculo de Crédito next-generation products (Open Banking &amp; Data Aggregation).,,0
0,https://github.com/anoopks2309/Online-Banking-System.git,"USING WEB TECHNOLOGIES (HTML , PHP ) AND DATABASE (MYSQL) , DESIGNING A ONLINE BANKING SYSTEM WHERE ONE CAN OPEN ACCOUNTS , DO TRANSACTIONS AND THEIR DATA IS BEING SAVED IN A DATABASE WHICH CAN BE RETRIEVED .",,0
0,https://github.com/AbdelrahmanNawar/Bank-Simulation-CPP.git,This application is simulation for banking system. you enter all clients by all clients would be added to linked list then sorted by their entering time. the Bank opens and starts the simulation by the following steps.,,0
0,https://github.com/APIHub-CdC/subscriptions-simulation-client-java.git,This API lets you manage the subscriptions to API Hub asynchronous events. It enables you to receive notifications (asynchronous events) from Círculo de Crédito next-generation products (Open Banking & Data Aggregation).,,0
0,https://github.com/CarlosOrtegaGonzalez/ob-accounts-api.git,This is a project aimed at learning Java. It contains a microservice that implements part of the Accounts and Transactions API from Open Banking. It requires projects ob-shared and ob-consent-manager.,,0
0,https://github.com/ammirante/TCC.git,"TCC gradução em Ciência da Computação pelo Centro Universitário IESB. Título: Estudo sobre o cenário, tecnologias, oportunidades e desafios do Open Banking e a transformação digital causada por esse modelo de negócio no setor financeiro brasileiro.","banking-applications,api,rest-api,graphql,java,angular,angular8",0
0,https://github.com/nitishpotdar/Distributed-Banking-Application.git,"The objective of the program is to design and develop 3 tier interactive TCP/IP client – server banking application using Socket API.   The Distributed Banking Application can be useful to record the transactions made by the customers, help the customers pay the utility bill online, or help the tellers to open new bank accounts and it will be helpful for the system administrators to authorize/verify the identity of the customers. ",,0
0,https://github.com/afrifin/afrifin.git,"<helloworld> Welcome to AFRIFIN (https://afrifin.co/), an open source project to develop a mobile client for banking, brokerage, investment, insurance, and many other applications. The primary focus is to create a viable platform to use on multiple mobile devices targeting a seamless customer experience for the developing world, emphasising on North, Central, and Sub-Saharan Africa.",,0
0,https://github.com/Srijoy-Chaki/BankManagementSystem.git,"This code is about bank management system. A user can enter number of accounts he/she wants to open, deposit money, withdraw money, view the account details. He/she can access these information using his/her account number which will be asked in the beginning of the program. The program is having many functions to deal with the various aspects of the banking system.    ",,0
0,https://github.com/Malakhye-Shine/Javafinalproject.git,"Final project for my Java II college course. Object Oriented program that opens and reads a text file with banking information, as well as changes the balance of the accounts that were created to then print all accounts out in a nice format.",,0
0,https://github.com/siddismaeel/bankingSystem.git,"This is a java project on banking system, where one can open a new account, can make a transactions like deposit or withdraw, and also can view transaction details. Java mail api, itext api for pdf generation has been used in this project.",,0
0,https://github.com/samarth70/Analysis-of-Portugese-banking-dataset.git,"Analysed portugese banking dataset with exploratory and predictive analysis.Learned by attending IBM masterclass ,how to use AIX360 & Lale. The AI Explainability 360 toolkit is an open-source library that supports interpretability and explainability of datasets and machine learning models.Lale is a Python library for semi-automated data science. Lale makes it easy to automatically select algorithms and tune hyperparameters of pipelines.",,0
