,Url,Description,Topics,Stars
824,https://github.com/blockmason/credit-protocol.git,Smart Contracts for Credit Protocol (CP),,27
825,https://github.com/CosmWasm/cosmwasm-template.git,Quickstart template to get started writing your own cosmwasm contracts,,27
826,https://github.com/austintgriffith/native-meta-transactions.git,integrate signed message recovery directly in your contracts,,27
827,https://github.com/bichenkk/solidity-cryptozombies.git,Learning smart contract game writing,,27
828,https://github.com/robsecord/ChargedParticlesEth.git,Token Contracts for Ethereum Charged Particles (Interest bearing NFTs),,27
829,https://github.com/yuntai/schnorr-examples.git,"Schnorr related examples (Schnorr, BN, MuSig, discreet log contracts)","blockchain,bitcoin,segwit,schnorr,musig,discrete-log-contracts,hd-wallet,bip32",27
830,https://github.com/nevillegrech/gigahorse-toolchain.git,A binary lifter and analysis framework for Ethereum smart contracts,"decompiler,security-tools,ethereum,blockchain-technology,framework",27
831,https://github.com/slim12kg/tokenzendr-contract.git,Smart Contract For TokenZendR (Simple Way To Transfer ERC20 Tokens),,27
832,https://github.com/levelkdev/registry-builder.git,Open source library for registry smart contracts,,27
833,https://github.com/device42/warranty_check.git,"Automatically pull warranty data from various vendors like Dell, IBM etc and populate purchase/contracts in Device42","sysadmin,inventory",27
834,https://github.com/deanpress/neosense.git,"{""NEO License dApp Smart Contract built with Python (neo-boa), used as example contract in Dean's NEO Development Workshops.""}",,27
835,https://github.com/Tectract/EthDeployer.git,A simple react app for automatically compililng & deploying Solidity language Ethereum smart-contracts,,27
836,https://github.com/nimiq/nimiq-exchange-token.git,Ethereum smart contract for the Nimiq Token Sale,,27
837,https://github.com/PumpkingWok/CTFGym.git,List of CTF related to Ethereum world (solidity smart contracts) ,"solidity,ctf-challenges,ethereum,blockchain,smart-contracts",27
838,https://github.com/gustavoguimaraes/honeyPotReentranceAttack.git,Example of vulnerable contract and an attack contract that would drain all money from it,,27
839,https://github.com/thanhson1085/convert-contract-abi-online.git,Convert Ethereum Contract ABI Online,,27
840,https://github.com/gustavoguimaraes/smart-contract-testing-javascript-example-.git,Example Code to Test Smart Contract With JavaScript,,27
841,https://github.com/hyeonleee/Smart_Contract_Security_Analysis.git,Papers of smart contract security analysis (and tools),,27
842,https://github.com/WeBankFinTech/WeIdentity-Contract.git,"The solidity smart contract of WeIdentity, including DID, CPT, Authority and Specific Issuers.","weidentity,weid",27
843,https://github.com/near/near-evm.git,Obsolete EVM contract experiments. Find current development at: https://github.com/aurora-is-near/aurora-engine,,27
844,https://github.com/xGodMode/godmode.git,Use GodMode to get full control of any Ethereum contract or account,"godmode,ethereum,smart-contracts,truffle",27
845,https://github.com/RUB-SysSec/EthBMC.git,"The code repository for the 2020 Usenix Security paper ""EthBMC: A Bounded Model Checker for Smart Contracts""",,27
846,https://github.com/bcnmy/mexa.git,"{""Repository contains smart contracts for biconomy's Mexa platform to implement meta transactions and allow dapp users to perform blockchain operations without holding any ether or other crypto currency.""}",,27
847,https://github.com/phodal/mest.git,契约测试框架。A TypeScript  Contract Test for Interface base project.,"e2e-tests,e2e-testing,contract-testing,contracts-programming,testing,test,testing-tools",27
848,https://github.com/AHRQ-CDS/AHRQ-CDS-Connect-Authoring-Tool.git,"{""The CDS Authoring Tool is part of the CDS Connect project https://cds.ahrq.gov/, sponsored by the Agency for Healthcare Research and Quality (AHRQ), and developed under contract with AHRQ by MITRE's CAMH FFRDC.""}","cds,clinical-quality-language,clinical-decision-support,opioid-cds,fhir,cql,smart-on-fhir,cds-hooks",27
849,https://github.com/smarie/python-autoclass.git,"A python 3 library providing functions and decorators to automatically generate class code, such as constructor body or properties getters/setters along with optional support of validation contracts on the generated setters. Its objective is to reduce the amount of copy/paste code in your classes - and hence to help reducing human mistakes :).","code-generator,constructor,autoargs,autoprops,contracts,enforce,boilerplate,pep484,type-hints,runtime-typechecking,typechecking,auto,fields,attr,attribute,class,getter,setter,property,properties",27
850,https://github.com/ConsenSys/permissioning-smart-contracts.git,Smart contracts for the Besu permissioning system,,26
851,https://github.com/algorand/smart-contracts.git,Example stateful and stateless smart contracts.,,26
852,https://github.com/BlocklancerOrg/Blocklancer-Contracts.git,Contracts for the Blocklancer Platform,"blockchain,ethereum-contract,ethereum,smart-contracts",26
853,https://github.com/bitcoin-computer/computer.git,Smart Contracts on Bitcoin,,26
854,https://github.com/thekosmix/Java-FbChatBot.git,"Messenger webhook implementation in java with jetty, contracts of facebook messenger webhook","webhook,messenger,java,fb-messenger-webhook,java-fbchatbot,jetty-server,chatbot",26
855,https://github.com/ava-labs/avalanche-smart-contract-quickstart.git,The easiest way to build smart contracts on Avalanche.,,26
856,https://github.com/JoinColony/colonySale.git,Colony Token and Crowdsale Contracts,"ethereum,solidity,smart-contracts,blockchain,token",26
857,https://github.com/tronprotocol/tron-studio.git,DEPRECATED. Use TronBox for smart contract deployment.,,26
858,https://github.com/znsio/specmatic.git,Turn your contracts into executable specifications. Contract Driven Development - Collaboratively Design & Independently Deploy MicroServices & MicroFrontends.,"contract-testing,microservices,contract-driven-development,cdd,specmatic,qontract",26
859,https://github.com/VeraBE/VeriMan.git,Analysis tool for Solidity smart contracts. Prototype.,"ethereum,solidity,ltl,blockchain,testing,temporal-properties,runtime-verification,monitoring",26
860,https://github.com/nexusdev/elastic-ethereum.git,Indexes Ethereum contracts with Elasticsearch,,26
861,https://github.com/turboprep/geth-tutorial.git,Helper scripts for learning Ethereum mining and smart contracts. Uses the Geth CLI client,,26
862,https://github.com/nimiq/hub.git,"The Nimiq Hub provides a unified interface for all Nimiq accounts, addresses, and contracts.",,26
863,https://github.com/exyte/gaster.git,Ethereum transactions stats for your smart contracts,"ethereum,nodejs,datascience",26
864,https://github.com/IBM/SmartContractTrading-wFabric1-4-VSCodeExt.git,Learn now to create a smart contract with VSCode,"blockchain,hyperledger,smart-contracts,vscode-extension,fabric,developer",26
865,https://github.com/ontio/ontology-oracle.git,The Oracle node and Oracle contract,"ontology,oracle,blockchain",26
866,https://github.com/epfl-lara/smart.git,Verification and Generation of Smart Contracts using Stainless and Scala,"smart-contracts,scala,stainless,verification",26
867,https://github.com/jbaylina/ERC820.git,EIP 820 - Pseudo-introspaection using a registry contract,,26
868,https://github.com/cryptofinlabs/bskt.git,A smart contract for creating decentralized token portfolios,,26
869,https://github.com/patractlabs/redspot.git,"{""Redspot is an Substrate pallet-contracts (ink!) development environment. Compile your contracts and run them on a different networks. Redspot's core forks from Hardhat but changed a lot to suit substrate.""}",,26
870,https://github.com/maxwoe/solidity_patterns.git,Smart Contracts Design Patterns in the Ethereum Ecosystem and Solidity Code,"solidity,solidity-contracts,solidity-patterns,patterns",26
871,https://github.com/spadebuilders/awesome-vyper.git,"An Awesome List: curated resources for Vyper, the Pythonic smart contract language for the EVM","ethereum,evm,smartcontracts,vyper,awesome-list",26
872,https://github.com/thauska/desafio-tecban.git,"Hackathon TecBan 2020 - BICOS, an React-Native app for connection and contracting service provision. BICOS was born to democratize access to Open Banking to those who were previously invisible.","hackathon,shawee,tecban,openbanking,hackathon-project,react-native-app",26
873,https://github.com/DigixGlobal/dao-contracts.git,DigixDAO 1.0 contracts,"ethereum,dao,governance,blockchain,digixdao",25
874,https://github.com/oceanprotocol/contracts.git,🐙 Smart contracts for Ocean Protocol v3,"solidity,smart-contracts,datatoken,oceanprotocol,defi",25
875,https://github.com/OpiumProtocol/opium-contracts.git,Smart contracts of Opium Protocol,,25
876,https://github.com/findmypast-oss/jackal.git,Consumer Driven Contracts Microservice,"consumer-driven-contracts,consumer,contracts,consumer-contracts,joi,docker",25
877,https://github.com/paritytech/pallet-contracts-waterfall.git,"Collection of simple Substrate smart contract examples written in Rust,  AssemblyScript, Solang and the smart contract language ink! to test substrates pallet-contracts module","substrate,smart-contracts,rust,polkadot-js,assemblyscript,solang,ink",25
878,https://github.com/trufflesuite/truffle-contract-schema.git,JSON schema for contract artifacts,,25
879,https://github.com/Zoltu/deterministic-deployment-proxy.git,An Ethereum proxy contract that can be used for deploying contracts to a deterministic address on any chain.,,25
880,https://github.com/Arianee/ArianeeMaster.git,Smart contracts & tools for Arianee Protocol,"solidity-contracts,dapp,protocol,opensource",25
881,https://github.com/marcingrzejszczak/sc-contract-car-rental.git,Sample setup used for the Why Contract Tests Matter? presentation,,25
882,https://github.com/androlo/EthereumContracts.git,Contracts written in LLL for Ethereum.,,25
883,https://github.com/eth-sri/zkay.git,A programming language and compiler which enable automatic compilation of intuitive data privacy specifications to NIZK-enabled private smart contracts.,"blockchain,privacy,ethereum,zero-knowledge-proofs,compiler,programming-language",25
884,https://github.com/uzyn/web3-loader.git,Ethereum web3.js module for Webpack. Deploys and returns instantiated contract.,,25
885,https://github.com/bloq/ora.git,Bloq Ora multi-blockchain smart contract compute oracle and validation engine,"bitcoin,ethereum,eosio,smart-contracts,moxie,moxie-architecture,ora",25
886,https://github.com/matter-labs-archive/PlasmaContract.git,More Viable Plasma (MoreVP) contract with Limbo Exits ,"transaction,plasma-operator,sign-transactions,plasma,ethereum,smart-contracts",25
887,https://github.com/sfcgeorge/yard-contracts.git,YARD Plugin for Automatic Param Docs from Contracts.,,25
888,https://github.com/smartzplatform/constructor-eth-merkle-airdrop.git,"Smart-contract and constructor on Smartz platform, allowng to perform very cheap and simple token airdrop to millions on addresses with easy interface",,25
889,https://github.com/psellcam/Superpixel-Contracted-Graph-Based-Learning-for-Hyperspectral-Image-Classification.git,"Code for the Paper ""Superpixel Contracted Graph-Based Learning for Hyperspectral Image Classification""",,25
890,https://github.com/allenheltondev/postman-contract-test-generator.git,"Postman collection and environment that will take an Open API Spec, validate component adherence, generate contract tests, and execute them.","oas,postman,schema-test",25
891,https://github.com/tonlabs/ton-dev-cli.git,"Tondev CLI is the  core SDK tool designed to facilitate the component installation, usage and update processes. In particular, it allows compiling smart contracts in Solidity and running them in the local node or TON testnet.","sdk,ton,blockchain,solidity,tondev-cli,tonos,nodese,tonosse",25
