,Url,Description,Topics,Stars
189,https://github.com/Axentro/Axentro.git,To be the go to platform for building dApps quickly and cheaply for business and gaming,"blockchain,crystal,bitcoin,dapps,axentro",183
190,https://github.com/inshopgroup/inshop-crm-api.git,"{""Inshop CRM / ERP API. It's powerful framework allows to build systems for business with different workflows. It has on board multi language support, clients management, projects & tasks, documents, simple accounting, inventory management, orders & invoice management, possibilities to integrate with third party software, REST API, and many other features.""}","symfony,api-platform,erp,crm,php,elasticsearch,postgresql",183
191,https://github.com/mokuappio/serverless-invoices.git,Create and manage invoices in your browser. Serverless Invoices is a free invoicing tool for freelancers and small businesses. Made with Vue.js.,"serverless-invoices,moku,invocing,invoice-generator,invoice-maker,invoicing-software,vue",182
192,https://github.com/maticnetwork/contracts.git,Smart contracts comprising the business logic of the Matic Network,"ethereum,blockchain,decentralised-exchange,payment,cryptocurrencies,dapps,scalability",181
193,https://github.com/doublesecretagency/craft-businesslogic.git,Business Logic module template for Craft CMS,"craft,php,craft3,craft-module",181
194,https://github.com/testingisdocumenting/webtau.git,"Webtau (short for web test automation) is a testing API, command line tool and a framework to write unit, integration and end-to-end tests. Test across REST-API, Graph QL, Browser, Database, CLI and Business Logic with consistent set of matchers and concepts. REPL mode speeds-up tests development. Rich reporting cuts down investigation time.","testing,test-framework,rest-api,selenium,groovy,report,rest,graphql,database,cli,junit5,java,http,jvm",181
195,https://github.com/wxbug-cn/ticket.git,"手机网页浏览器跳转到微信内置浏览器翻开指定网页,微信跳转链接,微信一键重视,网页跳转到微信,浏览器跳转微信链接,微信跳转源码,微信跳转,微信跳转ticket,ticket,weixin://dl/business/? ticket=,跳转到微信,翻开微信,微信内部,跳转微信,第三方浏览器跳转微信，域名跳转系统，微信跳转技术",,180
196,https://github.com/nickmpaz/tiny-tetris.git,"A Python Tetris implementation that ""fits on a business card"" (20 lines x 80 characters)",,178
197,https://github.com/microsoft/BCTech.git,Business Central technology samples,,174
198,https://github.com/byukan/Marketing-Data-Science.git,"Analytics and data science business case studies to identify opportunities and inform decisions about products and features.  Topics include Markov chains, A/B testing, customer segmentation, and machine learning models (logistic regression, support vector machines, and quadratic discriminant analysis).",,174
199,https://github.com/securityfirst/Umbrella_android.git,"Open source Android, iOS and Web app for learning about and managing digital and physical security. From how to send a secure message to dealing with a kidnap. Umbrella has best practice guides in over 40 topics in multiple languages. Used daily by people working in high risk countries - journalists, activists, diplomats, business travelers etc.","opensource,security,risk,human-rights-defenders,activism,infosec,journalism,hacking,lessons,travel,advice,encryption,umbrella,snowden,crypto,protest",174
200,https://github.com/JonPSmith/EfCore.GenericBizRunner.git,Library to run business logic when using Entity Framework Core for database accesses,,173
201,https://github.com/kylekatarnls/business-day.git,Carbon mixin to handle business days,,172
202,https://github.com/zerostaticthemes/hugo-serif-theme.git,Serif is a modern business theme for Hugo.,"hugo,hugo-serif-theme,theme,hugo-theme,hugo-site,jamstack,static-site-generator",171
203,https://github.com/DevlessTeam/DV-PHP-CORE.git,Devless is a ready-made back-end for development of web or mobile applications. It is fully open source under the permissive Apache v2 license. This means that you can develop your front end without worrying about neither back-end code or the business risk of a proprietary backend-as-a-service.,"baas,backend-services,php,laravel,backend-as-a-service,apis,reusable,docker",170
204,https://github.com/chrisjpowers/business-rules.git,A JavaScript library for building out the logic and UI for business rules.,,169
205,https://github.com/CloudRail/cloudrail-si-java-sdk.git,"Unified API Library for: Cloud Storage, Social Log-In, Social Interaction, Payment, Email, SMS, POIs, Video & Messaging. Included services are Dropbox, Google Drive, OneDrive, OneDrive for Business, Box, Egnyte, PayPal, Stripe,  Google Places, Foursquare, Yelp, YouTube, Vimeo, Twitch, Facebook Messenger, Telegram, Line, Viber, Facebook, GitHub, Google+, LinkedIn, Slack, Twitter, Windows Live, Yahoo, Mailjet, Sendgrid, Twilio, Nexmo, Twizo.",,166
206,https://github.com/jgauffin/Griffin.Framework.git,Application framework for Business Applications,,165
207,https://github.com/bbc/chaos-lambda.git,Randomly terminate ASG instances during business hours,,163
208,https://github.com/asigloo/vue-dynamic-forms.git,Easy way to dynamically create reactive forms in vue based on a varying business object model,"vue,dynamic-forms,reactive-form,forms,form-validation,vue-dynamic-forms,vue3,typrescript",162
209,https://github.com/ShadyBoukhary/Axion-Technologies-HnH.git,"Hotter’n Hell Hundred is the largest one hundred mile cycling events in the United States and the world. Held in Wichita Falls, TX, this event brings thousands of registrants within the city limits, resulting in a spike in revenue throughout local businesses, restaurants, and hotels, and overall for the city of Wichita Falls. There are several sub-events within the Hotter’n Hell Hundred, such as different races, dining events, consumer shows and a medical symposium. The proposed Hotter’n Hell Hundred mobile application serves as the ultimate source of information for the events, enabling users to quickly register for events and explore local places. In addition, the mobile application allows users to navigate through race during the event, tracking their speed, nearby rest stops, alternate routes, and finish line, ensuring the best possible experience during their stay in Wichita Falls.","clean-architecture,flutter,dart,expressjs,typescript,nodejs,mongodb,mobile-development,dartlang,flutter-apps,cross-platform,ios,android",162
210,https://github.com/idempiere/idempiere.git,iDempiere. Community Powered Enterprise.  Full Open Source Business Suite ERP/CRM/MFG/SCM/POS,"idempiere,java,zk,osgi,erp,business,management,accounting,crm",161
211,https://github.com/SpagoBILabs/SpagoBI.git,Outdated version of Knowage - Business Intelligence suite. Explore https://github.com/KnowageLabs for the current repository.,"spagobi,spagobi-suite,spagobi-server,gei,business-intelligence",160
212,https://github.com/bitstat/paperstencil.git,"A cross between word processor and web form. Paperstencil helps enterprises to roll-out data collection solutions, contracts, signatures, payment related solutions of their business needs in few minutes.",,159
213,https://github.com/Doptor-zz/Doptor.git,DOPTOR CMS & EMS : Enterprise level Pre-integrated Business Application Platform.,,158
214,https://github.com/letsar/binder.git,"A lightweight, yet powerful way to bind your application state with your business logic.","flutter,state-management,service-locator,inheritedwidget",156
215,https://github.com/ecoron/SerpScrap.git,"{""SEO python scraper to extract data from major searchengine result pages. Extract data like url, title, snippet, richsnippet and the type from searchresults for given keywords. Detect Ads or make automated screenshots. You can also fetch text content of urls provided in searchresults or by your own. It's usefull for SEO and business related research tasks.""}","scraper,search,seo,scraping,research,screenshot",156
216,https://github.com/adarshpastakia/aurelia-ui-framework.git,A bespoke UI Framework built on Aurelia for desktop business application,"aurelia,ui-framework",155
217,https://github.com/deenseth/PHP-Point-Of-Sale.git,"PHP Point Of Sale (POS) is designed to help small businesses with keeping track of customers, items and inventory, and generate reports based on sales. This program works great for businesses that use cash, check, or account numbers for their sales. ",,155
218,https://github.com/derekallard/BambooInvoice.git,"No longer maintained. BambooInvoice is free Open Source invoicing software intended for small businesses and independent contractors. Built on CodeIgniter, its priorities are ease of use, user-interface, and beautiful code.",,155
219,https://github.com/zerostaticthemes/gatsby-serif-theme.git,Serif is a beautiful small business theme for Gatsby.,"gatsby,theme,gatsby-serif-theme,gatsby-theme,gatsby-starter",154
220,https://github.com/ddd-crew/core-domain-charts.git,A tool for collaboratively finding your core domains - strategic business differentiators,,154
221,https://github.com/mzucker/miniray.git,Business card raytracer / eventual IOCCC winner,,152
222,https://github.com/ned-kelly/backup-and-bcp-for-aws.git,"{""A collection of scripts & tooling that's executed from Lambda to backup your AWS Services such as Route53, EBS, RDS, EFS, etc into a S3 bucket allowing you to sync into Google Cloud for Business Continuity. ""}","aws,backup,aws-backup,rds-backup,ebs-backup,ebs-snapshots,efs-backup,route53,route53-backup,lambda-backup",152
223,https://github.com/dotnet-architecture/eShopOnUWP.git,"Universal Windows Platform line of business application showcasing the latest Windows 10 capabilities such as Fluent Design System, Ink and Windows Hello.","uwp,dotnet,windows",151
224,https://github.com/kiegroup/appformer.git,A web platform to rapidly build forms for data management and business automation.,,150
225,https://github.com/awslabs/fhir-works-on-aws-deployment.git,A serverless implementation of the FHIR standard that enables users to focus more on their business needs/uniqueness rather than the FHIR specification,"hl7,fhir,healthcare,nodejs,aws,typescript,fhir-works",149
226,https://github.com/Jellyfishboy/trado.git,"Trado is a lightweight, easy to use ecommerce platform; designed to allow developers to quickly deploy a premium ecommerce store for their business","ruby,trado,ecommerce-platform,rails,stripe,paypal,mailchimp",149
227,https://github.com/venmo/business-rules-ui.git,A JavaScript library for building out the logic and UI for business rules.,,147
228,https://github.com/alexk111/awesome-bitcoin-payment-processors.git,"🌟 A curated list of Bitcoin payment processors enabling merchants, businesses and nonprofits to accept Bitcoin payments.","awesome-lists,bitcoin,payment-processing,awesome-list,awesome,bitcoin-payment,payment-processors,lightning,lightning-network,btc",146
229,https://github.com/inshopgroup/inshop-crm-client.git,"{""Inshop CRM / ERP Client. It's powerful framework allows to build systems for business with different workflows. It has on board multi language support, clients management, projects & tasks, documents, simple accounting, inventory management, orders & invoice management, possibilities to integrate with third party software, REST API, and many other features.""}","vue,vuex,rest-api,crm,erp,vuetify,javascript",145
230,https://github.com/mariusandra/aristotle.git,"Ruby business logic engine, inspired by Cucumber",,143
231,https://github.com/exceptionless/Exceptionless.DateTimeExtensions.git,"DateTimeRange, Business Day and various DateTime, DateTimeOffset, TimeSpan extension methods","datetime,datetimeoffset,range,c-sharp,datetimerange,timespan,business-days,time,exceptionless",143
232,https://github.com/runxc1/MicroRuleEngine.git,A .Net Rule Engine for dynamically evaluating business rules compiled on the fly.,,143
233,https://github.com/novatrixtech/mercurius.git,"{""Mercurius gives you speed when create 'Go' applications. It lets you being focused at business.""}",,143
234,https://github.com/TallyAssist/TallyAssist.git,Open source Flutter-based template for a business assistant application,"flutter,flutter-apps,business-solutions,flutter-examples,android-apps,firebase,android,hacktoberfest",142
235,https://github.com/rachelandrew/eu-vat.git,The VAT rules are changing in January 2015. Help me collect information and resources to help micro-businesses that are caught up in the change.,,142
236,https://github.com/business-science/presentations.git,A central repository of Business Science presentations,"business-science,tidyquant,timetk,sweep,tibbletime",137
237,https://github.com/melthaw/spring-backend-boilerplate.git,"The modularized backend boilerplate based on Spring Boot Framework, easy to get started and add your business part.","spring-boot,spring-mvc,spring-security,spring-data,spring-framework,gradle,boilerplate,audit,storage,sms,rbac,gridfs,backend,java,spring-boot-starter",137
238,https://github.com/iammukeshm/OnionArchitecture.git,"The onion architecture, introduced by Jeffrey Palermo, overcomes the issues of the layered architecture with great ease. With Onion Architecture, the game-changer is that the Domain Layer (Entities and Validation Rules that are common to the business case ) is at the Core of the Entire Application. This means higher flexibility and lesser coupling. In this approach, we can see that all the Layers are dependent only on the Core Layers.","onion-architecture,asp-net-core,cqrs-pattern,webapi,clean-architecture",136
239,https://github.com/microsoft/MCW-Line-of-business-application-migration.git,MCW Line-of-business application migration,,135
240,https://github.com/OrienteerBAP/Orienteer.git,Business Application Platform - no-code/low-code platform to build business applications,"java,orienteer,orientdb,baas,bap,business,bpmn,crm,nocode,low-code,no-code-framework",134
241,https://github.com/wplib/wplib.git,Foundation Library for Business-critical WordPress Websites,,133
242,https://github.com/toptal/granite.git,Business Actions architecture for Rails apps ,,127
243,https://github.com/system76/beansbooks.git,A revolutionary cloud accounting platform designed for small and medium businesses.,,127
244,https://github.com/masuda220/business-logic-patterns.git,experiments for business logic patterns,,127
245,https://github.com/blocoio/cardcase.git,Android app to share business cards with people nearby,"android,java,android-app,business-card,google-nearby",126
246,https://github.com/rails-engine/flow_core.git,FlowCore is a Rails engine to help you build your automation or business process application.,"ruby,ruby-on-rails,workflow-engine,petri-net,automation,rails-engine,business-process,bpm",125
247,https://github.com/optimajet/WorkflowServer.git,"Workflow Server is a ready-to-use Workflow Engine-based application that you can deploy into your infrastructure. It can be integrated with NodeJS, PHP, Ruby, .NET, or Java applications via a REST API. Workflow Server is a key component for managing the lifecycle of business objects within your enterprise.","workflow,workflowengine,java,workflowdesigner,bpm,state-machine",124
248,https://github.com/abantecart/abantecart-src.git,"AbanteCart is a free PHP based eCommerce solution for merchants to provide ability creating online business and sell products online quick and efficient.  AbanteCart application is built and supported by experienced enthusiasts that are passionate about their work and contribution to rapidly evolving eCommerce industry. AbanteCart is more than just a shopping cart, it is rapidly growing eCommerce platform",,123
249,https://github.com/ranjithprabhuk/Angular-Bootstrap-Dashboard.git,"Angular Bootstrap Dashboard is a web dashboard application based on Bootstrap and AngularJS. All components included in this dashboard template has been developed to bring all the potential of HTML5 and Bootstrap plus a set of new features (JS and CSS) ideal for your next dashboard admin theme or admin web app project. Angular Bootstrap Dashboard can be used in any type of web applications dashboard: Single Page Application (SPA), project management system, ecommerce admin dashboard, CMS, CRM, SAAS, help desk; for personal and business purposes. Angular Bootstrap Dashboard uses ui-router for routing purposes.",,123
250,https://github.com/StartBootstrap/startbootstrap-small-business.git,A Bootstrap HTML template for creating marketing websites for small businesses - created by Start Bootstrap,"bootstrap,html,bootstrap4,bootstrap-4,bootstrap-theme,bootstrap-template,open-source,free",122
251,https://github.com/ryanza/stateflow.git,State machine that allows dynamic transitions for business workflows,,122
252,https://github.com/zhaoboy9692/add_corporate_information_daily_of_china.git,"中国大陆 31 个省份最近几日新增工商企业注册信息以及其他部分企业数据，大概100余万信息，包含企业名称、注册地址、统一社会信用代码、省份、城市、注册日期、经营范围、负责人、邮箱、注册资金、企业类型等资料。 In 31 provinces in mainland China, About 1000000 messages，new business registration information has been added in recent days, including company name, registered address, unified social credit code, province, city, registration date, business scope, responsible person, mailbox, registered capital, and type of business.",,122
253,https://github.com/peasy/peasy-js.git,A business logic micro-framework for javascript,"peasy,peasy-js,middle-tier-framework,typescript,reusability,javascript,business-logic,front-end-framework,backend-framework,back-end-framework,frontend-framework,business-logic-framework,architecture,architectural-patterns",121
254,https://github.com/ACCORD5/TrellisDesk.git,A robust and user-friendly help desk solution for businesses and organizations.,,120
255,https://github.com/mikopbx/Core.git,"Free, easy to setup PBX for small business based on Asterisk 16 core","asterisk,pbx,telephony,phalcon,cti,pjsip,voip-server,voip,asterisk-pbx,asterisk-ami,asterisk-server,asterisk-manager-api,asterisk-agi,asterisk-dialplan,sip,sip-server,communications,iax,virtual-machine,iso",120
256,https://github.com/halower/vbp.git,"vue-boilerplate help you build a simple, easy-to-use front-end business framework","vue,vue-cli,vue-boilerplate",119
257,https://github.com/ddossot/NxBRE.git,NxBRE is a lightweight Business Rule Engine (aka Rule Based Engine) for the .NET platform.,,118
258,https://github.com/reinforced/Reinforced.Tecture.git,Aspect-based architectural framework for .NET business applications involving some FP and CQRS principles.,"csharp,dotnet-core,netstandard,cqrs,database,architectural-framework",117
259,https://github.com/metawidget/metawidget.git,"Metawidget is a smart User Interface widget that populates itself, either statically or at runtime, with UI components to match the properties of your business objects. ",,117
260,https://github.com/wen-fei/CNKISpider.git,"a spider for cnki patent content, just for study and commucation, no use for business.","python,scrapy",116
261,https://github.com/marklagendijk/node-toogoodtogo-watcher.git,Node.js cli tool for monitoring your favorite TooGoodToGo businesses. Docker image available.,,114
262,https://github.com/StartBootstrap/startbootstrap-business-frontpage.git,A Bootstrap HTML business homepage template created by Start Bootstrap,"bootstrap,html,bootstrap4,bootstrap-4,bootstrap-theme,bootstrap-template,open-source,free",112
263,https://github.com/oliverzy/process-engine.js.git,Node.js Business Process/Workflow Engine,,112
264,https://github.com/ra-systems/django-ra-erp.git,"A Django based framework to create diverse business solutions, equipped with a reporting engine and a responsive dashboard.","django,python,erp,framework,responsive-design,charting,reporting-engine",112
265,https://github.com/dddplus/dddplus.git,🔥  A lightweight flexible development framework for complex business architecture with full ecosystem！轻量级业务中台开发框架，中台架构的顶层设计和完整解决方案！,"ddd,ddd-architecture,business-architecture,java,plugin,flexible,extension,enterprise-architecture,domain-driven-development,complex-business-architecture,framework,productivity,tools-engineering,productivity-tools,landscape,dddplus,headless-commerce,ecosystem",112
266,https://github.com/awslabs/document-understanding-solution.git,"Example of integrating & using Amazon Textract, Amazon Comprehend, Amazon Comprehend Medical, Amazon Kendra to automate the processing of documents for use cases such as enterprise search and discovery, control and compliance, and general business process workflow.","amazon-comprehend,amazon-textract,aws-machine-learning,machine-learning,aws,amazon-kendra,amazon-elasticsearch,cdk,aws-cdk",109
267,https://github.com/icodebetter/icodebetter.git,An opinionated low code platform that helps you code business applications in a better way :rabbit:,"low-code,low-code-development-platform,spring-boot,java,javascript,react,reactjs,vue,vuejs",106
268,https://github.com/SwissBorg/Business.git,"Enjoy our Pitch deck, Business plan and white papers  ",,105
269,https://github.com/intrepidtechie/KITT-O365-Tool.git,KITT - An Open Source PowerShell O365 Business Email Compromise Investigation Tool,,105
270,https://github.com/lucpod/ticketless.git,An amazing workshop about AWS and Serverless where you have the chance to build a time-travel music business! 😱,"serverless,aws,aws-lambda,aws-s3,aws-api-gateway,training,workshop,training-materials,workshop-materials,nodejs",105
271,https://github.com/kiegroup/kogito-examples.git,Kogito examples - Kogito is a cloud-native business automation technology for building cloud-ready business applications.,"hacktoberfest,kogito,rules-engine,quarkus,spring-boot,bpmn,serverless-workflow,java,bpm,workflow,workflow-engine,dmn,cmmn,cloud-native,knative",104
272,https://github.com/hubot-scripts/hubot-business-cat.git,Business cat is summoned when business jargon is used,,104
273,https://github.com/WeBankBlockchain/WeDPR-Lab-Core.git,Core libraries of WeDPR instant scenario-focused solutions for privacy-inspired business; WeDPR即时可用场景式隐私保护高效解决方案核心算法组件,"wedpr,blockchain,privacy,zkp,mpc,crypto,cryptography,homomorphic-encryption,multiparty-computation,rust,sdk-rust",103
274,https://github.com/alipay/SOFAStack.git,"SOFAStack™ (Scalable Open Financial Architecture Stack) is a collection of cloud native middleware components, which are designed to build distributed systems with high performance and reliability, and have been fully validated by mission-critical financial business scenarios.","sofastack,index",103
275,https://github.com/TaddyLab/BDS.git,Code and examples from Business Data Science,,102
276,https://github.com/Rebuild-Black-Business/RBB-Website.git,Website to help connect black-owned businesses with consumers and resources,"black,reactjs,react,gatsby,gatsbyjs,blacklivesmatter,discord,volunteer,frontend,consumers",102
277,https://github.com/mmamaev/timeboard.git,Calendar calculations over business days and work shifts,"pyhton,business,calendar-api,shift-calendar,schedule",102
278,https://github.com/solnic/transflow.git,[DISCONTINUED] Business transaction flow DSL,,102
279,https://github.com/NitorCreations/nflow.git,"nFlow is a battle-proven solution for orchestrating business processes. It can be used as microservices orchestrator (Saga-pattern), as business process engine or as persistent finite-state machine.","workflow-engine,java,orchestrating-processes,nflow,workflow,workflow-automation,saga-pattern",101
280,https://github.com/18F/fbopen.git,"[DEPRECATED] An open API server, data import tools, and sample apps to help small businesses search for opportunities to work with the U.S. government.",,101
281,https://github.com/uuware/icons-font-customization.git,"A collection of over 33,000 high-quality free svg icons and tools for generating customized icon font. All icons are completely free for personal or business requirements.",,101
282,https://github.com/optimajet/DWKit.git,DWKit is a Business Process Management System based on .NET Core and React,"workflow,javascript,jsx,csharp,net,netcore2,form-builder,react,webpack,bpm,workflow-designer,postgresql,mssql,security",95
283,https://github.com/webdigi/GmailScheduler.git,Google app script system to allow gmail / google business apps users to schedule outgoing messages & to set messages to return to inbox,"gmail-scheduler,scheduler,gmail,google-apps-script,google-appscripts",95
284,https://github.com/Icinga/icingaweb2-module-businessprocess.git,Create top-level views of your applications in a graphical editor. Rules express dependencies between existing hosts and services and let you alert on application level. Business processes are displayed in a tree or list overview.,"icingaweb2,module,business-impact,business-process",95
285,https://github.com/apphud/ApphudSDK.git,"Build, Measure and Grow iOS subscription business","ios,in-app-purchase,in-app-purchases,in-app-receipt,receipt-validation,swift5,swift-5,subscription,apphud,storekit,iap,iap-verification,skproduct,skpaymentqueue,purchase,purchases",94
286,https://github.com/ecomfe/ub-ria.git,RIA base for union business,,93
287,https://github.com/ddzy/ts-utility-plugins.git,":octocat: Useful plugins library,  including Canvas、Business、Utility and more","typescript,canvas,business,plugins",92
