,Url,Description,Topics,Stars
424,https://github.com/pp4rs/2017-uzh-course-material.git,Repository that hosts the course materials for the 2017 edition of Programming Practices for Research in Economics at the University of Zurich,"reproducible-research,reproducible-science,computational-economics,git-tutorial,command-line,python3,python-tutorial,r-stats,snakemake-workflows,sqlite3",1
425,https://github.com/ECN431/2018.git,"Course material for ECN431 ""Applied Data Analysis for Firm Strategy and Competition"" given at the Norwegian School of Economics (NHH) during the spring semester of 2018.",,1
426,https://github.com/AbrahamEapen/Earthquake-Economics.git,Rutgers Bootcamp - Earthquake Economics,,1
427,https://github.com/rlsweeney/replications.git,Replication of economics papers,,1
428,https://github.com/rufuspollock/econ.git,Open Economics repo,,1
429,https://github.com/rodazuero/Labor-economics.git,Labor economics class,,1
430,https://github.com/meisser/course2018.git,Agent-Based Financial Economics 2018,,1
431,https://github.com/tyleransom/jolebib.git,BibTeX style file for the Journal of Labor Economics,,1
432,https://github.com/SmartyMJ/advanced-financial-economics.git,Repo of homework and research code for ECON 525: Advanced Financial Economics,,1
433,https://github.com/riabaldevia/Econometrics.git,A refresher on quant economics with Python,,1
434,https://github.com/DTOcean/dtocean-economics.git,Economics module for the DTOcean tools,,1
435,https://github.com/Constellation-Labs/economic-model.git,:page_with_curl::currency_exchange: Generative Economics,,1
436,https://github.com/MasonWang025/yei-website-old.git,The Youth Economics Initiative website (OLD).,,1
437,https://github.com/edouardmulliez/practical-reinforcement-learning.git,Reinforcement learning course on coursera.National Research University Higher School of Economics,,1
438,https://github.com/sehyoun/adaptive_finite_volume.git,Toolbox to test adaptive finite volume methods for Fokker Planck Equation (arising from economics),,1
439,https://github.com/databyjp/dash_bezos_tracker.git,A demo app using Plotly Dash - Jeff Bezos Wealth | COVID-19 Economics tracker,,1
440,https://github.com/santteegt/ctr-prediction.git,CTR prediction using online learning models for the Kaggle UCL Web Economics Algorithm Challenge 2016 ,"ucl,regression-models,ctr-prediction",1
441,https://github.com/xia0nan/coursera-advanced-machine-learning.git,Advanced Machine Learning Specialization by Higher School of Economics,,1
442,https://github.com/ccnmtl/econplayground.js.git,aka EconPractice - Environment for authoring and interacting with economics concepts,,1
443,https://github.com/pp4rs/syllabus.git,Course Syllabus for Programming Practices for Research in Economics,"syllabus,2020,uzh",1
444,https://github.com/gfgprojects/gabriele.git,General Agent Based Repast Implemented Extensible Laboratory for Economics,,1
445,https://github.com/DawievLill/data-science-methods.git,Course material for Data Science Methods for Economics,,1
446,https://github.com/math-econ-code/mec_optim_2018-01.git,"Jan 2018 edition of the ""math+econ+code masterclass on optimization in economics: optimal transport, demand models, matching models""",,1
447,https://github.com/aishameriane/msc-economics.git,Courses taken during the Master Course in Economics at UFSC,,1
448,https://github.com/labordynamicsinstitute/economics-of-privacy-replication.git,"Replication archive for ""Revisiting the Economics of Privacy""",,1
449,https://github.com/ligon/HackingFood.git,Hacking Food and Nutrition (Environmental & Economics and Policy 153),,1
450,https://github.com/stefanangrick/oemdlRtools.git,An R package to import data from an Oxford Economics Global Economic Model database file into an R data frame ,,1
451,https://github.com/joshuajohnsonjj/econ_sim.git,Open source web based economics simulation tool developed originally for use at the University of Notre Dame,,1
452,https://github.com/ffecon/Econ.git,About economics,,1
453,https://github.com/aakb/jira_economics.git,Jira Economics,,1
454,https://github.com/antonio-hickey/Economics.git,Economics Projects ,,1
455,https://github.com/WorldEcon/worldecon.github.com.git,World Economics,,1
456,https://github.com/meisser/course2019.git,"Repository for ""Agent-Based Financial Economics"", see http://course.meissereconomics.com",,1
457,https://github.com/mrafalo/PiWD.git,Support material for class: Data Visualisation and Presentation at Warsaw School of Economics,,1
458,https://github.com/pp4rs/2020-uzh-installation-guide.git,2020 Installation Guide for UZH - Programming Practices for Research in Economics,,1
459,https://github.com/JoanMartin/UIB-MasterInBigData.git,"{""Master's degree of Big Data Analysis in Economics and Business""}","big-data,machine-learning,data-science,data-analysis,machine-learning-algorithms,sklearn,r,python,pandas,matplotlib,igraph",1
460,https://github.com/talithafs/mpgse.git,"{""Masters' Thesis, Economics, Barcelona Graduate School of Economics""}",,1
461,https://github.com/zazhigin/hse.git,Higher School of Economics,,1
462,https://github.com/sintell/i-Economics.git,Real world economics simulation,,1
463,https://github.com/dotjersh/elasticity.git,Economics Elasticity Calculator,,1
464,https://github.com/juholaht/Thesis.git,Thesis in Economics 2020. ,,1
465,https://github.com/EconomicsObservatory/ECOvisualisations.git,🌌 Economics Observatory Visualisation Repository,"economics-observatory,data-science,economics,data-visualization,dataviz,dataviz-tools,covid-19,covid19-data,vega,vega-lite,d3js,d3plus,echarts,panel,jupyter,python",1
466,https://github.com/blthayer/ecen-715.git,Power System Economics,,1
467,https://github.com/pdarya/LemonsMarket.git,Experimental economics project,,1
468,https://github.com/s-saisw/studyGroup.git,Labor economics study group,"labor-economics,handbook,economics,econometrics",1
469,https://github.com/jpeak5/homec.git,my home economics app,,1
470,https://github.com/zsuzsa/PDE.git,Palgrave Dictionary of Economics,,1
471,https://github.com/ds-modules/ECON-141.git,Economics 141 - Spring 2019 ,,1
472,https://github.com/JShuman20/Econ-Thesis.git,Economics Thesis Replication Code,,1
473,https://github.com/sedyer/habitat.git,Orbital economics simulation game,,1
474,https://github.com/k-mawa/open_economics.git,somecode_for_economics,,1
475,https://github.com/janboone/msc_datascience.git,msc economics course datascience,,1
476,https://github.com/babycamel/afew.git,Advanced Fisheries Economics Workshop,"fisheries-economics,resource-economics,economics,jupyter-notebooks",1
477,https://github.com/alecandrews33/CS-144.git,Network Structures and Economics,,1
478,https://github.com/hhhym/Finaecon-2019s.git,Financial economics 2019 Spring,,1
479,https://github.com/johnnysparks/Prohibition.git,WIP 1920s economics game,,1
480,https://github.com/johnnysparks/Prohibition.git,WIP 1920s economics game,,1
481,https://github.com/cbowdon/CurryDistribution.git,Business economics simulation game,,1
482,https://github.com/PayalBordia/Economics-of-Water.git,Economics of Water,,1
483,https://github.com/rnyang/reconomics.git,code for /r/economics,,1
484,https://github.com/rugantio/ReinforcementLearning.git,Reinforcement Learning for Economics,,1
485,https://github.com/bongotastic/InterstellarTrader.git,Economics for Traveller,,1
486,https://github.com/MatthewKatzen/Thesis.git,Economics Honours Thesis,,1
487,https://github.com/alexeyandriyash/EconEUSpB.git,Economics in EUSpB,,1
488,https://github.com/saylordotorg/text_principles-of-economics-v2.0.git,"Principles of Economics, v2.0",,1
489,https://github.com/GPrev/AgentEconomists.git,Agent simulation applied to economics,,1
490,https://github.com/korenmiklos/per-shipment-costs-replication.git,"Replication code and data for Hornok and Koren, 2014. ""Per-Shipment Costs and the Lumpiness of International Trade."" Review of Economics and Statistics.",,1
491,https://github.com/TurtlePU/epic-economy-strategy.git,Simple .io-like economics game,"express,socket-io,papaparse,pixijs,game",1
492,https://github.com/CharlesMicou/ezomnotho-prototype.git,Agent-based computational economics prototype.,,1
493,https://github.com/qiaokang92/BA_network.git,"BA network, to study economics",,1
494,https://github.com/anishnuni/Klade_Economics.git,Economics of the Klade system,,1
495,https://github.com/moreira-matheus/mit-econometrics.git,[FINISHED] Economics 421 - Econometrics @ MIT,,1
496,https://github.com/Owenxu0510/Web_Scraping_hospital.git,Project in PKU Health Economics,,1
497,https://github.com/sg-s/awesome-economics.git,Curated reading list on economics,,1
498,https://github.com/lbogaardt/Complex-Network-Dynamics-In-Economics.git,Complex Network Dynamics In Economics,,1
499,https://github.com/erezny/offworld-helper.git,Offworld Trading Company economics helper,,1
500,https://github.com/josander/Algorithmic-Trading.git,"{""(Bachelor's Thesis in Economics)""}",,1
501,https://github.com/RalucaGeorgescu/Web-Economics.git,UCL Web Economics Coursework 2017,,1
502,https://github.com/blockerdude/Merchantile.git,An economics based strategy game,,1
503,https://github.com/usfca-economics/MA_Econ.git,Master of Arts in Economics,"economics,university,sanfrancisco",1
504,https://github.com/will-ducott/ECON.git,Numerous functions pertaining to economics,"economics,economic,economy,econometrics,economics-models,economia",1
505,https://github.com/jarbun/dsa-specialization.git,"{""Solutions for Coursera's Data Structures and Algorithms Specialization by UC San Diego & Higher School of Economics""}",,1
506,https://github.com/fernandoramacciotti/fgv-dissertation-twitter-vs-stocks.git,"Sao Paulo School of Economics, FGV, Master in Economics and Econometrics final dissertation",,1
507,https://github.com/SexyFishHorse/CitiesSkylines-Economics.git,Source code for the Economics mod that changes the behaviour of the economics in Cities Skylines,"cities-skylines,mod",1
508,https://github.com/SanteriVtj/The-Economics-of-Money-Banking-and-Financial-Markets.git,"Visualization for different concepts of economics BSc course ""Economics of Money, Banking and Financial Markets""",,1
509,https://github.com/jrnold/jabref-econ-journal-abbrevs.git,Economics journal abbreviations (JEL) for JabRef ,,1
510,https://github.com/Sibasish98/Economics-App.git,A simple Economics based Android app.,,1
511,https://github.com/ekarsten/Oeconomica-Health-Cohort.git,2017-2018 Cohort on Health Economics,,1
512,https://github.com/zbw/stw-mappings.git,Mappings for STW Thesaurus for Economics,,1
513,https://github.com/donkawechico/PyEconomics.git,Economics simulation (written by Peter Norvag),,1
514,https://github.com/salmuz/WAHEco.git,Application Web for Health Economics Decision Making,"health,economics,shiny,decision-making",1
515,https://github.com/SaidAbdullahi/web_econ_coursework.git,UCL ~ Web Economics 2016/17 Coursework,,1
516,https://github.com/yniu87/TeachStatistics.git,ECON 30330 Statistics for Economics: teaching materials,,1
517,https://github.com/NarekOhanyan/papers.git,Replication of famous papers in economics,,1
518,https://github.com/ianchadd/rpi_3208.git,RPI 3208 Exp Economics oTree Server,,1
519,https://github.com/danielsaggau/Elections-Belarus.git,Project for Machine Learning for Economics ,,1
520,https://github.com/liebermeister/metabolic-economics.git,Matlab code for Metabolic Economics calculations,"systems-biology,systems-biology-simulation",1
521,https://github.com/theTarzan/Thesis_Code.git,Code for Masters Thesis in Applied Economics,,1
522,https://github.com/PSJorgensen/real-world-economics.git,"Perspective on economics, finance and sustainability science",,1
523,https://github.com/gsamueil/Advanced-Machine-Learning-.git,National Research University Higher School of Economics,,1
524,https://github.com/aadityadar/econ_ra_india.git,Resources for economics research assistants in India,"economics,research-assistant,india,jobs",1
525,https://github.com/sbordt/unhet-expecon.git,Estimating Unobserved Heterogeneity in Experimental Economics,,1
526,https://github.com/ubcmicroworkshop/ubc-hku-2020.git,The Frontier of Economics + Computer Science,,1
527,https://github.com/ottermagically/ecological-economics.git,Test Repo for Ecological Economics projects,,1
528,https://github.com/MSchnidman/Economics-of-Happiness-Thesis.git,Undergraduate Thesis on the Economics of Happiness,,1
529,https://github.com/CoastalResilienceNetwork/enba.git,Economics of nature-based adaptation plugin (California),,1
530,https://github.com/codydf/OkCupidParsing.git,OkCupid Parsing Script for Economics Research,,1
531,https://github.com/sp1ke77/SymfonyGame.git,Strategy/economics sim using PHP and MySQL,,1
532,https://github.com/anayahall/cc_econ.git,ER276: Climate Change Economics - buildout IAM,,1
533,https://github.com/cbilstra/vulnerability-scanning.git,Economics of Cyber Security group 11,,1
534,https://github.com/CoastalResilienceNetwork/eca.git,Economics for Climate Adaptation (Gulf of Mexico),,1
535,https://github.com/hackettma/CIRES-PETRO.git,Petroleum Economics Calculator for the Web,,1
536,https://github.com/oguerrer/notebooks.git,iPython notebooks on agent computing economics models,,1
537,https://github.com/hdvinod/EconData.git,Economic Data for Learning Economics and Econometrics,,1
538,https://github.com/theris10/XLab.git,Andorid app for behavioral economics experiment,,1
539,https://github.com/rashediqbal/ucla_mae_17.git,Code for Masters of Applied Economics,,1
540,https://github.com/vitanova/econ.git,collect immature code while studying economics,,1
541,https://github.com/bquast/Thesis.git,Four Reproducible Contributions in Development Economics,,1
542,https://github.com/Ehsanwww/complexnetwork.git,applications of complex networks in economics,,1
543,https://github.com/kippum99/networks_structure_economics.git,Caltech CS 144 - Networks: Structure and Economics,,1
544,https://github.com/profjordanov/PHP-programming.git,Course in University of Economics - Varna.,"php,server,mvc,laravel",1
545,https://github.com/szstanly/Research.git,"Research on finance, accounting and economics",,1
546,https://github.com/ogaway/WillowProject.git,Programming with Willow for Experimental Economics,,1
547,https://github.com/shriram/instaBRIC.git,Make yourself an international economics pundit.,,1
548,https://github.com/NicolaBernini/Economics1.git,Set of Economics References and Considerations1,,1
549,https://github.com/andreamoro-git/Vandyletter.git,LaTeX letter style for Vanderbilt Economics letterhead,,1
550,https://github.com/jack-madison/Marketing-to-Physicians.git,"{""Jack Madison's Economics Honours Thesis""}","economics,health,prescription,drugs,physicians",1
551,https://github.com/maliars/Solving-for-labor-easily.git,"The folder “Maliars_CE_25_2005” contains MATLAB software accompanying  the article ""Parameterized Expectations Algorithm: How to Solve for  Labor Easily"" by Lilia Maliar and Serguei Maliar, (2005), Computational  Economics 25, 269-274. ",,1
552,https://github.com/vcurdia/CFNT2015-ReplicationCodes.git,"Replication codes for Cúrdia, V., Ferrero, A., Ng, G. C., and Tambalotti, A. (2015). ""Has U.S. monetary policy tracked the efficient interest rate?"" Journal of Monetary Economics, 70, pp. 72-83.",,1
553,https://github.com/graebnerc/EE-Complexity17.git,"Contains code material for the course ""Complexity Economics - Theory and Computational Methods"" taught during the Exploring Economics Summer Academy 2017.",,1
554,https://github.com/LuckyAbby/torch.git,A small BBS for Faculty of Management and Economics,,1
555,https://github.com/karthiktadepalli1/econ-grad-network.git,Network analysis of economics graduate admissions using web scraped data.,,1
556,https://github.com/egesenkul/Senior-Project-HOTELiEU.git,İzmir University of Economics Computer Engineering Senior Project,,1
557,https://github.com/tipalol/Programming-labs.git,Programming labs on C# (Higher School of Economics),,1
558,https://github.com/Andreaierardi/Master-DataScience-Notes.git,MSc. Data Science and Economics Notes and projects,"unimi,university,datascience,notes",1
559,https://github.com/jmoy/math-methods.git,A creative commons textbook on mathematical methods of economics,,1
560,https://github.com/tylersmithSD/Economics_and_Big_Data-HTML.git,HTML Website for research over economics and big data,,1
561,https://github.com/celinehh/heemod-CHM-late.git,Late-stage choroideremia patient model health economics of gene therapy,,1
562,https://github.com/remiroazocar/BMHEstan.git,Bayesian methods in health economics in Stan (Florence course),,1
563,https://github.com/coasian/coasian.github.io.git,"{""In honor of Ronald Coase and Chicago's cool economics.""}",,1
564,https://github.com/jgumbley/racing-selections.git,Following from a vague interest in web applications and economics.,,1
565,https://github.com/WillBrowne/SurvHE.git,R package for performing survival analysis in health economics,,1
566,https://github.com/MZabek/UMSumSem.git,Summer Seminar for the University of Michigan Economics Department,,1
567,https://github.com/shaynair/Plus-Card.git,"{""A project for the Management and Economics Students' Association (MESA).""}",,1
568,https://github.com/Tjoppen/solar_stuff.git,"Stuff for calculating solar panel economics, and FreeCAD drawings",,1
569,https://github.com/erinhengel/seminars-aea-pp.git,Diversity in Economics Seminars: Who Gives Invited Talks?,,1
570,https://github.com/Lordmzn/JADE_AgentEconomy.git,A class exercise: Multi agent economics with JADE,,1
571,https://github.com/GjjvdBurg/ESEBeamerPoster.git,Unofficial Beamer Poster style for the Erasmus School of Economics,,1
572,https://github.com/Ryan-Ashton/Australian_Economics.git,Personal Projects with Python Programming and Australian Economics,,1
573,https://github.com/DallasAutumn/Recruitment-and-Economics.git,A project to analyse economics using recruitment information.,,1
574,https://github.com/Blojak/Dissertation.git,My dissertation about macro-financial linkages in economics,,1
575,https://github.com/DappDevs/Arbie.git,Arbie the arbitration bot: teaching crypto-economics to the masses!,,1
576,https://github.com/janboone/datascience_notebooks.git,notebooks for TiU MSc course Data Science for Economics,,1
577,https://github.com/macacarrizosa/amazon-corportate-strategy.git,Amazon Corporate Strategy Story for Business and Economics Concentration.,,1
578,https://github.com/tkakantousis/ScheduleMasterAUEB.git,Official Athens University of Economics and Business Course Scheduling Application,,1
579,https://github.com/charlie-gallagher/economic_journal_analysis.git,A text analysis of three open economics journals,,1
580,https://github.com/HXYNODE/IncidentsDataAnalysis.git,There is a project on incidents data analyse from zufers (Zhejiang University of Finance and Economics) and our boss is Christoph Schubert.  ,,1
581,https://github.com/Nikita44lis/Engineering-Economics-.git,Package which solves Engineering Economics problems and creates interactive graphs ,,1
582,https://github.com/WhiskyChoy/network-economics-demo.git,This is the project demo for the course Network Economics.,,1
583,https://github.com/gabors-data-analysis/da_interactive.git,"Interactive site for Data Analysis for Business, Economics, and Policy",,1
584,https://github.com/mirrorUnion/Tianjian-University-of-Finance-and-Economics-MAP.git,（Tianjian University of Finance and Economics ）介绍天津财经大学校园信息的微信小程序,,1
585,https://github.com/TommyJacket/USUE_bot.git,Telegram bot for Ural State University of Economics,,1
586,https://github.com/study-groups/qe-study-group.git,Materials useful for the study of quantitative economics,,1
587,https://github.com/evilghostgirl/EconomyShop.git,School UI project where you can buy best economics books!,,1
588,https://github.com/gkilleen33/rs-economics.git,Open source scripts for utilizing remote sensing data in economics.,,1
589,https://github.com/visualizedata/undp.git,"Partnering with the United Nations Development Programme on Africa Human Development, Parsons Data Visualization students investigate how gender inequality impact economics on a micro- and macro level.",,1
590,https://github.com/Roverr/komacorp.git,School project at Budapest University of Technology and Economics,,1
591,https://github.com/jonoxia/aliensky.git,multiplayer planetary exploration/building/economics game using rpgbase,,1
592,https://github.com/jrhorn424/recruiter.git,Online recruitment software for economics experiments written with rails,,1
593,https://github.com/NormannR/JuddCode.git,"Julia codes for Judd\'s ""Numerical Methods in Economics""",,1
594,https://github.com/mengchen1113/Bayesian-Inference-Project.git,Final project for Harvard Economics 1127: Causal Inference,,1
595,https://github.com/marcincuber/WebEconomics.git,UCL coursework for module COMPGW02 Web Economics Masters level,,1
596,https://github.com/shafikbisharat/WebEconomics.git,This is a  repository for Web Economics module | UCL,,1
597,https://github.com/uo-ec510-2020-spring/syllabus.git,Syllabus for Big data in Economics (EC 410/510),,1
598,https://github.com/sarpcebeci/Financial_Economics_Term_Project.git,"Web scraping, and analysis source codes for Financial Economics class",,1
599,https://github.com/tweag/economics.git,Data science focussed on economics and social science,,1
600,https://github.com/brioux/KEM_CHINA_EE.git,KEM China natural gas model prepared for Energy Economics submission,,1
601,https://github.com/rcberg/health-economics.git,storehouse for projects and data relating to health economics,,1
602,https://github.com/chi-yv/models.git,The realization of common mathematical models of economics in Python.,,1
603,https://github.com/bendahmen/e_essay.git,Extended Essay for the MSc Economics at the LSE,"labor,economics,r,econometrics",1
604,https://github.com/Health-Economics-in-R/301118-scoping-workshop.git,Slides from the health economics in R scoping workshop.,,1
605,https://github.com/OopsYao/swufethesis.git,LaTeX Thesis Template for Southwestern University of Finance and Economics,"latex,tex,latex-thesis-template",1
606,https://github.com/karfunkel/econaxy.git,An OpenSource Economics Simulation game in a galaxy context setting,,1
607,https://github.com/garretchristensen/AFSEJune2019.git,Transparency and Reproducibility in Economics slides for AFSE 2019,,1
608,https://github.com/Banyuwangi45/Machine-Learning-and-Data-Science-in-Economics.git,Implementations of Machine Learning and Data Science Methods in Economics,"machine-learning,data-science,economics",1
609,https://github.com/parijatlal/dev_summaries.git,Summaries of Papers in Public Economics and Development,,1
610,https://github.com/dev-Kaustav/fes-website.git,The website of Finance and Economics society of NSUT,,1
611,https://github.com/ccnmtl/econplayground.git,aka EconPractice - Environment for authoring and interacting with economics concepts,,1
612,https://github.com/szeswee/econs-research-network.git,Networks of economics research fields through the years,"economics,network-analysis,jel-classification",1
613,https://github.com/SSabas/ucl-webecon-cw.git,"COMPGW02/M041 - Web Economics Coursework (UCL, 2017-18)",,1
614,https://github.com/redquasar3/BOX-Engine.git,A game engine for city builders and economics simulators,,1
615,https://github.com/nathanesau/m4fe.git,"Models for Financial Economics. European, American and Asian Option Pricing (using Binomial Trees), Interest Rate Models, Methods for Solving Partial Differential Equations.",,1
616,https://github.com/vbenndorf/wedr.git,Real-effort task for use in economics experiments,,1
617,https://github.com/ryansafner/publicS20.git,"Course website for ECON 410 - Public Economics, Spring 2020",,1
618,https://github.com/diegouriarte/otree_risk_aversion_soft_skills.git,Otree implementation for Experimental Economics Course at Universidade del Pacífico,"economics,otree",1
619,https://github.com/GiteshJ/Advanced-Machine-Learning.git,Advanced Machine Learning Course by Higher School of Economics,deep-learning,1
620,https://github.com/jhconning/Eco340_old.git,For Fall 2017 Economics 340 class.  Mirror at https://notebooks.azure.com/jhconning/libraries/Eco340/tree/pages to run interactive jupyter notebooks. Static website generated at:,"trade,nikola,economics,economics-models",1
621,https://github.com/snowdj/computational_economics.git,"Computational economics is a field of economic study at the intersection of computer science, economics and management science. The main focus of is the integration of information (IT) into economics and the automation of formerly manual processes. ",,1
622,https://github.com/maliars/Value-function-simulation.git,"The folder “Maliars_EL_87_2005” contains MATLAB software accompanying  the article “Solving Nonlinear Stochastic Growth Models: Iterating on  Value Function by Simulations” by Lilia Maliar and Serguei Maliar, (2005),  Economics Letters 87, 135-140. ",,1
623,https://github.com/jaros1/gofreerev-fb.git,Rails app https://dev1.gofreerev.com/ implementing free money and gift network. Ideas taken from Sacred Economics by Charles Eisenstein: http://sacred-economics.com/,,1
624,https://github.com/MathieuLoutre/FatLoutre.git,FatLoutre is an Analysis Tool for Linguists Oriented Unanimously Towards Revolution and Economics,,1
625,https://github.com/Realm0xFFreedom/MERRC.git,"Typing and translation of ""Maoist Economics and the Revolutionary Road to Communism""",,1
626,https://github.com/sdunbarne/Math-Modeling-Econ-Finance-Python.git,"Python scripts for the book ""Mathematical Modleing in Economics and FInance""",,1
627,https://github.com/hunterecon2/epidemics.git,A place to share code and ideas about epidemics and economics,,1
628,https://github.com/shrutikumar15/Arthanomics.git,"Website for Arthanomics 2020, fest of Economics Department of Jai Hind College.",,1
