,Url,Description,Topics,Stars
514,https://github.com/NTCoding/prod-domain-biz-arch-building-blocks.git,Product & Domain-Oriented Business Architecture Building Blocks,,39
515,https://github.com/yassinrais/sakura-panel.git,"Sakura Panel , made with PHP (Phalcon Framework) , to manage your business easy , by adding plugins to it",,39
516,https://github.com/treselle-systems/customer_churn_analysis.git,"In the customer management lifecycle, customer churn refers to a decision made by the customer about ending the business relationship. It is also referred as loss of clients or customers. Customer loyalty and customer churn always add up to 100%. If a firm has a 60% of loyalty rate, then their loss or churn rate of customers is 40%. As per 80/20 customer profitability rule, 20% of customers are generating 80% of revenue. So, it is very important to predict the users likely to churn from business relationship and the factors affecting the customer decisions. We are going to show how logistic regression model using R can be used to identify the customer churn in the telecom dataset.",,39
517,https://github.com/inshopgroup/inshop-crm-ecommerce.git,"{""Inshop CRM / ERP ecommerce. It's powerful framework allows to build systems for business with different workflows. It has on board multi language support, clients management, projects & tasks, documents, simple accounting, inventory management, orders & invoice management, possibilities to integrate with third party software, REST API, and many other features.""}","vuejs,vuex,nuxt,rest-api,pwa,javascript,ecommerce,vuetify",39
518,https://github.com/BelinChung/DChaser.git,A Business theme for WordPress,,38
519,https://github.com/olap4php/olap4php.git,olap4php - open source business intelligence,,38
520,https://github.com/sbarry50/vue-business-hours.git,"Vue component for selecting business hours. Supports days of the week, holidays and any other special business hours.",,38
521,https://github.com/microsoft/SkillsExtractorCognitiveSearch.git,Azure Search Cognitive Skill to extract technical and business skills from text,"azure-search,cognitive-search,named-entity-recognition,natural-language-processing",38
522,https://github.com/dropbox/DropboxBusinessAdminTool.git,Power User tool to assist Dropbox Business Administrators in managing their Dropbox team,,38
523,https://github.com/f5io/bonobo-js.git,A work-monkey to do your dirty business.,,38
524,https://github.com/artkonekt/appshell.git,"AppShell is an extensible Laravel Business Application boilerplate with Admin, Acl, Users & Clients","laravel,laravel5,laravel-package,laravel-admin,businessapp,acl,laravel5-backend",38
525,https://github.com/almost-full-stack/graphcraft.git,Rapildy build and extend GraphQL API based on Sequelize models. This library helps you focus on business logic while taking care of GraphQL schema automatically.,"sequelize-graphql-schema,sequelize-models,sequelize,graphql-js,graphql,microservices,serverless,sequelize-model",38
526,https://github.com/naman03malhotra/match-rules.git,A tiny 1kB zero dependency JavaScript utility that lets you write your conditional business logic in a declarative way  (React like).,"declarative,declarative-programming,complex-rules,complex-conditions,conditional-statements,if-else,react,reactjs,npm-module,if-else-refactoring,imperative-programming,imperative,javascript-utility",38
527,https://github.com/JustinBeckwith/go-yelp.git,"go-yelp is a #golang wrapper for the Yelp REST API.  It lets you do all kinds of interesting things like searching for businesses, getting user comments and ratings, and handling common errors.  The library is written Go.",,38
528,https://github.com/dimichgh/oja.git,"Structure your application business logic - lightweight pub/sub module with event backlog, timeout support that maps events to promises and back as well as chains them to other topics.",,38
529,https://github.com/doniyor2109/redux-lightweight.git,"Write one business logic instead of writing actions, action types and reducers","react,redux,reducer,action",38
530,https://github.com/pubnub/open-growth.git,"Open Growth - grow your business 10x by automating tedious workforce tasks with machines - rules-based ""customer delighter"" with MonkeyLearn ML/AI enriched customer profile building.  A framework for Developers capable of delighting your customers with template generated multi-channel messages in realtime.",,38
531,https://github.com/melvinchng/business-jekyll-theme.git,Business Jekyll Theme for your business,"jekyll-themes,jekyll,business-solutions,ruby,theme,business-service,office,bootstrap3-theme,bootstrap",37
532,https://github.com/SAP-archive/HANAVora-Extensions.git,Spark extensions for business contexts,open-source,37
533,https://github.com/yogeshsd/query2report.git,Query2Report is a simple open source business intelligence platform that allows users to build report/dashboard for business analytics or enterprise reporting,"reporting-engine,web-application,reporting-services,autorefresh,reporter,google-charts,lightweight,easy-to-use,web-based,business-intelligence,reporting-tool,report-generator,report-portal,statistical-analysis",37
534,https://github.com/rafalrozmus/java-and-sap-business-one.git,Examples on how to use Java with SAP Business One SDK,,37
535,https://github.com/suoko/spfilezilla.git,SPfilezilla - access document library and onedrive for business ,,37
536,https://github.com/EricFreeman/GiantShaftEnterprises.git,Incremental idle game about building businesses and mining asteroids....and maybe conquering the galaxy along the way.,"cookie-clicker,angularjs,javascript,game,idle-game,incremental-game,clicker-game",37
537,https://github.com/tdowd/excel-geocoder.git,"{""A VBA application for geocoding and reverse geocoding in Excel. Supports both Google's free and enterprise for business geocoder (Maps API for Work).""}",,37
538,https://github.com/mara/mara-schema.git,"Mapping of DWH database tables to business entities, attributes & metrics in Python, with automatic creation of flattened tables","metadata,datawarehousing,python,data-governance,data-modeling",37
539,https://github.com/microsoft/Industry-Accelerator-FinancialServices.git,"Dynamics 365 is releasing Industry Accelerators to enable ISVs, SIs and Partners to rapidly build industry focused solutions on top of our Business Application and Intelligence Platforms. These accelerators are created through a close partnership with internal Product , Sales, Service, Marketing, Field and Vertical Teams, with feedback from external industry SI, ISV and Partners. Here you will find samples and guidance on how to build and extend your industry solution on the Dynamics 365 Business Application and Intelligence platforms using our industry accelerators. Samples will also include cross product implementations with Azure, Office 365, Power BI, LinkedIn, Teams and other on-premise and cloud based implementations.",,37
540,https://github.com/emblemicons/emblemicons.github.io.git,"An open-source free to use library of 1000+ most commonly and frequently used icons in product development, product design, business presentations, and academic projects. You are completely free to use and download the icons for your personal and business requirements.","icons,iconset,iconography,freeicons,figma",37
541,https://github.com/PowershellScripts/SharePointOnline-ScriptSamples.git,"Over 260 scripts for SharePoint Online (SPO), OneDrive for Business, and SharePoint Server. The samples fix issues, provide reports and extra settings not available via UI. The scripts use Powershell, C#, CSOM and REST.  They include copies of existing scripts from Technet Gallery years 2013-2019.     >>>    Scroll down to see the full index","sharepoint-online,sharepoint-2016,powershell,powershell-script,csharp,office-365,office365",37
542,https://github.com/Nooul/ra-component-factory.git,"ra-component-factory when used with http://github.com/marmelab/react-admin provides a centralized way to easily configure visibility and permissions related business logic, including access to forms/views, visibility/immutability of resource fields/inputs, reordering of elements based on role and handling of tabbed views/forms",,37
543,https://github.com/tomorgan/SkypeWebSDKSamples.git,Skype for Business Web SDK Samples,,36
544,https://github.com/nuxeo/onedrive-java-client.git,Java client for OneDrive & OneDrive for Business,,36
545,https://github.com/laminas/laminas-form.git,"Validate and display simple and complex forms, casting forms to business objects and vice versa",hacktoberfest,36
546,https://github.com/mmahmoodictbd/production-ready-microservices-starter.git, Production Ready Microservices Starter gonna give you basic microservices which are common in all businesses. Best thing is - all microservices are multitenant.,"microservices,java,spring-boot,spring-cloud,ready-made-microservice,multi-tenant",36
547,https://github.com/JustinBeckwith/YelpSharp.git,"YelpSharp is a .NET wrapper for the Yelp REST API.  It lets you do all kinds of interesting things like searching for businesses, getting user comments and ratings, and handling common errors.  The library is written in C#, and available on NuGet.   ",,36
548,https://github.com/sharmaroshan/Data-Visualizations.git,"Data Visualizations is emerging as one of the most essential skills in almost all of the IT and Non IT Background Sectors and Jobs. Using Data Visualizations to make wiser decisions which could land the Business to make bigger profits and understand the root cause and behavioral analysis of people and customers associated to it. In this Repository I have deeply discussed about Line Plots, Bar plots, Scatter Plots, and Pie Charts, Apart from that I have Discussed scientific plots, 3d plots, animated plots, interactive plots to visualize any kind of business problem and that too of any complexity.","seaborn,seaborn-tutorial,plotly,plotly-express,plotly-python,ipywidgets,bubbly,python,jupyter-notebook,data-visualization,data-science,data-analysis,business-intelligence,business-analysis",36
549,https://github.com/getgrav/grav-theme-ceevee.git,"Ceevee is a clean, modern, fully responsive site template for your resume and portfolio. With this template, you can easily introduce yourself and showcase your works to future clients and employers. Also, it is flexible and easy to customize so you even use this template as a creative, business or portfolio site for your company.","grav,grav-theme",36
550,https://github.com/Instadapp/InstaContract.git,Smart contracts comprising the business logic of the InstaDApp,"truffle,moat-contract,ganache,kyber,makerdao",35
551,https://github.com/NateWr/business-profile.git,"{""WordPress plugin to display your business's contact details with seo-friendly Schema.org markup.""}",,35
552,https://github.com/aslakknutsen/arquillian-showcase.git,"Arquillian enables you to test your business logic in a remote or embedded container. Alternatively, it can deploy an archive to the container so the test can interact as a remote client.",,35
553,https://github.com/sighalt/logdecorator.git,Move logging code out of your business logic with python decorators.,"logging,clean-code,logging-library,python",35
554,https://github.com/spoman007/reactXstarter.git,React + Redux + React Native Starter Kit with reusable business logic. Sample TODO app built in.,"react,react-native,redux,cross-platform,starter-kit,boilerplate",35
555,https://github.com/ChristianWeyer/myProducts-End-to-End.git,"A modern business application with HTML5, JavaScript & .NET: sample secure master-detail application with AngularJS, ASP.NET Web API, SignalR. Uses Cordova/Phonegap and node-webkit (nw.js).",,35
556,https://github.com/tangshuang/nautil.git,Nautil.js is a javascript framework for building cross-platform business system applications based on React.,"javascript-framework,react,react-native",35
557,https://github.com/moqui/HiveMind.git,"HiveMind is a project management and ERP application for services organizations. It features project/task management, request tracking, time tracking, expenses, invoices/payments, general ledger, and content management (wiki). HiveMind is based on Moqui Framework, Mantle Business Artifacts, and Simple Screens.","moqui,moqui-framework,hivemind,erp,erp-application,service,professional-services,project-management,request-management,accounting,billing,general-ledger,payment,wiki",35
558,https://github.com/wilsonfreitas/python-bizdays.git,Business days calculations and utilities,,34
559,https://github.com/BlackMirrorz/ARKitBusinessCard.git,A Basic Example Creating An Interactive Business Card In ARKit2.,"arkit,arkit2,swift4,ios,scenekit",34
560,https://github.com/Sintattica/atk.git,Object-oriented full-stack PHP framework for developing business-oriented web applications,,34
561,https://github.com/vrajroham/laravel-bitpay.git,Laravel BitPay Client | Accept Bitcoin(Ƀ) and Bitcoin Cash for your business with your Laravel application,,34
562,https://github.com/iCircle/docxTemplateInPHP.git,Create Templates in MS Word docx format and use them Creating Business documents using PHP ,,34
563,https://github.com/buckhx/diglet.git,Your friend in the tile business,,34
564,https://github.com/webpixels/quick-free-bootstrap-theme.git,"Free Bootstrap 4 Theme perfect for building responsive, mobile-first projects on the web suitable for businesses, startups, and agencies.","bootstrap4,bootstrap-theme,freebie,responsive,website,template,theme,design-system,ui-components,uikit,free-bootstrap-theme",34
565,https://github.com/Borderless360/django-logic.git,Django Logic - easy way to implement state-based business logic with pure functions,"python,django,fsm,workflow,workflow-diagram,django-rest-framework,django-logic,transition",34
566,https://github.com/tsuruoka-lab/BSD.git,The Business Scene Dialogue corpus,"corpus,machine-translation,japanese,english,document-aligned,annotated-corpora,parallel-corpora,parallel-corpus",34
567,https://github.com/Xer0Dynamite/Pangaia.git,Operating System for the Creative Economy (and AI).  For use with http://wiki.hackerspaces.org/User:Average/Business_Plan,"python,hackerspaces,world-game,artificial-intelligence,social-justice",34
568,https://github.com/jmstfv/open-expenses.git,A curated list of (private) businesses publicly sharing their expenses.,"business,expenses,transparency,revenue,open-expenses,cost-estimation,accounting,bookkeeping,open-startup,startups,startup",34
569,https://github.com/exploitagency/PCB-Business-Card.git,"My open source \'business card"" is an ATtiny85 development board utilizing a credit card form factor to easily fit into a wallet. It types out my contact info when a capacitive touch sensor is activated.",,34
570,https://github.com/lukas-reineke/meishi.git,"This is my business card, as well as a QMK powered macro keyboard.",,34
571,https://github.com/jessesquires/delete-uber.git,"""There is no place for ethics in this business sweetheart."" — a list of news articles (with excerpts) on Uber.",uber,34
572,https://github.com/sajjad-021/Telegram-Marketing-Software.git,"how-to-extract-contacts-from-telegram-group, extract-telegram-group-members, TELEGRAM+SCRAPER+PYTHON, Telegram_auto_reply, Telegram_marketing_tools, Telegram_export, telegram-advertising-software, Export_telegram_group_members, Telegram Scraper Bot, Telegram_bulk_sender, telegram-auto-reply, Telegram_bulk_message_sender, Get Telegram Channel Members, telegram-scraper-python, Advertise_telegram_group, export-telegram-users, Telegram Scraper, Advertise Telegram Group, how-to-backup-telegram-channel, TELEGRAM+AUTO+REPLY, Telegram Business Groups, Telegram Advertising Software, Telegram_marketing_software, Import Export Telegram Group, scrape-telegram-channel-python, Telegram Bulk Message Sender, TELEGRAM+BULK+MESSAGE+SENDER+2018, Export_telegram_users, Export_telegram_channel, EXPORT+TELEGRAM+CHANNEL, GET+TELEGRAM+CHANNEL+MEMBERS, TELEGRAM+BULK+SENDER, TELEGRAM+USERNAME+SCRAPER, TELEGRAM+BULK+MESSAGE+SENDER, Scrape Telegram Channel, TELEGRAM+USERNAME+LIST, Telegram_advertising, Telegram_advertising_software, Telegram_marketing_group, HOW+TO+EXTRACT+CONTACTS+FROM+TELEGRAM+GROUP, EXPORT+TELEGRAM+USERS, Telegram_group_scraper, Telegram Bulk Message Sender 2018, telegram-bulk-message-sender, telegram-username-list, Telegram_chat_download, export-telegram-chat, How_to_add_members_in_telegram_channel, Telegram_marketing, Telegram_business_groups, Export Telegram Chat, HOW+TO+SEE+GROUP+MEMBERS+IN+TELEGRAM, Export Telegram Data, Export_telegram_chat, how-to-see-telegram-channel-members, telegram-bulk-message-sender-2018, Telegram Sender, TELEGRAM+GROUP+SCRAPER, Telegram Marketing, export-telegram-group-members, telegram-advertising, How To See Telegram Channel Members, get-telegram-channel-members, Telegram Username List, Telegram_scraper_python, How_to_see_group_members_in_telegram, Export Telegram Group Members, IMPORT+EXPORT+TELEGRAM+GROUP, TELEGRAM+MARKETING+GROUP, telegram-scraper, ADVERTISE+TELEGRAM+GROUP, telegram-scraper-bot, export-yammer-group-members, Scrape_telegram_channel_python, Telegram_sender, HOW+TO+BACKUP+TELEGRAM+CHANNEL, Telegram Advertising, HOW+TO+ADD+MEMBERS+IN+TELEGRAM+CHANNEL, How_to_extract_contacts_from_telegram_group, Telegram_username_list, telegram-export, TELEGRAM+CHAT+DOWNLOAD, telegram-marketing-group, EXPORT+TELEGRAM+DATA, telegram-business-groups, EXTRACT+TELEGRAM+GROUP+MEMBERS, Telegram Bulk Sender, TELEGRAM+MARKETING+TOOLS, EXPORT+TELEGRAM+GROUP+MEMBERS, TELEGRAM+BUSINESS+GROUPS, Extract Telegram Group Members, telegram-bulk-sender, telegram-chat-download, Import_export_telegram_group, How To Extract Contacts From Telegram Group, import-export-telegram-group, TELEGRAM+SCRAPER+BOT, SCRAPE+TELEGRAM+CHANNEL, telegram-group-scraper, EXPORT+TELEGRAM+CHAT, Telegram Group Scraper, TELEGRAM+ADVERTISING+SOFTWARE, TELEGRAM+MARKETING+SOFTWARE, Export Telegram Users, Export_yammer_group_members, telegram-sender, Telegram Scraper Python, Telegram_username_scraper, Extract_telegram_group_members, SCRAPE+TELEGRAM+CHANNEL+PYTHON, Scrape_telegram_channel, Export_telegram_data, Telegram_scraper_bot, telegram-blaster-download, advertise-telegram-group, How To Backup Telegram Channel, export-telegram-channel, Export Yammer Group Members, how-to-see-group-members-in-telegram, How_to_backup_telegram_channel, how-to-add-members-in-telegram-channel, Scrape Telegram Channel Python, Telegram_scraper, scrape-telegram-channel, telegram-username-scraper, telegram-marketing, TELEGRAM+SCRAPER, TELEGRAM+BLASTER+DOWNLOAD, Telegram Marketing Tools, How To See Group Members In Telegram, Telegram_blaster_download, EXPORT+YAMMER+GROUP+MEMBERS, Telegram Export, Telegram Blaster Download, TELEGRAM+MARKETING, telegram-marketing-software, Telegram Marketing Software, Telegram Chat Download, Telegram Auto Reply, TELEGRAM+ADVERTISING, Telegram Username Scraper, TELEGRAM+SENDER, How_to_see_telegram_channel_members, Telegram_bulk_message_sender_2018, Export Telegram Channel, HOW+TO+SEE+TELEGRAM+CHANNEL+MEMBERS, TELEGRAM+EXPORT, Get_telegram_channel_members, telegram-marketing-tools, export-telegram-data, Telegram Marketing Group, How To Add Members In Telegram Channel","extract-telegram-group-members,telegram-advertising-software,telegram-scraper-bot,telegram-auto-reply,export-telegram-users,telegram-bulk-message-sender,telegram-scraper,telegram-export,telegram-marketing-group,telegram-business-groups,telegram-bulk-sender,import-export-telegram-group,telegram-group-scraper,telegram-sender,advertise-telegram-group,telegram-username-scraper,telegram-marketing,telegram-marketing-tools,export-telegram-group-members,telegram-advertising",34
573,https://github.com/aws-samples/amazon-lex-bi-bot.git,Build a Conversational Business Intelligence Bot with Amazon Lex,,33
574,https://github.com/synrc/form.git,🧾 FORM: Business X-Forms,"x-forms,meta",33
575,https://github.com/Breeze/temphire.angular.git,A comprehensive business application example with Angular and Breeze,,33
576,https://github.com/StretchShop/StretchShop.git,Fast & scalable e-business solution,"ecommerce-shopping-solution,nodejs,moleculer-framework,microservices-application,ecommerce,javascript",33
577,https://github.com/martonsagi/al-object-designer.git,AL Object Designer for Dynamics 365 Business Central development,,33
578,https://github.com/shaper/yelp.git,A Ruby interface to the Yelp Developer API for searching local business information.,,33
579,https://github.com/iteles/Book-notes.git,:books: Notes on various technology & business books,,33
580,https://github.com/johnoneil/arib.git,Japan Association of Radio Industries and Businesses (ARIB) MPEG2 Transport Stream Closed Caption Decoding Tools,,33
581,https://github.com/msgphp/domain.git,A dependency-free package to help building a business domain layer,"domain-driven-design,symfony,doctrine,message-driven,uuid,cqrs,event-sourcing,cli,php,php7,api-platform",33
582,https://github.com/jama5262/MPESA-Biz-No-Detector.git,An android detection library that uses Azure Computer Vision Read API to detect MPESA business and/or account numbers from images,"azure,mpesa,android-library,object-detection-and-tracking,kotlin,android-detection-library",33
583,https://github.com/camptocamp/oerpscenario.git,Business Driven Development (BDD) for OpenERP/Odoo,,32
584,https://github.com/wilsonfreitas/R-bizdays.git,Business Days Calculations and Utilities,"holidays,business-days,bizdays,cran,calendar,market-calendar",32
585,https://github.com/azach/rules.git,"Dynamic, Active-Record based business rules engine",,32
586,https://github.com/ajmanser/Yelp.git,AI generated reviews to help local businesses!,,32
587,https://github.com/ViennaAdvantage/ERP-CMR-DMS.git," A business-level ERP with DMS and CRM, copy of VIENNA Advantage",,32
588,https://github.com/martinsson/Refactoring-Kata-Lift-Pass-Pricing.git,"{""A refactoring kata where you'll practice disentangling business logic from frameworks and SQL""}",,32
589,https://github.com/imairi/RIBsTreeMaker.git,Visualize RIBs business logic,"ios,ribs,mindmap,swift",32
590,https://github.com/nathanhere/Excel-VBA-Data-Functions.git,"Excel VBA Functions Package for Business Data Analysts. VBA has a reputation among some for being a ""step child"" programming language, however it enables practitioners to deliver real value to their local business units quickly. ","excel,vba,vba-functions,analytics",32
591,https://github.com/OfficeDev/Property-Inspection-Code-Sample.git,[ARCHIVED] The Property Management Code Sample demonstrates how to create a line of business system with Office 365 and mobile technologies.,,32
592,https://github.com/hopsor/open_hours.git,Time calculations using business hours,"elixir,datetime,holidays,business-hours,time",32
593,https://github.com/ezefranca/brazil-ios-utils.git,🇧🇷 Utils libraries for specific use cases / business in Brazil,"brazil,swift-wrapper,cpf",32
594,https://github.com/jangorecki/dwtools.git,"Data Warehouse, Business Intelligence, data integration helpers. Unifies database connectors to DBI, RJDBC, RODBC, csv. Easy managing multiple simultaneous db connections. MDX like queries on cube class object. Data modelling helpers, denormalization of star schema and snowflake schema, basic normalization. And more.",,32
595,https://github.com/heloufir/security-starter.git,"Security starter is a full implementation of laravel/passport and heloufir/simple-passport, containing all the implementations of the authentication and forgot password systems, which allows you to start your project from a good foundation, and only worry about the business logic of your application.","laravel,laravel-passport,middleware",32
596,https://github.com/PressMaximum/customify.git,Super-Awesome Multi-Purpose Business WordPress Theme,,31
597,https://github.com/qos-ch/logback-audit.git,For logging events which have long-term business significance.,,31
598,https://github.com/sverraest/revolut-php.git,💳 PHP Bindings for the Revolut Business API,"revolut,php,php7,api,api-client",31
599,https://github.com/redhat-cop/businessautomation-cop.git,"All examples related with business automation process such as jbpm, drools, optaplanner, kogito, quickstart, pipelines, etc.",,31
600,https://github.com/uicardioHQ/hugo-lime.git,Hugo Lime is a business theme for GoHugo by https://uicard.io,"hugo,hugo-theme,gohugo,business-theme,html5,css3,bootstrap4,bootstrap-4,bootstrap-theme,bootstrap-template",31
601,https://github.com/matholroyd/bps.git,"Free, automated bitcoin payment processor, to help anyone pay you or your business. Can run BPS for free on Heroku.",,31
602,https://github.com/MickeyUK/places-scraper.git,An example of how to use Google Places and Hunter.io to quickly collate business contact details.,"google-maps,google-maps-api,scraper,scrape-email,business,business-solutions,marketing,email-marketing,hunterio,hunter,csv,javascript,html,places-scraper,databases,markers,promotion,campaign",31
603,https://github.com/OleksandrKucherenko/binding-tc.git,AEB - Android Easy Binding. Android View properties binding to the Business Objects (known as POJO).,,31
604,https://github.com/szilard/teach-data-science-msc-analytics-ceu.git,Materials for a short introductory/intermediate Data Science course taught in the MSc in Business Analytics program at the Central European University,,31
605,https://github.com/moqui/mantle.git,"This is the old Mantle Business Artifacts repository which has been split into one repository per component. See mantle-udm, mantle-usl, mantle-edi, mantle-oagis, mantle-ubpl, and AuthorizeDotNet",,31
606,https://github.com/efpiva/dover.git,A development Framework for SAP Business One,,30
607,https://github.com/tallguyjenks/BusinessCard.git,💳 My curl-able business card,"business-card,businesscard,curl,terminal,cli,sh,shell,bash,command-line,command-line-business-card,bryan-jenks",30
