,Url,Description,Topics,Stars
302,https://github.com/volontariat/voluntary_proposition.git,Product for crowdsourcing plattform engine voluntary about proposition development process with delegated voting system (Liquid Democracy),,2
303,https://github.com/GSA/Crowdsource-Testing-Federal-Crowdsourcing-and-Citizen-Science-Toolkit_8-2015.git,Artifacts from the 8/2015 Federal Crowdsourcing and Citizen Science Toolkit Crowdsource Compatibility Test-cycle,,2
304,https://github.com/idigbio-citsci-hackathon/CrowdConsensus.git,Tool for reaching consensus on crowdsourced transcriptions and to minimize the number of workers needed by crowdsourcing tasks,,2
305,https://github.com/roadkilltaiwan/CrowdsourcingDataHandle.git,The repo is used to pool the source codes for handling the crowdsourcing data from Roadkill interest group on Facebook. ,,2
306,https://github.com/jbrekle/jbrekle-master-thesis.git,Leveraging the Crowdsourcing of Lexical Resources for Bootstrapping a Linguistic Data Cloud. Flexible RDF data extraction from Wiktionary.,,2
307,https://github.com/ChineseYjh/RAF-DB-baselines.git,Codes without DATA for Paper: Reliable Crowdsourcing and Deep Locality-Preserving Learning for Expression Recognition in the Wild,,2
308,https://github.com/tomfong/fyp-trackify-overview.git,"CSE Final Year Project - ""Dementia Patients Anti-Wandering System using Mobile Crowdsourcing"", namely Trackify, of HKUST in 2019-2020.","dementia-patients,ibeacon",2
309,https://github.com/volontariat/voluntary_music_metadata_enrichment.git,Music metadata enrichment product for crowdsourcing engine voluntary. Also adds a discography data model sync system to every Rails app.,,2
310,https://github.com/2dshapesstructure/2dshapesstructure.github.io.git,"On this web page, we present the 2D Shape Structure database, a public, user-generated dataset of 2D shape decompositions into a hierarchy of shape parts with geometric relationships retained. It is the outcome of a large-scale user study obtained by crowdsourcing, involving over 1200 shapes in 70 shape classes, and 2861 participants. ",,2
311,https://github.com/johnsonsirv/famous-poet.git,"A crowdsourcing MVP to store collections of poems and songs from poets across several languages, helping to transfer oral traditions and immortalizing eventful memories.","mvp,sprint-challenge",2
312,https://github.com/aburnap/JMD2015-When-Crowdsourcing-Fails.git,Code repository for replicating 2015 ASME Journal of Mechanical Design Paper - When Crowdsourcing Fails: A Study of Expertise on Crowdsourced Design Evaluation,,2
313,https://github.com/ZC-Wei/od3n.git,"On-Demand Dynamic Delivery Network (OD3N) is a platform that aim to providing a flexible, effective, intelligent, low-cost same-city delivery service. With crowdsourcing, OD3N try to find out an affordable delivery solution for small and medium business and provide a good delivery experience for public.",,2
314,https://github.com/cacois/learntonode.git,"LearnToNode: The Repo is the live development of the Node.js web app behind learntonode.com. The site learntonode.com will be dedicated to crowdsourcing and sharing high-quality tutorials, examples, and learning resources for aspiring Node.js developers. The development of the learntonode.com web app will be used to develop thorough tutorials on web development with Node.js.",,2
315,https://github.com/cartologic/cartoview_geo_observation.git,"Users can submit new reports, review existing reports, and comment and vote on reports or observations submitted by other users. They can track the status of problems or observations they have reported.  Field observations and mobile data collection, whether by professional monitoring staff or by volunteers in e.g. citizen science and mobile crowdsourcing projects. Field observations app is also useful as a platform for building a variety of mobile-first websites and CRUD applications.Allows users to submit problems or observations.  The application has been optimized for smartphones but is responsively designed to be used on smartphones, tablets, and desktop computers.","cartoview,observation",2
316,https://github.com/turnkeylinux-apps/ushahidi.git,Ushahidi - Crowdsourcing Crisis Information,,1
317,https://github.com/avwave/taskhive.git,Open and distributed p2p crowdsourcing internet marketplace in Java,,1
318,https://github.com/cicadas-2014/percolator.git,"Crowdsourcing problem solving, coffeeshop style",,1
319,https://github.com/ubriela/geocrowd-dp.git,Protecting location privacy of workers and requesters in spatial crowdsourcing,,1
320,https://github.com/RiceNBean/shufflebug.git,A crowdsourcing music playlist building app for events and public spaces.,,1
321,https://github.com/acdh-oeaw/wugsy.git,Crowdsourcing language data,,1
322,https://github.com/uw-biomedical-ml/segmentations.git,Crowdsourcing web interface to distribute imaging segmentation tasks,"segmentations,crowdsourcing,image-analysis,html5-canvas,html5",1
323,https://github.com/Abbe98/bildplats.git,Georeferencing historical images with crowdsourcing. ,"k-samsok,raa-collection,soch",1
324,https://github.com/dair-iitd/octopus.git,Octopus: Cost-Quality-Time Optimization in Crowdsourcing,,1
325,https://github.com/thsneumann/fahrkartentool.git,Crowdsourcing-Tool for the historical tickets collection of the German Museum of Technology (Deutsches Technikmuseum),,1
326,https://github.com/github-vet/bots.git,"{""Bots for running analysis on GitHub's public Go repositories and crowdsourcing their classification.""}","go,range-loop-capture,static-analysis,crowd-sourcing,github-api",1
327,https://github.com/cakefm/crowd_task_manager.git,"A system to create, schedule and distribute crowdsourcing tasks",,1
328,https://github.com/basbeu/theSofties.git,"It is an Android application that revolves around facilitating helping out other people. This is done by crowdsourcing the principle if I help you, you owe me.",,1
329,https://github.com/fida1989/forest-watch.git,An Android App to monitor deforestation and other natural/man-made events that are harming forests via crowdsourcing. (MobioApp Limited),,1
330,https://github.com/even-eeek/crowdsourcing-python.git,crowdsourcing python,,1
331,https://github.com/alexandr-s/django-crowd.git,crowdsourcing demo,,1
332,https://github.com/jaredscheib/tagasauris.git,Crowdsourcing Platform,,1
333,https://github.com/EricHamby/taylorapp.git,CrowdSourcing Groceries And More,,1
334,https://github.com/zhenghuihu2019/TopCoder-Data-Management.git,"TopCoder, Crowdsourcing, Data",,1
335,https://github.com/matt-jh/remnants.git,Crowdsourcing the remnants report,,1
336,https://github.com/NicWickman/Sozu.git,Decentralized on-chain crowdsourcing.,,1
337,https://github.com/kumekay/kune.git,Simple crowdsourcing news engine ,,1
338,https://github.com/kronion/Pickup.git,Crowdsourcing your errands,,1
339,https://github.com/brzonsea/Crowdsource-project.git,CS492 Crowdsourcing Group Project ,,1
340,https://github.com/rainble/crowdsourcing_client.git,crowdsourcing android client,,1
341,https://github.com/anhmiuhv/crowdsourcing-on-ethereum.git,Simple Ethereum Crowdsourcing contract ,"ethereum,solidity,blockchain,crowdsource",1
342,https://github.com/asm-products/autank.git,Crowdsourcing operating expenses,,1
343,https://github.com/tnunamak/art-we-all.git,An art-crowdsourcing experiment,,1
344,https://github.com/nka11/alternative-crowding.git, crowdsourcing alternative energy solutions,,1
345,https://github.com/roselynemakena/narrow.git,A crowdsourcing plateform,,1
346,https://github.com/MuckRock/whitewash.git,A prototype crowdsourcing application,,1
347,https://github.com/tohach/crowdbook.git,crowdsourcing book landing,,1
348,https://github.com/nikolozka/Move.Project.git,Crowdsourcing Running App,,1
349,https://github.com/corollari/tarkasti.git,Crowdsourcing fact-checking,"dapp,ethereum,fact-checking,twitter-bot",1
350,https://github.com/mtaptich/govlab30.git,Crowdsourcing climate change solutions,,1
351,https://github.com/Parkinglot/parkinglot.git,Freed - Crowdsourcing parking,,1
352,https://github.com/MichalBryxi/casosberne.cz.git,Crowdsourcing time-lapse videos.,,1
353,https://github.com/mrcoven94/scholarfund.git,Crowdsourcing scholarship generation,,1
354,https://github.com/renisalcedo/H23-PennAppsXVI.git,Crowdsourcing Emergency Data,,1
355,https://github.com/saeedizadi/Sal_AD.git,Saliency Aggregation Using CrowdSourcing Techniqes,,1
356,https://github.com/danielchawla/urban_crowdsourcing.git,MVP of urban crowdsourcing platform,,1
357,https://github.com/LemonaInc/Zorcely.git,A crowdsourcing platform front end,,1
358,https://github.com/Mortimerp9/CondoSol.git,a local issue crowdsourcing platform,,1
359,https://github.com/ConnorChristie/diagnosis-colony.git,Crowdsourcing Time & Funds for Research,,1
360,https://github.com/tkirchgessner/cs.git,Crowdsourcing app first run-through,,1
361,https://github.com/aankita1/SpeakAhead.git,Crowdsourcing User Responses on MTurk,,1
362,https://github.com/caretcaret/doodlearn.git,Crowdsourcing animated drawings for education.,,1
363,https://github.com/bijilap/CollabParking-CSPServer.git,Crowdsourcing part of CollabParking project,,1
364,https://github.com/CSIR2011/csir2011.github.com.git,Crowdsourcing for Information Retrieval 2011,,1
365,https://github.com/JSsquare/AlertsMall.git,aFoodie.Me :: Crowdsourcing Food Reviews,,1
366,https://github.com/sandbox/melaknowma.git,small crowdsourcing melanoma diagnosis app,,1
367,https://github.com/codenameyau/weather-flux.git,Crowdsourcing real-time weather updates,,1
368,https://github.com/abenrob/CrowdMapApp.git,Backlift-powered geo-crowdsourcing app,,1
369,https://github.com/eeezyy/CompanyTrends.git,Crowdsourcing application which crawls Yahoo! Finance News articles and creates task to the mock crowdsourcing platform.,,1
370,https://github.com/nqvhung/multiagg.github.io.git,Multi-Label Answer Aggregation for Crowdsourcing,,1
371,https://github.com/lang-uk/vulyk-ner.git,"NER tagging plugin for Vulyk, crowdsourcing framework",,1
372,https://github.com/stevenc81/beamitfast.git,[Archived] Same-day delivery with crowdsourcing,,1
373,https://github.com/giginet/LeDA.git,Level Design Assistant System via Crowdsourcing,,1
374,https://github.com/liua13/OpenStreets.git,Crowdsourcing platform to post issues on map,,1
375,https://github.com/BigRedT/crowdsource.git,Graphical Models and EM for Crowdsourcing,,1
376,https://github.com/v-ramachandran/athena-crowd.git,Crowdsourcing interaction scripts for the Athena project.,,1
377,https://github.com/amydoesntlai/amnesia.git,Crowdsourcing mnemonic devices to remember vocabulary.,,1
378,https://github.com/rastermanden/happymap.git,Crowdsourcing the happiness of the world,,1
379,https://github.com/stefanodecillis/TIW_peaks_validation_platform.git,CrowdSourcing Platform for mountain peaks - Web App ,,1
380,https://github.com/AlexanderPease/email-waze.git,"{""Crowdsourcing the internet's white pages""}",,1
381,https://github.com/kateflood/bikewithus.git,Crowdsourcing the best bike routes around town,,1
382,https://github.com/jesand/crowds.git,Crowdsourcing tools and algorithms in golang.,,1
383,https://github.com/josh-works/block_value.git,Crowdsourcing Parking data (and other things),,1
384,https://github.com/mispy/redballoon.git,Distributed crowdsourcing recruitment for Helix Nanotechnologies,,1
385,https://github.com/XLab-Tongji/crowdsourcing-mart-front.git,the crowdsourcing mart front end project.,,1
386,https://github.com/lilannie/StudyShare.git,Web App for Crowdsourcing Educational Material,,1
387,https://github.com/empatwi/crowdsourcing-api.git,API back-end da plataforma de Crowdsourcing,"python,flask-restful,pymongo,mongodb",1
388,https://github.com/octolabs/capitalbikeshare-web.git,Capital Bikeshare new stations location crowdsourcing,,1
389,https://github.com/bxm156/BioCrowd.git,A Hierarchal Crowdsourcing Platform for Metabolic Networks,,1
390,https://github.com/Ekula/uSquam_backend.git,The back-end of our crowdsourcing platform,,1
391,https://github.com/genagl/shmapper.git,"The shMapper plugin allows you to create simple crowdsourcing maps on OpenStreet Maps with an option of feedback messages form. This plugin gives you an alternative to current online map services such as Yandex.Maps, Google Maps etc which don’t provide the option for users to add new objects.","wordpress-plugin,openstreetmap,yandex-maps,wordpress,leaflet,leafletjs,osm",1
392,https://github.com/aslawson/Teller.git,The automated teller human.  Crowdsourcing the ATM.,,1
393,https://github.com/nherment/lesa-recover.git,Disaster management SMS crowdsourcing web application,,1
394,https://github.com/ztl8702/CrowdSource.git,Crowdsourcing coordination and state management tool,"crowdsource,aspnet-core,orleans",1
395,https://github.com/volontariat/voluntary_recruiting.git,Recruiting plugin for crowdsourcing management system voluntary,,1
396,https://github.com/dollygupta/CrowdSourcing.git,Traffic management for emergency vehicles using crowdsourcing,,1
397,https://github.com/richtermondt/inithub-web.git,Django-based web application for crowdsourcing innovation,,1
398,https://github.com/brianjhaller/spotifyShare.git,React Native application for crowdsourcing a playlist,,1
399,https://github.com/LucDoh/CrowdRank.git,Crowdsourcing product recommendations using NLP and Reddit.,,1
400,https://github.com/linyifei-6/DCrowd.git,A Trusted CrowdSourcing Systerm Based 0n BlockChain,,1
401,https://github.com/MediaComem/smapshot-api.git,API behind the crowdsourcing platform smapshot,,1
402,https://github.com/mayhewsw/crowdsourcing.git,Crowdsourcing project for IE598 Graphical Models ,,1
403,https://github.com/vanxining/RecSys.git,A recommendation system for software crowdsourcing platforms.,"recsys,crowdsourcing-platforms",1
404,https://github.com/AlessandroChecco/ModOp.git,Javascript tool to help crowdsourcing form design,,1
405,https://github.com/alexberger01/CrowdsourcingTemplate.git,website template for all crowdsourcing projects,,1
406,https://github.com/Rideshare/rideshare20.git,Crowdsourcing vanpools and carpools. Connect.Commute.Conserve,,1
407,https://github.com/octolabs/circulator-planning.git,Crowdsourcing DC Circulator future growth plan,,1
408,https://github.com/Historypin/metadatacrowdsourcing.git,documentation and code for metadata crowdsourcing projects,,1
409,https://github.com/j2abro/crowdsec.git,Experiment in crowdsourcing security risk within organizations,,1
410,https://github.com/BryceTsui/CrowdSourcingPlatform.git,Team Work of Course - CrowdSourcing Platform,,1
411,https://github.com/hughhan1/HopSA.git,Event crowdsourcing platform built using MEAN stack.,,1
412,https://github.com/ahmetkizilay/boycott-api.git,a RESTful API for crowdsourcing boycotted venues,,1
413,https://github.com/bioops/CrowdNodNet.git,Crowdsourcing nodulation gene network in Lotus japonicus,,1
414,https://github.com/janetyc/writingfeedback.git,a crowdsourcing project for collecting writing feedback,,1
415,https://github.com/EmilyKJamison/Crowdsourcing.git,Projects related to NLP annotation via crowdsourcing.,,1
416,https://github.com/elexis-eu/CrossTheWord.git,Crowdsourcing Module part 2 (Crossword app) ,,1
417,https://github.com/ryjo1026/footprints.git,A PWA for crowdsourcing path obstructions,,1
418,https://github.com/phouse512/crowdsource-refactor.git,A crowdsourcing prototype built in Python and Flask ,,1
419,https://github.com/gmathiou/shuttler.git,iOS app for crowdsourcing shuttle buses arrival time ,,1
420,https://github.com/shanselman/Hanselminutes-Images.git,Images from the Hanselminutes Podcast. Crowdsourcing to complete.,,1
421,https://github.com/adamantivm/railwatch.git,Detect train schedule delays through computer vision and crowdsourcing,,1
422,https://github.com/OTT21C/OTT21C-Platforms.git,Develop Crowdsourcing Platforms for Open Thoughts Transformation in 21st Century.,,1
423,https://github.com/volontariat/volontariat_example.git,Example application using the crowdsourcing platform engine gem voluntary,,1
424,https://github.com/jshiohaha/hacktech-2020.git,This is my hacktech 2020 project — Crowdsourcing against COVID-19,,1
425,https://github.com/utkarshm1999/Jagruk_Corona.git,A crowdsourcing platform for reporting COVID-19 lockdown violations,,1
426,https://github.com/melodyma/artfully.git,A conceptual public art crowdsourcing website made in Rails,,1
427,https://github.com/MusicConnectionMachine/dictionaries.git,Dictionaries of synonyms and ignored words curated via crowdsourcing,,1
428,https://github.com/heolin123/funcrowd-dataset.git,A collection of 6 datasets annotated using crowdsourcing,,1
429,https://github.com/xk-chen/Online-Aggregation-for-Crowdsourcing-Regression.git,Experimental codes for the algorithm Online Aggregation for Crowdsourcing Regression,,1
430,https://github.com/solitaryreaper/CrowdPrinting.git,Our project for HackMadison 2014 - Crowdsourcing 3-D Printing.,,1
431,https://github.com/dglittle/parallel-iterative.git,simulated experiments on parallel versus iterative crowdsourcing workflows,,1
432,https://github.com/gnasamx/CrowdSF.git,A decentralize application for crowdsourcing and crowdfunding using ethereum blockchain,"ethereum,solidity,crowdsourcing,crowsourcing,react",1
433,https://github.com/nicholasalanbrown/openlaw.git,A platform for crowdsourcing effective and representative laws.,"react,law,javascript,civic-tech",1
434,https://github.com/Ekula/uSquam_pipeline.git,The task pipelining part of our crowdsourcing platform,,1
435,https://github.com/sballesteros/nyctbike.git,crowdsourcing NYC Bike sharing system (formerly http://www.nyctbike.com),,1
436,https://github.com/PedalPatrol/PedalPatrol.git,Mobile application for crowdsourcing the retrieval of stolen bikes.,,1
437,https://github.com/brahmaneya/WorkerEvaluationGeneral.git,Finding confidence intervals for crowdsourcing worker error rates.,,1
438,https://github.com/SuLab/crowdflower_relation_verification.git,Verification of EU-ADR drug-disease relationships using crowdsourcing.,,1
439,https://github.com/volontariat/voluntary_survey.git,DRAFT: plugin for crowdsourcing management system voluntary about surveys.,,1
440,https://github.com/BathHacked/wheelmap-stats.git,Progress bar & project page for crowdsourcing accessibility info in Bath,"bath,wheelmap,wheelmap-stats,php,accessibility",1
441,https://github.com/akeshavan/vue-firebase-game.git,boilerplate for a crowdsourcing app w/ vuejs and firebase,,1
442,https://github.com/qiusihang/cslobby.git,A simple online chat lobby (created for CrowdSourcing research),,1
443,https://github.com/Paul-da-silva/CensorCheap.git,control censorship of the internet around the world with crowdsourcing,,1
444,https://github.com/tenac1337/CrowdViz.git,Crowdsourcing vision for the blind platform built for mobile applications,,1
445,https://github.com/juancamilo87/queue_estimation.git,Android app to use crowdsourcing to estimate queues in restaurants,,1
446,https://github.com/doncigalo/briberyNoMore.git,Crowdsourcing Application Designed To Tackle Bribery in Nigeria,,1
447,https://github.com/TobiasWooldridge/UniBuddyWalker.git,Crowdsourcing GPS coordinates (and more!) for university rooms,,1
448,https://github.com/theochino/Article78againstNYDFS.git,Site for Crowdsourcing to mount an Article 78 against NYDFS,,1
449,https://github.com/IARHeritages/CSvalidate.git,Crowdsourcing template to validate the content of webpages ,,1
450,https://github.com/notadilnaqvi/color-classifier.git,Crowdsourcing training data for a machine learning project,,1
451,https://github.com/vishalshubham/Audiovisual-Censorship.git,Audiovisual(e.g YouTube videos) censorship with Crowdsourcing,,1
452,https://github.com/dchart/HomoDemocraticoSapiens.git,HomoDemocraticoSapiens is a future project in developpement of crowdsourcing.,,1
453,https://github.com/gparuthi/CrowdMessageGeneration.git,This is a crowdsourcing application for generating high quality messages.,,1
454,https://github.com/penelope-nguyen/ground-zero.git,hackathon project. website for crowdsourcing emergency relief. django + materialize.css,,1
455,https://github.com/vaibhavdarji/vue-busstop-crowdsourcing.git,Bus-stop crowdsourcing web application using Vue JS,,1
456,https://github.com/Huppdo/SpotifyControl.git,Allows for public crowdsourcing of music to play on Spotify,,1
457,https://github.com/frank87/KiesWijzer.git,Crowdsourcing the questions to make a difficult decision.,,1
458,https://github.com/bgshih/cocotext-amt.git,COCO-Text V2 Amazon Mechanical Turk (AMT) Crowdsourcing.,,1
459,https://github.com/EducationalTestingService/nn-compound-sentiment.git,Sentiment Lexicon for Noun Noun Compounds Generated via Crowdsourcing.,"sentiment,lexicon,nouns",1
460,https://github.com/janmtl/flaskenberg.git,A Python Flask app for crowdsourcing data annotation,,1
461,https://github.com/AndreiBarsan/crowd.git,Improved crowdsourcing vote aggregation using document similarity and machine learning.,,1
462,https://github.com/IARHeritages/videotagging.git,Crowdsourcing application to ag video content relevant to IARH ,,1
463,https://github.com/FarnazKara/AttackFrameWorkMaliciousCrowdSourcing.git,Evaluate truth inference methods in crowdsourcing under data poisoning attack,simulation,1
464,https://github.com/nishanttotla/crowdprover.git,"Crowdprover is a crowdsourcing platform for program verification using crowdsourcing. The frontend mainly uses jQuery, among other frameworks. The backend is built in Python using Google App Engine.",,1
465,https://github.com/hyzhak/buses.git,Worldwide schedule of all buses based on crowdsourcing (4sq). In MVP stage.,,1
466,https://github.com/yujie0505/crowdNER.git,Using outlier detection and entity recognition to improve a crowdsourcing biocuration system,"biomedical,crowdsourcing,named-entity-recognition,socket-io",1
467,https://github.com/masaun/crowdsourcing-portal-for-art.git,This is a dApp that crowdsourcing portal for art for new wildcards,"solidity,truffle,web3js,react",1
468,https://github.com/calista-ai/crowdsourcing-app.git,A Web Application to collect data from pairwise image comparisons via crowdsourcing,"web-app,pairwise-comparisons,data-collection,data-gathering,image-evaluation,dataset,dataset-creation,crowdsourcing,mern-stack,react,node,express,mongodb,docker,nginx,mongo-express,calista,calista-ai,website-aesthetics",1
469,https://github.com/CAHealthData/social-services.git,Gathering feedback on the feasibility of crowdsourcing social services data in California,,1
470,https://github.com/dswatson/CrowdsourcedScience.git,Data and code for research on crowdsourcing in the natural sciences,,1
471,https://github.com/LARC-CMU-SMU/dph19-glycemic-impact.git,Estimating Glycemic Impact of Cooking Recipes via Online Crowdsourcing and Machine Learning (DPH’ 19),,1
472,https://github.com/vineetsethia/Ruban_India.git,"This repository contains everything related to Ruban_India project developed in InOut 2.0 hackathon by team Geek_Developers consists of members Vineet Sethia, Lucky Srivastava & Arvind Iyer  to  Connect Rural & Urban People of India. Ruban India a web & android based crowdsourcing & e-marketplace platform for connecting rural & urban people of India.",,1
473,https://github.com/shabeermothi/reNew.git,"Discuss about latest happenings in technology, bring in-sane people closer and crowdsourcing",,1
474,https://github.com/blakeney/cleanweb_box_server.git,Django application for Boston Cleanweb Hackathon electric box location crowdsourcing project.,,1
475,https://github.com/skishchampi/AapniSociety.git,"Android application for crowdsourcing and geotagging community resources like maids, cooks, grocery stores, laundry places etc",,1
476,https://github.com/leroyzhf/CrowdSourcing.git,the first crowdsourcing project for collecting brilliant business ideas and engaging co-creation,,1
477,https://github.com/LUCOSA/CrowdNotes.git,Lecture notes and e-books Crowdsourcing mobile application for Laikipia University students.,,1
478,https://github.com/t00lmaker/starbus-v2.git,Uma plataforma de crowdsourcing para usuário de transporte público de Teresina.,,1
479,https://github.com/volontariat/voluntary_classified_advertisement.git,Product about classified_advertising for crowdsourcing engine voluntary used e.g. by http://Volontari.at ,,1
480,https://github.com/volontariat/voluntary_classified_advertisement.git,Product about classified_advertising for crowdsourcing engine voluntary used e.g. by http://Volontari.at ,,1
481,https://github.com/hyylc/Online-task-Assignment-TBF.git,Differentially Private Online Task Assignment in Spatial Crowdsourcing: A Tree-based Approach,,1
482,https://github.com/DasAllFolks/CrowdCure.git,Crowdsourcing platform for tracking the spread of contagious diseases (or other epidemic phenomena) in real time.,,1
483,https://github.com/tjmasterson/Kindr_Project.git,Crowdsourcing quality control to establish a strain standardization in the cannabis industry,,1
484,https://github.com/flash3780/blueturtlelabs.org.git,"Repositofy for the blueturtlelabs website, a space for crowdsourcing open stirling engine development.",,1
485,https://github.com/galaxyeye/warps-nutch.git,"Web crawler based on Apache Nutch, with crowdsourcing support and ajax support",,1
486,https://github.com/kapelner/breaking_monotony.git,"Code and supplementary materials for the publication ""Breaking Monotony with Meaning: Motivation in Crowdsourcing Markets""",,1
487,https://github.com/MaastrichtU-IDS/CedMD.git,Conducting different crowdsourcing experiments for annotating lung nodules using point of interest annotation,,1
488,https://github.com/IshmaelLab/pretoria-rhok-icm.git,Repository dedicated to the continuing of the Pretoria RHoK challange on crowdsourcing service delivery related incidents,,1
489,https://github.com/Alaska47/Xplore.git,Android app that lets users share and view popular events going around them using crowdsourcing.,,1
