,Url,Description,Topics,Stars
621,https://github.com/AndrewRook/phdfootball.git,Scripts and other stuff used in my football analytics blog,,67
622,https://github.com/omegaml/omegaml.git,"Python analytics made easy - an open source DataOps, MLOps platform for humans","data-science,scikit-learn,jupyter-notebook,docker-image,deploy,machine-learning,artificial-intelligence,productized",67
623,https://github.com/segmentio/analytics-angular.git,The hassle-free way to integrate analytics into your Angular application.,"segment,analytics,quickstart,angular-boilerplate,angular2",67
624,https://github.com/transmart/transmartApp.git,"tranSMART is a knowledge management platform that enables scientists to develop and refine research hypotheses by investigating correlations between genetic and phenotypic data, and assessing their analytical results in the context of published literature and other work.",,67
625,https://github.com/robcowart/synesis_lite_snort.git,Snort IDS/IPS log analytics using the Elastic Stack.,"snort,elasticsearch,logstash,kibana,log-analytics,elk",66
626,https://github.com/segmentio/analytics.js-integrations.git,"{""Monorepo housing Segment's analytics.js integrations""}","javascript,segment,analyticsjs",66
627,https://github.com/vacu/electron-google-analytics.git,Node/Electron module for Google Analytics Measurement Protocol.,,66
628,https://github.com/uc-r/Advanced-R.git,Advanced Analytics with R training material delivered in a 2 day format,"r,data-science,training-materials,educational-materials,workshop-materials",66
629,https://github.com/Tarang/Meteor-Analytics.git,A super cool analytics package for meteor,,66
630,https://github.com/OpenVisualCloud/Ad-Insertion-Sample.git,"The ad-insertion reference pipeline shows how to integrate various media building blocks, with analytics powered by the OpenVINOâ„¢ Toolkit, for intelligent server-side ad insertion.","server-side-technologies,dash,hls,transcoding,ffmpeg,gstreamer,ad-inserter",66
631,https://github.com/KSemenenko/GoogleAnalyticsForXamarinForms.git,Google Analytics Plugin for Xamarin Forms,"google-analytics,xamarin-forms,xamarin",65
632,https://github.com/GalvanizeDataScience/building-spark-applications-live-lessons.git,"{""Supporting content (slides and exercises) for the Addison-Wesley (Pearson) video series covering best practices for developing scalable Spark applications for predictive analytics in the context of a data scientist's standard workflow.""}",,65
633,https://github.com/droher/boxball.git,"{""Prebuilt Docker images with Retrosheet's complete baseball history data for many analytical frameworks. Includes Postgres, cstore_fdw, MySQL, SQLite, Clickhouse, Drill, Parquet, and CSV.""}","retrosheet,docker,postgres,sql,baseball,sports,sqlite,mysql,column-store,postgresql,containers,baseballdatabank,sabermetrics,sports-stats,sports-data,clickhouse,play-by-play,apache-drill",65
634,https://github.com/jakobzhao/geog4572.git,Geovisual Analytics @ Oregon State University,"oregon-state-university,ceoas,gis,geovisualization,cartography,webmaps",64
635,https://github.com/buildingblocks/Quick-Event-Tracking.git,Unobtrusive Google Analytics Event Tracking jQuery ,,64
636,https://github.com/IBM/kafka-streaming-click-analysis.git,Use Kafka and Apache Spark streaming to perform click stream analytics,"kafka,structured-streaming,apache-spark,ibmcode,ibm-data-science-experience,data-science,clickstream,spark,jupyter-notebook",64
637,https://github.com/citusdata/citus-example-ad-analytics.git,"Reference App for Ad Analytics, using Ruby on Rails.",,64
638,https://github.com/tz33cu/ColumbiaX-Statistical-Thinking-for-Data-Science.git,This repo contains some R learning activities we created for the course I for the ColumbiaX series on Data Science and Analytics on edX. ,,64
639,https://github.com/binaryage/leechgate.git,Google Analytics for your S3 bucket,,64
640,https://github.com/frequencyanalytics/frequency.git,Frequency Analytics - Open source private web analytics server,"self-hosted,web-analytics",64
641,https://github.com/intel-hadoop/project-panthera.git,Project Panthera is our open source efforts to enable efficient support of standard SQL features for advacned analytics on Hadoop,,64
642,https://github.com/dkazanc/TomoPhantom.git,Software to generate 2D/3D/4D analytical phantoms and their Radon transforms (parallel beam) for image processing,"image,reconstruction,tomography,radon,denoising-images,deblurring,matlab,phantom,image-reconstruction,3d-phantoms,computed-tomography,astra-toolbox,image-classification,machine-learning",64
643,https://github.com/jpryda/facebook-multi-scraper.git,Multi-threaded Facebook scraper for social analytics of public and owned pages,"facebook,facebook-api,scraper,multithreaded,facebook-scraper,elasticsearch,ctr,engagement-rate,analytics,social-media,facebook-graph-api",63
644,https://github.com/kindmetrics/kindmetrics.git,Kind metrics analytics for your website,"analytics,google-analytics,crystal,lucky-framework,privacy",63
645,https://github.com/ckesc/miband_analytics.git,Analytics for Mi Band data on PC,mi-band,62
646,https://github.com/backtracks/open-podcast-analytics.git,Open podcast analytics specification,,62
647,https://github.com/state-machines/state_machines-audit_trail.git,Log transitions on a state_machines gem to support auditing and business process analytics.,,62
648,https://github.com/unit-io/unitdb.git,"Fast specialized time-series database for IoT, real-time internet connected devices and AI analytics.","db,database,timeseries,iot,timeseries-database,analytics,wal,trie",62
649,https://github.com/mbok/elasticsearch-linear-regression.git,A machine learning plugin for Elasticsearch providing aggregations to compute multiple linear regression on search results in real-time for predictive analytics.,"elasticsearch,linear-regression,elasticsearch-plugin,machine-learning,predictive-analytics",62
650,https://github.com/vertica/VerticaPy.git,"VerticaPy is a Python library that exposes sci-kit like functionality to conduct data science projects on data stored in Vertica, thus taking advantage Verticaâ€™s speed and built-in analytics and machine learning capabilities.","vertica,machine-learning,python,big-data,data-visualization,preparation,data-science,python-library",62
651,https://github.com/worldbank/dime-r-training.git,Dime Analytics R Training,,61
652,https://github.com/kaishengteh/Predictive-Analytics-for-Business-Nanodegree.git,Kai Sheng Teh - Udacity Predictive Analytics for Business Nanodegree,"udacity,business-analyst-nanodegree,alteryx,data-visualization,segmentation,cluster-modeling,analytics,ab-testing,time-series-forecasting,classification,tableau",61
653,https://github.com/intel-iot-devkit/Video-Analytics-OpenCV.git,Python video analytics samples with OpenCV*,,61
654,https://github.com/Rello/analytics.git,Analytics - Open source data warehouse and reporting for Nextcloud,"nextcloud,analytics,visualization,data,data-warehouse,datasources",61
655,https://github.com/abdullin/cellar.git,Append-only storage in Go designed for the analytical workloads,"storage,go,append-only,compressed,lmdb",61
656,https://github.com/microsoft/MCW-Cosmos-DB-Real-Time-Advanced-Analytics.git,MCW CosmosDB real-time advanced analytics,,60
657,https://github.com/Flowminder/FlowKit.git,FlowKit: Flowminder CDR analytics toolkit,"cdr,analysis,mobility,mobile,flowkit,cdr-analytics-toolkit,cdr-data",60
658,https://github.com/maxboeck/webmention-analytics.git,An analytics dashboard for webmention.io data.,,60
659,https://github.com/aws-samples/aws-open-data-analytics-notebooks.git,"COVID Response - Analytics, AI, and data science API and sample notebooks","aws-glue,data-science,amazon-athena,amazon-sagemaker,amazon-s3,machine-learning,amazon-comprehend,amazon-rekognition",60
660,https://github.com/FreeDiscovery/FreeDiscovery.git,Web Service for E-Discovery Analytics,"information-retrieval,machine-learning,text-classification,ediscovery,nlp,python",60
661,https://github.com/capesstack/capes.git,Cyber Analytics Platform and Examination System (CAPES) Project Page,,60
662,https://github.com/bigomics/omicsplayground.git,Visual self-service analytics platform for big omics data.,"omics,genomics-visualization,genomics,rna-seq,rna-seq-analysis",60
663,https://github.com/iam-mhaseeb/Skytrax-Data-Warehouse.git,"A full data warehouse infrastructure with ETL pipelines running inside docker on Apache Airflow for data orchestration, AWS Redshift for cloud data warehouse and Metabase to serve the needs of data visualizations such as analytical dashboards. ","python,python3,database,data-visualization,data-analysis,data-warehouse,data-warehousing,redshift,airflow,docker,sql,data-orchestration,data-analytics,s3,s3-bucket,metabase,data-engineering,data-cleaning,data-processing",60
664,https://github.com/jgallen23/node-ga.git,Server Side Google Analytics for Node,,59
665,https://github.com/Apress/text-analytics-w-python-2e.git,"{""Source Code for 'Text Analytics with Python,' 2nd Edition by Dipanjan Sarkar""}",,59
666,https://github.com/maxandriani/ngx-google-analytics.git,An easy way to use and configure Google Analytics on Angular 6+ applications,,59
667,https://github.com/qonversion/flutter-sdk.git,"Flutter SDK for cross-platform (iOS and Android) in-app purchase and subscription infrastructure, revenue analytics, engagement automation, and integrations","in-app-purchase,flutter-purchases,subscriptions,trials,receipt-validation,ios,ios-subscription,iap-verification,flutter,flutter-plugin,in-app,in-app-purchases,in-app-receipt,in-app-billing,android,storekit-wrapper",59
668,https://github.com/reconhub/covid19hub.git,Community-driven COVID-19 analytics in R,,59
669,https://github.com/balsikandar/Robin.git,Robin is a logging library for Bundle data passed between Activities and fragments. It also provides a callback to send screen views of user visited pages to your analytics client,"android,bundle,intent,events,androidlibrary,debugging,debugging-tool,crashlytics-logging",59
670,https://github.com/joernroeder/piwik-react-router.git,Piwik analytics component for react-router,"piwik,react,history,javascript,react-router",58
671,https://github.com/civisanalytics/civisml-extensions.git,scikit-learn-compatible estimators from Civis Analytics,,58
672,https://github.com/MediaRon/gravity-forms-google-analytics-event-tracking.git,Use event tracking with Google Analytics,,58
673,https://github.com/Arnaud73/ngx-matomo.git,Matomo (aka. Piwik) web analytics for applications based on Angular 5 to 12.,"matomo,ngx-matomo,tracker,angular,piwik,web-analytics",58
674,https://github.com/dipanjanS/nlp_workshop_dhs18.git,"{""Contains code and presentation for our full day workshop, 'Getting Started with Natural Language Processing'. This is created for the purpose of being presented in Analytics Vidhya's DataHack Summit 2018. Authors: Dipanjan Sarkar & Raghav Bali""}",,58
675,https://github.com/5t111111/middleman-blog-drops-template.git,"A blog template for Middleman which lets you start blogging immediately. Supports GitHub Pages and S3 deployment, sitemap, Atom feed, Google Analytics, responsive layout and syntax highlighting.",,58
676,https://github.com/DataStax-Examples/SparkBuildExamples.git,Example projects for using Spark and Cassandra With DSE Analytics,,57
677,https://github.com/seandroid-analytics/seal.git,SEAndroid Analytics Library for live device analysis,,57
678,https://github.com/Azure/live-video-analytics.git,A collection of reference applications using live video analytics capabilities in Azure Media Services,,57
679,https://github.com/zcaudate-me/sigmund.git,System analytics for Clojure,,57
680,https://github.com/jipiboily/forwardlytics.git,"Take events and customer data in and send them to various providers, mostly analytics providers.","segment-equivalent,drip,intercom,mixpanel,analytics,drift,hacktoberfest",57
681,https://github.com/joaolcorreia/Google-Analytics-PHP-cookie-parser.git,PHP class to parse Google Analytics Cookies,,56
682,https://github.com/TykTechnologies/tyk-pump.git,Tyk Analytics Pump to move analytics data from Redis to any supported back end (multiple back ends can be written to at once).,,56
683,https://github.com/jaredmessenger/unity3d-google-analytics.git,Track players and events using Google Analytics,,56
684,https://github.com/isamuelson/angularjs-googleanalytics.git,integrating google analytics to angular-js,,56
685,https://github.com/snowplow/snowplow-objc-tracker.git,"Snowplow event tracker for Objective-C. Add analytics to your iOS 8.0+, macOS and tvOS apps and games",,56
686,https://github.com/melaniewalsh/Intro-Cultural-Analytics.git,"Introduction to Cultural Analytics & Python, course website and online textbook powered by Jupyter Book","cultural-analytics,jupyter-book,jupyter-notebooks,course-materials,python,digital-humanities,textbook",56
687,https://github.com/timescale/timescale-analytics.git,"Extension for easier analytics, fully compatible with TimescaleDB and PostgreSQL ðŸ“ˆ",,56
688,https://github.com/KyberNetwork/reserve-data.git,"Kyber Reserve core component that helps manage reserves of tokens. It maintains market views, calculates prices and executes pricing/rebalancing instructions from analytic component.",,56
689,https://github.com/Meterwhite/MathStringExpression.git,objective-cè®¡ç®—æ•°å­¦è¡¨è¾¾(ç®—æœ¯è¡¨è¾¾å¼)å¼æ¡†æž¶ï¼Œå¼€å‘iOSè®¡ç®—å™¨/Framework of analytical math expressions,,56
690,https://github.com/OCA/account-analytic.git,Odoo Account Analytic Related Addons,,55
691,https://github.com/mtpa/mtpa.git,Modeling Techniques in Predictive Analytics with Python and R,,55
692,https://github.com/collectivemedia/spark-hyperloglog.git,Interactive Audience Analytics with Spark and HyperLogLog,,55
693,https://github.com/wes/Beautiful-Analytics-Chart.git,"Raphael, Prototype Analytics Line Chart with Multiple Data",,55
694,https://github.com/citusdata/pgconfsv-tutorial.git,Files for the PGConf SV tutorial on real-time analytics,,55
695,https://github.com/GeostatsGuy/2DayCourse.git,"My 2-day short course on spatial data analytics and geostatistics. I hope these resources are helpful, Prof. Michael Pyrcz ",,55
696,https://github.com/doo/GAJavaScriptTracker.git,Objective-C Cocoa Wrapper for javascript google analytics tracking on OSX.,,55
697,https://github.com/jakiestfu/Shadow.git,An internal analytics engine used to track meta data and user relations for objects in your application,,55
698,https://github.com/freshcodes/antycs.git,Organize and simplify your analytics event trapping related code.,,55
699,https://github.com/lakshmiDRIP/DROP.git,"Fixed Income Analytics, Portfolio Construction Analytics, Transaction Cost Analytics, Counter Party Analytics, Asset Backed Analytics","fixed-income,bond,asset-allocation,transaction-cost-analytics,counterparty-risk,cva-dva-fva-kva-xva,statistical-learning,asset-backed,portfolio-optimization,market-risk,credit-risk,corporates,loans,municipals,emerging-market,inflation-linked,interest-rates,fx,treasury,java",54
700,https://github.com/tcoopman/ga-react-router.git,Google analytics component for react-router,,54
701,https://github.com/sassoftware/enlighten-integration.git,Example code and materials that illustrate techniques for integrating SAS with popular open source analytics technologies like Python and R.,,54
702,https://github.com/awslabs/real-time-iot-device-monitoring-with-kinesis.git,"AWS Solution with a CloudFormation template for an ingestion mechanism for analytics about device connectivity and activity (i.e. sensor readings), as well as a dashboard for visualizing this data.",,54
703,https://github.com/fabric8-analytics/fabric8-analytics-vscode-extension.git,Red Hat Dependency Analytics extension,"dependency-analytics,security-vulnerability,insights,cve,nvd,online-flow,ide-extension",53
704,https://github.com/jfpsf/flurry-phonegap-plugin.git,Phonegap plugin for Flurry mobile analytics,,53
705,https://github.com/msadouni/cakephp-plugin-google-analytics.git,Google Analytics plugin for CakePHP,,53
706,https://github.com/databat-io/sonar.git,Google Analytics for the real world.,"raspberry-pi,people-counter,ble,bluetooth,analytics",53
707,https://github.com/implydata/distribution-docker.git,"{""I'm an analytics platform! In a Docker container!""}",,53
708,https://github.com/MarkCLewis/BigDataAnalyticswithSpark.git,Code for my videos on big data analytics with Apache Spark using Scala.,,53
709,https://github.com/sean-adams/dataslayer.git,A Chrome extension to enhance tag management and analytics debugging.,,53
710,https://github.com/NYPL/google-analytics-proxy.git,Google Analytics Proxy,,53
711,https://github.com/andrezimpel/gatsby-plugin-gdpr-cookies.git,"Gatsby plugin to add google analytics, google tag manager and facebook pixel in a gdpr form to your site.","google-analytics,gatsby-plugin,custom-cookie,facebook-pixel",53
712,https://github.com/veliovgroup/ostrio.git,"â–² Web services for JavaScript, Angular.js, React.js, Vue.js, Meteor.js, Node.js, and other JavaScript-based websites, web apps, single page applications (SPA), and progressive web applications (PWA). Our services: Pre-rendering, Monitoring, Web Analytics, WebSec, and Web-CRON","monitoring,analytics,prerender,prerendering,crawlable,webcron,protection,websecurity,websec,web-analytics,web-cron,spiderable",53
713,https://github.com/ins0/google-measurement-php-client.git,PHP Client to send analytics data over the Google Measurement Protocol to Google Analytics,"google-analytics,google-measurement-protocol,google,api-client",52
714,https://github.com/hadooparchitecturebook/clickstream-tutorial.git,Code for Tutorial on designing clickstream analytics application using Hadoop,,52
715,https://github.com/Apress/python-data-analytics-2e.git,"{""Source Code for 'Python Data Analytics, 2nd Edition' by Fabio Nelli""}",,52
716,https://github.com/Yannael/BigDataAnalytics_INFOH515.git,Material for the Big Data Analytics exercise classes - INFOH515 - Big Data : Distributed Data Management and Scalable Analytics - UniversitÃ© Libre de Bruxelles,,52
717,https://github.com/unrealmanu/ga-4-react.git,google analytics 4 wrapper for react,,52
718,https://github.com/Apereo-Learning-Analytics-Initiative/OpenLRW.git,Standards-based learning record warehouse built for a scalable learning analytics environment.,"apereo,learning-analytics,api,oneroster,caliper,xapi,education",52
719,https://github.com/dupadhyaya/sipPython.git,This repository is for learning to Analytics with Python Programming,,52
720,https://github.com/coinmetrics-io/haskell-tools.git,Tools for exporting blockchain data to analytical databases,"blockchain,haskell,analytics",52
721,https://github.com/3n/MooTune.git,"A MooTools class for logging events, errors and AB tests to multiple backends such as Google Analytics, Mixpanel or your own server logs.",,52
722,https://github.com/jorgecarleitao/datafusion-python.git,"A Python library to run analytics workloads with the performance of Rust, the flexibility of Python and O(1) cost in moving data between the two. Uses Apache Arrow in-memory format and respective query engine DataFusion.","rust,python,udfs,datafusion",52
723,https://github.com/bertomartin/big-data-analytics.git,Final project for big data analytics,,51
724,https://github.com/grafana/github-to-es.git,GitHub Analytics With Elasticsearch And Grafana,,51
725,https://github.com/tryolabs/daywatch.git,E-commerce scraping and analytics platform.,,51
726,https://github.com/peterbourgon/fastly-exporter.git,A Prometheus exporter for the Fastly Real-time Analytics API,,51
727,https://github.com/freshplanet/ANE-Flurry.git,Air Native Extension for Flurry Analytics & Ads (iOS + Android),,51
728,https://github.com/frovedis/frovedis.git,Framework of vectorized and distributed data analytics,"sx-aurora-tsubasa,machine-learning,spark,scikit-learn,distributed-computing,vectorization,mpi",51
729,https://github.com/DistributedSystemsGroup/zoe.git,Zoe: Container Analytics as a Service -- mirror of https://gitlab.eurecom.fr/zoe/main/,"data,analytics,containers,python,spark,jupyter",51
730,https://github.com/thunderain-project/thunderain.git,A Real-Time Analytical Processing (RTAP) example using Spark/Shark,,51
731,https://github.com/sent-hil/bitesized.git,Redis bitmap powered analytics in Go,,51
732,https://github.com/saturn-lab/FBDQA-2020A.git,"Financial Big Data and Quantitative Analytics, Autumn 2020.",,50
733,https://github.com/microsoft/ML-Server-Python-Samples.git,Advanced analytics samples and templates with Python for ML Server,,50
734,https://github.com/jrkinley-zz/flume-interceptor-analytics.git,Real-time analytics in Apache Flume,,50
735,https://github.com/edx-unsupported/insights.git,"[ARCHIVED]  Python+Mongo+Django framework for creating simple, pluggable analytics based on streaming events. ",,50
736,https://github.com/slanatech/dashblocks.git,Enable Analytics in your Apps,"dashboard,charts,d3,chartjs,vue,plotly,dygraphs,analytics",50
737,https://github.com/splitrb/split-analytics.git,:bar_chart: An extension to Split to push test data to Google Analytics.,,50
738,https://github.com/adctl/adctl.git,"Qt for Google Analytics, Google AdMob, Google Play services (auth and achievements) and StartAd.mobi framework",,50
739,https://github.com/Azure-Samples/azure-cosmos-db-change-feed-dotnet-retail-sample.git,"Reference Solution for Real-Time Data Analysis with Cosmos DB Change Feed           (+ Azure Functions, Azure Event Hubs, Azure Stream Analytics, Power BI)",,50
740,https://github.com/DUanalytics/BARtaxila.git,Business Analytics in R Programming : Taxila Business School,"business,analytics,r,programming,statistics",50
741,https://github.com/kidGodzilla/event-layer.git,"A very simple analytics abstraction layer. Write your events once, then send them where ever you want.","analytics,analytics-library,google-analytics,mixpanel,heap,simple,federation,generic,abstraction",50
742,https://github.com/flipkart-incubator/batchman.git,"This library for Android will take any set of events and batch them up before sending it to the server. It also supports persisting the events on disk so that no event gets lost because of an app crash. Typically used for developing any in-house analytics sdk where you have to make a single api call to push events to the server but you want to optimize the calls so that the api call happens only once per x events, or say once per x minutes. It also supports exponential backoff in case of network failures","java,persistence-strategies,batch-manager,persistence,strategies,batching,batch-processing,job-scheduler,serialization,analytics,networking,retry,android-library",50
743,https://github.com/tirthajyoti/Finance-with-Python.git,Financial data analytics with Python,"finance,financial-analysis,stock-market,stock-analysis,trading,python",49
744,https://github.com/wrbaldwin/da-week.git,Data Analytics Week at the AWS Loft,,49
745,https://github.com/DSC-SPIDAL/twister2.git,A composable framework for fast and scalable data analytics,"streaming,graph,batch,data,big-data,iterative",49
746,https://github.com/MacPaw/Google-Analytics-for-OS-X.git,Google Analytics SDK for OS X,"google-analytics,google-analytics-sdk",49
747,https://github.com/arnaudbreton/angular-segmentio.git,An AngularJS (http://angularjs.org) module for analytics service Segment.io (http://segment.io),,49
748,https://github.com/ZubairNabi/prosparkstreaming.git,"Code used in ""Pro Spark Streaming: The Zen of Real-time Analytics using Apache Spark"" published by Apress Publishing.",,49
749,https://github.com/AgnezIO/agnez.git,Analytics for Deep Learning projects.,"deep-learning,data-visualization",49
750,https://github.com/michael/dejavis.git,Visual Analytics for the Browser,,49
751,https://github.com/srcecde/google-youtube-history-analytics.git,"A Python Python Google-YouTube History Analytics, which reads your history data you get from Google and provide analytics about your searches on Google, YouTube and YouTube watch history. It provides number of counts for the term you searched for. ","youtube,google-history,analytics,google",49
752,https://github.com/grahams/safari-utm-stripper.git,Safari extension that strips Google Analytics (i.e. Urchin Traffic Monitor) tokens from URL query strings.,,49
753,https://github.com/segmentstream/digital-data-manager.git,"Digital Data Manager is an open source library which provides the hassle-free way to integrate Digital Data Layer on your website, collect customer data with one API and send it to hundreds of tools for analytics, marketing, and data warehousing.",,49
754,https://github.com/jcbonilla/Analytics.git,Analytics at NYU by JC Bonilla ,"business-analytics,data-analysis",48
755,https://github.com/italia/daf.git,Data & Analytics Framework (DAF),daf,48
756,https://github.com/rajat5ranjan/AV-LTFS-Data-Science-FinHack-ML-Hackathon.git,L&T Financial Services & Analytics Vidhya presents â€˜DataScience FinHackâ€™ organised by Analytics Vidhya,"analytics,machine-learning,loan-default-prediction,hackathon,analyticsvidhya",48
757,https://github.com/adswerve/universal-analytics-php.git,Universal Analytics library for PHP,,48
758,https://github.com/firmai/business-analytics-and-mathematics-python-book.git,Advanced Business Analytics and Mathematics with Python (by @firmai),"business,mathematics,analytics,python,data-science,data-analysis",48
759,https://github.com/HSAnet/qt-google-analytics.git,Qt5 classes for providing Google analytics usage in a Qt/QtQuick application,"google-analytics,qtquick,qt5,qt-google-analytics,c-plus-plus",48
760,https://github.com/OnceDoc/OnceDB.git,OnceDB full text search and analytics based on redis,,48
761,https://github.com/segmentio/analytics-rust.git, Segment analytics client for Rust https://segment.com/docs/libraries/rust,,48
