,Url,Description,Topics,Stars
269,https://github.com/mustafaakin/big-data-docker.git,"Better, container friendly big-data images for Docker",,38
270,https://github.com/lintool/my-data-is-bigger-than-your-data.git,My data is bigger than your data!,,38
271,https://github.com/vectorengine/vectordb.git,"VectorDB is a free analytics DBMS for IoT & Big Data, compatible with ClickHouse.","clickhouse,rust,olap,pipeline,streaming,storage,database",38
272,https://github.com/FINRAOS/HiveQLUnit.git,"Test your Hive scripts inside your favorite IDE with HiveQLUnit! Increase your developers productivity by testing on all operating systems including Windows, Linux and Mac OSX. Build continuous integration and delivery tests to control the releases of your big data products.",,38
273,https://github.com/joaolcorreia/Google-Analytics-BigQuery-Data-Export.git,Export Google Analytics data from BigQuery using Standard or Legacy SQL.,,37
274,https://github.com/purduedb/LocationSpark.git,LocationSpark: A Distributed In-Memory Data Management System for Big Spatial Data,,37
275,https://github.com/buaaliuming/Resources-for-Scholarly-Big-Data.git,"Tools, datasets, Corpus and Venue Challenge for scholarly big data——Pick up scattered pearls","scholarly-big-data,nlp,datasets,resources,current-task,knowledge-graph,citation-network,academic-corpus",37
276,https://github.com/aleph-im/pyaleph.git,"Next generation network of decentralized big data applications. Current connected chains: NULS, BNB and Ethereum.",,37
277,https://github.com/lintool/bigdata-2016w.git,CS 489/698 Big Data Infrastructure (Winter 2016) at the University of Waterloo,,36
278,https://github.com/SIDN/entrada.git,Entrada - A tool for DNS big data analytics,,36
279,https://github.com/Ziniki-Network/Ziggrid.git,Ziggrid is a Functional Reactive Programming Paradigm for Big Data,,36
280,https://github.com/mfjiang/DataNiuKnife.git,"数据牛刀是一款提供大数据表自动分割、归档和清理过期数据的服务。它使用C# /.NET CORE实现，当前支持Mysql数据源。  Data Niu Knife is a service provides  to automatically splits, archive, and clean up stale data for big data tables. It is implemented using C# /.NET CORE and currently supports Mysql data sources.",,36
281,https://github.com/sharmaroshan/Data-Visualizations.git,"Data Visualizations is emerging as one of the most essential skills in almost all of the IT and Non IT Background Sectors and Jobs. Using Data Visualizations to make wiser decisions which could land the Business to make bigger profits and understand the root cause and behavioral analysis of people and customers associated to it. In this Repository I have deeply discussed about Line Plots, Bar plots, Scatter Plots, and Pie Charts, Apart from that I have Discussed scientific plots, 3d plots, animated plots, interactive plots to visualize any kind of business problem and that too of any complexity.","seaborn,seaborn-tutorial,plotly,plotly-express,plotly-python,ipywidgets,bubbly,python,jupyter-notebook,data-visualization,data-science,data-analysis,business-intelligence,business-analysis",36
282,https://github.com/Envirometrix/BigSpatialDataR.git,Slides and lecture notes on how to process large spatial data with R,,35
283,https://github.com/YangKing0834131/2018-KUAISHOU-TSINGHUA-Solutions-.git,"China University Computer Contest-Big Data Challenge (A list: rank1, B list: rank2)",,35
284,https://github.com/jkolb/Lilliput.git,Low overhead file & byte processing for Swift. Has support for little and big endian data.,"swift,byte-order,endianness,linux,buffer-memory,carthage,lilliput,swift4,big-endian,little-endian,file-format",35
285,https://github.com/orendain/trucking-iot.git,"A modern real-time streaming application serving as a reference framework for developing a big data pipeline, complete with a broad range of use cases and powerful reusable core components.",,35
286,https://github.com/rajasharan/NaughtyKeyboard-Android.git,The Big List of Naughty Strings is a list of strings which have a high probability of causing issues when used as user-input data. This is a keyboard to help you test your app from your Android device.,,35
287,https://github.com/RealSelf/target-bigquery.git,A Singer (https://singer.io) target that writes data to Google BigQuery.,,34
288,https://github.com/Sotera/distributed-louvain-modularity.git,Community Detection and Compression Analytic for Big Graph Data,,34
289,https://github.com/Costello1329/made-cpp-2020-hw.git,A repo for publishing tasks and tests for mail.ru MADE (big-data school) 2020 C++ course.,"cpp,arm-assembly,x86-64,concurrent-programming,stl-containers,c,course",34
290,https://github.com/privefl/bigreadr.git,R package to read large text files based on splitting + data.table::fread,"r-package,read-csv,large-dataset",34
291,https://github.com/jangorecki/big.data.table.git,Distributed parallel computing on data.table,,34
292,https://github.com/maziarraissi/ParametricGP.git,Parametric Gaussian Process Regression for Big Data,,33
293,https://github.com/jennybc/2015-02-23_bryan-fields-talk.git,"Talk at Workshop on Visualization for Big Data: Strategies and Principles, Fields Institute http://www.fields.utoronto.ca/programs/scientific/14-15/bigdata/visualization/",,33
294,https://github.com/kiat/BigDataAnalytics.git, Big Data Analytics - Spark and Machine Learning Examples,,32
295,https://github.com/hanhanwu/Hanhan_Data_Science_Resources.git,helpful resources for (big) data science,,32
296,https://github.com/shuang790228/BigDataArchitectureAndAlgorithm.git,"《大数据架构和算法实现之路：电商系统的技术实战》一书的实验数据和代码- The resource files (including datasets and code) for the book ""Big Data Architecture and Algorithm:  Practice in E-commerce""",,32
297,https://github.com/mafeimf/Attention-Graph-Convolution-Network-for-Image-Segmentation-in-Big-SAR-Imagery-Data.git,"the code of paper ""Attention Graph Convolution Network for Image Segmentation in Big SAR Imagery Data""",,32
298,https://github.com/CloudaYolla/aws-serverless-data-lake-workshop.git,"This workshop\xa0is meant to give customers a hands-on experience with mentioned AWS services.\xa0 Serverless Data Lake workshop helps customers build a cloud-native and future-proof serverless data lake architecture.  It allows hands-on time with AWS big data and analytics services including Amazon Kinesis Services for streaming data ingestion and analytics, AWS Glue for ETL and Data Catalogue Management, Amazon Athena to query data lake. ",,32
299,https://github.com/lambdaclass/buzzconf.git,"A conference by devs for devs. Functional Programming, Distributed Systems, Big Data and Machine Learning Conference in Buenos Aires, Argentina","machine-learning,conference,buenos-aires,argentina,workshop",32
300,https://github.com/mfouesneau/faststats.git,fast algorithm to do statistics on big data,,32
301,https://github.com/utsabigdata/bigdata.git,big data technology,,31
302,https://github.com/saturn-lab/BDMI-2020S.git,"Big Data and Machine Intelligence, Spring 2020.",,31
303,https://github.com/onyas/bigData-in-docker.git,Make it easier to learn big data,,31
304,https://github.com/blackrock/TopNotch.git,A framework for systematically quality controlling big data.,,31
305,https://github.com/pablobarbera/ECPR-SC105.git,ECPR Summer School: Big Data Analysis in the Social Sciences,,31
306,https://github.com/seiflotfy/vhll.git,Hyper-Compact Virtual Estimators for Big Network Data Based on Register Sharing,,31
307,https://github.com/tmbdev/tarp.git,"Fast and simple stream processing of files in tar files, useful for deep learning, big data, and many other applications.",,31
308,https://github.com/UncleBarney/play-big-data.git,Play with various big data technologies,,30
309,https://github.com/molpopgen/BigDataFormats.git,"Tutorial on programming or ""big data""/bioinformatics",,30
310,https://github.com/LinkedEOData/GeoTriples.git, Publishing Big Geospatial data as Linked Open Geospatial Data ,"spark,geospatial,semantic-web,rdf",30
311,https://github.com/Novartis/yap.git,"High throughput, pain-free big data pipelines.",,30
312,https://github.com/cetic/fadi.git,"FADI - Ingest, store and analyse big data flows","bigdata,helm,kubernetes,cloudnative,opensource,containers,fadi,helm-chart,clouds,cetic,fossa-status",30
313,https://github.com/databio/simpleCache.git,Simplified R caching for reproducible big data projects,,30
314,https://github.com/PacktPublishing/Mastering-Big-Data-Analytics-with-PySpark.git,"Mastering Big Data Analytics with PySpark, Published by Packt",,29
315,https://github.com/patilankita79/Location-based-Restaurants-Recommendation-System.git,Big Data Management and Analysis Final Project,"apache-spark,scala,python,kafka,elasticsearch,kibana",29
316,https://github.com/bigdatacup/Big-Data-Cup-2021.git,Big Data Cup 2021: Powered by Stathletes,,29
317,https://github.com/bigcontainer/bigcont.git,Big Data Container Ecosystem for OpenShift Origin,,29
318,https://github.com/bigdawg-istc/bigdawg.git,A polystore database from researchers of the Intel Science and Technology Center for Big Data,,29
319,https://github.com/phodal/learning-data.git,"Big data with ElasticSearch,Hadoop,Pig,Map,D3",,29
320,https://github.com/Logimethods/smart-meter.git,To demonstrate a Smart Meter Big Data Application.,,29
321,https://github.com/prb/bigbird.git,An attempt to create a Twitter-like beastie backed by big data storage.,,29
322,https://github.com/yugokato/Spark-and-Kafka_IoT-Data-Processing-and-Analytics.git,Final Project for IoT: Big Data Processing and Analytics class in UCSC Extension. Analyzing U.S nationwide temperature from IoT sensors in real-time,"pyspark,kafka,iot-sensors,spark-streaming,bigdata,python",29
323,https://github.com/xuwd11/Coursera-Bioinformatics.git,"My solution to Bioinformatics Specialization (Finding Hidden Messages in DNA; Genome Sequencing; Comparing Genes, Proteins, and Genomes; Molecular Evolution; Genomic Data Science and Clustering; Finding Mutations in DNA and Proteins; Bioinformatics Capstone: Big Data in Biology)","coursera,bioinformatics,python",29
324,https://github.com/sf585978/cssReadingList.git,A list of useful learning resources and research articles on big data and computational social science,,29
325,https://github.com/koooee/BigDataR_Examples.git,Data Science and Machine Learning Examples for Data Science Linux,,28
326,https://github.com/PacktPublishing/Scala-and-Spark-for-Big-Data-Analytics.git,"Scala and Spark for Big Data Analytics, published by Packt",,28
327,https://github.com/saturn-lab/FBDQA-2020S.git,Financial Big Data and Quantitative Analytics,"weyoung,lotus",28
328,https://github.com/internetarchive/trough.git,"Trough: Big data, small databases.","python,python3,database,sqlite",28
329,https://github.com/citiususc/BigBWA.git,BigBWA is a new tool that uses the Big Data technology Hadoop to boost the performance of the Burrows–Wheeler aligner (BWA).,,28
330,https://github.com/mlampros/textTinyR.git,Text Processing for Small or Big Data Files in R,"boost,r,rcpp,rcpparmadillo,bh,text,processing,cpp11",28
331,https://github.com/salahdev8/NYYellowTaxiProject.git,"Big Data project using Hadoop (MapReduce, spark, Hive)",,28
332,https://github.com/infochimps-labs/data_science_fun_pack.git,"Meta-repository of big data tools -- source and essential plugins for hadoop, pig, wukong, storm, kafka etc.",,28
333,https://github.com/quintuslabs/GroceryStore.git,Grocery store template is created as a wonderful solution for any agricultural or organic food shop Android App UI template. It is a template for an Android developer that want to create grocery application with a clean design. The template is only lay outing without data flow and communication with the backend system. This UI Template can reduce your development time and will loved by developer that hate lay outing design!  You can use this app as one big super market app to sale product of your store. This app make easy for user to buy product from store with easy steps and store can get easy order.,"android,android-application,java,ecommerce,grocery,android-app,android-ui,android-studio,material-design,material-ui,store,grocery-store,ui-design,template,xml,grocerystore,grocery-application,grocery-managementsystem,grocery-list",28
334,https://github.com/astrojuanlu/ie-mbd-advanced-python.git,"""Advanced Python"" subject from the Master in Big Data @ IE",python,27
335,https://github.com/mitodl/edx2bigquery.git,Tool to convert & load data from edX platform into BigQuery,,27
336,https://github.com/ASvyatkovskiy/BigDataCourse.git,Materials for the Advanced Data Analysis Techniques with Apache Spark mini-course,,27
337,https://github.com/cuiods/WIFIProbe.git,Commercial big-data analysis system based on WIFI probe,"springboot,dva,hadoop,wifi,big-data",27
338,https://github.com/Gradiant/charts.git,Curated Big Data Applications for Kubernetes,,27
339,https://github.com/bbossgroups/bigdatas.git,"this is a db-hdfs tools used to transfer big database  datas to hadoop hdfs like sqoop,but bboss bigdata tool is very nice monitor and event drivered model,and high perfermance,support Distributed executor tasks Ability.",,27
340,https://github.com/plouto-quants/FBDQA-2020S.git,"Financial Big Data and Quantitative Analytics, Spring 2020 ","lotus,weyoung",27
341,https://github.com/plantinformatics/pretzel.git,Javascript full-stack framework for Big Data visualisation and analysis,"ember,express,emberjs,expressjs,bioinformatics,big-data,javascript,data-visualization,data-science,open-source",27
342,https://github.com/SKKU-SKT/ggplot2.SparkR.git,Rebooting ggplot2 for scalable big data visualization,,27
343,https://github.com/SANSA-Stack/Archived-SANSA-Inference.git,A general Inference API based on two of the most popular Big Data processing engines: Apache Spark and Apache Flink,"reasoning,semantic-web,owl,rdfs,spark,flink,distributed-computing",27
344,https://github.com/sakura26/killallbtn.git,A real BIG RED button to kill all your data & host in seconds in case of emergency.,,27
345,https://github.com/zwqjsj0404/BigData.git,big data books and papers,,26
346,https://github.com/sfu-db/bigdata-cmpt733.git,Big Data Programming II,,26
347,https://github.com/RafaelCaballero/BigDataPython.git,"Material de apoyo del libro BIG DATA CON PYTHON. Recolección, almacenamiento y procesamiento de datos, de Enrique Martín Martín, Adrián Riesco y Rafael Caballero, editado por RC libros",,26
348,https://github.com/maptalks/maptalks.biglayer.git,A maptalks layer to render millions of data with WebGL,,26
349,https://github.com/MicrosoftLearning/Azure-Data-Lake.git,Course files for the Microsoft course Processing Big Data with Azure Data Lake,,26
350,https://github.com/bigdata-trading/algo-trading-strategies.git,Big Data course project (EPFL) - Trading strategies based on order book,,26
351,https://github.com/Johannes-Berggren/firestore-to-bigquery-export.git,NPM package for copying and converting Cloud Firestore data to BigQuery.,"firestore,bigquery,bigquery-export,firestore-collections,schema,datasets",26
352,https://github.com/falstack/vue-flow-render.git,⚡️ A vue component support big amount data list with high scroll performance and more.,"vue,virtual-list,big-data,big-list,infinite-scroll",26
353,https://github.com/datadesk/django-bigbuild.git,"{""The open-source engine that powers bigbuilder, the Los Angeles Times Data Desk's system for publishing standalone pages""}","django,static-site-generator,python,news",26
354,https://github.com/josonle/Spark-The-Definitive-Guide-Learning.git,《Spark: The Definitive Guide Big Data Processing Made Simple》学习心得，说翻译嘛也不算完全翻译吧，只能说以个人经验和理解重新叙述一遍。同步更新在掘金上，点链接可跳转,,26
355,https://github.com/AsperaGmbH/xlsx-reader.git,"The project xlsx-reader is a PHP library for fast and efficient reading of XLSX spreadsheet files (e.g. generated by Microsoft Excel). It delivers functionality to efficiently read in data contained within the given XLSX file, also for very big XLSX files in the magnitude of multiple GBs.","xlsx,xlsx-files,xlsxreader,xlsx-lib,xlsx-spreadsheet,xlsx-parser,excel,excelreader,excel-import,excelparser,exceldatareader,spreadsheet,spreadsheet-data,php,php-library",26
356,https://github.com/AzureCAT-GSI/SessionCatalog.git,"The repositories managed by Azure CAT GSI provides materials to deliver sessions on various Microsoft Azure solution architecture topics, such as Infrastructure-as-a-Service capabilities, services supporting Internet-of-Things scenarios, Big Data, and many more. At a minimum, session content contains a PowerPoint presentation with full speaker notes. In addition, it may include demo scripts and demo code, with a video in which the demo is shown. The session catalog provides insight into the sessions available and the topics covered. A topic can contain multiple presentations.",,26
357,https://github.com/igorman/data-engineering.git,"Challenge for those applying to the Software Engineer, Big Data position",,25
358,https://github.com/EvanZ/myvagrant.git,edX: Introduction to Big Data with Apache Spark,,25
359,https://github.com/chengsoonong/digbeta.git,Active learning for Big Data,,25
360,https://github.com/hanhanwu/Hanhan_Data_Science_Practice.git,"data analysis, big data development, cloud, and any other cool things!",,25
361,https://github.com/UCLA-VAST/blaze.git,Blaze runtime system that support efficient accelerator integration for big data.,,25
362,https://github.com/WeiqiangZhou/BIRD.git,Big data Regression for predicting DNase I hypersensitivity,"rna-seq,dnase-seq,prediction-model,single-cell-genomics,gene-expression,chromatin-accessibiity",25
363,https://github.com/AI4Finance-LLC/Quantifying-ESG-Alpha-using-Scholar-Big-Data-ICAIF-2020.git,Quantifying ESG Alpha using Scholar Big Data: An Automated Machine Learning Approach.,"esg,machine-learning,lstm-neural-networks",25
364,https://github.com/ksavinash9/Neo4j-GraphX.git,Similar to Shifu - Neo4j-GraphX  extends Neo4j graph database to process big data graph algorithms with HDFS and Apache Spark on a scalable data set,,25
365,https://github.com/enahwe/Csv2Hive.git,"{""Csv2Hive is an useful CSV schema finder for the Big Data. It discovers automatically schemas in big CSV files, generates the 'CREATE TABLE' statements and creates Hive tables. You don't need to writes any schemas at all. Csv2Hive is a really fast solution for integrating the whole CSV files into your DataLake.""}",,25
366,https://github.com/timlukins/pixelmor.git,Big Pixel Data for image/video processing.,,24
367,https://github.com/jhs/bigdecimal.js.git,Javascript BigDecimal data type for arbitrary precision real numbers,,24
368,https://github.com/destiny19960207/URFC-top4.git,"Baidu Big Data Contest 2019: Urban Region Function Classification, top4",,24
369,https://github.com/smandaric/bigquerylayers.git,QGIS plugin for importing data from BigQuery,,24
370,https://github.com/int32bit/awesome-papers.git,"A collection of awesome papers about big data & cloud computing like Spark,Ceph,Kubernetes,inc.",,24
371,https://github.com/jwagemann/2019_egu_workshop_jupyter_notebooks.git,Short course on interactive analysis of Big Earth Data with Jupyter Notebooks,"jupyter-notebook,geospatial-analysis,bigdata,googleearthengine,climate-data",24
372,https://github.com/13952522076/DataMining.git,"Java implementation of the classic Data mining (big data)  algorithm. Create a new Java project, and copy this project to the SRC directory is ok.",,24
373,https://github.com/adamborowski/explorejs.git,Enables big data time series visual exploration for any JavaScript chart,,24
374,https://github.com/jorgeacf/dockerfiles.git,"Multi docker container images for main Big Data Tools. (Hadoop, Spark, Kafka, HBase, Cassandra, Zookeeper, Zeppelin, Drill, Flink, Hive, Hue, Mesos, ... )","dockerfile,bigdata,cassandra,drill,flink,hadoop,hbase,hive,hue,kafka,mesos,spark,zeppelin,zookeeper,docker-image",24
375,https://github.com/Aloja/aloja.git,"[DEPRECATED]  For read-only reference of the ALOJA Big Data Benchmarking platform: includes tools to define and deploy clusters, orchestrate benchmarking, collect and manage results, and analyze them in Web app including Predictive Analytic tools.  Check the website for the datasets and papers",,24
376,https://github.com/jlyang1990/Spark_Python_Do_Big_Data_Analytics.git,Course materials in Udemy Apache Spark 2.0 + Python: Do Big Data Analytics & ML,,23
377,https://github.com/t-ivanov/BigDataReading.git,"List of papers, reports and links of materials on Big Data and related topics.",,23
378,https://github.com/buomsoo-kim/Introduction-to-Python-Programming.git,"Lectures in Big Data Institute, Seoul National University","python,numpy,python-primer",23
379,https://github.com/bgruening/coding_for_big_data.git,X things you should take into consideration if you code for big data analysis,,23
380,https://github.com/BGT-M/spartan2.git,A collection of data mining algorithms on big graphs and time series,"big-graphs,data-mining,time-series,anomaly-detection,sparse-tensors",23
381,https://github.com/jnidzwetzki/bboxdb.git,"BBoxDB is a scalable, highly available and distributed data store for multi-dimensional big data. The software supports operations like hyperrectangle queries or spatial joins.","bigdata,key-value-database,multi-dimensional,storage-engine,storage-manager,multidimensional-data,key-value-store,sstables,range-query,distributed-storage-manager,spatial-data,gis,partitioning,spatial-join,nosql,nosql-database,datastream",23
382,https://github.com/PacktPublishing/big-data-analytics.git,"Big Data Analytics, published by Packt",,22
383,https://github.com/lintool/bigdata-2018f.git,CS 451/651 Data-Intensive Distribute Computing (Fall 2018) at the University of Waterloo,,22
384,https://github.com/saga-project/BigJob.git,SAGA-based Pilot-Job Implementation for Compute and Data,,22
385,https://github.com/arakat-community/arakat.git,ARAKAT - Big Data Analysis and Business Intelligence Application Development Platform,"big-data-analytics,business-intelligence,data-pipelines,predictive-maintenance,docker,docker-swarm,cloud-native-applications,distributed-systems",22
386,https://github.com/whomm/bigdata-tech-index.git,Big Data Technology Index,"bigdata,technology,index",22
387,https://github.com/hackerdojoml/mrbigdata.git,Source code for the Map reduce with big data class,,22
388,https://github.com/SISBID/Data-Visualization.git,"Materials for Module 2 of the SISBID Workshop, Visualization of Biomedical Big Data",,22
389,https://github.com/wilseypa/rphash-golang.git,Scalable Big Data Clustering by Random Projection Hashing: golang implementation,,22
390,https://github.com/wowdd1/xlinkBook.git,a web base research management tool that deal with big data for everyone,,22
391,https://github.com/GoogleCloudPlatform/solutions-automated-file-loader-for-bigquery.git,"The Automated File Loader to BigQuery solution demonstrates the use of Object Change Notification service on Google Cloud Storage. It shows how one can easily build a simple App Engine application to automatically pick up new data in Cloud Storage based on business logic, and load it directly into Google BigQuery.",,22
392,https://github.com/czyuan/LTM.git,"Code for ICML 2014 paper ""Topic Modeling using Topics from Many Domains, Lifelong Learning and Big Data""",,22
393,https://github.com/amazon-archives/harmonize-search-analyze.git,"Code samples related to ""Harmonize, Search, and Analyze Loosely Coupled Datasets on AWS"" (https://aws.amazon.com/blogs/big-data/harmonize-search-and-analyze-loosely-coupled-datasets-on-aws/) published on the Big Data Blog",,22
394,https://github.com/OWASP/Top-5-Machine-Learning-Risks.git," The OWASP Top 5 Machine Learning Risks[edit | edit source] The idea is to build the required resources which help software security community to understand the emerging technology of machine learning and how it is related to security, warn them about the risk associated with using ML, and discuss the defending techniques.  Description[edit | edit source] Machine Learning has recently re-emerged as a powerful tool in multiple business sectors, especially when it is used for Predictive Analytics at the scale of Big Data. This technique becomes vital when it is harnessed for the Security services and applications like Fraud Detection, Anomaly Detection, Behavioral Analysis",,22
395,https://github.com/dineshappavoo/IMDBMovieBigData.git,A big data project to apply Hadoop map- reduce to derive some statistics from IMDB movie data.,,21
396,https://github.com/sciabarra/BigDataDevKit.git,Big Data Development Kit (Hadoop / Spark / Zeppelin / IntelliJ),,21
397,https://github.com/Sotera/zephyr.git,"Zephyr is a big data, platform agnostic ETL API, with Hadoop MapReduce, Storm, and other big data bindings.",,21
398,https://github.com/edgararuiz-zz/bigdatalondon2018.git,Materials from the Data Science with Spark and R,,21
399,https://github.com/fslaborg/zzarchive-Deedle.BigDemo.git,BigDeedle demo showing how to use Deedle for working with very large time series and data frames stored in Azure table storage.,,21
400,https://github.com/STRCWearlab/DataLogger.git,Android application for reliable multidevice multisensor big data collection,,21
401,https://github.com/pablobarbera/big-data-upf.git,RECSM-UPF Summer School: Social Media and Big Data Research,"social-media,big-data,twitter,facebook,text-analysis,social-network-analysis,rstudio,scraping-websites",21
402,https://github.com/haiphucnguyen/BigDataDemo.git,"The demo of using Kafka, Spark, Hive, Cassandra, etc by using Docker. It produces the production ready environment for any kinds of big data project relates to Hadoop ecosystem","hadoop,kafka,spark,hive,scala,big-data,cassandra,docker,docker-compose,spark-streaming,jupyter",21
