,Url,Description,Topics,Stars
0,https://github.com/agentejo/cockpit.git,Add content management functionality to any site - plug & play / headless / api-first CMS,"headless,cms,headless-cms,php,cms-framework,javascript,api-rest,riotjs,cockpit,backend,hacktoberfest",4984
1,https://github.com/ory/kratos.git,"Next-gen identity server (think Auth0, Okta, Firebase) with Ory-hardened authentication, MFA, FIDO2, profile management, identity schemas, social sign in, registration, account recovery, service-to-service and IoT auth. Can work as an OAuth2 / OpenID Connect Provider. Golang, headless, API-only - without templating or theming headaches.","identity,identity-management,user-management,users,user,login,registration,profile-management,user-profiles,user-profile,hacktoberfest",3298
2,https://github.com/ckan/ckan.git,"CKAN is an open-source DMS (data management system) for powering data hubs and data portals. CKAN makes it easy to publish, share and use data. It powers catalog.data.gov, open.canada.ca/data, data.humdata.org among many other sites.","python,open-data,data,catalog,api,ckan,ckanext",2965
3,https://github.com/Canner/canner.git,"⚡️[NOT MAINTAINED] Content Management Framework creates custom CMS fast and easy. Support data sources such as Firebase/Firestore, GraphQL and Restful APIs.","cms,canner,cms-component,graphql,apollo,jsx,react,reactjs,firebase,google,restful-api,cms-framework,firebase-cms,prisma-cms,graphql-cms,prisma,restful-api-cms,firestore,firestore-cms",2481
4,https://github.com/Netflix/archaius.git,Library for configuration management API,,2273
5,https://github.com/orlabs/orange.git,OpenResty/Nginx Gateway for API Monitoring and Management.,"gateway,nginx,proxy,ngx-lua,openresty,lor,api,resty,monitoring",2150
6,https://github.com/NREL/api-umbrella.git,Open source API management platform,"api-management,nginx,openresty,api-gateway,api-manager,luajit,lua",1662
7,https://github.com/kubernetes-sigs/cluster-api.git,"Home for the Cluster Management API work, a subproject of sig-cluster-lifecycle",k8s-sig-cluster-lifecycle,1619
8,https://github.com/ever-co/ever-traduora.git,Ever® Traduora - Open-Source Translation Management Platform,"typescript,api,webapp,angular,self-hosted,translation,teams,nodejs,localization,internationalization",1500
9,https://github.com/OpenBankProject/OBP-API.git,"An open source RESTful API platform for banks that supports Open Banking, XS2A and PSD2 through access to accounts, transactions, counterparties, payments, entitlements and metadata - plus a host of internal banking and management APIs.","xs2a,xs2a-interface,xs2a-connector,psd2,psd2-xs2a-interface,openbanking,openbanking-api",1318
10,https://github.com/aws-samples/lambda-refarch-webapp.git,"The Web Application reference architecture is a general-purpose, event-driven, web application back-end that uses AWS Lambda, Amazon API Gateway for its business logic. It also uses Amazon DynamoDB as its database and Amazon Cognito for user management. All static content is hosted using AWS Amplify Console.","serverless,lambda,aws,aws-lambda,amplify,dynamodb",1257
11,https://github.com/gravitee-io/gravitee-gateway.git,Gravitee.io - API Management - OpenSource API Gateway,"api,api-management,gateway,microservices,java,vertx,api-gateway",1172
12,https://github.com/dreamfactorysoftware/dreamfactory.git,DreamFactory API Management Platform,"dreamfactory,laravel,framework,php,api,rest,openapi,automatic-api",1158
13,https://github.com/DXY-F2E/api-mocker.git,Api Mocker is more of an api management system than a mocker.,"api-mocker,mocker,vue,egg,api-manager,api-management",1096
14,https://github.com/log4cplus/log4cplus.git,"log4cplus is a simple to use C++ logging API providing thread-safe, flexible, and arbitrarily granular control over log management and configuration. It is modelled after the Java log4j API.","log4cplus,cxx,logging,logging-library",1079
15,https://github.com/parrot-translate/parrot.git,Self-hosted Localization Management Platform built with Go and Angular,"nginx,go,angular,javascript,typescript,localization,api,self-hosted,i18n,i10n,translation",964
16,https://github.com/apioo/fusio.git,Open source API management platform,"api,rest,api-management,serverless,microservice,php,javascript,openapi,api-gateway,api-manager,rpc,backend",959
17,https://github.com/salsita/node-pg-migrate.git,Node.js database migration management for Postgresql,"database,db,migrate,migration,migrations,migrator,db-migrate,pg,postgre,postgres,postgresql,sql,extensible,expandable,programatic,programable,api,cockroach,cockroachdb",854
18,https://github.com/ustayready/fireprox.git,AWS API Gateway management tool for creating on the fly HTTP pass-through proxies for unique IP rotation,,827
19,https://github.com/xuxueli/xxl-api.git,A api management platform.（API管理平台XXL-API）,"xxl,xxl-api,api,document,java",810
20,https://github.com/sitewhere/sitewhere.git,"SiteWhere is an industrial strength open-source application enablement platform for the Internet of Things (IoT). It provides a multi-tenant microservice-based infrastructure that includes device/asset management, data ingestion, big-data storage, and integration through a modern, scalable architecture.  SiteWhere provides REST APIs for all system functionality.  SiteWhere provides SDKs for many common device platforms including Android, iOS, Arduino, and any Java-capable platform such as Raspberry Pi rapidly accelerating the speed of innovation.","sitewhere,internet-of-things,integration,device-management,iot,iot-platform,platform,mqtt,iot-framework,java,arduino,raspberry-pi,android,open-source,aws,kafka,zookeeper,microservices,kubernetes,helm",809
21,https://github.com/sodafoundation/api.git,SODA API is an open source implementation of SODA API Standards for Data and Storage Management.,"sds,kubernetes,ceph,openstack,cloudnative,cloudnativestorage,swordfish,storage,multi-cloud",794
22,https://github.com/brehaut/color-js.git,A color management API for javascript,"color,javascript",788
23,https://github.com/sandroasp/Microsoft-Integration-and-Azure-Stencils-Pack-for-Visio.git,"Microsoft Integration, Azure, Power Platform, Office 365 and much more Stencils Pack it’s a Visio package that contains fully resizable Visio shapes (symbols/icons) that will help you to visually represent On-premise, Cloud or Hybrid Integration and Enterprise architectures scenarios (BizTalk Server, API Management, Logic Apps, Service Bus, Event Hub…), solutions diagrams and features or systems that use Microsoft Azure and related cloud and on-premises technologies in Visio 2016/2013","stencils,stencils-pack,mis-azure,support-stencils,systems-logo-stencils,sap-stencils,integration,azure,power-platform,office-365,visio,resizable-visio-shapes,shapes,mis-devices-stencils,office",761
24,https://github.com/apiman/apiman.git,API Management,"api-management,api-gateway,api-manager,apiman",612
25,https://github.com/kripod/react-hooks.git,Essential set of React Hooks for convenient Web API consumption and state management.,"react,hooks,react-hooks,essential,web-api,state-management",519
26,https://github.com/matus-chochlik/oglplus.git,"OGLplus is a collection of open-source, cross-platform libraries which implement an object-oriented facade over the OpenGL® (version 3 and higher) and also OpenAL® (version 1.1) and EGL (version 1.4) C-language APIs. It provides wrappers which automate resource and object management and make the use of these libraries in C++ safer and more convenient.",,488
27,https://github.com/cloudframeworks-apigateway/user-guide-apigateway.git,[Cloudframeworks]KONG API Gateway - user guide ／ [云框架]KONG API Gateway-用户指南 ／ For API Gateway & Microservice APIs Management ／ API网关 & 微服务API管理,,446
28,https://github.com/flextype/flextype.git,Hybrid Content Management System with the freedom of a headless CMS and with the full functionality of a traditional CMS,"php,cms,flat-file,flextype,content,content-management,php7,website-builder,twig,doctrine,flat-file-cms,flat-file-db,api,headless,headless-cms,open-source",445
29,https://github.com/aws-samples/aws-serverless-security-workshop.git,"In this workshop, you will learn techniques to secure a serverless application built with AWS Lambda, Amazon API Gateway and RDS Aurora. We will cover AWS services and features you can leverage to improve the security of a serverless applications in 5 domains: identity & access management, code, data, infrastructure, logging & monitoring.",,437
30,https://github.com/Singosgu/GreaterWMS.git,"Open source warehouse management system. And this warehouse-management-system follows Apache License 2.0 and front-back stage decoupling method. API uses restful protocol to facilitate for add-on functions development. The html & js code is constructed with quasar(base on Vue.js v2.6.0+). According to API, it can support business models such as multi warehouse, wave shipment, combined picking and milk-run and so on. To be a greater WMS","warehouse-management-system,wms,wms-system,warehouse-inventory,warehouse-management,warehouse-inventory-tracking",426
31,https://github.com/Azure/azure-api-management-devops-resource-kit.git,Azure API Management DevOps Resource Kit,,413
32,https://github.com/FeatherCMS/feather.git,Feather is a modern Swift-based content management system powered by Vapor 4. ,"swift,vapor-4,cms,engine,framework,api,web,blogging,journalism,publishing,feather",411
33,https://github.com/JoneXiong/DjangoX.git,A web GUI suite for Django ORM data or API data management,,369
34,https://github.com/rabbitmq/rabbitmq-management.git,RabbitMQ Management UI and HTTP API,"rabbitmq,management,monitoring,http,rabbitmq-plugin",360
35,https://github.com/apioak/apioak.git,Full Lifecycle Management API Gateway.,"api-gateway,openresty,gateway,gateway-api,gateway-microservice,nginx,nginx-proxy,lua,apioak,luajit,apis,apigateway,microservice,cloud-native,serverless,service-mesh,dynamic-upstream",343
36,https://github.com/blue-chip-js/blue-chip.git,Normalizes GraphQL and JSON:API payloads into your state management system and provides ORM selectors to prepare data to be consumed by components,"redux,mobx,react,state-management",331
37,https://github.com/cornflourblue/node-mongo-registration-login-api.git,"NodeJS + MongoDB API for User Management, Authentication and Registration",,281
38,https://github.com/microsoft/opensource-portal.git,"{""Microsoft's monolithic GitHub Management Portal enabling enterprise scale self-service powered by the GitHub API 🏔🧑\u200d💻🧰""}","portal,github,management,github-app,microsoft,ospo",278
39,https://github.com/auth0/auth0-PHP.git,Straight-forward and tested methods for accessing Auth0 Authentication and Management API endpoints.,"dx-sdk,php",267
40,https://github.com/microsoft/sqltoolsservice.git,SQL Tools API service that provides SQL Server data management capabilities.,,258
41,https://github.com/cornflourblue/aspnet-core-registration-login-api.git,"ASP.NET Core 2.2 API for User Management, Authentication and Registration",,256
42,https://github.com/angular-extensions/model.git,"Angular Model - Simple state management with minimalist API, one way data flow, multiple model support and immutable data exposed as RxJS Observable.","angular,rxjs,state-management,immutable,model,angular-cli,schematics",248
43,https://github.com/Wscats/cms.git,News Management System Written In PHP,"php,weui,news,codeigniter,api,management-system",246
44,https://github.com/Azure/api-management-developer-portal.git,Developer portal provided by the Azure API Management service.,"microsoft,api-management,azure,developer-portal",242
45,https://github.com/tenseijs/tensei.git,🚀 Content management and distribution with a touch of elegance. ,"nodejs,reactjs,cms,headless,api,graphql,express,apollo-server",242
46,https://github.com/dj-nitehawk/MongoDB.Entities.git,"A data access library for MongoDB with an elegant api, LINQ support and built-in entity relationship management","mongodb,mongodb-driver,mongodb-repo,csharp,linq,mongodb-orm,net5,netstandard2,netcore31",226
47,https://github.com/IndomaximTechID/storaji.git,":ledger: The light/responsive inventory management system available on Windows, macOS and Linux.","inventory,management,backend,services,api",222
48,https://github.com/stormpath/stormpath-sdk-java.git,Official Java SDK for the Stormpath User Management REST API,"spring-boot,java,spring,spring-cloud,servlet,authentication,authorization,identity",221
49,https://github.com/hybridgroup/taskmapper.git,Taskmapper provides a universal API to bug tracking and project management systems using Ruby,,220
50,https://github.com/Kotlin/binary-compatibility-validator.git,Public API management tool,"kotlin,api-management,binary-compatibility,change-management",212
51,https://github.com/javaee/grizzly.git,"Writing scalable server applications in the Java™ programming language has always been difficult. Before the advent of the Java New I/O API (NIO), thread management issues made it impossible for a server to scale to thousands of users. The Grizzly NIO framework has been designed to help developers to take advantage of the Java™ NIO API.","java,nio,http,http2,comet,websocket,eventing",208
52,https://github.com/auth0/auth0.net.git,.NET client for the Auth0 Authentication & Management APIs.,"oauth2,openid-connect,dx-sdk",205
53,https://github.com/openstack/barbican.git,"Barbican is a ReST API designed for the secure storage, provisioning and management of secrets, including in OpenStack environments. Mirror of code maintained at opendev.org.",,203
54,https://github.com/Netrvin/CFPMP.git,Cloudflare Partner Management Panel,"cloudflare,partners,panel,management,cname,api,php",197
55,https://github.com/northwesternmutual/kanali.git,A Kubernetes Native API Management Solution,"kubernetes,opentracing,ingress-controller,api-management,tracing,api-gateway",192
56,https://github.com/tjoudeh/eLearning.WebAPI.git,Tutorial for building eLearning Management RESTFul Service using ASP.Net Web API,,189
57,https://github.com/JulianHayward/Azure-MG-Sub-Governance-Reporting.git,"AzGovViz (Azure Governance Visualizer) is a PowerShell script that captures Azure Governance related information such as Azure Policy, RBAC (a lot more) by polling Azure ARM and Microsoft Graph APIs. From the collected data AzGovViz provides visibility on your\xa0HierarchyMap, creates a\xa0TenantSummary, creates\xa0DefinitionInsights and builds granular\xa0ScopeInsights\xa0on Management Groups and Subscriptions.","azure,azuregovernance,azure-policies,azurepolicy,rbac-roles",189
58,https://github.com/timothyf/EngineY.git,"{""EngineY is an easy to use social network framework and portal implemented in Ruby on Rails that is easy to customize and deploy as your own powerful social media site or other portal type site. Empower users with their own blogs. Enhance collaboration with forums, groups and events. Let your users post Twitter-like status messages. Track all the activity on your site with a live activity stream. Build a custom client to access all of your social data using EngineY's RESTful API.  Also includes integration with Facebook Connect to allow users to login with Facebook credentials.  Recent additions include support for Themes, and Content Management.  For project updates and information, follow the project on Twitter @engineyfw""}",,188
59,https://github.com/adrianhajdin/project_youtube_video_player.git,"This is a code repository for the corresponding article on freeCodeCamp. In this tutorial we are going to build a YouTube Clone Application from Scratch using React. Covered topics: lifecycle methods, project structure, destructuring, state management, passing props from parent to child components, API calls.","project-code,article",187
60,https://github.com/JanssenProject/home.git,"{""Welcome to Janssen: the world's fastest cloud native identity and access management platform""}","oauth,openid,sso,identity,api,security,uma,access-management,iam",185
61,https://github.com/cornflourblue/aspnet-core-3-registration-login-api.git,"ASP.NET Core 3.1 API for User Management, Authentication and Registration","aspnetcore,dotnetcore,aspnetcore3",183
62,https://github.com/inshopgroup/inshop-crm-api.git,"{""Inshop CRM / ERP API. It's powerful framework allows to build systems for business with different workflows. It has on board multi language support, clients management, projects & tasks, documents, simple accounting, inventory management, orders & invoice management, possibilities to integrate with third party software, REST API, and many other features.""}","symfony,api-platform,erp,crm,php,elasticsearch,postgresql",183
63,https://github.com/MAIF/otoroshi.git,Lightweight api management on top of a modern http reverse proxy,"proxy,reverse-proxy,http,http-proxy,scala,akka,playframework,loadbalancer,microservices,api-management,akka-streams,akka-http,http2,hacktoberfest,hacktoberfest2020",182
64,https://github.com/vsch/laravel-translation-manager.git,"Enhanced Management of Laravel 4 & 5 Translations, with Yandex Translation API assisted translations.","laravel-translator,laravel-translation-manager,laravel-5-package,translation-assistance",179
65,https://github.com/markcheno/go-vue-starter.git,"Starter project - Golang api, Vue.js  client with user management and jwt authentication","golang,vuejs2,gorm-orm,negroni,api-server,spa,jwt-authentication,boilerplate,starter-template",179
66,https://github.com/ianunay/mock-node.git,A configurable mock server with an intuitive configuration management interface and a http api,,175
67,https://github.com/contentful/contentful-management.js.git,"{""JavaScript library for Contentful's Management API (node & browser)""}","sdk,javascript,content-management,contentful,contentful-js-sdk",167
68,https://github.com/buildertools/entropy.git,An entropy and failure injection management API for Docker platforms.,,166
69,https://github.com/LLNL/Umpire.git,An application-focused API for memory management on NUMA & GPU architectures,"hpc,memory-management,gpu,blt,portability,radiuss,cpp",164
70,https://github.com/zalando/innkeeper.git,Simple route management API for Skipper,"mosaic,microservices",159
71,https://github.com/inshopgroup/inshop-crm-client.git,"{""Inshop CRM / ERP Client. It's powerful framework allows to build systems for business with different workflows. It has on board multi language support, clients management, projects & tasks, documents, simple accounting, inventory management, orders & invoice management, possibilities to integrate with third party software, REST API, and many other features.""}","vue,vuex,rest-api,crm,erp,vuetify,javascript",145
72,https://github.com/beetlex-io/WebApiBenchmark.git,Web api management and performance testing tools,"web,webapi,testing-tools,performance-testing,management,beetlex,fasthttpapi",144
73,https://github.com/openshift/hive.git,API driven OpenShift cluster provisioning and management,,143
74,https://github.com/Azure/api-management-policy-snippets.git,Re-usable examples of Azure API Management policies,,141
75,https://github.com/filestack/filestack-android.git,Official Android SDK for Filestack - API and content management system that makes it easy to add powerful file uploading and transformation capabilities to any web or mobile application. ,"android,java,sdk,file-upload,file-management,image-processing,video-processing",140
76,https://github.com/JackM36/Eazy-Sound-Manager.git,Eazy Sound Manager is a simple Unity3D tool which aims to make sound and music management in games easier,"unity3d,unity,unity-asset,sound,csharp,music,manager,api",139
77,https://github.com/anggrayudi/SimpleStorage.git,💾 Simplify Android Storage Access Framework for file management across API levels.,"android,storage-access-framework,file,storage,storage-manager,android-storage,saf,scoped-storage,android-10",138
78,https://github.com/tomastrajan/ngx-model.git,"Angular Model. Simple state management with minimalistic API, one way data flow, multiple model support and immutable data exposed as RxJS Observable.","angular,rxjs-observable,data-flow,model,state-management,rxjs5,ngx-model",137
79,https://github.com/mikelaurence/CoreResource.git,"Local & remote resource management for Objective-C in as little code as possible. Note: currently under heavy development, so API changes are likely!",,136
80,https://github.com/AnujaK/restfiddle.git,"An Enterprise-grade API Management Platform for Teams. RESTFiddle helps you design, develop, test and release APIs.",,134
81,https://github.com/filestack/filestack-react.git,Official React component for Filestack - API and content management system that makes it easy to add powerful file uploading and transformation capabilities to any web or mobile application.,"react,filestack,upload,upload-images,upload-file,transforming-files,transformations",132
82,https://github.com/zapadi/redmine-net-api.git,.Net API for Redmine bug/task management systems.,"redmine,c-sharp,dotnet,dotnet-framework,rest,api-client",131
83,https://github.com/r509/r509.git,"r509 is a Ruby gem built using OpenSSL that simplifies management of a public key infrastructure. The r509 API helps with CSR creation, signing/parsing of certificates, revocation (CRL/OCSP), and much more. Along with projects like r509-ocsp-responder & r509-ca-http it is a (RFC 5280) certificate authority suitable for production environments. ",,127
84,https://github.com/GoogleCloudPlatform/esp-v2.git,A service proxy that provides API management capabilities using Google Service Infrastructure.,"envoyproxy,cpp,go,proxy,api,google,cloud-endpoints,api-gateway,google-cloud",125
85,https://github.com/Patreon/nion.git,🌵  Declarative API Data Management Library built on top of redux 🌵,"redux,api,fetch",125
86,https://github.com/ZacSweers/ticktock.git,A timezone data management library for the JVM and Android targeting java.time APIs in Java 8+,"java,kotlin,android,timezone,time,tzdb,threetenbp,jsr310",124
87,https://github.com/Webiks/kibana-API.git,Kibana-API is an extension to Kibana that lets you tap in to the dashboard management board from your app and change the visualizations dynamically,,121
88,https://github.com/googleapis/github-repo-automation.git,A set of tools to automate multiple GitHub repository management.,"github,api",117
89,https://github.com/Haufe-Lexware/wicked.haufe.io.git,An API Management system based on Mashape Kong,"api-portal,mashape-kong,api-management,kong",114
90,https://github.com/xucongli1989/XCLCMS.git,"XCLCMS is a lightweight CMS (content management system) background management system, Developed using asp.net MVC, it provides a simple and easy-to-use web API interface and supports multiple applications for a single merchant.","cms,xclcms,webapi,asp-net,asp-net-mvc,asp-net-web-api,dotnet,content-management-system",106
91,https://github.com/CrowdStrike/CrowdFMS.git,"CrowdStrike Feed Management System. CrowdFMS is a framework for automating collection and processing of samples from VirusTotal, by leveraging the Private API system. This framework automatically downloads recent samples, which triggered an alert on the users YARA notification feed.",,105
92,https://github.com/gravitee-io/gravitee-management-webui.git,Gravitee.io - API Management - Management UI,"api-portal,angularjs,typescript",103
93,https://github.com/microsoft/Office365APIEditor.git,"You can test Microsoft Graph, Outlook REST API, Office 365 Management Activity API and Azure Resource Manager API easily.",,100
94,https://github.com/csvsoundsystem/federal-treasury-api.git,"The scraper, parser, and database creation scripts for Financial Management Service daily U.S. Treasury statements.",,95
95,https://github.com/mariazevedo88/travels-java-api.git,"An API for travel management. It is built with Java, Spring Boot, and Spring Framework. A toy-project to serve as a theoretical basis for the Medium series of articles I wrote about Java+Spring.","java,java11,java-11,api,api-service,api-restful,rest-api,rest,medium-article,http,http-rest-api,restful-api,swagger-api,swagger-documentation,java-api,java-api-for-restful-web-services,java-rest-api,java-restful-api,spring-boot,spring-framework",94
96,https://github.com/stormpath/stormpath-sdk-node.git,Official Node.js SDK for the Stormpath User Management REST API,,94
97,https://github.com/contentjet/contentjet-api.git,Headless API-first content management system,"headless,headless-cms,cms,api-first-cms,rest-api,node,koa2,objectionjs,api",92
98,https://github.com/gravitee-io/gravitee-management-rest-api.git,Gravitee.io - API Management - Management Rest API,,90
99,https://github.com/bkjones/pyrabbit.git,A Python module to communicate w/ the RabbitMQ HTTP Management API,,89
100,https://github.com/Azure-Samples/Serverless-APIs.git,Guidance for building serverless APIs with Azure Functions and API Management.,,88
101,https://github.com/fortinet-solutions-cse/fortiosapi.git,Python library aimed to be used by configuration management system using Fortigate/Fortios devices (REST API),"fortigate,vdom,fortiosapi-library",88
102,https://github.com/cyberark/epv-api-scripts.git,"These API scripts enable CyberArk users to automate privileged account management task like account creation, user management, and more.","rest-api,privileged-access-security,privileged-access-management,powershell-scripts,automation",87
103,https://github.com/minhtc/react-recontext.git,"A lightweight state management inspired by Flux, Redux, based on the latest React Context API.","react,react-native,redux,contex,react-context,flux,state-management,state,reactjs,lightweight",85
104,https://github.com/googleads/googleads-adsense-examples.git,Samples for the AdSense Management API,,84
105,https://github.com/JeremyGrosser/repoman.git,A reprepro and pbuilder management API with a RESTful interface,,84
