,Url,Description,Topics,Stars
12,https://github.com/mozdevs/devrel-dashboard.git,"{""Dashboard for bugs filed by members of Mozilla's Developer Relations team""}",,4
13,https://github.com/devrelcollective/devrelcollective.fun.git,"Home page for the DevRel Collective, a place forsharing information, resources, and encouragement among the Developer Relations community.","community,devrel,devrel-community",3
14,https://github.com/joshmarinacci/devrel-history.git,The History of Developer Relations,,2
15,https://github.com/kmaida/speakerbot.git,Slack App to manage and track internal speaking engagements for Developer Relations.,"slack,slackbot,slack-api,javascript",2
16,https://github.com/Aryia-Behroziuan/Overview.git,"{""Knowledge-representation is a field of artificial intelligence that focuses on designing computer representations that capture information about the world that can be used to solve complex problems.  The justification for knowledge representation is that conventional procedural code is not the best formalism to use to solve complex problems. Knowledge representation makes complex software easier to define and maintain than procedural code and can be used in expert systems.  For example, talking to experts in terms of business rules rather than code lessens the semantic gap between users and developers and makes development of complex systems more practical.  Knowledge representation goes hand in hand with automated reasoning because one of the main purposes of explicitly representing knowledge is to be able to reason about that knowledge, to make inferences, assert new knowledge, etc. Virtually all knowledge representation languages have a reasoning or inference engine as part of the system.[10]  A key trade-off in the design of a knowledge representation formalism is that between expressivity and practicality. The ultimate knowledge representation formalism in terms of expressive power and compactness is First Order Logic (FOL). There is no more powerful formalism than that used by mathematicians to define general propositions about the world. However, FOL has two drawbacks as a knowledge representation formalism: ease of use and practicality of implementation. First order logic can be intimidating even for many software developers. Languages that do not have the complete formal power of FOL can still provide close to the same expressive power with a user interface that is more practical for the average developer to understand. The issue of practicality of implementation is that FOL in some ways is too expressive. With FOL it is possible to create statements (e.g. quantification over infinite sets) that would cause a system to never terminate if it attempted to verify them.  Thus, a subset of FOL can be both easier to use and more practical to implement. This was a driving motivation behind rule-based expert systems. IF-THEN rules provide a subset of FOL but a very useful one that is also very intuitive. The history of most of the early AI knowledge representation formalisms; from databases to semantic nets to theorem provers and production systems can be viewed as various design decisions on whether to emphasize expressive power or computability and efficiency.[11]  In a key 1993 paper on the topic, Randall Davis of MIT outlined five distinct roles to analyze a knowledge representation framework:[12]  A knowledge representation (KR) is most fundamentally a surrogate, a substitute for the thing itself, used to enable an entity to determine consequences by thinking rather than acting, i.e., by reasoning about the world rather than taking action in it. It is a set of ontological commitments, i.e., an answer to the question: In what terms should I think about the world? It is a fragmentary theory of intelligent reasoning, expressed in terms of three components: (i) the representation's fundamental conception of intelligent reasoning; (ii) the set of inferences the representation sanctions; and (iii) the set of inferences it recommends. It is a medium for pragmatically efficient computation, i.e., the computational environment in which thinking is accomplished. One contribution to this pragmatic efficiency is supplied by the guidance a representation provides for organizing information so as to facilitate making the recommended inferences. It is a medium of human expression, i.e., a language in which we say things about the world. Knowledge representation and reasoning are a key enabling technology for the Semantic Web. Languages based on the Frame model with automatic classification provide a layer of semantics on top of the existing Internet. Rather than searching via text strings as is typical today, it will be possible to define logical queries and find pages that map to those queries.[13] The automated reasoning component in these systems is an engine known as the classifier. Classifiers focus on the subsumption relations in a knowledge base rather than rules. A classifier can infer new classes and dynamically change the ontology as new information becomes available. This capability is ideal for the ever-changing and evolving information space of the Internet.[14]  The Semantic Web integrates concepts from knowledge representation and reasoning with markup languages based on XML. The Resource Description Framework (RDF) provides the basic capabilities to define knowledge-based objects on the Internet with basic features such as Is-A relations and object properties. The Web Ontology Language (OWL) adds additional semantics and integrates with automatic classification reasoners.[15]""}",,2
17,https://github.com/netdata/developer-relations.git,"The documents, tools, and processes used by the Developer Relations team at Netdata. Open-sourced, for everyone, for free.","devrel,devrel-community,community,discourse",1
18,https://github.com/donejs/developer-relations.git,Developer Relations & Evangelism,,1
19,https://github.com/mahemoff/devrels.git,Index of Developer Relations Organisations,,1
20,https://github.com/johnbender/presentation-jqmdevrel.git,jQuery Mobile information for developer relations,,1
21,https://github.com/pachicodes/developer-relations-talk.git,💫Sharing material and researchers presented on my talk about Developer Relations,,1
22,https://github.com/tekimaki/libertygraph.git,A developer package for creating graph relations between content objects,,1
23,https://github.com/Hacko007/sqltableandsphelper.git,Developers Tools for viewing data and relations in SQL Server databases,"c-sharp,mssql-database",1
24,https://github.com/oldgregg89/CRM-React.git,"Basic Customer Relations Management Platform built with react, that is non industry specific but can allow for future developers to add on more features or customize the platform itself. Features of the platform allow for user authentication with two levels of credentials, first is the member login and 2nd is the leadership login.",,1
25,https://github.com/feicui1/predix-tutorials.git,Short markdown tutorials from Developer Relations,,0
26,https://github.com/HillReywer/DevRel.git,"Developer relations, developer marketing, developer experience.",,0
27,https://github.com/rawkode/devrel-as-code.git,Developer Relations as Code,,0
28,https://github.com/maxkatz/devrel-resources.git,Developer Relations resources,,0
29,https://github.com/matthewharrilal/Granite-Cont.git,Granite Solidifying Developer Relations,,0
30,https://github.com/mrlynn/rel.git,MongoDB Developer Relations static site,,0
31,https://github.com/fulchere/rocket-mortgage-devrel-tracker.git,Rocket Mortgage Developer Relations Tracker ,,0
32,https://github.com/tristansokol/Developer-Relations.git,A collection of thoughts and tools for developer relations,,0
33,https://github.com/mrlynn/godevrel.git,Go Developer Relations - DevRel as a Career,,0
34,https://github.com/krhoyt/Avocado.git,Community management software for developer relations professionals.,,0
35,https://github.com/goofmint/OpenDevRel.git,Open source Developer Relations Management System.,,0
36,https://github.com/goofmint/Yokoso.git,Yokoso is CMS for Developer Relations.,,0
37,https://github.com/s-gunawan/steve.gunawan.git,Developer Relations Engineer Task for MediaMath,,0
38,https://github.com/s-gunawan/dr-interview-submissions.git,Interview submissions for Developer Relations Engineering team,,0
39,https://github.com/samdutton/chromedevrel.git,An introduction to Google Chrome Developer Relations,,0
40,https://github.com/mrahimygk/works.git,A database schema for project-developer relations,,0
41,https://github.com/matthewharrilal/Granite-Backend.git,Backend to Granite ~ Solidifying Developer Relations,,0
42,https://github.com/tapishr/setu_challenge.git,This code is written for the Setu Developer Relations Challenge,,0
43,https://github.com/DevReljp/Yokoso.git,Yokoso is a CMS for Developer Relations (DevRel).,,0
44,https://github.com/leggetter/devrel-roles.git,Presentation about defining the roles within Developer Relations,,0
45,https://github.com/franklinhenri/100DaysOfDevRel.git,100 Days of Developer Relations. Exploring & documenting the DevRel journey. 📢Developer Advocates/ Evangelists/ Community builders & DevRel folks - Contributions are welcome 🎉,,0
46,https://github.com/bhnettv/Avocado.git,"Developer relations solution (advocates, champions, contacts, projects, events, and more) ... in a box!",,0
47,https://github.com/kmaida/gatsby-speakerbot.git,Single-workspace Slack app for @gatsbyjs inkteam to manage speaking engagements for Developer Relations & Community,"slack,slackbot,nodejs,javascript",0
48,https://github.com/Widen/jekyll-theme-guardian.git,Guardian: A Jekyll theme made by the Widen Developer Relations Committee,,0
49,https://github.com/thinkingserious/sendgrid-devrel-api.git,This API allows you to interact with data related to Dev Rel (Developer Relations) KPIs (Key Performance Indicators).,,0
50,https://github.com/weiwenl/StackBananaflow.git,A platform for new developers to ask questions with relations to what they learn from open coursewares and get help,,0
51,https://github.com/KuldipCodes/reference-to-relation.git,"useful for laravel 5.2, 5.3, 5.4, 5.5 developer to check eloquent model relations","laravel,laravel-framework,laravel5,eloquent-models,eloquent-database,migrations,migration-tool,relationships,relational-model,mysql-database",0
52,https://github.com/BayAreaMaverick/DevRel.git,A collection of tools and articles to help companies better engage and support developers. Meant for DevRel (Developer Relations) and Technology Product Marketers,,0
53,https://github.com/TobinStonelake/i-r-m.git,"{""An International Relations blog site, under the name International Relations Media (IRM). This will be presented as my first Milestone Project for the Code Institute's Fullstack Web Developer course.""}",,0
54,https://github.com/madamCS/DASH.git,"Google Developer Relations Internship final project. Generating charts in Sheets based on Vision API data, after picking an image from Drive.",,0
55,https://github.com/jigyasa-grover/Github-Craftwork-SF.git,Stuff from the GitHub Craftwork Workshop organised by the Github developer relations team in San Francisco to help us with how to use the GitHub API to build better developer workflows.,,0
56,https://github.com/amanrj33/DevBytes.git,An app that displays a list of DevByte videos. DevByte videos are short videos made by the Google Android developer relations team to introduce new developer features on Android.,,0
57,https://github.com/shivani909/shivani909.git,"{""Hi there 👋 My name is Shivani and here's a little about me.  🔭 I’m currently building a gaming app. 🌱 I’m currently learning Firebase & GetX. 👯 I’m looking to collaborate on with community building and developer relations. 💬 Ask me about Flutter 📫 How to reach me: shivanipandeycontact@gmail.com ⚡ Fun fact: “If I could have any superpower, it would be a TECH-LORD”""}",,0
58,https://github.com/mlmdevelopers/mlmdeveloper.git,"It says, A business becomes successful when people eager to know about it. The Concept of Multilevel Marketing Business is making money in less time and provide more profit by limited investment. Yes ! An good Business Plan makes sure your success and MLM Developers helps you become a successful Businessman. Our versatile softwares have latest and updated modules, We develop not only softwares and Website but also we are maintain relations to our cliens to make them friendly by our best services.",,0
59,https://github.com/rowelorbaneja/DevBytes.git,"{""DevByteViewer app displays a list of DevByte videos. DevByte videos are short videos made by the Google Android developer relations team to introduce new developer features on Android. They're also a great way to stay up to date with new features as they come out as well as tips and best practices. This app fetches the DevByte video list from the network using the Retrofit library and displays it on the screen. It uses a ViewModel and LiveData to hold the data and update the UI. Since the video list is big, results are displayed in a RecyclerView.""}",,0
