,Url,Description,Topics,Stars
813,https://github.com/cagdasdemirer/Newegg-Web-Scraper.git,"This script scrapes the website according to entered URL and creates a file includes product name, seller, discount, price, etc. in CSV format.",,3
814,https://github.com/zaikio/order_optimizer.git,The OrderOptimizer gem helps to find the cheapest order combination when the good is offered in different pack sizes and at different discount levels,,3
815,https://github.com/willboudle/magento-per_customer_discount.git,Creates a new customer attribute: per_cust_discount and then uses observers to set that price on the product list and on the product page,,3
816,https://github.com/Midoriykawa/Bernkastel-crack-berserk.git,"black sale, 1 script $ 7 all scripts $ 32  sale the promotion ends on February  29  Kishirika Kishirisu#6329 Weekend discounts! 7$- 1 script, a whole package of scripts is not $ 50, but $ 32 продаю за голду все скрипты || 2 ляма голды(2 скрипта) I exchange scripts,  ","tera-proxy,toolbox,tera-toolbox,bernkastel,bernk-crack,bernkaste-crack,bernkastel-crack,script-zerker",3
817,https://github.com/YOLOCASH/YLC-Franchising-Model-Token.git,Yolocash (YLC) Token is an unique cryptocurrency project driven by a global collaborative community with no private business agenda backing it. Know as the new kind of concept to tokenized franchising.  By using Yolocash token you can get discounts and easy process for franchising.,,3
818,https://github.com/kassent/SharedDiscount.git,"This plugin makes all of your companions share the maximum discount which one of your companions can enjoy,so no longer you have to transfer everything to your barter character.(Divinity: Original Sin 2)",,3
819,https://github.com/robgen/distNPVaggregateLosses.git,"this class allows to compute the distribution of the Net Present Value (NPV) of the aggregate seismic economic losses over a given time horizon, and for a given financial discount rate",,3
820,https://github.com/usability-ums/UMS-HE.git,UMS-HE stands for Usability Management System for Heuristic Evaluation. UMS-HE is a web base system that designed to help automate the Expert Review or more commonly known as Heuristic Evaluation (HE) involves a product being reviewed based on a set of heuristics or guidelines. It is also known as Discount Usability Engineering. ,,3
821,https://github.com/glennneiger/Magento-2-affiliate-pro.git,"{""# MAGENTO 2 AFFILIATE PRO  This is a perfect extension for you to create your affiliate program. As you may know, affiliate marketing is one of the most important marketing tools for selling online. It helps you to drive more sales from your affiliate channels and let your affiliate earn money. It is fully responsive, fast and easy for affiliate partners to join your program.  - Multiple Affiliate Programs - Multi-level Marketing - Set Commission, Discount & Payout Requirements. - Easy to Set Condition & Requirements If Needed - Manage Banner & Links in 1 place - Payout Requirements - Transaction Management. - SET Withdrawal Limits - Manage partner's account with ease - Pay Per Sale - Mass Payments - Support the most popular payment methods: Paypal, Skrill (coming soon) - Clear and Easy To Use  ## 1. Documentation  - Installation guide: https://blog.landofcoder.com/magento-2-install-extension/ - Download from our Live site: https://landofcoder.com/magento-2-affiliate-extension.html/ - Get Support: https://landofcoder.ticksy.com/   ## 2. How to install Extension  ### Install via composer (recommend)  Your magento 2 extensions can be installed in a few minutes by going through these following steps  Step 1: Download/purchase the extension  Step 2: Unzip the file in a temporary directory  Step 3: Upload it to your Magento installation root directory  Step 4: Disable the cache under System\xad >> Cache Management  Step 5: Enter the following at the command line:  php \xadf bin/magento setup:upgrade  Step 6: After opening Stores\xad >>Configuration >\xad>Advanced >\xad> Advanced, the module will be shown in the admin panel    ## 3. What make people fall in love with the extensions  ### Multiple Affiliate Programs With our magento 2 affiliate extension, you can create as many affiliate program as possible. There is no limitation. Each program, you can change:  - Name - Description - Affiliate Groups - Display - Valid Date - Status - Order - Storeview - Discount - Condition - Commission   ### Multi-level Marketing Using our magento 2 affiliate extension, you can add multiple tiers and set the different level of commissions for each tier.   ### Set Commission, Discount & Payout Requirements. In each affiliate program, it is easy for you to set Commission/ Discount & Conditions for each program. You can choose to give commission by percentage or fixed amount. The extension comes with conditions and requirements that you can freely set to meet your expectation.   ### Easy to Set Condition & Requirements If Needed Do you need to pay different commission levels based order quality, order quantity or product attributes? Our magento 2 affiliate extension will help you easily create multiple tiers as you want.  ### Manage Banner & Links in 1 place With our magento 2 affiliate extension, you can upload banners or text links for your affiliates. Your partners can use the source code to post in website, forum, blog...   ### Payout Requirements You can set a minimum amount of money that account must reach to withdraw their commission.   ### Transaction Management. In Transaction Management field, you can check:  - Affiliate Code - Order ID - Order Total - Commission Total - Description - Transaction Status    ### SET Withdrawal Limits Moreover, you will find it easy to set a limitation for withdrawal.   ###  Manage partner's account with ease Affiliate Details Payment Details History Transaction History Withdrawal   ###  Pay Per Sale With our extension, affiliate only gets paid when products are purchased. As you may know, affiliate partners maybe promote you products through multiple channels. However, they only get paid if products are bought via their links & referrals.    ### Mass Payments With PayPal API auto-process, admin can send money instantly to multiple recipients at once. The payment process will be much more fast and convenient right?   ### Support the most popular payment methods Our magento 2 affiliate extension supports the most popular payment methods such as Paypal, Skrill (coming soon)   ### Clear and Easy To Use If you are wondering whether it is user-friendly or not, we can make sure that it is really easy to use.   ### Divide Affiliates Into Different Group It allows you to create as many groups as you want. Then, you can classify your affiliate members into the different group. These groups are managed by Magento 2 system.   ### Account Management Take a full control of accounts: Add, enable or disable, delete accounts and edit each account information. View information on affiliates such as their programs, payment info, transactions, payments, commission, group, withdrawal history.   ### Email Notifications You can easily choose email sender in the admin panel.   ### Smart Referral Links Affiliates can share link through email, social network, put on website & blog with ease.   ### Transaction Management Access relevant information of an affiliate's transaction: campaign code, order ID, customer email, products, commission and discount, order ID Monitor, review and filter transactions.   ### Withdraw management Monitor affiliate email, balance, commission, status, customer account   ## 4. Full Feature List - Multiple Affiliate Programs - Multi-level Marketing - Pay Per Sale - Customizable Affiliate links - Create many Affiliate Groups - Unlimited Affiliate Campaigns - Banner and Links - Smart Referral Links - Withdraw their commissions via most popular payment methods: Paypal, Skrill (coming soon) - Lifetime Commissions - Email Notifications - Report Integrated - Account Management - Banner & Link Management - Pay Per Sale - Transaction Management - Withdrawal Management - Multiple Payment Methods: PayPal or credit card - Manage group affiliate - Manage account & feature: jquery UI autocomplete select customer when adding new - Manage banners, links - Manage campaign - Manage transaction - Transaction History And Balance - Easy Withdrawal Process - Easy To Manage Programs and Commissions - Simple commission setting process in the backend. - History commission - History orders that customer use affiliate code - Generate links, banners with track code of campaign and affiliate code   ## LandOfCoder extensions on Magento Marketplace, Github - [Magento 2 Multivendor Marketplace](https://landofcoder.com/magento-2-marketplace-extension.html/) - [Magento 2 Blog Extension](https://landofcoder.com/magento-2-blog-extension.html/) - [Magento 2 Testimonial Extension](https://landofcoder.com/testimonial-extension-for-magento2.html/) - [Magento 2 Image Gallery](https://landofcoder.com/magento-2-image-gallery.html/) - [Magento 2 Faq Extension](https://landofcoder.com/faq-extension-for-magento2.html/) - [Magento 2 Help Desk](https://landofcoder.com/magento-2-help-desk-extension.html) - [Magento 2 OUT OF STOCK NOTIFICATION](https://landofcoder.com/magento-2-out-of-stock-notification.html/) - [Magento 2 CUSTOMER QUOTATION FOR MAGENTO 2](https://landofcoder.com/magento-2-quote-extension.html/) - [Magento 2 RMA Extension](https://landofcoder.com/magento-2-rma-extension.html/) - [Magento 2 Stripe Payment](https://landofcoder.com/magento-2-stripe-payment-pro.html/) - [Magento 2 SMS Notification](https://landofcoder.com/magento-2-sms-notification-extension.html/) - [Magento 2 Page Builder](https://landofcoder.com/magento-2-page-builder.html/) - [Magento 2 Form Builder](https://landofcoder.com/magento-2-form-builder.html/) - [Magento 2 Advanced Report](https://landofcoder.com/magento-2-advanced-reports.html/) - [Magento 2 Marketplace PRO](https://landofcoder.com/magento-2-marketplace-pro.html/) - [Magento 2 Order Tracking](https://landofcoder.com/magento-2-order-tracking-extension.html/) - [Magento 2 Order Tracking PRO](https://landofcoder.com/magento-2-order-tracking-pro-extension.html/) - [Magento 2 Multiple Flat Rate](https://landofcoder.com/magento-2-multiple-flat-rate-shipping.html/) - [Magento 2 Shipping Per Product](https://landofcoder.com/magento-2-shipping-per-product.html/) - [Magento 2 Social Login](https://landofcoder.com/magento-2-social-login.html/) - [Magento 2 Store Locator](https://landofcoder.com/magento-2-store-locator.html/) - [Magento 2 Auto Search Extension](https://landofcoder.com/magento-2-search.html/) - [Magento 2 Mega Menu](https://landofcoder.com/magento-2-mega-menu.html/) - [Magento 2 Mega Menu PRO](https://landofcoder.com/magento-2-mega-menu-pro.html) - [Magento 2 Image Gallery PRO](https://landofcoder.com/magento-2-image-gallery-pro.html/) - [Magento 2 Layered Navigation](https://landofcoder.com/magento-2-layered-navigation.html/) - [Magento 2 Auction Extension](https://landofcoder.com/magento-2-auction-extension.html/) - [Magento 2 Store Credit](https://landofcoder.com/magento-2-store-credit.html/) - [Magento 2 Reward Point](https://landofcoder.com/magento-2-reward-points.html/) - [Magento 2 Follow Up Email](https://landofcoder.com/magento-2-follow-up-email.html/) - [Magento 2 Coupon Code Generator](https://landofcoder.com/magento-2-coupon-extension.html/) - [Magento 2 Hide Price](https://landofcoder.com/magento-2-hide-price.html/) - [Magento 2 Price Comparison](https://landofcoder.com/magento-2-price-comparison.html/) - [Magento 2 SMTP Extension](https://landofcoder.com/magento-2-smtp-extension.html)""}",,3
822,https://github.com/abjcoinblockchain/AbjcoinCommerce.git,"This is the official source code of the AbjcoinCommerce. Abjcoin Commerce(ABJC) is a decentralize Application blockchain(DApp) disrupting the over $1 trillion  E-commerce industry through it fee-less and border-less marketplace that facilitate the sales and distribution of goods and services across the world on a smart DApp escrow. The Abjcoin DApp provides discount products prices for buyers and also enables anyone to sell globally through their mobile phones without payment limitations, while also rewarding Abjcoin commerce holders through DApp POS.",,3
823,https://github.com/xploitspeeds/Bookmarklet-Hacks-For-School.git,"* READ THE README FOR INFO!! * Incoming Tags- z score statistics,find mean median mode statistics in ms excel,variance,standard deviation,linear regression,data processing,confidence  intervals,average value,probability theory,binomial distribution,matrix,random numbers,error propagation,t statistics analysis,hypothesis testing,theorem,chi square,time series,data collection,sampling,p value,scatterplots,statistics lectures,statistics tutorials,business mathematics statistics,share stock market statistics in calculator,business analytics,GTA,continuous frequency distribution,statistics mathematics in real life,modal class,n is even,n is odd,median mean of series of numbers,math help,Sujoy Krishna Das,n+1/2 element,measurement of variation,measurement of central tendency,range of numbers,interquartile range,casio fx991,casio fx82,casio fx570,casio fx115es,casio 9860,casio 9750,casio 83gt,TI BAII+ financial,casio piano,casio calculator tricks and hacks,how to cheat in exam and not get caught,grouped interval data,equation of triangle rectangle curve parabola hyperbola,graph theory,operation research(OR),numerical methods,decision making,pie chart,bar graph,computer data analysis,histogram,statistics formula,matlab tutorial,find arithmetic mean geometric mean,find population standard deviation,find sample standard deviation,how to use a graphic calculator,pre algebra,pre calculus,absolute deviation,TI Nspire,TI 84 TI83 calculator tutorial,texas instruments calculator,grouped data,set theory,IIT JEE,AIEEE,GCSE,CAT,MAT,SAT,GMAT,MBBS,JELET,JEXPO,VOCLET,Indiastudychannel,IAS,IPS,IFS,GATE,B-Tech,M-Tech,AMIE,MBA,BBA,BCA,MCA,XAT,TOEFL,CBSE,ICSE,HS,WBUT,SSC,IUPAC,Narendra Modi,Sachin Tendulkar Farewell Speech,Dhoom 3,Arvind Kejriwal,maths revision,how to score good marks in exams,how to pass math exams easily,JEE 12th physics chemistry maths PCM,JEE maths shortcut techniques,quadratic equations,competition exams tips and ticks,competition maths,govt job,JEE KOTA,college math,mean value theorem,L hospital rule,tech guru awaaz,derivation,cryptography,iphone 5 fingerprint hack,crash course,CCNA,converting fractions,solve word problem,cipher,game theory,GDP,how to earn money online on youtube,demand curve,computer science,prime factorization,LCM & GCF,gauss elimination,vector,complex numbers,number systems,vector algebra,logarithm,trigonometry,organic chemistry,electrical math problem,eigen value eigen vectors,runge kutta,gauss jordan,simpson 1/3 3/8 trapezoidal rule,solved problem example,newton raphson,interpolation,integration,differentiation,regula falsi,programming,algorithm,gauss seidal,gauss jacobi,taylor series,iteration,binary arithmetic,logic gates,matrix inverse,determinant of matrix,matrix calculator program,sex in ranchi,sex in kolkata,vogel approximation VAM optimization problem,North west NWCR,Matrix minima,Modi method,assignment problem,transportation problem,simplex,k map,boolean algebra,android,casio FC 200v 100v financial,management mathematics tutorials,net present value NPV,time value of money TVM,internal rate of return IRR Bond price,present value PV and future value FV of annuity casio,simple interest SI & compound interest CI casio,break even point,amortization calculation,HP 10b financial calculator,banking and money,income tax e filing,economics,finance,profit & loss,yield of investment bond,Sharp EL 735S,cash flow casio,re finance,insurance and financial planning,investment appraisal,shortcut keys,depreciation,discounting","hacking,javascript,bookmarks,school,exploits,exploit,school-project,exploitation,lua,javascript-library,javascript-tools,electronics,technology,tech,tagsforlikes,electronic,hack,computers,laptops,matrix",3
824,https://github.com/amw/spree-simple-volume-pricing.git,Spree extension that allows quantity discounts,,2
825,https://github.com/farosinv/sale_global_discount.git,Odoo sale global discount.,,2
826,https://github.com/mongramosjr/best-deals.git,Odoo Modules for Discounts and Coupons,,2
827,https://github.com/crossroadlabs/CDiscount.git,Swift wrapper over Discount: C markdown implementation,,2
828,https://github.com/cafe24-app/cafe24_app_discount_sample.git,cafe24 Discount app sample - 할인앱 샘플 코드,,2
829,https://github.com/tastyigniter/ti-ext-coupons.git,A TastyIgniter extension that allows you to offer coupon codes and discounts to your customers,"coupons,discounts,tastyigniter",2
830,https://github.com/easydigitaldownloads/EDD-Volume-Discounts.git,Volume Discounts for Easy Digital Downloads,,2
831,https://github.com/JDutil/spree_group_pricing.git,Group discounts where x orders for a product causes y discount.,,2
832,https://github.com/fabien/spree_discount.git,A simple way to display percentage discounts on products.,,2
833,https://github.com/ocmod-space/ocmod-price-range.git,"The «Price Range+» extension is for Opencart CMS 3. The extension allows to display price ranges of products based on option prices, specials and discounts.",,2
834,https://github.com/karanmotani/bigram-probabilities.git,"Bigram model without smoothing, with add-one smoothing and Good-turing discounting",,2
835,https://github.com/piyushranjan/discount_engine.git,A simple discount engine,,2
836,https://github.com/rsundriyal/EBIZ---Ecommerce-website-on-PHP-CURL-MYSQL-Wordpress.git,"Ecommerce website similar to amazon with lots of exciting features like product compare, Guest checkout , coupon codes , discounts , cross domain purchase , live chat support 24*7 etc ",,2
837,https://github.com/brontes3d/tribute.git,reporting billing system based on monthly invoicing with a rules engine for discounts and promotions,,2
838,https://github.com/kevomash10/OrderSystemCalculator.git,"Calculates discounts,total prices and total prices with discounts",,2
839,https://github.com/amnn/discounts.git,A system for applying discounts.,,2
840,https://github.com/Tyratox/vendure-bulk-discounts.git,Adds bulk discounts to vendure,,2
841,https://github.com/scottcwilson/zen_cart_quantity_discounts.git,Quantity Discounts for Zen Cart ,,2
842,https://github.com/yashthakar1997/nearby-location.git,project for discounts and offers,,2
843,https://github.com/qvacua/ocdiscount.git,A Cocoa wrapper framework around the discount markdown parser,,2
844,https://github.com/bonsook/ycevo.git,Non-parametric estimation of the discount rate and yield curve,,2
845,https://github.com/8sun/opencart-manager-discount.git,"Opencart Manager Discount (en, ru, ua) + LoadAll() in Language",,2
846,https://github.com/timothymchristensen/NPSDFD.git,"Replication data and files for Christensen (2017): ""Nonparametric Stochastic Discount Factor Decomposition""",,2
847,https://github.com/atm-john/dolibarr_module_discountrules.git,Dolibarr module usefull to manage discount for a lot of product,,2
848,https://github.com/sunnysideup/silverstripe-ecommerce_complex_pricing.git,add pricing rules to your silverstripe e-commerce (e.g. discount per group or per country),,2
849,https://github.com/denisbrandl/productdiscountspecialbyweekday.git,Create a discount or special product by weekday on the Opencart,opencart,2
850,https://github.com/JKeep/CeramicPrinter_Marlin_REPRAP_DISCOUNT_SMART_CONTROLLER.git,"{""Marlin arduino firmware for 'Make your own Ceramic 3D Printer with a REPRAP_DISCOUNT_SMART_CONTROLLER""}",,2
851,https://github.com/vanilla-thunder/oxid-module-active-discounts.git,userfriendly displaying active discounts in frontend,,2
852,https://github.com/dimadin/nth-order-discount-for-woocommerce.git,Automatic discounts after every nth order.,,2
853,https://github.com/Doomageddon/TelegramBot.git,This telegram bot can send discounts from ATB-market,,2
854,https://github.com/4lisalehi/torob-discount-crawler.git,A simple crawler of Digikala discounts on its homepage,"python,html",2
855,https://github.com/MrEbabi/Woocommerce-Category-Discounts.git,PHP Code For WooCommerce Discounts Based on Categories,"woocommerce,wordpress,php,woocommerce-discounts,discount",2
856,https://github.com/pervino/spree_bulk_discounts.git,Spree extension to add bulk discounts for specific quantities.,,2
857,https://github.com/helloandysok/helloandysok.github.io.git,AMZ SPY: Get Notified For Any Amazon Product Discounts,,2
858,https://github.com/metaclassco/django_oscar_non_standard_dicounts.git,Affiliate and user-specific discounts in the Django-Oscar project.,"django,django-oscar,ecommerce,discounts,referral-program",2
859,https://github.com/byteball/discount-stablecoin-aa.git,Autonomous Agent for Discount Stablecoins https://discount.ostable.org,"defi,autonomous-agents,stablecoin",2
860,https://github.com/Sampramudana/QuiziOSDiscount.git,Quiz Discount iOS,,2
861,https://github.com/1Hive/vesting-party.git,Vested allows Promoters to distribute vested tokens via airdrops and/or discounted exchange,,2
862,https://github.com/diegodominguez3/Magento2-MinicartDiscount.git,"Minicart plugin to add old price, discount percentage and saved amount to minicart item ","magento2,module,minicart",2
863,https://github.com/charitydiscount/mobile.git,Mobile App for Charity Discount,,2
864,https://github.com/ABCD-STUDY/delay-discounting.git,Delay-discounting task measuring impulsivity,,2
865,https://github.com/truetamtam/steam-discounts-tracker.git,Steam summer sale. Watch steam discounts and receive notification to your desktop.,,2
866,https://github.com/ali5991jalali/get_discounts.git,you can get json api for discounts from https://takhfifan.com/ website ,,2
867,https://github.com/nvh0412/dealhunting.git,"DealHunting is an Android Application which allows you to get newest sales, discounts, promotion. ",android,2
868,https://github.com/Iamdavidonuh/ecomm-parser.git,Scrape eCommerce sites to check for discounts on your favorite items,,2
869,https://github.com/7Backwards/All-in-one-Wallet.git,"Fidelity Card System to manage sales, discounts and transactions of a company",,2
870,https://github.com/moewe-io/woocommerce-apply-order-discount.git,This plugin allows administrators to apply discounts on orders from the administration panel.,"wordpress-plugin,wordpress,woocommerce,discount",2
871,https://github.com/1Hive/flora-discount-validator.git,Discount Validator for the flora sidechain,,2
872,https://github.com/gustavohenrique/grpc-golang-nodejs.git,Fetching products and applying discount for each,,2
873,https://github.com/krzysztofzuraw/rabat.git,🛍  Discount/Promo codes tracker for chrome,"chrome-extension,typescript,react",2
874,https://github.com/JulianoPeresLadeira/kacheck.git,I like Kabum and I like to know when they have good discounts. This checks what is discounted for me because why not.,,2
875,https://github.com/skranz/repgame.git,Solve discounted repeated games with monetary transfers,,2
876,https://github.com/yawenl/bug_price_finder.git,find bug price on discount websites,,2
877,https://github.com/SnowdogApps/FirstItemFree.git,Discount for first n items in cart,,2
878,https://github.com/bbeny123/AMA_server.git,Server for android QR discount application,"spring,spring-boot-2,maven,hibernate,postgresql,spring-boot,spring-security,spring-security-oauth2,oauth2,jwt,captcha,aes,gson,spring-data-jpa,android-server,rest,rest-api",2
879,https://github.com/skranz/dyngame.git,Solving discounted stochastic games with monetary transfers,,2
880,https://github.com/ikennaokpala/code_kata_dg.git,Kata code.. Supermarket discount rules program,,2
881,https://github.com/brituy/Discount.git,Magento 2.4 Discount module (cart rule),,2
882,https://github.com/xliUNR/ZazoveExercises.git,Exercises for Zazove Associates interview process. Option-free coupon bond pricing using discounted cash flow model and European stock pricing using binomial model.,"python3,finance,options-pricing,options-trading,bond-pricing,discounted-cash-flows,interpolation,linear-splines,european-options,binomial-model",2
883,https://github.com/bluecrayon52/Kupongo.git,A coupon gamification app that lets loose the wildest discounts on every street corner so you can wrangle them in. ,,2
884,https://github.com/tanerdiler/tdd-kata-spring-boot-ecommerce.git,Basket Management Project for E-Commerce Platforms includes defining campaigns and calculation discounts for products added in basket.,,2
885,https://github.com/sboosali/rl.git,"reinforcement learning. q learning (expected exponentially discounted reward); r learning (expected average reward); ""d"" learning (expected arbitrarily-multiplicatively discounted reward)",,2
886,https://github.com/yangb92/NintendoSpider.git,The spiders gets Nitendo game discounts.任天堂游戏在各国家的最新折扣.,,2
887,https://github.com/arshinmar/DaisyHacks.git,Image segmentation and text recognition on images of product flyers. Segmented for individual products and determined discounts and prices.,,2
888,https://github.com/VlasovArtem/cardiff.git,Project that helps to share your discount cards ,,2
889,https://github.com/varun95/coupon-management.git,Simple promotional/discount coupon management system with basic operations.,,2
890,https://github.com/puneetk00/customeroffer.git,Magento 2.x Custom discount page for producuts,,2
891,https://github.com/elindydotcom/eddsumo.git,Integrated AppSumo discount codes with Easy Digital Downloads (EDD).,"edd,wordpress-plugin",2
892,https://github.com/bhuiyanmobasshir94/price_tracker.git,"A discount tracking application with django, celery and others",,2
893,https://github.com/marketplacer/price-view-ios.git,iOS control to show price and price before discount,,2
