,Url,Description,Topics,Stars
0,https://github.com/timekit-io/booking-js.git,:date: Make a beautiful embeddable booking widget in minutes,,2339
1,https://github.com/aws-samples/aws-serverless-airline-booking.git,"Airline Booking is a sample web application that provides Flight Search, Flight Payment, Flight Booking and Loyalty points including end-to-end testing, GraphQL and CI/CD. This web application was the theme of Build on Serverless Season 2 on AWS Twitch running from April 24th until end of August in 2019.","graphql,airline-booking,serverless,sam,lambda-functions,lambda,aws,aws-lambda,python,typescript,aws-lambda-python,aws-lambda-node,tracing",1327
2,https://github.com/neuronetio/gantt-schedule-timeline-calendar.git,"Gantt Gantt Gantt Timeline Schedule Calendar [ javascript gantt, js gantt, projects gantt, timeline, scheduler, gantt timeline, reservation timeline, react gantt, angular gantt, vue gantt, svelte gantt, booking manager ]","gantt,js-gantt,js-scheduler,js-timeline,angular-gantt,angular-scheduler,angular-timeline,react-gantt,react-scheduler,react-timeline,vue-gantt,schedule,gantt-timeline,javascript-gantt,booking,reservation,timeline,scheduler,calendar,timeline-editor",1100
3,https://github.com/webkul/hotelcommerce.git,Hotel & Booking Reservation Ecommerce system on Prestashop,"hotel-booking,webkul,hotel",427
4,https://github.com/OpenConsultingGroup/Taxi-App.git,Taxi booking app built using Flutter,"flutter,flutter-apps,flutter-examples,flutter-bloc-pattern",370
5,https://github.com/rinvex/laravel-bookings.git,"{""Rinvex Bookable is a generic resource booking system for Laravel, with the required tools to run your SAAS like services efficiently. It's simple architecture, accompanied by powerful underlying to afford solid platform for your business.""}","laravel,php,eloquent,booking",330
6,https://github.com/academind/yt-graphql-react-event-booking-api.git,Code for GraphQL + React Event Booking API Series: https://academind.com/learn/node-js/graphql-with-node-react-full-app/,,309
7,https://github.com/julia-/room-booking-system.git,Room booking system built with Node.js and ReactJS,,305
8,https://github.com/olayemii/uberr-ui.git,Flutter UI design for a car booking application,"flutter,ui,uber,android,ios,flutter-app",290
9,https://github.com/blinks32/Taxi-booking-app-with-Admin.git,"This is a complete ride booking app, It uses google maps cordova plugin, firebase database and onesignal as notification provider.","firebase,angular4,ionic3,onesignal,typescript,android,cordova,scss,paystack,google-maps-android,nodejs,ionic5,stripe-api,nexmo-api,capacitor,ios",220
10,https://github.com/berndruecker/trip-booking-saga-java.git,Example implementation of the Saga pattern for the classic trip booking example using the lightweight open source workflow engine (Camunda).,saga-pattern,210
11,https://github.com/rationalappdev/MovieTickets.git,Movie Tickets Booking App with React Native Tutorial,react-native-tutorial,198
12,https://github.com/neokoenig/RoomBooking.git,"This is an open source application for booking rooms via a web based calendar, using cfWheels, Bootstrap3, jQuery, FullCalendar.js, and other bits. AKA the OxAlto RoomBooking System","fullcalendar,cfwheels,javascript,bootstrap,book-rooms",184
13,https://github.com/alfallouji/DHL-API.git,"This library provides a PHP client for the DHL XML Services. DHL XML Services is an online web services integration capability that provides DHL’s service availability, transit times, rates, shipment and courier pickup booking along with shipment tracking from over 140 countries around the world. Using DHL’s XML Services, customers can incorporate DHL shipping functionality into their websites, customer service applications or order processing systems.",,181
14,https://github.com/bitlabstudio/django-booking.git,A reusable Django app that manages bookings for various purposes.,,180
15,https://github.com/andbet39/Hotel.git,How to build  hotel booking engine with Laravel 5 and AngularJS,,171
16,https://github.com/TakeoffAndroid/SeatBookingRecyclerView.git,Custom ReyclerView for bus seat booking,,167
17,https://github.com/iZaL/my-appointment.git,ReactNative App for booking Appointment,"react-native,redux,react,appointment,appointment-booking",166
18,https://github.com/berndruecker/flowing-trip-booking-saga-c-sharp.git,Example implementation of the Saga pattern for the classic trip booking example using the lightweight open source workflow engine (Camunda) and C#.,,144
19,https://github.com/LaravelDaily/Hotel-Booking.git,"Laravel 5.5 Demo-project for booking hotel rooms, mostly generated with https://quickadminpanel.com",,141
20,https://github.com/Roomify/bat.git,A Booking and Availability Management Library for PHP,,138
21,https://github.com/bernii/django-reservations.git,Django module for handling reservations/booking,,137
22,https://github.com/georgesimos/cinema-plus.git,Online Movie Ticket Booking web app with MERN Stack,"cinema,mern,expressjs,javascript,fullstack,redux,mongodb,nodejs,react",134
23,https://github.com/zeke8402/booking-app.git,Laravel 5.1 web application for booking appointments,"laravel,book-appointments,calendar",130
24,https://github.com/cybdom/hotel_booking_ui.git,Flutter Hotel Booking UI,,121
25,https://github.com/Keiku/kaggle-airbnb-recruiting-new-user-bookings.git,2nd Place Solution in Kaggle Airbnb New User Bookings competition,"kaggle,kaggle-competition",118
26,https://github.com/enzoftware/hotel_booking_app.git,:love_hotel: :bookmark_tabs: :heart: Demo application for hotel booking app made with @flutter and love.,"flutter,booking,hotel-booking,flutter-examples,hacktoberfest",110
27,https://github.com/tkrebs/ep3-bs.git,Online booking system for courts,,107
28,https://github.com/Shashank02051997/BusBookingUI-Android.git,Check out the new style for App Design aims for the Bus Booking Service...😉😀😁😎,"ui,android,android-application,android-app,ui-design,business,business-solutions,bus,android-design,android-template,template,android-ui",107
29,https://github.com/rapind/togproof.git,"{""Professional photographer's client and booking management solution, as well as a gallery / portfolio to showcase your work.""}",,107
30,https://github.com/iamSahdeep/fu_uber.git,Flutter based taxi booking app (dummy) using provider.,"flutter,flutter-apps,flutter-demo,flutter-examples,flutter-app,uber,uber-clone,taxi",100
31,https://github.com/Kloudless/meeting-scheduler.git,"{""Drop-in calendar event booking tool for your app's users that integrates with Google, Outlook, Exchange, and CalDAV.. ""}","meeting-scheduler,booking,calendar-view,calendar-api",94
32,https://github.com/thomasms/glastoselenium.git,A bot for booking Glastonbury tickets using selenium,"glastonbury,festival,refresh,refreshinator,pilton,bot,selenium,python,book-glastonbury-tickets,autorefresh,auto",92
33,https://github.com/craigrodway/classroombookings.git,The open source hassle-free room booking system for schools,"php,room-booking,codeigniter,open-source,schools,education",90
34,https://github.com/varunjohn/Booking-Seats-Layout-Sample.git,A sample that shows how to create a dynamic layout for booking seats,"booking-layout,booking-ui,booking-ux,seating,android-ui,booking-seats,booking,booking-android,movie-booking,movie-seating-arrangement,movie,movie-seats",83
35,https://github.com/dzimchuk/book-fast-service-fabric.git,A sample demonstrating how to implement a multitenant facility management and accommodation booking application as native Azure Service Fabric reliable services.,"service-fabric,azure-search,azure-services,netcore,azure-ad,microservices,microservices-architecture",81
36,https://github.com/amirk3321/booking-management-dashboard.git,"flutter Booking Management Dashboard responsive (web,mobile,tablet)","flutter,flutter-ui,responsive-design,responsive-layout,responsive-web-design,clean-code,android-application,ios-app,tablet",79
37,https://github.com/tranngoclam/movie-booking.git,"An example for booking movie seat, combined of Android Data Binding, State Design Pattern and Multibinding + Autofactory. iOS version is: https://github.com/lizhiquan/MovieBooking","android,android-ui,data-binding,dagger2,recyclerview,movie,booking,multibinding,state,design-pattern,clean-code,architecture,dependency-injection,film,factory",78
38,https://github.com/jbro-io/bookingappdemo-angular.git,"Angular files for my blog post: Building a Google Calendar Booking App with MongoDB, ExpressJS, AngularJS, and Node.js – Part 2",,75
39,https://github.com/LanarsInc/hotel-booking-concept-flutter.git,Hotel Booking Concept is a promo sample application inspired by,"flutter,flutter-ui,flutter-ui-challenges,flutter-design,flutter-ui-collection,flutter-animation,flutter-app",71
40,https://github.com/toocool/tripexpress.git,Bus tour travel booking management web application,,66
41,https://github.com/yeliudev/SeatKiller-GUI.git,A GUI library seat booking tool for Wuhan University - 武汉大学图书馆抢座软件GUI版本，支持定时抢座、捡漏模式、座位改签、邮件提醒、座位锁定,"csharp,whu,gui",63
42,https://github.com/sunspikes/php-amadeus.git,Amadeus flight booking client for PHP,"php,amadeus,soap,client,flight-booking",62
43,https://github.com/krofax/Transport-Booking-Backend-Api.git,"A public bus transportation booking API\u200a-\u200aSuch that Users book tickets for their trips, can see all their bookings and have the right to cancel any booking they do not want to use again.",,62
44,https://github.com/mrzulkarnine/Web-based-hotel-booking-system.git,"This booking system integrate with Paypal and written on PHP, html and javascript.",,62
45,https://github.com/mohamedebrahim96/ToDoListZIRO.git,"ZIRO MEANS ZERO No more cutty commissions On our platform, we don’t charge Captains any per trip commissions—zero. When you drive with us we’re on equal footing, so why should we take away from what you earn? Plus, we have the lowest booking fee compared to those being collected by other ridesharing companies.","mvvm,rxjava,kotlin,java,gradle,live,livedata,room,room-database,solid-principles,ziro,drive,android,androiddevelopment",62
46,https://github.com/Dzoukr/Yobo.git,F# Yoga Class Booking System,"fsharp,fable,safestack,cqrs",60
47,https://github.com/visionect/roombooking.git,Room Booking System,,59
48,https://github.com/Henridv/laravel-booking.git,Laravel booking system,"laravel,booking-system,laravel-6",58
49,https://github.com/woocommerce/woocommerce-accommodation-bookings.git,An accommodations add-on for the WooCommerce Bookings extension.,,58
50,https://github.com/TheAlphamerc/flutter_yatch_booking.git,Sample yatch booking app designed in flutter,,57
51,https://github.com/girish03/Online-Appointment-Booking-System.git,An Online Appointment Booking System for Retail Chain Clinics with both the User as well as the Admin Side.,"appointment,doctor,clinic,hospital,phpmyadmin,wamp,xampp,retail-chain-clinics,patients,ajax,html5,css3,jquery,javascript,database",57
52,https://github.com/ccordenier/tapestry5-hotel-booking.git,"{""Seam like 'Hotel booking' demonstration Web application for Tapestry 5""}",,56
53,https://github.com/anchetaWern/grabClone.git,A ride-booking app created with React Native and Pusher,,55
54,https://github.com/ZoranPandovski/BookingScraper.git,:earth_americas: :hotel: Scrape Booking.com :hotel: :earth_americas:,"scraper,web-scraping,python3,beautifulsoup,request,webscraping,webscraper,booking",51
55,https://github.com/gdiasdasilva/hotel-booking.git,🏨 Spring MVC application about hotels and room bookings.,,49
56,https://github.com/tramyardg/hotel-mgmt-system.git,Hotel booking system for customers added with an admin feature to manage reservations.,"booking,hotel-booking,hotel-management-system,booking-system,room-pricing,php",48
57,https://github.com/pydanny/django-social-bookmarking.git,An eggified model based BSD licensed social booking app for Django,,47
58,https://github.com/shouryaj98/Hotel-Management-Project-Java.git,"It is a Hotel Management tool which can be used to manage activites like storing customer details, booking rooms of four different types, ordering food for particular rooms, unbooking rooms and showing the bill.","hotel-management,object-oriented-programming,java-project,java,oop",47
59,https://github.com/shrikanth7698/Cinema-App-Concept.git,Movie Ticket booking app (Concept),,46
60,https://github.com/vit-/telegram-uz-bot.git,Telegram Bot for booking UZ railway tickets,,45
61,https://github.com/ANovokmet/svelte-gantt.git,:calendar: Interactive JavaScript Gantt chart/resource booking component,"svelte,gantt,interactive,booking,js-gantt,javascript-gantt,react-gantt,angular-gantt,vue-gantt,svelte-gantt",44
62,https://github.com/jbro-io/bookingappdemo-node.git,"Node files for my blog post: Building a Google Calendar Booking App with MongoDB, ExpressJS, AngularJS, and Node.js – Part 1",,41
63,https://github.com/mjstewart/hotel-reservation-springmvc.git,Hotel booking system using spring boot and thymeleaf,,38
64,https://github.com/ilahi123/Taxi-Booking-Android-App.git,Uber Style Taxi Booking Android Application with location permission,"android,java,taxi-app,google-maps-api,json,uber,booking-system,location,googleplaces,autocomplete",38
65,https://github.com/IBM/icp-airways.git,Build an airline booking platform with a microservices architecture deployed on a private cloud,,38
66,https://github.com/javedbaloch4/laravel-booking-app.git,Laravel based application used to book rooms and bookings and manage bookings and clients. For now this is a basic booking management system for hotels.,"laravel,php,laravel-application,laravel-booking,open-source,example-app,laravel-booking-app,laravel-ready-app",37
67,https://github.com/ama3ing/MelifaroBookingBundle.git,Booking Bundle for Symfony 2 Applications,,37
68,https://github.com/pisyek/room-booking-system.git,A room booking system created using Laravel 5.1,"fullcalendar,laravel,tutorial",35
69,https://github.com/tranphong9mx/flutter_booking_app.git,"This is booking app that covered UX/UI was designed by ""Hananda Ilham Z"" on Uplabs.com",,35
70,https://github.com/malvee/Booking.com.git,My solutions to Booking.com interview questions for Developer position,,34
71,https://github.com/jbossdemocentral/bpms-travel-agency-demo.git,A JBoss BPM Suite demo project around a travel agency booking workflow.,,33
72,https://github.com/AxonIQ/hotel-demo.git,Hotel booking application - Demo - Axon Framework & Axon Server,,33
73,https://github.com/aliumujib/Flighttyyyyyyy.git,Simple flight booking demo app,,32
74,https://github.com/Roomify/bat_drupal.git,Booking and Availability Management Tools for Drupal 7 and Drupal 8,,32
75,https://github.com/WoollyinWalesIT/jomres.git,"Jomres Core, the online booking engine and portal for Joomla and Wordpress",,31
76,https://github.com/rationalappdev/MovieTicketsBackend.git,"API Backend with Node.js, Express, and MongoDB for Movie Tickets Booking App (Part 2)","nodejs,express,mongodb,api-backend,tutorial",31
77,https://github.com/harismuneer/Flight-Booking-System-JavaServlets_App.git,"✈️ An enterprise level Flight Booking System for Turkish Airlines (web-application) based on the Model View Controller (MVC) Architecture made using Java Servlets, Java Server Pages (JSPs). Moreover authentication and authorization for users is implemented. The web-application is also secured against SQL Injection and Cross-Site Scripting attacks.","web-application,airlines-booking,java-servlets,java-server-pages,java-web-app,sql-injection-attacks,xss-filter,xss-attacks,enterprise-applications,mvc-architecture,ajax,web-services,soap-web-services,tomcat-server,netbeans-project,security-roles,responsive-web-design,flight-reservation-system,airlines-reservation-system,ticket-reservation-system",31
78,https://github.com/sharetribe/ftw-hourly.git,Flex template for Web: time-based booking processes,,30
79,https://github.com/agriya/bookorrent.git,"BookorRent is an open source online platform for booking and rental marketplace sites. Book or rent anything--events, services, spaces, or anything. Ideal for events booking with tickets, tuition marketplace, activities marketplace (Universe clones), errands /  services (Thumbtack clones), spaces marketplace (Airbnb clones), etc. Its generic approach can fit to any business model.","mysql,booking,booking-rental,booking-platform,rental-platform,universe-clone,marketplace,tickets,seats,booker,book-tickets",30
80,https://github.com/mythemebox/ionic-uber-clone.git,Ionic 4 Taxi Booking script,"ionic,firebase,taxi-app,ionic2,ionic3,ionic4,ionic-framework,uber-clone,taxi-booking,ola-clone,taxi-clone",29
81,https://github.com/kristijanbambir/react-booking-calendar.git,Responsive customizable React booking calendar,"javascript,react,frontend",29
82,https://github.com/awethemes/awebooking.git,AweBooking: A free online hotel booking for WordPress,"wordpress,wordpress-plugin,awebooking,plugin,hotel,hotel-booking,booking",29
83,https://github.com/rahulzore/Zeppelin-Hotel-Booking-App.git,MERN stack application for hotel bookings and creating rentals. Live at https://zeppelin-hotels.herokuapp.com/rentals,,29
84,https://github.com/Travelport/travelport-uapi-tutorial-c-sharp.git,"The travelport-uapi-tutorial-c-sharp is a C# project for Universal API that will help you connect and code a standard Air availablity call and Hotel search, details, and booking flow. ",,29
85,https://github.com/microsoft/bookings-samples.git,Samples for the Microsoft Bookings API.,,28
86,https://github.com/tortuvshin/taracode.git,Hotels booking system,"php,hotel-booking,hotel-management,hotels,room-booking,ecommerce",28
87,https://github.com/LaravelDaily/Laravel-Faculty-RoomBooking.git,Laravel 7 Demo Project for Room Booking with Stripe. Generated with https://quickadminpanel.com and CoreUI theme.,,28
88,https://github.com/binocarlos/len.git,Database for time based bookings of resources in leveldb,,28
89,https://github.com/daltonmenezes/aircnc.git,":coffee: Airbnb like (Air Coffee & Code) to booking spots for developers using ReactJS, React Native, Node.js and more.","booking,spots,developers,javascript,js,nodejs,react,reactjs,reactnative,socket-io,realtime,mongodb,mongoose,express,app,mobile,web,airbnb,rocketseat",28
90,https://github.com/tiipiik/OctoberCMS-RoomBooking.git,Booking plugin for OctoberCMS,,27
91,https://github.com/trobz/openerp-booking-chart.git,Give a booking overview on any OpenERP resources,,27
92,https://github.com/agriya/burrow.git,"Burrow is an online booking platform / software for Real estate marketplace (Realty marketplace), Rental booking, Room sharing, Hotel booking, Office/Parking Space sharing, Car sharing, Bike sharing, Boat sharing, and other Airbnb clones like finder, etc","mysql,booking,vacation-rental,accommodation-booking,airbnb,airbnb-clone,realestate,hotel-booking,real-estate-rental,real-estate-platform,self-hosted",27
93,https://github.com/moshthepitt/apr.git,APR is an appointment/event booking and reminder system made with Python and Django.,,27
94,https://github.com/acrontum/kirby-booking-manager-plugin.git,A Kirby CMS plugin to receive and manage bookings of a product or service,,27
95,https://github.com/lgope/Natours.git,"An awesome tour booking web app written in NodeJS, Express, MongoDB 🗽","pug-template-engine,css3,javascript,nodejs,expressjs,mongoose,parceljs,stripe-api,mongodb-atlas,json-web-token,multer,compression,cors,express-mongo-sanitize,express-rate-limit,helmet,morgan,nodemailer,validator,xss-clean",26
96,https://github.com/akondas/flighthub.git,Flight ticket booking system implemented with CQRS and ES.,"cqrs,cqrs-es,event-sourcing,event-storming,event-machine",26
97,https://github.com/chuangag/room-booking-app.git,A simple room booking system build by Flask and SQLite,,25
98,https://github.com/hieuapp/delimeal.git,The Android template app for restaurant or booking item.,"android,template,mvp-architecture,material-design,booking,demo-app",25
99,https://github.com/LaravelDaily/Laravel-Room-Booking-Filters.git,Demo-project for managing bookings at hotels and rooms. ,,25
100,https://github.com/fnmendez/lof-mobile-app.git,Mobile app built with React Native for bike booking service with Mapbox GL and Bluetooth Low Energy,"react-native,bluetooth-low-energy,mapbox-gl",25
101,https://github.com/hellochirag/Cab-Booking-Flutter-Web-App.git,Cab Booking Web App in Flutter,,24
102,https://github.com/siili-auto/room-booking-app.git, Customizable Room Booking Application for your organization,,24
103,https://github.com/lambospeed/ionic-taxi-booking-app-web-admin.git,"This is a complete ride booking app built with ionic3 , It uses google maps cordova plugin, firebase as realtime database and onesignal as notification provider. ",,24
104,https://github.com/ezekielp/treebnb.git,Clone of rental bookings site Airbnb with a treehouse theme,,24
105,https://github.com/leaderruvuna/TaxiApp-ReactNative.git,"This is a taxi booking app with two parts,the driver and the rider part.The rider needs to request for driver to start the trip if the request is accepted.This app is written in javascript(ES6) with react native framework and firebase as our BAAS.You need to download the project and run npm install to install dependecies in your local machine and then you can run with expo.",,24
106,https://github.com/aryanveturekar/Health-Care-Chat-Bot.git,"Through chatbots one can communicate with text or voice interface and get reply through artificial intelligence. Typically, a chat bot will communicate with a real person. Chat bots are used in applications such as ecommerce customer service, call centres and Internet gaming. Chatbots are programs built to automatically engage with received messages. Chatbots can be programmed to respond the same way each time, to respond differently to messages containing certain keywords and even to use machine learning to adapt their responses to fit the situation. A developing number of hospitals, nursing homes, and even private centres, presently utilize online Chatbots for human services on their sites. These bots connect with potential patients visiting the site, helping them discover specialists, booking their appointments, and getting them access to the correct treatment. In any case, the utilization of artificial intelligence in an industry where individuals’ lives could be in question, still starts misgivings in individuals. It brings up issues about whether the task mentioned above ought to be assigned to human staff. This healthcare chatbot system will help hospitals to provide healthcare support online 24 x 7, it answers deep as well as general questions. It also helps to generate leads and automatically delivers the information of leads to sales. By asking the questions in series it helps patients by guiding what exactly he/she is looking for. ",,24
107,https://github.com/sha3rawi33/Sehhetna.git,"Am writing about ""OUR"" achievement of winning the 2nd place in ""E-sus Mobile Applications Competition"" in which, competitors creates Mobile applications and research ideas for solving the ""SDGs"" sustainable development goals of the UN. Our team\'s submitted application was named after me ""Healthy Wealthy""; we worked on the Public Health.  The application uses location services to find the nearest (Hospital, Pharmacy, and even Doctor In the selected specification). Also, it creates a medical profile for each user where you can add all your history, and automatically, the application creates a special QR code for you ""Patient"" that you can scan it to get all data about you. another service in our application was ""Blood bank"" in which you donate/request blood from people near you, offering payment or no. which will make it easier to request and donate blood ! another important service was the ""Ambulance"" in which you click the emergency button and the application calls and sends your Coordinates to the ambulance for Urgent actions. (the government shall support an API for that). one thing else, is that we\'ve created a service for the governmental alerts with notifications for the users. For instance: (all 6 years old children shall be vaccinated against virus C in all the public hospitals, from 17/4 till 24/4). another, is that we\'ve added a service that is specialized in predicting the possible diseases to harm you if your parents had, like those which can be transmitted genetically. another service, is we\'ve created ""ask a doctor"" tab, where you can ask a doctor for Urgent help, supporting image uploading, then the doctor looks at your profile and your restrictions then starts to give you advice. the application will support booking appointments with doctors and hospital, providing the nearest navigation to those hospitals/Doctors. $$ This application was built with #Flutter using #Dart #lang and created a mobile application for #Android and #iOS $$ all the Databases were built by using #FireBase and we used #Google #GMaps #API Am also honored to be the coder for this application, by helping from my researcher friend Abd El-naser and designer friend Mohamed Hesham ❤️ Thank you guys ❤️","flutter,dart,health,app,un,sdgs,sdg,flutter-apps,flutter-demo,flutter-material,dartlang,dart-frameworks",24
108,https://github.com/hendricius/booking.git,Wrapper for the Booking.com API.,,23
109,https://github.com/icomefromthenet/BookMe.git,MYSQL Timeslot Booking Library for Field Services,,23
110,https://github.com/labos/locanda.git,"Booking management system for hotels, bed&breakfasts and guesthouses. Written in Java (J2EE/Struts2).",,23
111,https://github.com/rajayogan/flutterui-hairstylist.git,Code for the hairstylist booking screen created using flutter,,23
112,https://github.com/wielebenwir/commons-booking.git,Wordpress plugin for managing and booking of common goods. New Version 2: https://github.com/wielebenwir/commonsbooking,"wordpress-plugin,commons,sharing,booking",23
