,Url,Description,Topics,Stars
0,https://github.com/AchoArnold/discount-for-student-dev.git,"This is list of discounts on software (SaaS, PaaS, IaaS, etc.) and other offerings for developers who are students",,2044
1,https://github.com/dakshshah96/awesome-startup-credits.git,✨ A collection of awesome companies offering free/discounted plans for eligible startups,"awesome,awesome-list,startups,list,startup-credits",1894
2,https://github.com/leereilly/swot.git,:school: Identify email addresses or domains names that belong to colleges or universities. Help automate the process of approving or rejecting academic discounts.,,999
3,https://github.com/davidfstr/rdiscount.git,"{""Discount (For Ruby) Implementation of John Gruber's Markdown""}","markdown,markdown-parser",755
4,https://github.com/aspnetrun/run-aspnetcore-microservices.git,"Microservices on .Net platforms which used Asp.Net Web API, Docker, RabbitMQ, MassTransit, Grpc, Ocelot API Gateway, MongoDB, Redis, PostgreSQL, SqlServer, Dapper, Entity Framework Core, CQRS and Clean Architecture implementation. Also includes Cross-Cutting concerns like Implementing Centralized Distributed Logging with Elasticsearch, Kibana and SeriLog, use the HealthChecks with Watchdog, Implement Retry and Circuit Breaker patterns with Polly and so on.. See Microservices Architecture and Step by Step Implementation on .NET Course w/ discount->","aspnet-core,docker,ocelot-gateway,micorservices,aspnetcore-microservices,rabbitmq,mongodb,redis,sql-server,cqrs-pattern,clean-architecture,event-sourcing,eventbus,event-driven,microservices-architecture,aspnet-web-api,swagger,rest-api,api-gateway,mediator-pattern",518
5,https://github.com/OpenGenus/Best-student-discount-services.git,Best student discount services one should definitely try out! Contributions and translations are highly encouraged. ,"students,wiki,discounts,awesome-list,opengenus",341
6,https://github.com/techtanic/Discounted-Udemy-Course-Enroller.git,A script/software for automatically enrolling/joining 100% discounted Udemy courses for free. Get Paid Udemy courses for free with just a few clicks.,"free,exe,bot,automated,udemy,coupons,python,gui,software,udemy-course,udemy-paid-courses,free-courses,udemycourse,discount-coupons,udemy-account,auto-login,udemy-enroller,automatic-udemy-enroller,coupon-scraper,udemy-bot",291
7,https://github.com/OliverLetterer/GHMarkdownParser.git,A markdown parser for iOS based on discount.,,268
8,https://github.com/fnando/coupons.git,Coupons is a Rails engine for creating discount coupons.,,140
9,https://github.com/halessi/DCF.git,Basic Discounted Cash Flow library written in Python. Automatically fetches relevant financial documents for chosen company and calculates DCF based on specified parameters.,"discounted-cash-flows,investment,valuation,intrinsic-value,python,financialmodelingprep,finance,financial-modeling,multiples,multiples-valuation,absolute-valuation,dcf,visualization",84
10,https://github.com/tj/node-discount.git,"nodejs bindings for the C markdown ""discount"" library",,78
11,https://github.com/DonsetPG/narya.git,"The Narya API allows you track soccer player from camera inputs, and evaluate them with an Expected Discounted Goal (EDG) Agent. This repository contains the implementation of the flowing paper https://arxiv.org/abs/2101.05388. We also make available all of our pretrained agents, and the datasets we used as well.",,67
12,https://github.com/liampetti/DDPG.git,"Implementation of DDPG (Modified from the work of Patrick Emami) - Tensorflow (no TFLearn dependency), Ornstein Uhlenbeck noise function, reward discounting, works on discrete & continuous action spaces",,58
13,https://github.com/yusra-haider/Give_Back_COVID19.git,Curation of resources gone free / are discounted due to the COVID-19 pandemic,,57
14,https://github.com/ZonCon/Ecommerce-Retronight-Android.git,"Native Android Application for Ecommerce (online shopping). Features - Product Catalogue Builder, Product Categories & Product Items, Secure Shopping Cart, Payment Gateway, Comprehensive pricing, availability & taxation, Shipping Locations, Customer Accounts, Exhaustive Discounting & Couponing options, Email-based invoicing, Order Management & Tracking, Push notifications",,56
15,https://github.com/vdudouyt/mhddfs-nosegfault.git,"{""Mhddfs without a 'Transport endpoint is not connected' bug which was introduced in 0.1.39. This repository will be discounted as soon as I'll receive a response from maintainer.""}",,51
16,https://github.com/taoyimin/eshop-game-android.git,Search eshop game prices in different regions and remind when discounting. Use androidx library instead of android support library.,"kotlin,android,material-design,androidx,ktx,leakcanary,jetpack",51
17,https://github.com/huiyonghkw/ecshop_discount.git,The discount of ecshop for Laravel 5.4 & Vue 2.0,"laravel,vuejs2,element-ui,oauth2",50
18,https://github.com/kenticny/wechat-card.git,"💳 微信卡券API for NODEJS Wechat( Weixin ) Card, include coupon , discount, cash, gift, etc..","wechat,wechat-sdk,wechat-card",48
19,https://github.com/calumptrck/Studddent.git,✨ Curated online discounts for students. 🎒,,46
20,https://github.com/armanhakimsagar/billing_software.git,This is a billing software for any store.Its will calculate product price tax discounts & generate a receipt customer. No database need . ,,46
21,https://github.com/rg3/steam_discounts.git,Print Steam discounts to your terminal,,40
22,https://github.com/aspnetrun/run-aspnet-grpc.git,Using gRPC in Microservices for Building a high-performance Interservice Communication with .Net 5. See gRPC Microservices and Step by Step Implementation on .NET Course w/ discount->,"grpc,grpc-server,grpc-csharp,microservices,aspnet,dotnet,microservices-architecture,aspnetcore",40
23,https://github.com/bmihelac/django-shop-discounts.git,Configurable discounts for django-shop,,28
24,https://github.com/stuartduff/woocommerce-dynamic-pricing-table.git,WooCommerce dynamic pricing table adds a pricing discount table to WooCommerce products that are offering bulk discounts or special offer discounts and user role discount messages to WooCommerce sections via the WooCommerce Dynamic Pricing plugin.,,28
25,https://github.com/claudiosanches/woocommerce-payment-discounts.git,Adds discounts  for specific payment methods in WooCommerce.,,27
26,https://github.com/asb/lua-discount.git,Lua binding to the discount C implementation of the Markdown text-to-html markup system,,24
27,https://github.com/railsdog/spree-volume-pricing.git,Spree extension which supports sales volume based pricing (quantity discounts.),,23
28,https://github.com/indiejoseph/tf-rda-cell.git,Recurrent Discounted Attention unit (RDA) for Tensorflow,"tensorflow,attention,rnn,machine-learning,deep-learning",23
29,https://github.com/ShannonCanTech/Diversity-Scholarships.git,Comprehensive list of diversity scholarships including travel stipend opportunities and student discounts.,,22
30,https://github.com/crankycyclops/DiscountCodeUrl.git,Magento 2 module that applies a discount code automatically via URL,"magento,coupon,discount-codes,discount,magento2,magento2-module,magento2-extension,magento2-extension-free,coupon-code",22
31,https://github.com/civicrm/org.civicrm.module.cividiscount.git,Add discount codes and automatic discounts to CIviCRM events and memberships,,21
32,https://github.com/wordnik/awesome-nonprofit-discounts.git,a list of awesome companies who discount their software for nonprofit orgs,,21
33,https://github.com/zhemani/Finco..git,"Finco automates the process of generating financial documentation and valuations for companies traded on the NASDAQ and NYSE. Provides user with a live stock price index, current balance sheet, liquidity ratios, current income statement, and a projected discounted cash flow statement.",,21
34,https://github.com/asaaki/discount.ex.git,"Elixir NIF for discount, a Markdown parser",,20
35,https://github.com/mombrea/Javascript-Referral-Tracking.git,A light weight JavaScript cookie based affiliate or discount code system,,20
36,https://github.com/trapeze/python-discount.git,"A Python interface for Discount, the C Markdown parser",,20
37,https://github.com/drbenvincent/delay-discounting-analysis.git,Hierarchical Bayesian estimation and hypothesis testing for delay discounting tasks,"toolbox,discounting,delay-discounting,hypothesis-testing,psychology",19
38,https://github.com/prasanna08/SNInfluenceMaximization.git,"Implementation of Greedy, CELF++, SPIN, IV-Greedy, Degree Discount algorithms for influence maximization in social network and information diffusion models such as LT, IC and TR (Triggering Model)",,19
39,https://github.com/dharmeshpatel/shoppingcart.git,"It is a open source cart developed using Python language to manage cart in e-commerce applications. It includes Product option support, Multi discount support, Multi tax support(specific to product as well as general taxes), Multi currency support, tax exclude and Include total, shipping method and charge.",,18
40,https://github.com/ScienceSoft-Inc/DiscountsApp.git,Xamarin app (Android & iOS) listing and plotting on a map discount locations,,17
41,https://github.com/strangerstudios/pmpro-subscription-delays.git,"Adds a “delay” field to membership levels and discount codes, allowing you to set a variable-length period between your initial payment (if required) and recurring subscription payment.",,17
42,https://github.com/sumardi/OCDiscount.git,Discount Markdown Processor for iOS and OS X,,17
43,https://github.com/raszidzie/Price-Tracker-Application.git,Discount Tracker app with Python/Django,,16
44,https://github.com/mdbootstrap/black-friday-cyber-monday-2020.git,A list of Black Friday and Cyber Monday promotions and discounts for developers,"discounts,black-friday,cyber-monday",16
45,https://github.com/MoltenKhor/quarantine-courses.git,List of free or discounted online courses during quarantine ,,16
46,https://github.com/MyUNiDAYS/tech-placement-challenge.git,UNiDAYS Discounts Programming Challenge,,15
47,https://github.com/Wang-GY/IMP.git,"Influence maximize problem with IC model (degree discount IC , new Greedy) and LT model (SIMPATH)",,15
48,https://github.com/benchling/schoolbus.git,"A python library for checking if an email is issued by an academic institution. Useful for granting discounts, etc to academic users.",,14
49,https://github.com/HumanCompatibleAI/learning_biases.git,"Infer how suboptimal agents are suboptimal while planning, for example if they are hyperbolic time discounters.",,14
50,https://github.com/gaiterjones/magento-facebook-discount-for-likes.git,Social Media Marketing app that rewards Facebook page Likes with a Magento Discount Coupon Code.,,14
51,https://github.com/somewherewarm/woocommerce-product-bundles-bulk-discounts.git,Bulk discounts and dynamic pricing rules for WooCommerce Product Bundles.,,13
52,https://github.com/strangerstudios/pmpro-sponsored-members.git,Generate a discount code for a main account holder to distribute to sponsored members.,"wordpress,plugin,paid-memberships-pro,php",13
53,https://github.com/adriaanvanrossum/saasforcovid.com.git,Fight COVID-19 together with these discounted SaaS products,"covid-19,coronavirus,corona,saas,products,discounts",13
54,https://github.com/sonntagsgesicht/dcf.git,A Python library for generating discounted cashflows.,,13
55,https://github.com/peterj/ppp-gumroad-discounts.git,Create PPP discount codes in Gumroad,,13
56,https://github.com/kitpages/KitpagesShopBundle.git,"Symfony2 bundle used for an online shop : cart, order, invoice, shipping, discount,... (alpha state)",,13
57,https://github.com/craigbarnes/lua-discount.git,Moved to https://gitlab.com/craigbarnes/lua-discount,"lua,markdown,parser,converter,html,toc",12
58,https://github.com/sekimura/text-markdown-discount.git,Text::Markdown::Discount,,11
59,https://github.com/baz/libORCDiscount.git,Objective-C static library wrapping the discount library,,11
60,https://github.com/edwindvinas/shopping-cart-api.git,"Golang shopping cart with customizable REST API and support for rules on discounts, promos, bundles, and more",,11
61,https://github.com/railsdog/spree-promotions.git,"Promotions, Discounts and Coupons (Eventually will be integrated into Spree Core)",,11
62,https://github.com/MagestyApps/magento2-fix-discount-rules.git,"Fixes core Magento 2 issue related to ""Payment Method"" condition in discount rules","magento2,magento2-module,magento2-extension,bugfix,cart-price-rules,discount-rule",11
63,https://github.com/acdvs/isthereanydeal-lookup.git,A simple Discord bot for getting game discount info from isthereanydeal.com,"discord,bot,javascript,nodejs,game-deals,isthereanydeal,game-discount-info,discord-bot",11
64,https://github.com/ZonCon/Ecommerce-Morningmist-Android.git,"Native Android Application for Ecommerce (online shopping). Features - Product Catalogue Builder, Product Categories & Product Items, Secure Shopping Cart, Payment Gateway, Comprehensive pricing, availability & taxation, Shipping Locations, Customer Accounts, Exhaustive Discounting & Couponing options, Email-based invoicing, Order Management & Tracking, Push notifications",,11
65,https://github.com/quafzi/magento-discountPreview.git,This extension shows discounts (based on shopping cart rules) on Magento product page.,,10
66,https://github.com/pushmatrix/discount-roulette.git,A SparkAR roulette filter for showing discounts.,,10
67,https://github.com/cthurber/Dynamic_DCF.git,Simple JSON to Excel for SEC EDGAR data to Discounted Cash Flow models,,10
68,https://github.com/zgldh/discount-and-coupon.git,"The core logic about discount and coupon. Useful to manage discount campaign, defining coupon and calculate the final price.",,10
69,https://github.com/ykaitao/the-elements-of-reinforcement-learning.git,"Reinforcement Learning (RL) is believe to be a more general approach towards Artificial Intelligence (AI). RL is the foundation for many recent AI applications, e.g., Automated Driving, Automated Trading, Robotics, Gaming, Dynamic Decision, etc. With concrete examples, this repository tries introduce clearly the basic elements of Reinforcement Learning, e.g., Agent, Environment, State, State Transition, Policy, Action, Reward, Future Return, Discounted Future Return, Exploration & Exploitation, Markov Decision Processing, The Bellman Equation, Policy-based Learning, Value-based Learning, etc. ",,10
70,https://github.com/defunkt/ooc-markdown.git,A Discount binding for ooc,,9
71,https://github.com/cataphract/php-discount.git,PHP extension that wraps the discount Markdown library; PECL markdown package.,,9
72,https://github.com/losDaniel/spot-connect.git,Module that makes it easy to use AWS virtual machines at discount pricing,"aws,boto3,python",9
73,https://github.com/eduardonunesp/Anomade.git,Another Markdown Editor - The Markdown library come from https://github.com/Orc/discount,,9
74,https://github.com/ellensp/rrd-glcd-tester.git,"{""Simple arduino sketch to test a reprap discount GLCD's on a RAMPS 1.4""}",,9
75,https://github.com/ClevelandOnRails/rubyonrailsbook.git,Learn Ruby on Rails. Use coupon code GITHUB2013 on LeanPub for a discount!,,9
76,https://github.com/silvershop/silvershop-discounts.git,Adds Discount and Coupon support for SilverShop,,8
77,https://github.com/gfariap/discountify.git,Shopify app to preview discounts before checkout,,8
78,https://github.com/miyamot0/discountingtools.git,This is a R-based package for performing a range of delay discounting analyses and procedures.  ,,8
79,https://github.com/johnmyleswhite/IntertemporalChoiceHeuristics.git,"Analysis pipeline for Psychological Science paper called ""Money Earlier or Later? Simple Heuristics Explain Intertemporal Choices Better than Delay Discounting""",,8
80,https://github.com/SuperV1234/DiscountCpp.git,"[HEADER-ONLY] C++11 wrapper for the markdown library ""Discount""","cpp,cpp11,library,discount,markdown,html-string,c-plus-plus,wrapper",8
81,https://github.com/ManigandanKrishnakumar/point-of-sale-system.git,"React Based Point of Sale System which includes billing, taxing, discounts, Inventory Mangement, with future scope of adding sales report and customer marketing",,8
82,https://github.com/rammyblog/PriceTracker.git,Price Tracker Application with Django and React used to Track Discounts on Jumia & Konga,"python,django,reactjs,react,django-rest-framework,nextjs,antd",8
83,https://github.com/somasis/makedown.git,[mirror] Static website generator using `make` and `discount`.,,8
84,https://github.com/careys7/Magento-Weather-Sales.git,"{""Discount products and create shopping cart rules based on a customer's local weather conditions""}",,8
85,https://github.com/maartenvanvliet/swotex.git,Identify email addresses or domains names that belong to colleges or universities. Help automate the process of approving or rejecting academic discounts. Port of https://github.com/leereilly/swot ,,8
86,https://github.com/jackmoody11/autodcf.git,📊 Easy plug-and-chug discounted cash flow model framework that allows for advanced modeling and sensitivity tests.,,8
87,https://github.com/Arcadier/Discount-Coupon-Generator.git,:gift: Create and reward your consumers with discount coupons to boost sales and build a loyal user base.,"plug-in,arcadier,discount-coupons,consumers,boost-sales,reward",8
88,https://github.com/wbuntine/libstb.git,"This source directory contains library routines that provide alternative ways of computing generalised second order Stirling numbers used in working with Pitman-Yor and Dirichlet processes (PYP and DP). Included is library routines for posterior sampling on the discount and concentration parameters of the PYP/DP, and some simple demo scripts.",,8
89,https://github.com/renventura/edd-url-generator.git,"{""EDD store managers and admins can generate URLs for adding downloads to a customer's cart, applying a discount, and redirecting to any page.""}",,8
90,https://github.com/yuqmettal/discounts-microservices.git,Discounts microservice architecture written in python,"python,microservices,fastapi,postgresql",7
91,https://github.com/guojiangclub/discount.git,"{""E-commerce discount component for Laravel's Application.""}","ecommerce,laravel,laravel-package,discount,coupon",7
92,https://github.com/strangerstudios/pmpro-level-cost-text.git,"Modify the default level cost text per level, per discount code, or globally via advanced settings when using Paid Memberships Pro.",,7
93,https://github.com/rmillsap/Daily-Deals.git,"A PHP Symfony webapp for creating daily discounts, giveaways similar to Groupon, Living Social, and more",,7
94,https://github.com/Health-Economics-in-R/QALY.git,:green_heart: :yellow_heart: :heart: An R package to calculate quality-adjusted life-years with discounting and inflated costs.,"health-economics,cost-effectiveness",7
95,https://github.com/rubenhuisman/altijd35procentkorting.git,Generating discount codes for every Albert Heijn product,,7
96,https://github.com/easydigitaldownloads/edd-optinmonster-discounts.git,Allows you to generate a discount code and send it to the email address when a user submits their email through OptinMonster,,7
97,https://github.com/tenusha/public-transport-ticketing-system.git,"Ticketing system for a Public Transport Network with features social logins, view real-time ticket availability, email and SMS notification, discount schema and admin panel. ","reactjs,nodejs,expressjs,mongodb,public-transport,e-ticket,admin-dashboard,email-notification,sms-notifications",7
98,https://github.com/Ahlyab/Udemy-coupon-fetcher.github.io.git,A program that will give you Udemy coupons with 100% discount and no coupon expired coupon will be fetched.,"udemy-free-coupons,udemy,udemy-free-courses",7
99,https://github.com/Ahlyab/udemy-coupon-fetcher-termux.git,A program that will give you Udemy coupons with 100% discount and no coupon expired coupon will be fetched,,7
100,https://github.com/AkashSirimanna/JOAT.git,"Analysis program written in Python that consolidates 3 pillars of investment analysis; sentiment, technical and fundamental. This script takes a stock ticker, performs a discounted cash flow valuation, identifies support and resistance levels alongside entry and exit points. This leads to a final sentiment vs price analysis conducted with data from twitter.",,7
101,https://github.com/rpadma/Rappay.git,"{""My entry for ICICI Bank Hackathon 2016- Proposed a mobile app with the following functionality     1)      A bank account is at the crux of a user’s relationship with the bank. However, a personalized interface for the user with the bank is still not a reality. I believe this can be changed once a common medium is found. Through this, we will be able to generate highly personalized data analysis to the user for free. This can be represented as simply as a pie diagram or a bar graph. Through this, the user will be able to understand his expenses and also find ways to minimize expenses and save more money. As there is a common medium, we will also find ways for the user to save and invest in the form of discount coupons for the user’s favorite restaurant, cinema hall, etc. We can also offer him stock/mutual fund options suited to his monthly savings and encourage him/her to do more with the data. This information can be conveyed to the user in a form he is familiar with. We can also make mock pitches that contain information post-investment, mutual funds, and its effect on his savings account, etc. This helps in finding potential customers for the bank. All the information will only act as an advisory to the user and the investments/savings will be at his discretion. No such service is available right now.    2)      It is simple, fast, and efficient from both the user and the vendor's point of view. Imagine being able to scan a QR on a bill to make a payment, without entering debit card details or getting redirected to a net banking website or having to open your physical wallet. Welcome to the Future J   ""}","icici,hackathon,java,android,qrcode,payment",7
102,https://github.com/AesopInteractive/edd-discounts-reminder.git,EDD Discounts Reminder,,6
103,https://github.com/emre/infestor.git,Claim and create discounted STEEM accounts on your command line,,6
104,https://github.com/rohanraval/ValuationProject.git,Financial valuation modeling using Discounted Cash Flow (on Django),,6
105,https://github.com/Turiknox/magento2-custom-total.git,A simple Magento 2 module demonstrating how to add a surcharge or discount total to the frontend.,"php,magento,magento2,magento2-module,magento2-extension",6
106,https://github.com/brendonakay/braham.git,Stock valuation using the discount dividend model.,,6
107,https://github.com/toshas/torch-discounted-cumsum.git,Fast Discounted Cumulative Sums in PyTorch,,6
108,https://github.com/strangerstudios/pmpro-set-expiration-dates.git,Set a specific expiration date (e.g. 2021-12-31) for a PMPro membership level or discount code. This expiration date will override any expiration period set on the level.,"paid-memberships-pro,wordpress,wordpress-plugins,paidmembershipspro",6
109,https://github.com/ThatoLesetla/Bulk-Buying-System.git,Bulk buying system combines customer orders into bulk orders. Then makes bulk purchases to vendors in order to receive massive discounts,,6
110,https://github.com/eshita53/Reward-Me.git,This app lets restaurant owners give discount to their regular customers. At the same time food lovers can get discount at their favourite restaurants.,,6
111,https://github.com/wangkuiyi/markdown-converter.git,A Racket module using FFI to load Discount and support Markdown text conversion.,,6
112,https://github.com/metagento/magento-2-discount-for-subscriber.git,Magento 2 extension gives discount to subscribers ( with or without coupon code ),,6
113,https://github.com/iop/magento2-order-grid.git,Magento 2 back-end order grid view with coupon_code and discount_amount columns added,,6
114,https://github.com/nopWay/HasCategories-discount-requiremement-plugin-for-nopcommerce.git,This nopCommerce plugin allows you to add a discount requirement that checks total quantity of products in selected categories against predefined min and max quantity values.,"nopcommerce,nopcommerce-discount-plugin",6
115,https://github.com/michaelkoek/vue-receipt-component.git,A receipt component that sums up your items. You can add VAT and discount aswell,"javascript,vue,receipt-component,ui",6
116,https://github.com/nopWay/HasProducts-discount-requiremement-plugin-for-nopcommerce.git,This nopCommerce plugin allows you to add a discount requirement that checks total quantity of selected products in the cart against predefined min and max quantity values.,"nopcommerce,nopcommerce-discount-plugin",6
117,https://github.com/strangerstudios/pmpro-group-discount-codes.git,Adds features to PMPro to better manage grouped discount codes or large numbers of discount codes.,"wordpress,plugin,paid-memberships-pro,php",5
118,https://github.com/dvizh/yii2-promocode.git,"CRUD, widgets and services for give discount to clients",,5
119,https://github.com/vvgomes/semprenalista.git,A service to subscribe people to nightclub discount lists.,,5
120,https://github.com/kigster/joyent-cloud-pricing.git,A collection of tools to help figure out Joyent cloud costs for an infrastructure of any size. Supports commit pricing discounts.,,5
121,https://github.com/cferdinandi/gmt-pricing-parity.git,Display country-specific EDD discounts to visitors.,,5
122,https://github.com/epeake/ModifiedKneserNey.git,Interpolated Kneser-Ney smoothing with an out-of-vocabulary correction and discount estimated from training data,"nlp-machine-learning,smoothing,kneser-ney-smoothing,kneser-ney",5
123,https://github.com/George-lewis/Selfmoji.git,Discount Discord:tm: Nitro:tm:,discord,5
124,https://github.com/tresni/awesome-nonprofit.git,A list of vendors that provide discounts for non-profit organizations,,5
