,Related APIs,Category,Submitted,Meta_Url,Description,Repository,Languages,Provider,Asset URL
270,,"Machine Learning, Big Data, Marketing, Predictions",04.30.2015,https://www.programmableweb.com/sdk/predicsis-ruby-sdk-predicsis, This is an official Ruby SDK for the machine learning API by PredicSis. Use this SDK to access the predictive modeling and dataset management tools provided by PredicSis. The SDK requires your API Token to get started. See the SDK documentation for a sample workflow and instructions on installing the gem.,https://github.com/PredicSis/predicsis_ml_sdk-ruby,Ruby,PredicSis,https://github.com/PredicSis/predicsis_ml_sdk-ruby
271,,Big Data,04.28.2015,https://www.programmableweb.com/sdk/google-bigquery-dart-sdk-dart," An auto generated Dart library for working with Google APIs, including BigQuery. Use BigQuery to mange your big data with its SQL-like commands and append-only tables for fast processing. This SDK, provided by Dart, is in Version 0.8.0. See the project documentation for detailed instructions on how to get started with Dart and Google APIs.",https://pub.dartlang.org/packages/googleapis,Dart,Dart,https://pub.dartlang.org/packages/googleapis
272,Google BigQuery REST API,Big Data,04.28.2015,https://www.programmableweb.com/sdk/google-bigquery-ruby-sdk-google," Use this official SDK to access Google APIs, including BigQuery, with Ruby. BigQuery is a tool for managing large datasets that combines Google's processing power with SQL-like commands against append-only tables for fast results. Note that this Gem is in Alpha. See the project page for detailed installation instructions and code examples.",https://github.com/google/google-api-ruby-client,Ruby,Google,https://developers.google.com/api-client-library/ruby/apis/bigquerydatatransfer/v1
273,,Big Data,04.28.2015,https://www.programmableweb.com/sdk/google-bigquery-python-sdk-google," A Python SDK for interfacing with Google APIs, including BigQuery - a tool for querying large datasets. BigQuery leverages Google's significant processing power with SQL-like commands against append-only tables for fast results. See the project documentation for detailed installation instructions as well as code samples.",https://developers.google.com/api-client-library/python/,Python,Google,https://developers.google.com/api-client-library/python/
274,,Big Data,04.28.2015,https://www.programmableweb.com/sdk/google-bigquery-php-sdk-google," This is a PHP client for working with Google APIs, including BigQuery. BigQuery is a data querying API that leverages Google's significant processing power with SQL-like commands against append-only tables for fast results. Developers should note that this official PHP SDK is in Beta and requires PHP 5.2.1 or higher and PHP JSON extension.",https://github.com/google/google-api-php-client/blob/master/src/Google/Service/Bigquery.php,PHP,Google,https://github.com/google/google-api-php-client
275,,Big Data,04.28.2015,https://www.programmableweb.com/sdk/google-bigquery-objective-c-sdk-google," This Objective-C SDK is for use with Google's BigQuery API.
The BigQuery API facilitates the efficient management of large datasets by pairing SQL-like commands and append-only tables with Google's significant processing power. This official Objective-C SDK is the recommended library for accessing JSON-based Google APIs for iOS and Mac OS X applications. The library is compatible with applications built for iOS 3 and later, and Mac OS X 10.5 and later.",https://code.google.com/p/google-api-objectivec-client/,Objective-C,Google,https://code.google.com/p/google-api-objectivec-client/
276,Moves REST API,Fitness,04.28.2015,https://www.programmableweb.com/sdk/moves-java-sdk-nutrino," Moves Java SDK by Nutrino is a SDK for working with the Moves API, written in Java.",,Java,,https://github.com/nutrino-rnd/moves-api
277,Moves REST API,Fitness,04.28.2015,https://www.programmableweb.com/sdk/moves-ios-sdk-vito," Moves iOS SDK by Vito is a library for working with the Moves API, written in Objective-C.",,Objective-C,,https://github.com/vitoziv/moves-ios-sdk
278,ShareFile REST API,File Sharing,04.28.2015,https://www.programmableweb.com/sdk/citrix-sharefile-javascript-sdk-citrix, The ShareFile JavaScript SDK provides access to ShareFile accounts and provides a repository for several projects known as Solution Kits. These kits allow developers to connect ShareFile to an existing website. The SDK is written in JavaScript.,https://github.com/citrix/ShareFile-Javascript,JavaScript,Citrix,https://github.com/citrix/ShareFile-Javascript
279,ShareFile REST API,File Sharing,04.28.2015,https://www.programmableweb.com/sdk/citrix-sharefile-objective-c-sdk-citrix, The ShareFile Objective-C SDK provides access to ShareFile accounts. This SDK is written in Objective-C.,https://github.com/citrix/ShareFile-ObjectiveC,Objective-C,Citrix,https://github.com/citrix/ShareFile-ObjectiveC
280,ShareFile REST API,File Sharing,04.28.2015,https://www.programmableweb.com/sdk/citrix-sharefile-java-sdk-citrix, The ShareFile PowerShell Java SDK provides access to ShareFile accounts. It is written in Java.,https://github.com/citrix/ShareFile-Java,Java,Citrix,https://github.com/citrix/ShareFile-Java
281,ShareFile REST API,File Sharing,04.28.2015,https://www.programmableweb.com/sdk/citrix-sharefile-powershell-.net-sdk-citrix, The Citrix ShareFile PowerShell .NET SDK by Citrix allows developers to integrate the Citrix ShareFile API into their applications developed with Powershell and .NET. This SDK requires PowerShell 4.x and .NET 4.x.,https://github.com/citrix/ShareFile-PowerShell,.Net,Citrix,https://github.com/citrix/ShareFile-PowerShell
282,ShareFile REST API,File Sharing,04.28.2015,https://www.programmableweb.com/sdk/citrix-sharefile-.net-sdk-citrix, The Citrix ShareFile .NET SDK by Citrix allows developers to access the Citrix ShareFile API's methods from their .NET applications. Usage examples are included in the documentation.,https://github.com/citrix/ShareFile-NET,.Net,Citrix,https://github.com/citrix/ShareFile-NET
283,,Big Data,04.27.2015,https://www.programmableweb.com/sdk/google-bigquery-node.js-sdk-google," Use this Node.js SDK to interface with Google's BigQuery API. The BigQuery API facilitates the efficient management of large datasets by pairing SQL-like commands and append-only tables with Google's significant processing power. This official SDK supports OAuth2 and authorization, and can be used with a number of Google's other APIs. Note that the Node.js client is currently in Alpha.",https://github.com/google/google-api-nodejs-client/,Node.js,Google,https://github.com/google/google-api-nodejs-client/
284,,Big Data,04.27.2015,https://www.programmableweb.com/sdk/google-bigquery-javascript-sdk-google," This official JavaScript SDK is for use with any of Google's APIs, including BigQuery. Load your data in to the BigQuery API for easy querying with SQL-like commands and Google's significant processing power. Note that this JavaScript client is currently in Beta and is supported in Chrome 8+, Firefox 3.5+, MSIE 8+, and Safari 4+. See the project documentation for installation instructions and access to sample projects and reference docs.",https://github.com/google/google-api-javascript-client,JavaScript,Google,https://github.com/google/google-api-javascript-client
285,,Big Data,04.27.2015,https://www.programmableweb.com/sdk/google-bigquery-java-sdk-google," Google's BigQuery API facilitates the querying of large data sets. Using Google's significant processing power, BigQuery uses SQL-like commands to query and manage data in append-only tables. Use this SDK to interface with the API using Java. See the project page for information on installing the Java client, access to the JavaDoc for BigQuery, and a sample API engine. Google's Java SDK is supported in the following environments: Java 5 or higher, Android 1.5, and Google App Engine.",https://developers.google.com/api-client-library/java/apis/bigquery/v2,Java,,https://developers.google.com/api-client-library/java/apis/bigquery/v2
286,,Big Data,04.27.2015,https://www.programmableweb.com/sdk/google-bigquery-.net-sdk-google," Use this .Net SDK to interface with Google's BigQuery API. Use Google's processing power to quickly query append-only data tables with SQL-like commands. Dependencies for this .Net client are: Google.Apis.Core ( 1.9.1), log4net ( 2.0.3), and Zlib.Portable ( 1.10.0). This official SDK is authored by Google and is offered under an Apache 2.0 license.",http://www.nuget.org/packages/Google.Apis/,.Net,Google,https://developers.google.com/api-client-library/dotnet/get_started
287,Ringcaptcha REST API,"Verification, Mobile, Text",04.27.2015,https://www.programmableweb.com/sdk/ringcaptcha-android-sdk-ringcaptcha," This is the Android SDK for Ringcaptcha. With this SDK, developers can access and integrate the functionality of Ringcaptcha with Android applications and devices through Java. Ringcaptcha is a service that brings phone-based verification to any website and mobile application. Ringcaptcha can be used for authentication, marketing, verifying ownership, and more.",https://github.com/ringcaptcha/ringcaptcha-android,Java,,https://my.ringcaptcha.com/docs/android
288,Ringcaptcha REST API,"Verification, Mobile, Text",04.27.2015,https://www.programmableweb.com/sdk/ringcaptcha-ios-sdk-ringcaptcha," This is the iOS SDK for Ringcaptcha. With this SDK, developers can access and integrate the functionality of Ringcaptcha with iOS applications and devices through Objective-C. Ringcaptcha is a service that brings phone-based verification to any website and mobile application. Ringcaptcha can be used for authentication, marketing, verifying ownership, and more.",https://github.com/ringcaptcha/ringcaptcha-ios,Objective-C,,https://my.ringcaptcha.com/docs/ios
289,,Location,04.27.2015,https://www.programmableweb.com/sdk/ingeo-ios-sdk-ingeo," The Ingeo iOS SDK by InGEO is used as a location library for iOS which powers an application with an always-ON (24/7) location awareness while keeping low battery consumption. It uses unique algorithms to adjust GPS power and monitoring mode according to user behaviour and whereabouts. Built to support iOS7 and iOS8, the SDK aims to get a stream of location data while in foreground or background. Battery consumption is just 2% per hour. It is written in Objective-C.",https://github.com/IngeoSDK/ingeo-ios-sdk,Objective-C,InGEO,http://ingeo.io/sdk/
290,Mapbox REST API v4.0,Mapping,04.27.2015,https://www.programmableweb.com/sdk/mapbox-ios-sdk-mapbox, The Mapbox iOS SDK by Mapbox is an open source alternative to MapKit for Apple. It is written in Objective-C.,https://github.com/mapbox/mapbox-ios-sdk,Objective-C,Mapbox,https://www.mapbox.com/mapbox-ios-sdk/
291,ProfitBricks REST RPC API,"Storage, Backup, Cloud, Hosting",04.27.2015,https://www.programmableweb.com/sdk/profitbricks-rest-python-sdk-profitbricks, The ProfitBricks Python SDK allows for access to the ProfitBricks REST API through Python programming language. This SDK is a developer tool for Python applications and supports simple and complex requests.,,Python,ProfitBricks,https://devops.profitbricks.com/libraries/python/
292,ProfitBricks REST RPC API,"Storage, Backup, Cloud, Hosting",04.27.2015,https://www.programmableweb.com/sdk/profitbricks-rest-nodejs-sdk-profitbricks, The ProfitBricks Node.js SDK provides access to ProfitBricks REST API through the use of JavaScript. This SDK accommodates simple and complex requests and is a developer tool for building Node.js applications.,,JavaScript,ProfitBricks,https://devops.profitbricks.com/libraries/nodejs/
293,ProfitBricks REST RPC API,"Storage, Backup, Cloud, Hosting",04.27.2015,https://www.programmableweb.com/sdk/profitbricks-ruby-sdk-profitbricks," The official ProfitBricks SDK for Ruby provides a method to use Ruby programming language with ProfitBricks REST API. This SDK provides configurations for url, user,e, password, path_prefix, headers, global_classes, timeout, interval, and debug.",,Ruby,ProfitBricks,https://devops.profitbricks.com/libraries/ruby/#additional-documentation-and-support
294,WURFL REST API,Security,04.24.2015,https://www.programmableweb.com/sdk/wurfl-.net-sdk-scientiamobile, The WURFL .NET SDK is a Device Description Repository (DDR) that enables applications to map HTTP requests to a description of the capability of the mobile device that requests the page. This framework is written in .NET.,,.Net,ScientiaMobile,http://wurfl.sourceforge.net/dotnet_index.php
295,WURFL REST API,Security,04.24.2015,https://www.programmableweb.com/sdk/wurfl-java-sdk-scientiamobile," The WURFL is a Device Description Repository (DDR), or framework that enables applications to map HTTP requests to a description of the capability of the mobile device that requests the page. This framework is written in Java.",,Java,ScientiaMobile,http://wurfl.sourceforge.net/njava_index.php
296,,"Hosting, Storage",04.23.2015,https://www.programmableweb.com/sdk/aws-scala-sdk-kazuhiro-sera, This SDK provides Scala developers access to work with Amazon Web Services (AWS) in Scala and the Scala Play Framework. This SDK opens up the functionality of the AWS SDK in Scala.,https://github.com/seratch/AWScala,Scala,,http://blog.knoldus.com/2015/04/19/aws-services-aws-sdk-on-the-scala-with-play-framework/
297,,Backend,04.22.2015,https://www.programmableweb.com/sdk/kemp-technologies-python-sdk-shane-mcgough," This is a Python SDK for interfacing with LoadMaster, KEMP Technologies' load balancing API. The project is authored by Shane McGough and is in version 0.1.2.",https://pypi.python.org/pypi/python-kemptech-api/,Python,,https://pypi.python.org/pypi/python-kemptech-api/
298,Spectra Logic DS3 REST API,Storage,04.21.2015,https://www.programmableweb.com/sdk/spectra-logic-ds3-.net-sdk-spectra-logic, Use this .NET SDK to interface with Spectra Logic's DS3 API. This official SDK supports the DS3 operations for the transfer of data to tape for archival storage. See the documentation for detailed setup instructions and to access the Google Forum for Spectra Logic SDKs.,https://github.com/SpectraLogic/ds3_net_sdk,.Net,Spectra Logic,http://spectralogic.github.io/ds3_net_sdk/api/namespacemembers.html
299,Spectra Logic DS3 REST API,Storage,04.21.2015,https://www.programmableweb.com/sdk/spectra-logic-ds3-c-sdk-spectra-logic," Use this official C SDK from Spectra Logic to access their deep storage and data transfer tools. This SDK interfaces with the Spectra Logic DS3 API and has the following dependencies: libxml2, libcurl, and libglib-2.0. See the SDK documentation for setup instructions and code samples.",https://github.com/SpectraLogic/ds3_c_sdk,C,Spectra Logic,https://github.com/SpectraLogic/ds3_c_sdk
300,,Storage,04.21.2015,https://www.programmableweb.com/sdk/spectra-logic-ds3-java-sdk-spectra-logic," This is an official Java SDK provided by Spectra Logic for interfacing with their DS3 API. Use this SDK to leverage their deep storage and data transfer tools. To install, the SDK can be directly included into a Maven or Gradle build. See the SDK documentation for detailed instructions and to access the Google Forum for Spectra Logic SDKs.",https://github.com/SpectraLogic/ds3_java_sdk,Java,Spectra Logic,http://spectralogic.github.io/ds3_java_sdk/javadoc/v0.7.7/
301,Weather Underground (Wunderground) REST API,Weather,04.21.2015,https://www.programmableweb.com/sdk/wunderground-perl-sdk-john-lifesy," Use this PERL SDK to interface with the Weather Underground (Wunderground) API. The SDK will parse Wunderground's XML/JSON returns into PERL, and the response is available in Hash::AsObject form, ensuring that any data from the server is accessible. Currently at version 0.08, the PERL SDK was authored by Jason Lifesy.",https://github.com/nebulous/WWW-Wunderground-API,PERL,,https://metacpan.org/pod/WWW::Wunderground::API
302,,Messaging,04.21.2015,https://www.programmableweb.com/sdk/orange-beacon-android-sdk-orange," Orange Beacon Android SDK by Orange lets developers integrate the Orange Beacon API into their Android application, using Java.",http://www.beacon.orange.fr/sdk/android/SDK-Obeacon-Android.zip,Java,Orange,https://www.orangepartner.com/content/beacon-api
303,,Messaging,04.21.2015,https://www.programmableweb.com/sdk/orange-beacon-ios-sdk-orange," The Orange Beacon iOS SDK by Orange lets developers integrate the Orange Beacon API into their iOS application, using Objective-C.",http://www.beacon.orange.fr/sdk/ios/SDK-Obeacon-iOS.zip,Objective-C,Orange,https://www.orangepartner.com/content/beacon-api
304,,Mapping,04.21.2015,https://www.programmableweb.com/sdk/citymaps-android-sdk-citymaps, Citymaps Android SDK by Citymaps lets developers build mobile applications that enable their users to access the Citymaps Map Library for tracking various locations. This SDK uses Java.,,Java,Citymaps,http://developer.citymaps.com/WebDocs/map_engine/android/
305,,Mapping,04.21.2015,https://www.programmableweb.com/sdk/citymaps-ios-sdk-citymaps, Citymaps iOS SDK by Citymaps lets developers build mobile applications that enable their users to access the Citymaps Map Library for tracking various locations. This SDK uses Objective-C.,,Objective-C,Citymaps,http://developer.citymaps.com/WebDocs/map_engine/iOS/html/
306,"AddThis Analytics REST API, AddThis Sharing Endpoints REST API, AddThis Menu Unspecified API, AddThis Services REST API, AddThis Client REST API, AddThis Welcome Bar REST API, AddThis Content Feeds FEED API, AddThis Content Feeds REST API, AddThis Trending Content Box REST API, AddThis Trending Content Box FEED API, AddThis Sharing Button REST API, AddThis Smart Layers REST API",Tools,04.21.2015,https://www.programmableweb.com/sdk/addthis-ios-sdk-addthis," The AddThis iOS SDK by AddThis is designed to help developers integrate the AddThis APIs into their Objective-C-based iOS applications. This SDK is no longer supported, but it's still available.",,Objective-C,AddThis,http://support.addthis.com/customer/portal/articles/381270-addthis-for-ios-quick-start-guide
307,"AddThis Analytics REST API, AddThis Sharing Endpoints REST API, AddThis Menu Unspecified API, AddThis Services REST API, AddThis Client REST API, AddThis Welcome Bar REST API, AddThis Content Feeds FEED API, AddThis Content Feeds REST API, AddThis Trending Content Box REST API, AddThis Trending Content Box FEED API, AddThis Sharing Button REST API, AddThis Smart Layers REST API",Tools,04.21.2015,https://www.programmableweb.com/sdk/addthis-android-sdk-addthis, The AddThis Android SDK by AddThis is designed to help developers integrate the AddThis APIs into their Java-language Android applications.,,Java,AddThis,http://support.addthis.com/customer/portal/articles/381271-addthis-for-android-quickstart-guide
308,,"Government, Data",04.16.2015,https://www.programmableweb.com/sdk/u.s.-department-labor-swift-sdk-u.s.-department-labor," This is a SDK for accessing Federal APIs, not just Department of Labor. It is compatible with APIs from NOAA, Department of Energy, Department of Education, Department of Transportation, the EPA, and many more. Until the Swift programming language becomes more stable, this SDK is considered to be in Beta. See the API documentation for detailed instructions on getting started, including extensive code samples.",https://github.com/USDepartmentofLabor/Swift-Federal-Data-SDK,Swift,U.S. Department of Labor,http://usdepartmentoflabor.github.io/Swift-Federal-Data-SDK/
309,,"Government, Data",04.16.2015,https://www.programmableweb.com/sdk/u.s.-department-labor-php-sdk-u.s.-department-labor," Use this PHP SDK to access DOL datasets like: workplace injury and illness rates, veteran's employment statistics, employment and wages reports, consumer price indexes, geographic information, or mine accident info. The API documentation contains detailed instructions on getting started, including extensive code samples.",https://github.com/USDepartmentofLabor/PHP_DOLDataSDK,PHP,U.S. Department of Labor,http://usdepartmentoflabor.github.io/PHP_DOLDataSDK/
310,,"Government, Data",04.16.2015,https://www.programmableweb.com/sdk/u.s.-department-labor-ruby-sdk-u.s.-department-labor," Use this Ruby SDK to integrate U.S. Department of Labor datasets into your apps. After installing the required JSON Ruby Gem and retrieving the Git repository, use this SDK to access information like: workplace injury and illness rates, mine accident info, employment and wages reports, consumer price indexes, Veteran employment data, BLS numbers, and much more. The API documentation contains detailed instructions on getting started, including extensive code samples.",https://github.com/USDepartmentofLabor/Ruby_DOLDataSDK,Ruby,U.S. Department of Labor,http://usdepartmentoflabor.github.io/Ruby_DOLDataSDK/
311,,"Government, Data",04.16.2015,https://www.programmableweb.com/sdk/u.s.-department-labor-.net-sdk-u.s.-department-labor," This .NET SDK eases access to U.S. Department of Labor datasets. Employ this SDK to utilize datasets like: workplace injury and illness rates, mine accident info, employment and wages reports, consumer price indexes, Veteran employment data, BLS numbers, and much more. See the API documentation for detailed instructions on how to get started and extensive code samples.",https://github.com/USDepartmentofLabor/DotNet_DOLDataSDK,.Net,U.S. Department of Labor,http://usdepartmentoflabor.github.io/DotNet_DOLDataSDK/
312,,"Government, Data, Data-as-a-Service",04.16.2015,https://www.programmableweb.com/sdk/u.s.-department-labor-ios-sdk-u.s.-department-labor," Use this Objective-C SDK to access U.S. Department of Labor data for integration into iOS apps. Access datasets like: workplace injury and illness rates, mine accident info, employment and wages reports, consumer price indexes, geographic information (states, counties, and congressional districts), and much more. See the API documentation for detailed instructions on how to get started and extensive code samples.",https://github.com/USDepartmentofLabor/DOLDataSDK-iOS,Objective-C,U.S. Department of Labor,http://usdepartmentoflabor.github.io/DOLDataSDK-iOS/
313,Riskified REST API,"eCommerce, Crime, Security",04.16.2015,https://www.programmableweb.com/sdk/riskified-php-sdk-riskified, The Riskified PHP SDK by Riskified allows developers to integrate the Riskified API's methods into their PHP applications and services.,,PHP,Riskified,https://github.com/Riskified/php_sdk
314,Riskified REST API,"eCommerce, Crime, Security",04.16.2015,https://www.programmableweb.com/sdk/riskified-.net-sdk-riskified, The Riskified .NET SDK by Riskified is a C# implementation of the Riskified API that developers can use in their .NET applications.,,".Net, C#",Riskified,https://github.com/Riskified/sdk_net
315,Riskified REST API,"eCommerce, Crime, Security",04.16.2015,https://www.programmableweb.com/sdk/riskified-java-sdk-riskified, The Riskified Java SDK by Riskified allows developers to integrate the Riskified API's methods into their Java applications. This SDK requires Java JDK-1.5 or higher.,,Java,Riskified,https://github.com/Riskified/java_sdk
316,,"Government, Data, Data-as-a-Service",04.15.2015,https://www.programmableweb.com/sdk/u.s.-department-labor-android-sdk-u.s.-department-labor," Use this Java SDK to access U.S. Department of Labor data for integration into Android apps. Access datasets like: workplace injury and illness rates, mine accident info, employment and wages reports, consumer price indexes, geographic information (states, counties, and congressional districts), and much more. See the API documentation for detailed instructions on how to get started and extensive code samples.",https://github.com/USDepartmentofLabor/Android_DOLDataSDK,Java,U.S. Department of Labor,http://usdepartmentoflabor.github.io/Android_DOLDataSDK/
317,Google Cloud Translation REST API v3.0,"Translation, Cloud, Language",04.15.2015,https://www.programmableweb.com/sdk/google-translate-node.js-sdk-mike-holly," Use this Node SDK to interface with the Google Translate API. SDK dependencies include: underscore (JavaScript programming helper library), querystring (Node.js querying module), and request (HTTP request client).",https://github.com/mikejholly/node-google-translate,Node.js,Independent Developer,https://github.com/mikejholly/node-google-translate/blob/master/LICENSE
318,Callfire Unspecified API,Messaging,04.15.2015,https://www.programmableweb.com/sdk/callfire-c-sdk-callfire," CallFire C# SDK by CallFire provides developers a way to integrate their applications and websites to the CallFire services, enabling users to communicate with their customers via text and telephoning. This SDK is written using C#.",,C#,CallFire,https://github.com/CallFire/CallFire-CSharp-SDK
319,Callfire Unspecified API,Messaging,04.15.2015,https://www.programmableweb.com/sdk/callfire-php-sdk-callfire," CallFire PHP SDK by CallFire provides developers a way to integrate their applications and websites to the CallFire services, enabling users to communicate with their customers via text and telephoning. This SDK is written using PHP.",,PHP,CallFire,https://github.com/CallFire/CallFire-PHP-SDK
320,Serials Solutions Summon Search REST API,Data,04.15.2015,https://www.programmableweb.com/sdk/serials-solutions-summon-php-library-serials-solutions, The Serials Solutions Summon PHP Library by Serials Solutions provides developers a way for integrating their applications with the Serial Solutions Summon APIs. This library is written in PHP.,,PHP,Serials Solutions,https://github.com/summon/summon.php
321,Sauce Labs REST API v1.1,Testing,04.14.2015,https://www.programmableweb.com/sdk/sauce-labs-c-sdk-sauce-labs, The Sauce Labs C SDK provides automated application testing. The SDK is written in C.,,C,Sauce Labs,https://docs.saucelabs.com/tutorials/c/
