,Related APIs,Category,Submitted,Meta_Url,Description,Repository,Languages,Provider,Asset URL
0,Respoke REST API,"WebRTC, Real Time, Telephony",06.22.2015,https://www.programmableweb.com/sdk/respoke-javascript-library-respoke," The Respoke JavaScript library by Respoke is available to download from the official documentation site. Contains lines of code for installation and connection to Respoke. This library aims to interact with the REST API features of video calling, real-time chat, and screen sharing.",https://docs.respoke.io/client/javascript/getting-started.html,JavaScript,Respoke,https://docs.respoke.io/
1,Respoke REST API,"WebRTC, Real Time, Telephony",06.22.2015,https://www.programmableweb.com/sdk/respoke-android-sdk-respoke," The Respoke Android SDK by Respoke offers straightforward resources to integrate voice, video, and text features into applications. The aim is to improve real time communication for client satisfaction. Available installation with a link to download the JAR file, test cases with seven steps to follow, and web test bot with endpoint ID to either load an HTML file from Chrome or run in a local server. Jason Adams is the developer who recently authored on GitHub.",https://github.com/respoke/respoke-sdk-android,Java,Respoke,https://docs.respoke.io/client/android/getting-started.html
2,Respoke REST API,"WebRTC, Real Time, Telephony",06.22.2015,https://www.programmableweb.com/sdk/respoke-ios-sdk-respoke," With Respoke, users can integrate applications with audio, video, and chat features. This SDK for iOS has the main goal to make development easier considering real time communications capabilities in mobile devices. Contains documents, installation, and test cases. Respoke is on GitHub at https://github.com/respoke/",http://cocoadocs.org/docsets/RespokeSDK/1.0.2/,Objective-C,Respoke,https://docs.respoke.io/
3,ClickSend SMS REST API,"Business, Email, Messaging, Voice",06.19.2015,https://www.programmableweb.com/sdk/clicksend-java-sdk-clicksend," The ClickSend Java SDK allows developers to integrate SMS services into applications. With this kit, they can send, receive, and track SMS. Opportunities include meeting reminders, client alerts, and business notifications. In addition, ClickSend offers SMS API, online SMS, Email to SMS, Outlook SMS, Bulk SMS, and SMS keywords.",http://developers.clicksend.com/sdk/java/,Java,ClickSend,http://developers.clicksend.com/sdk/
4,ClickSend SMS REST API,"Business, Email, Messaging, Voice",06.18.2015,https://www.programmableweb.com/sdk/clicksend-perl-clicksend," ClickSend, the cloud-based SMS service offers an SDK in PERL language to integrate with the SMS API functionalities. Requirements include internet connection and a ClickSend account. No installation is needed. With ClickSend, users could benefit from custom integration, Microsoft Outlook SMS, and online SMS.",http://developers.clicksend.com/sdk/perl/,PERL,ClickSend,http://developers.clicksend.com/sdk/
5,ClickSend SMS REST API,"Business, Email, Messaging, Voice",06.18.2015,https://www.programmableweb.com/sdk/clicksend-vb-sdk-clicksend," The Clicksend VB SDK is available to download for users with internet connection and a ClickSend account. Applications, websites, and sofware that intend to enhance business practices with SMS services, can offer online SMS, bulk SMS marketing, and SMS keywords.",http://developers.clicksend.com/sdk/vbnet/,Visual Basic,ClickSend,http://developers.clicksend.com/sdk/
6,ClickSend SMS REST API,"Business, Email, Messaging, Voice",06.18.2015,https://www.programmableweb.com/sdk/clicksend-c-sdk-clicksend-0," ClickSend provides cloud-based messaging tools for business services. Options include delivery notifications, meeting reminders, and follow-up alerts. The API allows to integrate the SMS capabilities into applications, websites, and software. Developers now have access to this SDK in C++ available to download from the official site. Registration required.",http://developers.clicksend.com/sdk/cplus/,C++,ClickSend,http://developers.clicksend.com/sdk/
7,ClickSend SMS REST API,"Business, Email, Messaging, Voice",06.18.2015,https://www.programmableweb.com/sdk/clicksend-c-sdk-clicksend," The ClickSend SDK in CSharp is available to use the HTTP API with the goal to integrate SMS messaging into websites and applications. With this service, users can send SMS, receive SMS, and track the status of messages. Useful to follow-up, notify clients, and create reminders.",http://developers.clicksend.com/sdk/csharp/,C#,ClickSend,http://developers.clicksend.com/sdk/
8,ClickSend SMS REST API,"Business, Email, Messaging, Voice",06.18.2015,https://www.programmableweb.com/sdk/clicksend-php-sdk-clicksend," ClickSend aims to improve business communications with the use of messages, e-mails, and voice systems. The goal of the PHP SDK is to ease the integration of SMS messaging into desktop and mobile applications. The requirements for developers include PHP 5.0, CURL enabled, and a ClickSend account.",http://developers.clicksend.com/sdk/php/,PHP,ClickSend,http://developers.clicksend.com/sdk/
9,500px REST API v1,"Photos, Community, Images",06.18.2015,https://www.programmableweb.com/sdk/500px-javascript-sdk-tye-shavik," The 500px JavaScript SDK by Tye Shavik affords the use of the API through browser-side. Available demo and demo source. Additional resources include how to configure callback, how to initialize SDK, how to make API calls, how to work with the response object, and how to subscribe to events.",,JavaScript,Independent Developer,https://github.com/500px/500px-js-sdk
10,US Census Bureau REST API,"Cities, Demographics, Statistics, USA",06.18.2015,https://www.programmableweb.com/sdk/census-city-sdk-us-census-bureau," The CensusCity SDK provides data to work in projects related to population, income, and any other Census data. It has been designed with modularity in mind to interact with Census Bureau APIs, Energy Information Agency, USDA Farmer's Market directory, and Socrata. Community modules include ArcGIS and U.S. Housing and Urban Development. Get started at http://uscensusbureau.github.io/citysdk/gettingstarted.html",https://github.com/uscensusbureau/citysdk,JavaScript,US Census Bureau,http://uscensusbureau.github.io/citysdk/
11,Zendesk Core REST API,"Business, Webhooks",06.17.2015,https://www.programmableweb.com/sdk/zendesk-perl-sdk-robin-clarke," Use this unofficial PERL SDK to interface with the Zendesk API. Zendesk provides voice, help desk, and chat tools for business communication. Developers should note that this tool is still in development (Alpha) and changes are to be expected.",https://github.com/robin13/API-Zendesk,PERL,Independent Developer,https://metacpan.org/release/API-Zendesk
12,Tumblr REST API v2.0,"Social, Blogging, Content, Media",06.17.2015,https://www.programmableweb.com/sdk/tumblr-ios-sdk-tumblr," The Tumblr iOS SDK by Bryan Irace, developer at Tumblr, aims to be an unopinionated library to integrate data into mobile iOS and desktop OS X applications. It requires iOS 5 and OS X 10.7. Contents include CocoaPods, documentation, authentication, API client, inter-app communication, UI features, and example.",https://github.com/tumblr/TMTumblrSDK,Objective-C,Tumblr,http://tumblr.github.io/TMTumblrSDK/
13,Tumblr REST API v2.0,"Social, Blogging, Content, Media",06.17.2015,https://www.programmableweb.com/sdk/tumblr-php-sdk-tumblr," Tumblr allows bloggers to post multimedia content. From photos, GIFs, and TV shows to jokes, Spotify tracks, and videos. The official library available in PHP allows interaction with the API, which can read Tumblr data to write a Tumblr post.",https://github.com/tumblr/tumblr.php,PHP,Tumblr,http://developers.tumblr.com/clients
14,TomTom WEBFLEET.connect REST API v1.39.0,"Business, Mobile, Monitoring, Software-as-a-Service",06.17.2015,https://www.programmableweb.com/sdk/tomtom-webfleet-pro.connect-sdk-tomtom," TomTom WEBFLEET.connect aims to facilitate the tracking of fleet vehicles. With the API, developers can access reporting data associated with job dispatch and transportation management. The file proconnectsdk-docs.zip contains the pertinent information to work with orders, text messages, and custom data.",,JavaScript,TomTom,http://business.tomtom.com/en_us/fleet-management/integration/resources/
15,Exact Online REST API,"Accounting, Business, Enterprise, Software-as-a-Service",06.17.2015,https://www.programmableweb.com/sdk/exact-online-c-sdk-exact-online," The official Exact Online SDK written in C# language allows to interact with the capacities of the API, which include budget, payroll, and financial documents. This project includes reference libraries, OAuth, initialize exact client, insert record and lines of code to retrieve, update, and delete data. Authored on GitHub by asimnazir",,C#,Exact,https://github.com/exactonline/ClientSDK
16,Optimizely REST API,"Web Site Management, Testing",06.17.2015,https://www.programmableweb.com/sdk/optimizely-android-sdk-optimizely, The Optimizely Android SDK by Optimizely allows developers to integrate the Optimizely API into their Android applications that have been written in Java.,,Java,Optimizely,http://developers.optimizely.com/android/introduction/index.html
17,Optimizely REST API,"Web Site Management, Testing",06.17.2015,https://www.programmableweb.com/sdk/optimizely-ios-sdk-optimizely, The Optimizely iOS SDK by Optimizely allows developers to integrate the Optimizely API into their iOS applications that have been written in Objective-C.,,Objective-C,Optimizely,http://developers.optimizely.com/ios/introduction/
18,Google Enterprise License Manager REST API,"Management, Applications, Domains",06.16.2015,https://www.programmableweb.com/sdk/google-admin-sdk-google," With the Google Admin SDK, users can administer domain resources, create reports, and manage subscriptions. APIs related include Directory API, Reports API, Enterprise License Manager API, and Reseller API. The possibilities invite to think in the interaction with admin settings, calendar resources, and domain shared contacts.",,"Java, PHP, Python",Google,https://developers.google.com/admin-sdk/
19,Exact Online REST API,"Accounting, Business, Enterprise, Software-as-a-Service",06.16.2015,https://www.programmableweb.com/sdk/exact-online-ios-sdk-andrew-kopanev," The Exact Online iOS SDK developed by Andrew Kopanev aims to facilitate the creation of Apple apps with Exact Online API data. Features include authorization/token refreshing and REST API access. Additional official APIs include support for XML and CSV formats. This project does not require CocoaPods, but uses AFNetworking and AFOAuth2Manager, both available as links on the site. Exact Online is a business software that can work with QuickBooks, an accounting solution service.",,Objective-C,Independent Developer,https://github.com/moqod/Exact-Online-iOS-SDK
20,Gmail REST API,"Email, Accounts, Social, Storage",06.16.2015,https://www.programmableweb.com/sdk/gmail-java-library-google," Gmail, the web-based email service owned by Google, offers a library in Java language for Android development. The overview contains how to create and send e-mail, how to manage mailboxes, how to authorize API requests, and how to migrate from a previous API. Best practices guide users through batch requests and performance tips.",https://developers.google.com/api-client-library/java/,Java,Google,https://developers.google.com/gmail/api/downloads
21,7digital REST API,"Music, Audio, Streaming",06.16.2015,https://www.programmableweb.com/sdk/7digital-ios-sdk-7digital, The 7digital iOS SDK by 7digital allows developers to integrate the 7digital API's ability to download and stream music into their own Objective-C-language iOS applications. This SDK requires iOS 7.0+ and the libxml2 library.,,Objective-C,7digital,https://github.com/7digital/7digital-iOS-SDK
22,7digital REST API,"Music, Audio, Streaming",06.16.2015,https://www.programmableweb.com/sdk/7digital-android-sdk-7digital," The 7digital Android SDK by 7digital allows developers to integrate the 7digital API's preview streams, music charts, music metadata, search, and purchasing into their Java-language Android applications.",,Java,7digital,https://github.com/7digital/7digital-Android-SDK
23,Google Cloud Print REST API,"Cloud, Hosting, Printing, Storage",06.15.2015,https://www.programmableweb.com/sdk/google-cloud-print-ios-sdk-conrad-kramer," Google Cloud Print iOS SDK by Conrad Kramer. It can integrates Google Cloud Print into Apple's AirPrint feature. This work uses AFIncrementalStore, AFOAuth2Client, and AFNetworking to communicate with the Cloud Print API, as mentioned by the author. Additional resources include prerequisites, how to build, and how to install.",,Objective-C,Independent Developer,https://github.com/conradev/GoogleCloudPrint
24,Google Cloud Print REST API,"Cloud, Hosting, Storage",06.15.2015,https://www.programmableweb.com/sdk/google-cloud-sql-sdk-google," The Google Cloud SQL SDK by Google is a resource to create projects on Google Cloud Platform, counting App Engine, Compute Engine, Cloud Storage, BigQuery, Cloud SQL, and Cloud DNS. The SDK works with Windows, Mac, and Linux. Requires Python 2.7.x. and in some cases (like in App Engine), Java 1.7+",,SQL,Google,https://cloud.google.com/sdk/gcloud/
25,Beats Music REST API,"Music, Audio, Streaming",06.14.2015,https://www.programmableweb.com/sdk/beats-music-java-sdk-dan-sabin," The Beats Music Java SDK is one of the resources available inside the Beats Music developer's site. It redirects to a GitHub repository created by Dan Sabin. Having Android development in mind, users can consider the functionalities of the API that include to access data of music catalogs, music playlists, and music tracks. The API requires Key to authenticate and it is protected with SSL.",https://github.com/whitneyimura/Beats-Sdk,Java,Independent Developer,https://developer.beatsmusic.com/docs/read/libraries/Third_Party_Libraries
26,,"Transportation, Location, Mobile, Travel",06.14.2015,https://www.programmableweb.com/sdk/uber-java-sdk-apimatic," This project is an SDK for Uber, the international transportation network, created by the company Apimatic in New Zealand. Resources include instructions to configure, build, and use the elements provided in Java language with the aim to construct Android applications. To work with this content, developers need to download Eclipse and export JARs files. For more information, contact zeeshan@apimatic.io",,Java,APIMATIC,https://github.com/apimatic/uber-java
27,,"Transportation, Location, Mobile, Travel",06.14.2015,https://www.programmableweb.com/sdk/uber-ios-sdk-tom-jowett," Uber is a service that connects users to drivers through a mobile application. What developers can do with the Uber API is to access data related to available car types, estimated prices, and geo-location services. In this case, the Uber iOS SDK created by tomj uses the Mantle framework for JSON, along with AFNetworking. The project aims to be useful to build applications with iPhone iOS 6. For more information, contact author Tom Jowett @tjrebase",,Objective-C,Independent Developer,https://github.com/tomj/Aubergine
28,E*TRADE REST API v1.0,"Financial, Business, International, Stocks",06.11.2015,https://www.programmableweb.com/sdk/etrade-c-sdk-etrade," The E*TRADE C++ SDK is an additional tool that helps to build trade applications directly through E*TRADE without installing additional software components. The section of news and the developers forum could be useful for programmers who want to learn with others before partnering with E*TRADE. With the developer platform, users can integrate portfolio data, market information, and trade execution.",,C++,ETrade,https://developer.etrade.com/ctnt/dev-portal/getContent?contentUri=Downloads-DocumentationSDKDownloads
29,E*TRADE REST API v1.0,"Financial, Business, International, Stocks",06.11.2015,https://www.programmableweb.com/sdk/etrade-php-sdk-etrade-0," The E*TRADE PHP SDK is available to download from the developer platform site. Beginners and advanced developers could build their own trading application to analyze market data in real time. Resources include documentation, code examples, and developer support.",,PHP,ETrade,https://developer.etrade.com/ctnt/dev-portal/getContent?contentUri=Downloads-DocumentationSDKDownloads
30,E*TRADE REST API v1.0,"Financial, Business, International, Stocks",06.11.2015,https://www.programmableweb.com/sdk/etrade-java-sdk-etrade-0," E*TRADE offers investment, retirement, and small business services for national and international markets. The Java SDK is available to download and the last update was made in 2014. The Java SDK also contains a tutorial to develop applications to leverage market data offerings and order routing capabilities. According to the site, the guide targets seasoned and novice programmers due to the clarity of the examples.",,Java,ETrade,https://developer.etrade.com/ctnt/dev-portal/getContent?contentUri=Downloads-DocumentationSDKDownloads
31,"Best Buy Products REST API, Best Buy Commerce REST API","eCommerce, Products, Search",06.11.2015,https://www.programmableweb.com/sdk/best-buy-products-php-sdk-waqar-alamgir," The Best Buy Products PHP SDK is a project to access Best Buy Products API and Best Buy Commerce API. It requires CURL, JSON, and open SSL. To use, developers can include the wrapper class MyBestBuy and create an instance calling methods. Users are invited to extend the methods. For more information, contact developer Waqar Alamgir waqarcs@yahoo.com",,PHP,Independent Developer,https://github.com/waqar-alamgir/best-buy-php-sdk
32,Walmart Open REST API,"eCommerce, Business, Supply Chain",06.10.2015,https://www.programmableweb.com/sdk/walmart-c-sdk-walmart," With Walmart Open API, developers can design applications related to e-commerce with supply chain in mind. The official Walmart C# SDK was created by WalmartLabs and Jeremy Frederick to work in .NET environments. A GitHub link provides a code example and a NuGet file package for the project.",https://github.com/NextGenWebStudios/Walmart-SDK.NET,C#,Walmart,https://developer.walmartlabs.com/forum/read/185049
33,Google Analytics Managment REST API,"Analytics, Management",06.10.2015,https://www.programmableweb.com/sdk/google-analytics-java-sdk-google," The Google Analytics SDK for Android is available to download. The site contains implementation guides to get started, initialize trackers, create XML file, and send an event. Additional resources in the web tabs relate to parameters, example apps such as 'Hello World' &amp; 'Cute Pets' and forum support.",,Java,Google,https://developers.google.com/analytics/devguides/collection/android/v4/
34,DataDog REST API,Data,06.10.2015,https://www.programmableweb.com/sdk/datadog-elixir-sdk-adam-kittelson, The DataDog Elixir SDK by Adam Kittelson is a Dogdata statsd client implementation for Elixir.,https://github.com/adamkittelson/dogstatsd-elixir,Elixir,Independent Developer,http://docs.datadoghq.com/libraries/#community-elixir
35,DataDog REST API,Data,06.10.2015,https://www.programmableweb.com/sdk/datadog-elixir-sdk-cargosense, The DataDog Elixir SDK by CargoSense is a Dogdata statsd client implementation for Elixir.,https://github.com/CargoSense/ex_statsd,Elixir,CargoSense,http://docs.datadoghq.com/libraries/#community-elixir
36,DataDog REST API,Data,06.10.2015,https://www.programmableweb.com/sdk/datadog-scala-sdk-cory-g-watson, The DataDog Scala SDK by Cory G Watson is a Scala library for interacting with the Datadog API.,https://github.com/gphat/datadog-scala,Scala,Independent Developer,http://docs.datadoghq.com/libraries/#community-scala
37,DataDog REST API,Data,06.10.2015,https://www.programmableweb.com/sdk/datadog-python-sdk-tommaso-barbugli," The DataDog Python SDK by Tommaso Barbugli is a scales pusher to send data to datadog, written in Python.",https://github.com/tbarbugli/scales_datadog,Python,Independent Developer,http://docs.datadoghq.com/libraries/#community-python
38,DataDog REST API,Data,06.10.2015,https://www.programmableweb.com/sdk/datadog-go-sdk-pagerduty, The DataDog Go SDK by PagerDuty is a statsd client for the Datadog extension of DogStatsd.,https://github.com/PagerDuty/godspeed,Go,PagerDuty,http://docs.datadoghq.com/libraries/#community-go
39,DataDog REST API,Data,06.10.2015,https://www.programmableweb.com/sdk/datadog-go-sdk-ooyala, The DataDog Go SDK by Ooyala provides a Go DogStatsD client for the Datadog API.,https://github.com/ooyala/go-dogstatsd/,Go,Independent Developer,http://docs.datadoghq.com/libraries/#community-go
40,DataDog REST API,Data,06.10.2015,https://www.programmableweb.com/sdk/datadog-go-sdk-mark-smith, The DataDog Go SDK by Mark Smith is a Go implementation of the Datadog API.,https://github.com/xb95/go-datadog-api,Go,Independent Developer,http://docs.datadoghq.com/libraries/#community-go
41,DataDog REST API,Data,06.10.2015,https://www.programmableweb.com/sdk/datadog-php-sdk-isra-v, DataDog PHP SDK by Isra V is a set of PHP scripts that can send some metrics from the developer's Plesk server (whether it's localhost or a remote server) to their Datadog dashboards.,https://github.com/isra00/plesk_datadog_metrics,PHP,Independent Developer,https://github.com/DataDog/php-datadogstatsd
42,DataDog REST API,Data,06.10.2015,https://www.programmableweb.com/sdk/datadog-php-sdk-alex-corley," The DataDog PHP SDK by Alex Corley is a client for Datadogstatsd, written in PHP.",https://github.com/DataDog/php-datadogstatsd,PHP,Independent Developer,http://docs.datadoghq.com/libraries/#community-php
43,DataDog REST API,Data,06.10.2015,https://www.programmableweb.com/sdk/datadog-ruby-sdk-yuu-yamashita," The DataDog Ruby SDK by Yuu Yamashita is a command-line tool for Datadog, written in Ruby.",https://github.com/yyuu/hotdog,Ruby,Independent Developer,http://docs.datadoghq.com/libraries/#community-ruby
44,DataDog REST API,Data,06.10.2015,https://www.programmableweb.com/sdk/datadog-ruby-sdk-andrew-cantino, The DataDog Ruby SDK by Andrew Cantino is used with the metriks gem to enable reporting metriks statistics to DogStatsd.,https://github.com/cantino/metriks-dogstatsd,Ruby,Independent Developer,http://docs.datadoghq.com/libraries/#community-ruby
45,DataDog REST API,Data,06.10.2015,https://www.programmableweb.com/sdk/datadog-perl-sdk-stefan-goethals, The DataDog Perl SDK by Stefan Goethals is a perl client for DogStatsd.,https://github.com/zipkid/dogstatsd-perl,PERL,Independent Developer,http://docs.datadoghq.com/libraries/#community-perl
46,DataDog REST API,Data,06.10.2015,https://www.programmableweb.com/sdk/datadog-perl-sdk-jennifer-pinkham," The DataDog Perl SDK by Jennifer Pinkham allows developers to interact with DataDog, using Perl.",https://github.com/jpinkham/webservice-datadog,PERL,Independent Developer,http://docs.datadoghq.com/libraries/#community-perl
47,DataDog REST API,Data,06.10.2015,https://www.programmableweb.com/sdk/datadog-node.js-sdk-daniel-bader, The DataDog Node.js SDK by Daniel Bader lets developers collect application metrics through DataDog's HTTP API.,https://github.com/dbader/node-datadog-metrics,Node.js,Independent Developer,https://www.npmjs.com/package/datadog-metrics
48,DataDog REST API,Data,06.10.2015,https://www.programmableweb.com/sdk/datadog-node.js-sdk-brett-langdon," The DataDog Node.js SDK by Brett Langdon is used to interact with the Datadog API, written in node.",https://github.com/brettlangdon/node-dogapi,Node.js,Independent Developer,http://docs.datadoghq.com/libraries/#community-node
49,DataDog REST API,Data,06.10.2015,https://www.programmableweb.com/sdk/datadog-node.js-sdk-young-han-lee, The DataDog Node.js SDK by Young Han Lee is an extension of general StatsD client to work with StatsD server.,https://github.com/joybro/node-dogstatsd,Node.js,Independent Developer,http://docs.datadoghq.com/libraries/#community-node
50,DataDog REST API,Data,06.10.2015,https://www.programmableweb.com/sdk/datadog-node.js-sdk-hashgo, The DataDog Node.js SDK by HashGo is a node module for interacting with the DataDog API,https://github.com/HashGo/node-datadog,Node.js,HashGo,http://docs.datadoghq.com/libraries/#community-node
51,DataDog REST API,Data,06.10.2015,https://www.programmableweb.com/sdk/datadog-java-sdk-arnab-karmakar, The DataDog Java SDK by Arnab Karmakar allows developers to communicate their Java applications with statsd.,https://github.com/arnabk/java-dogstatsd-client,Java,Independent Developer,http://docs.datadoghq.com/libraries/#community-java
52,DataDog REST API,Data,06.10.2015,https://www.programmableweb.com/sdk/datadog-java-sdk-bazaarvoice," The DataDog Java SDK by Bazaarvoice provides developers the ability to create, update, and remove screenboards, as well as the ability to fetch the specific id and embed code for specific screenboards.",https://github.com/bazaarvoice/lassie,Java,Bazaarvoice,http://docs.datadoghq.com/libraries/#community-java
53,DataDog REST API,Data,06.10.2015,https://www.programmableweb.com/sdk/datadog-java-sdk-coursera," The DataDog Java SDK by Coursera is a metrics reporter that sends reporting info to Datadog, supports both HTTP and UDP.",https://github.com/coursera/metrics-datadog,Java,Coursera,http://docs.datadoghq.com/libraries/#community-java
54,DataDog REST API,Data,06.10.2015,https://www.programmableweb.com/sdk/datadog-java-sdk-indeed, The DataDog Java SDK by Indeed lets developers communicate their java applications with statsd.,https://github.com/indeedeng/java-dogstatsd-client,Java,Indeed,http://docs.datadoghq.com/libraries/#community-java
55,DataDog REST API,Data,06.10.2015,https://www.programmableweb.com/sdk/datadog-c-sdk-datadog, The DataDog C# SDK by DataDog is an extension of the StatsD metric server for Datadog. It is written in C#.,https://github.com/DataDog/dogstatsd-csharp-client,C#,Datadog,http://docs.datadoghq.com/libraries/#c-sharp
